date,author,subreddit,score,url,text
2020-04-19,HuzzahPowerBang,television,3,https://www.reddit.com/r/television/comments/g4h9c6/gosh_30_rock_is_just_brilliant/fnxn2qr/,"Here's the Coronavirus episode summary from Tina Fey:

Tracy has already contracted and survived the virus (“My snakes eat bats and then I use my snakes to practice French kissing, so it was inevitable, Liz Lemon!”), so he would declare himself an immune “green person” and set out to help. (Tracy: “Like Mister Rogers said, ‘Look like the helpers.’”) So, dressed as a firefighter, he would volunteer his time delivering illegal box jellyfish to the elderly.

Jack would try to get Liz to go to the secret GE island off the coast of Connecticut: “It will just be the top executives, any wives under 40, and yes, Lauer will be there, but only because it was built into his deal years ago.” Liz refuses to go because of her desire to be egalitarian but also because everyone would probably be barefoot. Pass. She would shelter in place like nobody’s business and still somehow dodge sex with James Marsden.

Kenneth would be the most prepared, having grown up Eighth Day Resurrected Covenant of the Holy Trinity and observing its End of Days Countdown Calendar, which is different from most calendars. “For example, we’ve only had Christmas twice, but Easter is every four hours.” Jack would offer to buy Kenneth’s cupboard of canned chickpeas for a million dollars, but Kenneth would just give him two cans for free. “Hoarding is a sin, sir! Just like skateboarding or riding a horse you’re not related to!” —Tina Fey and Sam Means

Sauce: https://www.vulture.com/2020/04/if-i-wrote-a-coronavirus-episode.html"
2020-04-19,MissAustralianBi,HistoryMemes,3,https://www.reddit.com/r/HistoryMemes/comments/g4dhv0/belfast/fnxnrtm/,"The IRA wear masks to prevent coronavirus spread. Be like the IRA

inb4 I get banned, yeah, I know they're terrorists, no don't carbomb people"
2020-04-19,Turbosauce1,Coronavirus,3,https://www.reddit.com/r/Coronavirus/comments/g47edo/1_in_1000_new_york_city_residents_have_now_died/fnwj28r/,You’re [wrong](https://www.foxnews.com/sports/olympic-swimmer-describes-battle-with-coronavirus-worst-ive-ever-endured)
2020-04-19,redyellowblue5031,bestof,3,https://www.reddit.com/r/bestof/comments/g4bc0g/udr_midnight_finds_vast_network_of_antiquarantine/fnwiyuy/,"That doesn't really surprise me. I know of someone in Pennsylvania who just lost a lawsuit against the governor over the COVID lockdown measures.

See [here](http://www.pacourts.us/assets/opinions/Supreme/out/68MM2020mo%20-%2010439399799476700.pdf?cb=1)  and [here](https://www.pennlive.com/news/2020/04/split-pa-supreme-court-rejects-latest-challenge-to-gov-wolfs-coronavirus-business-shutdown-order.html)"
2020-04-19,ClintonWeathershed,WhitePeopleTwitter,3,https://www.reddit.com/r/WhitePeopleTwitter/comments/g4c89n/imagine_if_he_actually_helped/fnwjumu/,"What's True

During a Feb. 28, 2020, campaign rally in South Carolina, President Donald Trump likened the Democrats' criticism of his administration's response to the new coronavirus outbreak to their efforts to impeach him, saying ""this is their new hoax."" During the speech he also seemed to downplay the severity of the outbreak, comparing it to the common flu.

What's False

Despite creating some confusion with his remarks, Trump did not call the coronavirus itself a hoax."
2020-04-19,tansub,ChapoTrapHouse,3,https://www.reddit.com/r/ChapoTrapHouse/comments/g471ez/vietnam_appreciation_thread/fnwl6c2/,"Vietnam is definitely a mixed socialist market economy. They have adopted market reforms in the late 1980s called the ""doi moi reforms"". But Vietnam still follows 5 years and 10 years plans. There is a plan for 2020-2025 and another plan for 2020-2030. 

I worked in an embassy in Vietnam in 2019 (even got to see Vietnam Premier Nguyen Xuan Phuc) and I was invited to the Vietnam Reform and Development Forum, essentially a meeting where the Vietnamese leadership explains their economic plans to the world. The Prime Minister explained that for the next 10 years Vietnam wants to improve its institutional system, develop the infrastructure network and promote human resources. He also mentioned the importance of investing in human resources, mainly in education. 

He said that Vietnam wants to develop a dynamic and creative private sector. This definitely shows the capitalist turn that he Vietnamese communist party has taken. There was not any talk about how Vietnam was striving towards a communist society though, and many speakers were from the World Bank. 

At the end he explained that he wanted to invest in sustainable development but right after that he said he Vietnam was going to build a new mega airport next to Saigon (seems a bit contradictory). 

In Vietnam I would say people tend to listen more to their government than in the State, there protests against coronavirus lockdown is just unthinkable. Since Vietnam isn't as rich as say South Korea and Taiwan they didn't test massively but instead they have very strict quarantine measures, practically house arrest if you are suspected of having the virus. It's draconian but it seems to work, no one has died of the covid so far.

So Vietnam's response to the coronavirus crisis is not related to its healthcare system and more to the power that the government has over its people. Vietnam's healthcare system is pretty decent though, they are working towards universal healthcare and healthcare is free if you're poor. They also have good infrastructure especially in Hanoi and Saigon. I would rather be sick in Vietnam than in the States."
2020-04-19,bandaidsplus,canadaleft,3,https://www.reddit.com/r/canadaleft/comments/g4ap3t/get_ready_for_a_solid_generation_of_liberal_party/fnwo1wl/,"liberals can hold that coronavirus approval rating just fine, but let see how happy the people are gonna be when the decadely global recession sets in."
2020-04-19,Lumiosa,rpdrcringe,3,https://www.reddit.com/r/rpdrcringe/comments/g4atfh/if_u_r_queer_and_not_creating_something_then_u_r/fnwoq3a/,Oh wow I’ll go tell my gay boyfriend who’s a doctor fighting coronavirus that his life’s work is a waste and to go start an Etsy account to sell shitty screen caps of Violet’s porn. #ART Mawma
2020-04-19,Nostbrodamus,moderatepolitics,3,https://www.reddit.com/r/moderatepolitics/comments/g4cgzx/covid19_infection_fatality_rate_estimate_of_01036/fnwnq4k/,"Even mishandled, the United States is doing better than Europe. 

https://www.theguardian.com/world/live/2020/apr/19/coronavirus-live-news-europe-deaths-approach-100000-as-us-looks-to-lift-restrictions"
2020-04-19,Bwenj,ChapoTrapHouse,3,https://www.reddit.com/r/ChapoTrapHouse/comments/g4dudk/me_and_the_boys_on_the_way_to_milwaukee_circa/fnwtamp/,they'll use coronavirus to not hold a physical convention so nobody protests :)
2020-04-19,pichipichipoco,TikTokCringe,3,https://www.reddit.com/r/TikTokCringe/comments/g4c162/nobody_knew_there_would_be_a_pandemic_or_an/fnwvdnx/,"1. [Atleast get your facts straight before you try to call someone out](https://couriernewsroom.com/2020/04/14/obama-prepared-for-a-potential-pandemic-trump-gutted-his-work/). 

2. [You know what's even crazier? Evidence of his administration's work in preparing for a pandemic has been widely publicized of late, so it's not even like it's obscure info.](https://www.snopes.com/fact-check/obama-pandemic-preparedness-2014/)

3. [The Obama Administration has a lot of skeletons in the closet, but not attempting to prepare for a pandemic isn't one of them](https://www.independent.co.uk/news/world/americas/obama-ebola-coronavirus-trump-congress-tea-party-a9469186.html)."
2020-04-19,thedjmk,PublicFreakout,3,https://www.reddit.com/r/PublicFreakout/comments/g490ka/antiquarantine_protestor_leaves_car_in_drive_in/fnwz6a7/,"Yeah, that's not banning seed sales. My link details the same thing. 

It requires non-essential areas to be closed in businesses, because Home Depot needs to be open, but only in part. You NEED to be able to buy toilets and tools. You don't need to buy flowers.

Closing off garden centers and nurseries is not banning seed sales or saying seeds are responsible for coronavirus spread.

Where are you getting that?"
2020-04-19,fromscratch404,sweden,3,https://www.reddit.com/r/sweden/comments/g46qvg/megatråd_coronavirus_20200419/fnx2d0u/,"Tillverkat av Zhejian Orient Gene Biotech enligt [Åke Lundkvists studie](https://www.diva-portal.org/smash/get/diva2:1422649/FULLTEXT01.pdf).

De verkar ha lanserat testet redan i slutet av mars enligt Healgens [produktbeskrivning](http://www.orientgene.com/upload/202003/26/202003261418378618.jpg). 

De har rullats ut i Los Angeles, Denver, Maryland och North Carolina redan, i miljontals. Vi lär väl få data därifrån inom kort antar jag.

Intressant för ditt resonemang:
> In an email exchange, Fang of Healgen said its parent, Zhejiang Orient, applied in early April for approval for its test from China's Center for Medical Device Evaluation and is still waiting. Because the Chinese government banned manufacturers from exporting COVID-19 test kits after April 1 if they are unapproved, Fang said, Zhejiang Orient stopped exporting the tests and told its clients that it did not have the necessary license.
[Källa](https://www.nbcnews.com/health/health-news/unapproved-chinese-coronavirus-antibody-tests-being-used-least-2-states-n1185131)"
2020-04-19,RiotousOne,Ohio,3,https://www.reddit.com/r/Ohio/comments/g499bl/smiling_and_waving_as_i_drive_by/fnx2sch/,"[Amy Acton was sued by a bridal shop owner](https://www.cincinnati.com/story/news/2020/04/17/coronavirus-lawsuit-bridal-shop-owner-sues-acton-ohio-over-coronavirus-shutdown/5150986002/) because the shop lost money due to the stay at home order. 

To name and shame it is  Tanya Rutner Hartman, the owner of Gilded Social LLC.  The shop is in Columbus."
2020-04-19,Rhone33,Coronavirus,3,https://www.reddit.com/r/Coronavirus/comments/g46aoa/dr_oz_apologizes_for_saying_reopening_schools_is/fnwzodu/,"> We've spent billions and billions of dollars over the decades trying to make car accidents more survivable and less likely.

You make this sound like charity coming from people who care so much about the fatalities.  Companies *invest money* into things they believe will end up *being profitable* in the long run.  In the meantime, we have had literally more than a century in which we have had cars and deaths caused by them.

Likewise, money is being being poured into tests, treatments, and vaccines for coronavirus, by companies who stand to make quite a bit of money from it.  It is likewise still likely, however, that we return to business as usual at some point when there is 1) still some risk, but 2) small enough risk that we think the benefit of business as usual outweighs the risk.

> It's not like we ignore these things the way you present we do.

Not ignore.  *Accept.*  Yes, we may try to improve on things, but we don't entirely stop doing the thing that presents the danger."
2020-04-19,DuchessofWinward,Cooking,3,https://www.reddit.com/r/Cooking/comments/g4expe/quarantine_cupboard_protip_packaged_food_doesnt/fnx81b3/,"Here’s the deal....you are adding risk.  Food scientists balance age, sensory attributes, microbiology, and analytical data.  It is to a food company’s advantage to have as long of a shelf life as possible.  Much like the Coronavirus, you can not see or smell or touch or feel  common food pathogens before they become dangerous to your health.  

when you are seeing the mold, bloating, bad smells, color changes, slime etc the microbes have ALREADY HIT a level that is dangerous.  Can you stretch it a day? Sure.  But by advocating ignoring best before dates, you are taking risks that cause about 50,000 food born illnesses per year."
2020-04-19,TheMadIrishman327,instantkarma,3,https://www.reddit.com/r/instantkarma/comments/g4avhy/i_could_hear_this_gif/fnxd2ht/,Coronavirus symptom transmitted by slap.
2020-04-19,tutetibiimperes,Coronavirus,3,https://www.reddit.com/r/Coronavirus/comments/g4g4sb/patients_with_heart_attacks_strokes_and_even/fnxdqyo/,"Going in to a hospital environment does seem extremely risky right now if it’s not an emergency.   If it is an emergency it’s better to go in, a heart attack will kill you a lot faster than Coronavirus, but the media stressing caution is the responsible thing to do right now.  

Total recovered would be good to report to reinforce that the virus isn’t an instant death sentence, but as long as positive cases keep rising by tens of thousands per day the recovery rate isn’t the most important stat to look at."
2020-04-19,phasexero,HumansBeingBros,3,https://www.reddit.com/r/HumansBeingBros/comments/g4ffgw/imo_sweden_always_have_been_ahead/fnxaybz/,"Yes, [things aren't going too well in Sweden right now](https://www.msn.com/en-gb/news/coronavirus/anger-in-sweden-as-elderly-pay-price-for-coronavirus-strategy/ar-BB12S1Ez?li=BBoPWjQ)"
2020-04-19,Tyree_Callahan,Bellingham,3,https://www.reddit.com/r/Bellingham/comments/g4fdwj/end_the_lockdown_protesters_picketing_health_and/fnxbmr3/,Don't tread on my coronavirus!
2020-04-19,Rhone33,Nurse,3,https://www.reddit.com/r/Nurse/comments/g4aw04/coworkers_specifically_nurses_who_think_covid_19/fnxaj1l/,"There's a lot of dumb beliefs that at least have some flow of logic.  But I don't understand how someone who deals first hand with illnesses caused by microorganisms, suddenly needs to have a non-microorganism hypothesis for coronavirus."
2020-04-19,UmikoAhagon,anime,3,https://www.reddit.com/r/anime/comments/g2qvr8/casual_discussion_fridays_week_of_april_17_2020/fnxh2qf/,"If the they can heal us then why is the coronavirus continuing to spread?

Have the Precures decided that humanity is no longer worth saving?"
2020-04-19,SuperDave734,Michigents,3,https://www.reddit.com/r/Michigents/comments/g4evp8/can_we_please_stop_responding_to_out_of_staters/fnxgfyz/,"If you need it spelled out: It matters because traveling puts you and other people at risk. Stop for gas, get the virus from the handle, transmit that to your cards and cash. Get in an accident and now Michigan State Police have to respond to a possibly asymptomatic coronavirus carrier. Grow up and stay home."
2020-04-19,BuyAnyMemesNecessary,navy,3,https://www.reddit.com/r/navy/comments/g4goou/my_face_when_the_gally_is_serving_steak_shrimp/fnxio0h/,"“There have been some Coronavirus fatalities onboard, but we will be remaining at sea for the next month regardless. Try not to breathe too much shipmates.”"
2020-04-19,HunterDotCom,Coronavirus,3,https://www.reddit.com/r/Coronavirus/comments/g4i5bw/new_study_reveals_llama_blood_contains_antibodies/fnxk91j/,This specific Coronavirus? I'm sure the spike proteins are different.
2020-04-19,tnick771,Coronavirus,3,https://www.reddit.com/r/Coronavirus/comments/g4f90u/ny_nj_connecticut_reopen_marinas_amid_calls_to/fnx5ggg/,"Because clearly you can’t go anywhere without touching something and the immediately licking your hands before you wash them. 

Also, Coronavirus isn’t an aerosol. It doesn’t “hang in the air”"
2020-04-19,BarrettBuckeye,Conservative,3,https://www.reddit.com/r/Conservative/comments/g4gecg/a_few_words_on_covid/fnxr30n/,The research that I've seen suggests that it's most contagious [one to two days before manifesting symptoms](https://www.sciencenews.org/article/coronavirus-covid-19-infection-contagious-days-before-symptoms-appear).
2020-04-19,Armoranth,wallstreetbets,3,https://www.reddit.com/r/wallstreetbets/comments/g4ega7/what_are_your_moves_tomorrow_april_20_2020/fnxlw32/,They're probably the same users who sit in new on the coronavirus sub and downvote any submissions that are saying maybe china didn't handle this correctly
2020-04-19,MAGA-Lady-Ok,stimuluscheck,3,https://www.reddit.com/r/stimuluscheck/comments/g4b7no/no_more_messing_with_irs_cpa_said_for_most_all_on/fnwdt64/,"NoT true you need a new CPA 

if you filed and get SS/SSDI/VA etc and owed (or filed joint and one person gets any of those) 

>You will not be able to use Get My Payment to provide your bank account information **because you did not file tax returns for 2018 or 2019** The IRS will use the information on the Form SSA-1099 or Form RRB-1099 to generate your payment. You will receive your payment as a direct deposit or by mail, just as you would normally receive your benefits.

https://www.irs.gov/coronavirus/get-my-payment-frequently-asked-questions

Bolding mine. 

Only if you didn’t file taxes. Some people do even if they are on those benefits and don’t have their DD info on file with the IRS. they will not get a DD Payment automatically 

https://www.irs.gov/newsroom/how-to-use-the-tools-on-irsgov-to-get-your-economic-impact-payment

> I receive a Form SSA-1099 or RRB-1099 and file a tax return. Can I use Get My Payment to check my payment status?
Yes, you will be able to use Get My Payment to check the status of your payment after you verify your identity by answering the required security questions.

https://www.irs.gov/coronavirus/get-my-payment-frequently-asked-questions"
2020-04-19,t90fan,CasualUK,3,https://www.reddit.com/r/CasualUK/comments/g4b2xu/is_it_price_gouging_to_increase_delivery_charges/fnwcj61/,"It has always been extortionate - was £35 before coronavirus.

I bought a chair in January and that was how much it was."
2020-04-19,gonzolegend,Coronavirus,2,https://www.reddit.com/r/Coronavirus/comments/g47edo/1_in_1000_new_york_city_residents_have_now_died/fnwblr2/,"Not original poster but has been mentioned before. 

[The Economist](https://www.economist.com/graphic-detail/2020/04/13/deaths-from-cardiac-arrests-have-surged-in-new-york-city) has a chart. 

Amount of 9-11 calls for heart attacks jumped from under 100 a day in March 2019 to over 300 a day in March 2020. 

Coronavirus can release something called inflammatory cytokines which can cause inflammation of organs including the heart making you much more prone to heart attacks. Added into that lack of oxygen in the blood puts strain on the heart to pump harder. 

China back in February had also reported similar spikes in the amount of cardiac arrests and people needing heart transplants as linked to Coronavirus."
2020-04-19,mahinkt,OMSA,2,https://www.reddit.com/r/OMSA/comments/g0p1hy/will_omsa_send_an_acceptance_letter_in_the_mail/fnwbstc/,"Normally 4-6 weeks after department decision, but due to coronavirus situation 6-10 weeks. You can submit the documents after 60 days from the start of first semester. Graduate division will let you know what are the docs you need to send"
2020-04-19,kms2547,Wellthatsucks,2,https://www.reddit.com/r/Wellthatsucks/comments/g48zz8/15_pages_of_obituaries_in_the_boston_globe_today/fnw9yx6/,You seriously don't have any problem with these pro-coronavirus rallies conservatives keep having?
2020-04-19,Ijustneedquiet,funny,2,https://www.reddit.com/r/funny/comments/g45t9d/feeling_bad_for_laughing_audio_on_also_all_credit/fnwa9sq/,"I'm getting 11311 tests/1m population as of today from 

https://www.worldometers.info/coronavirus/

Literally 42nd on the list worldwide. Sure, the US has recently ramped up testing, but you can't say ""number one in pandemic preparation"" while also saying the major testing only recently started to take off."
2020-04-19,biking_barista,britishproblems,2,https://www.reddit.com/r/britishproblems/comments/g47y9x/the_government_allowing_people_to_drive_to_a/fnwc95o/,"But is travelling outside of what could be a hot spot for the infection given the close proximity of cities be wise?

Why don’t we start letting people travel to other parts of the country? Some parts of the UK don’t have enough Coronavirus cases so definitely get those numbers up"
2020-04-19,A_WILD_CUNT_APPEARED,SquaredCircle,2,https://www.reddit.com/r/SquaredCircle/comments/g4bhih/liz_myers_curt_hawkins_wife_gives_her_reaction_on/fnwezj8/,"https://theredheadedmom.com/2020/04/18/how-the-coronavirus-has-impacted-my-family/

Blog link"
2020-04-19,Nachofriendguy864,Coronavirus,2,https://www.reddit.com/r/Coronavirus/comments/g4a6iw/how_soap_absolutely_annihilates_the_coronavirus/fnwch7s/,">Dear liberals, if soap absolutely annihalates the coronavirus, how come it does such a bad job cleaning out my smegma?

-Charlie Kirk, Turning Point USA"
2020-04-19,Tactical_Tac0s,EDC,2,https://www.reddit.com/r/EDC/comments/g4bd51/some_love_for_my_backpack_tool_kit/fnweg5f/,"Contents: (left to right)
Fine point sharpie,
Benchmade edc edge maintenance tool,
Thrunite TN12,
Fisher cap-o-matic space pen,
Leatherman bit kit,
Leatherman Wave,
Stanley pocket screwdriver,
Tekton adjustable wrench,
Mini Vise-grip pliers,
Field notes notebook,
Five feet or so of gorilla tape wrapped around an old credit card,
Also a pocket sized spray hand sanitizer (because Coronavirus)"
2020-04-19,esoterik,Coronavirus,2,https://www.reddit.com/r/Coronavirus/comments/g47edo/1_in_1000_new_york_city_residents_have_now_died/fnwelpn/,He was telling people [that they should still be going out to restaurants](https://ny.eater.com/2020/3/11/21175497/coronavirus-nyc-restaurants-safe-dine-out) as long as they weren’t sick on March 11th. His rationale was that the virus doesn’t spread through food.
2020-04-19,kslqdkql,Coronavirus,2,https://www.reddit.com/r/Coronavirus/comments/g47edo/1_in_1000_new_york_city_residents_have_now_died/fnwfl2n/,"Belgium counts differently than most countries, [we include all suspected cases](https://www.brusselstimes.com/all-news/belgium-all-news/106454/coronavirus-why-belgium-also-counts-suspected-deaths/)"
2020-04-19,marc512,PublicFreakout,2,https://www.reddit.com/r/PublicFreakout/comments/g4a4n8/shootout_occurs_while_stayathome_order_is_active/fnx0llq/,They seem to be dying of coronavirus more. Due to what ever reason.
2020-04-19,x_Lyze,sweden,2,https://www.reddit.com/r/sweden/comments/g46qvg/megatråd_coronavirus_20200419/fnx2anr/,"Att man i andra länder stängt ned så mycket som man gjort och ständigt från ledarskapet använd hård och ibland krigsretorik verkar ju ha gjort de flesta rädda nog att [acceptera nödvändigheten av restriktionerna](https://www.telegraph.co.uk/news/2020/04/13/new-poll-shows-britons-fear-years-hardship-despite-backing-coronavirus/). Innan var det ju te.x. i [Storbritannien högljudd kritik att det *inte* stängdes ned](https://www.cnbc.com/2020/03/16/coronavirus-uk-public-backlash-against-lack-of-restrictions.html).

Fast det är ju en bra fråga hur många som blir frustrerade och hur snart.

Samtidigt har vi i Sverige rapporter om att folk i Stockholm nu börjar återgå till det normala, åka mer kollektivtrafik och vilja sluta jobba hemifrån.

Som den här polisen hörde på en uteservering i Stockholm: [""Ingen fara, vi är ju flockimmuna nu!""](https://twitter.com/YB_Sodermalm/status/1251528870093893634). Som alltså är en grav feltolkning av Tegnells [uttalanden om flockimmunitet i Stockholm](https://omni.se/tegnell-stockholm-kan-na-flockimmunitet-i-maj/a/zGJjjb)."
2020-04-19,dino_74,investing,2,https://www.reddit.com/r/investing/comments/g4edtj/40_billion_hedge_fund_elliott_management_is_being/fnx2z0a/,"This even applies to the same author. Take Nigam Arora

[https://www.marketwatch.com/search?q=nigam%20arora&Link=MW\_SearchAC](https://www.marketwatch.com/search?q=nigam%20arora&Link=MW_SearchAC)

Here's some headlines:

A treatment for the coronavirus would be priceless — and worth about 5,000 points in the Dow Jones Industrial Average

The U.S. stock market may enjoy the biggest rally ever when the pandemic is over

The biggest mistake stock market investors are making now — failing to look ahead

The force that’s propelled the stock market rally will exhaust itself this week

Greed overtakes fear in the stock market, but don’t be lured into this short-lived rally

Investors are placing bold bets on tech stocks — this is a very bad idea"
2020-04-19,EaglesNumberOne,Coronavirus,2,https://www.reddit.com/r/Coronavirus/comments/g4asj3/posthaste_threat_of_coronavirus_outbreaks_could/fnx3u4i/,That Santa Clara test has been completely destroyed.. https://statmodeling.stat.columbia.edu/2020/04/19/fatal-flaws-in-stanford-study-of-coronavirus-prevalence/
2020-04-19,nihilistic_outlier,Tailors,2,https://www.reddit.com/r/Tailors/comments/f2da0v/hello_all_im_not_confident_but_am_i_competent_to/fnx26f6/,"Yeah just the one so far. I havent been able to go to the thrift store and get cheap clothes i can try tailoring yet, cuz of the whole coronavirus situation.

I may try tailoring some of my existing shirts, since I have a whole lot of baggy ones and I also want the slim look.

Did you do your test with a sewing machine or using hand sewing? I used sewing machine and the seams are terrible lol. But still doesnt look bad since you cants see them."
2020-04-19,Artech2,covidmx,2,https://www.reddit.com/r/covidmx/comments/g4e1qa/capacidad_lectora_el_encargado_de_la_pandemia_en/fnx1h8r/,"Cree que es menos letal el Coronavirus que la gripa......

Pero bueno ahí tiene su club de fans de r/mexico"
