date,author,subreddit,score,url,text
2020-04-08,whyyouliekim,worldnews,9,https://www.reddit.com/r/worldnews/comments/fx9o8a/the_world_health_organization_asked_the_united/fmtj34r/,"You mean like how they said it was a global emergency by Jan 30th? https://www.politico.eu/article/coronavirus-who-declares-global-emergency/

Did that change Trump and UK's view towards the virus? Lol no.

Notice how the countries that handled it correctly by following the WHO's recommendation of mass testing everyone aren't the ones blaming the WHO right now? Literally from day 1 the WHO has been saying countries need to be testing everyone and the countries that had high testing rates early are the ones doing ok right now.

Notice how the countries that ignored 90% of what the WHO said and did their own thing from either ""lol its a hoax"" to ""herd immunity it is"" and only started taking it seriously end of March are the ones complaining?

It's almost like the Trump Administration and tories are massively trying to deflect to make people forget that for 2 entire months after the WHO declared this a global emergency both those parties sat around and did absolutely nothing but pretend like everything is ok and ""lol dem hoax"""
2020-04-08,EmporerGaramel,traaaaaaannnnnnnnnns,9,https://www.reddit.com/r/traaaaaaannnnnnnnnns/comments/fxeg2o/when_bernie_drops_out_of_the_race_so_now_your/fmv2hw8/,This just this. I’m in America and honestly anybody but trump would be better then trump. Even his Vice President would be better and he’s an evangelical Christian who is fully against gay marriage let alone anything trans people want. I oddly hope the boomers die off a bit from Coronavirus because they just won’t give up power
2020-04-08,rmslashusr,fivethirtyeight,9,https://www.reddit.com/r/fivethirtyeight/comments/fxa9cc/why_bernie_sanders_lost/fmu5wuq/,"Is his press Secretary attacking Kamala Harris insinuating she’s in favor of people dying of cancer simply because she tweeted that Coronavirus treatment should be free enough for you when Harris

1.  mother died of cancer which she broke down about in a previous interviews
2. Was indisputably for M4A during her campaign
3. Isn’t even an opposing candidate anymore

https://newsone.com/3921360/bernie-sanders-press-secretary-briahna-joy-gray-kamala-harris/

The issue is we’re paying attention to what his top campaign staff say and write directly themselves, not that we’re paying attention to lamestream media 🙄"
2020-04-08,trashpandalul,vegancirclejerk,9,https://www.reddit.com/r/vegancirclejerk/comments/fxga4p/ive_heard_the_new_vegan_face_masks_are_over_100/fmuts12/,"Lettuce rejoice, we did it boys, coronavirus is no more!"
2020-04-08,reallysickofyourbs,Accounting,9,https://www.reddit.com/r/Accounting/comments/fxhz3s/how_easy_is_it_to_get_fired_from_big_4/fmugo33/,"You’re fine. We all make mistakes. Unless you did something offensive to the client it’s pretty hard to get fired as an associate. 

Please keep In mind that nobody can say with the coronavirus how much easier it is to get fired. In a normal situation though you’re fine."
2020-04-08,BuddhistSagan,youtubehaiku,9,https://www.reddit.com/r/youtubehaiku/comments/fx27n7/its_just_the_flu_bro_poetry/fmttqcq/,"How about actual research: https://www.google.com/amp/s/www.businessinsider.com/coronavirus-cases-per-capita-chart-countries-2020-3%3famp

Keep in mind south korea and the US had the same, relatively late first cases. So south korea is probably the best comparison and the US has way more per million than south korea. 

If you compare it to any other country, it is best to know what date those countries had their first case"
2020-04-08,MintBerryCannon,worldnews,9,https://www.reddit.com/r/worldnews/comments/fx9mv4/french_hospital_stops_hydroxychloroquine/fmts65b/,"You need a controlled double blind study with a sufficient number of patients plus an understanding of the mechanism of action on how the drug actually works against the coronavirus. Right now no one knows if patients who recovered from coronavirus, would’ve have recovered anyway without the drug."
2020-04-08,NoodleKidz,Coronavirus,9,https://www.reddit.com/r/Coronavirus/comments/fxd4td/mayor_says_virus_has_hit_black_hispanic_new/fmtsbvz/,"funny that you mention this, I just saw an 'influencer' on youtube saying black people are immune from Coronavirus, and it hits Asians only.

I was like, WTF??? I hope nobody, especially African Americans believe him. He'd get so many killed"
2020-04-08,IcySpykes,aww,9,https://www.reddit.com/r/aww/comments/fx6u3i/babies_in_thai_hospital_gets_face_shields_for/fmtpd7s/,"I mean that's nice and Its cute, but other than direct being coughed or sneezed on this doesn't really make a huge difference, if this actually is a Coronavirus measure the nature of the virus hanging in the air defeats open face protection.

Unless that too has been found to be misinformation recently?"
2020-04-08,lusvig,neoliberal,9,https://www.reddit.com/r/neoliberal/comments/fx1nfr/discussion_thread/fmtnvia/,">African Americans more likely to die from coronavirus illness, early data shows

covid? more like COPid"
2020-04-08,RonnyronDaDon,Coronavirus,9,https://www.reddit.com/r/Coronavirus/comments/fxhh9s/61_patients_at_la_mental_health_facility_test/fmueo32/,[I wish I was](https://www.propublica.org/article/people-with-intellectual-disabilities-may-be-denied-lifesaving-care-under-these-plans-as-coronavirus-spreads)
2020-04-08,Morning-Coffee-fix,Coronavirus,9,https://www.reddit.com/r/Coronavirus/comments/fxdmu5/dr_deborah_birx_the_white_house_coronavirus/fmtp0uz/,"I'll try to rephrase that to remove any ambiguity.

 **Dr. Deborah Birx, the White House coronavirus response coordinator, says** **~~officials are~~** **Trump is** **~~looking at whether~~** **demanding social distancing guidelines** **~~could be~~** **are** **~~relaxed~~** **ignored in** **~~some~~** **all areas** **~~at the end of the month~~** **as soon as possible.**"
2020-04-08,cawfee,Coronavirus,9,https://www.reddit.com/r/Coronavirus/comments/fxfbd2/5g_car_is_screening_for_viruses_and_making/fmu17lk/,">top-mounted camera that can identify pedestrians via facial recognition and measure temperature using thermal imaging

There's no way the thermal reading implementation on these is accurate enough to determine an elevated body temperature, so they're essentially just facial data collection and surveillance tools with room for cargo:

https://www.nbcnews.com/tech/security/fever-detection-cameras-fight-coronavirus-experts-say-they-don-t-n1170791"
2020-04-08,BiodegradableFerret,wallstreetbets,9,https://www.reddit.com/r/wallstreetbets/comments/fx7z14/the_betrayal_of_ujartek/fmu2dcb/,Can’t catch the coronavirus if you’re already the illest uknowhatimsayin
2020-04-08,Ida13athlete,AskReddit,9,https://www.reddit.com/r/AskReddit/comments/fxdwng/what_is_the_dumbest_conspiracy_you_have_ever_heard/fmu1cg8/,That the government MADE the Coronavirus to cut down the world's population.
2020-04-08,TheGrayMan204,Anxiety,9,https://www.reddit.com/r/Anxiety/comments/fj2y1a/lets_post_good_news_on_the_coronavirus_here/fmurk60/,"Something for the canucks in the audience :)

(the title seems pessimistic, but theres a few positive takeaways in there)

[https://www.ctvnews.ca/health/coronavirus/planking-the-curve-experts-caution-canada-is-still-far-from-halting-covid-19-1.4888612](https://www.ctvnews.ca/health/coronavirus/planking-the-curve-experts-caution-canada-is-still-far-from-halting-covid-19-1.4888612)"
2020-04-08,elfinito77,moderatepolitics,9,https://www.reddit.com/r/moderatepolitics/comments/fxddh6/nyc_only_using_fraction_of_ventilators_of_what/fmu0k3s/,"I think a lot of the trump stuff was way over-blown - once we did did Buckle down as a nation.

That said -- I think he dug is own hole with a lot of his Tweets/Rally comments in February.

Jan. 22: “We have it totally under control.”

Feb. 24: “The Coronavirus is very much under control in the USA. … Stock Market starting to look very good to me!”

Feb. 25: “You may ask about the coronavirus, which is very well under control in our country. We have very few people with it, and the people that have it are … getting better. They’re all getting better. … As far as what we’re doing with the new virus, I think that we’re doing a great job.”

Feb. 26: “Because of all we’ve done, the risk to the American people remains very low. … When you have 15 people, and the 15 within a couple of days is going to be down to close to zero. That’s a pretty good job we’ve done.""

Feb. 26: “I think every aspect of our society should be prepared. I don’t think it’s going to come to that, especially with the fact that we’re going down, not up. We’re going very substantially down, not up.” — Trump at a press conference, when asked if “U.S. schools should be preparing for a coronavirus spreading.”

Feb 28 rally: . And this is their new hoax. But you know, we did something that’s been pretty amazing. We’re 15 people [cases of coronavirus infection] in this massive country. And because of the fact that we went early, we went early, we could have had a lot more than that.......so far we have lost nobody to coronavirus in the United States. Nobody. And it doesn’t mean we won’t, and we are totally prepared, it doesn’t mean we won’t. ....the press is in hysteria mode."
2020-04-08,pm_me_all_dogs,Coronavirus,9,https://www.reddit.com/r/Coronavirus/comments/fwusyf/hospitals_say_feds_are_seizing_masks_and_other/fmre7c7/,"The Trump administration and the GOP would have us get sick and die while they profit off of tax dollars.

Want to know how it works?

1.) Eliminate oversight of the spending of nearly a trillion dollars of tax dollars: https://thehill.com/regulation/court-battles/490737-stimulus-opens-new-front-in-trumps-oversight-fight

2.) Aquire the authority to command which businesses get which contracts: https://youtu.be/MlQx7Qs2ACI

3.) Have trusted people stand up companies through which the money can be funneled (3 week old company, founded through a loan approved via the Coronavirus Stimulus bill, is now the center of medical supply distribution): https://www.politico.com/news/2020/03/27/republican-fundraiser-company-coronavirus-152184 “I don’t want to overstate, but we probably represent the largest global supply chain for Covid-19 supplies right now,” he said. “We are getting ready to fill 100 million-unit mask orders.”

4.) Have the federal government sell, at a reduced price, it’s strategic stockpile to the new companies, run by your buddies: https://twitter.com/DavidBegnaud/status/1245841458323771393

5.) Have the states bid on the supplies, driving up the price: https://youtu.be/2zeEUs7tcpE

6.)  Have the federal government spend taxpayer dollars to ship supplies purchased from China to these	 brand new private companies: https://www.npr.org/sections/coronavirus-live-updates/2020/03/29/823543513/project-airbridge-to-expedite-arrival-of-needed-supplies-white-house-says?utm_campaign=npr&utm_source=twitter.com&utm_medium=social&utm_term=nprnews

7.) Eliminate the competition.  Attack any company that doesn’t play ball. https://mothership.sg/2020/04/trump-3m-10-million-masks/"
2020-04-08,Skydawne,Coronavirus,9,https://www.reddit.com/r/Coronavirus/comments/fx5m42/people_after_mild_corona_symptoms_may_not_be/fmu45sr/,"*Sorry, should have added the translation (with deepL, only first paragraphm about the title):*

**Van Dissel: People after mild corona symptoms might not be immune**

People who have been infected with the coronavirus and had mild symptoms are not automatically immune afterwards. RIVM boss Jaap van Dissel said in a briefing in the Lower House on Wednesday that there is a group that may not build up immunity after mild coronary complaints.

In this group, an infection with mild complaints also means that they do not always produce the required amount of antibodies. ""This immediately means that it becomes complex to interpret whether someone who has had mild complaints has also built up immunity,"" says Van Dissel.

At the moment it is not yet known whether these persons are susceptible to new infections and whether this group builds up immunity. The RIVM is still investigating this. Research is also taking place into the spread of the virus in nursing homes. Corona has been diagnosed in 900 of the 2,500 nursing homes.

Cabinet policy is to 'monitor' the virus as much as possible until a vaccine is available. This means that the most vulnerable groups are protected and everything is done to ensure that care and intensive care are not overdemanded. At the same time, the virus will circulate through society and group immunity must be built up.

Van Dissel said that further research is needed to see whether immunity can be established in people who have had mild symptoms. It is important that more tests are carried out. These tests must be combined with research to identify who an infected person has been in contact with."
2020-04-08,DJErikD,navy,9,https://www.reddit.com/r/navy/comments/fxg6w5/cno_message_to_the_fleet_america_has_a_great_navy/fmu4g4s/,"CNO Message to the Fleet

Release Date: 4/8/2020 5:33:00 PM

By Chief of Naval Operations, Adm. Mike Gilday

WASHINGTON (NNS) -- The events of the past week have been difficult for our Navy and our nation. We will learn from them. But make no mistake, we are moving forward. The Navy has our orders and we are executing them.

As I write, we have thousands of Sailors on mission, above, under, and on the seas as well as here at home on the front lines of the coronavirus crisis. We’re operating far forward on 90 ships, including three aircraft carriers and two big deck amphibious ships. Navy Cyber teams are defending our networks.  Seabees are converting commercial buildings into medical facilities across six states. Three thousand Navy doctors, nurses and corpsmen, including hundreds of reservists, are caring for our fellow Americans on USNS MERCY, COMFORT, in New York City’s Javits Center, and in civilian hospitals. Hundreds more deployed to treat the sick in Dallas and New Orleans. The NIMITZ carrier strike group and her air wing at Lemoore are in 14 day Restriction of Movement (ROM) as they ramp up to deploy. Same for our SSBN crews. Countless more Sailors are leaning in to support them – across our fleet staffs, intelligence centers, training facilities, and supply depots. More than six thousand recruits at Great lakes are preparing to head to the fleet.

Given this, I have three priorities for us right now. First, our health and safety. Second, ongoing fleet operations and our support to the coronavirus effort. Third, continuing to generate the enormous amount of support required to keep #1 and #2 on track. I know much of that effort is behind the scenes and out of the limelight – but every bit of it is critical.

We must ensure the health of the force. And we must be laser-focused on the Fleet – from manning to maintenance, and from training to warfighting. Operational readiness is our job… and every one of us has a role. Nobody sits the bench.

Everyone must pull together. And in this new environment of coronavirus, we’re all learning, adapting, and improving by the hour. There is no better example of this than USS THEODORE ROOSEVELT – staring down an invisible enemy – dedicated in their efforts – making phenomenal progress, and providing lessons for the Navy and beyond. 

America. Has. A. Great. Navy. Our nation counts on you and so do I.  Never more proud to be your CNO.
 

Get more information about the Navy from US Navy facebook or twitter.

For more news from Chief of Naval Operations, visit www.navy.mil/local/cno/."
2020-04-08,Snipuh21,Coronavirus,9,https://www.reddit.com/r/Coronavirus/comments/fx8w8w/where_have_all_the_heart_attacks_gone/fmss2kn/,"The hospitals are eerily quiet, except for Covid-19.

I have heard this sentiment from fellow doctors across the United States and in many other countries. We are all asking: Where are all the patients with heart attacks and stroke? They are missing from our hospitals.

Yale New Haven Hospital, where I work, has almost 300 people stricken with Covid-19, and the numbers keep rising — and yet we are not yet at capacity because of a marked decline in our usual types of patients. In more normal times, we never have so many empty beds.

Our hospital is usually so full that patients wait in gurneys along the walls of the emergency department for a bed to become available on the general wards or even in the intensive care unit. We send people home from the hospital as soon as possible so we can free up beds for those who are waiting. But the pandemic has caused a previously unimaginable shift in the demand for hospital services.

Some of the excess capacity is indeed by design. We canceled elective procedures, though many of those patients never needed hospitalization. We are now providing care at home through telemedicine, but those services are for stable outpatients, not for those who are acutely ill.

What is striking is that many of the emergencies have disappeared. Heart attack and stroke teams, always poised to rush in and save lives, are mostly idle. This is not just at my hospital. My fellow cardiologists have shared with me that their cardiology consultations have shrunk, except those related to Covid-19. In an [informal Twitter poll](https://twitter.com/angioplastyorg/status/1245892249101074432?s=20) by [@angioplastyorg, an online community of cardiologists,](http://angioplasty.org/) almost half of the respondents reported that they are seeing a 40 percent to 60 percent reduction in admissions for heart attacks; about 20 percent reported more than a 60 percent reduction.

And this is not a phenomenon specific to the United States. Investigators [from Spain reported](https://www.recintervcardiol.org/es/?option=com_content&view=article&id=344&catid=14) a 40 percent reduction in emergency procedures for heart attacks during the last week of March compared with the period just before the pandemic hit.

And it may not just be heart attacks and strokes. [Colleagues on Twitter report](https://twitter.com/MandaChelednik/status/1246793095032852480?s=20) a decline in many other emergencies, including acute appendicitis and acute gall bladder disease.

The most concerning possible explanation is that people stay home and suffer rather than risk coming to the hospital and getting infected with coronavirus. This theory suggests that Covid-19 has instilled fear of face-to-face medical care. As a result, many people with urgent health problems may be opting to remain at home rather than call for help. And when they do finally seek medical attention, it is often only after their condition has worsened. Doctors from Hong Kong [reported](https://www.ahajournals.org/doi/10.1161/CIRCOUTCOMES.120.006631) an increase in patients coming to the hospital late in the course of their heart attack, when treatment is less likely to be lifesaving.

There are other possible explanations for the missing patients. In this time of social distancing, our meals, social interactions and physical activity patterns tend to be very different. Maybe we have removed some of the triggers for heart attacks and strokes, like excessive eating and drinking or abrupt periods of physical exertion. This theory merits research but seems unlikely to explain the dramatic changes we’re observing.

We actually expected to see more heart attacks during this time. Respiratory infections typically increase the risk of heart attacks. [Studies](https://www.ncbi.nlm.nih.gov/pmc/articles/PMC3139921/) suggest that recent respiratory infections can double the risk of a heart attack or stroke. The risk seems to begin soon after the respiratory infection develops, so any rise in heart attacks or strokes should be evident by now. We [urge people to get flu vaccines](https://www.cardiosmart.org/News-and-Events/2019/03/Flu-Shot-Helps-Prevent-Heart-Attack) every year, in part, to protect their hearts.

Also, times of stress increase the risk of heart attacks and strokes. Depression, anxiety and frustration, feelings that the pandemic might exacerbate, are all associated with a doubling or more of heart attack risks. Work and life stress, which also may be higher with the acute disruptions we’ve all been going through, can markedly increase the risk of a heart attack. Moreover, events like earthquakes or terrorist attacks or war, in which an entire society is exposed to a stressor, are risk factors for heart attacks. Finally, Covid-19 can actually affect the heart, which should be increasing the number of patients with heart problems.

Experts are bringing together data to confirm these patterns. We hope to gain a greater understanding of their causes and consequences.

Meanwhile, the immediate message to patients is clear: Don’t delay needed treatment. If fear of the pandemic leads people to delay or avoid care, then the death rate will extend far beyond those directly infected by the virus. Time to treatment dictates the outcomes for people with heart attacks and strokes. These deaths may not be labeled Covid-19 deaths, but surely, they are collateral damage.

The public needs to know that hospitals are equipped not only to care for people with Covid-19 but also those who have other life-threatening health problems. Yes, we in health care are working to keep people out of the hospital if we can, but we can safely provide care for those people who are not sick from Covid-19. Masks and protective gear for health care workers and patients go a long way to ensure a safe environment. Also, people with chronic conditions need to know that avoidance of needed care could ultimately be as big a threat as the virus itself.

As we fight coronavirus, we need to combat perceptions that everyone else must stay away from the hospital. The pandemic toll will be much worse if it leads people to avoid care for life-threatening, yet treatable, conditions like heart attacks and strokes.

*Harlan Krumholz, M.D., is professor of medicine at Yale and director of the Yale New Haven Hospital Center for Outcomes Research and Evaluation.*"
2020-04-08,arbitrageME,worldnews,9,https://www.reddit.com/r/worldnews/comments/fx9mv4/french_hospital_stops_hydroxychloroquine/fmu73g1/,well I'd rather my kid get coronavirus and autism than get a MERCURY FILLED VACCINE. what if he becomes the one in a few million affected? it'll be on your head!
2020-04-08,Dinin53,worldnews,9,https://www.reddit.com/r/worldnews/comments/fx8lqc/eight_uk_doctors_died_from_coronavirus_all_were/fmufeua/,"Eight U.K. Doctors have died fighting Coronavirus.

FTFY."
2020-04-08,cestmoihaha,worldnews,9,https://www.reddit.com/r/worldnews/comments/fxg2a2/who_chief_addresses_death_threats_racist_insults/fmuh5nt/,"And Taiwan also. He called out Taiwan more times than its foreign ministry. 

And seriously, what campaign is he referring to? I have been closely watching the news in Taiwan about Coronavirus since January. I didn’t see anything like that on the internet or in the news. 

The biggest criticism and personal attack in the media was [he is accused of covering up epidemic in Ethiopia between 2006-2011.](https://www.nytimes.com/2017/05/13/health/candidate-who-director-general-ethiopia-cholera-outbreaks.amp.html)"
2020-04-08,Jugmentor,CanadaCoronavirus,9,https://www.reddit.com/r/CanadaCoronavirus/comments/fxiw84/planking_the_curve_experts_caution_canada_is/fmumn8c/,"""SARS was exterminated, it wasn’t a very successful virus, but COVID-19  is enormously successful,"" Furness said. ""We're seeing it [cross into other animals quite readily](https://www.ctvnews.ca/health/coronavirus/what-does-a-tiger-s-positive-test-mean-for-covid-19-and-pets-1.4886127),  which is concerning and means it will likely be endemic. The need for  anti-viral drugs and a vaccine will not go away no matter how much  physical distancing we do."""
2020-04-08,Shatteredreality,Portland,9,https://www.reddit.com/r/Portland/comments/fxdw3s/oregon_schools_will_remain_closed_for_the_rest_of/fmumw6p/,"So far are the key words. [Sweden, which refused to implement a coronavirus lockdown, has so far avoided a mass outbreak. Now it’s bracing for a surge in deaths.](https://www.businessinsider.com/coronavirus-sweden-no-lockdown-test-thousands-deaths-expected-2020-4)"
2020-04-08,people_watcher,Coronavirus,9,https://www.reddit.com/r/Coronavirus/comments/fxjt2n/nursing_home_with_39_coronavirus_cases_evacuated/fmut873/,">It’s unclear why, exactly, they went AWOL

Unclear? How dense are they?

>On late Monday evening, officials reported 34 positive cases of COVID-19, the disease caused by the coronavirus, among patients and five among employees at the Magnolia Rehabilitation and Nursing Center, Federico said. The five employees — who were not among the 13 who didn’t go to work — were sent home to self-quarantine, and the patients who tested positive were isolated from other residents.

&#x200B;

>Federico said the county had fulfilled — either **in part** or whole — equipment requests from hospitals and skilled nursing facilities.

Looks REALLY clear to me why they went AWOL. They likely had little in the way of PPE."
2020-04-08,godloki,PSVR,9,https://www.reddit.com/r/PSVR/comments/fxavfs/for_those_who_want_to_use_vr_to_get_fit/fmu7xn1/,It’s because coronavirus has people looking for ways to stay fit while stuck in the house.
