date,author,subreddit,score,url,text
2020-04-08,racingbarakarts,insaneparents,2689,https://www.reddit.com/r/insaneparents/comments/fxjity/update_im_immunocompromised_and_my_mom_refused_to/fmut37m/,Another update: I just called my mom to notify her and her first reaction was to ask why I was wasting my money at the doctor’s. Then she said she doesn’t believe I have the coronavirus. She’s mad. :/
2020-04-08,rhabdomyomatosis,science,1418,https://www.reddit.com/r/science/comments/fxe14a/cats_may_be_susceptible_to_covid19_according_to_a/fmu08mn/,"I've been waiting for this to hit the mainstream - Fun! Been monitoring these [pre-publications](https://www.biorxiv.org/content/10.1101/2020.03.30.015347v1) for a couple weeks now. 

This isn't much of a surprise, since cats (and ferrets) are especially susceptible to their own coronavirus (enteric coronavirus and FIP); however, all of the reports I've read only detail cats being susceptible to COVID-19 but unable to transmit it. These cases are likely a 'reverse zoonosis' where humans are transmitting COVID-19 to cats, but they are unable to transmit it back to us - so far. One study used a small group of cats and inoculated them with a heavy load of viral particles, and found that naive cats exhibited respiratory signs. The big cats at the Bronx zoo were super interesting, and I'm waiting for more of that story to come out. Who was in contact with those cats?!

There are a few groups out there utilizing [ferrets](https://www.ncbi.nlm.nih.gov/pubmed/?term=covid+ferret) as an animal model to recapitulate human disease. Looking forward to see where that goes. 

Source: Boarded veterinary pathologist"
2020-04-08,seejaysullivan,SandersForPresident,379,https://www.reddit.com/r/SandersForPresident/comments/fxfdd2/such_a_shame/fmu1vii/,"Chuck Todd just said on Msnbc, ""This was supposed to be Bernie Sanders' moment!"" 

Essentially stating that the coronavirus only helped his campaign's platform. Here's the problem Todd.

**It WAS his moment. YOU didn't do YOUR JOB and cover him.**

Instead, they brought Biden out every day for his slurring interviews, constant note checking and general awkwardness.

Bernie did daily coronavirus briefings before Trump even started doing his.

#NOBODY COVERED IT.

Today has had more Sanders coverage than the last month **COMBINED**.

Manufactured consent is real folks, we've witnessed it firsthand."
2020-04-08,frickinjaygaragearoo,worldnews,274,https://www.reddit.com/r/worldnews/comments/fx79nt/donald_trump_sends_200_ventilators_to_the_uk/fmtab8j/,"The federal stockpile is being given to privately owned distributors, who are then selling back the PPE at a markup to whichever state bids the highest on them. 

Including PPE already purchased by hospitals, which is being requisitioned by FEMA so that hospitals can then buy them back at a markup.  [https://www.latimes.com/politics/story/2020-04-07/hospitals-washington-seize-coronavirus-supplies](https://www.latimes.com/politics/story/2020-04-07/hospitals-washington-seize-coronavirus-supplies)"
2020-04-08,RobertdBanks,Coronavirus,224,https://www.reddit.com/r/Coronavirus/comments/fxgm84/cdc_considers_relaxing_coronavirus_guidelines/fmu7h0v/,"> The Centers for Disease Control and Prevention (CDC) is considering relaxing coronavirus guidelines as early as Wednesday, allowing Americans who have been exposed to COVID-19 but are asymptomatic to return to work.

>These individuals would be required to take their temperature twice a day for signs of a fever and wear a face mask when at work and out in public to prevent the spread of the virus, a person familiar with the proposal under consideration told The Associated Press. The person described the proposal on the condition of anonymity because the draft has not been finalized.

What an absolute joke. So if you’re asymptomatic you can return to work even though you’re just able as anyone else with the virus to spread it? What fucking sense does this make?"
2020-04-08,whyhellodermatey,ABoringDystopia,215,https://www.reddit.com/r/ABoringDystopia/comments/fxgzg2/dont_get_sick_tho_you_cant_afford_that_shit/fmuu8ew/,It has been clear that Bernie wouldn’t be the nominee for over a month.  The real reason for the stock increase is coronavirus.  Coronavirus being a winner for health insurance companies shows how fucked their business model is and how we need Medicare for all!
2020-04-08,evilfailure,UpliftingNews,192,https://www.reddit.com/r/UpliftingNews/comments/fxi6vl/all_11_coronavirus_patients_in_greenland_have_now/fmuonmw/,I can't believe the entire population of Greenland got coronavirus AND recovered.
2020-04-08,cptmx,ShitAmericansSay,188,https://www.reddit.com/r/ShitAmericansSay/comments/fxd394/will_shoot_at_the_government_if_they_try_to/fmtnnzt/,"“ Yeah! Just aim your gun at ‘em and BAM! “

... and just like that. Coronavirus was no more. Hospital staff emerged from ICU’s all around the world, cheering with arms waiving in the air. 

Suddenly, the ground trembles as a convoy of hummer-limos arrive - with AR15 rifles in place of normal wheels. “It’s the president!”, shouts a by-stander, “Could it be?”
Yes. Donald Trump, mid-bite of his hamberder, undoes his belt and hunches over. He shits out a Medal of Honor and pins it to our hero’s shirt. The fake news arrives just in time to capture the moment.

Just then, a light from above, as Jesus Christ himself descends from the heavens to place a crown atop our hero’s brow. 
“May the noblest of creatures bear the Holy Corona”. Our hero reels back and sucker punches Jesus in the face and says, 
“This is America, bitch. Speak English”.

...And then everybody clapped."
2020-04-08,TheFoxKing5,Denver,169,https://www.reddit.com/r/Denver/comments/fxi3lz/trump_grants_ventilators_to_colorado_at_the/fmula06/,"Didn't the fed swoop in on Colorado's deal and outbid them? So they paid more for them just so Trump could say Gardner got them for Colorado? This is next level gross.

https://www.coloradopolitics.com/coronavirus/gov-jared-polis-fema-took-our-ventilators-out-from-under-us/article_29f23eba-76a1-11ea-a065-f7f95e2756a1.html"
2020-04-08,icebrotha,Coronavirus,167,https://www.reddit.com/r/Coronavirus/comments/fxdwoa/all_11_coronavirus_patients_in_greenland_have_now/fmu6kdk/,Plague inc is the reason why I've been freaking out about coronavirus since late January.
2020-04-08,hernanthegoat,AskReddit,158,https://www.reddit.com/r/AskReddit/comments/fxdwng/what_is_the_dumbest_conspiracy_you_have_ever_heard/fmtputl/,The 5g coronavirus
2020-04-08,tyme,science,145,https://www.reddit.com/r/science/comments/fxe14a/cats_may_be_susceptible_to_covid19_according_to_a/fmukdv6/,">Neither Nadia nor the domestic cats studied “actually ever acted terribly sick,” Bronx Zoo veterinarian Paul Calle told the Times.

>An experiment in a lab — like injecting a big dose of the virus through a cat’s nose — “does not replicate what is happening in people’s homes around the world,"" Calle points out.

>In fact, cats may not be “generally susceptible” to getting sick from the novel coronavirus...

Since they decided to bury this bit at the bottom of the article."
2020-04-08,Hambgex,YouShouldKnow,144,https://www.reddit.com/r/YouShouldKnow/comments/fxbfms/ysk_mediastingercom_is_a_straightforward_quick/fmtxt13/,"Ah, those were the good times. That is, before the coronavirus nation attacked."
2020-04-08,Benteen,worldnews,132,https://www.reddit.com/r/worldnews/comments/fx9mv4/french_hospital_stops_hydroxychloroquine/fmthcl7/,"I've been on Hydroxychloroquine for four years for arthritis.  It is a widely-used drug with a reputation for minimal side effects (I've had none that I know of).  I discussed it with my Doctor just today and he said that side effects are ""extremely, extremely rare"".

It should only be used it if can be shown to be effective for coronavirus (unlikely).  I'm just saying that the idea that this is a dangerous drug that is going to cause catastrophic side-effects if used widely is overblown."
2020-04-08,Douglaston_prop,Coronavirus,129,https://www.reddit.com/r/Coronavirus/comments/fxb13q/new_york_state_now_has_more_confirmed_coronavirus/fmtiaj5/,"“Excuse our arrogance as New Yorkers — I speak for the mayor also on this one — we think we have the best health care system on the planet right here in New York,” Mr. Cuomo said on March 2. “So, when you’re saying, what happened in other countries versus what happened here, we don’t even think it’s going to be as bad as it was in other countries.”

[NYTimes](https://www.nytimes.com/2020/04/08/nyregion/new-york-coronavirus-response-delays.html?action=click&module=Top%20Stories&pgtype=Homepage)"
2020-04-08,snapper1971,MorbidReality,124,https://www.reddit.com/r/MorbidReality/comments/fx5g2l/the_letter_the_british_have_received_from_our/fmtcrux/,"""Grandad, what did you do during the coronavirus pandemic?""

""I did exactly what was expected of me. Nothing.""

""Wow. Did you really stay at home for five years?"""
2020-04-08,MightyMorph,WhitePeopleTwitter,109,https://www.reddit.com/r/WhitePeopleTwitter/comments/fxd7a4/us_govt_vs_wimbledon/fmu8qhz/,"[Intelligence report warned of coronavirus crisis as early as November: Sources
""Analysts concluded it could be a cataclysmic event](https://abcnews.go.com/Politics/intelligence-report-warned-coronavirus-crisis-early-november-sources/story?id=70031273)

I mean who could have seen it coming....

[U.S. axed CDC expert job in China months before virus outbreak](https://www.reuters.com/article/us-health-coronavirus-china-cdc-exclusiv/exclusive-u-s-axed-cdc-expert-job-in-china-months-before-virus-outbreak-idUSKBN21910S)

Im sure when he was aware of the problem he made sure to inform the public to make them prepared....

https://www.youtube.com/watch?v=ch7_t2Ri2Zg

He didn’t want to cause panic of course, So he made sure to get the government right on preparing for it though....

[A review of federal purchasing contracts by The Associated Press shows **federal agencies largely waited until mid-March** to begin placing bulk orders of N95 respirator masks, mechanical ventilators and other equipment needed by front-line health care workers.](https://apnews.com/090600c299a8cf07f5b44d92534856bc)

At least, as the president he knows he is in charge of the federal governments actions to the pandemic and showed great leadership by taking charge and taking this crisis as his responsibility to lead through....

**'I don't take responsibility at all'** - [President of The United States](https://www.youtube.com/watch?v=wOcY3XlzPzs)"
2020-04-08,thatguyalex2018,Coronavirus,108,https://www.reddit.com/r/Coronavirus/comments/fxhz42/86yearold_is_killed_in_er_over_social_distancing/fmugkbw/,"The woman, Janie Marshall, who had dementia, grabbed onto another patient’s IV pole to regain her balance and orient herself, the police said.

The patient, Cassandra Lundy, 32, had apparently become irate that Ms. Marshall had broken the six feet of personal space recommended to help prevent the spread of the coronavirus, law enforcement officials said. Ms. Lundy shoved the older woman, knocking her to the floor. Ms. Marshall struck her head and died three hours later."
2020-04-08,tonyenkiducx,worldnews,104,https://www.reddit.com/r/worldnews/comments/fx79nt/donald_trump_sends_200_ventilators_to_the_uk/fmu8e86/,"Oddly twisted story here, I've not got the source to hand but the 200 ventilators were purchased from companies in the US some time ago. It's not a gift, and the UK didn't ""ask"" for them

*Edit* found the source.

https://www.theguardian.com/world/2020/apr/08/uk-scrambles-for-foreign-made-ventilators-ahead-of-coronavirus-peak

""Earlier on Wednesday Downing Street confirmed that the UK had asked the US to deliver 200 ventilators already ordered from US companies, clarifying statements made the previous night by the US president, Donald Trump."""
2020-04-08,CakeAccomplice12,worldnews,103,https://www.reddit.com/r/worldnews/comments/fxjoh8/number_of_new_cases_of_covid19_in_nz_plummets_to/fmuxf7l/,"I mean you're fortunate you aren't on maps


The coronavirus just kept getting lost"
2020-04-08,EariosRandomness1,dankmemes,99,https://www.reddit.com/r/dankmemes/comments/fxa5i5/today_is_a_sad_day/fmtquah/,"He's not ending his campaign, he's putting it on hold to put more money towards coronavirus research and aid"
2020-04-08,rangeDSP,worldnews,98,https://www.reddit.com/r/worldnews/comments/fxfdg1/so_easy_i_thought_it_was_fake_canadas_cerb_system/fmu956e/,"Funnily enough, a large number of US's unemployment systems runs on COBOL, a programming language that fell out of favor ~40 years ago. 

The mainframes are currently being overwhelmed by the number of requests:
https://mashable.com/article/coronavirus-unemployment-cobol-programmers/"
2020-04-08,anonlogs,india,96,https://www.reddit.com/r/india/comments/fxaity/waiting_for_such_an_address_by_the_pm/fmtyntk/,"""The pandemic has attacked our religion, ideology, beliefs and other things that we hold dear all at once. Hence, to protect them, we must first defeat Coronavirus. Today, it is essential that people of all the views, ideology and sects come together to beat the Coronavirus pandemic.""

Literally a quote from his speech. People hear what they want to hear.

Source : [https://news.abplive.com/videos/news/india-pm-modi-appeals-religious-leaders-to-help-in-fight-against-coronavirus-1187747](https://news.abplive.com/videos/news/india-pm-modi-appeals-religious-leaders-to-help-in-fight-against-coronavirus-1187747)"
2020-04-08,WallaWallaPGH,Coronavirus,92,https://www.reddit.com/r/Coronavirus/comments/fxj2rd/ninety_thousand_medical_workers_volunteered_to/fmusb38/,Ninety thousand medical workers volunteered to help New York battle coronavirus. Most are sitting idle.
2020-04-08,lover_of_pancakes,Coronavirus,91,https://www.reddit.com/r/Coronavirus/comments/fxb13q/new_york_state_now_has_more_confirmed_coronavirus/fmudtx2/,"It's also worth noting that NYC has had an unprecedented increase in at-home deaths over the last couple weeks, who are also not being tested post-mortem.

EDIT for all the people telling me I'm wrong: here's the article. Conclusion: it's a shit show.
https://www.nytimes.com/2020/04/05/us/coronavirus-deaths-undercount.html"
2020-04-08,MikeGinnyMD,science,87,https://www.reddit.com/r/science/comments/fxe14a/cats_may_be_susceptible_to_covid19_according_to_a/fmuhzfs/,"There are seven known coronaviruses that infect humans.

Coronaviruses infect many species of mammals, Maybe even all of them, from mice to whales. However, each coronavirus will have a specific range of mammals that I can infect. This particular coronavirus seems to be really bad at infecting dogs, even though dogs have their own coronaviruses that do infect them.

The original SARS coronavirus originated in a bat and is thought to have been passed through a civet, which is a feloid related to felids (cats).  So it isn’t terribly surprising that this closely related coronavirus could also infect feloids, which include cats great and small.

So there is some relevance here. First of all, it means that we probably need to start looking at cats as a reservoir for this virus.  Having an animal reservoir makes it more difficult to get rid of a virus. Imagine if this would get into the feral cat population, a population that does have a fair amount of contact with humans.

It also means that if cat lovers are in high-risk occupations or or high-risk patients themselves, they may need to quarantine themselves from their feline friends."
2020-04-08,digital_end,awfuleverything,84,https://www.reddit.com/r/awfuleverything/comments/fxg5ja/good_luck_my_american_friends/fmv0ray/,"Either Trump or Biden will be president.  That is a factual statement, hedge around it or ignore it, but it's real.
 
So you want reasons to vote?
 
* [Sanders literally said to vote for the nominee.](https://thehill.com/homenews/campaign/433364-sanders-pledges-to-support-democratic-nominee-in-2020)
 
> If we do not win, I will strongly support the Democratic nominee…and hope and believe that others feel exactly the same way. Donald Trump must be defeated,
 
This should be highlighted by the fact that he's an independent running as a Dem, he understands splitting the vote is disastrous.  For example blaming Nader for putting Bush in office.  We could have had Gore, a guy obsessed with climate change... instead we got Bush and he fucked the middle east for a generation yet again.
 
* Trump winning means a 7-2 supreme court.
 
The rest of your life every interpretation of the supreme court would be decided by a super-majority of hyper conservatives.  This is an unbelievable boon for anyone trying to regress our nation.
 
Row v Wade will fall.  Many states already are pushing through laws intentionally violating it to go to the supreme court.  That will be decided during the next 4 years.  This election decides how that likely ends.
 
Imagine the joy on McConnell's face as he signs in RBG's replacement.  Imagine the bullshit impotent reddit outrage where we call for signatures about it.  That's the future where Trump wins.  Think about this.
 
* Trump's crimes will remain protected behind the office of the presidency. 
 
Currently many groups want to rip Trump to shreds for lawbreaking.  The state of New York for example.  He is currently protected by his office however, and they cannot touch him. 
 
Stripping away that office means that rotten bastard spends the rest of his life in court, watching everything he's built be torn down around him.
 
Leaving him in office means he'll go most of the rest of his life protected.  And with his position set, his predecessor will simply cover for him.
 
As someone who wants this fuck brought to justice, this matters to me.
 
* Trump being re-elected validates his appointments and actions.
 
We have [a literal fucking white nationalist in the white house](https://en.wikipedia.org/wiki/Stephen_Miller_\(political_advisor\)), he had advisers who [harrassed shooting victims](https://en.wikipedia.org/wiki/Alex_Jones), and gave a [racist drug addict](https://en.wikipedia.org/wiki/Rush_Limbaugh) the fucking medal of freedom.
 
This is what you're signing off on helping him get elected.  And again, one of the two will win, not helping one is helping the other.  That's math, like it or not.
 
* He's currently fucking everything about the pandemic up.
 
With that heading do you think I mean [him downplaying the pandemic causing his supporters to refuse to take it seriously](https://www.cnn.com/2020/03/17/politics/fact-check-trump-always-knew-pandemic-coronavirus/index.html), [the theft of medical supplies from hospitals](https://www.nytimes.com/2020/04/06/us/politics/coronavirus-fema-medical-supplies.html), or  [stealing from our international allies](https://www.vox.com/2020/4/4/21208250/coronavirus-trump-canada-germany-spain-brazil), or did you think I meant [him removing all oversight from the bailout funds so he can do with them what he wants?](https://www.washingtonpost.com/national-security/trump-removes-inspector-general-who-was-to-oversee-2-trillion-stimulus-spending/2020/04/07/2f0c6cb8-78ea-11ea-9bee-c5bf9d2e3288_story.html)
 
The fact that during a *fucking pandemic* we can't guess which scandal is under this heading should itself be a bit of a warning, no?
 
* The GOP (and foreign groups who support trump) want to drive down turn out. 
 
Seriously, the GOP's whole strategy is getting you not to vote.  They fight against registration, they fight against more voting centers.  Their whole battle is to keep you from voting.
 
Why in the *fuck* would the right choice be to help them?
 
[They know a low turn out is the only way to win.](https://www.vanityfair.com/news/2020/04/republicans-now-just-admitting-they-want-fewer-americans-to-vote)  Conservatives are a minority of the population, but they vote consistently.  So getting you to stay home is how they win.
 
If your analysis of a situation ends with you doing exactly what the people trying to oppose your ideals wants you to do.... [including foreign groups](https://www.vpr.org/post/how-russian-social-media-effort-boosted-bernie#stream/0)... that's something you need to think about.  They're not on your side, why obey them?
 
* Him winning validates it all.
 
It tells our international allies that Trump wasn't a mistake, he *is* America now.  America is now a nation not to be trusted, not looked to.  It is closer to Russia than Germany internationally.
 
It shows that all of us on the internet are just noise.  Our petitions?  Our marches?  Irrelevant fucking hippies, just a noisy fringe.  Not actual Americans.  Real Americans are like those folks on T_D calling low-t soyboys like you cucks. 
 
That's what you're showing the world.

 
* Biden isn't as bad as the internet has convinced you he is.
 
He's not my first... or second or third... choice.  [However there is a lot on his platform I don't hate.](https://www.politico.com/2020-election/candidates-views-on-the-issues/joe-biden/)  $15 minimum wage?  Getting rid of death penalty?  Eliminate private prisons?  Some government funded college?  
 
Again, certainly isn't my favored candidate.  My personal political position is left to the point that I feel most businesses considered ""essential"" right now should very likely be nationalized because clearly it's essential for the security of the nation.  Healthcare, internet, power, water, etc. 
 
So he's sure as shit not perfect.  But he *is better*.
 
...
 
And once more, because any response is going to inevitably avoid this simple reality:  Either Biden or Trump ***WILL*** be president.  Two possible futures, no more or less.  No debate on that fact.  
 
If you're discouraging people from voting for Biden, you are campaigning for Trump.  They're the same thing.
 
If you want to talk about the morality of it, you should think about the people your inaction hurts.  Because that is still a choice you've made to help keep Trump in office.  Exactly like the GOP wants you to."
2020-04-08,diamondmines2,OurPresident,80,https://www.reddit.com/r/OurPresident/comments/fx8die/bernie_suspends_campaign/fmsu2kx/,"We don’t get another four years. There’s a very good chance we’ve had our last free and fair election in this country for quite some time. If they’re shutting down polling stations in Texas and forced people to risk dying of coronavirus to vote yesterday, why would they allow fair say to everyone in four years?"
2020-04-08,jsmooth7,vancouver,80,https://www.reddit.com/r/vancouver/comments/fxi97v/justin_trudeau_sings_speaking_moistly_have_some/fmuxjwk/,This is catchier than coronavirus.
2020-04-08,_skank_hunt42,Coronavirus,78,https://www.reddit.com/r/Coronavirus/comments/fxhus7/california_to_buy_200_million_masks_a_month_amid/fmuv0ka/,"He’s not perfect but he’s been handling the Coronavirus situation very well, in my opinion. I’m very glad to be living in California right now, especially since I’m somewhat rural and my county has had very few cases."
2020-04-08,utalkin_tome,Coronavirus,76,https://www.reddit.com/r/Coronavirus/comments/fxhe21/us_authorities_seize_medical_supplies_that_the/fmumf3e/,"I don't get it. The EU has a ban on export of these supplies as well. Both Germany and France have seized these resources before they were sent to other EU countries. Do people here consider that wrong as well or does that not count since it's EU?

Source for germany and france:

https://www.irishtimes.com/news/world/europe/coronavirus-european-solidarity-sidelined-as-french-interests-take-priority-1.4216184?mode=amp

https://www.bloomberg.com/news/articles/2020-03-09/germany-faces-backlash-from-neighbors-over-mask-export-ban"
2020-04-08,elimepie,insaneparents,75,https://www.reddit.com/r/insaneparents/comments/fxjity/update_im_immunocompromised_and_my_mom_refused_to/fmuzfie/,"I'm so sorry that happened to you. That's a horrible thing to do to your child. Did any of this manage to  open her eyes a little bit? I recently had a family member get coronavirus from the nursing home he is staying in. His age and disabilities are making it much worse, Yet I still have ignorant family members traveling and just not giving a shit."
2020-04-08,Greych12,AskGayMen,75,https://www.reddit.com/r/AskGayMen/comments/fxiucn/gay_advice_on_anal_sex_im_planning_on_receiving/fmuuawd/,Wait until coronavirus has subsided
2020-04-08,ColeYote,TheRightCantMeme,73,https://www.reddit.com/r/TheRightCantMeme/comments/fx97kk/im_speechless/fmtsqkf/,The number of right-wing memes using Donald Trump's atrocious coronavirus response as an excuse to complain about Bernie Sanders is fucking ridiculous.
2020-04-08,Wisdom_is_Contraband,Coronavirus,71,https://www.reddit.com/r/Coronavirus/comments/fxcxxu/covid19_twice_as_contagious_as_previously_thought/fmtrsg4/,"rhinovirus mutates rapidly:
https://www.sciencedaily.com/releases/2009/02/090212141149.htm

coronavirus mutates slowly:
https://www.livescience.com/coronavirus-mutation-rate.html

Coronavirus is a type of virus that makes up the common cold, tehre are only 3 or 4 coronavirus that infect human beings (meaning, all coronavirus mutate slowly)

https://www.webmd.com/cold-and-flu/cold-guide/common_cold_causes


The misconception that coronavirus will become a seasonal illness is because Coronavirus make up part of the 'gang' of viruses that make up the common cold.  Common cold is associated with poor immunity, because Rhinovirus which makes up the majority of the virus that make up the common cold, mutate rapidly, and have poor immunity because of this.  However, Coronavirus will very likely have long lasting immunity."
