date,author,subreddit,score,url,text
2020-02-04,FlamingDune,Coronavirus,2,https://www.reddit.com/r/Coronavirus/comments/eyvzei/worried_usa_nurse_here/fgk0hxd/,"I’m in fire/rescue and our two main hospitals we transport to are both completely full today...just like last shift and the shift before. One is about to go on diversion and the other can’t as it’s a Trauma Center. The nurses and doctors are overworked and overwhelmed.

There are patients in beds in the hallways toe to head, vertical hold is full, the waiting rooms are full and there’s no rooms for patients to be admitted to in order to clear the ER.

A few years ago when there was a bad flu year we were transporting patients in acute respiratory distress whom the hospitals had previously had in patient and whom they’d discharged to make room for others. 

I’m totally floored seeing the response and disdain about concern from our government officials, Especially given the way this strain of Coronavirus is behaving, the immense unknowns re transmission capabilities, amount of time it survives on surfaces, the possibility of asymptomatic transmission and the clear and documented lack of accurate information from Chinese officials.

We might not have anything to be concerned about as far as an epidemic in the US, but our system is already at max capacity. An ounce of prevention and some science based caution seems far more than wise. I just don’t get the “meh” I’m seeing from the WHO and CDC."
2020-02-04,joey_bosas_ankles,China_Flu,2,https://www.reddit.com/r/China_Flu/comments/eyx1ee/german_patients_shedding_virus_with_only_cold/fgjtxp6/,"I mean, [the common cold is a coronavirus,](https://www.who.int/health-topics/coronavirus) and the expectation is for viruses to have a wide range of severity of symptoms, even if the average is usually more severe in 2019-nCoV vs the common cold."
2020-02-04,nagumi,China_Flu,2,https://www.reddit.com/r/China_Flu/comments/eywkt6/wrong_interpretation_of_international_spread/fgjtsf5/,"When you read about new cases outside of china, look to see if it's known where they got infected. This is why the news from thailand and (to a lesser degree) korea is so concerning... I believe they're the first cases from outside of china where we don't know who infected them. It means coronavirus is ""in the wild"" now, at least in thailand. Might still be contained, but it's the last real step before sustained human to human transmission."
2020-02-04,nostrademons,China_Flu,2,https://www.reddit.com/r/China_Flu/comments/eys95q/johns_hopkins_doctor_says_new_coronavirus_is_here/fgjtssr/,"You have already witnessed this type of virus emerge in your lifetime.  Of the 7 strains of coronavirus that infect humans, SARS was discovered in 2003, 2 additional common cold viruses in 2004 and 2005, MERS in 2012, and now this in 2019.  Add in new influenza strains and you have H1N1 swine flu pandemic in 2009 and H5N2 bird flu epidemic in the U.S. in 2015.  H1N1 is now a circulating seasonal flu - it's in the flu vaccine this year.

I think there's some recency bias and this outbreak will eventually be looked back upon the same way the 2003 SARS epidemic, 2009 swine flu epidemic, and 2014 Ebola outbreak are.  You'll remember it from the news cycles, but eventually it'll just be one more thing that's part of history."
2020-02-04,tarcapone,Coronavirus,2,https://www.reddit.com/r/Coronavirus/comments/eyuvfx/28_year_old_doctor_treating_ncov_patients_in/fgjtulu/,"I think you die from exhaustion when you work 24/7 with Coronavirus patients, then catch it yourself, but refuse to stop working helping people. Heroic indeed. But maybe not the smartest decision."
2020-02-04,flightlevel350,China_Flu,2,https://www.reddit.com/r/China_Flu/comments/eyxnce/canada_2nd_case_confirmed_in_bc/fgk4dfe/,"Here is another article that specifies the patient is in the Vancouver Coastal Health “Region”: 


https://www.richmond-news.com/news/coronavirus-b-c-s-second-case-has-family-visiting-from-wuhan-china-1.24068515

There are many VCH buildings, it is not a monolith. Search here if you’d like to see them all...searchable by districts in the *Vancouver Coastal Health Region*: 


http://www.vch.ca/locations-services"
2020-02-04,decrementsf,Coronavirus,2,https://www.reddit.com/r/Coronavirus/comments/eyyvxb/only_old_people_and_young_children_are_at_risk/fgk5v2n/,"You can assume only the very old, the very young, or those with immune system compromised for other reasons, are at risk from the flu virus. That assumption is based on data collected over decades of study of the flu virus.

This coronavirus is new. We are still learning its characteristics. Is it reasonable that assumptions about the flu virus also hold true for coronavirus? Maybe. But we have nothing to go on. We don't have enough data yet. This is new.

It is expected that wisdom of the crowds will repeat what is familiar in absence of information -- assumptions that hold true for the flu."
2020-02-04,liatrisinbloom,preppers,2,https://www.reddit.com/r/preppers/comments/eyy69n/we_need_to_encourage_people_who_are_just_starting/fgk669d/,It would probably be a good idea to point common questions to the [Coronavirus Megathread](https://www.reddit.com/r/preppers/comments/etf562/coronavirus_and_mask_suggestion_mega_thread/) to consolidate information where possible.
2020-02-04,javaislyfe,China_Flu,2,https://www.reddit.com/r/China_Flu/comments/eyz4oq/results_negative_for_first_nyc_case/fgk724v/,">BREAKING - Confirmed by KETV: Law enforcement says up to 70 people possibly exposed to the Coronavirus in China are being flown to Camp Ashland (Nebraska military base) to be quarantined. More details as we get them.

Dec & Jan is huge for tourism (even if cold). You have Rockefeller Center, NYE, Ball drop and 1st quarter business meetings."
2020-02-04,AZAllison,Coronavirus,2,https://www.reddit.com/r/Coronavirus/comments/eyxa6s/am_i_over_reacting/fgk2yqs/,"Is [this](http://archive.is/TbADQ) the article you're referring to?

Interestingly, the author admits he has relatives who ""live near Wuhan.""  Here's what it says:

""On Tuesday, around midnight, someone uploaded a video to Twitter showing emergency vehicles responding to an incident at an apartment complex near USC, the Lorenzo, known to be popular with Chinese international students.

The post claimed it was a case of coronavirus, and a screenshot of an email from the Lorenzo’s manager, Chance Kidd, seemed to confirm that.

The news that the first reputed coronavirus case in the center of Los Angeles had been detected near USC immediately went viral. A lot of people tweeted panicked, performative posts about hand-washing and the threat of disease. One poster claimed a friend’s roommate’s brother’s girlfriend had been infected.

The university later clarified that no coronavirus case had been discovered at the Lorenzo. And despite repeated requests for comment, Kidd and the Lorenzo declined to explain why they had made such a claim.""

That last sentence implies they did make the claim and the jpg is real."
2020-02-04,BaconFace2736,Anxiety,2,https://www.reddit.com/r/Anxiety/comments/eupik4/coronavirus_megathread/fgk5kgw/,"Coronavirus Cases Down From Weekend Levels As China Predicts Fall In Mortality Rates

The last 24 hours has seen a decline of new cases versus the previous three days. The novel coronavirus outbreak seems to have stalled out in China.


The Johns Hopkins University tracking system shows a leveling off of new case loads, and they are now on par with where they were a week ago following big jumps since last Thursday.

In addition, China’s National Health Commission (NHC) predicted on Tuesday that the mortality rate would start to taper off in the days ahead. Meanwhile, the World Health Organization said early this morning that the viral outbreak has not reached a rate for them to consider this a global pandemic. 

https://www.forbes.com/sites/kenrapoza/2020/02/04/coronavirus-cases-down-from-weekend-levels-as-china-predicts-fall-in-mortality-rates/#949fbc167cbe"
2020-02-04,Burlytown-20,gtaonline,2,https://www.reddit.com/r/gtaonline/comments/eyw7oj/anyone_else_get_this_alert/fgk3spz/,"Nah, cmon. I see people post their cool stunt vids/gifs a lot, quit playing. Also coronavirus jokes too"
2020-02-04,Liall-Hristendorff,Coronavirus,2,https://www.reddit.com/r/Coronavirus/comments/eyw0h1/this_is_not_how_the_world_responds_to_a_flu/fgk5qw8/,"That’s exactly what I’m understanding from the evidence.  I’ve known that the IPCC underpredicted the rate of climate change for decades, and even just recently scientists have found that the same climate models the world has been using to frame policy are showing much higher and far scarier rates of warming—up to 5 degrees Celsius.  
The world has already past 9 important tipping points.  Water scarcity is getting worse.  Agriculture has been taking a hit.  The Arctic’s sea ice is melting fast, and it’s a train that we won’t be able to turn around.  When it melts away entirely (likely very soon) there’ll be nothing to stop global warming from ravaging unhinged across the earth.  Combine that with a likely shut down of air travel from the coronavirus or any other pandemic the world is inadequately prepared to deal with without a dramatic slowdown of economic activity, and then the aerosols in the air fall away and allow temperatures to soar rapidly as well.  It’ll be a nightmare for humans.  
As to the Earth, I think she’s just moving from a destabilising state to a new, stable hot state where humans will either be extinct or their population will bottleneck, relieving the stress on the planet."
2020-02-04,_Standards_,Coronavirus,2,https://www.reddit.com/r/Coronavirus/comments/eyyw4f/where_are_the_wildlife_affected_by_the_virus/fgk6beh/,"Source? Because this is what the CDC says:

>Coronaviruses are common in many different species of animals, including camels and bats. Rarely, these coronaviruses can evolve and infect humans and then spread between humans. Recent examples of this include SARS-CoV and MERS-CoV.

>Most coronaviruses infect animals, but not people. In the future, one or more of these other coronaviruses could potentially evolve and spread to humans, as has happened in the past. We still don’t understand why only certain coronaviruses are able to infect people.

https://www.cdc.gov/coronavirus/index.html"
2020-02-04,outline_link_bot,China_Flu,2,https://www.reddit.com/r/China_Flu/comments/eyzpa5/china_desperate_to_stop_coronavirus_turns/fgkbi60/,"> *China, Desperate to Stop Coronavirus, Turns Neighbor Against Neighbor*

Decluttered version of this SFGate's article archived on February 03, 2020 can be viewed on https://outline.com/WVg4zz"
2020-02-04,mikeyeah17,hockey,2,https://www.reddit.com/r/hockey/comments/eyzeuf/game_thread_vegas_golden_knights_27207_at_tampa/fgkavun/,Fucking coronavirus
2020-02-04,RafikiJackson,China_Flu,2,https://www.reddit.com/r/China_Flu/comments/eyu407/bbc_interview_with_woman_stuck_in_wuhan_chilling/fgk7ffg/,Underreporting deaths is a problem though.  People dying at home are being just cremated and not counted towards coronavirus deaths.  They need to be either included as it most likely is the case or a separate category created for deaths that are suspected to be coronavirus related so the scientific community can make assessments based on that information.
2020-02-04,sickstagram,illnessfakersgonewild,2,https://www.reddit.com/r/illnessfakersgonewild/comments/eyz5i4/from_if_uanonopissed_aubs_is_getting_her_lymph/fgkdyks/,"Better question- what happened to her mask? Such a spokesperson for them and here she is in a health care setting, during cold/flu season, with the added fun of coronavirus, and no mask?!? 

No worries, we know just like the convoluted BS explanation she gave for SwayBack-Gate 2018, I’m sure she’ll have some explanation where she tries to make anyone who questions it seem like insensitive beasts who should be trolled to the depths of the murky cauldron by her blind and brainless followers."
2020-02-04,th3allyK4t,Coronavirus,2,https://www.reddit.com/r/Coronavirus/comments/ez02uu/damn7_pm_update_cases_are_up_to_24550_thats_an/fgkd8s5/,"Unfortunately that’s not wild speculation. That’s based on one crematorium with 30 incinerators in Wuhan working 24/7.  And not counting the deaths before the outbreak became widespread. 


https://www.google.co.uk/amp/s/meaww.com/amp/china-wuhan-coronavirus-lying-official-figure-sending-bodies-victims-cremation-eyewash-deaths"
2020-02-04,kirklennon,NoStupidQuestions,2,https://www.reddit.com/r/NoStupidQuestions/comments/ez01fl/is_it_safe_to_order_skin_products_from_asia_on/fgkcj4o/,"1. Coronavirus isn't actually that widespread. 
2. Most people with it are in China. 
3. The products you're buying were likely loaded on a ship and left Asia before you ever heard of coronavirus. 

Yes, it's safe."
2020-02-04,PrewashedYeti,mildlyinteresting,2,https://www.reddit.com/r/mildlyinteresting/comments/eyy9iv/here_is_my_proudest_agar_mixed_e_coli_serratia/fgk0rab/,"Come to find out, this genius accidentally mixed up Coronavirus and mailed it to his pen pal in Wuhon cause it looked ‘cool’.



(Jk) very cool!"
2020-02-04,sweetchillileaf,Coronavirus,2,https://www.reddit.com/r/Coronavirus/comments/eyycpv/update_now_23865_confirmed_with_492_deathscases/fgk1sn1/,"It's all over check for example worldometer
[this one](https://www.worldometers.info/coronavirus/"
2020-02-04,NotAnotherEmpire,China_Flu,2,https://www.reddit.com/r/China_Flu/comments/ez0dzr/how_is_the_flu_a_bigger_threat_than_this_virus_it/fgkgwda/,"This. Most people hospitalized for flu - already a small % of cases - are only in for a few days for fluids and maybe Tamiflu. 

The coronavirus is a whole other animal."
2020-02-04,PokestarFan,Coronavirus,2,https://www.reddit.com/r/Coronavirus/comments/ez0t5n/im_sure_its_a_total_coincidence_that_a_hiv/fgkglnc/,It has been scientifically disproven that Coronavirus contains HIV proteins specifically.
2020-02-04,fabionebbia,China_Flu,2,https://www.reddit.com/r/China_Flu/comments/ez1791/5_different_sites_5_different_numbers/fgkitl1/,"Use [NBO](https://bnonews.com/index.php/2020/02/the-latest-coronavirus-cases/), at the top of the page you can find worldwide figures, scroll down for individual countries’ numbers and timestamps."
2020-02-04,tantricfruits,China_Flu,2,https://www.reddit.com/r/China_Flu/comments/eyx1ee/german_patients_shedding_virus_with_only_cold/fgkffor/,"This may be posted twice but I waited a few minutes after posting something and it didn't show up :S 

Measles patients continue to shed virus (and therefore spread the disease) for an average 4 days after the rash has disappeared. Ebola patients' semen or tears contain the virus and can transmit the disease with those fluids (at least semen) for up to 6 months (dont know if it's all cases, but has been reported). 

Do we know if coronavirus patients that recover and no longer have any symptoms continue to shed virus? if so, for how long?"
2020-02-04,SecretAccount69Nice,Coronavirus,2,https://www.reddit.com/r/Coronavirus/comments/ez0pp6/the_real_question_we_have_to_ask_is/fgkhdpb/,"Unfortunately you are correct.  
https://www.bloomberg.com/news/articles/2020-02-01/coronavirus-lurking-in-feces-may-reveal-hidden-risk-of-spread"
2020-02-04,Xian_Clouds,China,2,https://www.reddit.com/r/China/comments/eyz08t/emergency_repatriation_info/fgkfmmr/,"I didn’t experience any myself, as I got out right at the start of the whole thing. However, I do have two friends there that have gotten some verbal abuse (both in person and on social media). The social media over there is currently full of bs articles about how the virus is an American bio weapon, and across the general population of china, anything read online (no matter how ridiculous) will be believed by about 50% of the people. Case in point, a rumor started that a traditional Chinese medicine over there (shuanghuanglian) could prevent the coronavirus, and instantly the entire country was sold out with ridiculous long lines of people waiting to buy it. Mob mentality combined with lack of common sense doing its work. That said, the bulk of people I know over there are great, but there’s always those few ultra-patriotic idiots that will start some shit"
2020-02-04,EUJourney,China_Flu,2,https://www.reddit.com/r/China_Flu/comments/eyxzwj/please_remember_what_the_word_pandemic_means/fgk2g8b/,Swine Flu was way worse than the Coronavirus that people are overhyping here
2020-02-04,4thstories,vaxxhappened,2,https://www.reddit.com/r/vaxxhappened/comments/ez29am/before_you_start_pointing_fingers_make_sure_your/fgkqzxw/,"Oooh scary Chinese virus oooh so scary.

Meanwhile these assholes are scared of autism and vaccine injury that they will resurrect shit we eradicated. You can still catch the coronavirus without going to China idiot anti vaxx people."
2020-02-04,fakersdozen,science,1,https://www.reddit.com/r/science/comments/eyizda/wuhan_coronavirus_likely_to_soon_be_declared_a/fgii8d7/,"Wow...and what was on reddits front page just a few days ago???? 

Coronavirus is NOT a pandemic!!!!"
2020-02-04,Zuilex,solotravel,1,https://www.reddit.com/r/solotravel/comments/exw61e/feeling_really_upset_and_depressed_someone_tried/fgijnku/,"The Spanish flu was a strain of influenza...

Obviously this strain of Coronavirus is emerging, and no one knows much yet. 

The reason that the ""Spanish flu"" in 1918 killed so many is that it didn't just kill the elderly and children. It was a strain of influenza that was particularly harsh for young, healthy adults. 

There is no perfect vaccine against influenza. It's a rapidly mutating virus. The seasonal vaccine is comprised of a mix of strains that doctors believe will be present during the flu season. 

There isn't herd immunity when we have an emerging strain of influenza. The vaccines only protect against the strains that have been selected that year, which are a fraction of the strains known. 

Influenza is a problem. 

I didn't say this Coronavirus isn't a problem. I said people are getting hysterical about this when they don't bat an eye at influenza."
2020-02-04,UusiIsoKaveri,Coronavirus,1,https://www.reddit.com/r/Coronavirus/comments/eyoizz/another_day_another_video_from_coronavirus/fgijrrt/,Lancet model and the first infected (not recognized as coronavirus by the Chinese government) happened to be early December (2nd of December to be exact). Interesting link: https://youtu.be/u7D3AoNdp84
2020-02-04,SadieShy,dankmemes,1,https://www.reddit.com/r/dankmemes/comments/eym34p/thats_so_sad_have_you_heard_of_this_cool_new/fgijrsh/,Coronavirus-Chan going to be  T H I C C
2020-02-04,Silverballers47,stocks,1,https://www.reddit.com/r/stocks/comments/eypory/have_we_ever_seen_anything_like_this/fgijv29/,"No just hold on to what you have.

Don't buy anything more at present. There's a good chance that Coronavirus could halt Shanghai production

But do not sell this stock for next 4 years. Just yesterday, UK announced that they will ban gasoline cars by 2035

Same thing for Germay, France, Norway, Denmark, India, China....

EV is the future!"
2020-02-04,StrictlyFT,politics,1,https://www.reddit.com/r/politics/comments/eyq18a/were_on_the_verge_of_a_global_pandemicbut_trump/fgikaso/,"Are we really though? Only one person outside of China has died from the coronavirus and it was in the Philippines. There's only a dozen or so cases outside of China to start with. 

If you live in USA you should be way more worried about the Flu."
2020-02-04,Fire_HQ,askscience,1,https://www.reddit.com/r/askscience/comments/ewwmem/have_a_question_about_the_2019_novel_coronavirus/fgikam7/,Is it true that the coronavirus reacts to alcohol and heat? (probably already asked but couldn't find it)
2020-02-04,Dazz316,unpopularopinion,1,https://www.reddit.com/r/unpopularopinion/comments/eyp2la/the_chinese_invited_a_killer_virus/fgilf7t/,"The virus is killing humans. We generally consider humans to be more important than wildlife. China hasn't done anything or been called out for anything that threatens us in any way like this does.

Not to mention coronavirus could kills the makers quite easily. Unless you beleive that this secret they hold includes a secret vaccine or cure that they are holding for themselves like true supervillians.

And what do you think they're doing this for? potentially wiping out potentially millions of their own people at random including globally friends and foes alike? What's in it for them? Sounds bad for everybody (if I'm to play make believe and pretend they did do this)."
2020-02-04,autotldr,China_Flu,1,https://www.reddit.com/r/China_Flu/comments/eypwhf/coronavirus_outbreak_not_yet_pandemic_world/fgilf4z/,"This is the best tl;dr I could make, [original](https://www.bbc.com/news/world-asia-china-51368873) reduced by 80%. (I'm a bot)
*****
> The deadly coronavirus outbreak that has spread from China does not yet constitute a &quot;Pandemic&quot;, the World Health Organization has said.

> A pandemic is the worldwide spread of a new disease, according to the WHO. At least 427 people have died with more than 20,000 confirmed cases around the world, most of them in China.

> &quot;When you deal with an epidemic, you rapidly see that in addition to the epidemic of diseases, we often have an epidemic of information. And this is what we call &#039;infodemic&#039;,&quot; she said.


*****
[**Extended Summary**](http://np.reddit.com/r/autotldr/comments/eyqh8p/coronavirus_outbreak_not_yet_pandemic_world/) | [FAQ](http://np.reddit.com/r/autotldr/comments/31b9fm/faq_autotldr_bot/ ""Version 2.02, ~465105 tl;drs so far."") | [Feedback](http://np.reddit.com/message/compose?to=%23autotldr ""PM's and comments are monitored, constructive feedback is welcome."") | *Top* *keywords*: **China**^#1 **epidemic**^#2 **spread**^#3 **Pandemic**^#4 **virus**^#5"
2020-02-04,LuridofArabia,worldnews,1,https://www.reddit.com/r/worldnews/comments/eyivdv/hong_kong_confirms_first_novel_coronavirus_death/fgilk7l/,"God, I could use a little coronavirus right now. Just take me out, fam."
2020-02-04,Empty-Platform,insaneparents,1,https://www.reddit.com/r/insaneparents/comments/exq6t0/this_is_the_mother_of_one_of_my_best_friends_they/fgii63q/,"

Elderberry extract in the body has been shown to help block the viruses from being able to enter cells. They then also can't replicate in the cells as well. So there's multiple parts of the viral life cycle that get inhibited. That's much more effective than if it only helped with a single part, because it makes it much harder for the virus to infect a cell and if it does, it doesn't reproduce as much, and the other cells still have enhanced resistance to infection. So it works synergistically to reduce viral loads. It's why for things like HIV drugs, they'll do a cocktail of antiretrovirals, because they attack different weaknesses in the virus at different points in the life cycle so it needs pass multiple hurdles to be able to infect other cells. 

In studies in the lab, it's been shown that elderberry syrup had antimicrobial properties - it's been shown that it kills bacteria and viruses outside of the body.

The study with the air travel, they gave elderberry from 10 days in advance for prophylaxis (preventing getting infected), it's also been shown to reduce the time you are sick if you take it when you get infected.

It's worth noting if you're going to use it, it's way cheaper to buy dried elderberry and brew it yourself, the syrup is very expensive. It's also super bitter, so add honey (also antimicrobial) generously. We use it before international flights along with garlic.

Garlic also has antimicrobial properties and works as an immunomodulator, meaning it changes how the immune system works. It works by boosting white blood cells, and making them effective. (Specifically, stimulating lymphocyte production, NK cells, and increasing macrophage cytotoxicity).

Protip: Elderberry is part of our nCoV2019 (coronavirus) strategy if there's an outbreak here. It seems like it will probably help with that based on its effectiveness against other coronaviruses."
2020-02-04,GorgeousGregory,TheRightCantMeme,1,https://www.reddit.com/r/TheRightCantMeme/comments/eymcjt/right_wing_back_at_it_countersignalling_actually/fgij0s3/,"I think they will begin hyping the economy and they will lapse into xenophobia, again. I wonder if the coronavirus and the Great Wall of Humpty Trump will be factors?"
2020-02-04,jayrocksd,science,1,https://www.reddit.com/r/science/comments/eyizda/wuhan_coronavirus_likely_to_soon_be_declared_a/fgikp7q/,"Any other first-world country probably already has contingencies in place where they don't need to do this. In preparation for a possible outbreak, the US [just created 1000 hospital beds with a](https://coloradosun.com/2020/02/01/fort-carson-coronavirus-quarantine/) short phone call"
