date,author,subreddit,score,url,text
2020-03-05,axelarium,Destiny,6,https://www.reddit.com/r/Destiny/comments/fe07c2/how_would_bernie_fare_any_better_than_biden_in/fjl0vy8/,"A Biden campaign is a mirror image of the Hillary campaign, but as much as I loathe her she literally is a better candidate with a better record and she wasn't sundowning. It's wild watching us relitigate 2016 when we've already seen the result.

Trump is in an even better position than 2016 ( barring coronavirus actually devastating the economy which is certainly possible )."
2020-03-05,MandyDordt,Coronavirus,6,https://www.reddit.com/r/Coronavirus/comments/fdyt1k/in_one_of_the_worst_seasons_2018_for_flu_it/fjkzed1/,"I'll try. But talking to the Dutch is like talking to deaf people. They had a debate today in the Netherlands and one of the MP's came out with a story of a coranapatient. Whom asked for a week long to be tested and continuously been told no, after that week he and his wife was told to stay quiet. Just to call in sick, dont mention that you have coronavirus, do not tell the people you have been with that you have coronavirus. All of this was said by the GGD and RIVM. These are the people who are supposed to protect us in case of emergency. It was insane.
Also the debate was a live stream. So they couldn't prevent the video to come out to the public. 
AND STILL THESE DUTCHIES ARE ACTING LIKE IT'S NOTHING."
2020-03-05,COVIDhunter,CoronavirusUS,6,https://www.reddit.com/r/CoronavirusUS/comments/fdzsuh/we_made_the_brave_decision_to_go_against_the_herd/fjkzhx6/,"Its semantics, but at the current WHO figures, the worldwide fatality rate is 3.7 out of 100 people that contract coronavirus die.

I think its fair to say that 3700% greater than the fatality rate of the flu warrants that statement."
2020-03-05,wot_in_ternation,Seattle,6,https://www.reddit.com/r/Seattle/comments/fe0a9m/washington_state_to_cover_covid19_tests_for_the/fjliyck/,"The [Kiro 7](https://www.kiro7.com/news/local/copays-deductibles-coronavirus-testing-waived-by-emergency-order-washington-state/ZDVWP6AKLNG5VKRCKKL5MAZDUI/) article states that insurers must also ""suspend any prior authorization requirement for treatment or testing of COVID-19."" 

I assume you still need your doctor to order the test so if anyone says no it would be the doctor and not the insurance company.

There's also some requirements to allow patients to use out of network doctors if necessary."
2020-03-05,YoNoLoArrivote,argentina,6,https://www.reddit.com/r/argentina/comments/fe36l1/un_nuevo_video_muestra_la_secuencia_completa_del/fjljawt/,Qué esta semana no tocaba karmawhorear con el coronavirus?
2020-03-05,ElusoryThunder,rickygervais,6,https://www.reddit.com/r/rickygervais/comments/fdzlnz/karl_predicted_the_coronavirus_in_2020_in_his/fjlipr4/,Absolute twaddle. The coronavirus is neither a giant germ nor does it like eating chocolate. You're talkikg shit again
2020-03-05,jessyblorp,ChapoTrapHouse,6,https://www.reddit.com/r/ChapoTrapHouse/comments/fe1y9t/wapo_writers_truly_have_their_fingers_on_the_pulse/fjlopxy/,I’ve been putting a drop of miracle grow on my thigh every night for twenty years and I don’t even have coronavirus so basically I guess you could say I’m a scientist
2020-03-05,AR_Harlock,Coronavirus,6,https://www.reddit.com/r/Coronavirus/comments/fe1n0u/italian_tv_show_piazzapulita_was_just_inside_a/fjl6ejh/,"It was the Hospital of Cremona...
[this other video is inside the Milan one with the patient 1... not so crude but still...](https://www.la7.it/piazzapulita/video/coronavirus-dentro-lospedale-del-paziente-1-27-02-2020-310154)


In this other article the video promo of the report [here](https://corrieredellumbria.corr.it/news/attualita/1510980/piazzapulita-anticipazioni-ospiti-corrado-formigli-oggi-5-marzo-2020-la7-coronavirus-epidemia-covid19-cacciari-monti-sallusti-telese-padellaro.html)


A screen grab from the report[inside Cremona Hospital](https://imgur.com/gallery/E0h6TgS) mind you it’s only 60s for imgur and size limitation, you can watch it on the homepage of (la7.it/piazzapulita), full video inside the banner at the top (might not load from phone but pc works fine, sorry couldn’t do better I am honestly not that good :/)


Edit again: I should add some numbers, that hospital has 100 circa patient with corona, of which 11 in ICU, and 24 with aided (invasive and not) respiration , and that last one is what  scares me"
2020-03-05,anbeck,Coronavirus,6,https://www.reddit.com/r/Coronavirus/comments/fdxzbl/ger_now_302_cases_in_north_rhinewestphalia_197_of/fjkhxoe/,"""Let's not cancel carnival, let's not cancel football games, let's not close schools - [we might reconsider in 4-8 weeks](https://www.reddit.com/r/Coronavirus/comments/fduamf/germany_at_least_270_cases_in_north/fjkfae3?utm_source=share&utm_medium=web2x)...."""
2020-03-05,alwaysnevernotwrong,Coronavirus,6,https://www.reddit.com/r/Coronavirus/comments/fdycwz/italy_daily_update_148_deaths_41_414_recovered/fjkkw5o/,"Among the 3,296 active cases, 1,790 (54%) are hospitalized, 331 of which (representing 11% of active cases) are in intensive care.Among the 562 closed cases, 414 (74%) have recovered, 148 (26%) have died.

sauce:  [https://www.worldometers.info/coronavirus/](https://www.worldometers.info/coronavirus/)"
2020-03-05,CorbynSanders,Anxiety,6,https://www.reddit.com/r/Anxiety/comments/eupik4/coronavirus_megathread/fjkl3z7/,"Those Italian numbers are quite bad, but at least recoveries are going up.

Hospital outbreaks really can be horrible

Edit: read a comment on the r/coronavirus sub that they count people who have the virus but die due to other diseases such as cancer or heart attack count as a fatality.

And also fuck those people on the BNO twitter feed celebrating this and hoping for the worst."
2020-03-05,thecolumbokid,ReallyBigShow,6,https://www.reddit.com/r/ReallyBigShow/comments/fdyc6y/necks_level_thread_march_05_2020/fjl6wfn/,"Boys it’s happening Las Vegas has its first confirmed Coronavirus case today... Plenty of time for Mongo Fatt to fly it get it, spread it and bring it back to Cleveland"
2020-03-05,tdotz123,wallstreetbets,6,https://www.reddit.com/r/wallstreetbets/comments/fe22hg/what_are_your_moves_tomorrow_march_06_2020/fjluhvg/,"NEW: Officials in Sunnyvale, California, say a 72-year-old person has died despite officers performing CPR. It was later learned that this person had been on a cruise ship with 2 people suspected of having coronavirus. No further details yet.

Condolences to the family.

+1 for my puts"
2020-03-05,Walkingplankton,Coronavirus,6,https://www.reddit.com/r/Coronavirus/comments/fdr7u4/daily_discussion_post_march_05_questions_images/fjl9pca/,"Everett community college in Everett Washington USA has been closed for 3 days  for cleaning! I think it’s complete and utter bullshit that all schools in the region haven’t been closed sooner. 

http://www.everettcc.edu/administration/cwt-security/security/emergency-management/resources/covid-19-novel-coronavirus"
2020-03-05,twitterInfo_bot,Coronavirus,6,https://www.reddit.com/r/Coronavirus/comments/fe2k6s/coronavirus_has_officially_landed_here_in_las/fjlcl0v/,"""BREAKING: The Southern Nevada Health District has announced the first presumptive positive case of coronavirus disease 2019 (COVID-19) in a Clark County resident. Test results are considered “presumptive positive” until the result is confirmed by the CDC.
FULL STORY TO COME."" 
 
 >publisher: @fox5vegas"
2020-03-05,mellyjohnson11,orangecounty,6,https://www.reddit.com/r/orangecounty/comments/fdzc4w/oc_coronavirus_health_officials_reaching_out_to/fjlcnga/,"What do you think will happen here? Our hospitals are already over run with people with things other than the Coronavirus...if everyone the has a cough and fever runs to the ER, it wont be good."
2020-03-05,DidWeGetPlayed,blogsnark,6,https://www.reddit.com/r/blogsnark/comments/fcandz/politics_and_current_events_mar_02_mar_08/fjlcp0n/,"Pence said that there aren't enough coronavirus tests to test everyone who needs it:

“We don’t have enough tests today to meet what we anticipate will be the demand going forward,” Pence told reporters following a meeting with his coronavirus task force and executives from 3M in Minnesota."
2020-03-05,forty4swagnum,wallstreetbets,6,https://www.reddit.com/r/wallstreetbets/comments/fdtomr/daily_discussion_thread_march_05_2020/fjklvzh/,">Wall Street wants more than Fed rate cuts to deal with the coronavirus scare

Rate cuts are the cure!"
2020-03-05,Whatisthiswinter,nfl,6,https://www.reddit.com/r/nfl/comments/fdy8jb/thursday_talk_thread_yes_thats_the_thread_name/fjkm6pm/,"Coronavirus tornadoes, fuck me sideways"
2020-03-05,LH99,technology,6,https://www.reddit.com/r/technology/comments/fe18s0/bernie_sanders_we_need_scientists_not_politicians/fjlb2t3/,"But . . .  Trump's hunch. I don't care what side of this guy you're on: this is the most whacked out shit. Totally and irredeemably irresponsible for a world leader to spew nonsense about a potential global epidemic. What a moron.

[https://www.politico.com/news/2020/03/05/trump-disputes-coronavirus-death-rate-121892](https://www.politico.com/news/2020/03/05/trump-disputes-coronavirus-death-rate-121892)  


\[edit\] if you're on his side and believe his hunch over the world health organization, then by all means don't have children."
2020-03-05,Titan67,crssdfest,6,https://www.reddit.com/r/crssdfest/comments/fe1nri/hotel_room_for_sale/fjld2bc/,"That would be amazing, if catching the coronavirus is the price I pay to see Carl Cox at a not “shit show crowded” City Steps then so be it."
2020-03-05,Defacto_Champ,Atlanta,6,https://www.reddit.com/r/Atlanta/comments/fdoytw/ratlanta_coronavirus_covid19_mega_thread/fjj64ao/,"I’m pretty fucking pissed that a man returning from the outbreak zone of Milan, Italy would send his kids to school even when he was feeling under the weather himself. The guy showed complete ignorance to allow that to happen when he knew that there was potential it could be the Coronavirus"
2020-03-05,lightingbolt50,neoliberal,6,https://www.reddit.com/r/neoliberal/comments/fd99hp/discussion_thread/fjj6o1e/,"Both Joe Biden and Bernie Sanders catch the coronavirus right before the convention, with even delegate totals and an assured brokered convention. Obviously they are receiving great medical care, but are at significant risk due to their age. What happens at the convention?"
2020-03-05,computerTechnologist,Coronavirus,6,https://www.reddit.com/r/Coronavirus/comments/fdqkri/up_to_100k_israeli_citizens_in_quarantine_after/fjj8o62/,"Yes, exactly. Especially the United States.

Currently in Israel there are only 15 coronavirus cases and they are barely spreading, so these very aggressive regulations seem to absolutely do the job"
2020-03-05,barbieonspeed,China_Flu,6,https://www.reddit.com/r/China_Flu/comments/fdqm1i/coronavirus_attacks_the_central_nervous_system/fjj91d6/,The coronavirus may be able to invade the central nervous system and cause neurological damage that results in people losing control of their breathing. It may be chronic as well. ([Source](https://onlinelibrary.wiley.com/doi/pdf/10.1002/jmv.25728))
2020-03-05,barbieonspeed,China_Flu,6,https://www.reddit.com/r/China_Flu/comments/fdqm1i/coronavirus_attacks_the_central_nervous_system/fjj9moj/,"“According to the WHO, SARS punched holes in the lungs, giving them “a honeycomb-like appearance”—and these lesions are present in those afflicted by novel coronavirus, too.” ([National Geographic](https://www.nationalgeographic.com/science/2020/02/here-is-what-coronavirus-does-to-the-body/))"
2020-03-05,mmmm_pandas,BeautyGuruChatter,6,https://www.reddit.com/r/BeautyGuruChatter/comments/fdlnuz/discussion_jaclyn_hill_hasnt_posted_on_youtube_or/fjj7lhn/,"At this point we need a counter. 

""It's been __ days since someone asked why JH hasn't posted anything"". 

She's not a good person, but the coronavirus wasn't a JHxMorphe collab."
2020-03-05,exazonk,australia,6,https://www.reddit.com/r/australia/comments/fdq9gr/a_little_rant_about_coronavirus/fjj7ml9/,"Read these two articles and take note of the graphs as well.

[https://virologydownunder.com/so-you-think-youve-about-to-be-in-a-pandemic/?fbclid=IwAR0amEsbnHM8BKsUeA21tPqBEDxo15L26TPfgiGE\_7CKdQRl4xoGEKW2Qcg](https://virologydownunder.com/so-you-think-youve-about-to-be-in-a-pandemic/?fbclid=IwAR0amEsbnHM8BKsUeA21tPqBEDxo15L26TPfgiGE_7CKdQRl4xoGEKW2Qcg) 

&#x200B;

[https://medium.com/@amwren/forget-about-the-death-rate-this-is-why-you-should-be-worried-about-the-coronavirus-890fbf9c4de6](https://medium.com/@amwren/forget-about-the-death-rate-this-is-why-you-should-be-worried-about-the-coronavirus-890fbf9c4de6)"
2020-03-05,Usual_Platypus,Coronavirus,6,https://www.reddit.com/r/Coronavirus/comments/fdqldr/polis_activates_colorados_emergency_response_to/fjj8v18/,"If you want to follow Colorado's testing status https://www.colorado.gov/pacific/cdphe/2019-novel-coronavirus

That page also details the scenarios they will run tests in, so far it only includes travel or known exposures, and hospitalized people with respiratory symptoms"
2020-03-05,immensethrowaway,holdmyfeedingtube,6,https://www.reddit.com/r/holdmyfeedingtube/comments/fdnyio/hmft_after_i_break_whatever_i_had_left_that_wasnt/fjj8u2l/,Too dangerous.  All the kids are snotting and spitting on the safe box buttons with their coronavirus.  Better to tumble down an escalator.  It's not like they will end up in a wheelchair.
2020-03-05,sch1agenheim,Anxiety,6,https://www.reddit.com/r/Anxiety/comments/eupik4/coronavirus_megathread/fjkpaj9/,r/coronavirus and a number of other covid subs are absolutely filled with conspiracy theorists and doomer enthusiasts burying actual info beneath hysteria. I don’t recommend checking those subreddits at all.
2020-03-05,Mjh22799,ChapoTrapHouse,6,https://www.reddit.com/r/ChapoTrapHouse/comments/fdpyr6/pokemon_shield_my_eyes_from_all_your_awful_posts/fjkqotd/,Legit concerned Bernie will get coronavirus with how fast it’s spreading and how much travel he does
2020-03-05,imanauthority,udub,6,https://www.reddit.com/r/udub/comments/fdxsfv/we_need_to_get_organized_to_get_class_cancelled/fjksgl1/,"The death rate is 10-20 times that of flu and at least twice as contagious

https://www.livescience.com/new-coronavirus-compare-with-flu.html"
2020-03-05,Bellamy13,Coronavirus,6,https://www.reddit.com/r/Coronavirus/comments/fdwg6v/liverpool_fc_manager_jurgen_klopp_when_asked/fjkxw42/,"His job is to take care of everything about football side of the club. For example, he doesn't make deals with sponsors or curates charity activities. 
 And Liverpool just released the statement about coronavirus ."
2020-03-05,Wolferalpha1872,memes,6,https://www.reddit.com/r/memes/comments/fe0rxh/the_grossest_thing_ever/fjl197z/,Be thankful that the coronavirus is a thing now
2020-03-05,Awakeat5amagain,Coronavirus,6,https://www.reddit.com/r/Coronavirus/comments/fe0vu8/blood_drive_cancellations_amid_coronavirus/fjl1xyq/,"Can the coronavirus be in the blood??

That’s what happened in the early days of HIV/AIDS. People were getting AIDS from blood transfusions"
2020-03-05,Chesp1n,memes,6,https://www.reddit.com/r/memes/comments/fdt5dq/them_aussies_eh/fjl56lq/,"Some guy said that diarrhoea is a symptom or Coronavirus (spoiler alert: it’s not), and the absolute idiots that populate this country decided that they needed to buy twelve 24 packs at once. This causes a domino effect, meaning even non idiotic people need to scramble to take a shit"
2020-03-05,DontEatFishWithMe,VoteBlue,6,https://www.reddit.com/r/VoteBlue/comments/fdsotm/daily_roundtable_for_march_05_2020/fjl2tr9/,I really hope our presidential candidates are taking extreme precautions not to get the coronavirus. Having to shake hands with hundreds of people every day seems like a recipe for disaster.
2020-03-05,Cumkin,Coronavirus,6,https://www.reddit.com/r/Coronavirus/comments/fe18s4/not_enough_coronavirus_tests_to_meet_us_demand/fjl4lpr/,"BbBbut I was told that USA gOnNa tEST 1,500,000 people by the end of the week

Source: Ok close to a million instead  
[https://www.msn.com/en-us/news/us/close-to-a-million-could-be-tested-for-the-coronavirus-this-week-health-official-says/ar-BB10Elgm?li=BBnb7Kz](https://www.msn.com/en-us/news/us/close-to-a-million-could-be-tested-for-the-coronavirus-this-week-health-official-says/ar-BB10Elgm?li=BBnb7Kz)   


Lol"
2020-03-05,Terry_P_Aids,barstoolsports,6,https://www.reddit.com/r/barstoolsports/comments/fdt3e1/free_talk_thursday/fjl4p9l/,Would rather coronavirus than work for that toilet bank. Maybe.
2020-03-05,ImaginaryHotel2,neoliberal,6,https://www.reddit.com/r/neoliberal/comments/fdrhww/discussion_thread/fjl6azu/,[COVID 19 lung scarring similar to SARS](https://news.sky.com/story/coronavirus-how-does-covid-19-attack-the-human-body-11947643)
2020-03-05,NintendoTodo,Coronavirus,6,https://www.reddit.com/r/Coronavirus/comments/fdr7u4/daily_discussion_post_march_05_questions_images/fjladze/,"can we get a survived coronavirus badge after it ends

edit: im leaving for chicago tomorrow, wish me luck"
2020-03-05,CrystalMenthol,news,6,https://www.reddit.com/r/news/comments/fbvz7n/covid19_megathread_4/fjley89/,"Congratulations!

Some doctors working on Coronavirus actually did an AMA over in /r/coronavirus yesterday, and somebody asked [this same question](https://www.reddit.com/r/Coronavirus/comments/fdf5fq/we_are_a_team_of_medical_experts_following/fjgzf1x/).  The answer is about as reassuring as it can be for this situation - they don't think pregnant women are at increased risk, and kids in general seem to do just fine.  There hasn't been enough time to collect a whole lot of data, but right now it doesn't look like it's particularly harmful to healthy pregnant women or their babies.

Of course, you'll naturally want to be extra careful, so feel free to use any excuse you're comfortable using to take it easy for a while."
2020-03-05,LargeMagician7,Wuhan_Flu,6,https://www.reddit.com/r/Wuhan_Flu/comments/fe2nu1/wtf_is_the_plan_i_keep_seeing_these_numbers_go_up/fjldv76/,"Trump accused the democrats of wanting millions to die. 

www.theguardian.com/world/2020/mar/05/theyre-rooting-for-the-coronavirus-trump-allies-attack-democrats-and-the-media

The democratic lead house then passed 8 billion to combat coronavirus, 6 billion more than the White House wanted to provide

https://www.google.com/amp/s/www.wsj.com/amp/articles/congress-reaches-8-billion-deal-to-combat-coronavirus-11583343193

Then trump went on to tell the population that going to work with the coronavirus is no big deal 

https://www.politico.com/news/2020/03/05/trump-disputes-coronavirus-death-rate-121892

Trump is definitely doing something."
2020-03-05,munioko,argentina,6,https://www.reddit.com/r/argentina/comments/fe2uf1/dame_el_partido_político_mas_nefasto_no_no_tan/fjleu6e/,Viva el coronavirus
2020-03-05,Drgntrnr,baseball,6,https://www.reddit.com/r/baseball/comments/fe2fhm/darvish_yu_darvish_started_coughing_so_his/fjleelk/,"So his relatives came over from Iran and gave him Coronavirus......you assume this because he’s half Iranian. 

How’s art school goin for ya?"
2020-03-05,One_Curious_Jay,Coronavirus,6,https://www.reddit.com/r/Coronavirus/comments/fe2tr5/a_member_of_the_french_parliement_confirmed/fjlfqqr/,"""*It's free real estate*"" - Coronavirus"
2020-03-05,profanitymanatee,TalesFromThePharmacy,6,https://www.reddit.com/r/TalesFromThePharmacy/comments/fe4tu9/this_has_been_the_most_stressful_week_in_pharmacy/fjm85co/,"We’ve had to limit how much hand sanitizer we are allowing people to buy. Masks have been out of stock for two weeks. Rubbing alcohol? Gone. Gloves? Gone.

 A lady called saying she’s feeling sick and she thinks she has the coronavirus what should she do. Why do these people.. Where do they get our number? What was the pharmacist gonna do for her over the phone? Go to the damn hospital"
2020-03-05,InfowarriorKat,CoronavirusUS,6,https://www.reddit.com/r/CoronavirusUS/comments/fe7e2s/err_on_the_side_of_safety/fjmezwo/,"I'm dealing with this with my significant other. Today when I tried to give him all the updates he said ""ok you've had your 5 minutes of Coronavirus talk. You're done."" 😔"
2020-03-05,twitterInfo_bot,Coronavirus,6,https://www.reddit.com/r/Coronavirus/comments/fe83d3/new_case_from_philippines_no_travel_history/fjmesqa/,"""BREAKING: Department of Health confirms two new cases of coronavirus in the Philippines "" 
 
 >publisher: @cnnphilippines"
2020-03-05,asdzhang,Coronavirus,6,https://www.reddit.com/r/Coronavirus/comments/fe7m2b/coronavirus_can_also_attack_the_nervous_system/fjmcz6i/,"It’s not the flu, Coronavirus is a complete different virus than influenza. This a cousin of SARS and MERS which made almost everyone pee their pants. Even if you recovered, you still have to suffer having your lungs being damage."
2020-03-05,Versatile_Investor,neoliberal,6,https://www.reddit.com/r/neoliberal/comments/fdrhww/discussion_thread/fjmcxaf/,"So the doomsday coronavirus preppers in my neighborhood don’t seem to understand that assuming water and electricity get shut off then it’s very likely law and order will be on the verge of breaking down. 

What’s to stop myself and a large group from taking the mountain of bottled water and toilet paper you got from Costco?

Edit: forgot to add, I have guns as well."
2020-03-05,BayouButters,Coronavirus,6,https://www.reddit.com/r/Coronavirus/comments/fe3cno/no_you_wont_contract_coronavirus_from_a_package/fjlj32l/,Can't contract coronavirus from packages if nobody sends me packages.
2020-03-05,BlueKnightJoe,wallstreetbets,6,https://www.reddit.com/r/wallstreetbets/comments/fdtomr/daily_discussion_thread_march_05_2020/fjkgowa/,"Of course he got coronavirus, he's been kissing Chinese ass"
2020-03-05,uninfinity,wallstreetbets,6,https://www.reddit.com/r/wallstreetbets/comments/fe22hg/what_are_your_moves_tomorrow_march_06_2020/fjm04k6/,***Mainland China reports 143 additional cases of coronavirus and 30 additional deaths on March 5th vs. Prev. 149 additional cases and 31 additional deaths on March 4th***
2020-03-05,journey333,Coronavirus,6,https://www.reddit.com/r/Coronavirus/comments/fe5jn5/seattlearea_officials_buy_4_million_quarantine/fjlyoau/,"NYC has almost 3000 people under quarantine, according to this [article](https://www.nytimes.com/2020/03/05/nyregion/coronavirus-new-york-cases.html) so I imagine so."
2020-03-05,Timpa87,Coronavirus,6,https://www.reddit.com/r/Coronavirus/comments/fe3qdr/though_over_2700_nyc_residents_are_quarantined/fjlmfh2/,"I think we are like 1% into the actual Coronavirus Pandemic in the US and I expect more people will be infected here than in China just because of ""freedom"" to ignore medical advice and lack of willingness of the Government to make tough choices(especially in an election year)"
2020-03-05,mrmanager237,neoliberal,6,https://www.reddit.com/r/neoliberal/comments/fdrhww/discussion_thread/fjlobzk/,"Sorry pal that Trump's policies said pee pee poo poo to ppl vulnerable to coronavirus, women with risky pregnancies, the uninsured, non-whites, and the global poor who will die in heatwaves, but you can't shame me into voting for Sleepy Joe because the **only** acceptable solution t9 all problems in America is a  revolution that will fully implement Maoist-Jucheist-Posadism, but I will meet you halfway if Biden proposes socialism and will begrudgingly leave my Brookkyn apartment to vote for him"
2020-03-05,DrUNC83,wallstreetbets,6,https://www.reddit.com/r/wallstreetbets/comments/fe22hg/what_are_your_moves_tomorrow_march_06_2020/fjlroqg/,"“Stocks in Asia were set to drop at the open as volatility continues to grip the markets amid investor concerns over the global coronavirus outbreak.”

Yes... tell me more"
2020-03-05,mizzaks,antiMLM,6,https://www.reddit.com/r/antiMLM/comments/fe4q5c/sanity_in_a_moms_group/fjm2bk0/,I’m in the Pacific Northwest about an hour from where most of the nation’s deaths due to coronavirus are occurring. This is what it looks like here. I’m surprised to hear it’s this way outside of this area!
2020-03-05,hemlocky_ergot,Coronavirus,6,https://www.reddit.com/r/Coronavirus/comments/fe0t6k/a_california_man_who_selfquarantined_after/fjm16eq/,"No, I think a similar thing is going on in South Korea.  My mom is South Korean and told me a story she heard in the news (we both live in America, but she watches the South Korean news).  As you know, many older people have issues with technology or mobility and as a result, aren't able to get masks since they announce where masks are on the internet.  The young people buy masks and drop them off at senior centers since the older people need it more.  She also told me that so many people are volunteering to go to Daegu that they don't have enough openings for everyone who wants to go.   


Yeah, those are feel good stories you'd hear in the news, but at the same time it's a very Korean thing.  South Koreans have spent generations digging themselves out of grinding poverty and sacrificing for future generations.  That is how they become so successful economically.  I think it is is this Confucian mentality that will help them be successful in fighting Coronavirus and that the younger generations will see that its their time to fight for the old.  When push comes to shove, people will put themselves on the line to save the collective whole.   This is something that i don't think we are going to see in the West."
2020-03-05,alex_verity,AskReddit,6,https://www.reddit.com/r/AskReddit/comments/fe4ftd/whats_something_that_was_really_hyped_up_but/fjlpza2/,Coronavirus
