date,author,subreddit,score,url,text
2020-02-15,autotldr,worldnews,1,https://www.reddit.com/r/worldnews/comments/f46dz8/cdc_contradicts_trump_coronavirus_wont_just_go/fhof94n/,"This is the best tl;dr I could make, [original](https://hillreporter.com/cdc-contradicts-trump-coronavirus-wont-just-go-away-by-april-we-dont-know-a-lot-about-this-virus-58234) reduced by 70%. (I'm a bot)
*****
> Just days after President Donald Trump acted nonchalant about the potential spread of the coronavirus in the United States, the director of the CDC contradicted his statements, making the case that the virus was going to be here for quite some time.

> &quot;A lot of people think that goes away in April with the heat. Typically that will go away in April. We&#039;re in great shape&quot; Trump said to reporters earlier this week.

> On Thursday, in an interview with CNN, CDC Director Dr. Robert Redfield explained that the virus was not something that was simply going to go away so quickly.


*****
[**Extended Summary**](http://np.reddit.com/r/autotldr/comments/f46hy5/cdc_contradicts_trump_coronavirus_wont_just_go/) | [FAQ](http://np.reddit.com/r/autotldr/comments/31b9fm/faq_autotldr_bot/ ""Version 2.02, ~468674 tl;drs so far."") | [Feedback](http://np.reddit.com/message/compose?to=%23autotldr ""PM's and comments are monitored, constructive feedback is welcome."") | *Top* *keywords*: **virus**^#1 **Trump**^#2 **Redfield**^#3 **beyond**^#4 **April**^#5"
2020-02-15,DiamanteNegroFan,brasil,1,https://www.reddit.com/r/brasil/comments/f3s753/prévia_do_pib_do_banco_central_indica_que/fhofers/,"Sorte que o coronavirus vá ser boa excusa para o 0,025%  do PBI no 2020"
2020-02-15,Ignis_40hrs,memes,1,https://www.reddit.com/r/memes/comments/f46aae/here_we_go_again/fhoeorr/,I see you are a man of culture as well calling the virus COVID-19 and not coronavirus. I thank you.
2020-02-15,AutoModerator,news,1,https://www.reddit.com/r/news/comments/f46fk0/au_beefs_up_preparedness_for_coronavirus_outbreak/fhoewfz/,"Your post was automatically removed for being about the coronavirus. Please use the update thread [here](https://www.reddit.com/r/news/comments/ezo8xn/coronavirus_megathread_2/).

*I am a bot, and this action was performed automatically. Please [contact the moderators of this subreddit](/message/compose/?to=/r/news) if you have any questions or concerns.*"
2020-02-15,Royalpipeline,China_Flu,1,https://www.reddit.com/r/China_Flu/comments/f2undw/call_from_texas_med_clinic_about_our_son_who_is/fhofcyt/,Exactly! I just reposted in Coronavirus.. I ask for what reason and they said it’s just better to post somewhere else... I tried to post somewhere else and it at first said I didn’t have enough karma? But I now can... weird stuff for sure.
2020-02-15,cursed_mods,cursedcomments,1,https://www.reddit.com/r/cursedcomments/comments/f44tas/cursed_coronavirus/fhoe2d0/,"Hey there, RadiatGarlic79! thanks for posting to /r/cursedcomments!!

Unfortunately, your submission ""*Cursed Coronavirus*"" has been removed for the following reason(s):

---

**Rule 1: Reposting** - Re-posting is not tolerated. It's annoying. Find something else to post or don't post it at all. Reposting anything from the [album of common reposts](https://old.reddit.com/r/cursedcomments/comments/bucr5t/every_image_in_this_album_with_be_removed_and_the/) may result in a seven day ban.

---

*^If ^you ^have ^any ^questions, ^you ^can ^message ^the ^mod ^team ^through ^[modmail](https://www.reddit.com/message/compose?to=/r/cursedcomments) ^Replies ^to ^this ^removal ^comment ^will ^not ^be ^answered.* ^(Reposting a removed post without express moderator approval will result in a ban.)"
2020-02-15,zobire,u_zobire,1,https://www.reddit.com/r/u_zobire/comments/f46bk4/corona_virus_what_security_measures_are_being/fhoeclz/,Corona Virus: What security measures are being taken to prevent it in Pakistan?The NIH has ruled out the presence of coronavirus among five patients ... has since been quarantined in an effort to prevent the spread of the viral outbreak. ... students in China had been informe
2020-02-15,IncredibleHamTube,iamatotalpieceofshit,1,https://www.reddit.com/r/iamatotalpieceofshit/comments/f43zxn/whoever_did_this/fhoedv4/,Because he didn't have the Coronavirus dumbass. Do I need to break out the fucking crayons for you?
2020-02-15,toastedquestion,memes,1,https://www.reddit.com/r/memes/comments/f45ykk/i_gotchu_mrbeast/fhoeta0/,"Sorry Mr Beast, your valentines day post can **not** get Coronavirus."
2020-02-15,acaiblueberry,Coronavirus,1,https://www.reddit.com/r/Coronavirus/comments/f46at8/japan_update_its_out_of_control/fhof46v/,"I thought this coronavirus was highly infectious but lower mortality/severity, but am starting to doubt the latter."
2020-02-15,HALOSECRETS,Egypt,1,https://www.reddit.com/r/Egypt/comments/f3zx03/i_wanted_to_be_the_first_to_congratulate_the/fhofikh/,"Yo, they have also been checked for the coronavirus, and I bet after they have found out that there was a person with the coronavirus, they would have taken everyone who was on the plane for a further inspection."
2020-02-15,beatmydoglikewiz,iamatotalpieceofshit,1,https://www.reddit.com/r/iamatotalpieceofshit/comments/f43zxn/whoever_did_this/fhofkyp/,They beat him up because he was Asian and the coronavirus is from China. In the bullies minds Asian = Chinese and Chinese = coronavirus
2020-02-15,PeenJoke,FashionReps,1,https://www.reddit.com/r/FashionReps/comments/f46is5/corona_virus/fhogzsp/,"Coronavirus will not spread through parcels most likely, since they most likely cannot survive through parcels and long periods of time, especially since the main transmitting is through indirect contact ie sneezing, coughing, and stuff like that. however, might be safe to leave it outside and cool for an hour or something, despite the chances of getting infected near impossible."
2020-02-15,jaegren,tacticalgear,1,https://www.reddit.com/r/tacticalgear/comments/f41wbk/are_you_coronavirus_ready/fhoh08r/,*When you think that the coronavirus is a xenomorph*
2020-02-15,MyCodeIsCompiling,worldnews,1,https://www.reddit.com/r/worldnews/comments/eyq5vp/live_thread_wuhan_coronavirus/fhoh8fs/,"[3 days average with the potential to go up to 24 days asymptomatic spread](https://www.pharmaceutical-technology.com/news/coronavirus-study-incubation-period/), [with a chance of it surviving on surfaces and remain infectious up to 9 days, average of 5 days if it's like other coronaviruses](https://www.sciencealert.com/study-shows-just-how-long-coronaviruses-can-stick-around-on-a-surface) So basically, on average, a host has the potential walk around and infect others and surfaces in places they'd commonly visit for 3 days, and those surfaces probably can infect for another 5 if not disinfected. For comparison, [most common causes of the flu normally don't remain infectious on surfaces for more than 24hrs,](https://www.nhs.uk/common-health-questions/infections/how-long-do-bacteria-and-viruses-live-outside-the-body/) and [is contagious for about a day before symptoms develop](https://www.healthline.com/health/how-long-does-the-flu-last#contagious)"
2020-02-15,hadiisaboss,Meme_Battles,1,https://www.reddit.com/r/Meme_Battles/comments/f46to2/a_great_threat/fhoh8cz/,"No coronavirus is the family not sars

SARS is a member of the coronavirus family though"
2020-02-15,Cross-ZMagma,newzealand,1,https://www.reddit.com/r/newzealand/comments/f451mw/coronavirus_auckland_mayor_phil_goff_sickened_at/fhoh8xw/,"lots of anti-chinese sentiment in the west before the virus, the coronavirus has just made that sentiment that much worse"
2020-02-15,SoVerySleepy81,iamatotalpieceofshit,1,https://www.reddit.com/r/iamatotalpieceofshit/comments/f43zxn/whoever_did_this/fhohbxj/,"His head is packed too full of sand, you're not going to get through to him. Some people have a really hard time with logical conclusions, also I'm going to bet he hasn't seen the news stories about people being shitty to Asian people because of coronavirus."
2020-02-15,mercier153,worldnews,1,https://www.reddit.com/r/worldnews/comments/f3t94f/coronavirus_covid19_sees_500_million_people_in/fhohcfm/,"Cant say ive heard anyone call it Wuhan virus myself, I've only ever heard it called Coronavirus on the news and in papers"
2020-02-15,AutoModerator,news,1,https://www.reddit.com/r/news/comments/f46xtk/the_nba_is_all_in_to_support_the_fight_against/fhohe2f/,"Your post was automatically removed for being about the coronavirus. Please use the update thread [here](https://www.reddit.com/r/news/comments/ezo8xn/coronavirus_megathread_2/).

*I am a bot, and this action was performed automatically. Please [contact the moderators of this subreddit](/message/compose/?to=/r/news) if you have any questions or concerns.*"
2020-02-15,AutoModerator,news,1,https://www.reddit.com/r/news/comments/f46xso/67dayold_coronavirus_patient_discharged_from/fhohdzg/,"Your post was automatically removed for being about the coronavirus. Please use the update thread [here](https://www.reddit.com/r/news/comments/ezo8xn/coronavirus_megathread_2/).

*I am a bot, and this action was performed automatically. Please [contact the moderators of this subreddit](/message/compose/?to=/r/news) if you have any questions or concerns.*"
2020-02-15,AutoModerator,news,1,https://www.reddit.com/r/news/comments/f46xuq/china_at_most_crucial_stage_of_novel_coronavirus/fhohe7e/,"Your post was automatically removed for being about the coronavirus. Please use the update thread [here](https://www.reddit.com/r/news/comments/ezo8xn/coronavirus_megathread_2/).

*I am a bot, and this action was performed automatically. Please [contact the moderators of this subreddit](/message/compose/?to=/r/news) if you have any questions or concerns.*"
2020-02-15,CheekyEmu,worldnews,1,https://www.reddit.com/r/worldnews/comments/f3u8y8/men_appear_to_be_more_vulnerable_to_coronavirus/fhoirq6/,"Sorry, coronavirus is transphobic."
2020-02-15,Bumpy_Nugget,Coronavirus,1,https://www.reddit.com/r/Coronavirus/comments/f46zw0/perhaps_this_is_a_reason_for_no_us_members_on_who/fhoj25i/,"This isn't a political discussion board.

It's a coronavirus discussion sub.

If this virus brings any silver lining, i hope it finally puts an end to the insufferable idiots who inject politics into every single discussion they have."
2020-02-15,Charlie_Mouse,worldnews,1,https://www.reddit.com/r/worldnews/comments/f3t94f/coronavirus_covid19_sees_500_million_people_in/fhojeye/,"You do realise that “novel 2019 coronavirus”
just means “new Coronavirus we don’t have an official name for yet”, right? And now it has an official name."
2020-02-15,jeredditdoncjesuis,thenetherlands,1,https://www.reddit.com/r/thenetherlands/comments/f3qy4p/om_gaat_coronalied_op_strafbaarheid_beoordelen_na/fhojkrg/,"Voor jou is het een storm in een glas water, maar dat is makkelijk praten als je niet dagelijks ‘stinkchinees’ of ‘jakkes coronavirus’ naar je hoofd krijgt. Iemand kan iets racistisch doen of zeggen zonder dat hij ‘fulltime racist’ is. Die DJ’s zijn vast toffe mensen die geen diepere agenda van Chinezenhaat hebben, maar het mag in Nederland wel wat vaker worden benoemd dat we racisme heel makkelijk afdoen - met name de mensen die zelf niet echt een idee hebben van hoe kut het voelt om gediscrimineerd te worden.

Betekent dat dat ik zelf nooit een op ras gebaseerd grapje heb gemaakt? Nee. Maar als ik zulke grapjes in een lied had gemaakt dat het hele land door zou gaan, zou ik er begrip voor hebben dat ik er niet alleen van afkwam met een ‘nee sorry joh ik ben helemaal geen racist ik wilde enkel vermaken’ en er wat meer fallout zou zijn."
2020-02-15,swerm,China_Flu,1,https://www.reddit.com/r/China_Flu/comments/f47jpn/france_reports_1st_death_from_coronavirus_first/fhokg0o/,It was a chinese tourist First coronavirus death confirmed in Europe https://www.bbc.co.uk/news/world-europe-51514837
2020-02-15,burningbun,Coronavirus,1,https://www.reddit.com/r/Coronavirus/comments/f47ir4/how_safe_is_it_receiving_packages_by_post/fhol1dn/,"https://www.dailymail.co.uk/health/article-8004761/Hand-dryers-wont-kill-coronavirus-World-Health-Organization-debunk-10-biggest-myths.html

2. Ultraviolet lamps cannot sterilise the skin 

Ultraviolet lamps, which pump UV rays into the skin, will not sterilise the skin.

They could, however, cause skin irritation, the WHO warned. 

Long term, UV radiation which also comes from the sun can damage the DNA in cells, which in turn may lead to cancer. It's for this reason that tanning beds are advised against. 

Hospitals and laboratories often use ultraviolet UV light to kill microbes, but never use it around humans."
2020-02-15,AutoModerator,news,1,https://www.reddit.com/r/news/comments/f480i0/first_european_coronavirus_death_in_france/fhome93/,"Your post was automatically removed for being about the coronavirus. Please use the update thread [here](https://www.reddit.com/r/news/comments/ezo8xn/coronavirus_megathread_2/).

*I am a bot, and this action was performed automatically. Please [contact the moderators of this subreddit](/message/compose/?to=/r/news) if you have any questions or concerns.*"
2020-02-15,EpicFishFingers,JusticeServed,1,https://www.reddit.com/r/JusticeServed/comments/ep3as6/dog_killer_dies_after_pet_owner_rams_him_into_a/fhoj5uj/,*Chinese knockoff of Chinese coronavirus has entered the chat*
2020-02-15,MarkdownShadowBot,ShadowBan,1,https://www.reddit.com/r/ShadowBan/comments/f47m66/and/fhokkgf/,"Hi /u/duke998, **you're not shadowbanned**, but 3 of your most recent 131 comments/submissions were removed (either automatically or by human moderators).

### Comments:

`fhkacah` in `Coronavirus` on 14 Feb 20 (-4pts):

> fuk India

### Submissions:

`ezr3uo` in `China_Flu` on 06 Feb 20 (0pts):

> Is it right for the entity that creates the first successful vaccine to profit?

`elhsru` in `Bitcoin` on 07 Jan 20 (1pts):

> Looking for a good TA channel.

***

I'm a bot. My home is at [/r/CommentRemovalChecker - check if your posts have been removed!](/r/CommentRemovalChecker) ([How to use](https://www.reddit.com/r/CommentRemovalChecker/comments/9u0zes/how_to_use_what_is_this/))

[Help us expose and stand up to social media bias and censorship!](https://www.patreon.com/blessbots)"
2020-02-15,housefire25,iamatotalpieceofshit,1,https://www.reddit.com/r/iamatotalpieceofshit/comments/f43zxn/whoever_did_this/fhokx1d/,This is the thing that pisses me off most about Coronavirus
2020-02-15,Mekachi,iamatotalpieceofshit,1,https://www.reddit.com/r/iamatotalpieceofshit/comments/f43zxn/whoever_did_this/fholy46/,"Coronavirus is a generalized term for a respiratory illness, it covers colds and flus, but it has many strands. The ""current"" coronavirus is a new strand that we don't have a vaccine for and is highly contagious (like many flus). That is why it is dangerous for people, and by people mostly elderly, children, and immunocompromised people. The general healthy person is most likely to fight off the illness and be fine, they just have to be quarantined like any flu patient so they don't get others sick."
2020-02-15,ClickableLinkBot,Bannedfromcoronavirus,1,https://www.reddit.com/r/Bannedfromcoronavirus/comments/f46qfy/permanently_banned_from_both_rchina_flu_and/fhoiy3m/,"##r/coronavirus
---------------------------------------------
^(For mobile and non-RES users) ^| 
[^(More info)](https://np.reddit.com/r/botwatch/comments/6xrrvh/clickablelinkbot_info/) ^| 
^(-1 to Remove) ^| 
[^(Ignore Sub)](https://np.reddit.com/r/ClickableLinkBot/comments/e0e9fg/ignore_list/)"
2020-02-15,Emgild,RealTesla,1,https://www.reddit.com/r/RealTesla/comments/f1pg2m/tsla_megathread_week_of_february_10_2020/fhompy3/,"France announced the first coronavirus death outside Asia. An 80-year-old Chinese tourist died at a hospital in Paris on Friday.

&#x200B;

[https://www.theguardian.com/world/2020/feb/15/chinese-tourist-in-france-becomes-europes-first-coronavirus-fatality](https://www.theguardian.com/world/2020/feb/15/chinese-tourist-in-france-becomes-europes-first-coronavirus-fatality)"
2020-02-15,musr,China_Flu,1,https://www.reddit.com/r/China_Flu/comments/f422rr/facebook_amazon_and_google_met_with_who_to_figure/fhomrnm/,"> Facebook, Amazon and Google met with WHO to figure out how to stop coronavirus misinformation

If only it was like this:

> Facebook, Amazon and Google met with WHO to figure out how to stop coronavirus _misinformation_ transmission"
2020-02-15,flashluther,Coronavirus,1,https://www.reddit.com/r/Coronavirus/comments/f41qij/ashamed_to_admit_i_did_not_consider_the_impact/fhok9eq/,Nothing to do with racism. Since the outbreak have you noticed more Chinese people? I seem to see a lot more than I did before and I'm certainly no rascist. The chances of a Chinese person having Coronavirus is probably statistically higher than anyone else - purely because they could have had a relative/friend from China contact. That's not racism but common sense.
2020-02-15,Loremus,leagueoflegends,1,https://www.reddit.com/r/leagueoflegends/comments/f43th6/is_there_a_pro_team_ranking_list/fhokhcz/,"https://www.espn.com/esports/story/_/id/28672178/league-legends-power-rankings-feb-10
Only this and it's released almost every week (It's not including LPL, because of coronavirus break)"
2020-02-15,Painfullyempty,Coronavirus,1,https://www.reddit.com/r/Coronavirus/comments/f455ra/small_question_how_do_infected_people_recover/fholivs/,I'm not sure but I do know that there are some similarities between HIV & the coronavirus as far as initial treatment experiments.
2020-02-15,LiteraryMisfit,ABoringDystopia,1,https://www.reddit.com/r/ABoringDystopia/comments/f3xi0h/apparently_actually_reading_a_bill_before_you/fholssz/,"This reminds me of an article I saw a couple weeks ago where the headline blared ""74 Tested for Coronavirus!"" And then the article was literally about how they had tested 74 random people and no one had coronavirus."
2020-02-15,nogalev,AskDocs,1,https://www.reddit.com/r/AskDocs/comments/ey3w7r/weekly_discussiongeneral_questions_thread/fhomqbm/,"Hi, 
I'm supposed to fly to Rome, Italy for vacation for a week on the 9th of march, so I checked and found out that there are currently 3 cases of Coronavirus there. My country didn't have any cases so far. I know it's not a lot, and that things could change until I go, but I'm wondering how I should decide whether to go or not. What should my considerations be and how do I know how high the risk is? 
Thank you."
2020-02-15,worlddones,de,1,https://www.reddit.com/r/de/comments/f47lmt/wenn_man_kohle_von_virusepidemie_machen_kann/fhomxpa/,"hat garnicht damit zu tun, dass Leute sich vor Viren schützen möchten. Ich finde es absurd, dass es in vor allem Shoecenter verkauft wird, weil man heute Panik vor Coronavirus hat."
2020-02-15,EestiGang,AskEurope,1,https://www.reddit.com/r/AskEurope/comments/f3tm89/noneuropeans_why_are_you_here/fholfwf/,With the coronavirus scare some people are suspicious of anyone who looks Chinese.
2020-02-15,lazyplayboy,LegalAdviceUK,1,https://www.reddit.com/r/LegalAdviceUK/comments/f3yidw/school_cancelled_trip_at_last_minute_due_to/fhojauh/,"Granted. Nonetheless, there's this scenario: School trip to Japan goes ahead, kids get coronavirus, infect an at-risk sibling at home with life-threatening consequences. Parents: ""School did school trip to region with on-going epidemic, what recourse do we have?"".

COVID-19 likely causes less severe disease than influenza, but the school is caught between a rock and hard-place with this one."
2020-02-15,Failedfisherman,AskReddit,1,https://www.reddit.com/r/AskReddit/comments/f47dgb/is_it_ever_ok_to_disagree_with_a_trans_person_is/fhom5b7/,1 in 2000 isn't common enough for you? There's less common cancers being researched... Coronavirus isn't that common...
2020-02-15,sushimoney,nba,1,https://www.reddit.com/r/nba/comments/f46zut/what_do_you_guys_know_terrence_davis_of_the/fhoknnb/,"Reading and watching videos of Coronavirus got me rambling random stuff.

The end of the world as we know it"
2020-02-15,JBHopkins06,NorwichCity,1,https://www.reddit.com/r/NorwichCity/comments/f3ziuk/it_might_be_that_we_wont_have_that_many_games_left/fhom7ro/,There are thousands of things that you should be more concerned about than Coronavirus.
2020-02-15,Dannyboiiiiiiiiii06,AskReddit,1,https://www.reddit.com/r/AskReddit/comments/f3zk0q/you_have_the_power_to_rid_the_world_of_one_thing/fhom9mr/,Coronavirus
2020-02-15,japaneseMEOW_com,China,1,https://www.reddit.com/r/China/comments/f45l37/as_the_coronavirus_spreads_china_is_losing_its/fhomohq/,Do you want to know one thing that is worse than the coronavirus?  The 2 dollar paywall.  Don’t even bother with the article unless you want to give them your credit card.
2020-02-15,RoughTourist,China_Flu,1,https://www.reddit.com/r/China_Flu/comments/f3sm0s/antibodies_in_blood_plasma_of_recovered_patients/fhomqkm/,Why is /u/CLO_Junkie (a user whose account is only a month old and who has almost exclusively posted about COVID19) a mod on almost all coronavirus subs?
2020-02-15,A_Hayner334,teenagers,1,https://www.reddit.com/r/teenagers/comments/f477rg/i_kinda_confessed_to_my_crush/fhoj30m/,Oooh shit the coronavirus
2020-02-15,bschug,news,1,https://www.reddit.com/r/news/comments/f3qlyw/n_korean_official_executed_for_violating/fhojb70/,"Somehow coronavirus is way less contagious in North Korea, but with a much higher morality rate."
2020-02-15,AutoModerator,news,1,https://www.reddit.com/r/news/comments/f47foh/china_commits_to_openness_transparency_in/fhojqoz/,"Your post was automatically removed for being about the coronavirus. Please use the update thread [here](https://www.reddit.com/r/news/comments/ezo8xn/coronavirus_megathread_2/).

*I am a bot, and this action was performed automatically. Please [contact the moderators of this subreddit](/message/compose/?to=/r/news) if you have any questions or concerns.*"
2020-02-15,remvs98,NUjijDiscussies,1,https://www.reddit.com/r/NUjijDiscussies/comments/f47nli/patiënt_in_frankrijk_overlijdt_aan_coronavirus/fhokqku/,"Korte beschrijving:

Het coronavirus 2019-nCoV heeft in Europa een eerste slachtoffer geëist. In
Frankrijk bezweek een tachtigjarige Chinese toerist zaterdag aan de gevolgen
van de ziekte COVID-19, meldt de Franse minister van Volksgezondheid Agnès
Buzyn."
2020-02-15,Create_Greatness,The_Donald,1,https://www.reddit.com/r/The_Donald/comments/f477at/video_built_in_just_seven_days_water_now_pours/fhom242/,"Damn that looks SO SANITARY  


It is a tragedy for the people of China. The Chinese government completely bungled this whole thing. It seems like most countries around the world had enough lead-time to jump on this and limit the spread, and handle the infected cases with the proper amount of high caution and attention as possible....  


But as the epicenter, it does not seem like China took it seriously enough or acted fast enough to prevent MASSIVE damage to their country. Not just to their population, it isn't purely about the amount of people who might die in China....but overall health of the population, the state of mind of the population....social unrest, political unrest, economic unrest....  


I think the entire Coronavirus epidemic and the ripple effect that is happening and will continue to happen is going to leave China in a seriously weakened state. The coronavirus might literally bring them to their knees by the time it is all said and done."
2020-02-15,autotldr,worldnews,1,https://www.reddit.com/r/worldnews/comments/f47jhb/africa_confirms_1st_coronavirus_case/fhoma9f/,"This is the best tl;dr I could make, [original](https://www.bbc.com/news/world-africa-51403865?intlink_from_url=https://www.bbc.com/news/topics/cyz0z8w0ydwt/coronavirus-outbreak) reduced by 93%. (I'm a bot)
*****
> The health systems in many African countries are already struggling with the existing workload, so can they deal with another outbreak of a highly infectious disease?

> Increasingly close trade links between China and African countries have heightened concerns that the virus could spread. China is Africa&#039;s biggest trade partner and around 10,000 Chinese firms are currently operating throughout the continent.

> According to Chinese state media, more than one million Chinese nationals live in African countries.


*****
[**Extended Summary**](http://np.reddit.com/r/autotldr/comments/f47zmm/africa_confirms_1st_coronavirus_case/) | [FAQ](http://np.reddit.com/r/autotldr/comments/31b9fm/faq_autotldr_bot/ ""Version 2.02, ~468699 tl;drs so far."") | [Feedback](http://np.reddit.com/message/compose?to=%23autotldr ""PM's and comments are monitored, constructive feedback is welcome."") | *Top* *keywords*: **country**^#1 **Africa**^#2 **African**^#3 **China**^#4 **coronavirus**^#5"
2020-02-15,newsdk,newsdk,1,https://www.reddit.com/r/newsdk/comments/f1ifhb/status_2020_w07/fhoiuw4/,Posted article with title 'Sundhedsstyrelsens telefonvagt om coronavirus modtager mange opkald' and URL 'https://politiken.dk/forbrugogliv/sundhedogmotion/art7657101/Sundhedsstyrelsens-telefonvagt-om-coronavirus-modtager-mange-opkald'
2020-02-15,AmatureMD,AMA,1,https://www.reddit.com/r/AMA/comments/f3hcea/part_2_im_a_us_citizen_aboard_the_diamond/fhojfok/,"Great reporting. Keeping a positive attitude is essential.

Just FYI, the news coming out of the San Diego quarantine isn't great. Conditions sound very basic and lacking essential sanitary products.
https://www.thedailybeast.com/brewing-coronavirus-mutiny-at-california-marine-base-slams-cdc-response"
