date,author,subreddit,score,url,text
2020-02-15,josesito8,SonicTheHedgehog,1,https://www.reddit.com/r/SonicTheHedgehog/comments/f41zny/sonic_movie_makes_20000000_in_first_24_hours_in/fhquymw/,"I dont think that the whole CoronaVirus will affect the movie's box office results, we pretty much live in a Digital Age nowadays

(and yes, I have friends overseas which say that the movie was pretty popular in Europe as well)"
2020-02-15,benagami,preppers,1,https://www.reddit.com/r/preppers/comments/f4htr2/what_elements_of_prepping_and_how_have_caused_you/fhqv42d/,"Most of my preps have second or third uses (solar/lithium generator in the RV, etc), however, my investments are almost 100% cash except for some soybean futures I bought as a joke a couple years ago.  Interestingly, the gold I have hidden is the only investment I have that has appreciated significantly.  

What I do find is that my prepping tends to come into conversations I have with others too much.  I tend to turn the conversation to being prepared whenever I talk politics... or lately about the Coronavirus."
2020-02-15,Vergyberg,AskReddit,1,https://www.reddit.com/r/AskReddit/comments/f4hau5/ladies_of_reddit_what_about_a_man_makes_you_feel/fhqxxa4/,Found the coronavirus quarantine fetish
2020-02-15,SHITBLASTER6900,worldnews,1,https://www.reddit.com/r/worldnews/comments/f4dzjk/trump_defends_chinas_alleged_coverup_of/fhqyxew/,"I am vaccinated for the flu and I am not vaccinated for the coronavirus. Neither are everyone else, and vaccines are effective by having most people vaccinated. It's a stupid comparison."
2020-02-15,CrunchyAl,confusing_perspective,1,https://www.reddit.com/r/confusing_perspective/comments/f4dk27/a_truckload_of_ship/fhqyxsb/,Careful! You’ll drop the coronavirus.
2020-02-15,absurdlivingghost,neoliberal,1,https://www.reddit.com/r/neoliberal/comments/f45yt3/discussion_thread/fhquc6x/,"What happened to that kid who was freaking out about coronavirus? Bring him back, he was neat"
2020-02-15,Mikkolka,worldnews,1,https://www.reddit.com/r/worldnews/comments/f4dzjk/trump_defends_chinas_alleged_coverup_of/fhqv2zm/,"You’re all laughing at this and saying he’s dumb and meanwhile here in Ukraine a deputy announced on her social media this week that our parliament is “split into 2 halves” one of which believes that coronavirus is a genuine threat and the other thinks it’s a “really good marketing move to sell protection masks” and literally no one cares. Neither half is doing anything to stop the virus from spreading into Ukraine. When our plane from Wuhan arrived, they checked the passengers body temperature and if it was fine they just let them go."
2020-02-15,GauMatri,newsNepal,1,https://www.reddit.com/r/newsNepal/comments/f4icma/४_फगन_२०७६_आइतवर_बहनक_०६_००/fhqvidd/,"Hundreds march in Hong Kong against potential coronavirus quarantine clinics
* [Link](https://thehimalayantimes.com/world/hundreds-march-in-hong-kong-against-potential-coronavirus-quarantine-clinics/)

* Summary: <p>Hundreds of anti-government protesters marched in multiple Hong Kong neighbourhoods on Saturday against government plans to potentially turn some buildings into coronavirus quarantine centres, demanding full closure of the mainland China border.</p>
<p>The post <a rel=""nofollow"" href=""https://thehimalayantimes.com/world/hundreds-march-in-hong-kong-against-potential-coronavirus-quarantine-clinics/"">Hundreds march in Hong Kong against potential coronavirus quarantine clinics</a> appeared first on <a rel=""nofollow"" href=""https://thehimalayantimes.com"">The Himalayan Times</a>.</p>

* Description: [VIEW SOURCE](https://thehimalayantimes.com/world/hundreds-march-in-hong-kong-against-potential-coronavirus-quarantine-clinics/)"
2020-02-15,shaundhumphreys,TrueOffMyChest,1,https://www.reddit.com/r/TrueOffMyChest/comments/f4bdlw/my_parents_wont_stop_saying_theyre_asian_so_they/fhqw0b3/,"they should keep these thoughts to themselves so as not to alienate people from china however, it is not unnatural given the coronovirus' origin in China and sars came from china. what i don't trust is china. as we have an evolutionary imperative instinct to protect ourselves and our genes, and our offspring, avoiding china and the chinese does not make. and as western caucasions are bad at telling the different between the chinese and other far east countries, people may void all far eastern persons. and this would actually provide some extra protection from a person more from the coronavirus as some of them may have come back from china before the WHO implemented disease containment protocols. however to be consistent, one should keep to the WHO guidelines of staying a minimum one metre away from anyone coughing and/or sneezing-i.e showing cold or flu type symptoms. as white brits for example have come back from china and a small number did catch the virus, then they are just as likely to infect others as a chinese person who has come back to the U.S  or Britain or europe from china. people do have the right to do anything they like to protect themselves from the coronovirus, no matter how alientating that is to the chinese/far easterners.   just as they did for sars. but there are more courteous ways of doing it, as it is not about racism, it's about virus protection, a virus from china. so they should not have spoken it out loud, as that asian person may have overheard and that would be very upsetting for them to be blanket stereotyped as some kind of dirty race, the human equivalent of a rat carrying the bubonic plague."
2020-02-15,Babyyodafans,newzealand,1,https://www.reddit.com/r/newzealand/comments/f4ezi0/witness_shocked_after_watching_st_john_staff_in/fhqwvhw/,I also hope at some point reading comprehension will make a come back. It said in the article that it didn’t meet the criteria for coronavirus but many have missed that
2020-02-15,Slapspoocodpiece,slatestarcodex,1,https://www.reddit.com/r/slatestarcodex/comments/f4eg99/what_is_the_best_case_to_be_made_that_the_who_and/fhqxqt1/,"This comes up constantly in the coronavirus sub. The deaths explicitly “due to” Covid19 **are** undercounted, but it’s because of the way that China lists mortality in every instance, not just this disease. For example, China has an insanely low number of deaths “due to” influenza, something obviously incorrect like 2,000 per year. It’s something to do with how they list cause of death as being due to pre-existing conditions someone might have when they enter the hospital, and it’s a well known quirk of China’s medical record system that makes it useless for calculating statistics but not evidence of a conspiracy for this particular disease."
2020-02-15,Waikiki_96815,Oahu,1,https://www.reddit.com/r/Oahu/comments/esr2gd/caronavirus/fhqync1/,"It passed through. So now we wait. Coronavirus aka covid-19

[https://www.staradvertiser.com/2020/02/13/breaking-news/japan-reports-1st-death-from-virus-44-more-cases-on-ship/](https://www.staradvertiser.com/2020/02/13/breaking-news/japan-reports-1st-death-from-virus-44-more-cases-on-ship/)

[https://www.staradvertiser.com/2020/02/14/breaking-news/japanese-man-confirmed-as-coronavirus-patient-after-returning-from-hawaii-vacation/](https://www.staradvertiser.com/2020/02/14/breaking-news/japanese-man-confirmed-as-coronavirus-patient-after-returning-from-hawaii-vacation/)"
2020-02-15,Nickadeamus36,Coronavirus,1,https://www.reddit.com/r/Coronavirus/comments/f4h3us/does_anyone_know_if_you_can_get_reinfected_with/fhqyoko/,"I think the key thing is that there is no standard viral infection behaviour across the families of viruses. 

And we truely don’t know enough about the entire Coronavirus family yet, up until 10 years ago we never thought it could be deadly."
2020-02-15,dc1122,worldnews,1,https://www.reddit.com/r/worldnews/comments/eyq5vp/live_thread_wuhan_coronavirus/fhqz4zy/,"Coronavirus is the family name, not SARS. How are you not getting this?"
2020-02-15,uoftsadboi,UofT,1,https://www.reddit.com/r/UofT/comments/f4ifrm/any_other_asians_feel_discriminated_recently/fhr0pgr/,"I've seen people commenting stuff like ""that's how you get coronavirus"" on any social media post that has asian people, and also seen on the street people saying ""coronavirus"" to asians wearing a face mask

Like...dude it costs $0 to not do that"
2020-02-15,Neetieoff,starterpacks,1,https://www.reddit.com/r/starterpacks/comments/f4iy8a/still_being_ordered_to_go_to_china_starter_pack/fhr1m7q/,People get way too butthurt over coronavirus jokes lmao
2020-02-15,Fickkissen,Coronavirus,1,https://www.reddit.com/r/Coronavirus/comments/f4iqlu/trump_defends_chinas_alleged_coverup_of/fhr2au5/,https://www.reddit.com/r/Coronavirus/comments/f271f5/trump_seeks_to_halve_us_funding_for_world_health/
2020-02-15,biotuner,melbourne,1,https://www.reddit.com/r/melbourne/comments/f45oso/coronavirus_in_australia_ten_have_totally/fhr2aug/,"\>...**ten have totally recovered, five still have it but only mild...**

This is incorrect. Via the Australian Government alerts page [here](https://www.health.gov.au/news/health-alerts/novel-coronavirus-2019-ncov-health-alert#current-status).

 

>As at 06:00 hrs on 14 February 2020, we have confirmed 15 cases of coronavirus (COVID-19) in Australia:  
>  
>\* 5 in Queensland  
>  
>\* 4 in New South Wales  
>  
>\* 4 in Victoria  
>  
>\* 2 in South Australia  
>  
>6 of the earlier cases have recovered. The others are in a stable condition.

I agree that people are overreacting locally. There's no evidence of local transmission in the community. Some of the 'panic' behaviour we're seeing is people profiteering by buying in Australia to ship to China; this is something that we really should have clamped down on earlier."
2020-02-15,BadBadgerChef,Coronavirus,1,https://www.reddit.com/r/Coronavirus/comments/f4f8ca/i_feel_the_same_as_in_the_911/fhr2lvi/,"In 2 months, it's likely that the deaths from the coronavirus  could be worse than 9/11 every single day. 

It's 9/11 times 100,000."
2020-02-15,Bonezmahone,worldnews,1,https://www.reddit.com/r/worldnews/comments/f4gmhx/wandering_ship_becomes_best_cruise_ever_despite/fhr085d/,"> it was Cambodia that finally let the lost ship dock – and it was discovered there that none of the passengers was infected.

An American man has been discovered to have been infected.

https://www.reuters.com/article/us-china-health-malaysia/american-from-cruise-ship-docked-in-cambodia-tests-positive-in-malaysia-for-coronavirus-idUSKBN2090IW?feedType=RSS&feedName=worldNews&utm_source=dlvr.it&utm_medium=twitter"
2020-02-15,MurkDollaSign,Coronavirus,1,https://www.reddit.com/r/Coronavirus/comments/f4iu10/announcement_rcoronavirus_and_rchina_flu/fhr32f9/,"When people search for a subreddit specifically for the corona virus, they're most likely going to search, you guessed it, /r/Coronavirus.

This is where most people are going to congregate and contribute the most. Why are you pushing people to a less active sub who want to ""speculate""?

Almost like you're trying to quarantine thoughtcrimes. Something a one-party, authoritarian regime would do to its own citizens. Really activates the almonds.... 🤔"
2020-02-15,aquarain,worldnews,1,https://www.reddit.com/r/worldnews/comments/eyq5vp/live_thread_wuhan_coronavirus/fhr35uq/,"Don't panic.  But be prepared.  The CDC has already said it is likely to spread everywhere in the world.  Quickly.

https://www.cnbc.com/2020/02/12/cdc-prepares-for-coronavirus-to-take-a-foothold-in-the-us.html

>The coronavirus produces mild cold symptoms in about 80% of patients, Dr. Sylvie Briand, head of WHO’s Global Infectious Hazard Preparedness division, told reporters on Monday. About 15% of the people who contract the virus have ended up with pneumonia, with 3% to 5% of all patients needing intensive care, she said.

Just be prepared for that to happen.  You might want to think about the consequences of 5% of the people in your community needing ICU beds in a span of a couple months.  Just so you properly prepare."
2020-02-15,RealNewsforever,u_RealNewsforever,1,https://www.reddit.com/r/u_RealNewsforever/comments/f4ivcb/chinese_police_drag_citizens_away/fhr0d1t/,\#Wuhan #Covid19 #Coronavirus
2020-02-15,HotspurJr,chess,1,https://www.reddit.com/r/chess/comments/f4a7q1/chess_event_the_candidates_tournament_to/fhr1ejh/,"I like the tiebreakers that put an emphasis on wins. Sonnenborn-Berger is a little abstract, but it ultimately rewards people for beating the other contenders, rather than just the never-had-a-chancers. 

Hopefully Ding and Wang won't have any Coronavirus-related travel issues."
2020-02-15,HellBrick666,cursedcomments,1,https://www.reddit.com/r/cursedcomments/comments/f4bax9/cursed_pedophile/fhr1en4/,Thank you China for coronavirus
2020-02-15,Hellrider_28,vaxxhappened,1,https://www.reddit.com/r/vaxxhappened/comments/f4ba3q/should_be_the_same_since_there_is_no_vaccine_for/fhr1owv/,"Wait for BIG PHARMA to release the Coronavirus vaccine and I'll show you, Karen"
2020-02-15,Kujo17,cvnews,1,https://www.reddit.com/r/cvnews/comments/f4j4m0/amid_price_hikes_for_mainland_produce_during/fhr2ndj/,"Hongkongers are used to standing in queues, never more so than in recent weeks, as 

blocks-long lines

 of residents seeking surgical masks and sanitisers have become the norm.

But a queue outside a farm? That would have been hard to imagine until about two weeks ago, when scores of people began flocking to a family farm in the New Territories town of Fanling.

“We have a lot of people here waiting, so please do not rush, we hope everyone is able to buy the vegetables they want today,” Becky Au Hei-man, 34, a third-generation farmer, told the queue of three dozen customers that snaked around Mapopo Community Farm last Sunday.

Driven by escalating fears amid the 

coronavirus outbreak

, which as of Saturday had seen 56 Hongkongers confirmed infected, panic-stricken residents have taken to emptying shelves of rice and toilet paper in major supermarkets in Hong Kong.

Advertisement

Fresh vegetables, meanwhile, though largely still available, have seen their prices soar.

￼

As fears around the virus first grew following the Lunar New Year holiday, produce prices jumped anywhere from 30 to 100 per cent, according to the government-backed Vegetable Marketing Organisation (VMO).

But while prices have come down as the initial panic subsided, they remain higher than in the first two weeks of January due to ongoing mark-ups on mainland produce, which accounts for the bulk of the city’s needs.

Enter Hong Kong’s local farms, which remain unaffected by the fluctuations.

The sudden price competitiveness has brought a sudden surge of new customers for local produce, which currently accounts for less than 1.7 per cent of the city’s supply, according to figures in 2017 by the Agriculture, Fisheries and Conservation Department.

Locally grown vegetables have historically sold for 20 to 30 per cent more than mainland produce, and what local produce is available has typically been sold to wholesalers through the VMO, with very little going directly from farm to consumer.

“Local farm products are always more expensive and less convenient to buy, so I did not think of buying it before. But now, even vegetables from the mainland are expensive, so that makes local vegetables more appealing,” said Tiff Cheung, who arrived with her husband and 3-year-old daughter 30 minutes before the twice-weekly farmers’ market opened.Ms Ma, a regular customer who lives in Ho Man Tin and travels an hour to Mapopo farm to buy vegetables every Sunday, said she has taken to arriving 45 minutes before the market opens because of all the new faces.

“If I do not come early, I will be left with very little to choose from,” she said.

“Usually the week following the end of the Lunar New Year is a slow season for the farming industry. It was so shocking, because we were not expecting this at all,” said Au, who runs the farm.Just an hour after their farmers market opened on Sunday, two-thirds of their produce was sold.

“The popularity is surreal to us. We have tried hard to promote sustainable local farming and the importance for Hong Kong to have its own agricultural supply, and suddenly it seems like people have all caught up and realised how important these issues we have been talking about all along are,” Au said.

*full article in link*"
2020-02-15,Awakeat5amagain,Coronavirus,1,https://www.reddit.com/r/Coronavirus/comments/f4ims0/new_coronavirus_could_go_one_of_two_ways_say/fhr3mkm/,How did the other four endemic human coronavirus’ start?
2020-02-15,funhawaii,Coronavirus,1,https://www.reddit.com/r/Coronavirus/comments/f49nwl/can_coronavirus_transmit_in_waikiki_ocean_water/fhr45xo/,"There is no consensus here. Few of you and your ass wipers got together and decided to just bash and write hatred instead of responding appropriately. You and your war mongering wanna be a gang did not wish to answer my question, which you did eventually with a very long writing and finally said yes the virus can travel within the Waikiki ocean water to a limit and infect others nearby. You still want to just keep bashing and write hatred. Why? You are scared that this will chase visitors away, which is what Chinese government have done exactly in their early stages of the coronavirus until it got out of control.

Now you have decided that you feel upset about having given an answer, which you feel you have been tricked into, and now you are trying to soften a bit to see if you can wash if off. But as you must admit you can not change your answer. Hence you are thrashing out with your temper tantrum, which is very childish. 
Just look at it this way. If the Hawaii politicians were more strict and make it very hard for the coronavirus to be brought into Hawaii, then yes we would lose some visitors in the beginning. However, when all other travel destinations get hit with the coronavirus Hawaii will be in much demand and the visitors with money will be more than willing to go through the extra tough checking policy to come to Hawaii, which would be a safe haven as compared to everywhere else. Work towards the long run instead of the short gain.

You already answered my question, the title. Now give it a rest."
2020-02-15,adotfree,plano,1,https://www.reddit.com/r/plano/comments/f3tbx2/update_faqs_about_coronavirus_friday_february_14/fhr078n/,"The [flu](https://www.cdc.gov/flu/about/burden/preliminary-in-season-estimates.htm) has hospitalized over 250k people this season *just in the US*, with at least 14k deaths attributed to it. [Coronavirus](https://www.cnn.com/asia/live-news/coronavirus-outbreak-02-15-20-intl-hnk/index.html) has over 67k cases reported worldwide, with about 1600 deaths attributed.

A flu shot won't help you against coronavirus, but the flu is deadly and prevalent enough here already that folks should be running to go get their shot."
2020-02-15,Gloworm02,lotrmemes,1,https://www.reddit.com/r/lotrmemes/comments/f4hbig/are_these_memes_dead_yet/fhr432k/,novel coronavirus
2020-02-15,cdnkevin,londonontario,1,https://www.reddit.com/r/londonontario/comments/ex2l04/where_to_buy_n95_or_surgical_masks/fhr4aya/,"> Are surgical masks PPE? No. 

You're incorrect. I don't think you really understand the subtle distinctions that are made in the article and the types of PPE out there.

From the article that you linked:

> There is some evidence to suggest the masks can help prevent  hand-to-mouth transmissions, but virologists are sceptical about their  effectiveness against airborne viruses. 

14 days ago there was no evidence to suggest the pathogen was airborne. We simply aren't seeing the infection/spread of the pathogen if it were airborne.

14 days ago, experts (I don't know their qualifications) [agreed with this assessment](https://www.reddit.com/r/askscience/comments/ewwmem/have_a_question_about_the_2019_novel_coronavirus/fg62ha8?utm_source=share&utm_medium=web2x).

Furthermore,

>Respirators and surgical masks are widely used in healthcare settings.  Both types of personal protective equipment (PPE) can be used for  infection control; however, only respirators can be used for respiratory  protection against airborne chemical hazards. 

and

>In comparison, a surgical mask only provides barrier protection against  large-particle droplets and does not effectively filter inhaled small  particles, fumes, or vapors. 

[https://www.cdc.gov/niosh/topics/healthcarehsps/respiratory.html](https://www.cdc.gov/niosh/topics/healthcarehsps/respiratory.html)

Also

>Typical surgical masks usually found at pharmacies (and which were  sold out on Amazon and other e-tailers as of Friday) are approved by the  U.S. Food and Drug Administration to protect the wearer against large  droplets or splashes of bodily and infected fluids from others,  according to the CDC.   
>  
>Wearing surgical masks does not prevent a person from  inhaling smaller airborne particles; they are not considered  respiratory protection by the CDC. Surgical masks are also loose  fitting, and when the wearer inhales, there is potential for particles  to leak in or out of the sides.

[https://time.com/5774521/coronavirus-face-mask-prevention/](https://time.com/5774521/coronavirus-face-mask-prevention/)

If you want to read more about the virus and ask questions try [here](https://www.reddit.com/r/askscience/comments/ewwmem/have_a_question_about_the_2019_novel_coronavirus/?utm_source=share&utm_medium=web2x). I posted about it in the [Megathread](https://www.reddit.com/r/londonontario/comments/ewsney/coronavirus_case_confirmed_in_patient_from_london/fg7b8yn?utm_source=share&utm_medium=web2x)."
2020-02-15,Midgetfarm,wallstreetbets,1,https://www.reddit.com/r/wallstreetbets/comments/f3yecl/weekend_discussion_thread_february_1416_2020/fhr4ayj/,"BREAKING: 70 new cases of coronavirus on cruise ship near Tokyo, raising ship's total to 355 - NHK"
2020-02-15,OWO-FurryPornAlt-OWO,JusticeServed,1,https://www.reddit.com/r/JusticeServed/comments/f4bkdf/crazy_religious_lady_arrested/fhr07z6/,"6,000,000 Isrealites have died from the coronavirus you bigot, learn your place goyim"
2020-02-15,funhawaii,Coronavirus,1,https://www.reddit.com/r/Coronavirus/comments/f4iq56/implications_of_the_japanesshawaii_case/fhr1dr0/,"We'll find out in about 2 weeks from now if there are other infections here.  

I have visited Chinatown today and I could not believe how slow it was. Coronavirus news is really having an effect. Now with the incident with the Japanese traveler Waikiki could have a negative economic effect as the tourism here could be effected. As such, many working people here are very nervous and sensitive to a point that they are lashing out at anyone writing anything about the Japanese visitor being infected by coronavirus in Waikiki. This is probably what happened in China in the early stages of the coronavirus infection and it just got out of control, which they could have instead deal with the infection in the earlier stages."
2020-02-15,AutoModerator,Coronavirus,1,https://www.reddit.com/r/Coronavirus/comments/f4j0wn/south_korea_reports_1_new_case_of_coronavirus/fhr1ghe/,"Twitter is generally an unreliable source. If possible, please re-submit with a link to a reliable source or the direct article.

Note that you may also resubmit as a text post, just add a link and some explanatory text. 

Thank you for helping us keep information in /r/Coronavirus reliable!


*I am a bot, and this action was performed automatically. Please [contact the moderators of this subreddit](/message/compose/?to=/r/Coronavirus) if you have any questions or concerns.*"
2020-02-15,AussieRaddict,RoastMe,1,https://www.reddit.com/r/RoastMe/comments/f47ue8/well_here_we_go/fhr2dpu/,"Currently an Asian. Yeah true that, the new coronavirus might hit you hard"
2020-02-15,thissitemakesmeread,roastmypet,1,https://www.reddit.com/r/roastmypet/comments/f4j3os/when_the_pets_hit_just_right/fhr2yvp/,Get that cat tested. It probably has the coronavirus.
2020-02-15,MsFinanceGeek,cambodia,1,https://www.reddit.com/r/cambodia/comments/f38nyj/coronavirus_in_cambodia/fhr3br0/,Update: now [one confirmed ](https://www.scmp.com/news/asia/southeast-asia/article/3050814/coronavirus-us-passenger-westerdam-cruise-ship-infected?utm_content=article&utm_medium=Social&utm_source=Facebook#Echobox=1581778165) infection from Westerdam cruise ship passenger
2020-02-15,LordoftheSynth,SeattleWA,1,https://www.reddit.com/r/SeattleWA/comments/f47ixa/emts_not_warned_of_transporting_possible/fhr07o3/,"Los Angeles has had outbreaks of typhus and typhoid in its homeless population in the recent past. The city didn't give a flying fuck until city employees started catching it. If it happens, the city will deny anything is wrong until cases start popping up everywhere.

That said, were I to bet on where coronavirus is likeliest to show up in the homeless, I'd pick San Francisco."
2020-02-15,yashoza,worldnews,1,https://www.reddit.com/r/worldnews/comments/f4dzjk/trump_defends_chinas_alleged_coverup_of/fhr11l5/,The CDC could have stopped coronavirus supposedly. It was investigating the cave that the bat came from.
2020-02-15,Fickkissen,Coronavirus,1,https://www.reddit.com/r/Coronavirus/comments/f4iqlu/trump_defends_chinas_alleged_coverup_of/fhr1c3a/,"Earlier this sub was [praising Trump](https://www.reddit.com/r/Coronavirus/comments/f271f5/trump_seeks_to_halve_us_funding_for_world_health/), for cutting funding for the WHO because they ""are controlled by the CCP and are not telling the truth"".

But as soon he defends the coverup himself, he gets praise."
