date,author,subreddit,score,url,text
2020-03-05,rocco_dog,AmItheAsshole,12,https://www.reddit.com/r/AmItheAsshole/comments/fdxmpi/aita_for_telling_a_coworker_she_isnt_special/fjl8diz/,"Yepppp. I am currently undergoing chemo and am immune suppressed and my doctor told me to be careful going to target. Target!!! So it’s important to remember that us diseased folks are at real risks for coronavirus even if it seems over the top or a scare tactic. She is probably deeply concerned. YTA for both not being empathetic and assuming she was ambulance chasing.

*edited to add that I have a blood cancer, and it’s also about white platelets count. My whites dropped dramatically this week and I immediately got a cold/fever. So also that."
2020-03-05,Most_Champion,Coronavirus,12,https://www.reddit.com/r/Coronavirus/comments/fdzdia/italy_from_2502_to_3858_confirmed_from_79_to_148/fjkr9uj/,"So far so good. The number of dead seems high but you need to take into account those were people already very sick. They were in their 70's, 80's 90's and 100's already battling with multiple chronic diseases and in precarious conditions.

Among healthy individuals (even old ones) the numbers of healed is growing pretty fast and will keep growing.

The numbers of infected of course will keep going up, the normal flu normally infects 6 million people in Italy in any given year. But 80% of the infected with coronavirus have mild symptoms so they don't cause any worry.

It's the 10% who require intensive care who are the problem.

They expect in two weeks the situation to stabilise and then to gradually improve with the warmer months. Next month already will be very warm in Italy so the virus should be less virulent"
2020-03-05,argo1230,Coronavirus,12,https://www.reddit.com/r/Coronavirus/comments/fe0t6k/a_california_man_who_selfquarantined_after/fjluwkm/,"testing is free and encouraged now, and getting treatment of coronavirus in China is free regardless whether you have insurance or not."
2020-03-05,Sheep_Goes_Baa,bayarea,12,https://www.reddit.com/r/bayarea/comments/fe3w2e/20_confirmed_cases_of_coronavirus_in_santa_clara/fjlwcrc/,"Unfortunately, it's much worse than that. https://twitter.com/NNUBonnie/status/1235663306246860800

""The public county officer called me and verified my symptoms and agreed with testing. But the National CDC would not initiate testing. They said they would not test me because if I were wearing the recommended protective equipment, then I wouldn’t have the coronavirus."""
2020-03-05,shtpostinalotofmemes,Coronavirus,12,https://www.reddit.com/r/Coronavirus/comments/fe61id/covid19_predicted_in_1981/fjm0tp4/,">did author Dean Koontz really predict coronavirus?

No"
2020-03-05,pointy-veggies,vegan,12,https://www.reddit.com/r/vegan/comments/fdpea2/indians_going_on_the_offence_against_meat_eaters/fjj7d38/,Coronavirus. HIV/AIDs. Ebola. SARs. Swine flu. Avian flu. Mad cow. All brought to you by meat eating.
2020-03-05,pacifichockeyfan,hockey,12,https://www.reddit.com/r/hockey/comments/fe3xdm/russo_wildsharks_game_will_go_on_despite_santa/fjlmlds/,"Context is, of course, COVID-19. [SCC has now 20 confirmed cases as of today.](https://www.nbcbayarea.com/news/coronavirus/14-coronavirus-cases-now-confirmed-in-santa-clara-county/2248001/)"
2020-03-05,gowithflow192,CoronavirusUK,12,https://www.reddit.com/r/CoronavirusUK/comments/fe34po/the_whole_of_the_uk_should_immediately_use/fjljy7x/,"Even surgical masks work somewhat:

[https://smartairfilters.com/en/blog/coronavirus-pollution-masks-n95-surgical-mask/](https://smartairfilters.com/en/blog/coronavirus-pollution-masks-n95-surgical-mask/)

Nothing is perfect. Would you ditch your seatbelt because it only makes a difference to saving your life in a small fraction of car crashes?"
2020-03-05,sativabuffalo,Pete_Buttigieg,12,https://www.reddit.com/r/Pete_Buttigieg/comments/fds3rl/home_base_and_daily_discussion_thread_start_here/fjloaqz/,"Hey guys, I went to SC to canvass for Pete and was shaking hundreds of hands/hugging/in close proximity with people from across the country for three days. I am a bit worried because of the coronavirus spread, not so much for myself ‘cause I’m so young I’m sure it’ll be mild, but I do live in FL, which is basically one giant retirement home. Already cancelled plans with my gma this week. Does anyone have tips for how to minimize potential spreading? I see conflicting and sensationalist info all over the news/Reddit/social media, and my family have fallen into either the Doomsday or Trump Says It’s Just the Flu camps, so I’m hoping one of ya’ll will have some measured advice. Is there any point to wearing gloves?"
2020-03-05,twitterInfo_bot,Coronavirus,12,https://www.reddit.com/r/Coronavirus/comments/fe64xr/three_cases_in_montgomery_county_maryland_state/fjm1fhn/,"""Three people in Montgomery County have tested positive today for Coronavirus. They were traveling overseas. Now they are quarantined at home.
"" 
 
 >publisher: @tpcarney"
2020-03-05,IReadTheWholeArticle,Coronavirus,12,https://www.reddit.com/r/Coronavirus/comments/fe64fr/tool_concert_case_confirmed/fjm1qz3/,"“The fourth person to test positive to coronavirus went to a Tool concert when he may have been infectious, it has been announced this afternoon.”

There’s absolutely a Tool song or lyric that is appropriate here but it’s eluding me."
2020-03-05,MiiSwi,Coronavirus,12,https://www.reddit.com/r/Coronavirus/comments/fe0t6k/a_california_man_who_selfquarantined_after/fjl4njl/,"I’ve heard so many people at my school scoff and deny that the coronavirus is dangerous. “if I get it, it’ll just be like the flu, I’ll be fine” they say selfishly, not realizing that if they get it and it spreads to someone unable to handle the virus, they could very well kill someone."
2020-03-05,Boring-Magazine,houston,12,https://www.reddit.com/r/houston/comments/fe1ut6/harris_county_reports_first_two_cases_of_covid19/fjlbuh1/,"[France](https://www.lemonde.fr/planete/article/2020/03/01/la-france-face-au-coronavirus-des-mesures-de-confinement-et-un-seuil-symbolique-de-100-contaminations_6031422_3244.html)

[California](https://www.mercurynews.com/2020/03/01/two-healthcare-workers-presumptive-positive-for-coronavirus-live-in-alameda-solano-counties/)

[Taiwan](https://www.reuters.com/article/us-china-health-taiwan-idUSKBN20N09C)

[Canada](https://www.cp24.com/news/ontario-reports-three-new-coronavirus-cases-bringing-province-s-total-to-18-1.4835004)"
2020-03-05,svdoornob,barstoolsports,12,https://www.reddit.com/r/barstoolsports/comments/fdt3e1/free_talk_thursday/fjkzibn/,"Please stop telling people to ""get ready"" for the coronavirus 5 times per day."
2020-03-05,fpreston,60daysin,12,https://www.reddit.com/r/60daysin/comments/fe20jb/season_6_episode_10_was_it_enough/fjmavsl/,"Coronavirus kills 3000 people and everyone loses their minds.  Heart disease is the number one killer in the world and KFC put fried chicken between two doughnuts.

FFS."
2020-03-05,henryeaterofpies,Coronavirus,12,https://www.reddit.com/r/Coronavirus/comments/fdzip8/university_of_washington_medicine_has_developed/fjkrzzr/,Dying from coronavirus to stick it to the libs.
2020-03-05,i-am-sancho,DemocratsforDiversity,12,https://www.reddit.com/r/DemocratsforDiversity/comments/fdsoa4/dfd_discussion_thread_march_05_2020/fjlhbge/,"https://twitter.com/the_law_boy/status/1235690252989169664?s=21


Guess he deleted it. But it was 

>remember when Obama went to Flint and drank a glass of the water? i think it would be a cool PR move for Trump to do the same thing but with drinking a glass of coronavirus"
2020-03-05,malganis12,neoliberal,12,https://www.reddit.com/r/neoliberal/comments/fdrhww/discussion_thread/fjlnqod/,"It's ok to recognize that Coronavirus is unlikely to kill you personally, and unlikely to collapse human civlization

AND

To recognize that the US Government, at Trump's direction, is deliberately underplaying its spread and its risks for political advantage.  And that includes hindering the ability of labs to test for it to artificially deflate the number of cases.  And that many people with underlying conditions or of advanced age will die from it, and that some percentage of those deaths were preventable.  All of which, is horrible and deserves the strongest condemnation."
2020-03-05,jkeefy,houston,12,https://www.reddit.com/r/houston/comments/fe1ut6/harris_county_reports_first_two_cases_of_covid19/fjlpkjx/,"S: RICE ALERT - Coronavirus alert
To the Rice community: Harris County Public Health notified Rice officials this afternoon that the university employee who was self-quarantined tested positive for the novel coronavirus COVID-19. The other Rice doctoral students, faculty and staff who are currently in self-quarantine have been notified. They remain in self-quarantine and none has reported symptoms to date. Please check your email for further information."
2020-03-05,Smoosmoo1,Anxiety,12,https://www.reddit.com/r/Anxiety/comments/eupik4/coronavirus_megathread/fjlqpvz/,"Saw this on Facebook today, defiantly helped calm my nerves a bit and think more rationally: 

Everyone take a breath... you don’t need more toilet paper! That won’t help with the Coronavirus BUT HERES SOME INFORMATION THAT WILL! 

82,000 People are sick with Coronavirus at the moment, of which 77,000 are in China.
This means that if you are not in or haven't recently visited China, this should eliminate 94% of your concern.

If you do contract Coronavirus, this still is not a cause for panic because:
81% of the Cases are MILD
14% of the Cases are MODERATE
Only 5% of the Cases are CRITICAL

Which means that even if you do get the virus, you are most likely to recover from it.

Some have said, “but this is worse than SARS!”. SARS had a fatality rate of 10% while COVID-19 has a fatality rate of 3.4%

Moreover, looking at the ages of those who are dying of this virus, the death rate for the people UNDER 50 years of age is only 0.2%

This means that if you are under 50 years of age and don't live in China - you are more likely to win the lottery (which has a 1 in 45,000,000 chance)

Let’s take one of the worst days so far, the 10th of February, when 108 people in CHINA died of Coronavirus.

On the same day:
26,283 people died of Cancer,
24,641 people died of Heart Disease,
4,300 people died of Diabetes. 
Mosquitoes kill 2,740 people every day"
2020-03-05,ThatzBS,barstoolsports,12,https://www.reddit.com/r/barstoolsports/comments/fdt25d/daily_barstool_radio_discussion_march_05_2020/fjl9bhf/,Going to be awesome when coronavirus is done and penn stock still sucks
2020-03-05,bamasmith,Coronavirus,12,https://www.reddit.com/r/Coronavirus/comments/fe2k07/how_to_watch_the_coronavirus_town_hall/fjlcnbg/,">Joining remotely will be a few patients infected with coronavirus.

Nani?"
2020-03-05,121518nine,wallstreetbets,12,https://www.reddit.com/r/wallstreetbets/comments/fdjqhh/what_are_your_moves_tomorrow_march_05_2020/fjj8uw4/,"LOCK EM UP


https://nypost.com/2020/03/03/man-locks-wife-in-bathroom-over-fear-she-might-have-coronavirus/?utm_source=NYPInstagram&utm_medium=Native&utm_campaign=Native&crl8_id=5eaf1623-7dd5-49f0-96c3-eb44e1fb7b15"
2020-03-05,KingMan6969,barstoolsports,12,https://www.reddit.com/r/barstoolsports/comments/fdt3e1/free_talk_thursday/fjl157e/,would you take $25k to get infected by a regular coronavirus patient?
2020-03-05,firminocoutinho,LiverpoolFC,12,https://www.reddit.com/r/LiverpoolFC/comments/fdzabg/premier_league_likely_to_go_behind_closed_doors/fjl15ai/,"The league would probably do that just to punish us... and all the rivals would say “you won the league the year of coronavirus.. games were played behind closed doors”

In other news, City wont be affected by the lack of fans cheering them on because their games are quiet regardless."
2020-03-05,bqb1,barstoolsports,12,https://www.reddit.com/r/barstoolsports/comments/fdt3e1/free_talk_thursday/fjlamvk/,update on the kid on my team from yesterday who volunteers at the airport for free on top of the 40 hours he works every week. it's been confirmed that a guy who was diagnosed with coronavirus flew through that airport this week and he is still going tonight. this kid is such an idiot
2020-03-05,DoubleCamel,Enough_Sanders_Spam,12,https://www.reddit.com/r/Enough_Sanders_Spam/comments/fdsn5l/daily_political_discussion_roundtable_03052020/fjlpce0/,"Coronavirus is harmless? Citation needed.

EDIT: Your edit is woefully unserious. The idea that a pandemic needs to be some sort of end of society threat to be “harmful” flies in the face of public health policy. It’s confusing real life with the MCU. 

If you’re not a public health official with knowledge of pandemics now is not the time to give half-baked opinions."
2020-03-05,rektogre1280,Coronavirus,12,https://www.reddit.com/r/Coronavirus/comments/fe6nnw/china_reports_143_new_cases_30_new_deaths/fjm6hrk/,It's such a sad thing that some people just want to see/hear more Chinese people dying from Coronavirus to fit into their narrow-minded worldview.
2020-03-05,jb4427,Mavericks,12,https://www.reddit.com/r/Mavericks/comments/fe0z6l/townsend_doncic_was_ill_sent_home_did_not/fjlj44b/,I hope Luka does not have coronavirus
2020-03-05,cheyan1de,maryland,12,https://www.reddit.com/r/maryland/comments/fe4sh3/gov_hogan_announces_state_health_dept_confirms_3/fjlwb58/,"tested and confirmed in baltimore

edit: [yeah](https://www.wusa9.com/article/news/health/coronavirus/three-confirmed-cases-in-maryland/65-113ff7d4-0ab9-4f23-82a5-d226fd846a54 ), all 3 [cases](https://www.washingtonpost.com/local/md-politics/maryland-confirms-three-cases-of-coronavirus/2020/03/05/687def10-5f3d-11ea-b014-4fafa866bb81_story.html) were residents of montgomery county, a couple in their 70s and a woman in her 50s were infected while traveling overseas"
2020-03-05,KingEdTheMagnificent,nfl,11,https://www.reddit.com/r/nfl/comments/fdy8jb/thursday_talk_thread_yes_thats_the_thread_name/fjldacm/,what if the real coronavirus was inside us all along
2020-03-05,hungrybear2005,Coronavirus,11,https://www.reddit.com/r/Coronavirus/comments/fdx8qh/trump_claims_thousands_could_still_go_to_work/fjkbax6/,Please ask at least one coronavirus patient to daily work with Trump and his gov and forbid them wearing masks.
2020-03-05,EpsteinKilledHisself,neoliberal,11,https://www.reddit.com/r/neoliberal/comments/fdrhww/discussion_thread/fjm83na/,[somehow Hong Kong knows a random dog has coronavirus while the us is barely able to tell if old people dying in nursing homes had it](https://www.washingtonpost.com/science/2020/03/05/coronavirus-dogs-cats/)
2020-03-05,Belikedis,Coronavirus,11,https://www.reddit.com/r/Coronavirus/comments/fe7tua/china_has_banned_eating_wild_animals_after_the/fjmel9c/,"You realize that a lot of countries besides America eat deer, right?  ... and fowl... and gator... and other small game.  

You know what a lot of these countries don’t eat? 

Dog, bat or pangolin.  Even in the listed article it says eating of mongoose likely created SARS.  Find me a mfer in America eating mongoose. 

So when eating deer creates a viral spread as massive as the coronavirus or SARS then you might actually have a point."
2020-03-05,speluunk,wallstreetbets,11,https://www.reddit.com/r/wallstreetbets/comments/fe22hg/what_are_your_moves_tomorrow_march_06_2020/fjmf819/,"“Coronavirus Live Updates: Cases Surge in U.S. and Europe, Thousands Quarantined in N.Y.C.”


hell yeah brother sounds good to me. SPY to 350 EOD 📈📈"
2020-03-05,hohsin1234,Coronavirus,11,https://www.reddit.com/r/Coronavirus/comments/fe3kk3/low_mortality_rate_in_south_korea/fjlkk1z/,Serious/critical cases are significantly lower than other country as well. ([data](https://www.worldometers.info/coronavirus/)) I guess CFR will be around 1% in Korea in the end.
2020-03-05,OwnRules,Coronavirus,11,https://www.reddit.com/r/Coronavirus/comments/fe1zxx/men_far_more_likely_to_die_from_coronavirus_than/fjl8q9m/,"> Coronavirus is far more deadly for men than women, with males 65 per cent more likely to die from an infection than females, new analysis shows.
> 
> The latest breakdown of figures from the World Health Organisation (WHO) and Chinese scientists, shows that of all suspected cases 1.7 per cent of women who contract the virus will die, compared with 2.8 per cent of men.
> 
> In confirmed cases, the infection is fatal for 4.7 per cent of men, but just 2.8 per cent of women, even though the gender balance for those testing positive is roughly split in half.

60s, male, paid for. Bye!"
2020-03-05,Capi9800,Coronavirus,11,https://www.reddit.com/r/Coronavirus/comments/fdyr25/survey_in_italy_95_of_italians_are_worried_about/fjkmifm/,"Also,this survey was taken in Sicily,which is now not in a state of emergency due to the coronavirus: Numbers are probably higher in regions in northern Italy."
2020-03-05,Kockx2019,wallstreetbets,11,https://www.reddit.com/r/wallstreetbets/comments/fe22hg/what_are_your_moves_tomorrow_march_06_2020/fjm0ou6/,I can’t make this shit up..... Vendor who sold concessions at Seattle XFL game tests positive for coronavirus
2020-03-05,willybarny,Coronavirus,11,https://www.reddit.com/r/Coronavirus/comments/fe2tr5/a_member_of_the_french_parliement_confirmed/fjlgy2q/,Breaking news:- French parliament surrenders to Coronavirus......
2020-03-05,-CosmicSock-,Coronavirus,11,https://www.reddit.com/r/Coronavirus/comments/fe4cqw/masks_do_work_and_any_type_of_mask_is_better_than/fjlqq2j/,"I’m not gonna put on my fake epidemiologist jacket for this, but as far as I’m aware, there is aerosolized spread of coronavirus. What you may be thinking of is airborne spread. If a virus is aerosolized it means that it is temporarily suspended in the air in small droplets of fluid. In the case of airborne spread, the virus is suspended in air on its own without being so quickly weighed down by the droplets of fluid we see in aerosolized transmission."
2020-03-05,bobobaa,Coronavirus,11,https://www.reddit.com/r/Coronavirus/comments/fdr7u4/daily_discussion_post_march_05_questions_images/fjm34vc/,"Not to sound paranoid, but my family may have already had it? I don't follow this virus very closely. I heard it was in WA as much as 6 weeks ago?

Jan 30 . I (27), school teacher, live in Las Vegas . I caught a respiratory virus. Felt like COMPLETE trash within 3 hours, body aches. By noon at the school I felt so weak, I couldn't stand for my last class. Bad dry cough develops at night. I just pass out. I had the flu last October and it was mild in comparison.

Jan 31, Skip work. I'm at the doctor. Negative for flu. No other tests, doc clear me for travel says I'm good to travel. At this time I didn't even consider if I had coronavirus, just some weird intense virus.  at night it gets bad. 103 fever, dry cough. Fever so high feels like I have sunburn, I pass out at some point. I have no memory of anything after. 

Feb 1st. I wake up at 102 fever, my family forced me to stay home and cancel trip. Spreads to my 55 year old father, smoker. Hits him even worse. 103 fever. He's hacking and coughing. VA says to just drink water, no need for appointment.

Feb 2nd. My mother catches it, 102 fever, aches, cough. All the same symptoms. I have to play nurse. 

Feb 3rd. I feel like hell but I recover slowly from then on. My girlfriend never caught it, but her mother did. 

It took 1.5 weeks for me to get better. 4 days for my mother and my gf's mother. My father, it lingers in him for 3 weeks. He confides he felt like he was going to die a few times. I have never seen this man so sick before in my life. It rattled him. He used to brag about how he never gets sick, now he's afraid to go out. 


You be the judge. Or the actual coronavirus worse?"
2020-03-05,sick-of-a-sickness,COVID19,11,https://www.reddit.com/r/COVID19/comments/fe6t9r/how_to_stay_informed_without_feeling_overwhelmed/fjm6zyl/,"Sticking to this sub and the r/medicine coronavirus thread (they do a megathread every 2-3 days) has REALLY taken my anxiety down like 15 notches. 

People on other subs (you know, ALL other corona subs) REALLY like to sensationalized and speculate, which is a really silly thing for them to do seeing as NONE of them know wtf they're talking about lol, people in these subs have scientific knowledge and are able to interpret a paper without speculating and projecting their doomsday wishes on everyone. Panicking the general public."
2020-03-05,Tree_Shirt,Coronavirus,11,https://www.reddit.com/r/Coronavirus/comments/fe1i2q/five_states_in_the_us_are_not_testing_for/fjl5nlu/,"This is wrong, there are currently tests being performed right now in Oklahoma.


https://okcfox.com/news/local/latest-coronavirus-test-in-oklahoma-comes-back-negative

Unless they mean testing inside the state using state labs? That I don’t know."
2020-03-05,crazeecatladee,nyc,11,https://www.reddit.com/r/nyc/comments/fe0hho/why_is_nobody_saying_anything_about_the_countless/fjlc28z/,"[https://www.instagram.com/p/B9XaTQRgJca/](https://www.instagram.com/p/B9XaTQRgJca/)

[https://www.instagram.com/p/B9P3eg3AuXp/](https://www.instagram.com/p/B9P3eg3AuXp/)

[https://www.nbcnews.com/news/us-news/coronavirus-hate-attack-woman-face-mask-allegedly-assaulted-man-who-n1130671](https://www.nbcnews.com/news/us-news/coronavirus-hate-attack-woman-face-mask-allegedly-assaulted-man-who-n1130671)"
2020-03-05,TRFilune,Anxiety,11,https://www.reddit.com/r/Anxiety/comments/eupik4/coronavirus_megathread/fjkz0ed/,"Day 4: Still kicking.

Hello everybody, it's ya boi, Radio Torrejon de Ardoz, bringing you regular updates from the Iberian Peninsula in its current fight against the Coronavirus.

First things first, me and my dad are still doing fine. We've both taken all of the measures we could do, and we're ready to ride this one out. Don't mistake my words for world-ending prepping, we just want to make sure that we can ride this out without any of us falling sick, of course. I hope that all of you are doing well so far too, ladies and gents. 

I have to confirm that we lost another person to the Virus here, making the official death count to 3. It was a 99 year old woman, who was living at a caretaker's home. Due to this, I have to assume that the residence, along with some of the older people in it, might be infected with it. The community's government is considering the option to close the caretaker homes until the crisis passes, but it has not been enforced yet.

Now that the regular update has been done, I  want to bring some sort of discussion to this. Something that I have noticed a long time ago.

'What is the cost of lies?'. Those words, who will always stay with me, were uttered by Valery Alekseyevich Legasov in the series of 'Chernobyl', portrayed by Jared Harris (blessed be his name). In the series, he uttered those words as criticism against the soviet apparatchik, and its blame culture, that contributed to the disastrous initial response to the disaster itself. The cost of lies is always great, and it will always collect its due, no matter how hard you try to hide it. We have seen how lies can make a problem grow worse. We have seen people flatout lying about this virus in order to promote homeopathic treatments that will not work against this. Hell, we've even seen some of the most insane theories still being paraded as 'absolute truth' (The Bioweapon theory, for instance)

Overall, do not give up. That is my recommendation to everyone that is involved in this subreddit. Your stories always bring a smile to my face, and your worries are the same as mine. I have a father who has diabetes. Not a genetical  problem, something he contracted some years ago. He doesnt need insulin, just takes some meds ocasionally, and he's had a very good diet so far. I'm proud of him, and I'm happy that he managed to do so. I have the lingering worry that somehow, this could cause him more complications, since the ministry of Health has classified it as a risk factor.

I will not lie. I am scared shitless when I think of that possibility. And I'm scared shitless because if it happens, I will be powerless to stop it. I only want to ask, can a very mild diabetes cause complications? How, and why? I need an answer to that, just the full truth.

Besides of that, I think I've already done all I could. Writing like this is the most effective coping mechanism I could find, besides of video games, and i'm happy that you're listening to my rambles. I'll still keep the updates coming, unless Corona-Chan takes my breath away all of a sudden, but I don't see that happening yet. What I will do today though, is start 'Narcos' all over again with my dad, and go back to Total War Warhammer. Sadly, the Skaven campaign was a bust, so i'll just play the Dwarves for this one. I hope that you all keep being awesome, people. Keep calm, and carry on."
2020-03-05,Sopi619,wallstreetbets,11,https://www.reddit.com/r/wallstreetbets/comments/fdtomr/daily_discussion_thread_march_05_2020/fjl0vy6/,"Welp, got a Coronavirus infection literally 2 minutes from my house. Looks like I’ll be a goner before my SPY 299p make me rich."
2020-03-05,twitterInfo_bot,Coronavirus,11,https://www.reddit.com/r/Coronavirus/comments/fe5oth/7_weeks_ago_china_announced_that_198_people_have/fjlyfml/,"""A surge of newly confirmed novel coronavirus (2019-nCoV) cases since Friday in Wuhan has pushed the outbreak total to 198 cases, some of them with no apparent links to the outbreak market."" 
 
 >publisher: @ScottGottliebMD"
