date,author,subreddit,score,url,text
2020-04-08,incorruptible61,CoronavirusCA,20,https://www.reddit.com/r/CoronavirusCA/comments/fxclrk/california_wont_be_lifting_coronavirus_stayathome/fmtqqvp/,"SAN FRANCISCO —  Even as California sees glimmers of hope amid [the coronavirus outbreak,](https://www.latimes.com/projects/california-coronavirus-cases-tracking-outbreak/#nt=0PromoSuperLeadLarge-1col-7030col1-main) authorities warn that the Golden State won’t be getting back to normal [anytime soon.](https://www.latimes.com/california/story/2020-04-07/california-coronavirus-curve-bending-gavin-newsom)

Officials expect months more of some [social distancing policies ](https://www.latimes.com/california/story/2020-04-07/coronavirus-face-covering-order-los-angeles-mayor-garcetti)and warn that lifting the strict rules too early could worsen the health crisis.

The public should realize that coronavirus cases [are likely to rise](https://www.latimes.com/california/story/2020-04-07/california-coronavirus-curve-bending-gavin-newsom) when stay-at-home orders are eased, officials said.

“There will definitely be individuals who will get sick. And because there are individuals who get sick, there will be individuals who die after the order is released, unless we come up with a foolproof immunization, which is highly unlikely,” said Dr. Jeffrey Smith, Santa Clara County executive officer.

Smith on Tuesday told that county’s Board of Supervisors that he did not expect there would be “any sports games until at least Thanksgiving, and we’d be lucky to have them by Thanksgiving. This is not something that’s going to be easy to do.”

In fact, it’s unlikely the new coronavirus will be completely eradicated, and the disease could become seasonal, Dr. Anthony Fauci, director of the National Institute of Allergy and Infectious Diseases, told CBS this week.

That would make it unlike a different deadly coronavirus scare of the past, the virus that caused [severe acute respiratory syndrome](https://www.cdc.gov/dotw/sars/index.html) in 2003, which killed 774 people worldwide and was fully contained within months.

On Monday, Fauci said getting back to normal would mean something different. There will be a gradual process by which society can begin to function again, he said during a [news conference](https://www.rev.com/blog/transcripts/donald-trump-coronavirus-task-force-briefing-transcript-april-6), but “if you want to get to pre-coronavirus, that might not ever happen in the sense of the fact that the threat is there.”

## Improving trends

Silicon Valley health officials are now [expressing more confidence](https://www.latimes.com/california/story/2020-04-07/california-coronavirus-curve-bending-gavin-newsom) that the shelter-in-place order implemented March 16 is working to curb the spread of the virus. Instead of projecting 50,000 coronavirus cases by May 1, the stay-at-home order may limit the number of cases in Santa Clara County to 2,500 to 12,000, according to a new estimate.

In addition, [Santa Clara County — the original epicenter](https://www.latimes.com/california/story/2020-03-25/coronavirus-why-santa-clara-became-california-epicenter-pandemic) of California’s coronavirus outbreak, where more than 1,200 cases have been reported and more than 40 deaths — may now be on track to have enough hospital beds to handle more COVID-19 patients in the coming weeks, the county public health officer said Tuesday.

## What’s next?

There are no easy answers about when state officials could begin to dial back the strict stay-at-home orders.

Public health officer Dr. Sara Cody said at a Santa Clara County Board of Supervisors meeting Tuesday there were four things that would need to be in place for stay-at-home orders to be eased:

**1. Robust hospital capacity**

Hospitals must be able to safely treat residents with the care they need when they need it. That also means hospitals must be able to protect healthcare workers, such as with [adequate supplies of masks, gowns and gloves](https://www.latimes.com/world-nation/newsletter/2020-04-08/federal-government-supply-seizures-hospitals-newsletter-todays-headlines).

Hospitals across California are continuing to find more space to prepare for additional hospital cases. In Marin County, with a population of about 260,000, officials say models suggest a continuous increase in COVID-19 cases and a possible surge in the next two to six weeks. They have been able to increase staffed bed capacity from 239 to about 400.

**2. The ability to test for the virus broadly**

Being able to test any patients who are [showing symptoms is essential.](https://www.latimes.com/california/story/2020-04-08/california-has-made-progress-on-testing-but-still-lags-most-states) The U.S. has been hobbled by a persistent shortage of tests.

**3. The ability to rapidly investigate new cases and isolate the newly infected**

Local health officials need to be able to investigate new cases, isolate the newly infected, and find those who may have had close contact with them and quarantine them to see if they show signs of illness.

“When we started back in the end of January, that’s exactly what we were doing: We carefully investigated every case, we carefully traced every contact, but of course, with the counts that we have today, we are not able to do that, and neither is anyone else,” Cody said.

**4. Sustained reduction in new coronavirus cases**

Finally, “we really need to see the sustained reduction in cases,” Cody said, and it would need to persist for at least one incubation period — the time it might take between infection and when a person shows signs of illness.

“We want to reassure ourselves that, for at least 14 days, we see that things have settled down,” Cody said.

California, initially one of the hardest-hit states, is now seeing a fraction of the cases and deaths of other states. By Tuesday night, California had reported more than 17,600 coronavirus cases and over 400 deaths; New York has reported more than 139,000 cases and more than 5,400 fatalities."
2020-04-08,Two_Tone_Stalone,AskReddit,20,https://www.reddit.com/r/AskReddit/comments/fxdwng/what_is_the_dumbest_conspiracy_you_have_ever_heard/fmu2a3s/,The Coronavirus is a hoax by the Democrats
2020-04-08,Im_Paolo_Not_Paulo,memes,20,https://www.reddit.com/r/memes/comments/fxkmfu/the_king_has_spoken_and_we_will_listen/fmuyfep/,"*gets Coronavirus*

""So anyways I started traveling"""
2020-04-08,Gravessss,insaneparents,20,https://www.reddit.com/r/insaneparents/comments/fxjity/update_im_immunocompromised_and_my_mom_refused_to/fmv1abp/,"Hey OP, first off, your mum sucks, second, I’m immune compromised too so i can feel that pain, i have Marfans Syndrome and if i catch the Coronavirus it could go directly to my heart, so I’ve been kinda panicking about all of this and it’s causing a lot of craziness in my mind and life but, I hope you get better soon! And i hope you’ll actually be able to isolate afterwards."
2020-04-08,Na3C6H5O7,xkcd,20,https://www.reddit.com/r/xkcd/comments/fxgnl6/xkcd_2291_new_sports_system/fmudx4q/,"Does this count as a coronavirus comic? I mean, this is the perfect sports system for quarantine."
2020-04-08,switch_switch,news,20,https://www.reddit.com/r/news/comments/fxgt8t/youtube_tightens_rules_after_david_icke_5g/fmue7v2/,"""Mr Icke also claimed that a coronavirus vaccine, when one is developed, would include ""nanotechnology microchips"" that would allow humans to be controlled. He added that Bill Gates - who is helping fund Covid-19 vaccine research - should be jailed. His views went unchallenged for much of the two-and-a-half-hour show.""

This guy is a moron."
2020-04-08,iwritethesongs2019,Philippines,20,https://www.reddit.com/r/Philippines/comments/fxhcfn/sa_pagiral_ng_enhanced_community_quarantine/fmuekgh/,"Youre seriously not reading the news.. 🤦‍♂️

https://www.rappler.com/nation/255117-dilg-response-exempting-tricycles-coronavirus-luzon-lockdown

https://cnnphilippines.com/news/2020/3/20/Pasig-tricycle-vs-Manila-e-trikes-DILG-.html

So this is LGU free will?"
2020-04-08,twittereddit9,AusFinance,20,https://www.reddit.com/r/AusFinance/comments/fxe6f9/the_sp500_is_now_just_19_off_its_all_time_high/fmuczad/,The same people who didn't know what coronavirus was on February 25 have fully priced all of the above in!
2020-04-08,disownedpear,quityourbullshit,20,https://www.reddit.com/r/quityourbullshit/comments/fxais8/facebook_user_tries_to_spread_misleading_meme/fmtmj1r/,"&#x200B;

[https://www.cnn.com/2020/04/07/politics/fact-check-trump-coronavirus-briefing-april-7/index.html](https://www.cnn.com/2020/04/07/politics/fact-check-trump-coronavirus-briefing-april-7/index.html)

"" President Donald Trump on Tuesday made inaccurate claims about the World Health Organization and delivered more of the false statements that have become a signature trait of his daily coronavirus briefings. """
2020-04-08,11greymatter,Coronavirus,20,https://www.reddit.com/r/Coronavirus/comments/fxhus7/california_to_buy_200_million_masks_a_month_amid/fmurlxz/,"> Wish it was clearer on where the masks originate.

California is buying the masks from BYD North America, which is a subsidiary of BYD, an electric car company in China. When the coronavirus hit China, BYD turned one of their automobile factories into a mask making factory, capable of making 5 million masks a day.  

https://en.byd.com/news-posts/byd-opens-worlds-largest-face-mask-manufacturing-plant/"
2020-04-08,JzargoTheMage,Gamingcirclejerk,20,https://www.reddit.com/r/Gamingcirclejerk/comments/fwf9yj/unjerk_thread_of_april_07_2020/fmuuxot/,"I will vote for Biden in November to get Trump out of office, but saying the Dem Libs would have stopped this is bullshit. Up to the primary, Joe Biden himself and his campaign were encouraging voters and saying it was safe to vote, on the basis that a polling place is different than a convention arena. The Republicans did the heavy lifting but the Dems weren't exactly blameless. 

Only after polls closed, Joe Biden backed off and said we shouldn't have had it. The DNC while better than the Republicans, are still scumbags who endanger voters so they can prop up their golden boy.

 Just look at Diane Feinstein, one of the star Lib Dems, who sold her stocks when told of the dangers of Coronavirus in a classified meeting like those four Republicans."
2020-04-08,Schoolqu,nursing,20,https://www.reddit.com/r/nursing/comments/fxapkr/coronavirus_84_residents_evacuated_from_riverside/fmulhc1/,"Elderly wouldn’t be there if their families hadn’t abandoned them to a nursing home in the first place.

>There are 34 confirmed cases of the novel coronavirus among the residents and five among employees, officials said.

The employees did the right thing. If the nursing home had been provided proper PPE by the company, then no employees would’ve tested positive. 

It’s not your place to ask people to risk their lives and their families’ lives, especially for a job. If a company doesn’t treat you like a human, then leave. The employees did the right thing."
2020-04-08,Anbuleader,SelfAwarewolves,20,https://www.reddit.com/r/SelfAwarewolves/comments/fxg4as/trumps_supporters_will_listen_to_75_of_doctors/fmue33v/,"Someone should point out what doctor Fauci said on fox news. About this exact same thing and that facts don't care about their feelings. Or maybe this second link where and expert is telling fox 

https://www.thedailybeast.com/dr-fauci-shuts-down-fox-and-friends-on-coronavirus-cure-says-we-dont-operate-on-how-you-feel

https://video.foxnews.com/v/6147481787001?fbclid=IwAR0ye7lcF5vNZHEFFiorbLFU0l8sXC6-eYEbvcTawJZfj1DmFlLRaa9iZIs#sp=show-clips"
2020-04-08,BuddhistNudist987,ABoringDystopia,20,https://www.reddit.com/r/ABoringDystopia/comments/fx7g05/clearly_the_next_best_thing/fmthww9/,"I'm a janitor at a hospital, too. Three weeks ago I was cleaning hospital bathrooms and sanitizing blood draw rooms, no increased pay or face masks. Two weeks ago I had my hours cut from full time to part time because so many other people are working from home. Last Friday my whole department got an email from our boss's boss telling us how important and essential our work is to keep the virus from spreading. Yesterday the whole hospital got an email requiring us to wear a mask (that are all kept locked up and I have to ask for if someone will allow me one) or make one ourselves. 

I know for a fact that people at my hospital have died from the coronavirus in the last 24 hours. It was on the local news. 

I barely made enough money to support myself before. How is anyone supposed to make it through this?"
2020-04-08,MyDearFunnyMan,Coronavirus,20,https://www.reddit.com/r/Coronavirus/comments/fx9lto/italy_performed_more_than_50k_tests_in_the_last/fmtlzi8/,Maybe 5G prevents Coronavirus.
2020-04-08,Humptythe21st,Conservative,20,https://www.reddit.com/r/Conservative/comments/fxfjmp/the_head_of_the_world_health_organization_took/fmu2wox/,"""Tedros tweeted praise for China on March 20, saying: ""[f]or the first time, #China has reported no domestic #COVID19 cases yesterday. This is an amazing achievement, which gives us all reassurance that the #coronavirus can be beaten.""

I believe that. If you don't test ,you don't get new cases."
2020-04-08,knotty_pretzel_thief,kansas,19,https://www.reddit.com/r/kansas/comments/fxd1mw/state_attorney_general_tells_police_not_to_limit/fmtnfb6/,"Nobody's being prohibited from practicing their religion; only gathering in groups of more than 10 people. And it sends a distinct message when the state's top law enforcement official tells police to blatantly disregard an executive order given during a state of emergency. Maybe not everyone of the people who violate the order will be vulnerable to the coronavirus, but I guarantee they interact with someone who is. People will die."
2020-04-08,b14nn,AskReddit,19,https://www.reddit.com/r/AskReddit/comments/fxcpfg/what_are_you_having_a_hard_time_with_now/fmtruuw/,"I’m a nurse. My normal workplace is closed and so everyday I turn up to work not knowing what unit I’m going to work in and if I’m going to see anyone I actually know that shift.

I can’t sleep because I lie awake at night worrying about the next shift. I work seven days in a row. I am exhausted. Having to deal with coronavirus patients is just adding to the pressure."
2020-04-08,djh_van,dataisbeautiful,19,https://www.reddit.com/r/dataisbeautiful/comments/fxam15/oc_how_much_billionaires_are_contributing_for/fmuoh6x/,"Jack should have hashtagged it the *Coronavirus Billionaire's Challenge*, tagged another billionaire, and said ""You're up next, Billionaire""."
2020-04-08,Ordinary_Gene,Coronavirus,19,https://www.reddit.com/r/Coronavirus/comments/fxjxiw/nyc_hospitals_are_allowing_coronaviruspositive/fmuul78/,"While WaPo has an article saying 90k medical personnel volunteered and most are sitting idle.  Stupidity transcends all metrics.

https://www.washingtonpost.com/health/2020/04/08/ninety-thousand-medical-workers-volunteered-help-new-york-battle-coronavirus-most-are-sitting-idle/"
2020-04-08,PossumJackPollock,Coronavirus,19,https://www.reddit.com/r/Coronavirus/comments/fx9zph/fauci_looks_like_us_deaths_will_be_lower_than/fmuamil/,Apparently not. the Families First Coronavirus Response Act assistance passed by Trump apparently doesn't apply to pharmacies.
2020-04-08,frickinjaygaragearoo,worldnews,19,https://www.reddit.com/r/worldnews/comments/fx79nt/donald_trump_sends_200_ventilators_to_the_uk/fmtkksc/,"I haven't seen a video, I think that would be pretty hard to make as recording isn't standard procedure in most medical facilities due to HIPAA (though obviously many HIPAA restrictions have been lifted). Here is a NYT article that basically reads the same as the LAT article:  [https://www.nytimes.com/2020/04/06/us/politics/coronavirus-fema-medical-supplies.html](https://www.nytimes.com/2020/04/06/us/politics/coronavirus-fema-medical-supplies.html)"
2020-04-08,Endless_Vanity,Coronavirus,19,https://www.reddit.com/r/Coronavirus/comments/fxf7xa/the_face_mask_debate_reveals_a_scientific_double/fmtyt8y/,[Make your own like everyone does who wants one.](https://www.cdc.gov/coronavirus/2019-ncov/prevent-getting-sick/diy-cloth-face-coverings.html)
2020-04-08,dwdsquared2,wallstreetbets,19,https://www.reddit.com/r/wallstreetbets/comments/fxev5z/what_are_your_moves_tomorrow_april_09_2020/fmu9ek6/,Wimbledon tennis tournament paid $2 million/year for the last 17 years ($34 mill) for pandemic insurance and is set to receive a $141 million payout for Coronavirus event.
2020-04-08,modernjaneausten,FundieSnark,19,https://www.reddit.com/r/FundieSnark/comments/fxh1oy/what_a_strange_way_to_deal_with_grief/fmuaz5j/,"This is so beyond stupid. If they didn’t know yet for sure how he died, why in the actual hell did she decide to include all the coronavirus crap in her original post? That family is insane."
2020-04-08,PM_How_To_PM,TikTokCringe,19,https://www.reddit.com/r/TikTokCringe/comments/fx8ws1/the_subtlety_of_this_one_blew_me_away_lmao/fmthb5l/,"He goes to ""Cure the Coronavirus"" but then you're supposed to notice the dog as he/she watches the dude go over to the ""Date Addison Rae"""
2020-04-08,Raccoonpug,wallstreetbets,19,https://www.reddit.com/r/wallstreetbets/comments/fxg81k/r_u_considering_changing_your_mind_latest_episode/fmu53wb/,"1. Unemployment
2. Bad earning
3. Death/ virus
3. Predicted coronavirus to last til july or august
4. Businesses closes
5.  Not just the US but global
6. Pussy ass Jpowell"
2020-04-08,Scioto_,AskReddit,19,https://www.reddit.com/r/AskReddit/comments/fxdwng/what_is_the_dumbest_conspiracy_you_have_ever_heard/fmttxvw/,5G Coronavirus. It's right there with believing the Earth is flat.
2020-04-08,poliscijunki,nyc,19,https://www.reddit.com/r/nyc/comments/fxe1qv/86yearold_is_killed_in_er_over_social_distancing/fmtqra6/,"One Saturday afternoon in late March, as the coronavirus pandemic flooded hospitals across New York City with desperately ill people, an 86-year-old lost her bearings and started wandering the emergency room at Woodhull Medical and Mental Health Center in Brooklyn.

The woman, Janie Marshall, who had dementia, grabbed onto another patient’s IV pole to regain her balance and orient herself, the police said.

The patient, Cassandra Lundy, 32, had apparently become irate that Ms. Marshall had broken the six feet of personal space recommended to help prevent the spread of the coronavirus, law enforcement officials said. Ms. Lundy shoved the older woman, knocking her to the floor. Ms. Marshall struck her head and died three hours later.

Ms. Marshall’s death underscored how hospital officials are struggling to keep order in health care facilities overrun by the pandemic, as crowding generates a new level of fear and anxiety.

Initially, hospital officials handed Ms. Lundy a summons for disorderly conduct. But a week later, after the medical examiner ruled Ms. Marshall’s death a homicide, the police charged Ms. Lundy with manslaughter and assault.

“How do you put your hands on a 86-year-old woman?” said Ms. Marshall’s grandniece, Antoinette Leonard Jean Charles, 41, a medical student in Tennessee. “I also understand the fear level of every person in New York has. There is a notion of every man for themselves. But attacking an elderly person? That went too far.”

Ms. Lundy’s public defender, George Cooke, could not be immediately reached for comment on the charges.

New York officials imposed social-distancing rules — maintaining space between people to stop the spread of the highly contagious coronavirus virus — in mid-March, shortly after the metropolis became the epicenter of the outbreak in the United States. The virus has claimed the lives of thousands of New Yorkers in a little more than a month.

In a statement, Woodhull hospital officials said they were cooperating with investigators.

“We are terribly saddened by this death,” the hospital said in a statement. “We are committed to ensuring a safe, health-focused environment in these very demanding times so our heroic health care workers can continue to deliver the quality, compassionate care New Yorkers need more than ever.”

The events that led to Ms. Marshall’s death began on March 27, when she told her niece she had a piercing stomachache. The niece, Eleanor Leonard, 72, called an ambulance, which took Ms. Marshall to Woodhull, where she had been treated for similar symptoms earlier in the week.

In the crowded emergency room, Ms. Marshall was diagnosed with a blocked bowel, and doctors said they would admit her, Ms. Leonard said.

But the hospital, in an effort to limit the spread of the coronavirus, did not allow Ms. Leonard or other family members to stay with her in the emergency room. Ms. Leonard said she could do nothing but wait by the phone for updates.

The next day at about 2 p.m., Ms. Marshall, disoriented, began walking around the emergency room, the police said. She crossed paths with Ms. Lundy, and the women — both from Brooklyn — got into an argument before the younger woman pushed her to the ground.

Ms. Marshall hit her head on the floor, lost consciousness and died hours later, investigators said. Ms. Lundy told detectives she had shoved Ms. Marshall because she “got into the defendant’s space,” according to a criminal complaint. The attack was captured on surveillance video, the complaint said.

Unaware of Ms. Marshall’s injury, Ms. Leonard kept calling the hospital that day. She finally reached someone shortly after 5 p.m. who told her that Ms. Marshall was with a nurse receiving medical care.

“I thought, ‘That’s great. She’s being tended to,’” Ms. Leonard recalled. “I didn’t know she was dead already.”

Ms. Leonard went to sleep feeling hopeful. Her phone rang at 3:30 the next morning. A doctor told her that Ms. Marshall had gone into cardiac arrest. “Are you telling me she’s dead?” Ms. Leonard recalled saying. “What happened?”

Ms. Leonard said she went to the hospital later that morning, but after several hours of waiting was sent home without an explanation.

“We thought it was weird, cardiac arrest?” Ms. Jean Charles, the grandniece, said. “She had gone in for something completely different. She suffered from dementia, bowel blockage, not heart problems that we knew of.”

Then a cousin on Long Island called Ms. Leonard with troubling news. He had seen a news report online. “Did you know your aunt was murdered?” the cousin asked.

Ms. Leonard then searched her aunt’s name on Google and saw news accounts. “I was so stunned,” she said. “It just tore at my gut that something like this would happen.”

Ms. Leonard wonders why hospital officials did not inform her about the incident when it happened. “I understand we are in the middle of a pandemic,” she said, “but to say nothing?”

Ms. Lundy has previous arrests, including charges of drug possession in 2018 and 2019, according to court records. It remained unclear why she had visited the hospital that night.

Ms. Marshall was born in Abbeville, S.C., in 1934, the youngest of 12 children. Her parents died when she was young and she followed some of her siblings to New York City, settling in Williamsburg, family members said.

“She arrived with big dreams and wide eyes, ready to take on the world,” Ms. Jean Charles said.

She became a successful accountant at a time when few black women practiced the profession, eventually working for the Social Security Administration and earning a bachelor’s degree from Queens College. She never married or had children, but she was a role model to her numerous nieces and nephews, her relatives said.

“We don’t want to remember her as a victim,” Ms. Jean Charles said. “She always told us, there is no shame in being the first African-American in any field. She was a leader.”

As it has become customary during the coronavirus pandemic, Ms. Marshall’s relatives and members of her church, Concord Baptist Church of Christ in Brooklyn, were planning to attend a virtual funeral service on Tuesday to abide by social-distancing rules, her family said.

Ms. Leonard said she planned to ride in a limousine by herself to Pinelawn Memorial Park on Long Island and bid her one last farewell from inside the vehicle.

“We want to obey social-distancing rules, and yet she died because of these social-distancing rules,” Ms. Jean-Charles said. “It’s ironic in a very sad way.”"
2020-04-08,orwell,Sacramento,19,https://www.reddit.com/r/Sacramento/comments/fxae0v/governor_on_radio_interview_says_schools_will_not/fmtxons/,it's because h1n1 vaccine was just based on already existing Influenza vaccines (which have been around for 70+years). No working human coronavirus vaccines exist to speed up COVID-19 vaccine development as rapidly as H1N1.  Influenza and coronavirus are not the same viruses
2020-04-08,starwarsfanb0y,dankmemes,19,https://www.reddit.com/r/dankmemes/comments/fxa5i5/today_is_a_sad_day/fmtxg2d/,"And bidens supporters are mainly white boomers, biden will not do anything different than what trump is doing, biden is corrupt and so will do anything his wealthy friends want him to do. With the coronavirus more people are seeking socialist measures like free healthcare which is what bernie is proposing. But bernie wasnt doing enough to tackle biden and he didnt want to say anything about bidens apparent dementia because, ""he is a good friend"""
2020-04-08,kedipult,worldnews,19,https://www.reddit.com/r/worldnews/comments/fx9mv4/french_hospital_stops_hydroxychloroquine/fmu2yn1/,"Ya too bad doctors wouldn't be able to tell if their patients had heart disease while treating them for coronavirus, right?"
