date,author,subreddit,score,url,text
2020-02-22,spaceshifty,China_Flu,119,https://www.reddit.com/r/China_Flu/comments/f818nx/as_an_italian_my_humble_opinion_of_why_italy_has/fii2p0y/,We have tested a whopping total of 414 here in the United States. It's embarrassing. https://www.cdc.gov/coronavirus/2019-ncov/cases-in-us.html
2020-02-22,w-on,interestingasfuck,117,https://www.reddit.com/r/interestingasfuck/comments/f840el/coronavirus_compared_to_other_virus_outbreaks/fij2qvf/,"Hey guys, it looks like OP literally screenrecorded the actual video. All good, but here is the [actual video](https://youtu.be/6dDD2tHWWnU) by CaryKH.


This video had many other comparisons than just this one, highly recommend it.


Here is the boiled down version of CaryKH’s conclusion, a **TLDR** of videos.

>Coronavirus is bad, and will get much worse than it is currently; however, at its current infectivity, location, and immunity, you are extremely unlikely to get Coronavirus. If anything, you are many times more likely to die of a stroke tomorrow than even contract Coronavirus.

**MY CONCLUSION** (after speaking with an M.D. who works in global health) is that Coronavirus will be terrible, much worse than the swine flu, and will kill many. But you probably won’t die. Coronavirus kills mostly elders or infants. (People who are vulnerable), but it is a respiratory disease which we have 0 immunity to, so it will almost for sure be a worldwide epidemic, and likely becoming a pandemic. 

*take my comment with a grain of salt, and I would suggest watching/reading other conclusions.*"
2020-02-22,UrbanPick8813,interestingasfuck,82,https://www.reddit.com/r/interestingasfuck/comments/f840el/coronavirus_compared_to_other_virus_outbreaks/fiixvf4/,"That lack of awareness over this disease is crazy. Anybody who believes Chinas numbers needs to rethink. Also, people who compare it to the normal flu need to understand that the ratio of infected to deaths is far higher with coronavirus. This is a scary outbreak."
2020-02-22,NSA_Official_Account,wallstreetbets,78,https://www.reddit.com/r/wallstreetbets/comments/f84j52/calling_it_now_china_created_the_coronavirus_to/fij22h7/,"So this is what happens when you cherrypick a single set of data and make a conclusion, which tbf is what most of this sub does. 

Yes, the coronavirus has a higher fatal % the older you are, *however*, it has only kill ~2,000 people so far, not enough to even make a fucking dent on the aging population. Hell, it would barely does anything to the demographics even with 200,000 deaths in China. 

Secondly, around 20% of the cases are severe, and while most can make full recovery, the virus can have a lot of permanent, long lasting effects, for example lung fibrosis. Which means that more working people can actually be fucked in long term and become a burden to the economy than the virus can kill the older population. 

Lastly, would they stopped their entire economy for one months, which will cost them billions of dollars, just for a solution that *might* worked? 

TLDR: OP is retarded, buy SPCE calls pls or ill be homeless by next month"
2020-02-22,Opinion8Her,AmItheAsshole,72,https://www.reddit.com/r/AmItheAsshole/comments/f7ugus/wibta_if_i_tracked_down_this_entitled_parents_and/fiiglm3/,"Not only should the staff handle it, but the staff should be questioned as to why unruly children are even being permitted on the mother/baby unit if they aren’t there specifically to meet a new sibling and then leave. Hello...germs?  CoRoNaViRuS?  MEASLES??"
2020-02-22,covidcanada,China_Flu,68,https://www.reddit.com/r/China_Flu/comments/f818nx/as_an_italian_my_humble_opinion_of_why_italy_has/fii59ir/,"In BC, Canada, they have tested 996 samples so far...Don't understand what US is doing... [http://www.bccdc.ca/about/news-stories/stories/2020/information-on-novel-coronavirus](http://www.bccdc.ca/about/news-stories/stories/2020/information-on-novel-coronavirus)"
2020-02-22,anonymous_peasant,PewdiepieSubmissions,61,https://www.reddit.com/r/PewdiepieSubmissions/comments/f81n50/kool/fiiwa88/,That's because he was trying to speak Chinese because the coronavirus originated there
2020-02-22,planetdaily420,Coronavirus,58,https://www.reddit.com/r/Coronavirus/comments/f81w2x/australia_not_testing_on_weekends/fii9lxt/,"ahhhh yes, because the coronavirus has been proven not to spread on weekends....."
2020-02-22,skeebidybop,Coronavirus,56,https://www.reddit.com/r/Coronavirus/comments/f81ov0/this_sunday_marks_one_month_since_wuhan_went_into/fii6khy/,"That still blows my mind - feels like it's been a few months at least.

Coronavirus time dilation is a very real phenomenon"
2020-02-22,Prometheus1889,pics,52,https://www.reddit.com/r/pics/comments/f7zt99/husband_and_wife_on_first_line_of_defense_against/fiiggbh/,"Upvoted for speaking unpopular truth. China FUCKED UP. Now there is a nation-wide, multimillion dollar social media campaign to change international opinion while jailing journalists, this is alongside massive quarantine measures that pit neighbor against neighbor in a failed bid to contain the virus. 

 [https://www.nytimes.com/2020/02/14/business/wuhan-coronavirus-journalists.html](https://www.nytimes.com/2020/02/14/business/wuhan-coronavirus-journalists.html)"
2020-02-22,drstins_n,italy,51,https://www.reddit.com/r/italy/comments/f7txjb/megathread_3_coronavirus/fih8gxg/,"> Si allontana da Codogno e torna ad Avellino: famiglia in quarantena
Si è allontanato da Codogno, in provincia di Lodi, dove risiede, nonostante la quarantena imposta per l'emergenza da coronavirus, ed è ritornato nel paese di origine a Montefusco, comune di un migliaio di abitanti in provincia di Avellino. Un 27enne è ora sottoposto alla quarantena assieme a tutta la sua famiglia


***** ***!"
2020-02-22,IceTea666,italy,50,https://www.reddit.com/r/italy/comments/f7txjb/megathread_3_coronavirus/fihft9k/,"Dogana slovenia/croazia. Il poliziotto croato che doveva controllarmi i documenti se ne resta ad un metro di distanza e mi fa ""vai pure, non ti controllo se no mi passi il coronavirus""
:) simpaticone :)

Magari al ritorno riempio la
macchina di droga o armi tanto non mi controllano /s"
2020-02-22,patbaum,China_Flu,38,https://www.reddit.com/r/China_Flu/comments/f81m3c/my_friend_seriously_every_time_theres_something/fii5thp/,Just imagine a future with the annual Coronavirus season in addition to the flu season.
2020-02-22,THe1238,memes,37,https://www.reddit.com/r/memes/comments/f7z5tr/at_least_there_is_something_good/fii1pvx/,Yeah but most people still call it the coronavirus
2020-02-22,verguenzanonima,Coronavirus,35,https://www.reddit.com/r/Coronavirus/comments/f7x1da/cdc_raises_japan_to_level_2/figd77o/,"Same with South Korea.   


 [https://wwwnc.cdc.gov/travel/notices/alert/coronavirus-south-korea](https://wwwnc.cdc.gov/travel/notices/alert/coronavirus-south-korea)"
2020-02-22,FFrisk,Coronavirus,34,https://www.reddit.com/r/Coronavirus/comments/f7x04j/the_38yearold_man_had_traveled_to_china_and_was/figftgj/,"Just to clarify, this is really bad and means that we don't know who 'brought' the virus in Italy.  
Authorities thought that the first person tested positive for the virus yesterday got infected from a ~~colleague~~ friend that works in China and came back for holidays. However, the latter was tested negative for the coronavirus and now we have confirmation he never had it, since he has no specific antibodies.

[Source](https://www.tgcom24.mediaset.it/cronaca/coronavirus-presunto-paziente-zero-del-focolaio-lodigiano-non-ha-mai-avuto-il-virus_15180375-202002a.shtml) (italian). If needed I can translate the full article, or at least summarise it."
2020-02-22,patbaum,China_Flu,33,https://www.reddit.com/r/China_Flu/comments/f81q0c/whats_the_most_realistic_however_most_scary/fii82pg/,"It becomes an annual “Coronavirus season” and you can’t make a good vaccine for reasons similar to trouble with getting a working SARS vaccine.

Even if a low severity rate, if it repeats yearly like the flu it’s just a massive drag on economy and ability to have “pre 2020 normalcy”"
2020-02-22,historiangeek,Coronavirus,33,https://www.reddit.com/r/Coronavirus/comments/f82lq9/signs_that_infection_is_slowing_in_wuhan/fiijq7z/,"Or it’s just a sign of increased social media censorship...this alone is not a conclusive data point.


Old npr article about this below:

https://www.npr.org/sections/goatsandsoda/2020/02/08/803766743/critics-say-china-has-suppressed-and-censored-information-in-coronavirus-outbrea"
2020-02-22,skeebidybop,Coronavirus,33,https://www.reddit.com/r/Coronavirus/comments/f82lq9/signs_that_infection_is_slowing_in_wuhan/fiilep1/,">I would say majority are non-coronavirus patients (especially cancer and dialysis patients) asking for help because **their care has been interrupted due to the coronavirus.**

I'm glad you brought that up. This is a huge factor in the overwhelming of healthcare systems that many are overlooking"
2020-02-22,jeremy1338,soccer,32,https://www.reddit.com/r/soccer/comments/f808j0/italian_prime_minister_has_announced_that_all/fihlm3c/,Covid-19 is Coronavirus for anyone wondering
2020-02-22,GROUND45,MMA,31,https://www.reddit.com/r/MMA/comments/f7yi1y/official_ufc_on_espn_26_felder_vs_hooker_live/fiicvii/,"""She's been affected by the Coronavirus"" 

lol come on, bruh."
2020-02-22,Numismatists,funny,30,https://www.reddit.com/r/funny/comments/f7tb6r/ordered_an_espresso_shot_over_ice_this_morning/fign964/,"Not everything.  I am pretty knowledgeable about the destruction of the ecosphere though.

Here, learn something;

Reduction in aerosol output from shipping due to change from bunker fuel to higher grade fuel
https://www.nature.com/articles/s41467-017-02774-9?utm_source=share&utm_medium=ios_app&utm_name=iossmf

Early NBC story on shipping fuels
https://www.cnbc.com/2019/03/01/biggest-change-in-fuel-since-leaded-gas-went-away-could-raise-prices.html

Phillips 66 4th quarter 2019 earnings call
“To the industry's credit, the transition to the low-sulfur marine fuel market has gone very smoothly...  I think there will be strong enforcement. Very low-sulfur fuel oil has been rapidly adopted.”
https://www.nasdaq.com/articles/phillips-66-psx-q4-2019-earnings-call-transcript-2020-02-01

70% reduction in Chinese air travel since Coronavirus outbreak
https://www.cnn.com/2020/02/03/business/china-eastern-coronavirus/index.html

China’s efforts to lower aerosols have been working (December 2019)
https://www.researchgate.net/publication/337776219_Improvement_of_Air_Pollution_in_China_Inferred_from_Changes_between_Satellite-Based_and_Measured_Surface_Solar_Radiation

China as already lowered their sulphur emissions significantly.
https://res.mdpi.com/d_attachment/remotesensing/remotesensing-12-00523/article_deploy/remotesensing-12-00523-v2.pdf

Airline industry having a difficult time 
https://www.businessinsider.com/coronavirus-flight-suspensions-delta-suspends-china-flights-american-united-2020-1

Shipping industry in trouble
https://www.wsj.com/articles/shipping-bellwether-hits-all-time-low-11580744101

https://www.petroleum-economist.com/articles/midstream-downstream/tankers/2020/imo-2020-promises-widespread-disruption"
2020-02-22,barnard33,soccer,25,https://www.reddit.com/r/soccer/comments/f808j0/italian_prime_minister_has_announced_that_all/fihw5iw/,"or ""Covid-19 is a coronavirus""."
2020-02-22,MeatwadMeatwad,dankmemes,25,https://www.reddit.com/r/dankmemes/comments/f7uo4t/definitely_stonks/figx4va/,A fucking quarter is massive because China is the worst when it comes to pollution. Take some time to thank the coronavirus.
2020-02-22,pollin00,italy,25,https://www.reddit.com/r/italy/comments/f7txjb/megathread_3_coronavirus/fih3tom/,"Comunque veramente non so quanti casi a sto punto ci siano negli altri paesi, io vivo in Germania e ho la febbre da ieri anche se solo 37.5 ho chiamato il numero e la tipa sembrava pure seccata. Sono andato a farmi vedere e quando ho detto che ero preoccupato per il coronavirus e che non volevo uscire mi hanno praticamente riso in faccia. Ok non allarmare però uno ci prova e poi queste sono le relazioni.."
2020-02-22,KebabDrogo,The_Donald,24,https://www.reddit.com/r/The_Donald/comments/f8284e/anyone_notice_a_trend/fiilwj1/,On pace with Coronavirus
2020-02-22,bignoony2421,wallstreetbets,23,https://www.reddit.com/r/wallstreetbets/comments/f80clb/bought_the_dip_anyone_else/fihnln8/,Monday and Tuesday gonna be aggressive sell off. Wednesday the Dow goes up 500 when “markets gain back last week’s losses after Coronavirus fears ease”
2020-02-22,PM_ME_EDGEWORTH_NUDE,smashbros,23,https://www.reddit.com/r/smashbros/comments/f83533/umebura_sp8_cancelled_due_to_coronavirus_concerns/fiiso0t/,"jeez fuck I have a trip planned to Japan in June and we have to make a stop to China for 15 hours

I seriously hope they get this coronavirus outbreak under control, this is really scaring me :("
2020-02-22,jeffyouwon,China_Flu,23,https://www.reddit.com/r/China_Flu/comments/f7zp6l/chinas_official_rag_finally_admits_coronavirus/fiherh5/,"I think most likely it could be accidentally released -- that a virus researcher was infected while working on a coronavirus.  Once the virus is out, the market was the scapegoat.  The bio-weapons theory seems a bit far fetched but further proof is needed to support either side's case.  But likely the virus is natural, just not from something sold at the Huanan market."
2020-02-22,UnicornHostels,Coronavirus,22,https://www.reddit.com/r/Coronavirus/comments/f7ye9n/how_have_c16_of_the_italian_cases_gone_from_not/figwkim/,"Awhile ago I had a conversation about whether it would be better to be sick in the beginning or the middle of this spread. 

The problem with being a patient in the front of this disease is you get treated like an idiot by doctors.  Think about what your doctor would say if you can down with flu like symptoms and you went to see him tomorrow.  Is he/she going to test you for coronavirus? No.  Think you have it? No.  If you tell them you think it is Covid19, do you think they will laugh at you?  Yeah probably. 

So it could be it’s not the patient’s fault but the healthcare’s arrogance, negligence or ignorance."
2020-02-22,Sacrebuse,Enough_Sanders_Spam,22,https://www.reddit.com/r/Enough_Sanders_Spam/comments/f7ugq6/nevada_caucus_megathread/fihc7aq/,"Coronavirus, I'm at peace. You can take me away now. Help me escape this fucking world."
2020-02-22,mataffakka,italy,22,https://www.reddit.com/r/italy/comments/f7txjb/megathread_3_coronavirus/fihpk74/,"Ma quindi il decreto Coronavirus è legge? Come funziona?

Bello come Salvini fa i raduni di Sansepolcro dei poveri e le Marce sul Papeete da 6 mesi, e Chad Conte ottiene *i pieni poteri* per un paio di polmoniti e nessuno oserà dirgli un cazzo."
2020-02-22,UrbanPick8813,interestingasfuck,22,https://www.reddit.com/r/interestingasfuck/comments/f840el/coronavirus_compared_to_other_virus_outbreaks/fiiyksv/,"It is FAR bigger than we know now. It takes 2 weeks for the symptoms to show. So everything we see about the coronavirus is two weeks old in a sense. That is 2 weeks of people walking around in large crowds, touching door knobs/handles, sneezing, coughing, etc. I wish people would pay more attention."
2020-02-22,Miss_Smokahontas,Wuhan_Flu,21,https://www.reddit.com/r/Wuhan_Flu/comments/f80nf9/italy_has_really_hit_the_oh_shit_point_78/fihrjxj/,The US secret to combating coronavirus.  Crisis solved!
2020-02-22,duatewolf,italy,20,https://www.reddit.com/r/italy/comments/f7txjb/megathread_3_coronavirus/fihnqpf/,the virgin decreto sicurezza vs the chad decreto coronavirus
2020-02-22,gforSVJ,wallstreetbets,20,https://www.reddit.com/r/wallstreetbets/comments/f7hla8/weekend_discussion_thread_february_2123_2020/fifqhab/,"Samsung confirms one coronavirus case at phone factory complex in South Korea

https://www.channelnewsasia.com/news/asia/samsung-coronavirus-case-phone-factory-south-korea-12460882?utm_source=share&utm_medium=ios_app&utm_name=iossmf"
2020-02-22,pstjdikgf5000,bugout,19,https://www.reddit.com/r/bugout/comments/f82vik/the_cdc_is_now_telling_the_public_a_pandemic_is/fiiqsy6/,"Just as a general rule about reading news, organizations like the CDC publish info themselves and it's often worthwhile to go to them after reading a news headline. The link I put here says:

Situation in U.S.

Imported cases of COVID-19 in travelers have been detected in the U.S. Person-to-person spread of COVID-19 also has been seen among close contacts of returned travelers from Wuhan, but at this time, this virus is NOT currently spreading in the community in the United States.

https://www.cdc.gov/coronavirus/2019-nCoV/summary.html

To answer your question, if it was a pandemic, I'd consider this a stay in place situation. Quarantine yourself but staying in town, closer to a hospital, is probably a good idea if you live in a city."
2020-02-22,Sonounuomoebasta,italy,19,https://www.reddit.com/r/italy/comments/f7txjb/megathread_3_coronavirus/fihi0jj/,"Protezione civile, ultimo aggiornamento sul coronavirus in Italia.

79 contagiati, di cui 2 morti e un dimesso.

Ricoverati con sintomi 33

In terapia intensiva 18

Positive in isolamento domiciliare 11"
2020-02-22,cheeblet,wallstreetbets,17,https://www.reddit.com/r/wallstreetbets/comments/f7hla8/weekend_discussion_thread_february_2123_2020/fiha7vw/,"you guys are retarded

I had lunch at my local chinese place and I don't have coronavirus

fucking overreacting"
2020-02-22,ShamelessC,AskScienceDiscussion,17,https://www.reddit.com/r/AskScienceDiscussion/comments/f7seje/if_you_have_recovered_from_the_coronavirus_can/fihgclw/,Coronavirus uh... finds a way
2020-02-22,InternetCaesar,Coronavirus,17,https://www.reddit.com/r/Coronavirus/comments/f80870/some_passengers_of_diamond_princess_will_be/fihlh2d/,"Only in the US do we have to wait for the local TV stations to tell us where victims of the Diamond Princess end up... 

Nebraska, Texas, California and now Alabama. 

Looks like we're sharing the love around, can we get a New England ""Where's Coronavirus"" facility too?"
2020-02-22,skeebidybop,Coronavirus,16,https://www.reddit.com/r/Coronavirus/comments/f82u7t/bno_news_has_been_the_real_mvp_so_far/fiipxgf/,"They are a small international news agency based in the Netherlands. Regarding the Coronavirus, they *rapidly* aggregate live updates for all over the world. No one else really does that AFAIK.

We usually follow the BNOdesk Twitter feed to get these live updates."
2020-02-22,hamiltonRoths,The_Donald,16,https://www.reddit.com/r/The_Donald/comments/f7ynvo/qom_the_religious_capital_of_the_islamic_republic/figzz2z/,"Now let’s get this , trump is Putin’s puppet , Putin supports Iran !   Coronavirus  originated in China , trump invented it !  
Trump must be a super brain gansta !!!!

I guess if your gonna lose an election clutch at straws."
2020-02-22,danythegoddess,italy,16,https://www.reddit.com/r/italy/comments/f81jem/mi_hanno_commissionato_una_vittorio_feltrichan_e/fiibryu/,Attendo notizie sull’argomento con maggiore trepidazione delle notizie sul coronavirus.
2020-02-22,TheLadderGuy,Barca,16,https://www.reddit.com/r/Barca/comments/f3dq2q/open_thread_the_new_normal/fihrp9m/,Unrelated but Serie A cancelled for tomorrow for the first time Football games due to Coronavirus in Italy
2020-02-22,larry_dallas99,wallstreetbets,16,https://www.reddit.com/r/wallstreetbets/comments/f7hla8/weekend_discussion_thread_february_2123_2020/fihyyt6/,"Bulls out enjoying life. Bears at home posting doom n' gloom epidemic stuff. Lol

Sorry Coronavirus Cheerleaders, confirmed green on Monday."
2020-02-22,narcs_are_the_worst,Coronavirus,16,https://www.reddit.com/r/Coronavirus/comments/f83gag/uk_to_start_drive_through_testing_on_monday/fiiuvbb/,They set up coronavirus pods around their medical facilities for screening so probable cases aren't trying to enter medical areas with patients who aren't affected (that they know of).
2020-02-22,TranceScape,barstoolsports,15,https://www.reddit.com/r/barstoolsports/comments/f7qnvz/free_talk_saturday/figi4vl/,"Was desperately looking for the hourly update from coronavirus guy, thanks for your service"
2020-02-22,Demortus,korea,15,https://www.reddit.com/r/korea/comments/f7xim4/chinas_global_times_south_korea_is_doing_a_poor/fiikd3y/,"Korea is #3 because it is testing and contact tracing faster than any other country on Earth. Name any other country (perhaps besides China, which has had a big head start) that is capable of testing over 6000 people for the Coronavirus *per day*? 

Also, the patients in the hospital you mentioned were exposed  to the sick person because no one knew he was sick until after he arrived. Keep in mind that the symptoms of this illness resemble those of a cold or Flu, so most people assume that's what they have when they admit themselves to a hospital. This is a universal problem for every healthcare system, no matter how advanced, because no one has the ability to test everyone before they're admitted to a hospital."
2020-02-22,Giovanni1926,soccer,15,https://www.reddit.com/r/soccer/comments/f80pi4/fabrizio_romano_intersampdoria_veronacagliari_and/fiht0gm/,Brescia fans sing napoletano coronavirus yet they are the infected ones.
2020-02-22,CLO_SIMP,Coronavirus,15,https://www.reddit.com/r/Coronavirus/comments/f84mhr/join_us_at_rprepare_for_worst_and_avoid_heavy/fij1z0f/,Not gonna lie the modding in /r/coronavirus has actually been pretty good since that one mod went absolutely mental and they apologized.
2020-02-22,AShinyNewPanda,China_Flu,15,https://www.reddit.com/r/China_Flu/comments/f7vrji/trump_furious_after_officials_allowed_americans/fifv0u3/,">President Trump  grew enraged with senior advisers this week when 14 Americans who had  tested positive for the coronavirus returned to the U.S. after he had  been granted assurances that infected patients would remain in  quarantine overseas.

If that isn't justification for a ""you're fired"" moment, I don't know what is."
2020-02-22,Give_me_the_science,China_Flu,15,https://www.reddit.com/r/China_Flu/comments/f818nx/as_an_italian_my_humble_opinion_of_why_italy_has/fii371y/,"There's a US specific sub Coronavirus US if you're interested, I'm not trying to spam, it's just in two weeks this sub will be difficult to sort through with all the posts"
2020-02-22,Rotundex,wallstreetbets,15,https://www.reddit.com/r/wallstreetbets/comments/f7hla8/weekend_discussion_thread_february_2123_2020/fij1k9i/,Create a drug to cure coronavirus and charge $5 million per dose.
2020-02-22,larry_dallas99,wallstreetbets,14,https://www.reddit.com/r/wallstreetbets/comments/f7hla8/weekend_discussion_thread_february_2123_2020/fig4saf/,Can coronavirus cheerleaders also be banned
2020-02-22,holla15,MMA,14,https://www.reddit.com/r/MMA/comments/f7yi1y/official_ufc_on_espn_26_felder_vs_hooker_live/fihijze/,What if the coronavirus is really an extremely effective PED? Anyone looked into this?
2020-02-22,pintsizeheroine,popping,14,https://www.reddit.com/r/popping/comments/f7zwtg/not_an_exciting_popping_video_but_worth_sharing/fii5jzk/,Coronavirus is less disgusting than your attitude.
2020-02-22,LinkUnseen,Coronavirus,14,https://www.reddit.com/r/Coronavirus/comments/f82bt7/if_coronavirus_is_killing_fewer_people_than_the/fiihlin/,"> deaths ocurring at homes are not being reported

To be counted as ""died from coronavirus"" they have to be tested. No one in China is testing corpses.

They go straight to the incinerator. No funeral."
2020-02-22,skeebidybop,Coronavirus,14,https://www.reddit.com/r/Coronavirus/comments/f7zhpz/israels_ambassador_to_china_has_been_quarantined/fihb566/,"Wow, any idea if the ambassador is being quarantined in China, Israel, or South Korea?

Edit - looks like they're being quarantined in Israel after recently arriving [according to the jpost](https://m.jpost.com/Israel-News/Likelihood-of-Israeli-infected-with-coronavirus-has-risen-significantly-618415)

Edit 2 - sorry misread article, hundreds of SK tourists are in isolation/quarantine in Israel but the ambassador to China is quarantined in Beijing"
2020-02-22,Chricri3112,italy,14,https://www.reddit.com/r/italy/comments/f7txjb/megathread_3_coronavirus/fihr0at/,"No, il decreto coronavirus al massimo sarà un atto con forza di legge, sarà legge solo quando convertito tramite legge di conversione da parte del Parlamento.
(Si, sono quello divertente alle feste, e ho dato diritto pubblico l'altro ieri)"
2020-02-22,rSlashCosmo87,Coronavirus,13,https://www.reddit.com/r/Coronavirus/comments/f7ww34/update_from_my_china_contacts_supply_chain/figej8r/,"wouldnt get ur hopes too high. headlines in march ""desperate ccp forces people back to work too soon creates second large wave of Coronavirus."""
2020-02-22,Atschmid,WayOfTheBern,13,https://www.reddit.com/r/WayOfTheBern/comments/f7zwhe/nevada_results_live_thread/fiirfzb/,"MSNBC is reporting that Trump is going to India, where he is scheduled to have the world's largest rally (to counteract the Bernie rallies).

https://www.msn.com/en-us/news/world/trump-heads-to-india-for-a-giant-rally-but-little-else/ar-BB10h3Gh

I wonder if he is aware that there is now a vicius outbrak of coronavirus in India."
2020-02-22,KorSkarn225,HistoryMemes,13,https://www.reddit.com/r/HistoryMemes/comments/f7tm1t/nothing_like_some_aged_milk/fihgedl/,#I have contracted coronavirus
