date,author,subreddit,score,url,text
2020-03-05,fireintolight,interestingasfuck,164,https://www.reddit.com/r/interestingasfuck/comments/fdw5n7/for_the_first_time_in_history_the_holy_haram_of/fjl482g/,this is the first time in history it’s been closed to coronavirus 💁🏼‍♂️
2020-03-05,heyimdong,LateStageCapitalism,163,https://www.reddit.com/r/LateStageCapitalism/comments/fe3krp/tax_them_till_they_cry/fjlyilw/,"Here’s another metric to consider. Last week the US stock market fell by 6 trillion dollars due to coronavirus concerns. It was pretty big news, and a couple notable industries took a significant hit (airlines), but nothing collapsed, the stock market kept ticking along, and everything is essentially fine. 

The entire balance of student debt in the US is 1.5 trillion. That means 4x the entire amount of student debt in the US was wiped out of the stock market in five days last week, it had no significant effect on just about anyone, and we have nothing to show for it. 

If just 25% of those losses went to forgiving student debt instead of skittish sell offs, the housing market would erupt overnight, millennial pregnancies would skyrocket, new businesses would multiply, and we’d probably boost gdp growth by an entire % for multiple years."
2020-03-05,IrritableIrvin,Coronavirus,116,https://www.reddit.com/r/Coronavirus/comments/fe39kx/pretty_stark_statement_from_a_kaiser_nurse_in/fjlij6n/,">I volunteered to be on the care team for this patient, who we knew was positive. I did this because I had all the recommended protective gear and training from my employer. I did this assuming that if something happened to me, of course I too would be cared for. Then, what was a small concern after a few days of caring for this patient, became my reality:  
>  
>I started getting sick.  
>  
>When employee health told me that my fever and other symptoms fit the criteria for potential coronavirus, I was put on a 14-day self-quarantine. Since the criteria was met, the testing would be done. My doctor ordered the test through the county.  
>  
>The public county officer called me and verified my symptoms and agreed with the testing. But the National CDC would not initiate testing. They said they would not test me because if I were wearing the recommended protective equipment, then I wouldn't have the coronavirus.

This is absolutely outrageous. Can you imagine the response if the US government refused to pay death benefits to soldiers because ""if they were doing their job, they wouldn't have died?""

If we can't even take care of the nurses who are literally risking their lives to fight this thing while no one else is even taking it seriously, what are we doing?

This makes me sick to my stomach."
2020-03-05,jeffismycat,Coronavirus,106,https://www.reddit.com/r/Coronavirus/comments/fe6m4a/surgeon_general_on_coronavirus_the_risk_is_low_to/fjm58c7/,"The risk of testing positive for coronavirus is low......


..... when there aren't enough tests for coronavirus."
2020-03-05,groot4lyfe,Coronavirus,103,https://www.reddit.com/r/Coronavirus/comments/fe1y0k/statement_by_a_quarantined_nurse_from_a_northern/fjl8vpf/,">The public county officer called me and verified my symptoms and agreed with testing. But the National CDC would not initiate testing. They said they would not test me because if I were wearing the recommended protective equipment, then I wouldn’t have the coronavirus.

>What kind of science-based answer is that?  What a ridiculous and uneducated response from the department that is in charge of our health in this country. 

>Later, they called back, and now it’s an issue with something called the “identifier number.” They claim they prioritize running samples by illness severity and that there are only so many to give out each day. So I have to wait in line to find out the results.

All signs point to the CDC being caught with its pants down and not having nearly enough test kits to respond to these outbreaks, despite two months of advance notice. They're using bureaucratic red tape to disguise the complete logistics fuckup."
2020-03-05,uncletugboat,baseball,75,https://www.reddit.com/r/baseball/comments/fe2fhm/darvish_yu_darvish_started_coughing_so_his/fjle3oa/,"*Darvish coughs*

“He doesn’t have the flu”

Reddit: “Oh shit he most likely has the Coronavirus, why else would he cough?”"
2020-03-05,HexyWitch88,antiMLM,74,https://www.reddit.com/r/antiMLM/comments/fe4q5c/sanity_in_a_moms_group/fjlyoy7/,"If one more person says “EOs were used to fight the plague, so coronavirus doesn’t stand a chance” to me I’m going to go on a hunacidal rampage."
2020-03-05,yachtsandthots,wallstreetbets,69,https://www.reddit.com/r/wallstreetbets/comments/fe22hg/what_are_your_moves_tomorrow_march_06_2020/fjl9lzo/,"Markets on Monday: Coronavirus aint shit it's just the flu bro

Markets on Tuesday: Oh fuck this coronavirus is way worse than I thought

Markets on Wednesday: Coronavirus aint shit it's just the flu bro

Markets on Thursday: Oh fuck this coronavirus is way worse than I thought"
2020-03-05,BruhAnotherThrowaway,Coronavirus,69,https://www.reddit.com/r/Coronavirus/comments/fe7fvq/beastie_boys_ozzy_osbourne_trent_reznor_pull_out/fjmam9r/,Ozzy is already immune to the coronavirus from all the bats he’s eaten.
2020-03-05,NoneOfYourBusiness82,Coronavirus,66,https://www.reddit.com/r/Coronavirus/comments/fe0t6k/a_california_man_who_selfquarantined_after/fjl0uws/,China is the safest place right now what comes to Coronavirus
2020-03-05,eddiebruceandpaul,Coronavirus,65,https://www.reddit.com/r/Coronavirus/comments/fe7ao0/ny_times_reporting_us_death_toll_rises_to_14_with/fjm9fxj/,When are these assholes going to take down the paywall for coronavirus.
2020-03-05,Raoulino,PewdiepieSubmissions,60,https://www.reddit.com/r/PewdiepieSubmissions/comments/fdyqkh/just_something_to_think_about/fjl5vkd/,"Will I get coronavirus while surprising my subscribers?!?!?!? Prank gone wrong
#1 Trending"
2020-03-05,NumberJ5,hockey,57,https://www.reddit.com/r/hockey/comments/fe3xdm/russo_wildsharks_game_will_go_on_despite_santa/fjlqjhv/,"Is it terrible that I immediately thought of the potential Coronavirus discounts that might be coming if attendance is low?

""Enter promo code COVID19 for special pricing."""
2020-03-05,TheKarmaSuiter,nba,57,https://www.reddit.com/r/nba/comments/fe4xoh/can_you_guys_chant_sell_the_knicks_when_we_play/fjlw3jb/,He will just ban all fans and blame the coronavirus
2020-03-05,JoJackthewonderskunk,tifu,55,https://www.reddit.com/r/tifu/comments/fe0per/tifu_by_sending_porn_to_the_whole_school/fjltzcf/,Instructions unclear computer has coronavirus
2020-03-05,The_Diviner,Coronavirus,55,https://www.reddit.com/r/Coronavirus/comments/fe39kx/pretty_stark_statement_from_a_kaiser_nurse_in/fjli5ka/,Oof the CDC is so painfully inadequate. To not test a nurse who directly cared for a coronavirus patient...
2020-03-05,WhatDoesAFAIKMean,Coronavirus,54,https://www.reddit.com/r/Coronavirus/comments/fe5zfo/we_anticipate_she_has_the_coronavirus_we_do_not/fjm12rg/,"Man I **hate-** this website. Force you to pay for a subscription and there are two dozen ads on the page. Here you go. 

KIRKLAND, Wash. — The hardest day of Debbie de los Angeles’s life had been the day she put her mother into a nursing home. That was before coronavirus.


As fatal infections spread through the Life Care Center in suburban Seattle, where her 85-year-old mother lived, Ms. de los Angeles had tried not to worry. Nurses were monitoring her mother’s temperature. They reassured Ms. de los Angeles that her mother had no fever, cough or other signs of infection.


But at 4:15 a.m. on Tuesday, a nurse called with troubling news. Her mother, Twilla Morin, had developed a 104-degree fever. They were giving her Tylenol. Then the nurse confirmed her do-not-resuscitate orders.


“We anticipate that she, too, has the coronavirus,” a voicemail message from a nurse said. “We do not anticipate her fighting this.”


Moving into a nursing home can be a wrenching choice for aging parents and their adult children. But families said they never imagined facing a public health crisis in the quiet hallways where they once believed their loved ones would be safe.


In the week since the Kirkland nursing facility became the focal point of an unfolding coronavirus outbreak in the Pacific Northwest, daily life has stalled into a sleepless, slow-motion agony. With visits restricted, families now call and call for updates from the overworked nursing staff. The families wonder whether they should demand a visit, risking their own health and wider contamination. Some want their parents moved to the hospital or to a different facility but have no idea who else would care for fragile patients potentially exposed to a deadly disease.



“I just feel ill that my mom could be dying alone,” said Vanessa Phelps, whose 90-year-old mother has chronic breathing problems and has lived at the facility for four years. “It’s pure panic and I can do nothing. I have no control.”


Some families now call twice a day to ask how their octogenarian parents are feeling and reassure them about the alarming television news transmitted into their rooms, much of it featuring the crisis right there inside the center. Some video chat on tablet computers designed for older users. One woman stood outside her mother’s window to catch a glimpse between the slats.


It has been like seeing a ship sink without lifeboats. “We are watching from the shore and not being able to do anything,” said Alex Stewart, whose 95-year-old grandmother lives in the nursing center and has been crocheting a small blanket in anticipation of Ms. Stewart’s baby — her first great-grandchild. “It is a very helpless feeling.”


Nobody knows for sure how the coronavirus first entered the facility, which has become a grim warning of how the virus can spread particularly quickly inside nursing homes. At least eight of the 14 coronavirus deaths in the United States have been Life Care residents, and at least a half dozen other people connected to the facility have been sickened by the virus.



Even amid intense scrutiny of the nursing center and its record of handling infections, families said they were struggling to get basic information from Life Care’s leaders and public health officials. They said they had spent untold hours on the phone, being shunted between county and state government offices and the Centers for Disease Control and Prevention.



One man said he called a federal hotline and introduced himself as the son of an octogenarian Life Care resident. The response, he said, was concerning: He was asked whether there had been any coronavirus cases in his area.


Many residents inside the 190-bed facility went days without being tested for coronavirus, families said, even as they and their roommates started coughing and feeling feverish. Families worry that the true number of infections may be higher than official totals.


Experts in infectious diseases say older people, many of whom have underlying health problems and respiratory problems, are particularly vulnerable to the virus and have a higher risk of death.



Continue reading the main story
“People keep saying, ‘Why don’t you just go and bust them out?’” said Kevin Connolly, whose 81-year-old father-in-law, Jerry Wall, has been at the home for about a year recovering from heart failure.


“It’s his home,” Mr. Connolly said. “He likes the food, he likes the care, he has friends there.”


At a news conference on Wednesday, Dr. Jeff Duchin, the officer for public health in Seattle and King County, said teams were now working to test every Life Care resident for the virus, and apologized for a breakdown in communication. A federal disaster medical assistance team was expected to arrive at the center on Thursday.


Carmen Gray and Bridget Parkhill, who are sisters, hugged after they discussed concerns about their mother, who is a resident at Life Care.
Carmen Gray and Bridget Parkhill, who are sisters, hugged after they discussed concerns about their mother, who is a resident at Life Care.Credit...David Ryder/Reuters
Ellie Basham, the executive director of Life Care, said in a statement that it was assigning every resident a representative who could answer questions from family members.


Continue reading the main story
Families welcomed the promised help, and praised the nurses and caregivers who showed up to work even as the virus spread and as several employees tested positive. It appeared that the virus tests were underway on Thursday; one relative reported that her father had been swabbed.


On Wednesday night, Ms. Stewart said her grandmother had begun to feel chills and short of breath.


“She rang for the nurse, but they hadn’t come yet,” Ms. Stewart said. By Thursday, her grandmother was feeling better. “We’re hoping it was just a blip and not the virus,” Ms. Stewart said. “But we don’t know yet until she’s tested.”


Day by day, desperation has grown for families of sicker, weaker residents.


Bridget Parkhill’s 77-year-old mother had been ill for nearly a week inside the home. On Wednesday, she was taken to the hospital after her coughing worsened and she felt a heaviness in her chest. “We are devastated that it’s come to this,” Ms. Parkhill said. Her mother returned to the home on Thursday.
Ms. de los Angeles, 65, said that her mother, Ms. Morin, had never wanted to move into a nursing home.


Continue reading the main story
Ms. Morin had been a numbers whiz, once halting an embezzlement scheme while working as a bookkeeper. She had also learned to day trade stocks and would get up early for the market open on Wall Street, three time zones ahead of her home in Kennewick, in southeastern Washington State.



A patient was transported from the Life Care Center of Kirkland.
A patient was transported from the Life Care Center of Kirkland.Credit...David Ryder/Reuters
Ms. Morin moved into her first nursing home about four years ago after she could no longer stand or walk by herself. As her dementia deepened, Ms. Morin sometimes confused Ms. de los Angeles, her only child, for her sister.

Her world at the Life Care Center, where she had lived for two years, had narrowed to her shared room, the wheelchair she rolled to the dining room and the table where she often ate by herself. She loved a cup of hot chocolate at night and cared for a doll as if it were a real child. In lucid moments, she knew she was proud of her grandsons, Ms. de los Angeles said.



Ms. de los Angeles wanted to race to the nursing facility this week when she heard that her mother’s condition was deteriorating. But she knew the risks of infecting her husband, who has lung problems, were too great.


She got regular updates from the nurses caring for her mother, and was comforted that mother’s favorite nurse was on duty, and that her mother appeared to be mostly sleeping. And yet.
“We wanted to be there,” Ms. de los Angeles said. “She was alone.”


Early on Wednesday morning, Ms. de los Angeles woke to a new voicemail message from Life Care. Her mother had died at 2:10 a.m., the message said. Because of the “unique situation” at the home, her mother’s remains had to be picked up by the coroner, a nurse said.


By late morning, Ms. de los Angeles and her husband, Bob, were sitting on living-room couches at their home in Monroe, Wash., surrounded by their four grown sons, looking at old photos and sharing memories of Ms. Morin.


They had to arrange her cremation and decide whether it was safe to pick up her ring, stuffed teddy bear and other belongings. They were waiting for test results to determine whether Ms. Morin had contracted the coronavirus. It had been a month since the family’s last visit, so they were not worried about being infected themselves. Ms. de los Angeles said she simply needed to know.

“I still question what’s going on in that nursing home,” Ms. de los Angeles said. “They gown up. They wear masks. But the virus is still making its way around"
2020-03-05,soybatmang,nba,51,https://www.reddit.com/r/nba/comments/fe1biw/espn_the_knicks_drew_their_smallest_home_crowd_in/fjl43oh/,"As much as i wish this was a protest against Dolan, the coronavirus scare is real especially in the city last couple days"
2020-03-05,Ohmiglob,ChapoTrapHouse,51,https://www.reddit.com/r/ChapoTrapHouse/comments/fe1csd/399_1_v_1_3520/fjl73mh/,"As someone who has to travel for works its actually pretty wild how mild travel has completely killed them, like its bubble boy but for Brooklynites where leaving their sphere has infected them all with Coronavirus"
2020-03-05,-dont-panic,Coronavirus,46,https://www.reddit.com/r/Coronavirus/comments/fe5ovz/vice_news_producer_on_returning_to_the_us_through/fjm1xlh/,I uh...[may have said something along those lines](https://reddit.com/r/Coronavirus/comments/f71sr4/_/fi8m463/?context=1).
2020-03-05,AcuMan_NYC,Coronavirus,45,https://www.reddit.com/r/Coronavirus/comments/fe4gc2/seattle_traffic_non_existent_amid_coronavirus/fjlqf55/,Coronavirus has cut emissions faster than years of climate negotiations. (From another article)
2020-03-05,energizerbunneee,Coronavirus,42,https://www.reddit.com/r/Coronavirus/comments/fe3ojx/28_people_died_of_influenza_complications_in/fjll0kh/,And many more will die from coronavirus if we don't start testing more than 2 people a day
2020-03-05,bored_in_NE,Coronavirus,37,https://www.reddit.com/r/Coronavirus/comments/fe53uu/new_york_officials_say_2733_people_are_under/fjlv1gv/,"officially ""2,733 people are under coronavirus quarantines"" but nobody can guarantee they are not breaking the quarantine."
2020-03-05,c3knit,Coronavirus,37,https://www.reddit.com/r/Coronavirus/comments/fe5ovz/vice_news_producer_on_returning_to_the_us_through/fjm7s1h/,"The coronavirus won't get you, but scurvy will!"
2020-03-05,ahecht,boston,36,https://www.reddit.com/r/boston/comments/fe12of/tennessee_man_diagnosed_with_coronavirus_flew/fjljwv8/,"In China, 81% of people who tested positive for coronavirus experienced mild symptoms or no symptoms at all. 14% were severe, 2.7% critical, and 2.3% fatal."
2020-03-05,Not_MyName,melbourne,36,https://www.reddit.com/r/melbourne/comments/fe0lxl/isnt_this_just_lovely/fjlnm2f/,"God if you wiped your butt with train seat cloth, Coronavirus is the least of your infection worries!"
2020-03-05,sfdc_away,Coronavirus,34,https://www.reddit.com/r/Coronavirus/comments/fe1y0k/statement_by_a_quarantined_nurse_from_a_northern/fjlfr5x/,Can't Diagnose Coronavirus
2020-03-05,PimpSquad,ChapoTrapHouse,33,https://www.reddit.com/r/ChapoTrapHouse/comments/fdpyr6/pokemon_shield_my_eyes_from_all_your_awful_posts/fjkmwu7/,"Bernie gets coronavirus, he gives it to Biden at the debate

They both die because they're older than Israel, Tulsi becomes nominee by default. She beats Trump after securing the horny vote."
2020-03-05,Looddak,Coronavirus,33,https://www.reddit.com/r/Coronavirus/comments/fe80qy/cnbcs_rick_santelli_suggests_giving_everyone/fjme8tc/," 

>Everyone in America should be given the coronavirus so the economic impact of the outbreak will be lessened, CNBC on-air editor Rick Santelli suggested Thursday.  
>  
>But what he left unsaid was that would result in more than 11 million Americans dead."
2020-03-05,NukeTheOcean,boston,33,https://www.reddit.com/r/boston/comments/fe12of/tennessee_man_diagnosed_with_coronavirus_flew/fjla2l8/,"From [The Boston Globe](https://www.bostonglobe.com/2020/03/05/metro/tennessee-coronavirus-patient-had-traveled-boston/). 

> [...] may have caught the virus at an out-of-state conference which was also attended by people who had traveled outside of the country

Seems very likely this is PAX East."
2020-03-05,BCMO1,AskReddit,33,https://www.reddit.com/r/AskReddit/comments/fe13as/teachers_of_reddit_what_was_the_best_excuse_for/fjlsf2n/,This is what the coronavirus is for
2020-03-05,Orcus424,YouShouldKnow,32,https://www.reddit.com/r/YouShouldKnow/comments/fdzuqr/ysk_that_covid19_does_not_have_a_mortality_rate/fjl17cr/,[Here is a Reddit post](https://old.reddit.com/r/Coronavirus/comments/fdkqda/coronavirus_not_a_common_cold/) with an expert testifying to the US Congress saying the mortality rate is multiple times of the seasonal flu.  Here is the [full video](https://www.youtube.com/watch?v=QD7H9B3RcZA).  I will take the word of an expert over some random Redditor with no sources what so ever.  You need to cite stuff for a health/science post here.
2020-03-05,seanotron_efflux,Coronavirus,32,https://www.reddit.com/r/Coronavirus/comments/fe3ojx/28_people_died_of_influenza_complications_in/fjlljno/,41 died of coronavirus in Italy *today*
2020-03-05,Cobra_McJingleballs,Coronavirus,31,https://www.reddit.com/r/Coronavirus/comments/fe5szq/quarantined_northern_ca_nurse_issues_statement/fjlzcem/,"[Transcript of statement](https://bit.ly/2PRgdbv).

**Statement by a quarantined nurse from a northern California Kaiser facility**

*March 5, 2020*

As a nurse, I’m very concerned that not enough is being done to stop the spread of the coronavirus. I know because I am currently sick and in quarantine after caring for a patient who tested positive. I’m awaiting “permission” from the federal government to allow for my testing, even after my physician and county health professional ordered it.

I volunteered to be on the care team for this patient, who we knew was positive. I did this because I had all the recommended protective gear and training from my employer. I did this assuming that if something happened to me, of course I too would be cared for. Then, what was a small concern after a few days of caring for this patient, became my reality:
I started getting sick.

When employee health told me that my fever and other symptoms fit the criteria for potential coronavirus, I was put on a 14-day self-quarantine. Since the criteria was met, the testing would be done. My doctor ordered the test through the county.

The public county officer called me and verified my symptoms and agreed with testing. But the National CDC would not initiate testing. They said they would not test me because if I were wearing the recommended protective equipment, then I wouldn’t have the coronavirus.

What kind of science-based answer is that? What a ridiculous and uneducated response from the department that is in charge of our health in this country.

Later, they called back, and now it’s an issue with something called the “identifier number.” They claim they prioritize running samples by illness severity and that there are only so many to give out each day. So I have to wait in line to find out the results.

This is not the ticket dispenser at the deli counter; it’s a public health emergency! I am a registered nurse, and I need to know if I am positive before going back to caring for patients.

I am appalled at the level of bureaucracy that’s preventing nurses from getting tested. That is a health care decision my doctor and my county health department agree with. Delaying this test puts the whole community at risk.

I have the backing of my union. Nurses aren’t going to stand by and let this testing delay continue; we are going to stand together to make sure we can protect our patients—by being protected ourselves."
2020-03-05,box_of_no_north,Coronavirus,31,https://www.reddit.com/r/Coronavirus/comments/fe4dg6/oregon_will_keep_limiting_coronavirus_tests/fjlpkhy/,">The Oregon Health Authority will approve [coronavirus testing](http://oregonlive.com/coronavirus/) only for people sick enough to be hospitalized who do not have the flu and people with symptoms who have either traveled to countries affected by the virus or who have had contact with a person confirmed to be sick, state and regional county health officials said Thursday.

Fire them all."
2020-03-05,pattisabs,AmItheAsshole,30,https://www.reddit.com/r/AmItheAsshole/comments/fe2oqg/aita_for_sending_my_son_to_school_with_medical/fjlehkg/,"YTA, it’s not necessary to wear masks, especially considering the following facts about the coronavirus.
1. It’s actually far less serious in children and highly unlikely to cause them serious harm
2. Masks won’t stop your kids from getting the virus
3. Living in Buffalo, NY means the exposure to the virus your kids will be getting is incredibly incredibly low. As long as they wash their hands, they’ll be fine. 

I’m saying YTA because making them wear masks unnecessarily contributes to panic and can absolutely disrupt things in school by contributing to panic amongst students and staff there for no reason."
2020-03-05,StrongyEdits,Coronavirus,30,https://www.reddit.com/r/Coronavirus/comments/fe2k6s/coronavirus_has_officially_landed_here_in_las/fjlcxiv/,"2020 Slogan: What happens in Vegas, stays in Vegas with the exception of Coronavirus"
