date,author,subreddit,score,url,text
2020-04-08,Shoresey_69,worldnews,12,https://www.reddit.com/r/worldnews/comments/fxgitg/tennis_tournament_wimbledon_paid_pandemic/fmueati/,"This is not accurate.


[Your life insurance will almost certainly pay off if you die of covid](https://www.nerdwallet.com/blog/insurance/does-life-insurance-cover-coronavirus/).   The only reason it wouldn't is the standard stuff like missed premiums or fraud."
2020-04-08,AStartlingStatement,supplychain,12,https://www.reddit.com/r/supplychain/comments/fxh6h7/farmers_are_panicbuying_to_keep_americas_95/fmub5ua/,">Days after President Trump extended America’s quarantine guidelines, Tyler Beaver, the 31-year-old founder of brokerage Beaf Cattle Co., couldn’t get hold of the rations that feed his clients’ cows. He’d already tried sellers in the traditional producing areas of the U.S. such as Kansas, Missouri and Oklahoma, only to find they were mostly sold out. Soon, in a bid to connect his customers with a feed mill still willing to sell, he changed strategy and tried to pull feed from the Delta region, hundreds of miles away — again without luck.

>Just as virus-spooked consumers have rushed to grocery stores to stockpile everything from toilet paper to pasta, farmers raising America’s cattle, hogs, and chickens have filled their bins with feed, fearing the spread of the coronavirus would disrupt their supply chains. “I’ve had some calls from customers of mine looking for feed because the mills are out,” says the Fayetteville, Ark.-based Beaver. “There’s a rush to buy just because of the uncertainty in the market. They just don’t want to be caught without.”

>Keeping America’s 95 million cows, 77 million pigs, and 9 billion chickens fed isn’t as simple as it may seem. Farmers are worried their feed mills could close as employees get sick or that their slaughterhouses could slow production, forcing them to keep animals for longer. They’re also concerned that a shortage of trucks, which are being waylaid to supply supermarkets, could make it harder for farm supplies to reach them.

>Even the plunge in gasoline demand affects the feed supply. As ethanol plants shut down — because the fuel additive isn’t needed when gas isn’t selling — the animal feed market is being starved of an important ingredient called dried distillers grains (DDGs) that are a byproduct of ethanol production. Distillers grain is a key ingredient in rations for beef cattle and dairy cows.

>The rush to fill bins hasn’t happened only in the U.S. French feedmakers stepped up ingredient purchases at the start of the lockdown, and demand jumped as plants that produce biofuels started to slow down. A similar trend occurred in Germany last month. “This is a new phenomenon,” says David Webster, head of animal nutrition and health at Cargill Inc., adding that the agribusiness giant has seen its global feed sales volume climb 10% or more in the past month. “We saw a bit of this in China in February, but now we are seeing globally, in every geography that we operate in, so it’s testing the system, so to speak.”

>France’s Avril Group also experienced strong demand in the past few weeks as customers rushed to finalize purchases over concerns that production could be suspended as biodiesel demand plummeted. And German farm cooperative Agravis Raiffeisen AG said there was some panic meal buying from feedmakers, while Munich-based grain trader BayWa AG saw hoarding in northwest Europe. “If you have a huge cattle herd, you want to make sure you have enough feedstuffs available on your farm,” says Thorsten Tiedemann, chief operating officer at Getreide AG, a Hamburg-based trader that sells rapeseed meal, a feed ingredient.

>That’s why James Holz, a farmer in Jefferson, Iowa, recently bought three weeks’ worth of ration for his 3,000 cattle, triple the norm. Because he’s in the U.S.’s top ethanol-producing state, he typically doesn’t need to stockpile. Some cattle producers there get multiple deliveries of distillers grains a day. “A lot of guys use their last scoop at 9 a.m., and then the truck comes at 10 a.m.,” says the 34-year-old farmer. But even he was taking no chances.

>Still, because farmers’ bin space is limited, they can’t really hoard the same way that consumers are doing, says David Hoogmoed, president of the Purina Animal Nutrition unit of Land O’ Lakes Inc. (The Purina that makes the dog and cat food is owned by Nestlé SA.) “What we are seeing isn’t a run on feed, but a keep-everything-full scenario,” he says. “While the producer [in the past] may have run things down to the last minute and ordered feed for tomorrow, they are building in, in their inventory management, more of a safety stock.”

>While sales at Purina’s livestock business increased only by single digits, there probably was a boost of more than 20% in the companion animal segment, which includes horses and rabbits. Even with social distancing in place, Hoogmoed says the company has kept its more than 60 mills operating, adding overtime and some weekend shifts and running “a very strong throughput.” “When you have a pet, even if it’s a horse — not a dog and a cat — they have a name and you want to take care of them,” he says. “We had a very large runup in retail feeds in all of our outlets and most of our customers.”

>It’s still unclear if all the talk of hoarding will eventually result in more demand for feed. The number of animals isn’t necessarily growing at a pace that’s faster than usual, and farmers can only fill up their bins once before they go back to the normal rate of consumption, says Tiedemann of Getreide. “We will see how it plays out over the next 90 days, but our view today would be that this is demand being pulled forward,” says Cargill’s Webster.

>Back in Arkansas, Beaver, who also raises cattle, is worried about the present. “If all the farmers go out and fill up all the storage bins they did have just because they are unsure what the future is going to hold, that does absorb a lot,” he says. “And if all the feedlots throughout the U.S. do the same thing and keep everything maxed out as far as their storage bins, storage capacity, and hedge for the future as well, you will start seeing shortages.”"
2020-04-08,Dedicated4life,unitedkingdom,12,https://www.reddit.com/r/unitedkingdom/comments/fx9knx/boris_johnson_improving_as_intensive_care/fmt9lc5/,"""I don't know what the fuss is about the coronavirus, felt like just a flu to me. My doctor's made me go to the ICU for a week just as a caution, I felt great! Also when I was there I saw too many doctors and nurses so I will be making some cuts to the NHS because they looked over staffed."""
2020-04-08,dxrey65,worldnews,12,https://www.reddit.com/r/worldnews/comments/fx5r6b/passengers_to_be_evacuated_from_antarctic_cruise/fmta1fq/,"Things did happen pretty quickly, and it's hard to know what news people had at the time. I went back through my messages to look at the timeline: March 9 talked to my daughter who works in a restaurant. Among other things, mentioned that I hoped the coronavirus thing didn't screw with her job. She gave that a ""not really worried, lol"". Six days later all the restaurants in the state shut down and she was out of work. 

Reality hit pretty quick right around the 15th. If I had an antarctic trip planned it's hard to say whether I would have gone. Probably I would have. 

Remember the president had been saying regularly up to that point that things were totally under control and we shouldn't worry. Even after he declared a national emergency on the 14th he gave a press conference where he talked mostly about how great the stock market was doing, and how he was thinking about taking advantage of the low rates to refinance the federal debt. And only off-handedly mentioned at one point in response to a question that unnecessary travel might be avoided."
2020-04-08,fluffyshorts,California_Politics,12,https://www.reddit.com/r/California_Politics/comments/fx61pb/newsom_california_has_contract_for_200m_masks_per/fmtfrrk/,Or hijacked by the feds: https://www.latimes.com/politics/story/2020-04-07/hospitals-washington-seize-coronavirus-supplies
2020-04-08,bobby_triple,Coronavirus,12,https://www.reddit.com/r/Coronavirus/comments/fxcvgm/hundreds_of_young_americans_have_now_been_killed/fmtjgdy/,">Two weeks after her husband died alone in an intensive care unit in Fort Myers, Fla., Nicole Buchanan is quarantined at the home they shared with their 12-year-old daughter, wrestling not only with grief but with why and how the [coronavirus](https://www.washingtonpost.com/health/2020/02/28/what-you-need-know-about-coronavirus/?tid=lk_inline_manual_2&itid=lk_inline_manual_2) could steal someone so young and healthy.  
>  
>“My husband didn’t have diabetes, he didn’t have asthma, he didn’t have high cholesterol. He didn’t have anything,” Buchanan said. “There’s just so much I’ll never know, that I’ll never get the answers to.”  
>  
>Conrad Buchanan, who died at 39 on March 26 after battling the infection for nearly two weeks, was creative and goofy. A professional DJ, he could entertain huge crowds with his music. But at home, he was fond of singing Bob Marley’s “Three Little Birds” to his 12-year-old daughter, Skye.  
>  
>“He had an amazing sense of humor. He had a big laugh. He was so magnetic,” his 37-year-old widow said. “He was our universe.”  
>  
>He also was among at least 759 people under age 50 across the United States who have perished amid the deepening pandemic, according to a Washington Post analysis of state data. These deaths underscore the tragic fact that, while the novel coronavirus might be most threatening to the old and compromised, no one is immune.  
>  
>For the very young — people under the age of 20 — death is extremely rare in the current pandemic. But it happens: The Post identified nine such cases.  
>  
>The risk appears to rise with every decade of age. The Post found at least 45 deaths among people in their 20s. (It’s hard to give a precise number because of the divergent ways that states present age groups: For instance, this figure does not include 15 deaths under the age of 30 in Louisiana and New Jersey.)  
>  
>As ages progress, The Post found at least 190 deaths among people in their 30s, and at least 413 among people in their 40s.  
>  
>The true number of deaths among young people is probably even higher. Not all states provide data on coronavirus deaths sorted by age group. Some, like New Jersey and Texas, provided figures after being approached by The Post, while others, like California, did not. As a result, the figures above do not include data from some states, including several with sizable outbreaks.  
>  
>The percentage of younger deaths, which The Post has defined as people under the age of 50, varies widely among states. It is just 0.8 percent of all deaths in Massachusetts, but 8 percent in Louisiana and 9 percent in Illinois.  
>  
>By far the largest number of such deaths have come in New York, which has the country’s biggest outbreak. [As of Wednesday](https://covid19tracker.health.ny.gov/views/NYS-COVID19-Tracker/NYSDOHCOVID-19Tracker-Fatalities?%3Aembed=yes&%3Atoolbar=no&%3Atabs=n), six New York residents under the age of 20, 33 people in their 20s, 118 in their 30s and 265 in their 40s had died.  
>  
>Even more young people are getting cases of serious, dangerous disease that require a hospital visit to beat. In Colorado — where the state health department reports age data for both hospitalizations and deaths — 247 people under 50 have been hospitalized. Of these patients, nine have died.  
>  
>Data on more than 1,400 hospitalizations released Wednesday by the Centers for Disease Control and Prevention showed that just over 25 percent of people hospitalized with covid-19 were under the age of 50. Most of these young people suffered from underlying conditions such as asthma, diabetes and hypertension. But at least seven for whom the CDC had data had no outside health problems, underscoring that a small fraction of severe cases remain hard to explain."
2020-04-08,jamz512,blogsnark,12,https://www.reddit.com/r/blogsnark/comments/fvyjuf/love_taza_46412/fmtm53g/,"Not sure if it's been mentioned yet, but Vanity Fair put out an article and while Arielle Charnas is the focus, Taza is mentioned too. [https://www.vanityfair.com/style/2020/04/influencers-coronavirus-arielle-charnas-escape-new-york](https://www.vanityfair.com/style/2020/04/influencers-coronavirus-arielle-charnas-escape-new-york)"
2020-04-08,LilKaySigs,gtaonline,12,https://www.reddit.com/r/gtaonline/comments/fx7kda/retirement_be_like/fmtpgec/,Coronavirus got the US like
2020-04-08,kots707,Anxiety,12,https://www.reddit.com/r/Anxiety/comments/fj2y1a/lets_post_good_news_on_the_coronavirus_here/fmu0yu1/,"Not necessarily. We aren’t gonna throw away all these testing resources. We can trace infection patterns much more easily. Antibody testing will also be available for widespread use so you will know if you are immune, or whether to self isolate. Treatment options will also be fda approved for widespread use by then which will likely nullify a lot of risk for most people. Plus there’s going to be some element of herd immunity in a lot of large cities, which are also the most likely places to be hit harder or earlier. 

This particular virus will likely not be an issue after this outbreak unless it mutates significantly in a couple months which is nearly impossible, regardless of what r/coronavirus thinks."
2020-04-08,undertheice71,JoeRogan,12,https://www.reddit.com/r/JoeRogan/comments/fxh4is/what_joe_thinks_helps_fight_covid_19_vs_what/fmumoxb/,"I just smoked a bowl and let me tell you, weed cures coronavirus. Has there been any reports or findings that prove that weed doesn’t cure coronavirus? No. I rest my case."
2020-04-08,Winrawrd,worldnews,12,https://www.reddit.com/r/worldnews/comments/fxbs7a/britain_joins_growing_chorus_of_countries_furious/fmu5vl7/,"Really? Literally every single post for the past few weeks in this forum is about coronavirus. The idea that anyone here even has a semblance of an original thought or really anything valuable to say is dubious.

Every single post is whining about America, China, trump, leadership across the world. Whining, blaming, being utterly useless. Blaming gives people a sense of control-that something could be done to stop this 

Then you'll have  a 'let' s congratulate the white wealthy liberal area' post about how they are morally superior about Coronavirus or w.e. Canada is a common one

If anything this international reaction of social distancing is an amazing contrast to every pandemic in the past. But sheep only like drama, exaggerated media, fear mongering, and really anything that gives them something to talk about in their shallow relationships"
2020-04-08,Shawn_Darby,gso,12,https://www.reddit.com/r/gso/comments/fxd5cm/the_epa_just_seized_masks_inbound_for_our/fmu36xx/,"Similar/related story here, though not local.

https://www.reddit.com/r/Coronavirus/comments/fwusyf/hospitals_say_feds_are_seizing_masks_and_other/?utm_medium=android_app&utm_source=share

After I read this yesterday I heard the mecklenburg county spokesperson say they'd been informed by FEMA that there would be no help forthcoming.

 

https://youtu.be/ztgDa_orARI


Edited to add Mecklenburg County link"
2020-04-08,Jugmentor,CanadaCoronavirus,12,https://www.reddit.com/r/CanadaCoronavirus/comments/fxiw84/planking_the_curve_experts_caution_canada_is/fmuq9aa/,"I apologize if it seems that way.  It wasn't what I was trying to do.  And I still feel it's worth emphasizing that an epidemologist said what she said, that likely Coronavirus will stick with us until we have antivirals and vaccines for it."
2020-04-08,Grand-Ayatolla-Lenin,me_irl,12,https://www.reddit.com/r/me_irl/comments/fxbsrl/me_irl/fmuwjej/,Maybe the real Presidency is the Coronavirus we got along the way.
2020-04-08,rgov,SanJose,12,https://www.reddit.com/r/SanJose/comments/fxd1gm/despite_budget_shortfall_san_jose_spends_17/fmtu56i/,"The headline here seems disapproving, doesn't it? I checked to make sure it wasn't an Opinion piece.

Not: ""San Jose fast-tracks construction of 500 homes for homeless facing coronavirus outbreak""

It is almost entirely focused on the cost of construction and the budgetary situation."
2020-04-08,stuuked,China_Flu,12,https://www.reddit.com/r/China_Flu/comments/fxedve/the_stigma_of_having_coronavirus_this_women/fmtvqmp/,"CNN is the perfect platform for what she doing.  Next she will be interviewed by Mr Coronavirus himself.  Fredo ""CV"" Cuomo."
2020-04-08,bored_in_NE,Coronavirus,12,https://www.reddit.com/r/Coronavirus/comments/fxkpgo/who_chief_addresses_death_threats_racist_insults/fmuzvmn/,This guy is the reason why the whole world is infected with the coronavirus.
2020-04-08,JakeNBake_89,Anxiety,12,https://www.reddit.com/r/Anxiety/comments/fj2y1a/lets_post_good_news_on_the_coronavirus_here/fmuzwmu/,"Worldometers has reported a drop in Active cases in Australia for the 4th day in a row, as they only reported dozens of new cases today versus hundreds at the peak.

 [https://www.worldometers.info/coronavirus/country/australia/](https://www.worldometers.info/coronavirus/country/australia/)"
2020-04-08,thelittlelebowski23,WhitePeopleTwitter,12,https://www.reddit.com/r/WhitePeopleTwitter/comments/fxd7a4/us_govt_vs_wimbledon/fmudice/,"We have a massive emergency medical stockpile with 17,000 ventilators in it. The reason we don’t have more is actually because the experts didn’t think it was necessary. Apparently “When pressed, the experts running the stockpile moved to buy obscure pharmaceuticals likely to go out of production without a big government purchase. They left off items such as ventilators and masks, which sell to medical systems anyway.” 

Maybe it’s not as big as you’d like it to be, but the US does have an enormous medical stockpile which receives a good amount of funding each year.

https://publicintegrity.org/health/coronavirus-and-inequality/the-governments-secret-ventilator-stockpile-is-nowhere-near-enough-to-fight-the-coronavirus/"
2020-04-08,071319,florida,12,https://www.reddit.com/r/florida/comments/fxaryp/anyone_being_threatened_by_their_landlord_yet_i/fmt6g6e/,"There's a moratorium on evictions in the entire state of FL, your landlord is just being an asshole; he cannot legally evict you.

https://www.actionnewsjax.com/news/florida/coronavirus-evictions-foreclosures-suspended-part-new-executive-order-by-gov-ron-desantis/AWTZVAMZQBG5BC3JPGNAR3Q47E/"
2020-04-08,Temry_Quaabs,LeopardsAteMyFace,12,https://www.reddit.com/r/LeopardsAteMyFace/comments/fxen3u/those_poor_people_complain_too_much_wait_im_poor/fmv1sil/,Have you heard the news about Coronavirus?
2020-04-08,realboxwood,popheads,12,https://www.reddit.com/r/popheads/comments/fx81ui/daily_discussion_april_08_2020/fmt7lik/,"Biden supports no actual changes and has a rape allegation against him, along with a consistently awful record and what can most generously be described as poor oratory skill. The only way Trump doesn’t wipe the floor with him is if this Coronavirus puts him in a much worse light than he already is. It’s not Bernie supporters or anyone’s responsibility to vote for an awful candidate who’s strongest appeal is being marginally better than the other guy, and if democrats ever want to win another election they’re gonna have to realize that begging and shaming people into supporting whatever pos they run doesn’t actually work. As someone who happily voted for Hilary in 2016 I despise the “blue no matter who” line, because it puts the onus on voters to hold their noses and support awful people instead of putting it on the actual fucking politicians to listen to and help their constituents.

Do go vote downballot, at least. Local elections especially are more important than many people realize, and there are still plenty of great candidates running there. And if you’re as crushed by this outcome as I am, search around for ways you can help outside the void that electoral politics so often is."
2020-04-08,Looddak,Coronavirus,12,https://www.reddit.com/r/Coronavirus/comments/fxbhp9/finland_chinese_face_masks_fail_tests/fmtbrfm/,"Those are likely surgical masks. When treating coronavirus patients, medical workers should use N95 masks.

The article doesn't specify what kind of mask they were testing."
2020-04-08,coup85,askspain,12,https://www.reddit.com/r/askspain/comments/fxb7ti/qué_piensan_los_españoles_en_general_de_nosotros/fmtcmgo/,"Creo que bastante afinidad, aún con nuestras diferencias, creo que somos dos sociedades bastante similares y de hecho en la historia reciente hemos ido pasando por etapas paralelas, tristemente para ambos esto se repite otra vez con el Coronavirus.

PD: Solo mi opinión."
2020-04-08,Machu-pikachuu,CoronavirusCA,12,https://www.reddit.com/r/CoronavirusCA/comments/fxfma3/california_is_analyzing_covid19_data_on_basis_of/fmu8dp2/,"I remember hearing that the black community is slightly overrepresented. Im not sure if it was in LA or CA in general though.

Edit: Yes. Fauci just confirmed that it is the pre-existing conditions that put african americans at a disadvantage with coronavirus."
2020-04-08,MrHuggableBubbles,wallstreetbets,12,https://www.reddit.com/r/wallstreetbets/comments/fxev5z/what_are_your_moves_tomorrow_april_09_2020/fmuzt26/,"https://www.reuters.com/article/us-health-coronavirus-pope-profit/pope-condemns-those-trying-to-make-quick-buck-off-coronavirus-idUSKBN21Q21Y

Everyone trying to make a quick buck off of the coronavirus is going to hell.

IWM 5/15 $110 p"
2020-04-08,Eric_the_Enemy,Coronavirus,12,https://www.reddit.com/r/Coronavirus/comments/fx6ii0/texan_18_arrested_for_threatening_to_infest_every/fmtje4o/,"> If you want to get the coronavirus and fucking die, call me. I’ll meet you up

/r/tinder"
2020-04-08,RunningPath,medicine,12,https://www.reddit.com/r/medicine/comments/fx673s/megathread_covid19sarscov2_april_8th_2020/fmtk2ie/,"This has been discussed in this forum, but this is an incredibly fraught issue.

Antibody tests may be neither sensitive nor specific. They may cross-react with other coronavirus antibodies. Antibodies against SARS-CoV-2 may or may not be protective of infection. If they are, we don't know for how long. They may be protective in some people and not others.

There are significant ethical concerns with using antibody tests for individual decision-making. For example, if employers allow antibody-positive people to return to work, people will go out and deliberately get sick so that they can return to work.

Antibody tests will be useful for epidemiology on a population level, with very large numbers of tests which minimize the effect of relatively low sensitivity and specificity (though we would still want both to be as high as possible of course). But they will not, and should not, be useful for individual decision-making for a long time."
2020-04-08,ContentsMayVary,Coronavirus,12,https://www.reddit.com/r/Coronavirus/comments/fxepqd/chinacentric_who_really_blew_it_on_coronavirus/fmtv0k6/,"Title of the article is actually

>Trump says 'China-centric' WHO 'really blew it' on coronavirus"
2020-04-08,GP_222,CoronavirusUS,12,https://www.reddit.com/r/CoronavirusUS/comments/fxhzcr/new_york_state_now_has_more_confirmed_cases_than/fmuhimt/,"[yea... just ignore all that Coronavirus stuff and go on with your lives.....](https://mobile.twitter.com/BilldeBlasio/status/1234648718714036229)

/s

This is so sad.  I feel for all you New Yorkers....."
2020-04-08,Raekear,collapse,12,https://www.reddit.com/r/collapse/comments/fxd03v/social_distancing_in_california_may_last_into/fmunp04/,You mean for some reason like this: [https://www.scmp.com/news/china/science/article/3078840/coronavirus-low-antibody-levels-raise-questions-about](https://www.scmp.com/news/china/science/article/3078840/coronavirus-low-antibody-levels-raise-questions-about)
2020-04-08,dez_nuz_boz,MakeMeSuffer,12,https://www.reddit.com/r/MakeMeSuffer/comments/fxfrzo/spread_the_news/fmu282p/,This is why coronavirus isn’t a bad thing
2020-04-08,SovietSpaceHorse,atlanticdiscussions,12,https://www.reddit.com/r/atlanticdiscussions/comments/fxf0mi/wednesday_night_open/fmtz2vb/,"I had to talk a friend who is positive -- but so far only showing mild symptoms -- out of TAKING horse wormer he had in his barn, based on an Australian study that showed horse wormer kills the coronavirus in a lab setting 

NGL -- I'm very ready for this to be done w."
2020-04-08,obliviononahalfshell,Conservative,12,https://www.reddit.com/r/Conservative/comments/fxeouw/abortion_advocates_melt_down_after_federal_court/fmuhlr0/,"FTA~ There’s no reason for the state to allow elective abortions to continue during the coronavirus crisis while all other elective surgeries—not to mention a vast array of other activities—are suspended for many good reasons. As we argued in a friend-of-the-court brief filed just yesterday regarding a similar executive order in Oklahoma, ‘The abortion industry is demanding special treatment not to save lives, but to end them.’ The courts ‘should not allow abortion businesses to drain critical medical resources from the front lines and flout social distancing requirements.’"
