date,author,subreddit,score,url,text
2020-02-04,Jmlsky,AsianSocialists,1,https://www.reddit.com/r/AsianSocialists/comments/eyoarf/a_racist_letter_sent_to_a_frenchchinese_worker_in/fgi9wjy/,"""Our dear Chinese ennemy,

It's time for you to go back in China. You come here (in France) to poison us with the coronavirus. My doctor friend got it while he was treating you... It's not racism to send you all back to send you back in your country, but a precaution for our arab and european civilisation. It's true that we're already invaded by your product, so it's only normal that your citizen don't invade our country. Stay at home !! You weren't able to defend yourself against the japanese in 37-45, so this fight defend yourself against the coronavirus and let us alone...


C.F.D.A ""


This is the translation of the letter displayed in the picture.

 I'm fucking ashamed of this kind of people, they're the real plague of our ""arab and european civilisation"" if you ask me.

I share this to highlight how the Chinese community in France undergo such a banalized racism. In fact, ""it's not racism"" in their little shithead. 

To give you a bit more context, it's a letter the mother of the OP received at work. She work as a cleaning agent (?) in a hostel with numerous different ethnicity, and this is what they received.

To end on a more positive tone, people in the sub are correct and tell to the OP to go make legal pursuit about it, especially given thé fact that his mother and her friends think that they know who wrote it.

But hey, i'm sure this class justice system won't do jackshit about it, so don't hope too much on this level too...

Fucking racist cunt.
I"
2020-02-04,IamMintLeaf,RoastMe,1,https://www.reddit.com/r/RoastMe/comments/eyn3o3/yall_got_a_lot_to_work_with_i_have_high/fgia0hk/,Forget Coronavirus..looks like you have Gingervirus
2020-02-04,frankliTY,singapore,1,https://www.reddit.com/r/singapore/comments/eynxwt/there_will_always_be_this_guy_who_prepares_for/fgiaada/,Ships later ( probably filters arrive after he gets coronavirus)
2020-02-04,NeverAgainTheSame,worldnews,1,https://www.reddit.com/r/worldnews/comments/ey7ejt/experts_say_wuhan_coronavirus_will_likely_become/fgib2hk/,"It has been refuted.

https://www.sciencemag.org/news/2020/02/paper-non-symptomatic-patient-transmitting-coronavirus-wrong"
2020-02-04,AutoModerator,news,1,https://www.reddit.com/r/news/comments/eyolk0/goldman_sachs_estimates_modest_hit_to_2020_global/fgib7zd/,"Your post was automatically removed for being about the coronavirus. Please use the update thread [here](https://www.reddit.com/r/news/comments/evvzf9/coronavirus_megathread/).

*I am a bot, and this action was performed automatically. Please [contact the moderators of this subreddit](/message/compose/?to=/r/news) if you have any questions or concerns.*"
2020-02-04,AutoModerator,news,1,https://www.reddit.com/r/news/comments/eyollb/taking_credit_avoiding_blame_xi_jinpings_absence/fgib84t/,"Your post was automatically removed for being about the coronavirus. Please use the update thread [here](https://www.reddit.com/r/news/comments/evvzf9/coronavirus_megathread/).

*I am a bot, and this action was performed automatically. Please [contact the moderators of this subreddit](/message/compose/?to=/r/news) if you have any questions or concerns.*"
2020-02-04,BunnyBunny79,askscience,1,https://www.reddit.com/r/askscience/comments/ewwmem/have_a_question_about_the_2019_novel_coronavirus/fgi928f/,"If you could compare/relate the coronavirus with another disease from history which would it be? Some people call it a ""baby black death"", how true is this ?"
2020-02-04,polarbear128,newzealand,1,https://www.reddit.com/r/newzealand/comments/eyjgq9/seriously_its_that_easy/fgi95zi/,That's not a silly [question](https://www.nytimes.com/2020/01/30/world/asia/coronavirus-chinese-racism.html)
2020-02-04,kd-_,askscience,1,https://www.reddit.com/r/askscience/comments/ewwmem/have_a_question_about_the_2019_novel_coronavirus/fgi9b2g/,"Though it is true people with pre-existing conditions, elderly etc are more susceptible, the exact same thing can be said about the flu. However, the same person is expected to be more sick with this than they would have if they had the flu so the chance of complications is, on average, higher for every age group. The other thing to consider is that even if you are in an age/health group that is extremely unlikely to die from this (despite it being worse than the flu), you still have to be careful not to contact it or transmit it to someone else if you already have it because others who may not be as lucky/healthy/young as you could be at much bigger risk. It kills usually from respiratory complications. 

https://www.who.int/emergencies/diseases/novel-coronavirus-2019/advice-for-public/myth-busters"
2020-02-04,AutoModerator,news,1,https://www.reddit.com/r/news/comments/eyo7e6/deadly_coronavirus_pandemic_doubles_in_6_days/fgi9gi0/,"Your post was automatically removed for being about the coronavirus. Please use the update thread [here](https://www.reddit.com/r/news/comments/evvzf9/coronavirus_megathread/).

*I am a bot, and this action was performed automatically. Please [contact the moderators of this subreddit](/message/compose/?to=/r/news) if you have any questions or concerns.*"
2020-02-04,BigManDoBigFings,newzealand,1,https://www.reddit.com/r/newzealand/comments/eyjgq9/seriously_its_that_easy/fgi9r8y/,Why would people bring racism into a medical thing like coronavirus??
2020-02-04,collax974,france,1,https://www.reddit.com/r/france/comments/ey4zbd/la_situation_en_chine_en_ce_moment/fgia5ug/,"Puis bon, si le gouvernement chinois compte les morts de coronavirus comme ils comptent les mort de la grippe. L'année dernière en janviers ils avaient compté seulement 143 morts de la grippe en janvier soit beaucoup moins qu'en france alors qu'ils ont 20 fois plus d'habitants."
2020-02-04,autotldr,worldnews,1,https://www.reddit.com/r/worldnews/comments/eyo1bb/coronavirus_spore_reports_first_cases_of_local/fgiaj6k/,"This is the best tl;dr I could make, [original](https://www.straitstimes.com/singapore/coronavirus-spore-reports-first-cases-of-local-transmission-4-out-of-6-new-cases-did-not) reduced by 93%. (I'm a bot)
*****
> SINGAPORE - Singapore has recorded its first cases of local coronavirus transmission, with four women here infected who had not travelled to Wuhan, the epicentre of the outbreak.

> As an added precaution, the authorities said they are also contacting people with similar profiles to the four cases of local transmission, who have had recent close contact with individuals with travel history to China.

> The 19th case is a 28-year-old Singapore resident, a woman who had no recent travel history to China.


*****
[**Extended Summary**](http://np.reddit.com/r/autotldr/comments/eyog32/local_transmission_in_singapore/) | [FAQ](http://np.reddit.com/r/autotldr/comments/31b9fm/faq_autotldr_bot/ ""Version 2.02, ~465037 tl;drs so far."") | [Feedback](http://np.reddit.com/message/compose?to=%23autotldr ""PM's and comments are monitored, constructive feedback is welcome."") | *Top* *keywords*: **case**^#1 **SINGAPORE**^#2 **China**^#3 **transmission**^#4 **Wuhan**^#5"
2020-02-04,autotldr,China_Flu,1,https://www.reddit.com/r/China_Flu/comments/eyo15a/local_transmission_in_singapore/fgiaj3q/,"This is the best tl;dr I could make, [original](https://www.straitstimes.com/singapore/coronavirus-spore-reports-first-cases-of-local-transmission-4-out-of-6-new-cases-did-not) reduced by 93%. (I'm a bot)
*****
> SINGAPORE - Singapore has recorded its first cases of local coronavirus transmission, with four women here infected who had not travelled to Wuhan, the epicentre of the outbreak.

> As an added precaution, the authorities said they are also contacting people with similar profiles to the four cases of local transmission, who have had recent close contact with individuals with travel history to China.

> The 19th case is a 28-year-old Singapore resident, a woman who had no recent travel history to China.


*****
[**Extended Summary**](http://np.reddit.com/r/autotldr/comments/eyog32/local_transmission_in_singapore/) | [FAQ](http://np.reddit.com/r/autotldr/comments/31b9fm/faq_autotldr_bot/ ""Version 2.02, ~465037 tl;drs so far."") | [Feedback](http://np.reddit.com/message/compose?to=%23autotldr ""PM's and comments are monitored, constructive feedback is welcome."") | *Top* *keywords*: **case**^#1 **SINGAPORE**^#2 **China**^#3 **transmission**^#4 **Wuhan**^#5"
2020-02-04,AutoModerator,askscience,1,https://www.reddit.com/r/askscience/comments/eyoknw/study_claiming_new_coronavirus_can_be_transmitted/fgib3oo/,"Hello, it looks like you're trying to submit a question related to Coronavirus. We currently have a question thread about Coronavirus.  Go [here](https://www.reddit.com/r/askscience/comments/ewwmem/have_a_question_about_the_2019_novel_coronavirus/) to participate.

*I am a bot, and this action was performed automatically. Please [contact the moderators of this subreddit](/message/compose/?to=/r/askscience) if you have any questions or concerns.*"
2020-02-04,Catappa_mama,IndiaSpeaks,1,https://www.reddit.com/r/IndiaSpeaks/comments/eynspj/rakhi_sawant_heads_to_china_to_kill_coronavirus/fgib722/,Isko coronavirus kha jaye
2020-02-04,AutoModerator,news,1,https://www.reddit.com/r/news/comments/eyollv/african_countries_rush_to_reinforce_defences/fgib86o/,"Your post was automatically removed for being about the coronavirus. Please use the update thread [here](https://www.reddit.com/r/news/comments/evvzf9/coronavirus_megathread/).

*I am a bot, and this action was performed automatically. Please [contact the moderators of this subreddit](/message/compose/?to=/r/news) if you have any questions or concerns.*"
2020-02-04,sprazcrumbler,worldnews,1,https://www.reddit.com/r/worldnews/comments/eyk6sf/chinese_citizens_can_face_7_yrs_imprisonment_for/fgib9z6/,"Anyone read this article?

BBC News - The Chinese doctor who tried to warn others about coronavirus
https://www.bbc.co.uk/news/world-asia-china-51364382

Maybe the first Dr to notice coronavirus had to sign a confession from the police promising not to spread any more flase rumours."
2020-02-04,CosmoPhD,AMD_Stock,1,https://www.reddit.com/r/AMD_Stock/comments/eyfjk1/vmware_caps_percpu_fees_at_32_cores_amds_epyc/fgibf42/,"Speed is important to the desktop market.

Stability and reliability are important to the server market.

Investors here are taking their experience with a personal computer and superimposing those expectations on the server market.

And then when AMD misses the sales they blame it on Intel manipulation because they’re unable to determine why companies aren’t jumping at what is clearly better hardware.  

AVX512 has been beating AMD on its head for about a decade. This 512bit optimization code has insinuated itself in some major server software like Oracle.  I don’t know why AMD CPUs don’t support or benefit from it, but it has become a sales factor. As has AMD drivers and software in general.  

Drivers and software is enough to cause a person to switch from AMD to nVidia and even to Intel in some cases for personal computing. There are plenty of stories popping up on The AMD forum. I’d say that for most Ross isn’t an issue, but that’s for personal computers.  It’s a different game in servers where a bug or bad software can ok was to many hours of downtime, or worse if the company is forced to seek a consultant to get It working.  Before they even css as led the consultant, that server has lost them money.

Due to this, AMD , despite its hardware advantage does not have an advantage in traditional servers.  Their advantage is limited to new customers requiring a sever for the first time and to web servers where Intel’s software and AVX512 advantage doesn’t exist. If you look at AMDs server wins, they all fit that bill.  If you look at sales though, that market doesn’t seem big, but it could be the ramp. 

Anyway, I think the coronavirus changed the game. Since, due to the tarrif war and the corresponding discussions we’ve gad about on here, it’s established that 40% of AMD business is shipped to China for assembly and sales elsewhere. All of that has been disrupted with a large delay due to an absent workforce in China. It’s also been disrupted due to uncertainty around the world. In my experience companies will delay investments under these conditions because they don’t know when full production and full sale revenue will resume, so that money is saved to keep the business running as is 

The actions Chiba took in the market yesterday was for that reason alone. To provide liquidity for companies in China that would have folded due to the stress that coronavirus has on their ongoing operations. That’s why banks were orders not to collect on outstanding loans.

Under those conditions how can you expect AMD to meet guidance? How can you expect similar companies to meet guidance, or more affected companies.  Apple shuttered all of their stores in China during what is one of the most lucrative shopping seasons. How are they going to meet guidance?

What about the people at home under forced quarantine, how are they making money, and if they aren’t how will they buy computer parts? How will they buy computer parts?

The market is at that extreme point where sentiment is so high that we’re sitting at the delusional/ denial phase of the stock market phases.

As a growth stock though it’s not as dangerous as AMD will eventually make the sales to support this stock price again, but damage caused by the reaction to this virus will delay everything by an amount of time dictated by how far this thing spreads before a vaccine is created. 

It’s important to note that rna inhibitors are dangerous. They prevent/mess up/damage the creation of protein in the body and are linked with mitochondrial damage that may be inherited. Compared to death it’s a solution, but compared to a virus that has a ~2% mortality rate, people will take those chances, those are good odds (if it’s at ~2%) as statistics is telling us.
The vaccines represents confidence. The people’s are not confident they can go to work and carry back n their lives safely until they’re vaccinated. This is all about fear. Fear in the market is a recession. This hasn’t been priced in because we’re sitting at the denial stage in the market. 

AMD current evaluation is way ahead of sales, we know this because of the high PE compared to other stocks in the same sector and other companies. It requires a perfect execution to maintain its value.  Look at what I just wrote. Can AMD make those sales if 40% of their market is in jeopardy?

To be clear, a long term hold strategy is good. I think the virus may cause a ~6-9 month delay in sales once this thing blows over after a vaccine is developed.... assuming that the reason MERS doesn’t have a vaccine is because that virus is affecting the middle east. If it’s because MERS has thwarted efforts, then that’s horrible news and things will be much worse."
2020-02-04,PeteBootySnitch,Thailand,1,https://www.reddit.com/r/Thailand/comments/ew1r10/wuhan_coronavirus_update_and_discussion_megathread/fgibg32/,"Singapore announces first local coronavirus transmissions


https://www.bangkokpost.com/world/1850449/singapore-announces-first-local-coronavirus-transmissions"
2020-02-04,starfyredragon,Jokes,1,https://www.reddit.com/r/Jokes/comments/eynlw0/what_do_you_get_when_you_cross_a_ford_with_a/fgi98qg/,">What's the difference between your jokes and coronavirus?

>Coronavirus doesn't cause cancer.

I am quite radiant, thankyou.''

>What do your jokes and coronavirus have in common?

>They're both bad.

Yep. Girls always tell me they like 'em bad. 

>Do you wanna know what's funnier than your jokes?

>Literally everything, including coronavirus.

I like how you think coronavirus jokes are equivalent to Republican Senator jokes. Thanks for the help with material. 

>What's the difference between your jokes and a Republican?

>Republicans are anti-abortion.

Only until Trump wants one for one of his Mistresses (or himself, he looks well past term).

>What does Jeffry Epstein have to do with any of this?

>Nothing. Just thought I'd remind everyone that he didn't commit suicide.

Yea, I'd agree with that."
2020-02-04,sanman,Coronavirus,1,https://www.reddit.com/r/Coronavirus/comments/ey9zn6/stop_comparing_the_coronavirus_to_the_flu/fgi9kk2/,But are the Coronavirus symptoms flu-like? Do all of these pandemics basically show flu-like symptoms? Or should we be comparing this with Ebola?
2020-02-04,deepfluke,charts,1,https://www.reddit.com/r/charts/comments/eykqyn/coronavirus_versus_sars/fgiab24/,"New transmissions outside China are already being reported:

""**February 4:**

 [**Person to Person transmission**](https://www.worldometers.info/coronavirus/coronavirus-incubation-period/#asy) **confirmed**

As they confirm 6 new cases in Singapore, **4 of weach did not travel to China**. [Health official announce first **local coronavirus transmissions**](https://www.straitstimes.com/singapore/coronavirus-spore-reports-first-cases-of-local-transmission-4-out-of-6-new-cases-did-not).

* [2 new cases, both in their 60s, in Hong Kong](https://www.scmp.com/news/hong-kong/health-environment/article/3048839/coronavirus-hong-kong-confirms-first-death-39): Health officials said it was suspected the virus had been **transmitted locally**.
* [6 new cases in **Thailand**](https://www.reuters.com/article/china-health-thailand/thailand-confirms-six-new-cases-of-coronavirus-including-four-thais-health-ministry-idUSL4N2A42CP).
* **1st case of** [coronavirus confirmed in **Belgium**](https://www.brusselstimes.com/all-news/belgium-all-news/93361/first-case-of-coronavirus-confirmed-in-belgium/) (one of the nine [repatriated from Wuhan](https://www.reuters.com/article/us-china-health-belgium/repatriated-belgian-tests-positive-for-coronavirus-idUSKBN1ZY0OK) on Feb. 2).
* [a 39-year-old man **died from the coronavirus in Hong Kong**](https://www.scmp.com/news/hong-kong/health-environment/article/3048839/coronavirus-hong-kong-confirms-first-death-39). According to reports, the **patient had  an underlying illness** and had travelled to Wuhan on January 21.""

[https://www.worldometers.info/coronavirus/](https://www.worldometers.info/coronavirus/)"
2020-02-04,JasperBeardly444,China,1,https://www.reddit.com/r/China/comments/eygxw7/china_indefinitely_halts_film_production/fgiapuk/,"Finale: American holds a syringe to Chinese woman's neck, he's about to inject her with Coronavirus, Jackie Chan looks on tearfully, then looks at the flag on his lapel, which imbibes him with the strength of Xi, which allows him to rip out the Americans heart. Heart is placed directly into child-who-needs-heart-transplant, who gives a communist to salute to a smiling Mao, who is Mufasa-ing in the sky. The end."
2020-02-04,DoinWhatImDoin,CryptoCurrency,1,https://www.reddit.com/r/CryptoCurrency/comments/eymwpf/can_someone_explain_hashgraph_to_me/fgias32/,"It is the 3rd iteration of Distributed Ledger Technology:

Bitcoin 1st

Ethereum 2nd

Hashgraph 3rd

&#x200B;

Hashgraph already has many real world uses, such as:

&#x200B;

 [https://www.prnewswire.com/news-releases/cdc-and-whos-coronavirus-data-now-searchable-via-acoer-powered-by-hedera-hashgraph-300997822.html](https://www.prnewswire.com/news-releases/cdc-and-whos-coronavirus-data-now-searchable-via-acoer-powered-by-hedera-hashgraph-300997822.html) 

&#x200B;

Jeff Brown has expressed interest in Hashgraph:

&#x200B;

 [https://www.bonnerandpartners.com/bleeding-edge/why-we-shouldnt-invest-in-hedera-hashgraph-yet/](https://www.bonnerandpartners.com/bleeding-edge/why-we-shouldnt-invest-in-hedera-hashgraph-yet/) 

&#x200B;

George Gilder can also see Hashgraph's value:

&#x200B;

 [https://www.hedera.com/blog/futurist-george-gilders-new-book-highlights-hashgraphs-potential](https://www.hedera.com/blog/futurist-george-gilders-new-book-highlights-hashgraphs-potential)"
2020-02-04,newsdk,newsdk,1,https://www.reddit.com/r/newsdk/comments/exyhfq/status_2020_w06/fgib3yl/,Posted article with title 'Alle hjemvendte danskere er testet negativ for coronavirus' and URL 'https://jyllands-posten.dk/indland/ECE11919326/alle-hjemvendte-danskere-er-testet-negativ-for-coronavirus/'
2020-02-04,MayMisbehave,China_Flu,1,https://www.reddit.com/r/China_Flu/comments/eymwew/travel_insurance_in_shanghai/fgi8xtk/,"I don't know if Safety Wing will take you or not, but it's worth checking. They won't cover coronavirus treatment if you arrived in China after January 27th, though."
2020-02-04,bowwowwoofmeow,Damnthatsinteresting,1,https://www.reddit.com/r/Damnthatsinteresting/comments/eyn8h0/removing_oil_with_ice/fgi8z1t/,This is how the coronavirus spreads.
2020-02-04,lonely_ghost_april,Coronavirus,1,https://www.reddit.com/r/Coronavirus/comments/eyipv5/im_alone_at_the_emergency_centre_in_a_hospital/fgi9ynd/,"The doctor told me that 5-6 people each day goes to the hospital to get coronavirus check even though they didn’t go to China or leave the country. People went to get checked for safety and to ensure they are okay. Every tests are the same. People who haven’t been to China or weren’t in China the last 14 days were not really recommended to get a check up but I did anyways cause I was coughing. 

However, people who came from China or were in China the last 14 days will have a have a separate different tests. They have more and accurate tests like X ray and blood tests and other types (not really sure). So it’s quite different."
2020-02-04,oddwhobody,worldnews,1,https://www.reddit.com/r/worldnews/comments/eyk6sf/chinese_citizens_can_face_7_yrs_imprisonment_for/fgiacnd/,"It’s real. It’s being reported in Chinese media as well. Last I heard, 4 people were arrested but from what I understand they were saying the death toll is a lot higher than what’s being reported- this is true. They’re trying to put anything but coronavirus on the death certificate. 
Put in jail for stating facts."
2020-02-04,autotldr,cvnews,1,https://www.reddit.com/r/cvnews/comments/eyo9ps/4_locally_transmitted_cases_among_new_cases_in/fgiai6n/,"This is the best tl;dr I could make, [original](https://www.channelnewsasia.com/news/singapore/wuhan-virus-coronavirus-singapore-community-spread-tourists-12389314) reduced by 90%. (I'm a bot)
*****
> SINGAPORE: Singapore confirmed on Tuesday its first locally transmitted cases of the novel coronavirus, among six new cases of the disease detected in the country.

> They re-entered Singapore via Woodlands Checkpoint at 3am on Jan 27 and flew from Changi Airport Terminal 1 at 6am.READ: What we know about the 6 new cases of novel coronavirus in Singapore.

> The 32-year-old Singapore resident was asymptomatic when she went to NCID. The 22nd and 23rd cases were among 92 people evacuated from Wuhan on Jan 30 and the two had no symptoms when they boarded the flight to Singapore.


*****
[**Extended Summary**](http://np.reddit.com/r/autotldr/comments/eyoft4/4_locally_transmitted_cases_among_new_coronavirus/) | [FAQ](http://np.reddit.com/r/autotldr/comments/31b9fm/faq_autotldr_bot/ ""Version 2.02, ~465034 tl;drs so far."") | [Feedback](http://np.reddit.com/message/compose?to=%23autotldr ""PM's and comments are monitored, constructive feedback is welcome."") | *Top* *keywords*: **case**^#1 **SINGAPORE**^#2 **coronavirus**^#3 **Jan**^#4 **China**^#5"
2020-02-04,east_62687,indonesia,1,https://www.reddit.com/r/indonesia/comments/eyamz2/04_february_2020_daily_chat_thread/fgiai6o/,"it appears we have first Indonesian infected with coronavirus in Singapore..
  
https://www.channelnewsasia.com/news/singapore/wuhan-virus-coronavirus-singapore-community-spread-tourists-12389314
  
>Case 19's maid, a 44-year-old Indonesian national, is the 21st case. She reported onset of symptoms on Sunday and did not leave her house until she was admitted to SGH the next day."
2020-02-04,LTT82,GoldandBlack,1,https://www.reddit.com/r/GoldandBlack/comments/ey6h8q/michael_bloombergs_claim_about_children_killed_by/fgiauoy/,"
>More people have died this year from the flu than from corona virus.

To be fair, we're relying upon the honesty of China to know the full extent of the Corona virus.  [It's not like there isn't reason to suspect they're lying.](https://nypost.com/2020/01/26/coronavirus-whistleblower-nurse-says-china-has-90000-sick/)

It's China.  [Why wouldn't we believe them?](https://www.latimes.com/world-nation/story/2020-02-03/china-wuhan-coronavirus-censorship)"
2020-02-04,mac_bug,canada,1,https://www.reddit.com/r/canada/comments/eyayi9/canadians_with_coronavirus_symptoms_wont_be/fgib7gb/,https://www.sciencemag.org/news/2020/02/paper-non-symptomatic-patient-transmitting-coronavirus-wrong
2020-02-04,jayramos96,britishproblems,1,https://www.reddit.com/r/britishproblems/comments/eyolaj/2_primary_schools_in_my_local_town_of_milton/fgib98g/,https://www.miltonkeynes.co.uk/health/two-chinese-schoolchildren-unfairly-excluded-milton-keynes-schools-over-coronavirus-fears-claims-dad-1384084
2020-02-04,justinitforthesci,China_Flu,1,https://www.reddit.com/r/China_Flu/comments/eymugu/potential_bad_news_a_korean_woman_got_the_virus/fgibak5/,"Maybe she had a lift with this man? How many others? 

https://www.theguardian.com/world/2020/jan/31/coronavirus-thailand-confirms-first-human-to-human-transmission"
