date,author,subreddit,score,url,text
2020-04-19,agclax7,neoliberal,17,https://www.reddit.com/r/neoliberal/comments/g43a27/discussion_thread/fnwwgff/,Talks with the coronavirus going well!
2020-04-19,HbRipper,Coronavirus,16,https://www.reddit.com/r/Coronavirus/comments/g4dfru/navarro_its_incumbent_on_china_to_prove_lab/fnwrj2z/,"Ok, it’s incumbent on the US to prove their inaction played no role in the Coronavirus outbreak. Agree on both:)"
2020-04-19,SFMara,Coronavirus,16,https://www.reddit.com/r/Coronavirus/comments/g4hkba/us_alerted_israel_nato_to_disease_outbreak_in/fnxh82p/,"For all those screaming for weeks that this was fake news and no such report existed, apparently there is now outside corroboration.

>Israeli military officials later in November discussed the  possibility of the spread of the virus to the region and how it would  affect Israel and neighboring countries.  
>  
>The intelligence also reached Israel’s decision makers and the  Health Ministry, where “nothing was done,” according to the report.  
>  
>Last week, [ABC News reported](https://abcnews.go.com/Politics/intelligence-report-warned-coronavirus-crisis-early-november-sources/story?id=70031273)  that US intelligence officials were warning about the coronavirus in a  report prepared in November by the American military’s National Center  for Medical Intelligence.  
>  
>It was unclear if that was the same report that was said to have been shared with Israel.  
>  
>Colonel Shane Day, the NCMI director, denied last week that any  such report existed. “As a matter of practice the National Center for  Medical Intelligence does not comment publicly on specific intelligence  matters,” he said. “However, in the interest of transparency during this  current public health crisis, we can confirm that media reporting about  the existence/release of a National Center for Medical Intelligence  Coronavirus-related product/assessment in November of 2019 is not  correct. No such NCMI product exists.”

What's the new party line?"
2020-04-19,hawknasty13,wallstreetbets,15,https://www.reddit.com/r/wallstreetbets/comments/g4ega7/what_are_your_moves_tomorrow_april_20_2020/fnx9xqa/,"My uncle has had coronavirus for a week. Was feeling ok, just got sent to the ICU with breathing problems. Fuck man."
2020-04-19,tnick771,Coronavirus,15,https://www.reddit.com/r/Coronavirus/comments/g4dgqt/louisiana_is_in_a_much_better_place_today_than_we/fnwspvq/,"I understand and agree. But you look at Spain, Italy and New York and, even if it’s not a deadly virus, healthcare systems can be overwhelmed which leads to excess fatalities. Excess as in unnecessary, not “a ton”. 

But I agree, the fatality rate of the coronavirus was really overestimated (I remember some people thinking it was as high as 5%). When in reality it seems like it’s about 0.3% (still 3x deadlier than the flu)."
2020-04-19,DTLACoder,wallstreetbets,15,https://www.reddit.com/r/wallstreetbets/comments/g4ega7/what_are_your_moves_tomorrow_april_20_2020/fnx4grr/,Las vegas opening casinos on May 1. The fine residents of Las Vegas don't give AF about coronavirus. Get some calls on Wynn while you can.
2020-04-19,MrDownhillRacer,Cringetopia,14,https://www.reddit.com/r/Cringetopia/comments/g48zbb/the_battle_of_the_simps/fnx0kds/,"With the coronavirus pandemic, millennials and zoomers have stopped saying ""ok, boomer"" and have started asking ""are you ok, boomer?"""
2020-04-19,y0ur_h1ghness,Coronavirus,13,https://www.reddit.com/r/Coronavirus/comments/g4eooc/is_it_a_myth_to_say_its_life_as_normal_in_sweden/fnwyd32/,"My friends girlfriends’ parents are from Sweden and went skiing two weeks ago. They both caught coronavirus, along with their doctor friend."
2020-04-19,antsy123,wallstreetbets,11,https://www.reddit.com/r/wallstreetbets/comments/g4d40o/puts_are_back_on_the_menu_boys/fnwpk34/,"For nearly five decades, David Hunter — the chief macro strategist at Contrarian Macro Advisors — has had financial markets at the forefront of his attention. At this point he's seen just about all there is it see, and has become known for his prescient analysis of economic cycles.

""It's a different thing when you've lived through these cycles as opposed to reading about them,"" he said on ""The Contrarian Investor Podcast."" ""I have a lot of conviction on my calls, typically, because I have that experience behind me.""

Today, Hunter thinks the economy is nearing the end of a ""super-cycle"" — the collapse of which will have cataclysmic repercussions.

""We're at the latter-end of a super-cycle,"" he said. ""The super-cycle is the long cycle that starts after the last depression and ends with the next depression.""

Hunter's gloomy forecast is mainly predicated upon what he sees as an unmanageable amount of debt and leverage that's been building within the economy.

If that evaluation and skepticism of the overarching landscape sounds familiar, it's because Ray Dalio, the billionaire founder and cochief investment officer of Bridgewater Associates, touts a similar thesis. He's also been equating today's longer-term debt cycle to the Great Depression era.

Dalio has long warned of the unsustainability of a low-interest-rate environment — especially one where asset prices have become overextended. A widening wealth gap and a surging populist movement also inform his view that today's situation mirrors the 1930s.

Hunter is similarly weary of unprecedented central bank easing.

""We have debt beyond anything we can ever manage,"" Hunter said. ""When you get these surprises, that leverage really exacerbates whatever downturn you get.""

Now, with two of the world's largest economies — the US and China — essentially running at a fraction of their prior capacity, Hunter thinks the bust is inevitable.

""You look at where we are today, and you can become pretty dire about coming out of this,"" he said. ""I think this is the front edge of that bust.""


Hunter thinks this will all play out with an intense bout of volatility. And his view of what happens next might be surprising considering his dire long-term outlook.

Hunter actually sees a massive S&P 500 rally transpiring before an eventual collapse. In fact, he thinks the benchmark will exceed 4,000 by Labor Day — implying upside of about 40% from current levels. He refers to this as the final ""melt up"" and says it will be ""a secular top that I expect to be the high-water mark for decades to come.""

His reasoning behind his bullish short-term call is simple: unprecedented Federal Reserve stimulus.

""Because you're getting money beyond anything that's ever been pumped before, you can get this run up in the market in spite of the fact that the bust is not going to leave us,"" Hunter said. ""We're not going to start the bust and then not.""

He continued: ""We will have some sort of a 'V' recovery for a quarter, maybe two, because of all this money — but ultimately, it's all one bust.""

A similar degree of medium-term bullish sentiment has been adopted by equity strategists at Goldman Sachs. They recently called the S&P 500 market bottom on the heels of a $2.3 trillion Fed stimulus announcement. It's become a popular sentiment across Wall Street that the Fed's actions have bailed out financial markets and enabled risk-takers.

Unfortunately, Hunter thinks the market's stimulus-induced exuberance will be exhausted in the later portion of the year as participants realize the money printer isn't the panacea that had hoped it'd be.

""There's a lot of things you can't reach with money, and a lot of things you can't fix,"" he said. ""We're also dealing with a virus that is beyond anything we're used to dealing with — and it's going to take time to get that fixed.""

That element of his forecast matches that of fellow market bears, including Societe Generale strategist Albert Edwards and John Hussman, the former economics professor and current president of the Hussman Investment Trust.

Both have cited unprecedented levels of Fed stimulus as creating unsustainable asset bubbles that will eventually pop. They say easy lending conditions have backstopped assets and allowed for wild speculation — and believe that's created unsustainable pockets of risk throughout markets.

With all of that under examination, Hunter delivers a stark warning.

""What follows the final leg up is what I call: 'A bear market of historic proportions,'"" he said. ""From that high this summer, I expect an 80% peak-to-trough decline.""  

""Basically the biggest bear market since the '29 crash,"" he concluded.

Do you have a personal experience with the coronavirus you'd like to share? Or a tip on how your town or community is handling the pandemic? Please email covidtips@businessinsider.com and tell us your story."
2020-04-19,NewYearNewMe2021,Coronavirus,11,https://www.reddit.com/r/Coronavirus/comments/g4ihcr/us_coronavirus_death_toll_surpasses_40000/fnxmx2d/,"Look, when coronavirus accounts for more deaths than all forms of death combined in 2020, including coronavirus, then I'll concede that 5G might be a problem."
2020-04-19,AuburnSeer,neoliberal,11,https://www.reddit.com/r/neoliberal/comments/g43a27/discussion_thread/fnwwkmw/,"this made me giggle

just take every tweet Trump has ever had about Kim Jong Un and replace dear leader's name with coronavirus"
2020-04-19,RemarkableGeneral7,Coronavirus,10,https://www.reddit.com/r/Coronavirus/comments/g4hkba/us_alerted_israel_nato_to_disease_outbreak_in/fnxkfhn/,"The very first patient in hospital dates from the middle of December, and even then, doctors didn't have reason to think it was anything other than pneumonia. That first patient had symptoms on December 1. It is likely that patient was infected in November, and given how many people are asymptomatic, there were probably cases in November. But even Chinese doctors didn't know about them. The virus won't be sequenced until January. The US cannot possibly know before Chinese doctors do, unless the CCP is right that the US brought the coronavirus over there. But then, it would be incredibly odd the US doesn't have a vaccine, and the US government only warned Israel and NATO but did nothing to prepare for a pandemic. I call this story B.S. The far-right Times of Israel is hardly a credible source of information."
2020-04-19,SkyRu1e,SquaredCircle,10,https://www.reddit.com/r/SquaredCircle/comments/g4i6mn/i_feel_like_aew_is_ready_to_pick_up_the_tab_and/fnxk6ce/,Are you too stupid to realise the financial impact of coronavirus?
2020-04-19,sstarr,bristol,10,https://www.reddit.com/r/bristol/comments/g4eww2/satellites_flying_over_right_now/fnx3hg4/,Probably 5G satellites dropping Coronavirus all over the place.
2020-04-19,cobolcommando,ChapoTrapHouse,10,https://www.reddit.com/r/ChapoTrapHouse/comments/g41tn6/malarkey_containment_thread_19_april_2020/fnxrjps/,A whole month of 4/20 was taken from us by the coronavirus
2020-04-19,Wisef0g,DarkHumorAndMemes,10,https://www.reddit.com/r/DarkHumorAndMemes/comments/g4d0gx/germany_were_heroes_we_just_couldnt_see_it/fnxo6zq/,"> Germany has sparked outrage in China after a **major newspaper** put together a £130bn invoice that Beijing ""owes"" Berlin following the impact of the coronavirus pandemic.

Clickbait title by the express, as usual.

Edit: Formatting."
2020-04-19,ItsJustAnIllusion,neoliberal,10,https://www.reddit.com/r/neoliberal/comments/g43a27/discussion_thread/fnx0xpn/,"[40,000 dead from coronavirus: I sleep, 
Ice Cream: Real shit?](https://twitter.com/timmurtaugh/status/1250876656295841800?s=21)"
2020-04-19,flatman_88,sydney,9,https://www.reddit.com/r/sydney/comments/g4flnq/maroubra_beach_this_morning/fnxjuym/,"[Randwick City council have announced that their beaches are now open with strict rules and instructions.](https://www.abc.net.au/news/2020-04-19/coronavirus-randwick-reopens-coogee-maroubra-clovelly-beaches/12163000) 

For the moment, Waverley Council beaches remain closed (Bondi, Bronte, etc.)"
2020-04-19,UnleashedGeek,Anxiety,9,https://www.reddit.com/r/Anxiety/comments/fj2y1a/lets_post_good_news_on_the_coronavirus_here/fnwoq7h/,"I'm not sure if someone has already posted something about this. But according to [this article](https://www.theguardian.com/us-news/live/2020/apr/19/coronavirus-us-live-trump-latest-news-updates-cuomo-pelosi-lawmakers-funding-deal), New York is getting past the plateau and starting the downward trend!!!!

Keep it up, New York! I have to be honest, even though I don't live there, I cry with happiness every time I see good news coming out of there. We can do it, guys! Y'all are strong, badass people!"
2020-04-19,Panic492,Coronavirus,9,https://www.reddit.com/r/Coronavirus/comments/g4g7a3/a_question_at_the_hospitals_where_have_all_the/fnx85js/,Scared as fuck to go and pick up coronavirus.
2020-04-19,be11end,wallstreetbets,9,https://www.reddit.com/r/wallstreetbets/comments/g39g3g/weekend_discussion_thread_for_the_weekend_of/fnwsmth/,"Eminem has just become the first celebrity to be diagnosed with Coronavirus. In a statement released by doctors, it has been revealed that his palms were sweaty, knees weak and arms were heavy. He presented with vomit on his sweater already. Initial testing has revealed it was mums spaghetti."
2020-04-19,Kubrick_Fan,GlobalTalk,9,https://www.reddit.com/r/GlobalTalk/comments/g4fs08/question_how_do_people_in_your_country_feel_about/fnx6s6q/,"In the UK we have / had a dumb conspiracy theory that it's linked to coronavirus. it got to the point where idiots where attacking any mobile phone mast, including the ones that serves NHS Nightingale"
2020-04-19,xRandomality,Coronavirus,9,https://www.reddit.com/r/Coronavirus/comments/g4f90u/ny_nj_connecticut_reopen_marinas_amid_calls_to/fnx6eyj/,"Literally basic virology of the coronavirus family. Go read a book, educate yourself before you speak."
2020-04-19,FREE_ROGIO,LockdownSkepticism,9,https://www.reddit.com/r/LockdownSkepticism/comments/g4inoj/japan_had_7_covid_deaths_yesterday_they_have/fnxnqkg/,Because it doesn't fit the narrative that the coronavirus is an extremely dangerous disease and that house arrest isn't needed
2020-04-19,CapuchinMan,TikTokCringe,8,https://www.reddit.com/r/TikTokCringe/comments/g4c162/nobody_knew_there_would_be_a_pandemic_or_an/fnxga1f/,They tried but the whole process was botched; [LINK](https://www.nytimes.com/2020/03/29/business/coronavirus-us-ventilator-shortage.html)
2020-04-19,_bird_internet,Coronavirus,8,https://www.reddit.com/r/Coronavirus/comments/g4b9r1/coronavirus_has_now_killed_more_people_in_us_than/fnx0mho/,"We don't shut down the entire country for the flu. If we hadn't done this, the deaths would be even higher.

The deaths are being concentrated among those who can't social distance. For example, in NYC, 68 MTA workers have died from coronavirus. That's insane. The flu never has that type of impact, and suggesting it might be similar is delusional."
2020-04-19,kidfromkor,Coronavirus,8,https://www.reddit.com/r/Coronavirus/comments/g47znm/daily_discussion_post_april_19_questions_images/fnxhja4/,"It's been 41 days since my last write-up of my life in Korea and I've had a few people contact me wanting to know how I'm doing and what it's like in Korea now. So I figured I'd write up an update. Here's my previous write up.

  


[https://www.reddit.com/r/Coronavirus/comments/ffqiyn/daily_discussion_post_march_09_questions_images/fk0238h?context=3](https://www.reddit.com/r/Coronavirus/comments/ffqiyn/daily_discussion_post_march_09_questions_images/fk0238h?context=3)

  


Korea's coming off a day with 8 new cases. 8 in the whole country. Such a low number is great, but at the same time, it has this ""too good to be true"" kind of a feel. Like something terrible is just around the corner, ready to hit us with another patient \#31. I guess the last few months has brought out the skeptic in me.

  


Today's the first day of school for my oldest kid, 2nd grade. It's an online first day of school, but first day of school nonetheless. It's going to count as a day in school for the academic year, as I understand it. Some older kids, especially those in their last year of middle/high school started a couple of weeks earlier. As expected, there were some problems of EBS (Education broadcasting Station) website being down for a few days, but mostly I think it's been going OK. People know everything's not going to be perfect, but this seems fine. My kid will be watching 2 30 minute episodes of ""class"" on TV, one at 9:30, the second at 10:30, and submit some form of a response to his homeroom teacher by 2 pm via commenting on an app. My biggest concern is the younger one contantly getting in the way, but we'll see how it goes.

  


Bigger news has been politics. I don't want to get TOO political, but I feel I should mention how the virus affected the result. Contrary to my concerns, the voting turnout was higher than any other elections in the past (limited to lawmaker election. presidential elections have been higher). More than 60% showed up. In Korea, you have two days of pre-vote (not sure of the terminology) a few days before the official election day that includes a Saturday for people that can't make it to the voting booth on the official election day. This is useful especially if you're currently living away from your registered residence, because you can vote anywhere. On election day, you must goto your designated voting booth closest to your registered residence. I actually went Saturday to pre-vote, but I came back after seeing the long queue. It would've taken 30 minutes plus, at least. I went to vote at 6 am on official voting day, the time the booths open, and I still had to wait 20 minutes or so. The people stood about 1~2 meters apart, everyone obviously had there masks on. People working there gave out pumps of hand sanitizers, and then plastic gloves to wear. Temperatures were checked before entering the booth. Everything went well considering the situation. Left leaning ruling party had its biggest win in recent history, which was contrary to my concern that younger voter turnout would be low because of the virus. In all, I think we set a good precedent on how a nationawide election can be held through the virus.

  


Government stimulus has come in various ways. There are three separate programs that I was able to sign up to get money. First there's the providence/city stimulus. We get $200 (doing a rough 1USD=1,000KRW here) for every member of your family ($100 from the providence, $100 from the city). This means we got a $800 worth of local currency. I say ""local"" because this $800 can only be used within the local city, and for shops or business that has sales less than a specific amount. This eliminates Walmart-like businesses and department stores. They're trying to get you to spend the money of local small businesses. This $800 will disappear after 3 months. So we've been buying groceries and going to the dentist with this money. Second, there's $400 for every kids younger than 7. That money can be spent in the whole providence, not just the city. I can use it anywhere that's not Walmart-like business, dept stores, bars, etc. Then finally third, we have $100 for all elementary/middle/high school kids. This comes directly to my bank account and has no limits on usage. All this obviously helps. Of course us, but a lot of the local businesses. We've spent a lot of the money we got on books for kids, going to local bookstores. 

  


Other than that, not much has changed. I've gotten more used to living like this. I goto work like I did a month ago. All the masks, sanitizers, temperature checks are still there. If you have any questions, feel free to ask. Hope everyone's well."
2020-04-19,jjkase,television,8,https://www.reddit.com/r/television/comments/g4h9c6/gosh_30_rock_is_just_brilliant/fnxku51/,"There was actually an article about how the 30 Rock crew would handle COVID


https://www.vulture.com/2020/04/30-rock-coronavirus-episode.html"
2020-04-19,iStar08,YouShouldKnow,8,https://www.reddit.com/r/YouShouldKnow/comments/g49189/ysk_news_media_is_not_an_accurate_representation/fnwx0g1/,"When will you people stop parroting this fake narrative that Reddit is having more anti-china sentiment? First off, I've seen more comments saying what you're saying, than I have comments saying something that can be taken as ""anti-china sentiment"" 

And second, you'd think a country that runs concentration camps and is committing actual genocide, and letting their people live/shop in conditions that spread diseases like coronavirus, would be more subject to scrutiny. For a website that constantly whines about ""lIteRaL nAziS iN the WhITE hOusE"" they don't seem to be too concerned with China. I would have expected to see more anti-china comments, but I don't."
2020-04-19,nicereddy,neoliberal,8,https://www.reddit.com/r/neoliberal/comments/g43a27/discussion_thread/fnx60ss/,"https://twitter.com/conormccuetv/status/1251966190651572224?s=21

One guy is holding a sign that says ""I would rather risk Coronavirus than socialism!""

We already beat Bernie you idiots"
2020-04-19,HeliumChameleon,neoliberal,8,https://www.reddit.com/r/neoliberal/comments/g43a27/discussion_thread/fnx9579/,Coronavirus isn't real they just want an excuse to fill our skateparks with sand
2020-04-19,Boomertron7000,Anxiety,7,https://www.reddit.com/r/Anxiety/comments/fnz5n3/coronavirus_discussion_thread/fnxfsqk/,"Is it just me, or is optimism about coronavirus very frowned upon on the internet, at least on Reddit?"
2020-04-19,akotapa,medicalschool,7,https://www.reddit.com/r/medicalschool/comments/g4dawg/ventserious_due_to_covid_our_tuition_has_been/fnxg2vq/,"Not a med student but a premed. Someone at my undergrad (Purdue, one of the cheapest schools in my state) sued the school for not giving enough reimbursement on tuition (they gave us 750). [https://www.jconline.com/story/news/2020/04/18/coronavirus-indiana-lawsuit-targeting-purdue-profiteer-student-suing-not-only-one-grousing-tuition-r/5144012002/](https://www.jconline.com/story/news/2020/04/18/coronavirus-indiana-lawsuit-targeting-purdue-profiteer-student-suing-not-only-one-grousing-tuition-r/5144012002/)

I say you lawyer up and settle this with a class action lawsuit like the hero at my school."
2020-04-19,Waldo_Pepper62,Coronavirus,7,https://www.reddit.com/r/Coronavirus/comments/g4abya/professor_sarah_gilbert_possible_to_be_infected/fnwuadz/,"40 mutations of the virus

Icelandic scientists say testing has already revealed that there are at least 40 mutations of coronavirus in Iceland, and the virus might develop to become more contagious, but less dangerous.

https://english.alarabiya.net/en/features/2020/03/25/Coronavirus-Iceland-s-mass-testing-finds-half-of-carriers-show-no-symptoms.html

https://www.msn.com/en-gb/news/coronavirus/scientists-in-iceland-claim-they-have-found-forty-mutations-of-the-coronavirus-and-admit-seven-cases-can-be-traced-back-to-a-football-match-in-england/ar-BB11DpwG"
2020-04-19,TijoWasik,funny,7,https://www.reddit.com/r/funny/comments/g45t9d/feeling_bad_for_laughing_audio_on_also_all_credit/fnwomwd/,"Combine the 5 worst affected areas of the US, and you'll find that the statistics skew hugely in the other direction. You cannot cherry pick to make yourself look better. Let's not forget here that there's some states that are not heavily affected which skews the statistics in such a way that they're not comparable any more. But if you want an example, here's what I wrote to another person earlier.

""Perspective.

""Italy has a population of 60.36 million in 301,338km^2, with 178,972 cases confirmed, for an average of one in 337 people with the Coronavirus.

""New York City has a population of 8.399 million in just 783.8km^2 and has 134,436 cases for an average of one infection per 62 people.

""You can twist the statistics all you want, but someone can twist them right back at you. Italy has 7.18 times the amount of people but also has 380+ times the amount of space.

""You see the problem with quoting statistics like they're facts without presenting them in the proper way, with the proper context?"""
2020-04-19,socal_guy1320,weed,7,https://www.reddit.com/r/weed/comments/g4f0cn/someone_donate/fnx0bo7/,"If your dad robbed you out of 2K then why not call the police? Out of work due to Coronavirus, file unemployment like everyone else."
2020-04-19,EQAD18,ChapoTrapHouse,7,https://www.reddit.com/r/ChapoTrapHouse/comments/g41tn6/malarkey_containment_thread_19_april_2020/fnx3vso/,[Vietnam hasn't had a new case in three days and even the usual casual racists at r/coronavirus had to give them credit](https://www.reddit.com/r/Coronavirus/comments/g43x41/bigups_to_vietnam_controlling_the_hell_out_of)
2020-04-19,dwdsquared2,wallstreetbets,7,https://www.reddit.com/r/wallstreetbets/comments/g4ega7/what_are_your_moves_tomorrow_april_20_2020/fnxhfi1/,"""I don't like mosquitos"" 

-DJT during a Coronavirus Briefing"
