date,author,subreddit,score,url,text
2020-02-25,kreduloust,xfl,3,https://www.reddit.com/r/xfl/comments/f9iwx5/xfl_imperial_map_week_3_the_downfall_of_the/fisic1p/,"I don't recall it ever being 1%. I might have come late to the party though.

And the majority of those deaths were the elderly and those who already had serious health issues before getting NCOV. The way it's  going, the rate is probably gonna drop and end around 6%.

The [place](https://www.worldometers.info/coronavirus/) I've been watching to see up to the minute raw data on the progress of NCOV and the efforts against it is now reporting an 8% mortality rate. It was almost 40% three weeks ago."
2020-02-25,Climber_News,climbing,3,https://www.reddit.com/r/climbing/comments/f9j8ik/tokyo_2020_olympics_might_be_cancelled_due_to/firwmu1/,"TL;DR:

Oldest member of the International Olympic Committee has said there is a risk that the Tokyo 2020 Olympics may be cancelled due to the Coronavirus outbreak.

No current decision, but if it reaches a Pandemic or plans to control outbreak aren't in place, a cancellation is much more likely than postponing or moving.

Those other options basically don't work for something as large as the Olympics because of logistics of hosting, TV slots, and affecting world sports schedules.

Experts say this could well be a pandemic so it's up in the air. Final decision by May."
2020-02-25,SwimmingCampaign,ChapoTrapHouse,3,https://www.reddit.com/r/ChapoTrapHouse/comments/f9529d/crying_about_a_poll_from_a_c_pollster_thread/firx42t/,Damn coronavirus whips ass now
2020-02-25,bigelowz,wallstreetbets,3,https://www.reddit.com/r/wallstreetbets/comments/f9h6jj/what_are_your_moves_tomorrow_february_26_2020/firx949/,"Feels like a Dec 2018 repeat, futures up, and a sell off early morning. Replace “trade news” with “Coronavirus”."
2020-02-25,BeginningResearch,Coronavirus,3,https://www.reddit.com/r/Coronavirus/comments/f9l5we/covid19_beyond_containment_but_singapores_efforts/fishf6x/,"Full article below:
SINGAPORE - The coronavirus outbreak has gone beyond the point of containment, said a Harvard don.
""I think the virus is already spreading rapidly and actively in many places,"" said Professor Marc Lipsitch, director of the Centre for Communicable Disease Dynamics at the Harvard T.H. Chan School of Public Health.
He told The Straits Times: ""It seems extremely unlikely that the virus will be contained.""

More than 80,000 people worldwide have been infected in the Covid-19 outbreak and about 3,000 have died. This is already far more than the previous two coronavirus outbreaks - severe acute respiratory syndrome (Sars) and Middle East respiratory syndrome (Mers) - combined.
Covid-19 infections already spread to more than 30 countries worldwide so far.
For other countries, it’s a matter of “when and not if” they will be hit, said visiting professor Tikki Pang at the Lee Kuan Yew School of Public Policy, National University of Singapore. 

“I think the genie is out of the bottle and containment is out of the question,” he added. “It’s now a matter of how more widely it spreads and having countries not yet affected be prepared for appearance of cases.”

While he thinks the outbreak has peaked in China and Singapore, it “may just be the beginning” for countries like Italy, Korea and Iran. 
Numbers have exploded recently in countries like South Korea and Italy, with more than 900 and 200 infected respectively. Both countries have had seven deaths. 

Prof Lipsitch thinks this may happen in other countries too. He said: ""In most countries, there is not much testing of infections unless they have connections to known cases or to China.""

His team from the school had upset Indonesian authorities by suggesting in a paper published earlier this month that countries like Indonesia and Thailand are probably missing cases, as the number reported are below expected levels, given their connection with China, and the number of infections that have been picked up by Singapore.

The team had used Singapore as the upper limit of case detection capacity, and said other countries' detection ranged from 11 to 40 per cent of Singapore's efforts.

The paper, which has not been peer reviewed, concluded that for each detected case outside of China, 1.8 cases go undetected.

Singapore now has 90 cases, and close to 3,000 people who may have been infected by these patients have been put under 14 days of quarantine in an effort to stem the spread of the virus.

Travellers returning from China are also required to comply with a 14-day stay-home notice.
Prof Lipsitch had predicted earlier this month that the virus is out of control and about half the world's population will likely be infected within the coming year, though many will have the disease in a mild form.
Asked if all Singapore has been doing has been is a waste of effort if the virus cannot be contained, Prof Pang gave an emphatic “definitely not” in response. 
“The key priority is to control the situation in Singapore - the global spread is a natural consequence of these kinds of events and there is nothing Singapore can do about it. At the same time, Singapore’s experience will provide valuable lessons for other countries.”
Concurring, Prof Lipsitch said Singapore’s efforts will slow the spread, and “delay is good”. 

He explained that delaying the spread of the virus in the country is good for at least four reasons:
- Fewer individuals get infected in total in a slower-moving epidemic;
- The burden on the health system is spread out, with lower peak demand for scarce resources;
- We will know more as time goes by, on about how to care for patients. So it is better to get the disease late than early;
- If we can slow the spread long enough, there may be new drugs, vaccines, or other countermeasures to aid in preventing and treating infection.
Prof Pang said he is particularly worried about hidden cases in countries with fragile healthcare systems such as Africa. Singapore and the rest of the world can take steps to prepare countries with weak healthcare systems for introduction of the virus. "
2020-02-25,User9705,Coronavirus,3,https://www.reddit.com/r/Coronavirus/comments/f9m7go/us_service_member_test_positive_for_coronavirus/fishiry/,"Incase Article shifts - An American soldier stationed in South Korea has tested positive for the coronavirus, according to a US Forces Korea statement.

The soldier is a 23-year-old man stationed at Camp Carroll, and is the first US service member to test positive. He is currently self-quarantined at his off-base residence, said the statement.

“He visited Camp Walker on 24 Feb. and Camp Carroll 21-25 Feb. KCDC (Korea Centers for Disease Control and Prevention) and USFK (United States Forces Korea) health professionals are actively conducting contact tracing to determine whether any others may have been exposed,” the statement said"
2020-02-25,Flashy-Band,wallstreetbets,3,https://www.reddit.com/r/wallstreetbets/comments/f9h6jj/what_are_your_moves_tomorrow_february_26_2020/fiscxy0/,"""There are no positive cases of the novel coronavirus""

THEN FUCK OFF MICHIGAN, NO ONE ASKED YOU"
2020-02-25,Michael2015usa,The_Donald,3,https://www.reddit.com/r/The_Donald/comments/f9lhiy/fun_fact_dr_nancy_messonnier_the_cdc_official_who/fisejfa/,"If the Coronavirus becomes widespread in the US, why are people still pushing politics? We should be trying to help each other instead of playing the blame game."
2020-02-25,Crypto556,wallstreetbets,3,https://www.reddit.com/r/wallstreetbets/comments/f9funz/major_concerns_for_global_recession/firwg0u/,All the gay clubs are closed because of Coronavirus so they just roam the streets telling us to buy puts.
2020-02-25,BoojumG,skeptic,3,https://www.reddit.com/r/skeptic/comments/f9exoy/rush_limbaugh_coronavirus_a_common_cold_being/firz1f8/,"Whatever you understood and whatever they actually said, coronavirus is not a form of influenza virus. Coronaviruses and influenza viruses are different families of virus.

They were probably trying to manage your impression of how serious the novel coronavirus is, what the symptoms are like, and how it spreads. In those respects it is similar to the flu, though this virus is more serious than most forms of flu (edit: if you get infected) just like it's more serious than most forms of coronavirus. What impression did you initially give them of what you thought about coronavirus?

This coronavirus outbreak is a very specific novel virus and it's killing about 2-3% of the people who get infected, though they usually have some other underlying health problem, and it might be lower if we're underestimating how many people have been infected and never realized it.

https://en.wikipedia.org/wiki/Coronavirus_disease_2019

And again, it is not any kind of influenza virus. It is not *literally* ""the flu""."
2020-02-25,NoPoet406,China_Flu,3,https://www.reddit.com/r/China_Flu/comments/f98fet/covid19_daily_discussion_20200225/firxfd5/,"Well I'm in South Yorkshire and I was told today that in a local Morrisons supermarket a female member of staff was bragging that she's had a lengthy holiday in Asia, tested negative for coronavirus on her return to UK, but when the authorities asked her to self-isolate she went back to work. So this is how well ""recommending self-isolation"" is doing. We know the tests aren't reliable, we know this virus spreads like fire. There could be 150 to 1500 people who've been infected already, all from one supermarket worker. Assuming, of course, she was telling the truth."
2020-02-25,quant_cobalt,gatech,3,https://www.reddit.com/r/gatech/comments/f9gbl1/this_might_sound_a_bit_paranoid_but/firdt1m/,"I asked one of the doctors at STAMPS this, and she said they have a negative pressure room for possible coronavirus infections, and that school might close for a bit but she considered it unlikely. This was about a month ago though."
2020-02-25,ForgotMyPassword102,NoStupidQuestions,3,https://www.reddit.com/r/NoStupidQuestions/comments/f9gqis/us_why_does_the_news_always_tie_random_good_or/firf4vz/,"Well, coronavirus is a bit of a special case because it's impacting Chinese manufacturing, logistics, etc. The fear of it really is impacting worldwide trade to some extent. And remember, the stockmarket is full of gamblers who make a shitload of money on 1-2% swings. 

But good news/bad news is the source of those swings. You just really have to connect the dots. 

Like say Bernie is elected, healthcare futures are going to plummet due to his professed hatred of insurance and pharmacutical companies."
2020-02-25,krusnik99,China_Flu,3,https://www.reddit.com/r/China_Flu/comments/f9k0wx/happy_tuesday_my_entire_office_seems_to_be/fis1lwo/,"I get your frustration and yes the coronavirus is a big deal, but take a step back, breathe, and remember it’s office flu season too."
2020-02-25,I_H_T,neoliberal,3,https://www.reddit.com/r/neoliberal/comments/f96cl9/discussion_thread/fis2jeq/,"If my math is right then less than 1% of the Chinese population either has or has gotten the coronavirus. The WHO says that they believe the epidemic has plateaued and begun to decline there. If this is something that's going to infect less than 1% of a countries population and then plateau and decline, then why is everyone acting like this could kill us all?"
2020-02-25,ViktorVaughnLickupon,dankmemes,3,https://www.reddit.com/r/dankmemes/comments/f9g6xd/im_dead/fis33u2/,"https://www.theguardian.com/world/live/2020/feb/26/coronavirus-latest-updates-who-mission-director-warns-world-is-simply-not-ready?CMP=Share_iOSApp_Other
Bye. First case in Latin America"
2020-02-25,InternetCaesar,Coronavirus,3,https://www.reddit.com/r/Coronavirus/comments/f9jzjk/has_the_cdc_or_anyone_given_any_indication_as_to/fis16z1/,Read todays posts and then please play coronavirus again later.  Thank you.  Good day.
2020-02-25,flmosinman124,wallstreetbets,3,https://www.reddit.com/r/wallstreetbets/comments/f98o73/daily_discussion_thread_february_25_2020/fiqxxi8/,A televangelist said Coronavirus is punishment for gays and tranny's
2020-02-25,Flashy-Band,wallstreetbets,3,https://www.reddit.com/r/wallstreetbets/comments/f98o73/daily_discussion_thread_february_25_2020/fiqyav0/,"#WHY ARE MARKETS DOWN WTF

#JUST CLOSE YOUR EYES AND WALK AWAY FROM THE CORONAVIRUS"
2020-02-25,SandKey,wallstreetbets,3,https://www.reddit.com/r/wallstreetbets/comments/f9h6jj/what_are_your_moves_tomorrow_february_26_2020/fis3z56/,"You're correct.

API numbers come out every Tuesday after the bell. Gov numbers come out every Wednesday an hour after the opening bell.

Crude:     +1.33 MCushing: +0.411 MGasoline: +0.074 MDistillate: -0.706 M

Crude numbers built a very small amount which is countering what the media has been saying about demand being down due to coronavirus. A build this small is pretty good which is why you're seeing the global commodity moving up."
2020-02-25,emilio911,China_Flu,3,https://www.reddit.com/r/China_Flu/comments/f9klh1/looking_for_the_list_of_150_meds_that_will_face/fis5n8q/,I asked the question on r/coronavirus and was removed [https://www.reddit.com/r/Coronavirus/comments/f9k9p3/list\_of\_150\_medication\_that\_will\_face\_shortages/](https://www.reddit.com/r/Coronavirus/comments/f9k9p3/list_of_150_medication_that_will_face_shortages/)
2020-02-25,dylanstacey05,China_Flu,3,https://www.reddit.com/r/China_Flu/comments/f9kez0/americans_doubting_the_severity_of_the/fisab68/,"How does the data show the opposite? The cdc literally just released a statement saying to prepare for disruptions and community spread in America. Also there was a balloon in cases in Japan, South Korea, and Italy in the last few days, though it’s stabilized a little bit. there’s been a flurry of countries reporting there first coronavirus patients as well. Stop throwing around the word “confirmation bias”."
2020-02-25,CarlosSpcyWeenr,awfuleverything,3,https://www.reddit.com/r/awfuleverything/comments/f9l8gn/where_do_i_begin/fisay5p/,Forget the coronavirus. This is the pandemic we need to be worried about.
2020-02-25,lrngray,Coronavirus,3,https://www.reddit.com/r/Coronavirus/comments/f9l5we/covid19_beyond_containment_but_singapores_efforts/fisc4jl/,"I haven’t read the article, but I commend Singapore.  All that I have heard about their response has been what I think an intelligent group of scientifically minded people would do to stop the spread.  Kudos, Singapore.  I wish the rest of us could have done so well.  Instead Trump proposed a budget which cuts funding to the CDC a few weeks ago during the budding phases of the outbreak during which he routinely under quoted the number of cases in the US (example if it was 5 and a 6th case had been announced earlier in the day he would not mention the 6th.  Either was not being briefed or deliberately understated.  Either reason is worrisome).  About 12 days ago, Trump also talked to Xi (supreme communist leader or whatever in China) and said China will win against coronavirus on Twitter.  Why the hell was advising him?  Granted I have a doctorate, but I am no genius, and I have been predicting this shit based on science and poor containment for weeks.  Who the hell is advising our president?  I am so tired of the “it’s just like the flu.”  Or Trump saying the virus is under control just yesterday.  It is clearly not. 

I’m not suggesting we panic, but approach it like Singapore.  They even told their people when the numbers were climbing that there was a possibility (and they were not there yet) of it becoming so widespread that they would ask people well enough to stay home allowing those who needed emergent care to be at the hospital.  The beauty of truth and science.  God, I love it.

The irony here is that this virus isn’t the end of the world, but the response to it has shown some serious problems we have dealing with large problems that require working together, an interdisciplinary approach, and intelligence.  Singapore has done this, but most of the world has failed to."
2020-02-25,HowardRoark2020,The_Donald,3,https://www.reddit.com/r/The_Donald/comments/f9fvq9/the_slow_creep_of_death_of_the_donald_has_sped_up/fisc6vu/,I hope Spez gets the Coronavirus.
2020-02-25,Jahghex,wallstreetbets,3,https://www.reddit.com/r/wallstreetbets/comments/f9h6jj/what_are_your_moves_tomorrow_february_26_2020/fisba70/,"Chinese coronavirus improvements are priced in, its all about global cases now"
2020-02-25,LeftistsAreBigots,Wuhan_Flu,3,https://www.reddit.com/r/Wuhan_Flu/comments/f9n4gu/pragmatic_approach/fisocps/,"I'm not sure what makes it harder to breathe... having coronavirus, or having your head shoved all the way up the CCP's ass.  Ask the WHO."
2020-02-25,23therealme23,wallstreetbets,3,https://www.reddit.com/r/wallstreetbets/comments/f9h6jj/what_are_your_moves_tomorrow_february_26_2020/fismb5z/,"Next year Coronavirus will be normal like the flu. 

We will have the flu, cold, and some strain of C-Virus every winter. There will be a combination flu and C-Virus vaccine. 

No one will care. Everyone will just use common sense to avoid getting sick like we already do with the flu. No ones going to go to the hospital unless they have respiratory issues. It’ll be mainly treated at home like the flu. 

This is why I’m buying the dip. Thank you for overreacting market."
2020-02-25,MrE78,China_Flu,3,https://www.reddit.com/r/China_Flu/comments/f9n80v/what_do_i_tell_my_dad_to_convince_him_to_buy/fisr4te/,I showed my 83 year old father reddit and coronavirus subs yesterday and he has spent as of an hour ago 2 grand on prep items.
2020-02-25,slappingkick,Coronavirus,3,https://www.reddit.com/r/Coronavirus/comments/f9nh6i/i_have_a_feeling_that_feels_like_there_is_mucas/fisqikc/,"Fever is present in 90% of coronavirus cases. So, if you don't have fever, it's probably fine."
2020-02-25,originalmuggins,wallstreetbets,3,https://www.reddit.com/r/wallstreetbets/comments/f9hadz/bob_iger_to_step_down_as_disney_ceo/firjujr/,You guys are retarded thinking this has anything to do with coronavirus. These decisions are made weeks and sometimes months before they are announced.
2020-02-25,kusuriurikun,Qult_Headquarters,3,https://www.reddit.com/r/Qult_Headquarters/comments/f9gfcu/so_has_the_qult_called_coronavirus_a_deep_state/firk1fi/,"There's stuff all over the place (as rednail64 noted) usually going all over the conspiracy theory map:

* Alleged bioweapon by THE DEEP STAYT!!!@!1one! to Reduce The Population
* Alleged bioweapon by the Heathen Chinee to kill us all
* Alleged bioweapon by Gen-U-Wine US Patriots^(TM) to facilitate an *autogolpe* by Trump
* Alleged bioweapon to make people get shots (oh noes) to get Teh Autism or Evil Sinister Microchips or be injected full of Baby Slurry
* Alleged bioweapon (yeah, there's....a bit of a theme here) to Stop The Election of the Dolt to ~~Emperor of the Galactic Empire~~ ~~God-Emperor of Blessed Terra~~ a second term whereupon he will commit an *autogolpe* and Heads. Will. Roll

About the only thing I've not seen yet (and I'm genuinely surprised at this) is some claim that COVID-19 is in fact Divine Retribution of some sort.  (Admittedly, the fact that at least two epidemic centers have been in ""Bible-based cults""--a Moonies-esque group with a rather NAR-like group structure in the case of South Korea, an *actual* New Apostolic Reformation-linked Assemblies of God megachurch in Singapore--MIGHT have dampened down the ""divine retribution"" bit.)  

I've also seen other, not necessarily QAnonsense-related (but in fellow circles like ""prepper"" groups that have turned most of the non-scientific COVID-19 related subs into a fucking dumpster fire) forms of woo:

* Claims that salt water will protect you from the virus, especially soaking disposable masks in salt water
* Claims that industrial bleach (of the rather horrible sort that people force-feed to kids with autism to try to ""cure"" them) will cure you of the COVID-19
* Claims that various herbal preparations (everything from elderberry and black raspberry extracts to Chinese medicines which contain bitter almond seeds as an ingredient--the latter contain arsenic, of note) will cure you of the COVID-19
* Outright disease denialism--essentially claiming CoV-SARS-2 is not the cause of COVID-19, it's got to be Something Else that's causing illness
* Claims that ACE inhibitors (of the sort used for high blood pressure and coronary disease) will cure you of the COVID-19
* Claims (based on literally results in a test tube that have just STARTED to go through human trials in China) that various fun antimalarials will cure you of the COVID-19
* Claims that quinine in tonic water, or the old quinine tabs they used to sell for restless leg syndrome OTC, will cure you of the COVID-19 (I'm actually, honestly surprised we don't have a literal True Scotsman singing the praises of Irn-Bru in that regard yet)
* Claims that Asians are Uniquely Susceptible because of Reasons
* Claims that Western governments are Covering Up The True Horrors of COVID-19 and it's actually going to be a ""The Stand""/""The Road""/""I Am Legend""/""28 Days Later""-esque Civilization Ending Event^(TM) (often followed by calls to invest in gold or silver, cryptocurrency, LDS Buckets of a year of MREs, and/or guns and ammo and LOTS of them)
* Claims that COVID-19 is a lot more deadly than...it's actually been shown to be in communities outside of China (COVID-19, outside of China, has an estimated death rate of around 1-2%, which is about the same as a bad ""swine flu"" year--not *good,* but not TEOTWAWKI; the panicmongers are essentially claiming COVID-19 has equivalent death tolls to smallpox if not *Ebola* of around 30-50% fatality rate even with treatment)
* Various unproven claims about COVID-19 that insinuate it's the next Ebola Zaire (including: claims of cytokine storms (not proven with COVID-19, and in fact evidence says no), claims of ""second time you get it you'll die because of immune fail"" (only one disease causes the mechanism responsible for this in humans, and that is dengue fever), claims of similar horrible conditions to some consequences coronavirus infections in animals (which don't occur in primates, much less humans, and aren't even conclusively proven to be the result of coronavirus infections entirely), claims COVID-19 does not actually cause long-lasting immunity (which is also not proven), etc. etc. etc. etc. and often all the above at once
* Various claims to the effect vaccines are impossible because vaccination will make the disease worse (which was based on a single study of a SARS vaccine in genetic knockout mice, using a type of vaccine that was never continued for use in humans, and not noting there have been successful SARS vaccines developed that do not cause bad effects in primates)
* And yes, in the two ""Bible-based cults"" affected (the NARasitized AoG megachurch in Singapore and the Shincheonji ""Moonies Clone"" in South Korea), there's even been claims to the effect COVID-19 exists because Satan is trying to oppress THEM directly and attack them with a Literal Demon Satan Virus to Stop Their Culty Work In The World Winning Souls For Their Cult.  And it's all really Satan.  All of it."
2020-02-25,blorg,investing,3,https://www.reddit.com/r/investing/comments/f9eve1/cdc_warns_it_expects_coronavirus_to_spread_in_us/firjs01/,"And even 14 is the normal upper limit. It *can* take longer in extreme cases, but the median incubation is estimated at only 3 days.

27 is not normal, it's an extreme outlier. You have to account for these before you consider something over, but most people will get sicker much quicker than that.

https://www.worldometers.info/coronavirus/coronavirus-incubation-period/"
2020-02-25,xayma,financialindependence,3,https://www.reddit.com/r/financialindependence/comments/f971aw/daily_fi_discussion_thread_february_25_2020/firhjpm/,"Maybe, but not due to coronavirus itself. Just a global correction given how long the US and a few other countries are growing.

In some ways the earlier it happens the less bad it will be for some (for people cost averaging it'll be pretty much the same just with less psychological shock)."
2020-02-25,Gotmykingz88,China_Flu,3,https://www.reddit.com/r/China_Flu/comments/f9dywd/us_cdc_we_can_have_community_spread_in_the_united/fir07v1/,I'm still considered a nutcase according to alot of people. You're supposed to shut the fuck up and wait for the authorities to handle this if you ask 99.9% of r/Coronavirus
