date,author,subreddit,score,url,text
2020-02-25,Taellion,Coronavirus,2,https://www.reddit.com/r/Coronavirus/comments/f9mnd7/how_deadly_is_the_coronavirus/fislziw/,"he virulence (R0) of SARS-CoV-2 is estimated between 1.4-6.49, with a mean estimate of 3.28[[1](https://www.medicalnewstoday.com/articles/coronavirus-may-spread-faster-than-who-estimate#Higher-estimates-than-WHO-predict)] . This mean estimate is much higher than the seasonal flu, which has an R0 of 1.3[[2](https://www.theatlantic.com/science/archive/2020/01/how-fast-and-far-will-new-coronavirus-spread/605632/)] . What this means is that SARS-CoV-2 spreads signficantly faster than the seasonal flu. 

 1. The Case Fatality Rate (CFR) of SARS-CoV-2 is at least 2-3%[[3](https://academic.oup.com/ajcp/advance-article/doi/10.1093/ajcp/aqaa029/5735509)] . This is 20-30 times higher than the CFR of the season flu, which is around .1%[[4](https://www.cnbc.com/2020/02/03/the-flu-has-already-killed-10000-across-us-as-world-frets-over-coronavirus.html)] . 

 2. SARS-CoV-2 can be transmitted without the infected showing any symptoms[[5](https://jamanetwork.com/journals/jama/fullarticle/2762028)] . This makes it much more difficult to control. 

 3. Roughly 20% of SARS-CoV-2 infections result in serious symptoms that require medical intervention[[6](https://www.medicalnewstoday.com/articles/coronavirus-81-of-cases-are-mild-study-says#80.9%-of-the-cases-are-mild)] . This is more than 10 times the hospitalization rate of the seasonal flu[[7](https://www.cdc.gov/flu/about/burden/index.html)].

 4. Symptoms from SARS-CoV-2 can persist over a month[[8](https://www.thelancet.com/pb-assets/Lancet/pdfs/S2213260020300795.pdf)] compared to the seasonal flu where symptoms typically tend to clear after 5 days[[9](https://www.emedicinehealth.com/flu_in_adults/article_em.htm)] .

 5. There is no vaccine for SARS-CoV-2[[10](https://www.cdc.gov/coronavirus/2019-ncov/about/prevention-treatment.html)] whereas people regularly get annual flu shots. 

 6. There is no [herd immunity](https://www.ovg.ox.ac.uk/news/herd-immunity-how-does-it-work) for SARS-CoV-2 which means that it can theoretically infect the entire population. See, for example, a [Korean psychiatric department where the virus infected 99/102 people](https://twitter.com/covid_19news/status/1231581727438467072?s=21). 

Now, consider the multiplicative effect that all of these attributes have for the virus. Compared to the seasonal flu, SARS-CoV-2 (1) spreads faster; (2) kills far more; (3) is harder to control; (4) requires use of far more medical resources; (5) for far longer a period of time; (6) has no effective treatment; and (7) can infect entire populations. 

These factors mean that SARS-CoV-2, if left unchecked, is far more likely to overwhelm a country's medical infrastructure. Additionally, when medical infrastructure is overwhelmed, the CFR will skyrocket because we know that 20% of cases require medical intervention. 

This virus is potentially devastating if containment measures fail. Far worse than the seasonal flu.

Credits to user Hafomeng"
2020-02-25,Argark,HistoryMemes,2,https://www.reddit.com/r/HistoryMemes/comments/f9jgwb/who_else_agrees_humans_need_to_be_nerfed/fismp4f/,Login queues are getting longer due to coronavirus
2020-02-25,TheParchedOne,China_Flu,2,https://www.reddit.com/r/China_Flu/comments/f9mfhk/san_francisco_declares_state_of_emergency_over/fism44n/,"San Diego did this 2 weeks ago...
https://www.kpbs.org/news/2020/feb/20/san-diego-county-extends-coronavirus-emergency/"
2020-02-25,mesj361,Coronavirus,2,https://www.reddit.com/r/Coronavirus/comments/f9az8y/daily_discussion_post_20200225_questions_images/fiskebt/,"US Army soldier tested positive for coronavirus in South Korea, marking the first time a US service member is confirmed to have the disease

https://www.cnbc.com/2020/02/26/coronavirus-latest-updates-asia-stocks.html"
2020-02-25,doucettejr,China_Flu,2,https://www.reddit.com/r/China_Flu/comments/f9kez0/americans_doubting_the_severity_of_the/fisledc/,"Here is the link to their main page where it shows how many they have tested. 

https://www.cdc.gov/coronavirus/2019-ncov/cases-in-us.html"
2020-02-25,Ivotedforher,stlouisblues,2,https://www.reddit.com/r/stlouisblues/comments/f997r5/gdt_game_64_blackhawks_blues_25feb_1900/fismfs5/,It hasn't given me coronavirus yet and is rather comfy. They even added personalization and that has survived the washer
2020-02-25,CakesofCoffee,The_Donald,2,https://www.reddit.com/r/The_Donald/comments/f9fvq9/the_slow_creep_of_death_of_the_donald_has_sped_up/fis7hnl/,Spez can go suck a coronavirus infected dick from one of his Communist Chinese cockroach overlords
2020-02-25,TBoy25,tennis,2,https://www.reddit.com/r/tennis/comments/f9246x/rtennis_discussion_tuesday_february_25th_2020/fis7liw/,The Davis Cup tie between Japan and Ecuador will be played behind closed doors because of the coronavirus.
2020-02-25,EpsteinKilledHisself,neoliberal,2,https://www.reddit.com/r/neoliberal/comments/f9krck/the_thunderdome_returns/fisa3vr/,Moderators to Bernie Sanders: what is your plan for surviving the coronavirus and wouldn't it be ironic if a communist chinese lab created virus took down the most successful communist politician in American history right before he seized power?
2020-02-25,planetdaily420,Coronavirus,2,https://www.reddit.com/r/Coronavirus/comments/f9h79d/new_dow_closes_down_878_points_31_amid_concern/firli68/,Literally  no one listened to me about the coronavirus UNTIL this happened. SMDH.
2020-02-25,GladiusVCreed,PlagueIncHeadlines,2,https://www.reddit.com/r/PlagueIncHeadlines/comments/f9g7in/kuwait_suspends_all_flights_with_singapore_japan/firj2qj/,"Earlier northern Italy was in the midst of a shutdown after a suspected outbreak too, I heard. Plus, a Chinese man beat the snot out of a woman who threatened that she had coronavirus and then coughed at him. 


Weird times."
2020-02-25,DNAhelicase,Coronavirus,2,https://www.reddit.com/r/Coronavirus/comments/f9hfva/a_template_that_can_be_used_to_send_messages_to/firk87v/,"* Your post may be more appropriate as a comment of the Daily Discussion Thread on the front page.



If you believe we made a mistake, please let us know.
Thank you for your cooperation and for making /r/Coronavirus reliable! :)"
2020-02-25,Mentioned_Videos,Coronavirus,2,https://www.reddit.com/r/Coronavirus/comments/f9avja/usa_currently_lacking_diagnostic_capabilities_can/firkdfy/,"Other videos in this thread:

[Watch Playlist &#9654;](http://subtletv.com/_rf9avja?feature=playlist&nline=1)

VIDEO|COMMENT
-|-
[The Nimitz Encounters](http://www.youtube.com/watch?v=PRgoisHRmUE)|[+3](https://www.reddit.com/r/Coronavirus/comments/f9avja/_/fiqi5g1?context=10#fiqi5g1) - Being the police force of the world isn’t cheap. And we’ve got the Navy seeing UFOs off the coast of both California (Tic Tac Nimitz Encounter 2004) and the East Coast too  (Gimbal and Go Fast videos 2016)
\[NSFW\] [Saliva - They Don't Care About Us (Michael Jackson Cover)](http://www.youtube.com/watch?v=ewlEUhrwRjM)|[+1](https://www.reddit.com/r/Coronavirus/comments/f9avja/_/firi7dx?context=10#firi7dx) - Michael Jackson said it best. They don’t really care about us
[Get Your Shit Together, Summer -  Rick and Morty](http://www.youtube.com/watch?v=-tGL-buZ94Y)|[+1](https://www.reddit.com/r/Coronavirus/comments/f9avja/_/fir1txe?context=10#fir1txe) - A lesson to the USA from Morty
I'm a bot working hard to help Redditors find related videos to watch. I'll keep this updated as long as I can.
***
[Play All](http://subtletv.com/_rf9avja?feature=playlist&ftrlnk=1) | [Info](https://np.reddit.com/r/SubtleTV/wiki/mentioned_videos) | Get me on [Chrome](https://chrome.google.com/webstore/detail/mentioned-videos-for-redd/fiimkmdalmgffhibfdjnhljpnigcmohf) / [Firefox](https://addons.mozilla.org/en-US/firefox/addon/mentioned-videos-for-reddit)"
2020-02-25,SplurgyA,China_Flu,2,https://www.reddit.com/r/China_Flu/comments/f9e8v3/us_cdc_were_asking_folks_in_every_sector_as_well/firl5kn/,There was a classified briefing about Coronavirus today in the Senate
2020-02-25,VolumetricSigner,northernireland,2,https://www.reddit.com/r/northernireland/comments/f9am1p/coronavirus_children_and_teachers_sent_home_from/firlg92/,"The incubation period of the virus is thought to be 14-21 days so in all likelihood the symptoms they're showing now aren't Coronavirus.  All the same the parents shouldn't be near work.  


In general attitudes of people and employers will have to change dramatically to keep this at bay."
2020-02-25,neoshnik,Coronavirus,2,https://www.reddit.com/r/Coronavirus/comments/f9hc9u/where_can_i_find_updates_for_us_states_that_have/firk5i5/,"Here in the US, the main strategy for fighting the virus is not to test for it. We've only tested 426 people in over a month.  
 [https://www.cdc.gov/coronavirus/2019-ncov/cases-in-us.html](https://www.cdc.gov/coronavirus/2019-ncov/cases-in-us.html)"
2020-02-25,CactusPearl21,Coronavirus,2,https://www.reddit.com/r/Coronavirus/comments/f9eir2/americans_should_prepare_for_significant/firiwv2/,"What a loser to think ""America"" needs you to stand up for it against criticism.

I bet you believe the WH advisor when he says:

> “We have contained this, I won’t say airtight, but pretty close to airtight,” 

And you think that

> 20 cases out of 330 million people

means something because you are ignorant of how life actually works. 

Meanwhile the actual experts have opinions. For once in your life listen to them. Okay no, if you only listen once, let it be regarding climate change. If you listen twice, you know what just fucking listen

> There have been fewer than 20 coronavirus cases diagnosed in the U.S., though the Centers for Disease Control and Prevention has said it **expects the pathogen to eventually spread locally.**"
2020-02-25,breakintheclouds,CoronavirusUS,2,https://www.reddit.com/r/CoronavirusUS/comments/f9mwal/coronavirus_during_democratic_debate/fisnpqz/,"But they're still talking about it outside of the debate (attended by donors).

Warren, for example, [rips Trump for ‘bungling’ coronavirus outbreak](https://www.politico.com/news/2020/02/25/coronavirus-elizabeth-warren-trump-117452)"
2020-02-25,WaitWhatOhNevermind,Coronavirus,2,https://www.reddit.com/r/Coronavirus/comments/f9n79r/why_some_sarscov2_infections_are_worse_than_others/fisq3v8/,"This title is very misleading

>Scientists are working to understand why some people suffer more from the virus than others. It is also unclear why the new coronavirus—like its cousins SARS and MERS—appears to be more deadly than other coronaviruses that regularly circulate among people each winter and typically cause cold symptoms

They’re working to understand. They don’t know why."
2020-02-25,zuzumotai,JETProgramme,2,https://www.reddit.com/r/JETProgramme/comments/f9mwyq/covid19_school_schedule_alternation_cancellation/fisov04/,"Gunma here. Absolutely no talk about it or schedule changes. People are still more concerned about the flu than the coronavirus. (Edit: as am I, honestly. There's a higher chance right now of catching the flu from someone than COVID-19 and neither would kill a young healthy person) ""What strain did you get? A or B? Ohhhh..."" Of course, we also don't have any cases here, so that's probably why."
2020-02-25,barber5,Coronavirus,2,https://www.reddit.com/r/Coronavirus/comments/f9mx6h/friend_going_to_europe_soon/fisnisn/,"* Your post may be more appropriate as a comment of the Daily Discussion Thread on the front page.
 



If you believe we made a mistake, please let us know.
Thank you for your cooperation and for making /r/Coronavirus reliable! :)"
2020-02-25,ZizDidNothingWrong,ChapoTrapHouse,2,https://www.reddit.com/r/ChapoTrapHouse/comments/f9529d/crying_about_a_poll_from_a_c_pollster_thread/firncx6/,Comrade coronavirus
2020-02-25,telemaxine,runningman,2,https://www.reddit.com/r/runningman/comments/f993xu/yoo_jae_suk_and_kim_jong_kook_each_donate_100/firmq0m/,"There was a super-spreader event in Daegu a couple of weeks ago. A woman who refused to be tested went to several church events with hundreds of people in attendance. This caused the virus to spread rapidly.

The woman refused to be tested initially because she said that she wasn't in China/Wuhan recently so there could be *no way* for her to have the coronavirus."
2020-02-25,upvotemeok,teslainvestorsclub,2,https://www.reddit.com/r/teslainvestorsclub/comments/f9732r/tsla_daily_investor_discussion_february_25_2020/firn8os/,Disney ceo quits? Coronavirus. Tesla raises 2 bil? Coronavirus. Seems coronavirus is the cause of everything.
2020-02-25,contec,China_Flu,2,https://www.reddit.com/r/China_Flu/comments/f9hksv/one_of_the_new_confirmed_cases_in_germany_is_in/firnq3j/,"Yes, according to this article.

https://www.wz.de/nrw/erster-coronavirus-fall-in-nrw-person-aus-erkelenz-in-uniklinik-duesseldorf_aid-49191687"
2020-02-25,SDResistor,China_Flu,2,https://www.reddit.com/r/China_Flu/comments/f9hx5o/are_futurama_style_suicide_booths_not_far_off/firn19n/,The coronavirus booths next to UK hospitals pretty much look like it
2020-02-25,akayd,Chinesetourists,2,https://www.reddit.com/r/Chinesetourists/comments/f96xjo/俄羅斯背後向中共捅刀子官方宣布virus出自人工實驗室並向聯合國un和世界衛生組織who通報這與kf/firnjd2/,""" Russia government backstabbing the CPP, announcing the coronavirus was originated from a biolab. They also reported that information to UN and WHO...."""
2020-02-25,420-raze-it,China_Flu,2,https://www.reddit.com/r/China_Flu/comments/f9e8v3/us_cdc_were_asking_folks_in_every_sector_as_well/firo1ks/,"I actually just looked at the local news station he referenced and they have this up: 
https://www.wfaa.com/mobile/article/news/health/coronavirus/cdc-warns-spread-of-coronavirus-in-us-appears-inevitable/287-389efaa8-8505-46db-8b1c-552ba773a597

Prepare for possible ""disruption of every day life"" lmao. I'm going to give him a hard time about this"
2020-02-25,Mcbuffalopants,WomensHealth,2,https://www.reddit.com/r/WomensHealth/comments/f9h1vy/susceptibility_of_pregnant_women_to_covid19/firo7o6/,"It’s too soon to know. That’s the problem with new diseases. 

https://www.cdc.gov/coronavirus/2019-ncov/specific-groups/pregnant-women.html

https://www.thelancet.com/journals/lancet/article/PIIS0140-6736(20)30365-2/fulltext"
2020-02-25,T4nkcommander,Lyme,2,https://www.reddit.com/r/Lyme/comments/f9ddvm/had_to_hide_my_amusement_today_at_work/firoea3/,"When I told my coworker I wasn't worried about coronavirus as I couldn't get much worse, he said ""well, you might not be able to walk without a cane, so that would definitely be worse"".

Which might have been funny if I haven't been thinking about buying a cane the last two weeks. Breaking long-established biofilms is *rough*"
2020-02-25,Kujo17,cvnews,2,https://www.reddit.com/r/cvnews/comments/f9hrw0/clinical_characteristics_of_50404_patients_with/firm53v/,"*this has not yet been peer reviewed*

#Abstract

##Objective:
 To provide reliable evidence of evidence-based medicine for the treatment and prevention of the 2019 novel coronavirus(2019-nCoV) by analyzing all the published studies on the clinical characteristics of patients with 2019-nCoV. 

##Methods
: PubMed,Cochrane Library,Embase and other databases were searched. Some studies on the clinical characteristics of 2019-nCoV infection were collected for Meta-analysis .

##Results: 
9 studies were included in Meta-analysis, including a total of 50404 patients with 2019-nCoV infection.

According to Meta-analysis, among the clinical characteristics of patients with 2019-nCoV infection, the incidence of fever is 90.9% , the incidence of cough is 70.8%, and the incidence of muscle soreness or fatigue is 41%. 

#***The incidence of acute respiratory distress syndrome (ARDS) was 14.8%, the incidence of abnormal chest CT was 95.6%, the proportion of severe cases in all infected cases was 21.3%, and the mortality rate of patients with 2019-nCoV infection was 4.8%***

## Conclusion:
 Fever and cough are the most common symptoms in patients with 2019-nCoV infection, and most of them have abnormal chest CT examination.

Some people have muscle soreness or fatigue, ARDS. 

Diarrhea, hemoptysis, headache, sore throat, shock and other symptoms only occur in a small number of patients.

*The mortality rate of patients with 2019-nCoV infection was lower than that of Severe Acute Respiratory Syndrome (SRAS) and Middle East Respiratory Syndrome (MERS)*"
2020-02-25,I_H_T,neoliberal,2,https://www.reddit.com/r/neoliberal/comments/f96cl9/discussion_thread/firmvdk/,Linear graphs of coronavirus infections are panic charts. Look at logarithmic graphs instead so you can see the rate of change.
2020-02-25,october21769644,Coronavirus,2,https://www.reddit.com/r/Coronavirus/comments/f9mxwn/for_those_of_you_who_didnt_catch_his_press/fisqqlu/,https://www.cbc.ca/news/health/coronavirus-china-who-bruce-aylward-1.5459615
2020-02-25,captainmanlyhands,Coronavirus,2,https://www.reddit.com/r/Coronavirus/comments/f9hb3g/are_social_media_companies_to_blame_for_delayed/firkiri/,WHO are the ones directing social media in coronavirus matters
2020-02-25,pozzowon,wallstreetbets,2,https://www.reddit.com/r/wallstreetbets/comments/f9ij72/buy_nokia_and_ericsson/firr9c4/,After the Coronavirus dip
2020-02-25,Nico_E,China_Flu,2,https://www.reddit.com/r/China_Flu/comments/f9ii54/btw_everyone_should_go_to_the_bno_news_website/firrf1m/,Yes... it is here:  [https://bnonews.com/index.php/2020/02/the-latest-coronavirus-cases/](https://bnonews.com/index.php/2020/02/the-latest-coronavirus-cases/)
2020-02-25,forerunner398,neoliberal,2,https://www.reddit.com/r/neoliberal/comments/f96cl9/discussion_thread/firratb/,"Sure, I like Pete but disagree with his take on this. 

Also, unfriendliness to immigration in Denmark has literally 0 to do with Coronavirus."
2020-02-25,joey_bosas_ankles,COVID19,2,https://www.reddit.com/r/COVID19/comments/f9dbeq/covid19_what_do_we_have_to_fear_from_a_pandemic/firrfhu/,"(Not a medical doctor, but did bio-med and med cowriting during post-grad with some colleagues.)

Current status of testing is:

[Sensitivity of Chest CT for COVID-19: Comparison to RT-PCR](https://pubs.rsna.org/doi/10.1148/radiol.2020200432)

>Discussion

>In our series, the sensitivity of chest CT was greater than that of RT-PCR (98% vs 71%, respectively, p<.001). The reasons for the low efficiency of viral nucleic acid detection may include: 1) immature development of nucleic acid detection technology; 2) variation in detection rate from different manufacturers; 3) low patient viral load; or 4) improper clinical sampling. The reasons for the relatively lower RT-PCR detection rate in our sample compared to a prior report are unknown (3). *Our results support the use of chest CT for screening for COVD-19 for patients with clinical and epidemiologic features compatible with COVID-19 infection particularly when RT-PCR testing is negative.*

(My note: concurrent radiograph findings are important.  Other cases indicate CT signs exist prior to apparent density changes on typical radiographs.)

That's not to say RT-PCR isn't necessary, because radiological findings, alone, are not complete differentials (from legionella pneumonia, for example.)  Visible changes, when present, on CT tend to appear at the disease mid-point, in all serious cases, as far as I'm aware.

There are a couple of other alternatives:  the CDC is working on a [Serology Test for COVID-19.](https://www.cdc.gov/coronavirus/2019-ncov/about/testing.html)  Specific details about the CDC RT-PCR kit are on that page, incidentally.

>The serology test will look for the presence of antibodies, which are specific proteins made in response to infections.  Antibodies can be found in the blood and in other tissues of those who are tested after infection.  The antibodies detected by this test indicate that a person had an immune response to SARS-CoV-2, whether symptoms developed from infection or the infection was asymptomatic.  **Antibody test results are important in detecting infections with few or no symptoms.**

The gold standard for viral diagnostic confirmation is viral isolation (because it guarantees live virus, which RT-PCR does not:)  the CDC has grown SARS-CoV2 in cell culture.  There are higher confidences when the sample for viral isolation is from an implicated lung area.  Sampling can be performed by bronchoscopy."
2020-02-25,MordecaiMaxwell,GamersRiseUp,2,https://www.reddit.com/r/GamersRiseUp/comments/f9g2fy/not_cool/firsh62/,Plot twist: the man was infected with coronavirus
2020-02-25,Winnie_The_Fluu,tucker_carlson,2,https://www.reddit.com/r/tucker_carlson/comments/f9ko8w/live_thread_tucker_carlson_tonight_tuesday/fisbx4m/,Wait till antifa starts spitting at people after they contract Coronavirus
2020-02-25,Ima_Newbie,China_Flu,2,https://www.reddit.com/r/China_Flu/comments/f9k7d2/doctor_says_its_just_the_flu/fiscwle/,">Coronavirus is just a type of flu they were not expecting this year

Flu is caused by the influenza virus (of which there are multiple strains.)  
nCov is a coronavirus (multiple strains exist, and this one is brand new)   
Coronavirus is NOT flu virus. Symptoms overlap, but not the same virus. 

Your doc is either lying or incompetent. Yikes!"
2020-02-25,FuriousMarine,PandemicPreps,2,https://www.reddit.com/r/PandemicPreps/comments/f9frdo/as_we_are_bound_to_have_a_flood_of_new_people/fisb77c/,"r/CoronavirusUncensored 

They are totally nerding out at r/Coronavirus, demanding all posts have sources to cite. They don't want news articles, just epidemiology studies. To make it worse they don't offer any explanation just technical jargon that only doctors will understand. Nothing useful there."
2020-02-25,bigiain,sydney,2,https://www.reddit.com/r/sydney/comments/f9bksa/sydney_daily_random_discussion_february_26_2020/fisbhjd/,"How about this announcement: ""We have declared a state of emergency in San Francisco due to the <checks notes> \*ZERO\* cases of Coronavirus reported here!""

[https://www.businessinsider.com.au/san-francisco-state-of-emergency-coronavirus-covid19-outbreak-2020-2?r=US&IR=T#the-citys-tech-conference-scene-has-also-taken-a-hit-1](https://www.businessinsider.com.au/san-francisco-state-of-emergency-coronavirus-covid19-outbreak-2020-2?r=US&IR=T#the-citys-tech-conference-scene-has-also-taken-a-hit-1)"
2020-02-25,NomadicDolphin,Coronavirus,2,https://www.reddit.com/r/Coronavirus/comments/f9l3sm/sen_mitt_romney_trump_administration/fiscrjf/,"I hope this huge oversight can be used to get the dumbass out of office in November. If coronavirus truly does break out badly in the US, trump will be partially to blame for lack of preparedness"
2020-02-25,vmar27,wallstreetbets,2,https://www.reddit.com/r/wallstreetbets/comments/f9h6jj/what_are_your_moves_tomorrow_february_26_2020/fiscwdp/,"“There are no positive cases of the novel coronavirus disease in Michigan”

You forgot that part"
2020-02-25,verguenzanonima,Coronavirus,2,https://www.reddit.com/r/Coronavirus/comments/f9i7pm/24m_confirmed_case_in_madrid_spain/firowzv/,">The Community of Madrid has certified the first case of coronavirus in the capital. This is a 24-year-old patient who was traveling in Italy. The sanitary equipment went to his home to take samples and has left positive.  
>  
>They are in good condition and has been transferred to Carlos III Hospital.  
>  
>Throughout this Tuesday there are already four confirmed cases in Spain: the woman of the Italian doctor who tested positive in Tenerife, one patient in Barcelona and another in Castellón.  
>  
>During this Tuesday, in addition, the Community of Madrid had carried out analysis at least three other people, who nevertheless gave negative throughout the afternoon.  
>  
>This is the first case registered in the Community, and this Tuesday was the day on which the virus has jumped to the Peninsula, since the two cases that were known weeks ago (and already discharged) occurred in the Canary Islands and the Balearic Islands"
2020-02-25,Chicago31,ChapoTrapHouse,2,https://www.reddit.com/r/ChapoTrapHouse/comments/f9529d/crying_about_a_poll_from_a_c_pollster_thread/firoujc/,"The lethality  of the flu is .1% compared to 2% of coronavirus, shut the fuck up."
2020-02-25,fartybucketface,metacanada,2,https://www.reddit.com/r/metacanada/comments/f9h45e/anyone_else_nervous/firpg2r/,"It will take you 2-3 months to get your pal, and then another month after that before you can use it. 

I’m not saying don’t do it, but it’s unlikely you’d have it before Coronavirus."
2020-02-25,5thtimeisacharm,Wuhan_Flu,2,https://www.reddit.com/r/Wuhan_Flu/comments/f9fud7/diary_from_milan_day_3_after_covid19_outbreak/firqco7/,I totally understand. When I was living there (Roma) Chinese are usually the rudest people. Italians cater to them because of money. That is the only reason. In Venice it was almost impossible to enjoy the city because of them. There are cases of Chinese knowingly leaving China with the coronavirus so they didn’t get quarantined. It’s so dangerous and irresponsible. Please take care of yourself and your family.
2020-02-25,EScforlyfe,neoliberal,2,https://www.reddit.com/r/neoliberal/comments/f96cl9/discussion_thread/firq0sg/,When do you reckon this whole coronavirus thing will have blown over?
2020-02-25,IcyMoraine,skeptic,2,https://www.reddit.com/r/skeptic/comments/f9exoy/rush_limbaugh_coronavirus_a_common_cold_being/firqj0p/,Wouldn't it be ironic if he died from the coronavirus because he was part of the at-risk-population due to his lung cancer?
