date,author,subreddit,score,url,text
2020-02-25,NotBloodyLikely,climbing,23,https://www.reddit.com/r/climbing/comments/f9j8ik/tokyo_2020_olympics_might_be_cancelled_due_to/fis01v3/,The gods sent down coronavirus to spare us the plague of the combined format including speed
2020-02-25,ScaryChange,Coronavirus,21,https://www.reddit.com/r/Coronavirus/comments/f9iagz/iran_may_have_many_more_coronavirus_cases_than/firpdrc/,Has Canadian research done any research on how many potential coronavirus cases Canada might have walking around unchecked in its own population?
2020-02-25,johntwit,Coronavirus,21,https://www.reddit.com/r/Coronavirus/comments/f9j31o/world_isnt_ready_for_coronavirus_outbreak_says/firvtl8/,"""World Isn't Ready For Coronavirus Information, says WHO, Facebook, Google and Twitter"""
2020-02-25,its_a_trapcard,neoliberal,20,https://www.reddit.com/r/neoliberal/comments/f9krck/the_thunderdome_returns/fisdukk/,">We'll talk about [coronavirus] in the next segment

Spoiler alert: Everyone is against"
2020-02-25,CNegan,ChapoTrapHouse,17,https://www.reddit.com/r/ChapoTrapHouse/comments/f9529d/crying_about_a_poll_from_a_c_pollster_thread/firz63b/,Trump wants to fund the coronavirus response by taking money from low-income heating assistance funding. This is who Never Bernie people are fine with keeping in office.
2020-02-25,Gankingroceries,The_Donald,17,https://www.reddit.com/r/The_Donald/comments/f9kqm9/watch_party_dem_debate_disaster_south_carolina/fisff2l/,"Coronavirus becomes self aware, finds guns, shoots us all"
2020-02-25,malganis12,neoliberal,16,https://www.reddit.com/r/neoliberal/comments/f96cl9/discussion_thread/firrme7/,Take advantage of Coronavirus chaos and destroy Iran's nuclear facilities.
2020-02-25,suckmyslab,The_Donald,16,https://www.reddit.com/r/The_Donald/comments/f9kqm9/watch_party_dem_debate_disaster_south_carolina/fisfsi1/,BERNIE'S GONNA TAX THE CORONAVIRUS
2020-02-25,dontletmepost,wallstreetbets,16,https://www.reddit.com/r/wallstreetbets/comments/f9h6jj/what_are_your_moves_tomorrow_february_26_2020/firu20t/,"CDC backing off of comments on coronavirus being inevitable.

Strangely their updated statement was written in sharpie."
2020-02-25,LtPatterson,The_Donald,16,https://www.reddit.com/r/The_Donald/comments/f9kqm9/watch_party_dem_debate_disaster_south_carolina/fisdty5/,"Wow. Blame Trump for coronavirus. Nice one.

Get fucked."
2020-02-25,raconteuring,wallstreetbets,15,https://www.reddit.com/r/wallstreetbets/comments/f9h6jj/what_are_your_moves_tomorrow_february_26_2020/firmyrh/,"""San Francisco declares state of emergency to help prepare for an outbreak of coronavirus; there are currently no confirmed cases in the city - SF Chronicle""

Holy shit"
2020-02-25,Lothire,wallstreetbets,15,https://www.reddit.com/r/wallstreetbets/comments/f9h6jj/what_are_your_moves_tomorrow_february_26_2020/fislxvg/,"- Disney gets nearly 80% of its revenue from markets that are at the TOTAL AND COMPLETE MERCY of Coronavirus. 

- CEO peaces out

- Virus spreading in Murica now

- All theaters and parks closed in China, about to close elsewhere

Ya, I'd say the next safe bet would be $DIS puts."
2020-02-25,financefolks,wallstreetbets,15,https://www.reddit.com/r/wallstreetbets/comments/f9h6jj/what_are_your_moves_tomorrow_february_26_2020/fis8cwi/,"Well...my girlfriends coworker went to China, was in quarantine, and now has a cough and is sick.  This asshole will be how I get Coronavirus"
2020-02-25,Bud_Grant,nfl,15,https://www.reddit.com/r/nfl/comments/f9dao9/talko_tuesday/firc3mb/,"News going around about an IOC committee member saying there's a chance the Tokyo Olympics could be canceled due to coronavirus, but I'm not paying attention because the guy's name is Dick Pound and that may be one of the best names I've ever seen"
2020-02-25,mythrowawaybabies,Coronavirus,15,https://www.reddit.com/r/Coronavirus/comments/f9kren/south_korea_reports_169_new_cases_of_coronavirus/fis6ayn/,"South Korea has now surpassed 1,000 confirmed cases

UPDATE: South Korea says 16,734 people are currently being tested for coronavirus, up from 13,880 last night. Many of them are being tested as a precaution."
2020-02-25,RhysPeanutButterCups,Enough_Sanders_Spam,14,https://www.reddit.com/r/Enough_Sanders_Spam/comments/f99xgf/tenth_democratic_debate_megathread/fisfq8q/,"If Bernie fucking says something about billionaires being the key to stopping coronavirus, I'm going to scream."
2020-02-25,Schutzwall,neoliberal,14,https://www.reddit.com/r/neoliberal/comments/f96cl9/discussion_thread/firyl1o/,"FIRST CORONAVIRUS CASE IN BRAZIL CONFIRMED

RUN TO THE HILLS

!PING SOUAM"
2020-02-25,marinesol,neoliberal,13,https://www.reddit.com/r/neoliberal/comments/f96cl9/discussion_thread/fis1e39/,"Broke: Coronavirus was created by eating wild animal meat.

Woke: Coronavirus was created by the  Chinese government's corruption.

Baroque: Coronavirus was created by the US to destroy China.

Bespoke: Coronavirus was created by Bernie to destroy old people so he'll win the nomination."
2020-02-25,blandge,China_Flu,13,https://www.reddit.com/r/China_Flu/comments/f9jpc2/has_your_worldview_changed_as_a_result_of_this/firzie0/,I was a 7 Day Adventist and now I'm gay. The Coronavirus has changed my life.
2020-02-25,jimmyscrackncorn,The_Donald,13,https://www.reddit.com/r/The_Donald/comments/f9kqm9/watch_party_dem_debate_disaster_south_carolina/fisfrib/,"CoronaVirus = ZikaVirus = Ebola = Swine Flu = Bird Flu = Mad Cow Disease 

Oh, we still doing this?"
2020-02-25,coolrunnings190,wallstreetbets,13,https://www.reddit.com/r/wallstreetbets/comments/f98o73/daily_discussion_thread_february_25_2020/fir0pbp/,Buy everything! [They found the cure to the beer flu ](https://www.alaraby.co.uk/english/news/2020/2/25/applying-essential-oil-to-anus-cures-coronavirus-iranian-cleric)
2020-02-25,VirTW,The_Donald,13,https://www.reddit.com/r/The_Donald/comments/f9kqm9/watch_party_dem_debate_disaster_south_carolina/fisfent/,dems who want to let everyone into the US are going to tell us how to stop the coronavirus
2020-02-25,Orangemanbad90,The_Donald,13,https://www.reddit.com/r/The_Donald/comments/f9kqm9/watch_party_dem_debate_disaster_south_carolina/fisf1e9/,"A warning to all my pedes: potus’ main opposition until the election is not the democrats but coronavirus. 

The markets are falling because of it and the chinese cant be trusted to tell the truth. Potus must tread carefully because the dems, media, and others who hate him are ready to pile on him if coronavirus and its effects on the economy get worse."
2020-02-25,treasonousGOP,ChapoTrapHouse,13,https://www.reddit.com/r/ChapoTrapHouse/comments/f9kdru/epstein_aint_going_away_general_megathread_25/fisfk85/,STAY SCARED OF CORONAVIRUS SO WE CAN JUSTIFY RACIST XENOPHOBIC POLICY AND INCREASED MILITARY SPENDING
2020-02-25,adamtraskk,neoliberal,13,https://www.reddit.com/r/neoliberal/comments/f9krck/the_thunderdome_returns/fisfwdz/,The cure for coronavirus is Biden sniffing the back of your head
2020-02-25,xbettel,ChapoTrapHouse,12,https://www.reddit.com/r/ChapoTrapHouse/comments/f9529d/crying_about_a_poll_from_a_c_pollster_thread/firb2zg/,"If I am Bernie tonight, I would:

- Just mention Obama when answering any question about Cuba and baiting the other candidates to bash Obama

- Scaremongering about the Coronavirus when he talks about healthcare

- Respond every attack with ""The democratic establishment is desperate to stop us"""
2020-02-25,burninTsherman,wallstreetbets,12,https://www.reddit.com/r/wallstreetbets/comments/f98o73/daily_discussion_thread_february_25_2020/firch4n/,CDC says coronavirus is inevitably coming to the US.  Trump throws the whole fucking administration on TV to say it's contained. Markets aren't buying it.
2020-02-25,ominousferret,wallstreetbets,12,https://www.reddit.com/r/wallstreetbets/comments/f98o73/daily_discussion_thread_february_25_2020/firdv5r/,"Lawl ""Please change the name from China Coronavirus to just Coronavirus, we don't want to cause xenophobia.""

Proper response: ""Don't fucking eat bats and this shit wouldn't happen. Anyone else eating them?  Nope, just you."""
2020-02-25,daswoot,wallstreetbets,12,https://www.reddit.com/r/wallstreetbets/comments/f98o73/daily_discussion_thread_february_25_2020/firfjgd/,Daily reminder that coronavirus is a bioweapon that China accidentally dropped on themselves
2020-02-25,DadGoneGamer,wallstreetbets,12,https://www.reddit.com/r/wallstreetbets/comments/f9h6jj/what_are_your_moves_tomorrow_february_26_2020/fise5wl/,"The drop off in infection numbers in China isn’t a result of the virus subsiding, it’s the result of economic activity in the affected provinces and the broader country screeching to a halt. Coronavirus can’t spread if people aren’t coming into contact with each other in public places."
2020-02-25,spyaintnobitch,wallstreetbets,12,https://www.reddit.com/r/wallstreetbets/comments/f9h6jj/what_are_your_moves_tomorrow_february_26_2020/fisluhj/,Wtf is the point of futures anyway. We're just gonna sell off tomorrow while weak handed fks bitch about coronavirus
2020-02-25,lgoldfein21,neoliberal,12,https://www.reddit.com/r/neoliberal/comments/f9krck/the_thunderdome_returns/fisdx0u/,Klob: Throw staplers at the coronavirus
2020-02-25,JackDT,Coronavirus,12,https://www.reddit.com/r/Coronavirus/comments/f9ivxu/white_house_says_trumps_vaccine_claims_about/firtz24/,"> With coronavirus, the death rate is currently closer to “1 or 2 percent,” Trump said.  
>  
>“In the other case it was a virtual 100 percent. Now they have it, they have studied it, they know very much. In fact, we’re very close to a vaccine,” Trump said.  
>  
>White House spokesman Judd Deere told CNBC later Tuesday that Trump “was talking about the Ebola vaccine.”

We're not 'very close' to an Ebola vaccine, we have one, Ervebo, fully approved for use..."
2020-02-25,aglowwiththeflow,wallstreetbets,12,https://www.reddit.com/r/wallstreetbets/comments/f9h6jj/what_are_your_moves_tomorrow_february_26_2020/firxatt/,DD: Friend at U of Mississippi got Coronavirus. Being transported to quarantine now.
2020-02-25,sweetchillileaf,China_Flu,12,https://www.reddit.com/r/China_Flu/comments/f9kcad/anything_coming_out_of_wuhan/fis3rq0/,Coronavirus
2020-02-25,visionarymind,wallstreetbets,12,https://www.reddit.com/r/wallstreetbets/comments/f9h6jj/what_are_your_moves_tomorrow_february_26_2020/firorb7/,"Is this a biological weapon or not❓

Why is the world panicking over a non-lethal coronavirus that withers in heat & does not kill healthy people❔"
2020-02-25,jeffynihao,wallstreetbets,12,https://www.reddit.com/r/wallstreetbets/comments/f98o73/daily_discussion_thread_february_25_2020/fir97ug/," ""Subprime is contained."" - 2007 

&#x200B;

""Coronavirus is contained."" - 2020"
2020-02-25,SellTheSun,The_Donald,12,https://www.reddit.com/r/The_Donald/comments/f9kqm9/watch_party_dem_debate_disaster_south_carolina/fisfgyh/,"Pete Buttplug created the coronavirus by having gay sex with bats. 

Change my mind."
2020-02-25,covidcanada,Coronavirus,11,https://www.reddit.com/r/Coronavirus/comments/f9hxbq/san_francisco_declares_state_of_emergency_to_help/firneov/,"**'Santa Clara County'** declared local emergency on Feb 11 already.

[https://www.mercurynews.com/2020/02/10/coronavirus-public-risk-still-low-but-santa-clara-county-declares-local-emergency-to-prepare/](https://www.mercurynews.com/2020/02/10/coronavirus-public-risk-still-low-but-santa-clara-county-declares-local-emergency-to-prepare/)

'**San Diego County'** declared local emergency on Feb 14.

[https://www.kusi.com/county-declares-local-state-of-emergency-in-response-to-the-coronavirus-in-san-diego/](https://www.kusi.com/county-declares-local-state-of-emergency-in-response-to-the-coronavirus-in-san-diego/)

This is a 3rd state of emergency in California, as far as we know. Please update if you know of more."
2020-02-25,Wakanda_Dreams,wallstreetbets,11,https://www.reddit.com/r/wallstreetbets/comments/f9h6jj/what_are_your_moves_tomorrow_february_26_2020/firrl1x/,"Read somewhere that Coronavirus tests are costing people $1.4k with insurance in the states. FUCK that shit, I need 1.4k for my gae puts"
2020-02-25,shanshani,DemocratsforDiversity,11,https://www.reddit.com/r/DemocratsforDiversity/comments/f97lyw/dfd_discussion_thread_february_25_2020/firwv6w/,"a restaurant worker at a restaurant I ordered from 5 days ago because I was under quarantine was diagnosed with coronavirus

and I woke up today with a mild fever

3-5 days is the typical incubation period of the virus

if I caught coronavirus due to quarantine, lmao, I swear"
2020-02-25,dolphins3,neoliberal,11,https://www.reddit.com/r/neoliberal/comments/f96cl9/discussion_thread/fisqer2/,"Yes. Coronavirus, CEO of Disney stepping down, and other crap. /r/wallstreetbets has been suicidal all day."
2020-02-25,CoolDimension,Coronavirus,11,https://www.reddit.com/r/Coronavirus/comments/f9el2o/coronavirus_man_receives_3500_medical_bill_for/firs7i5/,"*dies of Coronavirus complications*

Boss:  hey, soo we're pretty understaffed right now, if you don't come in tomorrow I get the feeling that you're not being a 'team player'"
2020-02-25,Temstar,Coronavirus,11,https://www.reddit.com/r/Coronavirus/comments/f9ldvg/chinas_national_health_commission_reports_406_new/fise31s/,"https://www.reddit.com/r/Coronavirus/comments/f9aty1/first_wave_of_medical_staff_in_huanggang_hubei/

I am starting to see teams of medical staff being rotated off the front line now now that pressure has decreased."
2020-02-25,Arazak,The_Donald,11,https://www.reddit.com/r/The_Donald/comments/f9kqm9/watch_party_dem_debate_disaster_south_carolina/fisdjrw/,Real questions are toooo haaaard. Immigration reform? Border security? late term abortions? Medicare for illegals? Coronavirus protection?
2020-02-25,trillcollins,ChapoTrapHouse,11,https://www.reddit.com/r/ChapoTrapHouse/comments/f9kdru/epstein_aint_going_away_general_megathread_25/fisfmge/,"Holy shit, we need to dissect the coronavirus cure out of some kid's head lmao"
2020-02-25,Jokerang,DemocratsforDiversity,10,https://www.reddit.com/r/DemocratsforDiversity/comments/f97lyw/dfd_discussion_thread_february_25_2020/firpwiw/,Apparently the Tokyo Olympics could be cancelled if coronavirus gets serious enough in Japan
2020-02-25,aradsgfafdasdfasdf,wallstreetbets,10,https://www.reddit.com/r/wallstreetbets/comments/f9h6jj/what_are_your_moves_tomorrow_february_26_2020/fis4s7n/,"Trump reportedly furious stock market is plunging lmao

https://www.cnbc.com/2020/02/25/trump-is-reportedly-furious-with-the-plunging-stock-market-due-to-coronavirus-fears.html"
2020-02-25,icecovfefe,The_Donald,10,https://www.reddit.com/r/The_Donald/comments/f9kqm9/watch_party_dem_debate_disaster_south_carolina/fisag1h/,No mention of coronavirus yet.
2020-02-25,absurdlivingghost,neoliberal,10,https://www.reddit.com/r/neoliberal/comments/f96cl9/discussion_thread/firb6qc/,"If Coronavirus starts rapidly spreading in the US, will I get some time off work? Short term NEETdom can be pretty sweet"
2020-02-25,The420Roll,neoliberal,10,https://www.reddit.com/r/neoliberal/comments/f96cl9/discussion_thread/firzkpi/,"Me: lmao eurosuccs with Coronavirus 🤣

Me when it arrives To SA: GRINGOS PLS HALP 🤧😭"
2020-02-25,PHalfpipe,ChapoTrapHouse,10,https://www.reddit.com/r/ChapoTrapHouse/comments/f9529d/crying_about_a_poll_from_a_c_pollster_thread/firz7ee/,"Coronavirus only only has the 7%+ fatality rate for people over 50, so a ton of good jobs will be opening up soon, and the voting power of millennials will be supercharged years ahead of schedule.

Condolences to our older comrades though, you will be missed."
2020-02-25,Acrobatrn,Coronavirus,10,https://www.reddit.com/r/Coronavirus/comments/f9ho4a/what_is_the_panic_really_all_about/firla86/,"You're comparing something with a year of stats to a novel virus just beginning to spread and spread rapidly at that.  While the actual number of deaths is lower than flu deaths, the percentage of completed coronavirus cases has a way higher mortality rate than the percent of people who die of flu.  Majority of coronavirus patients are still being treated (many in critical/serious condition)  and could go either way.   It is apples to oranges."
2020-02-25,dummkopf_reloaded,Enough_Sanders_Spam,10,https://www.reddit.com/r/Enough_Sanders_Spam/comments/f97kzh/daily_political_discussion_roundtable_02252020/fircdwm/,"https://twitter.com/SenBlumenthal/status/1232316382253133824
>This morning’s classified coronavirus briefing should have been made fully open to the American people—they would be as appalled & astonished as I am by the inadequacy of preparedness & prevention."
2020-02-25,Technical58CZ,dankmemes,10,https://www.reddit.com/r/dankmemes/comments/f9g6xd/im_dead/fis2lo5/,"It kills people of all ages but it seems some groups are more vulnerable than other. For example, according to [this source](https://www.worldometers.info/coronavirus/coronavirus-age-sex-demographics/), people ages 10-40, have the highest chance of surviving and the older you are, your chances of surviving are smaller. It also depends if you already have some condition. Also it appears males have higher chance of dying than females.
But this is new virus and there are many unknowns so some things in there might not be 100% accurate."
2020-02-25,how_ya_doinz,wallstreetbets,10,https://www.reddit.com/r/wallstreetbets/comments/f9h6jj/what_are_your_moves_tomorrow_february_26_2020/fis320w/,An Iranian official that met with the Ayatollah a few days ago tested positive for Coronavirus
2020-02-25,badpizzaisstillgood,wallstreetbets,10,https://www.reddit.com/r/wallstreetbets/comments/f98o73/daily_discussion_thread_february_25_2020/firgnwj/,"Literal fool proof plan: Buy $SPY puts for July 2020 -> Get Coronavirus -> Sneeze on 500 people -> Ez money.

And now I'm on a FBI watchlist, shit.

But jokes aside this is probably the only way the average person can make a huge market movement lmao."
2020-02-25,jeffynihao,wallstreetbets,10,https://www.reddit.com/r/wallstreetbets/comments/f9hadz/bob_iger_to_step_down_as_disney_ceo/firj2qf/,Before coronavirus infects all of Disneyland
2020-02-25,55trader,wallstreetbets,10,https://www.reddit.com/r/wallstreetbets/comments/f9h6jj/what_are_your_moves_tomorrow_february_26_2020/fisdicg/,Guys my brother in law contracted the coronavirus. What stock should we short ill get him a plane ticket there
2020-02-25,emilio911,China_Flu,10,https://www.reddit.com/r/China_Flu/comments/f9m635/is_it_too_over_reactionary_to_suggest_to_the/fishct9/,"yeah... but I think it's the least of your issues at the Grocery store, lots of people ... touching the same carts, handling the money

coronavirus spreads by breathing too"
2020-02-25,auldlangy,Coronavirus,10,https://www.reddit.com/r/Coronavirus/comments/f9f5ud/experts_fear_the_small_number_of_us_coronavirus/firw8yg/,"Yeah my American mates who work in healthcare say the coronavirus is all over the US already, cases piling up of horrible pneumonias negative for flu or other common causes, but with the CDC kits being rubbish America can't even do testing to confirm these almost certain COVID19 cases, whilst Korea and Italy test more in a day than US has in all of 2020. I would not want to be a US health care worker or patient in an American hospital right now, those places must be breeding grounds but they can't even take preventive measures without working test kits. So much for vaunted US technical prowess (I say this as American-born myself even though now working in UK). And then on top, at least if my gigs working in the USA are any indication, Americans will spread the COVID19 like wildfire, much worse than China or Europe since you can get fired for taking a single sick day off work in the US or even suggesting work at home. And then you lose your health care, and are too afraid to even go to a clinic for dread of the medical bills. I fear the United States will soon be the global epicentre for COVID-19 because of this perfect storm of dumpster fire policy. As bad as things were in China, the Chinese can take aggressive centralised action and you don't go broke from medical bills there or get fired for taking a day off, which helps more than anything to contain the viral spread. The US is like the perfect incubator for this nightmare so I suspect we're just seeing the tip of the iceberg."
2020-02-25,MWM2,ChapoTrapHouse,10,https://www.reddit.com/r/ChapoTrapHouse/comments/f9529d/crying_about_a_poll_from_a_c_pollster_thread/fis34ec/,"####A suggestion

Ignore all tweets *without a link to an article* that make news-y claims about the coronavirus. Seriously, *all of them*."
2020-02-25,patrickclegane,MLS,10,https://www.reddit.com/r/MLS/comments/f9kpzl/match_thread_atlanta_united_fc_vs_cd_motagua/fise8ej/,Big Coronavirus outbreak at MBS
2020-02-25,McFatty7,The_Donald,10,https://www.reddit.com/r/The_Donald/comments/f9kqm9/watch_party_dem_debate_disaster_south_carolina/fisg1df/,"**There's just no way this Coronavirus was an ""accident"" from China. I think this is retaliation for the tariffs that President Trump put on China.**

**China can't beat President Trump, so I believe they created the virus to destroy the economy and stock market.**"
2020-02-25,Anowoz,wallstreetbets,10,https://www.reddit.com/r/wallstreetbets/comments/f98o73/daily_discussion_thread_february_25_2020/fir1a1u/,"Did anybody get that notification?:






“How coronavirus can boost iPhone 12 sales”"
2020-02-25,Miragey,wallstreetbets,10,https://www.reddit.com/r/wallstreetbets/comments/f98o73/daily_discussion_thread_february_25_2020/fir9ngi/,"They read WSB the last couple days too?

&#x200B;

 [https://www.cnbc.com/2020/02/25/cdc-hopes-the-coronavirus-outbreak-is-seasonal-like-the-flu-and-subsides-in-the-summer.html](https://www.cnbc.com/2020/02/25/cdc-hopes-the-coronavirus-outbreak-is-seasonal-like-the-flu-and-subsides-in-the-summer.html) 

 

# CDC hopes the coronavirus outbreak is seasonal like the flu and subsides in the summer

**PUBLISHED TUE, FEB 25 20202:32 PM EST**"
2020-02-25,spyaintnobitch,wallstreetbets,10,https://www.reddit.com/r/wallstreetbets/comments/f9h6jj/what_are_your_moves_tomorrow_february_26_2020/firm47k/,"""Trump builds wall to keep out illegal coronavirus"""
2020-02-25,spooky300pd,ChapoTrapHouse,9,https://www.reddit.com/r/ChapoTrapHouse/comments/f9529d/crying_about_a_poll_from_a_c_pollster_thread/firl383/,"Reposting this as top comment, regarding coronavirus.

Live in Italy, am near the red zone. Main takeaway is: there is a MASSIVE data reporting bias going on.

The virus has probably been around for weeks, but they only discovered it because some rando (so-called ""italian patient 1"") who has never been to china had extraordinarily bad symptoms and mentioned having lunch with a chinese guy, so they tested him for covid (the chinese lunch had nothing to do with the infection, it was later discovered).

After finding out about him they did tests in all villages in the regions and hundreds of cases came out, and old people deaths were attributed to the virus. THOSE BOOMERS WERE ALREADY DYING IN THE PRIOR WEEKS, but no one cared until they started testing.

So: your country is probably already infected, but no one is testing outside of airports, and most of non-boomers will not get anything beyond flu-like symptoms. Many boomers will die tho, and unless they test for covid it will only be a statistic."
2020-02-25,mootymoots,wallstreetbets,9,https://www.reddit.com/r/wallstreetbets/comments/f9h6jj/what_are_your_moves_tomorrow_february_26_2020/fironx7/,"They declared an emergency in San Diego for Corona 2 weeks ago. Only to unlock funds. Market didn’t care.

[edit] [1 week ago](https://www.latimes.com/california/story/2020-02-14/san-diego-county-local-health-emergency-coronavirus-response)"
2020-02-25,Howtoshortdow,wallstreetbets,9,https://www.reddit.com/r/wallstreetbets/comments/f9h6jj/what_are_your_moves_tomorrow_february_26_2020/firs1yg/,Apparently coronavirus which there are no cases is worse than homeless and needle epidemic lmao
2020-02-25,bindersthrownatmen,DemocratsforDiversity,9,https://www.reddit.com/r/DemocratsforDiversity/comments/f97lyw/dfd_discussion_thread_february_25_2020/fise3xo/,"Unironically, ""Donald Trump and republicans cut the CDC budget which helped the coronavirus spread to the US and potentially become an oitbreak"" would be an insanely effective attack"
2020-02-25,CptnBligh,The_Donald,9,https://www.reddit.com/r/The_Donald/comments/f9kqm9/watch_party_dem_debate_disaster_south_carolina/fisfyo1/,What the fuck does climate change have to do with the Coronavirus????
2020-02-25,BranfordJeff2,The_Donald,9,https://www.reddit.com/r/The_Donald/comments/f9kqm9/watch_party_dem_debate_disaster_south_carolina/fisft61/,Coronavirus is because of global warming?
2020-02-25,ILikeTalkingToMyself,neoliberal,9,https://www.reddit.com/r/neoliberal/comments/f9krck/the_thunderdome_returns/fisftgp/,To stop coronavirus we need to TAX BILLIONYAHS
2020-02-25,ominousferret,wallstreetbets,9,https://www.reddit.com/r/wallstreetbets/comments/f9h6jj/what_are_your_moves_tomorrow_february_26_2020/fisq1qq/,[Wuhan Flu](https://www.marketwatch.com/story/dont-buy-chinas-story-the-coronavirus-may-have-leaked-from-a-lab-2020-02-22?mod=home-page) could have been a lab test that got out of the lab?
