date,author,subreddit,score,url,text
2020-02-22,BlueCoastalElite,MemeThatNews,5,https://www.reddit.com/r/MemeThatNews/comments/f83i67/election_2020/fiitmlv/,"**Flying coronavirus class: Photos of American Diamond Princess passengers’ flight from hell**

[https://nypost.com/2020/02/22/flying-coronavirus-class-photos-of-americans-flight-from-hell/](https://nypost.com/2020/02/22/flying-coronavirus-class-photos-of-americans-flight-from-hell/)

&#x200B;

**Coronavirus-stricken cruise ship passengers returned to US against CDC advice**

[https://www.livescience.com/coronavirus-cruise-ship-us-passengers-against-cdc-advice.html](https://www.livescience.com/coronavirus-cruise-ship-us-passengers-against-cdc-advice.html)

**""CDC officials, however, warned against evacuating the infected, due to concerns over re-exposing healthy passengers to the virus. When State Department and administration officials decided to go through with the evacuation, the CDC's principal deputy director, Anne Schuchat, requested not to be included in the news**[ **release announcing the decision**](https://www.state.gov/joint-statement-by-u-s-department-of-state-and-u-s-department-of-health-and-human-services-on-repatriation-of-american-passengers-from-the-diamond-princess-cruise-ship/)**. ""**

&#x200B;

**Trump Has Sabotaged America’s Coronavirus Response**

[https://foreignpolicy.com/2020/01/31/coronavirus-china-trump-united-states-public-health-emergency-response/](https://foreignpolicy.com/2020/01/31/coronavirus-china-trump-united-states-public-health-emergency-response/)

""As it improvises its way through a public health crisis, the United States has never been less prepared for a pandemic.

For the United States, the answers are especially worrying because **the government has intentionally rendered itself incapable. In 2018, the Trump administration fired the government’s entire pandemic response chain of command, including the White House management infrastructure**. In numerous phone calls and emails with key agencies across the U.S. government, the only consistent response I encountered was distressed confusion. If the United States still has a clear chain of command for pandemic response, the White House urgently needs to clarify what it is—not just for the public but for **the government itself, which largely finds itself in the dark**."""
2020-02-22,WhenLuggageAttacks,Coronavirus,5,https://www.reddit.com/r/Coronavirus/comments/f80aq7/italy_update_at_least_80_cases_2_deads_schools/fiiuw7h/,"Yes.

> CDC estimates that so far this season there have been at least 29 million flu illnesses, 280,000 hospitalizations and 16,000 deaths from flu.

https://www.cdc.gov/flu/weekly/index.htm

That's slightly less than 9% of the country (USA) getting the flu this season. Only 1% of those infected ended up in the hospital. Only 6% of the folks who ended up in the hospital died.

If the current forecasts and the China Report is to be believed, 60% of the country will be exposed to the coronavirus this year. 30% of the country will actually will get infected, or 98 million. Twenty percent of those, or around 20 million people will end up in the hospital. Around five million will end up in critical condition. Around 2%, or 2 million, will end up dying.

Hospitals can barely cope with a feisty flu season, and this definitely ain't the flu."
2020-02-22,swagmaster600_gang,wallstreetbets,5,https://www.reddit.com/r/wallstreetbets/comments/f7hla8/weekend_discussion_thread_february_2123_2020/fihkae4/,"The only people breaking the rules of WSB is bears, they are trying to take our money out of the market by saying this is market correction and coronavirus red, Monday will be green boys as well as the next 99 percent of the days we are alive"
2020-02-22,Michelleisaman,conspiracy,5,https://www.reddit.com/r/conspiracy/comments/f7z81j/after_one_person_is_found_infected_in_italy/fihm3ij/,"The flu has a mortality rate of 0.014% in the United States.  Coronavirus has a mortality rate of 3%.  

In other words, the flu kills 1.4 people for every 10,000 infected.  Coronavirus kills 300 people for every 10,000 infected.  Coronavirus is also much more infectious than the flu.  If half of the people in your town of 20,000 gets infected, 300 people will die.  A Harvard epidemiologist said last week he expects half of the world's population to get infected.  At a 3% mortality rate, that's over 100 million people dead.  

&#x200B;

So yes, this is more serious than the flu."
2020-02-22,RidingRedHare,worldnews,5,https://www.reddit.com/r/worldnews/comments/f7xl2l/live_thread_coronavirus_outbreak/fihtnjt/,North Koreans won't die from the coronavirus because they'll be executed first.
2020-02-22,ToddlerPeePee,wallstreetbets,5,https://www.reddit.com/r/wallstreetbets/comments/f80clb/bought_the_dip_anyone_else/fihqjq0/,"My friends (yes multiple of them) in China are telling me that the situation there is much worse than the news are trying to cover up. One of them, just within his apartment, there are 3 infected with the coronavirus, 1 had already died. How many apartments are there in China? Factories remain closed and they are telling me they may lose their jobs as the boss is refusing to pay them salaries as the business is lacking cashflow from the shutdowns. Take it or not, this is the real situation in China right now."
2020-02-22,ne0ndistraction,Wuhan_Flu,5,https://www.reddit.com/r/Wuhan_Flu/comments/f7xcua/rnottheonion/figjdfc/,"Um, yeahh... I'm going to need you to come in with coronavirus."
2020-02-22,HillaryBrokeTheLaw,collapse,5,https://www.reddit.com/r/collapse/comments/f7yy7m/the_signs_say_going_out_is_death_anyone_who_goes/fihxy1y/,"> Seriously though, this won’t decimate the population

That's assuming serious medical intervention for chronic cases and that's an assumption that is questionable in many parts of the West. And it's definitely not true in the Middle East or Africa. The death rate would be far higher without aggressive medical intervention by the Chinese. 

I wonder if you can get a pre-auth for the kind of treatment necessary to keep you alive if you get hospitalized? Coronavirus is going to make the case for a Medicare for All in the US."
2020-02-22,Wisdom-Speaker,Coronavirus,5,https://www.reddit.com/r/Coronavirus/comments/f7y74j/comparisons_to_the_spanish_flu_are_laughable/figviwp/,"It's not fear mongering it's rational analysis of available data.

1) The 1918-1920 pandemic flu had a CFR of about 2% as well.  WHO Situation Report 30 has the data for COVID and it's similar, maybe not quite as high, but also far more infectious so more people will get it if it's not controlled soon.

2) Countermeasures were taken during the 1918 flu... surgical masks were new and in wide use, quarantines were made.  Also, the political pressure to avoid countermeasures until it's too late is the same today as then because human nature hasn't changed.  

3) Just because COVID-19 kills more slowly than the 1918 flu does not make it less dangerous. In fact it makes it more dangerous, because countermeasures taken only after the first confirmed case are too late; the virus has several generations of hidden early-stage cases by the time a case becomes serious enough to get noticed. Witness Korea, Iran, Italy for examples. Or the Singapore meeting event.

4) COVID is killing plenty of people under age 50. The fact that it is less deadly for teens and 20-somethings than the 1918 influenza is good for younger people, but cold comfort to the 40-and-over who are taking the brunt of the death rate so far.

5) The early stage of the Spanish Flu did not kill in great numbers, in spring 2018. It mutated and got worse. The new coronavirus may do the same. 

It is prudent to take precautions in the face of a novel and largely unknown risk."
2020-02-22,zenthepoet,Cosmere,5,https://www.reddit.com/r/Cosmere/comments/f7ygzq/starting_this_today_i_am_looking_forward_to_them/fii5mlp/,Avoid spoilers like it's the coronavirus!
2020-02-22,glorriosa,Wuhan_Flu,5,https://www.reddit.com/r/Wuhan_Flu/comments/f81p9n/open_discussion_about_current_reality/fii7r1p/,"Regarding Indonesia- some kind of magic prayer is protecting them or maybe God just likes Indonesia..

Source: https://www.newsweek.com/indonesia-coronavirus-health-minister-prayer-1487768"
2020-02-22,wu_ming2,italy,5,https://www.reddit.com/r/italy/comments/f7txjb/megathread_3_coronavirus/fii8kwr/,"Le ultime informazioni su covid-19 dal centro europeo per la prevenzione e controllo delle malattie: https://www.ecdc.europa.eu/en/novel-coronavirus-china

In particolare per informazioni sui sistemi di prevenzione consiglio di leggere Guidelines for the use of non-pharmaceutical measures to delay and mitigate the impact of 2019-nCoV: https://www.ecdc.europa.eu/en/publications-data/guidelines-use-non-pharmaceutical-measures-delay-and-mitigate-impact-2019-ncov"
2020-02-22,TonedCalves,China_Flu,5,https://www.reddit.com/r/China_Flu/comments/f7yk3w/accounts_that_are_trying_to_silence_users_should/figybm2/,Did you see the reports today about Russian shills and the coronavirus? Not to mention Xi's explicit directions to influence international social media
2020-02-22,hello-world-foo-bar,wallstreetbets,5,https://www.reddit.com/r/wallstreetbets/comments/f7hla8/weekend_discussion_thread_february_2123_2020/fiezvk8/,"Only 2 news item for markets to sink further:

Yuan to usd

Coronavirus count.

Yuan passed 7 on friday and global markets sank.  China I'd devaluing to deal with a financial crisis there they aren't disclosing.  Employers have told employees they wont be paid or deferred payment.  Theres a real liquidity issue in china just like LEHMAN collapse  bit this time is chinas shadow banking.

Corona count is important because it is the structural problem why China is facing a liquidity crisis from supply chains stipping and 750M people not working.

China CB have to provide 750B USD in liquidity each month so that he minksy/lehman moment foesnt happen.

This is very much like 2008 GfC but starting in china."
2020-02-22,coupl4nd,avfc,5,https://www.reddit.com/r/avfc/comments/f7tafb/match_thread_southampton_vs_aston_villa/fif7k1u/,Coronavirus.
2020-02-22,gravesaver,Coronavirus,5,https://www.reddit.com/r/Coronavirus/comments/f7uovi/is_it_me_or_was_panic_more_pronounced_on_this_sub/fifribc/,"The r/coronavirus, r/china_flu, r/covid19 drama deserves its own subreddit. It’s a microcosm of everything both good and bad about reddit. You could write a dissertation on it.  Conspiracies, doxxing, over-zealous mods, well-meaning mods, accusations of CCP agents, etc..."
2020-02-22,namethatisntaken,anime,5,https://www.reddit.com/r/anime/comments/f7ufll/fategrand_order_zettai_majuu_sensen_babylonia/fift72h/,I think he's trying to say the coronavirus.
2020-02-22,Aerowitz,SCJerk,5,https://www.reddit.com/r/SCJerk/comments/f7tg2r/reminder_that_chris_totally_not_a_right_wing/fifsn88/,"Coronavirus cancelled a month of Stardom'Waifu shows. Checkmate, bigot!

~~FUCK TAM~~ IT'S TAM TIME"
2020-02-22,GS_Hyperios,Coronavirus,5,https://www.reddit.com/r/Coronavirus/comments/f7uovi/is_it_me_or_was_panic_more_pronounced_on_this_sub/fifi446/,Funny thing is that r/coronavirus used to be the conspiracy sub and r/china_flu the more reasonable one.
2020-02-22,knightsone43,Coronavirus,5,https://www.reddit.com/r/Coronavirus/comments/f7wa0z/italy_reports_7_more_cases_of_coronavirus/fig2235/,I think this coronavirus will sadly be added to the other seasonal flu lists
2020-02-22,watertatertot0182,Coronavirus,5,https://www.reddit.com/r/Coronavirus/comments/f7wa0z/italy_reports_7_more_cases_of_coronavirus/fig7dbj/,The real coronavirus cure: Gypsy tears
2020-02-22,BrawndoTTM,barstoolsports,5,https://www.reddit.com/r/barstoolsports/comments/f7qnvz/free_talk_saturday/figjl6y/,Daily reminder that you are still CONSIDERABLY more likely to die in a car accident driving to work than from coronavirus.
2020-02-22,lambdookie,average_redditor,5,https://www.reddit.com/r/average_redditor/comments/f7uqb0/average_redditor/figtiig/,Wtf I love coronavirus now
2020-02-22,gaylemadeira,collapse,5,https://www.reddit.com/r/collapse/comments/f4po2f/megathread_the_fifth_spread_of_the_wuhan/fih4c7u/,"My question of the day - How is it that the CDC claimed 34 coronavirus cases as of February 21st but Costa Mesa California is trying to ""block the transfer of up to 70 confirmed coronavirus patients from near Sacramento""? Source: [https://www.msn.com/en-us/news/crime/costa-mesa-seeks-to-block-transfer-of-coronavirus-patients/vi-BB10g2lj](https://www.msn.com/en-us/news/crime/costa-mesa-seeks-to-block-transfer-of-coronavirus-patients/vi-BB10g2lj)

The video in this link says that “some of them may have been” on the cruise ship, but they don’t even know, and even if they were on the cruise ship, the 34 counted by the US right now is including all known confirmed COVID cases in the US. Another webpage that I found this on yesterday has since been deleted (even the cached version) and most references to this situation now say ""30-50 coronavirus patients"" instead of 70."
2020-02-22,lisa0527,China_Flu,5,https://www.reddit.com/r/China_Flu/comments/f7y8r9/curious_as_to_what_happens_in_different/fiha9sl/,"Elective ortho and plastics surgeries will be the first to be shut down. Ortho trauma will continue to run. Obstetrics will have to continue...hopefully isolated at a dedicated hospital. Internal medicine and neurology are trickier...May need to move outpatient clinics off site. General surgery...emergency cases only. That might include emergency oncological surgeries. Oncology will hopefully continue, although I don’t know where chemo drugs are manufactured...China? The more I think about it, the more I think they’ll need to designate some hospitals as “everything but coronavirus” (with strict screening procedures), and focus coronavirus cases at dedicated sites."
2020-02-22,CharlD22,worldnews,5,https://www.reddit.com/r/worldnews/comments/eyq5vp/live_thread_wuhan_coronavirus/fihcdfb/,"Israel's ambassador to China has been quarantined because he was on the same flight as South Korean tourists who tested positive for coronavirus - Jerusalem Post

https://twitter.com/BNODesk/status/1231335651397849088?s=20"
2020-02-22,spacejam999,Coronavirus,5,https://www.reddit.com/r/Coronavirus/comments/f7znlw/14_universities_closed_in_milan_until_february/fihiatb/,"Official Press conference that's going on right now in tv, also here (but in Italian)
 https://www.tgcom24.mediaset.it/cronaca/coronavirus-nuovo-caso-di-contagio-in-veneto-un-67enne-di-dolo_15145712-202002a.shtml"
2020-02-22,CharlD22,worldnews,5,https://www.reddit.com/r/worldnews/comments/f7xl2l/live_thread_coronavirus_outbreak/fiiikzl/,"UPDATES:

South Korea reports 95 new cases of coronavirus, raising country's total to 556

South Korea reports 2 more deaths from coronavirus, raising death toll to 4

Summary of South Korea's update: 

- 123 new cases, 2 new deaths 

- 75 new cases linked to church 

- 48 others with unknown link 

- Total: 556 cases, 4 deaths 

- 6,039 people being tested


The 4th fatality was a man in his early 40s, according to officials.


Source: https://twitter.com/BNODesk?s=20"
2020-02-22,reverse_-_card,memes,5,https://www.reddit.com/r/memes/comments/f8344i/sorry_coronavirus_not_today/fiir0xd/,We did it boys. Coronavirus is no more
2020-02-22,pelariarus,indonesia,5,https://www.reddit.com/r/indonesia/comments/f82wgv/new_case_of_coronavirus_in_tokyo_is_a_man_who/fiisb3l/,All the passengers will be monitored of course.. more so when the japanese has confirmed the suspect coronavirus patient
2020-02-22,Oh_no_bros,wallstreetbets,5,https://www.reddit.com/r/wallstreetbets/comments/f838k9/weekend_dd/fiise93/,"Just a word of warning, this sounds like a good long play, but very risky short term in light of coronavirus news. Maybe that is already priced in but you never know."
2020-02-22,james___bondage,worldnews,5,https://www.reddit.com/r/worldnews/comments/f7xl2l/live_thread_coronavirus_outbreak/fiitfsb/,"i didn't say it kills the virus, cool your fucking jets. but we do know that viruses often spread more easily in cooler, drier air, and [here's an article that covers that](https://www.reuters.com/article/us-china-health-explainer/could-warmer-weather-help-contain-the-coronavirus-idUSKBN20F1RG). there's a reason that there is a flu season. sick strawman though"
2020-02-22,aquarain,worldnews,5,https://www.reddit.com/r/worldnews/comments/f7xl2l/live_thread_coronavirus_outbreak/fiiuzm0/,"https://www.1011now.com/content/news/UPDATE-CDC-on-coronavirus-health-emergency-568112081.html

>The state department says Americans who get sick in Asia can no longer expect to be repatriated to the U.S."
2020-02-22,GravyBear8,neoliberal,5,https://www.reddit.com/r/neoliberal/comments/f7p3ro/discussion_thread/fieoyao/,"Wait, what the absolute fuck

I was curious about how Coronavirus compares to other diseases of the past and looked up Swine Flu, and that fucking disease infected *10-20%* of the global fucking population? How the fuck is this not talked about? What the fuck, when I remember it as a kid, it was just a blip on the news."
2020-02-22,fishyfish2656,preppers,5,https://www.reddit.com/r/preppers/comments/f81pkg/please_rate_my_prep_from_today_covid19_edition/fiiykqy/,"I see you watched the news 3 weeks ago, firstly it does not have comparable mortality rate to the flu. Going off current US statistics 0.05 percent of people who the flu die of it. Where as 2.5 percent die of coronavirus, but heres the thing the coronavirus statistics aren't even correct. If you look at the numbers:  78773 confirmed, 2462 dead and 23188 recovered (these are CCP numbers are certainly fake), then you can see that you have a 3.12% mortality rate sure not much worse but still a tad, but what isnt factored in is the fact that many many of the confirmed cases haven't even ran their full course of the virus. To get an actually understanding of the real mortality rate it is much more accurate to look at the recovered cases compared to the number of dead. This number ends up being 10.61%. 

The virus has a much higher R0 value (how many people are expected to become infected from a single infected person) at between 2.5 and 8.08 at the highest ive seen but commonly believed to be at around 4.0 now, compared with the flu at between 1.4 and 1.6. The incubation period is also sitting at around 14 days with some reports showing people after 20-40 days of quarantine starting to show symptoms. Speaking of symptoms the symptoms are much worse than that of the common cold including reports of major respiratory damage after recovering from the virus. The virus is still very much in its infancy are 'relatively concentrated' to certain countries but you will start to see over the next few months just how much this is ramping up. To stay ignorant and say 'its just the flu bro' is simply that. I could write another 5 paragraphs about this but most of this I have listed or would list Im not going to spend 10 hours getting the source for. Either way i urge you to do some research and inform yourself instead of just dumbing things down and believing the first thing you see."
2020-02-22,Teckel22,wallstreetbets,5,https://www.reddit.com/r/wallstreetbets/comments/f7hla8/weekend_discussion_thread_february_2123_2020/fii2iwy/,"BREAKING: Italy to put cities with coronavirus outbreaks on lockdown, around 50,000 people will be affected by the lockdown in 11 different towns. https://twitter.com/banana_news_247/status/1231357684143837184"
2020-02-22,Teckel22,wallstreetbets,5,https://www.reddit.com/r/wallstreetbets/comments/f7hla8/weekend_discussion_thread_february_2123_2020/fii3ncl/,"Codogno (Italy) (AFP) - Two deaths from the new coronavirus sparked fears throughout northern Italy on Saturday, as about 50,000 people were poised for a weeks-long lockdown imposed by authorities trying to halt a further increase in infections.

Italy on Friday became the first country in Europe to report the death of one of its own nationals from the virus, triggering travel restrictions on about a dozen towns where the number of people contaminated has continued to rise.

[..]

Conte warned that the **restrictive measures would last for a couple of weeks**, corresponding to the length of time the virus incubates. Some 50,000 people, who had already been asked to stay at home by local authorities, will be affected, he said.
https://news.yahoo.com/emergency-room-shops-closed-italian-town-coronavirus-lockdown-090557997.html"
2020-02-22,J-Botty,Coronavirus,5,https://www.reddit.com/r/Coronavirus/comments/f7xqas/daily_discussion_post_20200222_questions_images/fii1adg/,There are other (better and freer) Coronavirus subs on reddit. I find it helpful to sample all of them (including this one) as they seem to balance each other out. It is true that if this is the only one you rely on you will be continually frustrated in this manner - but it’s clear there is a segment of society who likes to have truth selected and curated for them and this sub serves them well.
2020-02-22,therealglovertexeria,MMA,5,https://www.reddit.com/r/MMA/comments/f7yi1y/official_ufc_on_espn_26_felder_vs_hooker_live/fiifj79/,"Hey everyone making Coronavirus jokes, get fucked"
2020-02-22,kraken989,Coronavirus,5,https://www.reddit.com/r/Coronavirus/comments/f82bt7/if_coronavirus_is_killing_fewer_people_than_the/fiik5y1/,"Also Coronavirus seems to be more severe than the flu... i.e. more hospitals are needed (for the same numbers of infected)... but because it's airborne... it can infect everybody in the hospital... so it needs special hospitals. That's the reason China build 2 new hospitals in Wuhan, because normal hospitals become a cross infection nightmare. (one Coronavirus patient, can potentially infect the whole hospital) Also that's the reason Wuhan is still problematic. So if people are not ready... and medical personal is not instructed, normal hospitals would become death traps, very fast.

Hiding and downplaying the Coronavirus threat is not going to help anyone.  People should be aware of the danger, especially the medical personnel, there should be special instructions for the medical personnel. (that's not done in my country... and I don't know who is going to build 2 special hospitals in my town, when the virus blows out)."
2020-02-22,KageyK,livepd,5,https://www.reddit.com/r/livepd/comments/f7yapx/live_pd_live_thread_feb_22_2020/fiin1po/,"Are you stupid?

The slippery wiener

ThE other slippery wiener and the Coronavirus guy.   


Good opening."
2020-02-22,windsyofwesleychapel,China_Flu,5,https://www.reddit.com/r/China_Flu/comments/f83o0n/front_page_of_cnn/fiiv03n/,"Hmmm mine looks nothing like that.

In fact there is an entire Coronavirus section.  

Take a look:  [Front Page of CNN](https://www.cnn.com)"
2020-02-22,sneakpeek_bot,singapore,5,https://www.reddit.com/r/singapore/comments/f84jb8/3_teenagers_investigated_for_spit_on_lift_buttons/fij0r2l/,"> # 3 teenagers investigated for spit on lift buttons at Rumbia LRT

> SINGAPORE - Three male teenagers are being investigated by the police for spitting on the lift buttons in a lift at Rumbia LRT station.

> The incident, which came to light on Thursday (Feb 20) after SBS Transit posted a photo on Facebook of the lift buttons covered in spittle, had sparked condemnation coming amid the coronavirus outbreak.

> SBS Transit, the operator of the Sengkang LRT line, said it had lodged a police report over the ""abhorrent act"".

> On Saturday, the police said in a statement that it is investigating three 15-year-olds over the incident for an offence of mischief.

> The teenagers had been caught on police camera, and their identities were established on Friday through ground enquiries by officers from the Ang Mo Kio Police Division.

> Preliminary investigations found that they had spat on the lift buttons on Wednesday at about 6.10pm.

> Those convicted of an offence of mischief under Section 426 of the Penal Code can be jailed up to two years, or fined, or both.

> The police added that they take a ""serious view of such inconsiderate and irresponsible behaviour"", especially during the current coronavirus outbreak situation.

> ""Everyone needs to play their part to maintain social responsibility, and observe good personal hygiene,"" said the statement.

---
1.0.2 | [Source code](https://github.com/fterh/sneakpeek) | [Contribute](https://github.com/fterh/sneakpeek)"
