date,author,subreddit,score,url,text
2020-03-05,cisned,Coronavirus,8,https://www.reddit.com/r/Coronavirus/comments/fe6ed6/australian_woman_tested_positive_again_after_she/fjmdmat/,"I’ve done vaccine research at Duke for CMV and HIV.

CMV is a herpes virus, and like someone said, it’s a DNA virus. HIV is an RNA virus that kills immune cells. This coronavirus is an RNA virus capable of infecting like HIV and CMV. 

About 90% of the population has CMV, and it’s one of the most prevalent viruses. It’s not a problem unless you’re a newborn, or an immunocompromised patient. Coronavirus will be prevalent, but we don’t know what it does to the immune system. 

Some sources from China claim that it reduces lymphocytes during infection. When lymphocytes reach a low number, it causes respiratory and/or multiple organ failure leading to death. HIV does the same, it attacks lymphocytes and allows a secondary infection that leads into death. 

HIV also hides in the body and causes reinfection when the body is in distress or vulnerable. It can’t be cured because it mutates constantly, and the antibodies needed are rare to make, while also being autoimmune.

This virus shows signs of reinfection, as there are multiple cases where discharged patients come back with Conv-19. Its been claimed by scientific sources that there are two strains, and both can infect you at the same time. HIV does the same, and it has multiple strains, 3 major ones, that can infect you at once.

As far as I can tell, this virus has everything. It can even infect you while being asymptomatic. Something HIV, Hep-B/C only have. We don’t know what the long term effects of coronavirus are, but if I had to guess it will be like HIV.

The body and immune system will be scarred, and constantly attacked by reinfection. The scarred tissue in the lungs will cause low oxygen saturation in the blood. This will lead into a chronic illness, possibly causing early cardiac arrest.

The virus will not be able to be cured, but rather treated. Eventually something like this will need a vaccine, but we will also need to get a bit lucky. The first step of the vaccine is to find an antigen to give universally. The problem is that some people don’t react to the antigen accordingly, or simply don’t have the genes to form the required antibodies, something that occurs with HIV. Not only that, but that antigens must also be effective against multiple strains and in multiple cells lines. Something that we also have problems with herpes and HIV.

As a biochemist turned immunologist/virologist I’m not optimistic. I believe it’s going to be challenging, but if we overcome this, we will get better. If we can cure this virus, we’ll be able to tackle many other viruses. The field will advance, and eventually CRISPR technology will be used.

Unfortunately with vaccine research you always run into the same problem. How do you fix a genetic mutation without modifying its genome if you can’t do genetic experiments?"
2020-03-05,joaquinsALFhoodie,neoliberal,8,https://www.reddit.com/r/neoliberal/comments/fdrhww/discussion_thread/fjmbs55/,Man r/coronavirus is a wild place.
2020-03-05,YaBoyRustyTrombone,wallstreetbets,8,https://www.reddit.com/r/wallstreetbets/comments/fe22hg/what_are_your_moves_tomorrow_march_06_2020/fjmdmmv/,"I really like the idea behind buying puts on travel and entertainment stocks, but how much lower can they go?
Honestly, it seems too good to be true. Like I missed the trend. Anybody else going into this can explain their logic?
For reference, I'm gonna be buying 3k in cedar fair puts (coronavirus just hit ohio where two of their biggest parks are), 3k in seaworld puts (Busch gardens is also part of seaworld), and 3k in DAL puts (more and more events are being canceled around America, I just had a smash tournament regional in Seattle cancel on me).
Thoughts?"
2020-03-05,ak51388,Coronavirus,8,https://www.reddit.com/r/Coronavirus/comments/fe8833/santa_clara_county_officials_recommended_san_jose/fjmg6gw/,Our decisions when it comes to containing coronavirus will be a tragic embarrassment for years to come.
2020-03-05,bwredsox34,nfl,8,https://www.reddit.com/r/nfl/comments/fe8dis/basterio_update_panynj_tells_me_quinnenwilliams/fjmhdx7/,"You know the old saying, ""Always bring a gun to a coronavirus fight"""
2020-03-05,irony_tower,DemocratsforDiversity,8,https://www.reddit.com/r/DemocratsforDiversity/comments/fdafvy/dfd_discussion_thread_march_04_2020/fjj6x4s/,"The President called in to Fox news saying that if you have Coronavirus, it is fine to still go in to work

https://twitter.com/Politidope/status/1235415582931066880"
2020-03-05,FinndBors,Coronavirus,8,https://www.reddit.com/r/Coronavirus/comments/fdqjmj/president_trump_suggests_in_an_interview_with_fox/fjj8kug/,"Before passing judgement, listen to the recording.

All he is saying is that some people don’t exhibit much symptoms and they go to work. Not that it is okay to go to work with coronavirus.

With trump, there is no need to make up stupid shit he says. There is plenty of it, like his comment about using the flu vaccine for coronavirus."
2020-03-05,TomVR,ChapoTrapHouse,8,https://www.reddit.com/r/ChapoTrapHouse/comments/fdpyr6/pokemon_shield_my_eyes_from_all_your_awful_posts/fjkq18k/,"they think they'll be dead in 20 years.

with coronavirus they'll be dead in 20 weeks"
2020-03-05,virtu333,neoliberal,8,https://www.reddit.com/r/neoliberal/comments/fdrhww/discussion_thread/fjkom1r/,Trump's handling of coronavirus might actually get some of his base killed and accelerate demographic shifts lol
2020-03-05,homerule,blogsnark,8,https://www.reddit.com/r/blogsnark/comments/fcandz/politics_and_current_events_mar_02_mar_08/fjkr3bj/,Should we have a Blogsnark Coronavirus Megathread?
2020-03-05,grrrarrrrgh,Coronavirus,8,https://www.reddit.com/r/Coronavirus/comments/fdr7u4/daily_discussion_post_march_05_questions_images/fjljsov/,Coronaviruses are a class of diseases that has been around forever. MERS and SARS are coronaviruses. The common cold is a coronavirus.
2020-03-05,YVRJon,vancouver,8,https://www.reddit.com/r/vancouver/comments/fe307s/whats_going_on_on_elmbridge_in_richmond/fjlkt1r/,"Looks like a meth lab.  In addition to what you've mentioned, there was a truck from the ""Technical Rescue"" department there this morning.

And no, it's not coronavirus.  They don't need four fire trucks (yesterday afternoon) for coronavirus."
2020-03-05,DamnBruhChill,wallstreetbets,8,https://www.reddit.com/r/wallstreetbets/comments/fe22hg/what_are_your_moves_tomorrow_march_06_2020/fjlytrc/,"Guys, the lab I work at just announced we are accepting swab samples for the Coronavirus. Am I fucked? Also, buying more puts lol."
2020-03-05,Legatomachine,LasVegas,8,https://www.reddit.com/r/LasVegas/comments/fe4145/what_happens_in_vegas_if_no_one_stays_in_vegas/fjlzzde/,Lots of travel/hotel/hospitality/theme park/event industries will feel negative effects from people traveling less due to coronavirus.
2020-03-05,GoldenTaterSalad,barstoolsports,8,https://www.reddit.com/r/barstoolsports/comments/fe4oe1/thirsty_thursdays/fjm9d5x/,Word just came from HR that we're working from home next week as well due to coronavirus. My movie queue is already dwindling. Any under-the-radar Prime/Netflix/HBO movies that I should check out?
2020-03-05,biologia2016,Coronavirus,8,https://www.reddit.com/r/Coronavirus/comments/fdzip8/university_of_washington_medicine_has_developed/fjktfls/,Forcing individual universities to have to make their own test kits is just bewildering. Where in the world is the 8 billion coronavirus package Congress supposedly approved going towards?
2020-03-05,pictorsstudio,philosophy,8,https://www.reddit.com/r/philosophy/comments/fdzomm/how_the_stoics_help_us_calm_during_the/fjkw1s7/,I don't know one person that is actually worried about coronavirus.
2020-03-05,moxievernors,superleague,8,https://www.reddit.com/r/superleague/comments/fdv8zq/thursday_match_thread_round_six/fjl6h5x/,I think I'll wander through r/China_flu and r/coronavirus for a little while.  I need to see something more positive than this game.
2020-03-05,isaac_horstmeier,Coronavirus,8,https://www.reddit.com/r/Coronavirus/comments/fe1th1/dogs_cats_cant_pass_on_coronavirus_but_can_catch/fjl7qjq/,"Pet cats and dogs cannot pass the new coronavirus on to humans, but they can test positive for low levels of the pathogen if they catch it from their owners."
2020-03-05,RTRonan,barstoolsports,8,https://www.reddit.com/r/barstoolsports/comments/fdt3e1/free_talk_thursday/fjl8e2u/,Many thanks to the coronavirus and old people for making flights extremely cheap right now.
2020-03-05,NarcoticsConnoisseur,Coronavirus,8,https://www.reddit.com/r/Coronavirus/comments/fdr7u4/daily_discussion_post_march_05_questions_images/fjl9u8h/,"I just went to the clinic because I’ve had a cough for 7 days. Along with that, the nurse said my temperature was 99.5 (slight fever). They didn’t test me for anything at all, I was prescribed a combination of steroids and something else. Considering I meet the criteria for coronavirus and they didn’t even raise an eyebrow, I’m kinda disappointed in them."
2020-03-05,TetsuoSama,soccer,8,https://www.reddit.com/r/soccer/comments/fdzuc6/sky_the_premier_league_has_scrapped_players/fjlapls/,"[It does](https://www.huffingtonpost.ca/entry/hand-sanitizer-coronavirus-wuhan-canada_ca_5e2f26a3c5b67d8874b7ae94?guccounter=1&guce_referrer=aHR0cHM6Ly9kdWNrZHVja2dvLmNvbS8&guce_referrer_sig=AQAAAIMBWsRYMwJDOxWYyxEgptU--O-C-bGtHuD3fyfVYFLGbWZAyZZqftqqWjfdiHxdKENJbJWIr9s19dmMzgLNjRRhaITqFg8Z3ChVYyKqyF6XdktZhcu7JPfT7ob8IvafbdoCa6VDLI8VuNuhRgrJ40GMZXOkPjFj1aewWU6bJN6o).  

> Does hand sanitizer prevent the spread of coronavirus?

> Yes. Alcohol-based hand sanitizers are not only effective at preventing the transmission of coronavirus, but the transmission of viral infections in general. According to Public Health Canada, they need to have around 60 or 70 per cent alcohol content, which is the case for most over-the counter hand sanitizers."
2020-03-05,PlusLemon3,Coronavirus,8,https://www.reddit.com/r/Coronavirus/comments/fdwyaa/nyc_still_has_only_tested_35_people_as_of_1030_am/fjkinef/,"It's unbelievable! The NYTimes wrote 2 days ago:

„Soon after the virus surfaced in China, the C.D.C. got to work on its own test. “Generally, C.D.C. provides these tests for the world,” said Dr. Frieden. But German researchers were devising their own test, which was quickly adopted by the World Health Organization for distribution around the world.

After the C.D.C.’s version turned out to be flawed, the agency continued to pursue it, despite the fact that another diagnostic test was already in wide use.“

That means they are too proud to order the test kits from the WHO! They could instantly stop the whole shitshow and save lives instead! 

(Source: [https://www.nytimes.com/2020/03/02/health/coronavirus-testing-cdc.html](https://www.nytimes.com/2020/03/02/health/coronavirus-testing-cdc.html))"
2020-03-05,BovineLightning,socialism,8,https://www.reddit.com/r/socialism/comments/fdz9gg/think_china_mishandled_the_coronavirus_wait_until/fjm3glj/,"China built a hospital from scratch for infected patients in a week [source](https://www.dailymail.co.uk/news/article-7924249/Chinese-builders-work-day-night-turn-field-coronavirus-hospital-WEEK.html).

Trump is currently claiming that Coronavirus will magically disappear once the weather warms up [source](https://www.vanityfair.com/news/2020/02/donald-trump-coronavirus-warm-weather).

That should tell you all you need to know"
2020-03-05,labarbatron,Coronavirus,8,https://www.reddit.com/r/Coronavirus/comments/fdr7u4/daily_discussion_post_march_05_questions_images/fjm319y/,"I might be crazy or I’m just attributing symptoms, but I’m almost positive I had Coronavirus back in January. It started with a dry cough with clear phlegm but it was stuck in my lungs, really cold when I breathed in and then I started getting shortness of breath. Like walk around the house and get out of breath. Long story short went to the ER and they were like “yeah looks like you’re not having a heart attack but your 02 levels are low and you have a little bit of fluid in your lungs, so it’s like you have walking pneumonia, but no fever so let’s call it bronchitis” and got a zpak and it didn’t work. Then went back to a primacare a week later after almost keeling over I was so out of breath (taking the fucking trash out) and the guy was like “well let’s try some new meds! Here’s a new antibiotic, a steroid shot, and how about some promethehzyne with codiene!” And I was like “umm I don’t need that I don’t have a sore throat” and he gave it to me anyways. (That probably sums up the problems with the American health system) but everyone was a tad perplexed with it and was like ya know this dry cough is going around and I don’t know what else it is so it must be bronchitis. Maybe I’m crazy - no one else was deadly ill and I have a weekly group I meet with and none of them got sick so IDK."
2020-03-05,dungeon-lizard,ChapoTrapHouse,8,https://www.reddit.com/r/ChapoTrapHouse/comments/fe6sup/anybody_watching_the_snakes_interview_with_maddow/fjm6yq8/,Coronavirus? I sleep. Someone calling me a shitty person because I want to deny poor people free healthcare? REAL SHIT ?
2020-03-05,AnalogRobber,Retconned,8,https://www.reddit.com/r/Retconned/comments/fe6qy7/apparently_the_2009_swine_flu_infected_up_to_50/fjm6z64/,Whoa whoa whoa 1 in 6 people had this thing? I don't ever remember 50 million Americans coming down with swine flu. If 50 million Americans came down with coronavirus the entire country would completely shut down....wtf is this
2020-03-05,LivingFortune,ChapoTrapHouse,8,https://www.reddit.com/r/ChapoTrapHouse/comments/fdpyr6/pokemon_shield_my_eyes_from_all_your_awful_posts/fjm79mx/,Go to Michigan if that’s an actual option. Unless you have coronavirus.
2020-03-05,theAlChemist233,Coronavirus,8,https://www.reddit.com/r/Coronavirus/comments/fe4cqw/masks_do_work_and_any_type_of_mask_is_better_than/fjm9yz0/,I heard (from an epidemiology nurse) that the reason masks don't work very well is because the coronavirus has a long lifetime on inanimate objects so you're more likely to get it from touching something than from aerial transmission.
2020-03-05,lucific_valour,funny,8,https://www.reddit.com/r/funny/comments/fe4qud/how_is_this_possible/fjmdrva/,Yeah this ain't a coronavirus thing: It's just a normal day at Costco.
2020-03-05,armsugar,Coronavirus,8,https://www.reddit.com/r/Coronavirus/comments/fdzajw/official_gives_advice_to_not_touch_face_then/fjkqg4y/,*PornHub adds Coronavirus as a new category.*
2020-03-05,DanteandRandallFlagg,thanosdidnothingwrong,8,https://www.reddit.com/r/thanosdidnothingwrong/comments/fdv61f/i_did_everything_wrong_but_i_was_right/fjkvm7l/,"That is 6.75% of the people tested to have the coronavirus. As we are hardly testing any one for it in the US, I think it safe to assume that no one has the virus."
2020-03-05,sk8er4514,houston,8,https://www.reddit.com/r/houston/comments/fe1ut6/harris_county_reports_first_two_cases_of_covid19/fjlgmjw/,"Children haven't been affected much at all. Check out deaths sorted by age.

https://www.worldometers.info/coronavirus/coronavirus-age-sex-demographics/"
2020-03-05,danyma,China_Flu,8,https://www.reddit.com/r/China_Flu/comments/fe2kqo/warning_from_milan_10_of_patients_in_icu/fjlkcef/,"March 1 - ...140 of which (representing 9% of active cases) are in intensive care.

March 2 - ...166 of which (representing 9% of active cases) are in intensive care.

March 3 -  ...229 of which (representing 10% of active cases) are in intensive care.

March 2 -  ...295 of which (representing 11% of active cases) are in intensive care

March 5 -  ...331 of which (representing 11% of active cases) are in intensive care

[Source](https://www.worldometers.info/coronavirus/#countries)"
2020-03-05,surecmeregoway,ireland,8,https://www.reddit.com/r/ireland/comments/fe1fzs/coronavirus_now_13_people_have_covid19_in_the/fjlni7b/,"They have. Mostly. But they did that by taking extraordinary measures. Lockdowns. Fever clinics. Isolation centres. Road stops with temperature checks. We're talking [200 CT scans per machine per day](https://cn.nytimes.com/health/20200305/coronavirus-china-aylward/dual/) with multiple machines running per hospital at the height of it in order to detect lung abnormalities in patients. 

... and 15 million people in Wuhan on lockdown ordering food online and having it delivered."
2020-03-05,HonestPlane,soccer,8,https://www.reddit.com/r/soccer/comments/fe0703/daily_discussion_20200305/fjln32n/,"Never underestimate the power of Liverpool fans. They are everywhere, arguably as bad as the coronavirus itself."
2020-03-05,zombiesingularity,ChapoTrapHouse,8,https://www.reddit.com/r/ChapoTrapHouse/comments/fdpyr6/pokemon_shield_my_eyes_from_all_your_awful_posts/fjlnpsc/,"Spread coronavirus fear pls, old are particularly vulnerable young can overcome it without any medical treatment."
2020-03-05,BurningKiwi,neoliberal,8,https://www.reddit.com/r/neoliberal/comments/fdrhww/discussion_thread/fjlr775/,"BERNIE SANDERS MEDICARE FOR ALL WILL CURE CORONAVIRUS, JACOBIN ANALYSIS SAYS"
2020-03-05,AvidLerner,Coronavirus,8,https://www.reddit.com/r/Coronavirus/comments/fdxxr6/trump_says_he_thinks_34_coronavirus_death_rate_is/fjkgzo6/,"""President Trump said in an interview Wednesday night that the 3.4% mortality rate for coronavirus cited by the director of the World Health Organization is a ""false number,"" and he also said that he thought people infected with coronavirus may get better ""by sitting around and even going to work."" 

The average mortality rate for influenza is 0.1%. This mortality rate should get people's attention, that believe covid 19 is no more deadly than the flu.

The WHO mortality rate for covid 19 is 3.4%."
2020-03-05,albinootter,neoliberal,8,https://www.reddit.com/r/neoliberal/comments/fdrhww/discussion_thread/fjlishi/,Guys help is the coronavirus manufactured or severely under reported. I need to know which conspiracy I want to support.
2020-03-05,ProbablyMyJugs,AmItheAsshole,8,https://www.reddit.com/r/AmItheAsshole/comments/fdxmpi/aita_for_telling_a_coworker_she_isnt_special/fjl81s9/,"No, I can’t. Because I know how miserable having a chronic illness is even though I don’t have one. And she is immunocompromised. She has reason to be worried about coronavirus."
2020-03-05,swagmaster600_gang,wallstreetbets,8,https://www.reddit.com/r/wallstreetbets/comments/fe22hg/what_are_your_moves_tomorrow_march_06_2020/fjlrcxt/,"Coronavirus confirmed 30 minutes from where I live, will I be the first autist to get it?"
2020-03-05,InternetDude_,starbucks,8,https://www.reddit.com/r/starbucks/comments/fe3ghq/my_skin_today_after_an_8hr_shift/fjlu5q1/,"Barista's choice:

Cracked hands vs. CoronaVirus."
2020-03-05,MediocreBandito,Coronavirus,8,https://www.reddit.com/r/Coronavirus/comments/fe39kx/pretty_stark_statement_from_a_kaiser_nurse_in/fjlt1qv/,"[The recommended PPE is not a full body latex suit. It’s gloves, gowns, eye/face protection, and a respirator.](https://www.cdc.gov/coronavirus/2019-ncov/infection-control/control-recommendations.html?CDC_AA_refVal=https%3A%2F%2Fwww.cdc.gov%2Fcoronavirus%2F2019-ncov%2Fhcp%2Finfection-control.html)"
2020-03-05,terrymcginnisbeyond,startrek,8,https://www.reddit.com/r/startrek/comments/fe4qk7/spocks_vulcan_salute_should_replace_handshakes_in/fjlsv37/,"\> coronavirus era

? 

Christ, people are getting hysterical."
2020-03-05,SEAinLA,Coronavirus,8,https://www.reddit.com/r/Coronavirus/comments/fdyt1k/in_one_of_the_worst_seasons_2018_for_flu_it/fjko2tv/,How about the people who died from coronavirus before testing was available whose causes of death were attributed to other or unknown causes?
2020-03-05,Danielrh9,bonnaroo,8,https://www.reddit.com/r/bonnaroo/comments/fdyq4e/corona_virus_confirmed_in_tn/fjknxaj/,"Some important information to remember:

Someone getting the virus is in NO WAY lethal.  If you're under 40 years old like most of us are, you have less than half a percentage point chance of it being lethal.  For comparison, you have a far greater chance of getting killed in your car on your way to work:

(Source: https://www.worldometers.info/coronavirus/coronavirus-age-sex-demographics/)

Panicking over this is a bad idea.  The only group that hysteria does any good are for the new sources looking for clicks and ad sales.

Wash your hands, be mindful of your surroundings, and you're going to be just fine."
2020-03-05,beeboprob,wallstreetbets,8,https://www.reddit.com/r/wallstreetbets/comments/fdjqhh/what_are_your_moves_tomorrow_march_05_2020/fjj7s98/,"LMAO 

https://www.google.com/amp/s/thehill.com/homenews/house/486013-gaetz-tweets-photo-of-him-in-a-gas-mask-reviewing-the-coronavirus-supplemental%3famp"
2020-03-05,misterjefe83,wallstreetbets,8,https://www.reddit.com/r/wallstreetbets/comments/fdjqhh/what_are_your_moves_tomorrow_march_05_2020/fjj6gqy/,"https://www.reuters.com/article/us-health-coronavirus-southkorea-toll/south-korea-declares-new-special-care-zone-as-coronavirus-spreads-idUSKBN20S04O

i know everyone is tired of beer virus but i don't see how this could not affect the US in any way unless we somehow got the super lame version of the virus.

SK is probably at the forefront of actually actively testing everyone, that's why their #'s are fucking high but also has a low death rate.  the issue is with the hospital beds and not overwhelming the system but doing it gradually.  what the fuck measures are we taking?  payce."
2020-03-05,Dnagle7,Coronavirus,8,https://www.reddit.com/r/Coronavirus/comments/fdpxqn/doctor_in_portland_says_they_have_no_tests_for/fjj7ofd/,"Quote from Politico article from 2/4/20.


""The virus has sickened some 20,900 people worldwide and killed at least 427, almost all in China. The FDA late Tuesday granted emergency authorization to distribute a diagnostic test for the virus to public health laboratories around the country. The move eliminates the need to confirm cases by sending samples to the CDC's headquarters in Atlanta.""

So what happened? Where are the tests? This is a giant scandal with life amd death consequences!!


https://www.politico.com/news/2020/02/04/coronavirus-quaratine-travel-110750"
2020-03-05,CrankyyFrankie,wallstreetbets,8,https://www.reddit.com/r/wallstreetbets/comments/fdjqhh/what_are_your_moves_tomorrow_march_05_2020/fjjaika/,"Orcl tendies look good since they’re beer virus immune and 70% of revenue is reoccurring! & An analyst at Societe Generale upgraded Oracle to “buy” from “hold,” citing the stock’s “large discount vs. peers.” The analyst also thinks Oracle will be less impacted by the coronavirus than other companies in the space, given that two-thirds of revenue is recurring “thanks to its maintenance and cloud businesses.” Price Target is $61 and earning haven’t been priced in ! Earnings is March 12th !

Edit: March 16th is earnings !"
2020-03-05,hsdad,mildlyinteresting,8,https://www.reddit.com/r/mildlyinteresting/comments/fdqxge/the_walmart_near_me_started_putting_cereal_in_the/fjjakuq/,It’s their way of trying to hide the panic buying due to coronavirus.
2020-03-05,harajuku_bblgm,Coronavirus,8,https://www.reddit.com/r/Coronavirus/comments/fdzib9/germany_caritas_workshop_ensures_supply_of/fjkrq0f/,"Translation:

Almost 300 people with physical or mental disabilities work in Altenoythe (district of Cloppenburg) in the Caritas workshops. They normally produce parts for car couplings and sterile cans for medical products. 

But now they have a new order: In case surgical clothing for the hospitals in the region could not be supplied from China in the coming months due to the coronavirus, they are to provide supplies and sew mouth masks for the hospitals. 

According to production manager Christian Willer, the masks sewn by Caritas have a clear advantage over conventional products. They are recyclable, disinfectable and can be washed at higher temperatures. The seamstresses at the workplace have already sewn more than 3,000 protective masks, gowns and surgical caps are to follow."
2020-03-05,wadenelsonredditor,China_Flu,8,https://www.reddit.com/r/China_Flu/comments/fdzthy/based_on_virus_characteristics_alone_sarscov2_is/fjkwnxm/,"Counterpoint:  1918 flu had hemorrhagic features not displayed by COVID-19.  Victims were bleeding out of their eyes, ears, noses, massive cyanosis among victims to where whites couldn't be distinguished from blacks - they were ALL blue. 

There was also significant neurological impairment in MANY victims, from delusions to mania to dementia, cognitive & motor impairment.    Haven't seen MUCH of that in Chinese accounts---- yet!

There are accounts of soldiers in Kansas dying within 12 hours of displaying initial symptoms. Nothing I've read in the Chinese accounts matches that sort of speed.

Your post is excellent but you probably want to get ahold of a copy of ""the Great Epidemic"" by John Barry and read it before further comparing the two.

Former EMT here, Biomed Engineer Vanderbilt, Married to an MD, and have spent 10+ hours a day reading about Coronavirus for 2+ weeks.  Diagnosis:  Obsessed."
2020-03-05,waffleboardedburrito,maybemaybemaybe,8,https://www.reddit.com/r/maybemaybemaybe/comments/fdu22m/maybe_maybe_maybe/fjkwsfj/,Do you have any thoughts on the coronavirus?
2020-03-05,Artistic-Explanation,Enough_Sanders_Spam,8,https://www.reddit.com/r/Enough_Sanders_Spam/comments/fdsn5l/daily_political_discussion_roundtable_03052020/fjl4hwa/,"*heavy metal starts playing*

*coronavirus in shambles*

#DOOM ETERNAL BAYBEE"
