date,author,subreddit,score,url,text
2020-04-19,bhdbvd,Coronavirus,2,https://www.reddit.com/r/Coronavirus/comments/g4b9r1/coronavirus_has_now_killed_more_people_in_us_than/fnxc5fo/,"I saw some idiot on Facebook saying that the reason there's so many positive tests is that anyone with any coronavirus (which is common) is getting a positive result, not *just* those with covid-19. I'd assume they'll have a similar reasoning for deaths."
2020-04-19,F812SuperFast,Thank_China,2,https://www.reddit.com/r/Thank_China/comments/g4cqnw/why_china_is_losing_the_coronavirus_narrative_it/fnxbmng/,"here's the full article:

When Roger Roth received an email from the Chinese government asking him to sponsor a bill in the Wisconsin state legislature praising China’s response to coronavirus, he thought it must be a hoax. The sender had even appended a pre-written resolution full of Communist party talking points and dubious claims for the Wisconsin senate president to put to a vote.  “I’ve never heard of a foreign government approaching a state legislature and asking them to pass a piece of legislation,” Sen Roth told me last week. “I thought this couldn’t be real.” Then he discovered it was indeed sent by China’s consul-general in Chicago. “I was astonished . . .\[and\] wrote a letter back: ‘dear consul general, NUTS’.”  It is impossible to see this episode as anything but another disastrous own goal in Beijing’s attempts to boost its global standing in the time of coronavirus.  From the deplorable treatment of African citizens in southern China to the export of faulty medical equipment, or the official endorsement of conspiracy theories blaming the US military for the outbreak, most of the Communist party’s efforts to control the international narrative have backfired.  Some assume the west’s chaotic and early response allows China to step into the global governance vacuum. Even allowing for questionable data, China has so far reported under 5,000 deaths, versus almost 30,000 in the US and nearly 20,000 each in Italy and Spain. But Beijing’s attempts to take advantage of the situation are more likely to leave it isolated and distrusted on the world stage when the crisis recedes.  Wang Jisi, a legendary scholar at Peking University, says the virus fallout has pushed Sino-US relations to their worst level since formal ties were established in the 1970s. He describes bilateral economic and technological decoupling as “already irreversible”.  The shift has been striking in the UK too, where influential Conservatives have called on the prime minister to be tougher on China, the British press has become more critical, and intelligence agencies have promised to focus on the threat from Beijing. In Europe and Australia, governments have rushed to block Chinese companies from buying assets cheaply amid economic carnage. And Tokyo has set aside $2.2bn explicitly to help Japanese companies move their supply chains out of China.  But it is not just the US and its allies that have soured on Beijing. North Korea, China’s only treaty ally, was the first country to close its northern border at the start of the outbreak, despite Beijing’s objections to international travel bans. Russia quickly followed. Even Iranian officials have criticised China for hiding the extent of the outbreak.  Some of the criticism is clearly unfair. Populist western politicians such as US president Donald Trump have attacked Beijing to deflect and distract from their own failings. There is also a hint of racism in the calls to shut down “disgusting wet markets”. But Beijing could have gained far more sympathy if it had switched quickly to a strategy of transparency and co-operation. Instead, it arrested people who criticised its cover-up, and launched a global propaganda campaign to raise doubts about the Chinese origin of the virus and assert the superiority of its authoritarian system.  Many multinational companies have been badly burnt since Beijing effectively sealed its borders and cancelled visas last month. The expulsion of much of the US press corps from Beijing will also harden international attitudes. China’s main government mouthpiece has even threatened to withhold medical supplies and block medical exports to the US so it can “cast America into a novel coronavirus hell”. Coronavirus: Ian Bremmer on tackling a global pandemic in a leaderless world  All this will accelerate calls in Washington and elsewhere for rapid decoupling from Chinese supply chains. This apparently self-defeating behaviour makes more sense when you consider the domestic political context.  This is the biggest crisis that President Xi Jinping has faced since he took power in 2012. The Communist party’s legitimacy has been damaged by early mistakes and the crackdown that followed. Mr Xi knows the coming economic crisis will erode support further. In the 2008 financial crisis, Beijing identified 8 per cent annual growth as the minimum to stave off social unrest. China’s economy shrank 6.8 per cent in the first quarter of this year.  Doubling down on vituperative nationalism can distract the populace, even if it damages China’s global reputation in the medium term. That explains why diplomats risked turning someone such as Senator Roth, a hitherto neutral bystander or even potential ally of Chinese trade diplomacy, into an enemy.  China’s goal was to publicise the resolution in state propaganda to validate party rule back home. But now the Wisconsin senator plans a very different bill. While praising the Chinese people, it will “strip the brutal Chinese Communist party naked for the world to see . . . as well as the damage it has done to the whole world through covering up this coronavirus,” Sen Roth said. It is likely to pass with a hefty majority."
2020-04-19,MediaShatterSeaStill,POLITIC,2,https://www.reddit.com/r/POLITIC/comments/g481mh/msnbc_spends_an_entire_segment_talking_about_how/fnx2jnk/, [https://www.axios.com/coronavirus-protest-social-distancing-1bc7fb5a-b94c-471e-adf2-c50bfad4f242.html](https://www.axios.com/coronavirus-protest-social-distancing-1bc7fb5a-b94c-471e-adf2-c50bfad4f242.html)  Look at how awesome these parties are. Demotards are just jealous that we know this whole thing is a fucking hoax
2020-04-19,segwayistheway,bullcity,2,https://www.reddit.com/r/bullcity/comments/g4ewiy/dirt_bikes_and_4_wheelers/fnx46zn/,"You can see them every Sunday when it's nice weather. They've been doing it for years. They were also wearing face masks since before the coronavirus, so perhaps we all have something to learn. However, it's terrifying to be caught amongst them on the street as they are incredibly unsafe. It  happened to me on N Roxboro by Guess and I felt like any moment one of them would flip off their bike and I would end up hitting and killing a teen with my car. If you see one of them look in your rear view mirror to check for more and pull over to let them pass.

\*Edit: I think they go by ""Bikes Up, Guns Down"""
2020-04-19,Franco_Seven,stimuluscheck,2,https://www.reddit.com/r/stimuluscheck/comments/g4fdga/so_fuck_social_security_ooorrr/fnx4kyr/,">**I receive a Form SSA-109 or RRB-1099 and do not file a tax return because I don't meet the income requirement to file. Can I use Get My Payment to provide my bank information to receive my EIP by direct deposit.**  
>  
>You will not be able to use Get My Payment to provide your bank account  information because you did not file tax returns for 2018 or 2019. The IRS will use the information on the Form SSA-1099 or Form RRB-1099 to  generate your payment. You will receive your payment as a direct deposit or by mail, just as you would normally receive your benefits.

[https://www.irs.gov/coronavirus/get-my-payment-frequently-asked-questions](https://www.irs.gov/coronavirus/get-my-payment-frequently-asked-questions)

Non-filers who receive social security haven't been able to access their payment status. Only social security individuals who have filed taxes."
2020-04-19,chengjih,Coronavirus,2,https://www.reddit.com/r/Coronavirus/comments/g4b9r1/coronavirus_has_now_killed_more_people_in_us_than/fnx2l1z/,"[The Stanford study has flaws](https://statmodeling.stat.columbia.edu/2020/04/19/fatal-flaws-in-stanford-study-of-coronavirus-prevalence/).

On the face of this, the 0.1% number can't be true given what's happening here in NYC.  We've had 10,000 deaths (and counting) in a city of 8.5M people.  That would imply everyone here has had exposure to the virus at this point, which is obviously false.  Even with the higher 0.3% number, we're talking about something close to half the city being infected.

For comparison, Columbia University recently looked at all their maternity patients and found around 13% testing antigen positive.  This population is also likely to have more contact with the medical system over the course of the pregnancy, so their numbers might be a bit higher, but that's not too bad for a rough random sample.  Ballparking around 10% of the population of NYC being exposed at this point would roughly fit the 10,000 deaths figure and a fatality rate of above 1%."
2020-04-19,OutrageousFile,moderatepolitics,2,https://www.reddit.com/r/moderatepolitics/comments/g4cgzx/covid19_infection_fatality_rate_estimate_of_01036/fnx4d5a/,"Someone else just posted this article earlier which goes into it https://www.reuters.com/investigates/special-report/health-coronavirus-usa-cost/

Suicide is definitely a big one: ""In Europe and the United States, suicide rates rise about 1% for every one percentage point increase in unemployment, according to research published by lead author Aaron Reeves from Oxford University""

But even just years lost off your life: ""An extended freeze of the economy could shorten the lifespan of 6.4 million Americans entering the job market by an average of about two years, said Hannes Schwandt, a health economics researcher at Northwestern University, who conducted the study with von Wachter"""
2020-04-19,66herobrine66,legaladviceofftopic,2,https://www.reddit.com/r/legaladviceofftopic/comments/g4ejog/is_it_legal_in_the_us_to_sell_native_tadpoles/fnx2i18/,"I don't think anyone with authority will care if you sell tadpoles on Ebay. Ebay might not let you sell live animals, but I'm pretty sure the cops will have much bigger problems than someone selling tadpoles online, especially with the Coronavirus."
2020-04-19,realsiebird,LockdownSkepticism,2,https://www.reddit.com/r/LockdownSkepticism/comments/fwk3l0/megathread_use_this_post_to_share_the/fnx2u1h/,"Parents laid off, no money coming in. School shut down, and I have to wait in line to GO INSIDE A WALMART? This is after my entire family already got the virus and got better. I've always been left so don't tell me only conservative babies are mad.

Coronavirus was overblown from the start, nobody actually gets tested because most of us only get a light cough. Completely pointless lockdown. We're gonna look like idiots when all this is over."
2020-04-19,FrickUSADA,MMA,2,https://www.reddit.com/r/MMA/comments/g4191k/official_general_discussion_thread_april_19_2020/fnx2zps/,"> People still are under the assumption that Disney put the stop to this. They certainly did not, the governor made them stop

this exactly, two weeks ago Dana said he was pulling the event due to pressure from the higher ups and like 3 days ago [they filed trademarks](https://mmajunkie.usatoday.com/2020/04/ufc-files-trademarks-fight-island-mma-legal-coronavirus) for 'Fight Island'"
2020-04-19,Soleil_Noir,Coronavirus,2,https://www.reddit.com/r/Coronavirus/comments/g4dgqt/louisiana_is_in_a_much_better_place_today_than_we/fnx39bu/,"While it might sound unbelievable for a southern state to be doing better than expected, they locked things down back in mid-March. For these reasons, we weren't hit as hard as people were expecting. Social distancing was followed by many, if not most, citizens. Schools were shut down around March 17th. All but essential businesses were shut down, curfews were implemented. Our governor even extended this until end of April, hopefully he extends again.

No one is hiding the data, there's no reason for it, and they set up a website to show what was happening here as soon as this all began, when we got our first reported cases.

http://ldh.la.gov/Coronavirus/"
2020-04-19,Bbrhuft,Coronavirus,2,https://www.reddit.com/r/Coronavirus/comments/g47edo/1_in_1000_new_york_city_residents_have_now_died/fnx4jxx/,"Title from article v's Title from submission

>1 in 1000 New York City residents have now  died from Coronavirus  
>  
>1 in 1000 New York City residents have now died from Coronavirus

There is a double space between 'now' and 'died' in the original title."
2020-04-19,kesm30,Anxiety,2,https://www.reddit.com/r/Anxiety/comments/fnz5n3/coronavirus_discussion_thread/fnxd17s/,"I read that article today, too (was that the “we spoke with 20 experts..” article?) - I freaked out. My husband, ever the pragmatist, said a few things that helped: 1. You are mistaken if you think everything you read has only the sole purpose of ‘reporting the facts.’ 2. There were probably 30+ more experts who had things to say that didn’t fit the narrative of the article. 3. No one, including all the experts, knows what will happen next. We are learning more and more about this virus every day. Experts are being cautious, laying out what they believe to be worst case scenario, but they aren’t alluding to all the great work that’s being quietly done because who knows what will pan out. 4. That article made mention of only 3 vaccine candidates in trials; that was a lie at worst and an omission at best. There are 200+ vaccine and treatment candidates in clinical trials, with more being added (by the US!) every day. A woman — the foremost expert on coronavirus vaccines — at Oxford is 80% sure her vaccine (a slight tweak of an existing one) will work and is working with the UK government to begin developing/producing and have a large number of doses (1m?) ready by September. The article even discussed repurposes various manufacturing facilities to help churn out vaccinesx

As a result of this article, today I vowed to stop reading the news until June 1. But I can’t help but visit my fave reddit thread 😊"
2020-04-19,risenanew,neoliberal,2,https://www.reddit.com/r/neoliberal/comments/g46i3k/democrats_enthusiasm_up_by_8_points_highest_in_8/fnxehc8/,"I definitely can see rising enthusiasm to vote among the Democrats I know. I'm serious when I say that I would sprint naked through a crowd of coughing coronavirus patients in order to vote against Trump -- and I live in possibly the safest blue state in the country! (FFS, AOC is my damn representative!)

And since I know my vote won't count for much, I've pledged to donate at least $100 of every paycheck I get to Biden, to phone-bank over the summer/fall, and to write post-cards for voters as well.

If anyone has any other ideas of what else I can do to help, I'm happy to hear them. I want Trump and the rest of his awful party out out OUT of power this fall!"
2020-04-19,prozaczodiac,budtenders,2,https://www.reddit.com/r/budtenders/comments/g35qg9/a_budtenders_essential_observations_during_the/fnxdxdc/,"Thank you for posting this. I have been sort of looking for something online that echoes this sentiment that I have personally felt, but can't express, especially in my work environment. 

As other essential workers have communicated to me, I feel torn between appreciating I have a job and being upset by my working conditions. The notion that budtenders are the ""front lines"" for this industry predates the Coronavirus. There is a real disconnect between our experiences and that of management. 

I was told the other day that transactions can be completed within just a couple minutes, which shocked me considering each one takes at least three times that when factoring in running in and out of the building once, twice, or even three times for order corrections. This running in and out has reinvigorated old injuries and health conditions. I am running in the heat, sweating, sometime dizzy and in the rain, socks soaked and cold. I am literally doing things that make you sick. 

I have accepted I will eventually get sick and looking forward to it is scary. On top of it all, I'm not making tips like I was and customers are always giving me crap for not being able to come inside. Or they are just plain unappreciative and agitated by the state of things. It has been infuriating for me at times and I have struggled to keep my composure."
2020-04-19,314z,CoronavirusUS,2,https://www.reddit.com/r/CoronavirusUS/comments/g4g0ft/how_the_economy_will_look_post_covid19/fnxeegq/,"Put a dot after the com - works on many sites, breaks up on reddit so paste from below

    https://foreignpolicy.com./2020/04/15/how-the-economy-will-look-after-the-coronavirus-pandemic/"
2020-04-19,scholarandrogue,Conservative,2,https://www.reddit.com/r/Conservative/comments/g47xhc/well_this_doesnt_add_up_i_declare_shenanigans/fnxemzq/,"The WHO creates  the diagnostics codes for covid19, which are licensed out, and there are parameters. The CDC implements WHO codes and policy in the US. Dr. Shiva claims there are no diagnostic codes for negative test results. So negative test results cannot be recorded as covid19 negative

https://www.who.int/classifications/icd/covid19/en/ 
Emergency use ICD codes for COVID-19 disease outbreak
 The COVID-19 disease outbreak has been declared a public health emergency of international concern.
 An emergency ICD-10 code of ‘U07.1 COVID-19, virus identified’ is assigned to a disease diagnosis of COVID-19         confirmed by laboratory testing.
 An emergency ICD-10 code of ‘U07.2 COVID-19, virus not identified’ is assigned to a clinical or epidemiological         diagnosis of COVID-19 where laboratory confirmation is inconclusive or not available.
 Both U07.1 and U07.2 may be used for mortality coding as cause of death. See the International guidelines for         certification and classification (coding) of COVID-19 as cause of death following the link below.
In ICD-11, the code for the confirmed diagnosis of COVID-19 is RA01.0 and the code for the clinical diagnosis         (suspected or probable) of COVID-19 is RA01.1.
International guidelines for certification and classification (coding) of COVID-19 as cause of death
    pdf, https://www.who.int/classifications/icd/Guidelines_Cause_of_Death_COVID-19.pdf?ua=1 

COVID-19 coding in ICD-10 [p. 1]
4WHO COVID-19 Case definitions for Global Surveillance124 March 2020
""Confirmed cases A confirmed case is a person with laboratory confirmation of infection with the COVID-19 virus, irrespective of clinical signs and symptoms.1 https://www.who.int/publications-detail/global-surveillance-for-human-infection-with-novel-coronavirus-(2019-ncov)
Suspected cases  A) a patient with acute respiratory illness (that is, fever and at least one sign or symptom of respiratory disease, for example,  cough or shortness of breath) AND with no other etiology that fully explains the clinical presentation AND a history of travel to or residence in a country, area or territory that has reported local transmission of COVID-19 disease during the 14 days prior to symptom onset 
OR B) a patient with any acute respiratory illness AND who has been a contact of a confirmed or probable case of COVID-19 disease during the 14 days prior to the onset of symptoms 
OR C) a patient with severe acute respiratory infection (that is, fever and at least one sign or symptom of respiratory disease, for example, cough or shortness breath) AND who requires hospitalization AND who has no other etiology that fully explains the clinical presentation. Probable case  A probable case is a suspected case for whom the report from laboratory testing for the COVID-19 virus is inconclusive."" [p. 4] 

https://www.who.int/classifications/icd/COVID-19-coding-icd10.pdf?ua=1 
WHO/HQ/DDI/DNA/CATINTERNATIONAL GUIDELINES FOR CERTIFICATION AND CLASSIFICATION (CODING) OF COVID-19AS CAUSE OF DEATH  WHO/HQ/DDI/DNA/CAT
2. DEFINITION FOR DEATHS DUE TOCOVID-19 
""A death due toCOVID-19 is defined for surveillance purposes as a death resulting from a clinically compatible  illness,in  a  probable  or  confirmed  COVID-19  case,unless  there  is  a  clear  alternative cause of death that cannot be related to COVID disease (e.g. trauma). There should be no period of complete recovery from COVID-19 between illness and death"". [p. 3, para. 1]

https://www.who.int/classifications/icd/Guidelines_Cause_of_Death_COVID-19.pdf?ua=1 
COVID-19 Alert No. 2March 24, 2020 
""The WHO has provided a second code, U07.2, for clinical or epidemiological diagnosis of COVID-19 where a laboratory confirmation is inconclusive or not available.  Because laboratory test results are not typically reported on death certificates in the U.S., NCHS is not planning to implement U07.2 for mortality statistics."" [para. 4]

I found the real time diagnostics panel published by the CDC march 30, 2020. https://www.fda.gov/media/134922/download  
on page one it reads: 
""Results are for the identification of 2019-nCoV RNA. The 2019-nCoV RNA is generally detectable in upper and lower respiratory specimens during infection. Positive results are indicative of active infection with 2019-nCoV but do not rule out bacterial infection or co-infection with other viruses. The agent detected may not be the definite cause of disease. Laboratories within the United States and its territories are required to report all positive results to the appropriate public health authorities. 
Negative results do not preclude 2019-nCoV infection and should not be used as the sole basis for treatment or other patient management decisions. Negative results must be combined with clinical observations, patient history, and epidemiological information."" [ p. 1, para. 2,3 ]
If the test is negative for covid19 there still needs to be observation, consideration of patients medical history and epidemiological information. Epidemiological information is used to plan and evaluate strategies to prevent illness and as a guide to the management of patients in whom disease has already developed.
Some patients then might not have covid19 exposure but might still have the same symptoms from a different illness and that might be construed as covid. Or for those that are diagnosed positive it might be a co-infection or bacterial infection.
IMO there is a good probability all cases deemed corona positive might not be accurate  because of testing methods and coding parameters. But something has to be recorded. 

https://www.fda.gov/media/134922/download  
""Results are for the identification of 2019-nCoV RNA. The 2019-nCoV RNA is generally detectable in upper and lower respiratory specimens during infection. Positive results are indicative of active infection with 2019-nCoV but do not rule out bacterial infection or co-infection with other viruses. The agent detected may not be the definite cause of disease. Laboratories within the United States and its territories are required to report all positive results to the appropriate public health authorities. 
Negative results do not preclude 2019-nCoV infection and should not be used as the sole basis for treatment or other patient management decisions. Negative results must be combined with clinical observations, patient history, and epidemiological information."" [ p. 1, para. 2,3 ]
If the test is negative for covid19 there still needs to be observation, consideration of patients medical history and epidemiological information. Epidemiological information is used to plan and evaluate strategies to prevent illness and as a guide to the management of patients in whom disease has already developed.
Some patients then might not have covid19 exposure but might still have the same symptoms from a different illness; or for those that do it might be a co-infection or bacterial infection.

https://greatgameindia.com/whistleblower-how-cdc-is-manipulating-covid-19-death-toll/  
""So even before we heard of COVID-19, death certificates were based on assumptions and educated guesses that go unquestioned.  When it comes to COVID-19 there is the additional data skewer, that is –get this— there is no universal definition of COVID-19 death.  The Centers for Disease Control, updated from yesterday, April 4th, still states that mortality, quote unquote, data includes both confirmed and presumptive positive cases of COVID-19.  That’s from their website.' [para. 5]

Dr. Shiva Ayyadurai and Stefan Molyneux [ pre-existing conditions, test coding and follow the money]
https://www.youtube.com/watch?v=5I46oFxp5L0
This Event Was A Coordinated Last Ditch Effort By The [DS], Moves & Countermoves: Dr. Shiva
https://www.youtube.com/watch?v=WwMLMXV6mcU"
