date,author,subreddit,score,url,text
2020-01-18,blowtorchma,HongKong,1,https://www.reddit.com/r/HongKong/comments/eqeclc/sars_20_i_am_super_worried_hows_the_situation_now/feqb67c/,"The number of people already infected by the mystery virus emerging in China is far greater than official figures suggest, scientists have told the BBC. 
There have been nearly 50 confirmed cases of the new virus, but UK experts estimate the figure is closer to 1,700.
Two people are known to have died from the respiratory illness, which appeared in Wuhan city in December. 
""I am substantially more concerned than I was a week ago,"" disease outbreak scientist, Prof Neil Ferguson, said.
The work was conducted by the MRC Centre for Global Infectious Disease Analysis at Imperial College London, which advises bodies including the UK government and the World Health Organization.
■   'Sars-family' virus claims second victim in China
■   Mystery Chinese virus: How worried should we be?
Singapore and Hong Kong have been screening air passengers from Wuhan and US authorities announced similar measures starting on Friday at three major airports in San Francisco, Los Angeles and New York.
How were the numbers calculated?
The crucial clue to the scale of the problem lies in the cases being detected in other countries.
While the outbreak is centred on the central Chinese city of Wuhan, there have been two cases in Thailand and one in Japan. 
""That caused me to worry,"" said Prof Ferguson.
He added: ""For Wuhan to have exported three cases to other countries would imply there would have to be many more cases than have been reported.""
It is impossible to get the precise number, but outbreak modelling, which is based on the virus, the local population and flight data, can give an idea. 
Wuhan International Airport serves a population of 19 million people, but only 3,400 a day travel internationally.
The detailed calculations, which have been posted online ahead of publication in a scientific journal, came up with a figure of 1,700 cases. 
What does it all mean?
Prof Ferguson said it is ""too early to be alarmist"" but he was ""substantially more concerned"" than a week ago.
Chinese officials say there have been no cases of the virus spreading from one person to another. 
Instead they say the virus has crossed the species barrier and come from infected animals at a seafood and wildlife market in Wuhan. 
Prof Ferguson argues: ""People should be considering the possibility of substantial human-to-human transmission more seriously than they have so far.
""It would be unlikely in my mind, given what we know about coronaviruses, to have animal exposure be the principal cause of such a number of human infections."" 
Understanding how a novel virus is spreading is a crucial part of assessing its threat. 
What is this virus?
Viral samples have been taken from patients and analysed in the laboratory.
And officials in China and the World Health Organization have concluded the infection is a coronavirus.
Coronaviruses are a broad family of viruses, but only six (the new one would make it seven) are known to infect people. 
At the mild end they cause the common cold, but severe acute respiratory syndrome (Sars) is a coronavirus that killed 774 of the 8,098 people infected in an outbreak that started in China in 2002.
Analysis of the genetic code of the new virus shows it is more closely related to Sars than any other human coronavirus. 
The virus has caused pneumonia in some patients and been fatal in two of them.
What do other experts say?
Dr Jeremy Farrar, director of the Wellcome medical research charity, said: ""There is more to come from this epidemic.
""Uncertainty and gaps remain, but it's clear that there is some level of person-to-person transmission. 
""We are starting to hear of more cases in China and other countries and it is likely, as this modelling shows, that there will be many more cases, in a number of countries.""
Prof Jonathan Ball, from the University of Nottingham, said: ""What's really important is until there has been widespread laboratory testing it is very difficult to put a real number on the cases out there. 
""But this is a figure we should take seriously until we know otherwise, 41 animal-to-human 'spillovers' is stretching it a bit and there probably is more underlying infection than has been detected so far.""
Follow James on Twitter."
2020-01-18,baron_eh,news,1,https://www.reddit.com/r/news/comments/eq7htg/the_number_of_people_already_infected_by_the/feqgomi/,[WHO gets confirmation from Japanese Health Ministry of 2019-nCoV](https://www.who.int/csr/don/16-january-2020-novel-coronavirus-japan-ex-china/en/)
2020-01-18,SolusOpes,preppers,1,https://www.reddit.com/r/preppers/comments/eqf4b7/is_it_possible_to_protect_oneself_from_a_viral/fer7rtc/,"It's *just* a coronavirus.

So how did you protect yourself when SARS was the big scare?

Do that again. Because it's just a SARS mutation."
2020-01-18,TheChinaWatcher,China,1,https://www.reddit.com/r/China/comments/eqc6wp/bbc_the_number_of_people_already_infected_by_the/fesrmf8/,"Because, the Thailand Case was directly from Wuhan.

> The case is a 61-year-old Chinese woman **living in Wuhan City**, Hubei Province, China. On 5 January 2020, she developed fever with chills, sore throat and headache. On 8 January 2020, she took a direct flight to Thailand from Wuhan City together with five family members in a tour group of 16 people.

> The patient’s full exposure history is under investigation. **She reported a history of visiting a local fresh market in Wuhan on regular basis prior to the onset of illness on 5 January 2020**; however, she did not report visiting the Huanan South China Seafood Market from where most of the cases were detected. 

> https://www.who.int/csr/don/14-january-2020-novel-coronavirus-thailand-ex-china/en/

All the cases originate in Wuhan with common theme being fish markets. There is limited evidence of huma-to-human transmission. The BBC Article is taking things way out of context."
2020-01-18,autotldr,worldnews,1,https://www.reddit.com/r/worldnews/comments/eqfk0f/china_reports_4_more_cases_in_viral_pneumonia/fercxx2/,"This is the best tl;dr I could make, [original](https://www.sfgate.com/news/medical/article/China-reports-4-more-cases-in-viral-pneumonia-14985549.php) reduced by 72%. (I'm a bot)
*****
> BEIJING - Four more cases have been identified in a viral pneumonia outbreak in the central Chinese city of Wuhan that has killed two people and prompted countries as far away as the United States to take precautionary measures.

> Health authorities are keen to avoid a repeat of SARS, or severe acute respiratory syndrome, another coronavirus that started in southern China in late 2002 and spread to more than two dozen countries, killing nearly 800 people.

> Doctors began seeing a new type of viral pneumonia - fever, cough, difficulty breathing - in people who worked at or visited a food market in the suburbs of Wuhan late last month.


*****
[**Extended Summary**](http://np.reddit.com/r/autotldr/comments/eqg46j/china_reports_4_more_cases_in_viral_pneumonia/) | [FAQ](http://np.reddit.com/r/autotldr/comments/31b9fm/faq_autotldr_bot/ ""Version 2.02, ~459784 tl;drs so far."") | [Feedback](http://np.reddit.com/message/compose?to=%23autotldr ""PM's and comments are monitored, constructive feedback is welcome."") | *Top* *keywords*: **people**^#1 **Wuhan**^#2 **Health**^#3 **cases**^#4 **pneumonia**^#5"
2020-01-18,Lookismer,collapse,1,https://www.reddit.com/r/collapse/comments/eqjyav/a_mysterious_and_deadly_virus_from_china_could/fet3f5f/,Original source http://www.imperial.ac.uk/mrc-global-infectious-disease-analysis/news--wuhan-coronavirus/
2020-01-18,redesoul7,saraba2nd,1,https://www.reddit.com/r/saraba2nd/comments/eqfkm4/外國研究推測截至1月12日武漢約有1700宗病例/ferzp2u/,"南华早报说深圳和上海都有
However, three separate sources have told the South China Morning Post that at least two suspected cases have been reported in the south China city of Shenzhen, and a third in Shanghai, in the east of the country.

来源 https://www.scmp.com/news/china/society/article/3046681/china-coronavirus-least-three-suspected-cases-found-shenzhen"
2020-01-18,GeorgeShadows,worldnews,1,https://www.reddit.com/r/worldnews/comments/eqmcm7/czechs_detect_bird_flu_as_new_europe_outbreak/fevdh53/,"The one in china is a type of coronavirus, bird flu is a type of influenza."
2020-01-18,autotldr,worldnews,1,https://www.reddit.com/r/worldnews/comments/eqbyl8/deadly_mystery_virus_spreads_outside_china_to_new/feplnqr/,"This is the best tl;dr I could make, [original](https://gizmodo.com/mystery-virus-spreads-to-new-countries-outside-china-1841057194) reduced by 84%. (I'm a bot)
*****
> Officials in Thailand first identified the new virus in the country on January 13 and announced a second case today.

> The illness is a coronavirus, part of a large family of viruses that can cause symptoms ranging from that of a common cold to Severe Acute Respiratory Syndrome, more commonly known as SARS. The new 2019-nCoV presents as having pneumonia-like symptoms and 41 people have tested positive for the virus so far, with five people still in critical condition from &quot;Severe infections.""

> Health officials believe that the new virus can only be transmitted from animals to human and that the Huanan Wholesale Seafood Market in Wuhan, which sells live animals, may be the culprit.


*****
[**Extended Summary**](http://np.reddit.com/r/autotldr/comments/eqc5wh/deadly_mystery_virus_spreads_outside_china_to_new/) | [FAQ](http://np.reddit.com/r/autotldr/comments/31b9fm/faq_autotldr_bot/ ""Version 2.02, ~459711 tl;drs so far."") | [Feedback](http://np.reddit.com/message/compose?to=%23autotldr ""PM's and comments are monitored, constructive feedback is welcome."") | *Top* *keywords*: **virus**^#1 **new**^#2 **Health**^#3 **Market**^#4 **Wuhan**^#5"
2020-01-18,1832jsh,HongKong,1,https://www.reddit.com/r/HongKong/comments/eqeclc/sars_20_i_am_super_worried_hows_the_situation_now/feqbffy/,"Well, from what I can gather, it’s a reasonably isolated incident. 

For more information refer to:


https://www.cdc.gov/coronavirus/2019-ncov/index.html


https://www.who.int/csr/don/12-january-2020-novel-coronavirus-china/en/"
2020-01-18,1832jsh,HongKong,1,https://www.reddit.com/r/HongKong/comments/eqeclc/sars_20_i_am_super_worried_hows_the_situation_now/feqaqs4/,Are you referring to the Coronavirus in Wuhan?
2020-01-18,WikiTextBot,MoreTankieChapo,1,https://www.reddit.com/r/MoreTankieChapo/comments/eqa289/theyve_cracked_the_code/feqdmll/,"**2019–20 outbreak of novel coronavirus (2019-nCoV)**

The 2019 – 2020 China pneumonia outbreak, also known as Wuhan pneumonia (Chinese: 武漢肺炎; pinyin: Wǔhàn fèiyán) began in mid-December 2019 in the city of Wuhan in central China, as an emerging cluster of people with pneumonia of unknown cause, linked primarily to stallholders who worked at the Huanan Seafood Market (華南海鮮市場), which sold live animals. Chinese scientists subsequently isolated a new coronavirus, the 2019-nCoV, which has been found to be at least 70% similar in genetic sequence to SARS-CoV, and later mapped and made available its gene sequence.The first suspected cases were reported on 31 December 2019, with the first symptoms appearing just over three weeks earlier on 8 December 2019. The market was closed off on 1 January 2020, those affected were isolated, and over 700 close contacts, including more than 400 healthcare workers were subsequently monitored. With the development of a specific diagnostic PCR test for detecting the infection, the presence of 2019-nCoV was then confirmed in 41 people in the Wuhan cluster, of which two were later reported to be a married couple, one of whom had not been to the market, and another three who were members of the same family that worked at the market's seafood stalls.

***

^[ [^PM](https://www.reddit.com/message/compose?to=kittens_from_space) ^| [^Exclude ^me](https://reddit.com/message/compose?to=WikiTextBot&message=Excludeme&subject=Excludeme) ^| [^Exclude ^from ^subreddit](https://np.reddit.com/r/MoreTankieChapo/about/banned) ^| [^FAQ ^/ ^Information](https://np.reddit.com/r/WikiTextBot/wiki/index) ^| [^Source](https://github.com/kittenswolf/WikiTextBot)   ^]
^Downvote ^to ^remove ^| ^v0.28"
2020-01-18,itsveronicalodge,news,1,https://www.reddit.com/r/news/comments/eq7htg/the_number_of_people_already_infected_by_the/feqeump/,"It’s a new virus within the coronavirus family, most closely resembling SaRS (also a coronovirus)"
2020-01-18,GauMatri,newsNepal,1,https://www.reddit.com/r/newsNepal/comments/eqow42/५_मघ_२०७६_आइतवर_बहनक_०६_००/fev56bf/,"China reports new Wuhan virus cases ahead of key holiday
* [Link](https://thehimalayantimes.com/lifestyle/health/china-reports-new-wuhan-virus-cases-ahead-of-key-holiday/)

* Summary: <p>Chinese health authorities said on Saturday they had discovered four more cases of pneumonia following an outbreak of what is believed to be a new coronavirus strain in the central city of Wuhan, raising concerns that the disease could spread further.</p>
<p>The post <a rel=""nofollow"" href=""https://thehimalayantimes.com/lifestyle/health/china-reports-new-wuhan-virus-cases-ahead-of-key-holiday/"">China reports new Wuhan virus cases ahead of key holiday</a> appeared first on <a rel=""nofollow"" href=""https://thehimalayantimes.com"">The Himalayan Times</a>.</p>

* Description: [VIEW SOURCE](https://thehimalayantimes.com/lifestyle/health/china-reports-new-wuhan-virus-cases-ahead-of-key-holiday/)"
2020-01-18,F6_GS,worldnews,1,https://www.reddit.com/r/worldnews/comments/eq7s7p/the_number_of_people_already_infected_by_the/fetrkis/,World war z (2006) could well have been inspired by the last time a pneumonia-inducing coronavirus outbreak was covered up by China (SARS in 2003)
2020-01-18,-IntoTheVoid-,China,1,https://www.reddit.com/r/China/comments/eqdujb/report_over_1700_infected_with_chinese_virus/feqliug/,"Primary source: [http://www.imperial.ac.uk/mrc-global-infectious-disease-analysis/news--wuhan-coronavirus/](http://www.imperial.ac.uk/mrc-global-infectious-disease-analysis/news--wuhan-coronavirus/)

**Summary**

We estimate that a total of 1,723 cases of 2019-nCoV in Wuhan City (95% CI: 427 – 4,471) had onset of symptoms by 12th January 2020 (the last reported onset date of any case).

This estimate is based on the following assumptions:

* Wuhan International Airport has a catchment population of 19 million individuals \[1\].
* There is a mean 10-day delay between infection and detection, comprising a 5-6 day incubation period \[8,9\]  and a 4-5 day delay from symptom onset to detection/hospitalisation of a case (the cases detected in Thailand and Japan were hospitalised 3 and 7 days after onset, respectively) \[4,10\].
* Total volume of international travel from Wuhan over the last two months has been 3,301 passengers per day. This estimate is derived from the 3,418 foreign passengers per day in the top 20 country destinations based on 2018 IATA data \[11\], and uses 2016 IATA data held by Imperial College to correct for the travel surge at Chinese New Year present in the latter data (which has not happened yet this year) and for travel to countries outside the top 20 destination list.

**Caveats**

1. We assume that outbound trip durations are long enough that an infected Wuhan resident travelling internationally will develop symptoms and be detected overseas, rather than being detected after returning to Wuhan. We also do not account for the fact that international visitors to Wuhan (such as the case who was detected in Japan) might be expected to have a shorter duration of exposure and thus a lower infection risk than residents. Accounting for either factor correctly requires additional data but would increase our estimate of the total number of cases.
2. We estimate the potential number of symptomatic cases with disease severity of a level requiring hospitalisation (both the cases detected in Thailand and Japan were moderately severe). Our estimates do not include cases with mild or no symptoms.
3. The incubation period of 2019-nCov is not known and has been approximated with the estimates obtained for MERS-CoV and SARS \[8,9\].
4. We assume that international travel is independent of the risk of exposure to 2019n-CoV or of infection status. If zoonotic exposure was biased towards wealthier people, travel frequency may be correlated with exposure. Also, some travel might be causally linked to infection status (to seek healthcare overseas) or the infection status of contacts in Wuhan (this may apply to the case detected in Japan) \[10\]. Accounting for either association would increase the probability of a case travelling and therefore reduce our estimates of the total number of cases."
2020-01-18,trentn2,MoreTankieChapo,1,https://www.reddit.com/r/MoreTankieChapo/comments/eqa289/theyve_cracked_the_code/feqgvf0/,"lol fake news has been circulating as if Wuhan is in literal bio warfare right now.

Seriously though, this is a new type of coronavirus. The authorities are working on it and publishing results along the way."
2020-01-18,wakeup2019,Sino,1,https://www.reddit.com/r/Sino/comments/eqlgnt/bbc_fearmongers_that_china_is_suppressing_the/fewfp3r/,"Virus mutates all the time. The flu virus is new every year

But ... it is a “coronavirus,” which is in the family of SARS viruses. So, there’s some justification for being prudent. But the hysteria has a lot of racism behind it. You just have to read the comments on social media"
2020-01-18,autotldr,worldnews,0,https://www.reddit.com/r/worldnews/comments/eqloi3/china_reports_new_virus_cases_raising_concern/fetyg56/,"This is the best tl;dr I could make, [original](https://www.reuters.com/article/us-china-health-pneumonia/china-reports-new-virus-cases-raising-concern-globally-before-key-holiday-idUSKBN1ZH020) reduced by 76%. (I'm a bot)
*****
> BEIJING - China reported four more cases of pneumonia believed to be caused by a new coronavirus strain, causing rising concern globally that a disease health officials do not yet fully understand could spread during a key holiday period.

> Though experts say the new virus does not appear to be as lethal as SARS, there is little known about its origins and how easily it can spread. Thailand and Japan have confirmed new cases of the virus earlier this week, stoking worries globally as many of the 1.4 billion Chinese people will travel abroad during the Lunar New Year holidays that begin next week.

> The Wuhan Municipal Health Commission said on Saturday the four new individuals diagnosed with the new virus are in stable condition, adding it has confirmed 45 cases in the city as of Thursday.


*****
[**Extended Summary**](http://np.reddit.com/r/autotldr/comments/eqma9w/china_reports_new_virus_cases_raising_concern/) | [FAQ](http://np.reddit.com/r/autotldr/comments/31b9fm/faq_autotldr_bot/ ""Version 2.02, ~459878 tl;drs so far."") | [Feedback](http://np.reddit.com/message/compose?to=%23autotldr ""PM's and comments are monitored, constructive feedback is welcome."") | *Top* *keywords*: **new**^#1 **virus**^#2 **Wuhan**^#3 **health**^#4 **cases**^#5"
