date,author,subreddit,score,url,text
2020-02-15,smallskeletal,xfl,11,https://www.reddit.com/r/xfl/comments/f4c4x6/game_thread_dc_defenders_vs_new_york_guardians/fhpxwt4/,DC can't even catch the Coronavirus
2020-02-15,Lurker9605,China_Flu,11,https://www.reddit.com/r/China_Flu/comments/f4fszu/covid19_is_the_name_of_the_disease_like_aids/fhqafq6/,Nah. I'm gonna call it coronavirus. The WHO took too long to name it. Now your telling me covid19 AND sars cov 2?? Fuck that. No one is gonna use those terms. Everyone is gonna say coronavirus and everyone is gonna know exactly what it is when its brought up cause is the only coronavirus in the news
2020-02-15,blueblarflubar,wallstreetbets,10,https://www.reddit.com/r/wallstreetbets/comments/f3yecl/weekend_discussion_thread_february_1416_2020/fhqk9i0/,That boomer doomer bear gang cuck Quoth the Raven has been non stop posting coronavirus stuff for like 3 weeks hoping the market goes down but it never does lmfao
2020-02-15,healrstreettalk,Coronavirus,10,https://www.reddit.com/r/Coronavirus/comments/f4gqsq/when_98_of_all_human_beings_currently_alive_on/fhqm98n/,"Yeah it doesn't make sense. While I can appreciate a bit of a ""boy who cried wolf"" syndrome, with fatigue around virus scares, the measures of reddit, twitter, etc, actually suppressing coronavirus info is disturbing."
2020-02-15,gohoos13,China_Flu,9,https://www.reddit.com/r/China_Flu/comments/f4fcbg/new_case_in_france_one_of_the_british_citizens/fhq4p7l/,"Translation:

 > The Ministry of Solidarity and Health informs of a 12th confirmed case of infection with the new coronavirus (COVID-19). The patient, of British nationality, is one of the people who had stayed in the Contamines-Montjoie chalet where, after the discovery of a first case, five people (secondary cases) were then diagnosed positive last week . The patient has remained in strict isolation in a referral hospital in Lyon since last Saturday, in accordance with the reinforced surveillance procedure for contact cases. His condition does not cause concern today.

 > Since his arrival at the hospital, he has been regularly evaluated and tested. A sample has tested positive for coronavirus today. This underlines the relevance of the isolation measures recommended for high-risk contact persons implemented in France.

 > France now has twelve confirmed cases of COVID-19, including six in the context of grouped contamination, in a chalet in Contamines-Montjoie. As of February 15, four patients were cured and discharged from the hospital and one patient died."
2020-02-15,Rummie123,China_Flu,9,https://www.reddit.com/r/China_Flu/comments/f4fszu/covid19_is_the_name_of_the_disease_like_aids/fhqajgo/,Or Wuhan coronavirus. That works also.
2020-02-15,ne0ndistraction,China_Flu,8,https://www.reddit.com/r/China_Flu/comments/f4hauz/politico_article_could_tobacco_help_cure/fhqoc0f/,"Hold up..

So Big Tobacco is willing to come to the rescue.. to find a cure for a virus that's been infecting thousands.. an infection that is made more severe if you happen to be a smoker.. a smoker that pays Big Tobacco?

Does that mean that the Big Tobacco paying smoker that's infected with coronavirus would then pay Big Tobacco again for a vaccination?"
2020-02-15,advcthrwy,China_Flu,8,https://www.reddit.com/r/China_Flu/comments/f4g5uz/wuhan_2k19_who_dropped_the_ball_on_the_name/fhqdas8/,"They dropped the ball when they didn't name the disease ""coronavirus respiratory acquired pneumonia syndrome"" aka CRAPs. (Note: someone else came up with this; I unfortunately don't remember their username to credit them.)"
2020-02-15,Liviig,boxoffice,7,https://www.reddit.com/r/boxoffice/comments/f454s6/sonic_the_hedgehog_speeds_to_an_a_cinemascore/fho95jt/,"Domestic  yes.

OS potential was really hampered by coronavirus in china.

Unless it pulls  a Lego movie domestically which ain't happening."
2020-02-15,OmagadRWI,Coronavirus,7,https://www.reddit.com/r/Coronavirus/comments/f4fxzq/im_sure_im_just_overreacting_but_do_yall_think_i/fhqc1p4/,Bacteria or a different Coronavirus. These are common. People just freak out because of nCov.
2020-02-15,rryan596,Coronavirus,6,https://www.reddit.com/r/Coronavirus/comments/f4f8ca/i_feel_the_same_as_in_the_911/fhq9dpo/,"USA here. I actually feel worse than 9/11 with this one.  In the hours after the 9/11 attacks we kind of had comfort that all planes were grounded except for the military or AirForce1. So there was some relief. I will admit 9/11 seemed to bring all Americans together but we didn’t have to worry about our own government. Watching this event is like slow torture, you know it’s coming and all you can do is watch it like a wave coming to shore. 
Disclaimer. I am not claiming 9/11 or Wuhan is better or worse than the other. Just giving my perspective. I agree with a previous reddit post that we will live in a post coronavirus world."
2020-02-15,psytokine_storm,wallstreetbets,6,https://www.reddit.com/r/wallstreetbets/comments/f3yecl/weekend_discussion_thread_february_1416_2020/fhqd3zy/,"Unless it's AAPL, the market doesn't care.

GE has been a dog for years. SPY has rocketed during the same timeframe.

That said, AAPL is unlikely to be able to meet demand for their flagship products over the next 3 months because of Coronavirus. It's going to miss targets in either q1 or q2, most definitely."
2020-02-15,DipnDave,xfl,6,https://www.reddit.com/r/xfl/comments/f4c4x6/game_thread_dc_defenders_vs_new_york_guardians/fhpwu5c/,The Golden Corral chocolate fountain is a vector for coronavirus
2020-02-15,cws1981,Coronavirus,6,https://www.reddit.com/r/Coronavirus/comments/f4gw47/jd_patriot_on_twitter_this_is_insane_how_big_is/fhqktbd/,Swine Fever was in china before coronavirus. Whole different thing.
2020-02-15,Iarguewithretards,Coronavirus,5,https://www.reddit.com/r/Coronavirus/comments/f4gqsq/when_98_of_all_human_beings_currently_alive_on/fhqkgzt/,"[sauce](https://www.nytimes.com/2020/02/15/business/china-coronavirus-lockdown.html?smid=nytcore-ios-share) 

Sorry 760 million not 750 but WHO’s counting ?"
2020-02-15,0fiuco,MMA,5,https://www.reddit.com/r/MMA/comments/f4g7qx/official_ufc_on_espn_25_anderson_vs_błachowicz_2/fhqjlbd/,"just joined in, you allright guys? everyone still coronavirus free?"
2020-02-15,IncredibleHamTube,iamatotalpieceofshit,5,https://www.reddit.com/r/iamatotalpieceofshit/comments/f43zxn/whoever_did_this/fho84cu/,Because they wanted to beat up an Asian. Coronavirus is just the excuse they used.
2020-02-15,TonedCalves,China_Flu,5,https://www.reddit.com/r/China_Flu/comments/f4efx0/ccp_state_media_reveals_xi_knew_about_virus_in/fhpvrqq/,"China’s Communist Party leader, Xi Jinping, issued internal orders about the coronavirus epidemic in early January, about two weeks before his first public remarks on the outbreak, according to a speech by Mr. Xi that was published Saturday. The speech confirmed for the first time that he was aware of the virus while officials at its epicenter were openly downplaying its dangers.

In the speech, Mr. Xi said that he had initially given orders about the coronavirus outbreak on Jan. 7, during a meeting of the Politburo Standing Committee, the Communist Party’s topmost body. That places Mr. Xi’s involvement with fighting the epidemic earlier than previously known. Mr. Xi’s earliest public comment on the epidemic was Jan. 20, when he gave brief instructions on the issue that were published by state media.

In early January, leaders in Wuhan, the city at the epicenter of the outbreak, were giving open assurances that there was no clear evidence of human-to-human transmission. Mr. Xi did not disclose details of his instructions on Jan. 7, but it seems clear that Wuhan officials would have known that the country’s top leader was paying attention to the outbreak.

The evidence that Mr. Xi was addressing the spread of the coronavirus earlier than previously known has now been released apparently in an effort to show that he has commanded the fight against the epidemic — notwithstanding rumors that he let others take the lead.

ADVERTISEMENT

Continue reading the main story
The speech in which Mr. Xi described his initial involvement in countering the spread of the coronavirus was published by Qiushi, or Seeking Truth, the Communist Party’s top doctrinal journal. Mr. Xi gave the speech on Feb. 3, when the coronavirus was spiraling into a national crisis for China, prompting the lockdown of Wuhan and other hard-hit cities in Hubei Province, and a chain reaction of restrictions across other parts of the country.

Mr. Xi is a dominant figure in Chinese politics, and his utterances are treated as lodestones by officials. Here are some other main points from the newly published Feb. 3 speech:

Mr. Xi in charge: Mr. Xi emphasized that he has been constantly involved in decisions about the crisis, and he indicates that he gave the authorization to put Wuhan and other areas of Hubei under an unprecedented lockdown from Jan. 23. In the speech, Mr. Xi recalled: “I clearly demanded that Hubei Province exercise comprehensive, strict control over the outflow of individuals.”

You have 4 free articles remaining.
Subscribe to The Times
Two focal points in a nationwide ‘people’s war’: Mr. Xi describes the effort to end the epidemic as an all-encompassing “people’s war” across China. But he singles out two key battlegrounds: Hubei Province, where the infections and deaths have been concentrated, and Beijing, the national capital. “Beijing has a special status,” Mr. Xi told the meeting. He said: “Strengthen management and control of key populations.”

Controlling the narrative: Mr. Xi stresses the importance of preserving social stability through easing public fear, providing adequate supplies of food and other needs, and demonstrating confidence that the epidemic can be beaten. And he also emphasizes winning over public opinion at home and abroad. “There must be closer monitoring and assessment of opinion, proactively speaking out and giving positive guidance,” Mr. Xi said of Chinese public sentiment. “Seize the initiative and effectively shape international opinion,” he added. “Tell well the story of China’s fight against the epidemic.”

ADVERTISEMENT

Continue reading the main story
Coping with economic damage: Mr. Xi acknowledges that the epidemic and fight to curtail it will drag on China’s economy by putting pressure on industry, especially smaller firms; by slowing construction projects; and by cooling domestic and foreign trade. In response, Mr. Xi said, the government will provide financial support for businesses, help migrant workers return to their jobs when production resumes, and step up support for projects. He also said the blow to consumer spending could be offset by encouraging spending in new areas, such as 5G phone networks, as well as online entertainment and education. He also encouraged areas across China to lower restrictions on car purchases."
2020-02-15,momd0tcom,China_Flu,5,https://www.reddit.com/r/China_Flu/comments/f4elto/couple_diagnosed_with_coronavirus_after_returning/fhq27ei/,Coronavirus definitely isn’t on our wedding registry.
2020-02-15,miz_v2,neoliberal,5,https://www.reddit.com/r/neoliberal/comments/f45yt3/discussion_thread/fhpwcl7/,"*on phone with grandpa*

grabdpa: i don't like that people are looking at us weirdly because of the coronavirus. we're not dirty just because we're asian

me: 👈😔👈

grandpa: those G_ddamn chinese people are giving us a bad reputation"
2020-02-15,ididdothatdidnti,China_Flu,5,https://www.reddit.com/r/China_Flu/comments/f4gtsh/facebook_cancels_san_francisco_conference_over/fhqjyvs/,The article states that there are 15 confirmed coronavirus cases in California. I’m guessing they mean the US.
2020-02-15,carrot512,Coronavirus,5,https://www.reddit.com/r/Coronavirus/comments/f45bdm/update_1526_dead_67104_infected/fho9wpx/,"The flu has had a foothold on hte general population for a lot longer and has a much lower mortality rate. If the coronavirus we know spreads like it's looking like it's going to do, it will make hte flu look like the common cold."
2020-02-15,TonedCalves,China_Flu,5,https://www.reddit.com/r/China_Flu/comments/f4etxq/coronavirus_updates_xi_was_aware_of_virus_earlier/fhpz6m9/,"China’s Communist Party leader, Xi Jinping, issued internal orders about the coronavirus epidemic in early January, about two weeks before his first public remarks on the outbreak, according to a speech by Mr. Xi that was published Saturday. The speech confirmed for the first time that he was aware of the virus while officials at its epicenter were openly downplaying its dangers.

In the speech, Mr. Xi said that he had initially given orders about the coronavirus outbreak on Jan. 7, during a meeting of the Politburo Standing Committee, the Communist Party’s topmost body. That places Mr. Xi’s involvement with fighting the epidemic earlier than previously known. Mr. Xi’s earliest public comment on the epidemic was Jan. 20, when he gave brief instructions on the issue that were published by state media.

In early January, leaders in Wuhan, the city at the epicenter of the outbreak, were giving open assurances that there was no clear evidence of human-to-human transmission. Mr. Xi did not disclose details of his instructions on Jan. 7, but it seems clear that Wuhan officials would have known that the country’s top leader was paying attention to the outbreak.

The evidence that Mr. Xi was addressing the spread of the coronavirus earlier than previously known has now been released apparently in an effort to show that he has commanded the fight against the epidemic — notwithstanding rumors that he let others take the lead.

ADVERTISEMENT

Continue reading the main story The speech in which Mr. Xi described his initial involvement in countering the spread of the coronavirus was published by Qiushi, or Seeking Truth, the Communist Party’s top doctrinal journal. Mr. Xi gave the speech on Feb. 3, when the coronavirus was spiraling into a national crisis for China, prompting the lockdown of Wuhan and other hard-hit cities in Hubei Province, and a chain reaction of restrictions across other parts of the country.

Mr. Xi is a dominant figure in Chinese politics, and his utterances are treated as lodestones by officials. Here are some other main points from the newly published Feb. 3 speech:

Mr. Xi in charge: Mr. Xi emphasized that he has been constantly involved in decisions about the crisis, and he indicates that he gave the authorization to put Wuhan and other areas of Hubei under an unprecedented lockdown from Jan. 23. In the speech, Mr. Xi recalled: “I clearly demanded that Hubei Province exercise comprehensive, strict control over the outflow of individuals.”

You have 4 free articles remaining. Subscribe to The Times Two focal points in a nationwide ‘people’s war’: Mr. Xi describes the effort to end the epidemic as an all-encompassing “people’s war” across China. But he singles out two key battlegrounds: Hubei Province, where the infections and deaths have been concentrated, and Beijing, the national capital. “Beijing has a special status,” Mr. Xi told the meeting. He said: “Strengthen management and control of key populations.”

Controlling the narrative: Mr. Xi stresses the importance of preserving social stability through easing public fear, providing adequate supplies of food and other needs, and demonstrating confidence that the epidemic can be beaten. And he also emphasizes winning over public opinion at home and abroad. “There must be closer monitoring and assessment of opinion, proactively speaking out and giving positive guidance,” Mr. Xi said of Chinese public sentiment. “Seize the initiative and effectively shape international opinion,” he added. “Tell well the story of China’s fight against the epidemic.”

ADVERTISEMENT

Continue reading the main story Coping with economic damage: Mr. Xi acknowledges that the epidemic and fight to curtail it will drag on China’s economy by putting pressure on industry, especially smaller firms; by slowing construction projects; and by cooling domestic and foreign trade. In response, Mr. Xi said, the government will provide financial support for businesses, help migrant workers return to their jobs when production resumes, and step up support for projects. He also said the blow to consumer spending could be offset by encouraging spending in new areas, such as 5G phone networks, as well as online entertainment and education. He also encouraged areas across China to lower restrictions on car purchases."
2020-02-15,ne0ndistraction,Coronavirus,5,https://www.reddit.com/r/Coronavirus/comments/f4ho0n/cruise_ship_passengers_pissed_about_2week/fhqql1f/," YOKOHAMA, Japan — American passengers under coronavirus lockdown on the Diamond Princess cruise ship in Yokohama were told Saturday of U.S. plans to take them home. But some were outraged by the new rules: 14 additional days of quarantine back in the United States.

""It's completely devastating,"" said Karey Sells, 44, from St. George, Utah. ""If they wanted to keep us under quarantine for an additional period, they should have picked us up 10 days ago. They should have done their job.""

The announcement was a shift from previous U.S. statements that the passengers were best serving out their quarantine aboard the ship, and that passengers would not have to do more once they returned home.

The Japanese government also announced that an additional 67 people on the ship were found to have the virus, out of the latest batch of 217 who were tested, although more than half showed no symptoms. That brings to 285 the number of passengers and crew members who have been found to be infected out of 930 tested, more than 30 percent.

Sells, who is self-employed, said the forced absence would harm her business. She thinks people testing positive for the virus probably contracted it before the quarantine period began, but says the U.S. government should have sent experts at the start to assess whether the quarantine on the ship was effective.

“They should have done this on the very first day,” she said, close to tears. “And now 400 American citizens are going to suffer because of their incompetence.”

Sells doesn’t even know whether her husband, a Canadian citizen who owns a small business in the United States, will be able to travel with her.

“That’s basically a month of our lives we are being held captive,” she added. “And without just cause — we didn’t commit a crime.”

**New cases on the ship**

The ship, with 2,666 passengers and 1,045 crew members, began a 14-day quarantine on Feb. 5. The end was supposed to come on Wednesday, and passengers anticipated being able to return home. But as more tests were carried out, it became clear that a high percentage of people had the virus, and experts warned that there was a risk it could still be spreading on the ship.

In acknowledgment of those risks, [Japan changed course](https://www.washingtonpost.com/world/asia_pacific/japan-relaxes-cruise-ship-quarantine-for-elderly-amid-fears-of-virus-spread/2020/02/13/4e0e2470-4e43-11ea-967b-e074d302c7d4_story.html?tid=lk_inline_manual_19&itid=lk_inline_manual_19) and began evacuating some passengers before the quarantine period ended, beginning with people older than 80 and with underlying health problems. It also stepped up its program of testing passengers.

After initially backing Japan’s approach toward the ship, the U.S. government has now also implicitly acknowledged that the Diamond Princess may not have been the best place to keep the American travelers.

“We are deeply grateful to the cruise line and government of Japan for working diligently to contain and control the spread of the illness,” the U.S. Embassy in Tokyo wrote in an email to Americans on the ship.

“However, to fulfill our government’s responsibilities to U.S. citizens under our rules and practices, as well as to reduce the burden on the Japanese health care system, the U.S. government recommends, out of an abundance of caution, that U.S. citizens disembark and return to the United States for further monitoring.”

It was a decision that some passengers said should have been made much earlier.

“Why didn’t they test everybody \[earlier\] and it would have been over?” asked Melanie Haering, 58, of Tooele, Utah, echoing a question many people have asked from the beginning.

**'Frightening'**

Medical experts have expressed concerns that the virus could still be spreading on the ship, possibly through the crew, or even perhaps through the air conditioning system — although the captain has repeatedly assured passengers that the air in their cabins is fresh rather than recycled. More than 20 crew members have tested positive for the virus.

The email said the State Department, working with the Department of Health and Human Services and other agencies, will provide a chartered aircraft to passengers directly from Japan to Travis Air Force Base in California, and for some passengers on to Lackland Air Force Base in Texas.

The plane will arrive in Japan on Sunday evening. Passengers will be screened for symptoms and then taken by bus to the plane. “We are working with our Japanese partners to ensure that any symptomatic passengers receive the required care in Japan if they cannot board the flight,” the embassy said.

“Travelers returning to the United States from high-risk areas are required to undergo quarantine. Accordingly, you will need to undergo further quarantine of 14 days when you arrive in the United States,” the email said.

“We understand this is frustrating and an adjustment, but these measures are consistent with the careful policies we have instituted to limit the potential spread of the disease.”

Passengers who choose not to return on this flight will be unable to return to the United States “for a period of time,” the embassy wrote.

Several passengers said they viewed the additional quarantine period as the wisest course of action but still found the news tough to process.

“Having hoped that three, four days from now, I’d be getting on a plane and this would be all behind me, now facing another 14-day quarantine on a military institution where the conditions — I imagine they’re obviously going to be more sanitary, but they’re going to be vastly different — it is frightening,” said Spencer Fehrenbacher, 29, a U.S. citizen whose family immigrated to Canada in 2016."
2020-02-15,Iarguewithretards,Coronavirus,5,https://www.reddit.com/r/Coronavirus/comments/f4gqsq/when_98_of_all_human_beings_currently_alive_on/fhqkolw/,"Tell that to the [New York Times](https://www.nytimes.com/2020/02/15/business/china-coronavirus-lockdown.html?smid=nytcore-ios-share)

Archived [link](http://archive.is/17Lvo?utm_source=share&utm_medium=ios_app&utm_name=iossmf)  to avoid paywall"
2020-02-15,OldSchoolPredsFan,Predators,5,https://www.reddit.com/r/Predators/comments/f4h4tp/postgame_preds_vsblues/fhqnimj/,"Don’t kiss an ASIAN, you might get the Coronavirus."
2020-02-15,skeebidybop,China_Flu,5,https://www.reddit.com/r/China_Flu/comments/f4gz1n/epicenter_of_coronavirus_outbreak_reports_1843/fhqpe2v/,"Okay thanks! So critical condition absolutely *requires* full-time ICU support / ventilation.

And in gauging Hubei's ICU operational capacity strain, we also have to consider all the other non-coronavirus patients who require ICU support for other illnesses, which usually occupies ICUs to +70% capacity as is."
2020-02-15,Swako_ITA,memes,4,https://www.reddit.com/r/memes/comments/f4diwd/ill_shoot_his_dick_off/fhqn7uv/,There's Coronavirus for a reason
2020-02-15,Nitro0531,China_Flu,4,https://www.reddit.com/r/China_Flu/comments/f4fxgg/this_lady_from_wuhan_is_a_hero/fhqmgbu/,"Not trying to make light of such a deadly virus as a good thing, but you know, this Coronavirus thing might end up being what brings down the CCP if people get desperate enough and revolt."
2020-02-15,orangequokka,illnessfakersgonewild,4,https://www.reddit.com/r/illnessfakersgonewild/comments/f4g3l2/and_ellens_now_on_the_mast_cell_wagon/fhqjsii/,"I'm allergic to her family nicknames. 

MCAS seems to be more contagious than the new Coronavirus."
2020-02-15,lemonacidy,China_Flu,4,https://www.reddit.com/r/China_Flu/comments/f43dbf/another_doctor_confirmed_positive_in_the_same/fho93xb/,"As someone who has been observing how the Japanese government has been handling this whole coronavirus issue from the beginning,  I will not be surprised if they are making stupid lies for dumb reasons like saving the face of the hospital and such."
2020-02-15,mcdj,RoastMe,4,https://www.reddit.com/r/RoastMe/comments/f44buy/gay_sailor_in_japan_looking_to_get_fucked_here/fho68vc/,Oh great. Here’s the guy who finally brings coronavirus to the rest of the world.
2020-02-15,PinkPropaganda,China_Flu,4,https://www.reddit.com/r/China_Flu/comments/f4dcnt/a_great_history_professor_in_wuhan_passed_away/fhqckpq/,Families can publish a list of missing persons. Government can track how much less pensions they will pay this year due to coronavirus. The truth is out there.
