date,author,subreddit,score,url,text
2020-02-04,GoddammitDalton,ChapoTrapHouse,18,https://www.reddit.com/r/ChapoTrapHouse/comments/eyl4up/iowa_caucus_does_not_look_good_election/fgk7w54/,Gonna get coronavirus so i can sneeze on a birthday card & send it to Pete
2020-02-04,verguenzanonima,China_Flu,15,https://www.reddit.com/r/China_Flu/comments/eywmhh/coronavirus_patient_went_on_mexico_city_vacation/fgjpfis/,">A Chinese man who tested positive for coronavirus fell sick on a family vacation to Mexico before he flew back to Los Angeles, according to a report.  
>  
>The 38-year-old man, who was only identified as Q.L., traveled Jan. 20 to Mexico City on a **Delta Airlines** flight from Los Angeles, the Mexican newspaper Milenio reported.  
>  
>Upon arrival, the man **took an Uber** to the **Hotel Hilton Mexico City Reforma**, where he was staying with his family, according to the report.  
>  
>The next day, they had **breakfast in the hote**l before **roaming around the city**’s tourist sights, the report said.  
>  
>The group **walked about a mile to the Catedral Metropolitana**, went to a **museum** and ate tacos at a **local restaurant**, the outlet reported.  
>  
>Later that evening, he began to feel ill and the next day **took an Uber** back to the airport, where he flew back with his family on an **American Airlines flight to LA**, the report said.

That's a LOT of potential opportunities for infection."
2020-02-04,Dueler312,The_Donald,13,https://www.reddit.com/r/The_Donald/comments/eyzzvr/live_watch_party_president_trump_delivers_the/fgkptb4/,Glad Trump made a mention on the coronavirus epidemic.
2020-02-04,ker95,preppers,12,https://www.reddit.com/r/preppers/comments/eyy69n/we_need_to_encourage_people_who_are_just_starting/fgk1bt6/,"I agree with OP that posters should be encouraged.   If the coronavirus issue passes with little pain in your home country,  that's great,  and maybe the new folks will learn some of the value in being prepared.

Personally I'm not nearly as worried about getting the virus as I am about disruption in our supply chain.   It's terrifying to have validated how many of our daily supplies come from China and it is very likely that if the virus cannot be contained it will be years before they are back to full production. 

So let's help newbies make informed decisions- a case of augasun farms food may not be the wisest purchase,  but it will be there for whatever SHTF situation they may face."
2020-02-04,onekrazykat,China_Flu,12,https://www.reddit.com/r/China_Flu/comments/eyycc0/this_is_significant_as_it_seems_to_confirm_human/fgk21nx/,That attitude is going to make this so much worse. Like Chinese people have no clue how to stop the spread of a virus. That they haven’t seen the devastating effects of a novel coronavirus. That they don’t see the current effects. That they aren’t all living in ghost towns because they don’t want to catch it...
2020-02-04,millhouse0824,Coronavirus,11,https://www.reddit.com/r/Coronavirus/comments/eyz3fz/everyone_i_know_is_sick_could_we_already_be/fgk64hv/,"Anything is possible but the odds of you and your family having a common cold or the flu are much much higher than having the coronavirus at this point. It’s easy to assume the worst but sometimes it’s worth asking, what’s the most likely explanation?"
2020-02-04,Wallposter-in-chief,China_Flu,11,https://www.reddit.com/r/China_Flu/comments/eyyxt6/japan_has_reportedly_confirmed_10_cases_of/fgk5elw/,"Earlier but context:  [https://edition.cnn.com/2020/02/04/asia/coronavirus-japan-cruise-intl-hnk/index.html](https://edition.cnn.com/2020/02/04/asia/coronavirus-japan-cruise-intl-hnk/index.html)   


""The man who tested positive for the virus is an 80-year-old from Hong Kong, the semiautonomous Chinese city said in a statement. The infected patient had not been to healthcare facilities or seafood markets, nor had he had exposure to wild animals during his incubation period -- meaning he likely contracted the virus from another human. The man visited mainland China for ""a few hours"" on January 10, the statement said.  

&#x200B;

The man flew into Tokyo -- the world's most populous city -- on January 17 with his two daughters, and two days later said he began developing a cough, Hong Kong authorities said. He boarded the cruise in Yokohama on January 20, and when it stopped back in Hong Kong on January 25, part of its pre-planned itinerary, he got off and never returned. He sought medical attention on January 30 and was diagnosed with the virus shortly after. He is currently in a stable condition.""  


Not ideal."
2020-02-04,kind-of-there,China_Flu,10,https://www.reddit.com/r/China_Flu/comments/eyxnce/canada_2nd_case_confirmed_in_bc/fgjxgwc/,"The airport security reportedly consists of a single question and the province’s health officer has openly said she [won’t institute quarantines](https://bc.ctvnews.ca/mobile/why-b-c-s-top-doctor-doesn-t-want-to-impose-a-coronavirus-quarantine-1.4792625) and rely on self isolation instead.

Canada seems to be handling this issue the worst by far of any developed country."
2020-02-04,TrumanB-12,neoliberal,10,https://www.reddit.com/r/neoliberal/comments/eym6us/discussion_thread/fgkgezd/,"Every time I peek into /r/politics I fear I might catch the coronavirus. Seriously you need a hazmat suit if you're anything but a Bernie supporter.

How the fuck can these people be so toxic and keep sharing what is essentially fake news propaganda?"
2020-02-04,CLO_Junkie,China_Flu,9,https://www.reddit.com/r/China_Flu/comments/eyx70j/who_working_on_recommendations_for_resuming/fgjt0v6/," GENEVA (Reuters) - The World Health Organization will work with travel and tourism industry representatives on Wednesday to draw up further recommendations to protect their crews so they can resume flights to China, a senior WHO official said.  

Sylvie Briand, WHO director of global infectious hazard preparedness, said people infected with the coronavirus should wear masks, but that for other people without signs of the disease, “the masks will not necessarily protect them 100%”.

Frequent hand-washing and other hygiene measures were needed, as the virus is spread by close contact and can also remain on surfaces, she said.

**She dismissed earlier medical studies of some people having transmitted the disease without showing signs, saying they actually had “minor symptoms” that went undetected.**"
2020-02-04,ThaGoodGuy,China_Flu,9,https://www.reddit.com/r/China_Flu/comments/eyz4oq/results_negative_for_first_nyc_case/fgk8ciq/,"Poor Coronavirus. Unfortunately we can't say that if it can't make it here, it can't make it anywhere."
2020-02-04,vellonn,China_Flu,9,https://www.reddit.com/r/China_Flu/comments/eyyilv/reminder_stats_on_daily_updates_9642_11791_14380/fgk2mde/,"Correct, it is a novel coronavirus."
2020-02-04,babydolleffie,China_Flu,9,https://www.reddit.com/r/China_Flu/comments/eyyxt6/japan_has_reportedly_confirmed_10_cases_of/fgk51gl/,"""A Hong Kong man on a cruise ship has been infected with the new coronavirus, and several passengers have reported a positive reaction to the new coronavirus.  Is from more than 10 people.

 The Japan Coast Guard has begun work to transport those who have tested positive.

 Persons who have a positive response will be transported from a cruise ship to the Yokohama Coast Guard on a patrol boat of the Japan Coast Guard, and then transported to a hospital.  An ambulance is already waiting at the Yokohama Coast Guard."""
2020-02-04,Bumpy_Nugget,Coronavirus,9,https://www.reddit.com/r/Coronavirus/comments/eyziag/could_cases_of_coronavirus_in_the_us_be/fgk89hb/,"I'm guessing that if the last several months of vaping stories were actually coronavirus, we'd have more patients than China does by now."
2020-02-04,patbaum,China_Flu,8,https://www.reddit.com/r/China_Flu/comments/eyuy7d/mods_deleting_posts/fgjf0qb/,"Lots of re-posts of old info. Lots of speculation (most of which is repeat of old speculation)

I think the mods are doing a pretty good job.

r/Coronavirus is another good option if you want a place with more tolerance for speculation and recycling of some older info and videos."
2020-02-04,Thewatchfuleye1,OakIsland,8,https://www.reddit.com/r/OakIsland/comments/eyzzlr/drunk_island_s7_ep12_fortified/fgkobq5/,Bats carry Coronavirus
2020-02-04,bsrbsrbrs,The_Donald,8,https://www.reddit.com/r/The_Donald/comments/eyzzvr/live_watch_party_president_trump_delivers_the/fgkprg1/,Will he mention Coronavirus?
2020-02-04,DariusStrada,eu4,8,https://www.reddit.com/r/eu4/comments/eywugb/one_dynasty_to_rule_them_all/fgk3ea4/,"Coronavirus, circa 2025 (colourized)"
2020-02-04,yorik_J,interestingasfuck,8,https://www.reddit.com/r/interestingasfuck/comments/eyywj8/fighting_the_coronavirus_with_toothpicks/fgk9chy/,Catching coronavirus but with extra steps
2020-02-04,justttc,vancouver,8,https://www.reddit.com/r/vancouver/comments/eyycbb/2nd_presumptive_case_of_wuhan_coronavirus/fgk2c65/,"I posted this half an hour ago and it didn’t get through the mods’ ‘firewall’. From daily hive: “The woman was identified “quite late yesterday,” and “Vancouver Coastal is doing the detailed testing today,” said Henry.”I fully expect they’ll come back positive as well.”

Henry said the woman had visitors from Wuhan in her house who are “still here,” and  health authorities are “following up with the entire family right now.”

Henry said the visitors “left Wuhan before the travel restriction was put in place, but they minimized contact with people outside of the home.””


https://dailyhive.com/vancouver/second-presumptive-coronavirus-case-bc"
2020-02-04,madman320,China_Flu,7,https://www.reddit.com/r/China_Flu/comments/eyy23z/daily_general_post_feb_5_2020_questions_images/fgk3ym7/,"Reports that Ecuador has confirmed South America's first case of coronavirus are wrong. Reuters has issued a retraction.

[Source](https://twitter.com/BNODesk/status/1224828423635423233)"
2020-02-04,dudz23,wallstreetbets,7,https://www.reddit.com/r/wallstreetbets/comments/eyx22e/what_are_your_moves_tomorrow_february_05/fgk3poq/,They gonna talk about how you can’t get Coronavirus in space. Stonk goes up 50%
2020-02-04,harri_g,reddevils,7,https://www.reddit.com/r/reddevils/comments/eyv7ft/here_he_is_first_interview_with_ighalojude_as_an/fgjlpai/,Nigerian Prince. Coronavirus in his veins. Coughs on markers. Chinese league R9. AFCON legend. Straight outta Quarantine. Prem ain’t ready. Defenders have families. African Gunman.
2020-02-04,verguenzanonima,China_Flu,7,https://www.reddit.com/r/China_Flu/comments/eyzj50/leaked_recording_calls_into_question_chinas/fgk99zn/,"This isn't a recent video, note they're talking about 40 deaths. So it's probably from around the 25th.  


 [https://web.archive.org/web/20200125225446/https://bnonews.com/index.php/2020/01/the-latest-coronavirus-cases/](https://web.archive.org/web/20200125225446/https://bnonews.com/index.php/2020/01/the-latest-coronavirus-cases/)"
2020-02-04,verguenzanonima,China_Flu,7,https://www.reddit.com/r/China_Flu/comments/eyyufi/japan_a_cruise_ship_anchored_off_the_port_of/fgk402f/,"Another link:  
[https://news.tv-asahi.co.jp/news\_society/articles/000175456.html](https://news.tv-asahi.co.jp/news_society/articles/000175456.html)

&#x200B;

>About a cruise ship anchored off the port of Yokohama, virus tests revealed that about 10 passengers were infected with the new coronavirus.  
>  
>The large passenger ship Diamond Princess has approximately 3,700 passengers and quarantine starts on the night of March 3. In addition, samples were collected from 133 people who had symptoms such as fever and their close contacts, and tested for viruses.  
>  
>According to the Ministry of Health, Labor and Welfare, examination of people with symptoms has been completed and about 10 passengers have been infected. In addition, according to the Yokohama Fire Department, 10 people will be transported to the hospital after this, and they have started waiting at the Yokohama Disaster Prevention Base in Yokohama Port.

Another from CNN:  
[https://edition.cnn.com/2020/02/04/asia/coronavirus-japan-cruise-intl-hnk/index.html](https://edition.cnn.com/2020/02/04/asia/coronavirus-japan-cruise-intl-hnk/index.html)  


&#x200B;

>The ship, the Diamond Princess, ended its planned 14-day itinerary early and is currently docked off the coast of Yokohama, not far from the Japanese capital. Medical officials are going room-by-room to check each guests' temperature and medical condition, Japan's health ministry said in a statement. Several passengers have reported feeling ill, and the tests to check if they contracted the virus will take four to five hours, the ministry said.  
>  
>Passengers and crew will now be required to stay on board until at least Tuesday night.  
>  
>The man who tested positive for the virus is an 80-year-old from Hong Kong, the semiautonomous Chinese city said in a statement. The infected patient had not been to healthcare facilities or seafood markets, nor had he had exposure to wild animals during his incubation period -- meaning he likely contracted the virus from another human. The man visited mainland China for ""a few hours"" on January 10, the statement said.  
>  
>The man flew into Tokyo -- the world's most populous city -- on January 17 with his two daughters, and two days later said he began developing a cough, Hong Kong authorities said. He boarded the cruise in Yokohama on January 20, and when it stopped back in Hong Kong on January 25, part of its pre-planned itinerary, he got off and never returned. He sought medical attention on January 30 and was diagnosed with the virus shortly after. He is currently in a stable condition.  
>  
>Princess Cruises, which is owned by the Miami and London-headquartered Carnival Corporation, said in its statement that the man did not visit the ship's medical center.  
>  
>It's also unclear how many passengers may have disembarked early. The Japanese health ministry said it is tracing people who may have disembarked in Okinawa, the cruise's second-to-last stop. The ministry is also investigating the infected patient's movements during his time in Japan but must rely on authorities in Hong Kong for information since the patient is there, authorities said."
2020-02-04,pvijay187,Drama,7,https://www.reddit.com/r/Drama/comments/eyyu12/yanggang_iowa_victory_party_thread/fgk4e11/,People in Iowa are just scared they will catch the coronavirus
2020-02-04,benagami,preppers,7,https://www.reddit.com/r/preppers/comments/eyy69n/we_need_to_encourage_people_who_are_just_starting/fgk3uv4/,"This may get much worse before it gets better.  The coronavirus has caused a dip in the price of oil because China isn't buying as much as they usually do.  The price of a barrel dropped below $50 today.  If it stays there, it may start a domino effect as that's the price where frackers break even.  The fracking companies have borrowed a shit-ton of money.  If they can't renew their loans, and they won't be able to if they're not making a profit, they're going to default.  It'll start a financial disaster.

So, this isn't just about prepping for virus.  It is possible this will also be about prepping your finances for a shock that was caused by the virus."
2020-02-04,NeverFarted,MMA,7,https://www.reddit.com/r/MMA/comments/eyx3kc/daniel_cormier_breaks_down_how_conor_mcgregor/fgjw1ym/,Imagine a pig flies out of my ass and creates a cure for the coronavirus
2020-02-04,arnaoutelhs,wallstreetbets,7,https://www.reddit.com/r/wallstreetbets/comments/eyx22e/what_are_your_moves_tomorrow_february_05/fgkb532/,"Sars total cases 8,096

Coronavirus cases today +3.831

No worries"
2020-02-04,thesynod,The_Donald,6,https://www.reddit.com/r/The_Donald/comments/eywegp/after_getting_fucked_out_of_the_iowa_caucus/fgjzd35/,Now with extra coronavirus!
2020-02-04,HarpsichordsAreNoisy,Coronavirus,6,https://www.reddit.com/r/Coronavirus/comments/eyzcmj/the_infected_numbers_are_rising_massively/fgk7e5k/,"There’s no way the death count could increase as rapidly.

Those who were infected two days ago and are alive now but couldn’t previously be tested get to be counted in the “infected“ category. Those who were died two days ago without testing will never be in the “dead from coronavirus” category. 

It will take time for deaths to spike after this.

The numbers will begin to come in clearer and more accurately, like focusing a microscope."
2020-02-04,fabionebbia,Coronavirus,6,https://www.reddit.com/r/Coronavirus/comments/eyztbp/i_wish_i_could_volunteer_against_coronavirus/fgkacrb/,"If coronavirus hits Italy, and volunteers are allowed, I want to volunteer too.

I’m feeling the same as you."
2020-02-04,joef1727,antiMLM,6,https://www.reddit.com/r/antiMLM/comments/eyx0yh/noterra/fgjvkwl/,"To be fair, they initially thought that coronavirus came from snakes. So it stands to reason that snake oil ..."
2020-02-04,madman320,China_Flu,6,https://www.reddit.com/r/China_Flu/comments/eyx3xh/new_suspected_cases_february_5th_edition_all_new/fgk3y0l/,"Reports that Ecuador has confirmed South America's first case of coronavirus are wrong. Reuters has issued a retraction.

[Source](https://twitter.com/BNODesk/status/1224828423635423233)"
2020-02-04,Fattybobo,Coronavirus,6,https://www.reddit.com/r/Coronavirus/comments/eyw7cz/just_so_you_know_people_have_started_stocking_up/fgjnnoz/,"Did you like read the first sentence? ""The boss of an emergency food supply company who experienced Brexit  panic buying has seen a 1,200% spike in sales - **because of coronavirus.**"" It litterally says its because of the coronavirus."
2020-02-04,EpsteinKilledHisself,neoliberal,6,https://www.reddit.com/r/neoliberal/comments/eym6us/discussion_thread/fgkgt42/,Remember when people were in the DT mere days ago saying that SARS will have killed more people than the coronavirus when that was basically statistically guaranteed to be false a week ago?
2020-02-04,coyicada,trashy,6,https://www.reddit.com/r/trashy/comments/eyzn60/honestly_guys_this_is_so_fucked_up/fgkekjh/,they are also throwing their pets from their apartments/balconies thinking they can get coronavirus from them..
2020-02-04,MachuPikcuinta,China_Flu,6,https://www.reddit.com/r/China_Flu/comments/eyx3xh/new_suspected_cases_february_5th_edition_all_new/fgk2myr/,"BNO shows that the two patients in Italy are now in a serious condition. In Thailand the number of infected confirmed is 25 while Japan has 23*.  Singapore has 24 confirmed cases. 

https://bnonews.com/index.php/2020/02/the-latest-coronavirus-cases/"
2020-02-04,ILikeTalkingToMyself,neoliberal,5,https://www.reddit.com/r/neoliberal/comments/eym6us/discussion_thread/fgj9sng/,"[/new: Coronavirus Crisis Shows China’s Governance Failure](https://www.reddit.com/r/neoliberal/comments/eytwkr/coronavirus_crisis_shows_chinas_governance_failure/)

*Replies to this comment will receive a frowney face, please participate in the linked thread*"
2020-02-04,sammi-blue,HumansBeingBros,5,https://www.reddit.com/r/HumansBeingBros/comments/eytozk/respect/fgjlqtb/,"Praising nurses caring for coronavirus patients doesn't retract any sympathy and respect for people in your profession. I have so doubt that you job is hard and thankless and that you deserve more appreciation, but your not exactly in constant danger of contacting a new, barely-researched, deadly disease lmao"
2020-02-04,supernova0114,BokuNoHeroAcademia,5,https://www.reddit.com/r/BokuNoHeroAcademia/comments/eyy3uj/due_to_what_happened_with_the_drs_name_china_has/fgk3ayw/,"I just saw a [video](https://www.youtube.com/watch?v=7OEqybiGdaA) recently where a man was complaining about the incompetency of the Chinese government in dealing with the coronavirus and was asking for help from the outside world. A key line he said that the comments mentioned was, ""Not all of us are brainwashed. We too, want to live the life with democracy and freedom."" Kinda sad whats going on over there"
2020-02-04,SrerkDankey,PublicFreakout,5,https://www.reddit.com/r/PublicFreakout/comments/eyzddu/chinese_woman_gets_attacked_for_wearing_a_mask_in/fgk7h4j/,"Why can’t she wear a mask?


Coronavirus?"
2020-02-04,CoronavirusCoverage,China_Flu,5,https://www.reddit.com/r/China_Flu/comments/eyywnn/question_for_all_the_serious_preparers/fgk4ml9/,"I know this. Even if this does not turn into a global pandemic (which it already seems to be) it's still good to be prepared. Nothing wrong with being prepared. Pandemic fear is natural, especially when a new virus breaks out and has spread to 20,000 people (as per China's numbers) Pop culture has also had a big effect on how people see this. I put together a video on pandemic media in pop culture and it's hard to not feel anxious about all of this.

[https://www.youtube.com/watch?v=ZW9G\_Pa\_-mo&t=3450s](https://www.youtube.com/watch?v=ZW9G_Pa_-mo&t=3450s)

[https://www.wsj.com/articles/coronavirus-cases-rise-above-20-000-in-china-as-hong-kong-reports-first-death-11580799736](https://www.wsj.com/articles/coronavirus-cases-rise-above-20-000-in-china-as-hong-kong-reports-first-death-11580799736)"
2020-02-04,verguenzanonima,China_Flu,5,https://www.reddit.com/r/China_Flu/comments/eyzrsp/france_changes_the_possible_case_definition/fgk9umk/,">French health authorities have again widened, on Tuesday, the definition of ""possible cases"" of infections with the new coronavirus, to take into account the evolution of data from China and minimize the risk of spread on the territory. This definition is used to guide health professionals to know for which patients it is necessary to carry out additional examinations.   
>  
>Thus, the ""exposure zone"" considered to be at risk now extends to ""the whole of China"", instead of the only province of Hubei, epicenter of the epidemic, and the ""clinical signs have been clarified. ""to include people with"" a feeling of fever "", and not necessarily a temperature above 38 ° C actually observed, said the director general of Health Jérôme Salomon.  
>  
>Any person with clinical signs of low acute respiratory infection, whatever its severity, with a fever or a feeling of fever, and having traveled or stayed in China within 14 days, will be considered as a ""possible case"" of infection. days preceding the date of onset of clinical signs "", according to the updated definition"" validated by Santé publique France "".   
>  
>Also considered as ""possible cases"" are people very exposed to the risk of contagion, as soon as they have an acute respiratory infection high or low, even without fever and whatever its severity. This case applies to people who have been in close contact with a confirmed case (relatives sharing the same living space, office neighbors, neighbors in public transport ...), subject to the same exposure risks as a case confirmed or having worked or stayed in a hospital where a case has been confirmed. "
2020-02-04,FBI-Webcam-Operator,dankmemes,5,https://www.reddit.com/r/dankmemes/comments/eyvkj6/i_have_deadly_virus_back_fiend/fgkf7u8/,“catch coronavirus or draw 20”
2020-02-04,mountain_rules,Coronavirus,5,https://www.reddit.com/r/Coronavirus/comments/eyzq1l/10_people_on_that_yokohama_cruise_test_positive/fgkb06v/,"This is crazy.

The ship has 3700 passengers. 273 were tested. So far they have 31 results and out of those 10 were positive.I sure hope they test all the passengers.

[www.japantimes.co.jp/news/2020/02/05/national/science-health/quarantined-japanese-cruise-ship-infected-coronavirus/](https://www.japantimes.co.jp/news/2020/02/05/national/science-health/quarantined-japanese-cruise-ship-infected-coronavirus/)"
2020-02-04,FC37,China_Flu,5,https://www.reddit.com/r/China_Flu/comments/eyvjrr/who_confirms_27_cases_of_new_coronavirus/fgjlf74/,"So, this doesn't mean +25. ""New Coronavirus"" is nCov. This is the same information we already knew:

10 in Germany, 5 in Korea, 3 in Japan, 2 US, 2 Malaysia, 2 Vietnam, and 1 each in France, Thailand, Spain, and the UK."
2020-02-04,verguenzanonima,China_Flu,5,https://www.reddit.com/r/China_Flu/comments/eywmhh/coronavirus_patient_went_on_mexico_city_vacation/fgjq8pm/,"> Further details were not released about the man’s health condition or travels, such as whether he previously visited the Chinese city of Wuhan, the epicenter of the virus. [source](https://nypost.com/2020/02/04/uber-suspends-hundreds-of-accounts-after-coronavirus-patient-takes-rides-in-mexico/)

  
This is all I can find, sorry."
2020-02-04,GooeyGlobs4U,coolguides,5,https://www.reddit.com/r/coolguides/comments/eyx8lu/corona_virusmyths_vs_facts/fgjwbeh/,"Okay so some problems here... the coronavirus hasnt been around long enough to have an annual death toll. However if it persists at the rate it has, the common flu is gonna have serious competition.

Secondly, the Chinese govt is untrustworthy and we simply cannot trust the information they give us, nor our own media. This was proven when we were told the burning of bodies was fake news and fear mongering since we now know they have indeed been burning the dead.

Washing hands and sneezing into elbows is... ineffective. People who are dealing with the virus first hand are in hazmat suits. The best way to prevent transmission is to get the fuck away from people who have it, and keep those who have it the fuck away from everyone else.

The last two points may as well have been written by an intern at vox. Its not racism or xenophobic, its preventative measures from potential plague-level situations. The nation where it originated is barring people inside their homes and arresting people without masks as well as whistleblowers. 

Dont make this political, its too serious an issue to make a point about fucking racism and xenophobia..."
