date,author,subreddit,score,url,text
2020-04-19,IkkunKomi,coolguides,2,https://www.reddit.com/r/coolguides/comments/g46pjr/be_careful/fnx37y9/,"Thank you very much for putting in words what I have tried for ages to do. I understand your struggle and I hope that your journey with it is going well. I know that there are good days and bad days. And what most people also don't understand is usually a trauma will be the 'light switch' that triggers BPD.


Right now BPD symptoms are flaring up, at least for me, due to Covid-19 and the stress alongside with it. I live in South Dakota and I'm autoimmune. We have some cities with bars, restaurants, and casinos open. But we have some with those closed. It is a patchwork ordance to where you can drive a few minutes or miles out of town, and it makes everything in your city invalid. I also live in one of the surrounding cities by Sioux Falls, home of Smithfield, the largest hotspot in the nation for Coronavirus. The mayor and governor have refused to order a shelter in place for either that city, county, or state. People commute and travel to and from Sioux Falls, as well as truckers who use our state highways and interstates though our city. 


I wasn't trying to be political there, but explaining why for me it is currently stressful. My BPD is the product of a mom who was manipulative, a compulsive liar, and hateful. But she was very well liked. She was only like that to me. My siblings are 16 & 18 years older than me. So I grew up with my nieces and nephews around my age. I grew up with 6 of them, and they range from 3 years apart from the oldest to 13 at the youngest. So for example, When I was about 8, I spent all day cleaning my room. My niece and nephew went in there and tore it up and made a mess. We were all watching TV in the playroom, and my mom came in angry at me and slapped me yelling that I made a huge mess. My niece said that her and my nephew did it. My mom then turned arind and gave them a huge hug and said it was okay and everything was fine. Things like that happened all the time throughout my childhood. That is what started to lay the foundation for my BPD.

When I was 16, I had an abusive boyfriend. Both physically and emotionally. My dad had to have a heart procedure about 200 miles away. My mom went with him. I don't want to get into the details of it too much, but my mom had a brain aneurysm during my dad's procedure. When we got to the ICU waiting room, it was my sister's family with her kids and husband, my other sister's family with her kids and husband, my mom's sisters and their families, and well... me. I was alone during this pretty awful time. My dad was in recovery for surgery, and after roaming around the hospital for a bit, I went to the front desk and they let me sleep in my dad's room. Now, both of my parents did survive. The abusive boyfriend had to have a restraining order x2 on him, and he made my life hell by turning everyone against me while I was tending to my family. So, what I am trying to say here is, this is my 'light switch.'


If you wanted to skip all the personal experience shit, BPD is basically a result of trauma from past experiences. With Covid-19, my worry is that those who had those traumatic experiences and are waiting for those 'light switches' to enter a full blown state will happen, but since unemployment is so high, they will not be able to afford to seek care due to lack of insurance. Also, there is the genetic predisposition to mental illness where the 'light switch' can be flipped too.


Trauma brings out a lot of BPD symptoms that I usually have under control mostly thanks to DBT. But it is hard to be able to use DBT sometimes right now because it does take a lot of mental fortitude and power to focus. Trauma in general also is going to affect a lot of people during this time. It's going to affect doctors, nurses, delivery drivers, truck drivers, warehouse worker, grocery store workers, or anyone who is working under less than ideal conditions disproportionately. Alongside anyone who will suffer a loss of a loved one. 


That said (if anyone is still reading, which I hope because this is the main point), **there is absolutely no shame in getting help.** Everyone is going to need some help at some point or another in their life. It could be during the period of the loss of a loved I e or a job, could be during a time of addiction, could be during a realization that you don't feel like yourself anymore, it could be for anything. There is no shame in it at all. 25% of Americans (Sorry I usually like to do global figures, but it was hard to find) have a mental illness. 60% seek help with a therapist, even without a mental illness. Seeking help with a therapist, even if it is online or any other non-verbal commutation, can keep your mental health in good shape.


During Covid-19 and everything with it, stress, anxiety, depression, and all that stuff is normal and will happen. This will be a traumatic experience for some, which is awful. Please do not feel shame if you need to get mental health care. Mental health is just as important as physical health. People don't judge each other over the flu or fibromyalgia. The same goes for mental health care. 


NAMI (National Alliance on Mental Illness) has some great resources to get started:


https://www.nami.org/Support-Education/NAMI-HelpLine/Top-HelpLine-Resources


If you need help, reach out to them. They can hopefully provide you with the guidance of how to set up care and provide you with resources to improve and maintain your mental health via outside treatment.


This is a hard time for everyone. Taking care of your health is the most important thing you can do right now. That includes your mental health. Please take time and make sure to you are doing both. Stay safe and be well."
2020-04-19,shakeil123,memes,2,https://www.reddit.com/r/memes/comments/g4etus/so_this_and_thought_it_was_a_bit_of_cuteness/fnx3nw1/,Keanuvirus> Coronavirus
2020-04-19,Chef_Sasquatch,Coronavirus,2,https://www.reddit.com/r/Coronavirus/comments/g4cpql/reuters_us_covid19_death_toll_passes_40000/fnxpoic/,Looking at [actual numbers](https://coronavirus.1point3acres.com/en) where Florida has similar deaths/population as most other states (which don't have massive spring break parties).
2020-04-19,Avid-Eater,Coronavirus,2,https://www.reddit.com/r/Coronavirus/comments/g47znm/daily_discussion_post_april_19_questions_images/fnxqwcu/,"As someone who has grown up and lived in a rural area all my life, can anyone from a big city with public transportation chime in on the average conditions in buses e subway cars? For instance, how common is it to see people coughing and sneezing? If anyone is still traveling by those methods, do you still see a lot of that? I read a report from a couple of weeks ago that a study found that the average transmission rate between persons was 1-5%, but I'm not sure how accurate that is.

Source: https://www.the-hospitalist.org/hospitalist/article/218769/coronavirus-updates/covid-19-update-transmission-5-or-less-among-close"
2020-04-19,BeatsOnDrives,golf,2,https://www.reddit.com/r/golf/comments/g4jfye/i_made_a_doubt_eagle_last_saturday_and_am_just/fnxsx58/,Yes and no. I could see it the whole way to the green but we only playing our cups an inch deep right now so we can retrieve our ball without touching the flag or hole due to coronavirus. the top of the ball was still visible so I could tell it was in the hole until I got up to the green.
2020-04-19,idkwhattocallthis20,MBA,2,https://www.reddit.com/r/MBA/comments/g4hjtg/coronavirus_changed_my_career_path_will_it_affect/fnxrpv7/,"I really think Coronavirus will have lasting implications for years, if not decades to come. I know this sounds scary but in terms of your MBA chances, I wouldn’t worry. The same way employers don’t fault applicants for gaps in their resume one the 2008-2010ish range, I highly doubt they would fault you for this. Just try and stay competitive and differentiate yourself, even if there are less opportunities and the scale of success gets smaller (no promotions, less positions available, etc.) just try and stay towards the top of the pact!"
2020-04-19,iamfrankfrank,u_washingtonpost,2,https://www.reddit.com/r/u_washingtonpost/comments/g4assl/opinion_hold_these_republicans_accountable_for/fnxrsgn/,"Oh wow what a surprise:

https://mediabiasfactcheck.com/global-research/

Fuck off and take your alternative facts with you.  Hey report this account to the admins.  2 year-old account that suddenly started posting nothing but coronavirus misinformation and literally nothing else.

Here's a handy link:
https://www.reddit.com/report
(targeted harassment at you (because it is)"
2020-04-19,claudemac24hrs,tennis,2,https://www.reddit.com/r/tennis/comments/g4er90/patrick_mcenroe_tests_negative_for_coronavirus/fnxsbkt/,Good for him that he has no coronavirus.
2020-04-19,FuckityFuckedFuck,Coronavirus,2,https://www.reddit.com/r/Coronavirus/comments/g47znm/daily_discussion_post_april_19_questions_images/fnxt19b/,"BRASILIA/SAO PAULO (Reuters) - Brazil’s president Jair Bolsonaro on Sunday again attended a public rally and attacked lockdown measures meant to fight the coronavirus, as supporters of the right-wing leader joined political motorcades around the country. 

Brazil has more cases of the new coronavirus than any other country in Latin America. On Sunday, confirmed cases rose to 38,654 with 2,462 deaths. 

Bolsonaro, who was not wearing a face mask, addressed a crowd of a few hundred in Brasilia, many of them wearing Brazil’s yellow-and-green soccer jersey. 

His brief address, which was punctuated by the president coughing, touched on talking points that have become his usual rallying cry. 

He called those in attendance “patriots” and said they were helping defend individual freedoms that he said are under threat by lockdowns imposed by authorities at the state level."
2020-04-19,EndlessTheorys_19,GlobalTalk,2,https://www.reddit.com/r/GlobalTalk/comments/g4fs08/question_how_do_people_in_your_country_feel_about/fnx9qzx/,"Which is amazing considering 5G hasn’t been installed yet, those are just plain old non-coronavirus transmitting 4G masts."
2020-04-19,Adce1234,Coronavirus,2,https://www.reddit.com/r/Coronavirus/comments/g4fbbr/minuscule_traces_of_coronavirus_found_in/fnx6i34/,"""""Minuscule traces"" of [the new coronavirus](https://www.straitstimes.com/coronavirus) have been found in Paris's non-potable water - such as the supply used for cleaning streets - but drinking water is at no risk of contamination, a city official said on Sunday (April 19).""

Before you stop drinking water, make sure you actually read the article."
2020-04-19,Frothy_moisture,vaxxhappened,2,https://www.reddit.com/r/vaxxhappened/comments/g419xz/not_even_the_worst_thing_out_there_right_now/fnx8oy3/,"NO, they DON'T

They cause RADIATION which causes the CORONAVIRUS so that bill gates can put TRACKERS in when they give you the non-existent VACCINE

DUH SHEEPLE

/s"
2020-04-19,septimusprime,AbsoluteUnits,2,https://www.reddit.com/r/AbsoluteUnits/comments/g47kbc/this_rooster_is_an_absolute_unit/fnx86f0/,"This is how the world ends. We recreate dinosaurs and coronavirus does the rest. Thus completing the cycle of time back where it started.

/s"
2020-04-19,Drexce1138,dankmemes,2,https://www.reddit.com/r/dankmemes/comments/g4gjzv/haha_virus_go_brrrr/fnxb1qu/,Hehehe coronavirus go brrrrr
2020-04-19,holefrue,LockdownSkepticism,2,https://www.reddit.com/r/LockdownSkepticism/comments/g49nyi/is_the_tide_actually_turning/fnxccc0/,"Much of US history is seated in rebellion.  Though, if you'd asked me a week ago I would've said we probably had another month in us before this started happening.  I think the combination of no clear end date/shifting goal posts plus insufficient data to prove coronavirus is deadly enough to warrant draconian measures has expedited the discontent."
2020-04-19,fretit,Conservative,2,https://www.reddit.com/r/Conservative/comments/g47mwl/after_slamming_trump_for_not_doing_enough_pelosi/fnxayup/,The fact that it was Chinatown is irrelevant.  She was encouraging people to come and hang out in very crowded places [while all sorts of conferences were being cancelled](https://www.inc.com/minda-zetlin/coronavirus-fears-cause-cancellation-of-6-major-conferences-events-so-far.html).
2020-04-19,lynx_and_nutmeg,Coronavirus,2,https://www.reddit.com/r/Coronavirus/comments/g46aoa/dr_oz_apologizes_for_saying_reopening_schools_is/fnxdkah/,"Forgive me if I'm wrong, but don't doctors learn to read medical research, to analyse and understand it and recognise flawed methodology when they see it? This should at least make him qualified to read papers on coronavirus and educate himself, and translate those studies into public knowledge on his blog?"
2020-04-19,boanngles,DarkHumorAndMemes,2,https://www.reddit.com/r/DarkHumorAndMemes/comments/g4ff4h/yeeeef/fnxbbsn/,No I didn't laugh at your disgraceful and pitiful attempt of humour. I can't believe someone like you would even attempt to get a chuckle out of me when you clearly are not suited for making jokes. The only thing that made me chuckle is you making a joke so bad that I laughed at how bad your comedy was. I am in lockdown currently trying to hide from getting coronavirus but in reality I should be hiding from you stupid attempt at comedy. I could of donated money to a charity in the time I am writing this. But this is my main priority at the moment because the whole planet needs to know and I   the person who needs to address this because the humour you have tried create has failed so badly that you should be locked up for how terrible it is. My life has been ruined because of your stupid attempt of making me laugh. I stopped breathing when you made that joke so I would not ever laugh at anything you say again. I didn't laugh no one will ever laugh at your joke and I am so confused regarding the situation you have put me and other people of the human race into. I am shocked and others will be shocked at your comedy. I didn't laugh and you should not have a right to even utter anything with a tiny touch of sarcasm. Unbelievable. I am scarred for life as your comedy has ruined me. Disgraceful
2020-04-19,takev9393,Coronavirus,2,https://www.reddit.com/r/Coronavirus/comments/g47h8i/broadway_star_nick_cordero_has_leg_amputation_due/fnxe07h/,">Tony Award-nominated actor Nick Cordero has had his his right leg amputated after suffering complications from the coronavirus, his wife says.

Literally the first sentence."
2020-04-19,RasterAlien,olympia,2,https://www.reddit.com/r/olympia/comments/g4ehpf/live_protest_from_olympia_about_coronavirus/fnxhnyw/,Hope he enjoys that heapin' helpin' of coronavirus he's about to get served.
2020-04-19,NathanOsborn,CoronavirusUK,2,https://www.reddit.com/r/CoronavirusUK/comments/g4fidb/impossible_for_uk_to_meet_covid19_testing_targets/fnxgm3y/,"Source for people in hospital:
https://www.gov.uk/government/collections/slides-and-datasets-to-accompany-coronavirus-press-conferences

Source for Nightingale hospitals:
https://www.dailymail.co.uk/news/article-8218299/Londons-Nightingale-Hospital-sits-19-coronavirus-patients-treated-Easter.html
https://www.bbc.co.uk/news/uk-england-tyne-52284262

Don't have a physical source for ICU capacity as Government don't officially release those figures, but from time to time Hancock usually tells us in TV interviews etc. He said a few days ago we have 2800 free ICU beds."
2020-04-19,NikkiSharpe,Coronavirus,2,https://www.reddit.com/r/Coronavirus/comments/g4ged1/florida_beach_swamped_by_huge_crowds_of_people_as/fnxfxxd/,"Multiple news outlets have reported issues with their numbers since March. I'm not convinced the data we see is correct.

https://www.wlrn.org/post/theres-something-strange-about-floridas-coronavirus-data

https://www.sun-sentinel.com/opinion/editorials/fl-op-edit-florida-coronavirus-questions-20200323-kq5tnxfu7rad7glrmitd2eebs4-story.html"
2020-04-19,genieoogie,Seattle,2,https://www.reddit.com/r/Seattle/comments/g4hopm/protesters_rally_against_washington_stayathome/fnxi67g/,"Life, Liberty, and the pursuit of Coronavirus!"
2020-04-19,Head_Honchoo,Coronavirus,2,https://www.reddit.com/r/Coronavirus/comments/g4i4nn/italys_daily_covid19_death_toll_hits_oneweek_low/fnxl74c/,/r/coronavirus in shambles trying to figure out how and why Italy needs to stay closed for 2 more years
2020-04-19,sir_tort,coloranalysis,2,https://www.reddit.com/r/coloranalysis/comments/g4epqg/an_online_tool_said_i_was_a_soft_autumn_but_i/fnxldnr/,"I’ve checked over them but I honestly just don’t know what looks good on me personally, possibly because of low self esteem and also a lack of different colored clothing to try and do draping. I know in person would be much better, but that’s not a possibility right now (plus I’m not sure if it would be regardless of the coronavirus because it looks like it would cost a couple hundred dollars to get a professional’s help). Thank you for writing up such in depth guides, though!"
2020-04-19,fertthrowaway,COVID19positive,2,https://www.reddit.com/r/COVID19positive/comments/g4b9ec/recovery_tips_for_those_with_30_day_symptoms/fnxifiq/,"https://www.newscientist.com/article/mg24632783-400-could-the-coronavirus-trigger-post-viral-fatigue-syndromes/

I really think it's happening (and I say this being exhausted after just taking an afternoon nap, I'm just getting over an over 5 week long illness for which I tested negative for COVID on day 27, but who knows by then, and it started out precipitating the most severe autoimmune flare I ever had, completely knocked me on my ass, had like parasthesias going off in my hands and feet which I never experienced before, then wham fever, sore throat, dry cough, then second wave with the worst bronchitis I've ever had by far, weird sore throat coming and going different places). All you can do is ride it out and know there's stuff out there that can do this to you. I've had to be easier on my body since my mid-20s. Hopefully at worst it will just come in waves, will fade over the years."
2020-04-19,Bucket_Monster,TooAfraidToAsk,2,https://www.reddit.com/r/TooAfraidToAsk/comments/g3hojw/do_the_people_who_think_being_told_to_stay_home/fnxijnp/,"Saying that people don't care about deaths from seasonal flu is also not true. Scientists spend a lot of time trying to determine which flu viruses will be most prevalent each year, prepare the corresponding vaccine mix and try their damnedest to get people to get the vaccine. Plus people have likely been exposed to those viruses so people have some level of natural immunity to them.

With the novel coronavirus, we don't have a vaccine. Nobody has a built up immunity. So the only thing we can do is to try to avoid catching it, either until there's a vaccine or (since we obviously can't completely avoid it) people have been exposed and their immune systems make the antibodies to combat the virus. The lockdown is really so that those exposures happen in a more controlled manner so hospitals can keep up. If everyone got exposed in a short period of time, those who might live with intervention end up dying because hospitals can't accommodate.

I'll admit that the original numbers were likely inflated, not because we were being lied to, but because we just weren't noticing a lot of the mild cases. As we've learned that a lot of cases don't even show symptoms, the calculated fatality rate has dropped."
2020-04-19,Bepisrory,UnitedNations,2,https://www.reddit.com/r/UnitedNations/comments/g4ftox/why_is_the_un_not_going_after_china/fnxj2ao/,"the coronavirus was not a “biohazard attack” it wasn’t created by the Chinese for warfare, China warned the WHO of a novel coronavirus as early as last December."
2020-04-19,crispyballoon21,stimuluscheck,2,https://www.reddit.com/r/stimuluscheck/comments/g4hvmg/non_filer_did_anyone_file_on_the_irs_freefilable/fnxj2jf/,"Yes, my son filed on April 11 and got the same email within an hr. after filing. I found this on the IRS web site but he hasnt heard anything else since he filed.

 

You  will receive an e-mail from Customer Service at Free File Fillable Forms that either acknowledges you have successfully submitted your  information, or that tells you there is a problem and how to correct it.  Free File Fillable forms will use the information to automatically  complete a Form 1040 and transmit it to the IRS to compute and send you a  payment.

[https://www.irs.gov/coronavirus/non-filers-enter-payment-info-here](https://www.irs.gov/coronavirus/non-filers-enter-payment-info-here)"
2020-04-19,commander_nice,bestof,2,https://www.reddit.com/r/bestof/comments/g4bxzd/uicesir_uderilect_uncover_2_potential_advertising/fnxkjxc/,"I'm currently watching the white house coronavirus task force press briefing fantasizing about one of the reporters asking about it. I know it won't happen, but just wondering what Trump's reaction would be what with how Trump tends to attack reporters or answer with word salads."
2020-04-19,KawakamiForever,ChapoTrapHouse,2,https://www.reddit.com/r/ChapoTrapHouse/comments/g4fo9g/this_is_one_of_the_top_comments_rpolitics_delenda/fnx50y2/,"Hahaha just saw that post! For reference, this is a post about Pelosi going on fox news and saying ""Trump gets an F for coronavirus response"".

Fucking hell, I hate to be a meme guy, but the whole ""Sir, your fired"" bit just keeps giving."
2020-04-19,ekcunni,moderatepolitics,2,https://www.reddit.com/r/moderatepolitics/comments/g48ww7/do_you_think_some_of_these_groups_should_be/fnx5936/,">It's to replace lost wages due to the Coronavirus

There are a lot of people who have not lost wages that are getting a check. (Myself included.) Stimulus checks aren't typically intended as wage replacement."
2020-04-19,WillyWarface,Coronavirus,2,https://www.reddit.com/r/Coronavirus/comments/g4b9r1/coronavirus_has_now_killed_more_people_in_us_than/fnx58pl/,"[He has loosened restrictions on elective surgeries and is reopening nonessential businesses on April 24th under new restrictions dubbed ""retail to go"".  He is planning to open other businesses to be announced on the 27th.](https://www.texastribune.org/2020/04/17/texas-reopening-greg-abbott-coronavirus/)"
2020-04-19,sarahkali,depression,2,https://www.reddit.com/r/depression/comments/g4fjtl/does_having_a_kid_help/fnx5dqs/,Totally agree. Plus a sprinkle of coronavirus which could affect our world for the worst forever. Kids are prob not the best thing to have.
2020-04-19,WhatTheFuh-uh-uh,StreetMartialArts,2,https://www.reddit.com/r/StreetMartialArts/comments/g4c4na/bjj_fighter_puts_basketball_player_in_a_straight/fnxjlwr/,"Do it and you'll be starting 4 years younger than I was when I started.  I just turned 53 and am competitive with other blue belts and purple belts.  Go slow and leave your ego off the mats.  But... DO.  IT.  As soon as this coronavirus mess passes, do it.  Google gyms in your area.  Visit a few of them and get on the mats for a few classes at each place.  PM me if you want suggestions based on where you live."
