date,author,subreddit,score,url,text
2020-02-04,XenosphereWarrior,Sino,1,https://www.reddit.com/r/Sino/comments/eyiyjw/some_thoughts_on_the_progression_of_2019_ncov/fgj7pn7/,"https://news.cgtn.com/news/2020-02-04/Expert-explains-why-Hubei-has-higher-mortality-rate-of-coronavirus-NNKmnf0Boc/index.html

It's mostly due to stretched medical resources and lack of medical personnel."
2020-02-04,My_workaccount00,worldnews,1,https://www.reddit.com/r/worldnews/comments/eyq5vp/live_thread_wuhan_coronavirus/fgj5hoc/,"Everything that I have read wether it's from WHO source or medical journals says that this has flu like symptoms and is very similar to the flu. Looks like 61,200 people died from the flue last year. So my question is, should we really be scared about the Coronavirus? is the media blowing this way out of proportion?"
2020-02-04,RelevantHelp,Health,1,https://www.reddit.com/r/Health/comments/eymfvf/the_chinese_doctor_who_tried_to_warn_others_about/fgj5omo/,"How bad is the coronavirus? I’ve had pneumonia a number of times in my life , is it worse than ordinary pneumonia?"
2020-02-04,Gnome-Ercy,uberdrivers,1,https://www.reddit.com/r/uberdrivers/comments/eyriqn/i_am_no_longer_picking_up_at_dulles_because_of/fgj5urr/,">You mean a virus that is on par with flu as far as symptoms go.  

I swear to god I am watching Contagion

""It's just the flu"" is bullshit

I you know the structure of the lung, you know they are like trees. Your trachea branches off into smaller tubes which branch off into smaller tunes which end in alveoli where oxygen is absorbed

Flu causes pneumonia. It makes alveoli in one node of your lung fill with fluid. It also inflames it so it is incapable of drawing in air

Coronavirus causes this to happen to *both of your entire lungs*

Saying it is the same is the flu is like saying a paper cut is the same as slashing your femoral arterty

> Thank you for your insights, Chicken Little. Some of us have health insurance AND disability insurance. A nice little paid hospital stay and I'll be good as new.

You will be infected for about two weeks before the symptoms show up

When they do, you better be in the ER with your insurance card out because it moves fast 

In one of the horrific videos of what is actually going on in China, there is a woman who's husband started getting sick. She called emergency services but he died before the ambulance got there 

`
> Uber told you that your next trip at the airport would have an extra $7 tacked on. They never promised you a quick ride. Had you waited long enough, you'd have gotten that $7. I mean, you already pissed away an hour, why not 3 more?

It's not so much about me or the others already there. It's about them drawing drivers away from lucrative areas with the promise of quickly getting a long trip with a bonus. They don't know it is bullshit until they are in the lot and see the queue is not moving


Considering IAD's location, you are almost guaranteed a nice long trip so it is worth the wait."
2020-02-04,YoungZM,canada,1,https://www.reddit.com/r/canada/comments/eyq1hm/airline_returns_to_toronto_after_passenger_claims/fgj737a/,"We all know joking about coronavirus in a pressurized tube isn't the same as joking with a friend. Stop being ridiculous. 

The whole point of tackling these people in a criminal manner is to address this from this behaviour exploding any further and making the law reflective/contemporary. 

Coughing in your buddies face and screaming ""Corona"" at a party makes you an idiot. Doing it on an airline should make you an inmate. It's no less serious than belting out any other inappropriate instances in the same setting such as bomb/terrorist/fire/gun, etc. It's not edgy, it's not funny, and it should have serious consequences.

We're talking about hundreds of thousands of dollars in damage *minimum* because someone with the maturity of a walnut wanted to have a giggle."
2020-02-04,AutoModerator,NoStupidQuestions,1,https://www.reddit.com/r/NoStupidQuestions/comments/eyttke/trump_and_the_wuhan_coronavirus/fgj7bra/,"Hello /u/amusing_racer! Thanks for your submission to /r/NoStupidQuestions! Unfortunately, it's been removed: 

* It looks like this may be a question that has been asked and answered here before - please check our list of [FAQ](https://www.reddit.com/r/NoStupidQuestions/wiki/index/faq) and see if this helps answer the question you're curious about.
* Also attempt to [search the subreddit](https://www.reddit.com/r/NoStupidQuestions/search?q=Coronavirus&restrict_sr=on&sort=relevance&t=all) for similar questions.

##[If you still can't find it, send us a note by clicking here](/message/compose/?to=/r/NoStupidQuestions&subject=Post removal&message=I am requesting reinstating /r/NoStupidQuestions/comments/eyttke/trump_and_the_wuhan_coronavirus/.  My reasons are:).


*I am a bot, and this action was performed automatically. Please [contact the moderators of this subreddit](/message/compose/?to=/r/NoStupidQuestions) if you have any questions or concerns.*"
2020-02-04,enolerobottii,macdemarco,1,https://www.reddit.com/r/macdemarco/comments/eyi7wp/by_any_chance_do_any_of_yall_know_the_name_of_the/fgj4ysb/,coronavirus
2020-02-04,iUsedToUseMyRealName,wallstreetbets,1,https://www.reddit.com/r/wallstreetbets/comments/eyoh7t/daily_discussion_thread_february_04_2020/fgj5jj4/,"We are all agreed that China is lying through its teeth on these Coronavirus numbers, right? I can't be the only one who has friends over there who are chatting with me about how scared they are?"
2020-02-04,povlova,askscience,1,https://www.reddit.com/r/askscience/comments/ewwmem/have_a_question_about_the_2019_novel_coronavirus/fgj6xtx/,"Hello, I'm a physician from Venezuela!

\-Have the epidemiological authorities already released data about the percentage of patients developing SARS?

\-Is there any clinical or laboratory finding ***suggestive*** of this new coronavirus infection, aside from a definitive diagnostic tests? We can't count on expensive, highly sensible/specific test here in Venezuela: they're either too expensive, or simply unavailable.

Have a great day."
2020-02-04,ZephirAWT,ScienceUncensored,1,https://www.reddit.com/r/ScienceUncensored/comments/eysgym/activists_are_bypassing_the_paywalls_and_are/fgj7fvw/,"[Drastic escalation of advice UK says all 30,000 UK citizens must leave China immediately.](https://www.dailymail.co.uk/health/article-7965149/Foreign-Office-warns-British-people-LEAVE-China-coronavirus-outbreak.html) Citizens warned to leave sooner than later as flights may not be available."
2020-02-04,Pathofthefool,answers,1,https://www.reddit.com/r/answers/comments/eyme55/is_the_us_chinatown_generally_safe_to_go_to/fgj7jht/,"The cat is out of the bag, you arent safe anywhere. But on the other hand, if the flu wont kill you the coronavirus probably wont either."
2020-02-04,Boisko,sweden,1,https://www.reddit.com/r/sweden/comments/eyo2yc/uppgifter_coronaviruset_fanns_på_svenskarnas_plan/fgj89y6/,"Som jämförelse kan vi ta ett annat coronavirus; influensa, som skördar över en *halv miljon* dödsoffer varje år. Det såg lite oroande ut när viruset först bröt ut, men nu är det långt fler som har återhämtat sig från sjukdomen än som har dött. Det är bara en tuffare variant av influensa. Ta't lugnt."
2020-02-04,autotldr,worldnews,1,https://www.reddit.com/r/worldnews/comments/eytpl5/russia_will_quarantine_wuhan_evacuees_in_siberia/fgj8to2/,"This is the best tl;dr I could make, [original](https://edition.cnn.com/asia/live-news/coronavirus-outbreak-02-04-20/h_7f21978c28d6ef1b8c275125c763db9e) reduced by 88%. (I'm a bot)
*****
> Russia will set up a quarantine area in Siberia for people travelling back from China&#039;s Hubei province due to the coronavirus outbreak, Deputy Prime Minister Tatiana Golikova said Tuesday.

> Two additional evacuation flights for American citizens are scheduled to depart Wuhan, the epicenter of the novel coronavirus outbreak, on Tuesday for military bases in California with a combined 550 passengers on board, a US official with knowledge of the matter told CNN&#039;s Steven Jiang in Beijing.

> Thailand confirms six new cases of coronavirusFrom Kocha Olarn in Bangkok and Isaac Yee in Hong Kong.Thai health officials have confirmed six additional cases of the Wuhan coronavirus - bringing the countrywide total to 25.Speaking at a press conference on Tuesday, the Director General for the Disease Control Department Dr. Suwannachai Wattanayingcharoen said that four of the new cases are Thai nationals, and two are Chinese nationals.


*****
[**Extended Summary**](http://np.reddit.com/r/autotldr/comments/eyu24t/russia_will_quarantine_wuhan_evacuees_in_siberia/) | [FAQ](http://np.reddit.com/r/autotldr/comments/31b9fm/faq_autotldr_bot/ ""Version 2.02, ~465174 tl;drs so far."") | [Feedback](http://np.reddit.com/message/compose?to=%23autotldr ""PM's and comments are monitored, constructive feedback is welcome."") | *Top* *keywords*: **coronavirus**^#1 **China**^#2 **Wuhan**^#3 **two**^#4 **official**^#5"
2020-02-04,robotevil,politics,1,https://www.reddit.com/r/politics/comments/eyqvvo/republican_party_official_quits_in_disgust_over/fgj9wmq/,"They are already drinking this: https://www.thedailybeast.com/qanon-conspiracy-theorists-magic-cure-for-coronavirus-is-drinking-lethal-bleach

Have to be careful of the keywords here, since apparently ""drink"" and ""chemical name"" will trigger an automod removal."
2020-02-04,anxiouscompensation,Meditation,1,https://www.reddit.com/r/Meditation/comments/eyosn0/really_disappointed_in_dhamma_a_bit_peeved/fgja9de/,I’m with the center on this one. Coronavirus is turning it to be much worse than we thought. More people have died from it than have recovered from it. Your gf probably doesn’t have it but all it takes is one mistake on their part and they’ve infected a whole town.
2020-02-04,aqualung_aqualung,China_Flu,1,https://www.reddit.com/r/China_Flu/comments/eyteaj/preparedness_with_noticing_price_hikes_product/fgjadwq/,"CoV-2019 solution for cities like Wuhan:

https://themilsource.com/thai-doctors-found-treatment-wuhan-coronavirus-2020/
""Dr. Kriangsak Atipornwanich, a medical doctor at Rajavithi Hospital in Bangkok, combined the anti-flu drug oseltamivir with lopinavir and ritonavir – antivirals used to treat human immunodeficiency virus (HIV).""

These 3 drugs are all tablets -- not liquid. 

-- The first drug is Tamiflu. Will be avail over the counter in USA later during 2020.

--- The last two are anti-HIV drugs in a combined tablet. ""Kaletra"" is the brand name for the paired combo. 

The Chinese govt should load tablets in packs of 3 on drones or helicopters, fly over the city, and drop the blister-packed meds to the people in the streets."
2020-02-04,sneakpeekbot,PS4Dreams,1,https://www.reddit.com/r/PS4Dreams/comments/eyrn12/dreams_early_access_players_will_unlock_full_game/fgjavap/,"Here's a sneak peek of /r/whoosh using the [top posts](https://np.reddit.com/r/whoosh/top/?sort=top&t=year) of the year!

\#1: [McQueen is superior](https://i.redd.it/e2zsgr8401931.jpg) | [27 comments](https://np.reddit.com/r/whoosh/comments/cahlv3/mcqueen_is_superior/)  
\#2: [We got a genius right here.](https://i.redd.it/u33fy3lvfdm31.jpg) | [19 comments](https://np.reddit.com/r/whoosh/comments/d3q1dx/we_got_a_genius_right_here/)  
\#3: [Coronavirus](https://i.redd.it/5d3x5bgxzvd41.png) | [22 comments](https://np.reddit.com/r/whoosh/comments/ew2y2f/coronavirus/)

----
^^I'm ^^a ^^bot, ^^beep ^^boop ^^| ^^Downvote ^^to ^^remove ^^| [^^Contact ^^me](https://www.reddit.com/message/compose/?to=sneakpeekbot) ^^| [^^Info](https://np.reddit.com/r/sneakpeekbot/) ^^| [^^Opt-out](https://np.reddit.com/r/sneakpeekbot/comments/ciakte/blacklist_vi/)"
2020-02-04,Chayoss,unitedkingdom,1,https://www.reddit.com/r/unitedkingdom/comments/eytxkk/coronavirus_uk_tells_all_britons_to_leave_china/fgj83lz/,"My analysis separately [here](https://np.reddit.com/r/medicine/comments/ets905/megathread_2019ncov_wuhan_coronavirus/fgj1gnk/).

This new guidance from the UK may reflect the possibility that the quarantine will either continue to expand until it reaches the nation's borders, or that the quarantine is likely to remain in effect for an uncomfortably long time with concomitant restrictions on civil liberties and difficulty accessing aid from embassies etc. Supply lines and basic necessities are [already threatened](https://www.nytimes.com/2020/02/04/business/china-coronavirus-food-prices.html), and even very lucrative businesses [are suspended](https://www.nytimes.com/2020/02/04/business/coronavirus-macau-gambling.html). The intensity of the instructions from the Chinese government has significantly increased and the language seems to set the scene for extreme action:

>Mr. Xi warned officials not to resist orders or to let ""bureaucratism"" slow government efforts to bring the outbreak under control. ""Those who disobey the unified command or shirk off responsibilities will be punished,"" Mr. Xi said, the Xinhua news agency reported."
2020-02-04,johncellis89,mildlyinteresting,1,https://www.reddit.com/r/mildlyinteresting/comments/eyoyoh/a_rat_enjoying_a_milkshake_in_the_backyard_of_my/fgj871o/,"I mean, NCoV just stands for Novel Coronavirus. So, it sort of is."
2020-02-04,Dependent_Tomato,TikTokCringe,1,https://www.reddit.com/r/TikTokCringe/comments/eyqs85/hey_look_im_american/fgj9j73/,hey look i'm Chinese *proceeds to get coronavirus*
2020-02-04,aqualung_aqualung,China,1,https://www.reddit.com/r/China/comments/eypiya/the_world_and_china/fgjax9y/,"CoV-2019 solution for cities like Wuhan:

https://themilsource.com/thai-doctors-found-treatment-wuhan-coronavirus-2020/
""Dr. Kriangsak Atipornwanich, a medical doctor at Rajavithi Hospital in Bangkok, combined the anti-flu drug oseltamivir with lopinavir and ritonavir – antivirals used to treat human immunodeficiency virus (HIV).""

These 3 drugs are all tablets -- not liquid. 

-- The first drug is Tamiflu. Will be avail over the counter in USA later during 2020.

--- The last two are anti-HIV drugs in a combined tablet. ""Kaletra"" is the brand name for the paired combo. 

The Chinese govt should load tablets in packs of 3 on drones or helicopters, fly over the city, and drop the blister-packed meds to the people in the streets."
2020-02-04,rotorydial,China_Flu,1,https://www.reddit.com/r/China_Flu/comments/eyszl2/likelihood_of_detection_outside_of_china/fgj7sdl/,Could coronavirus test positive on a different virus panel like rsv?
2020-02-04,CptnAlex,bugout,1,https://www.reddit.com/r/bugout/comments/eyq1wt/improvised_coronavirus_filter/fgj7rxl/,"I get what you’re saying but if you care this much about coronavirus, are you also getting your flu shot? 

There is a lot of worry over this but the flu has been killing tons of people each year and is largely ignored.

People like to choose what they get worked up about even if statistics/data don’t back it up."
2020-02-04,hunglikeahero,electronic_cigarette,1,https://www.reddit.com/r/electronic_cigarette/comments/ey9lvy/so_geekvape_has_an_aegis_pod_system_releasing_in/fgj8o71/,im not even sure rip had the go ahead to post the video. there isnt even a preview/sneak peak on the official geekvape pages. they have been off work for over a week for chinese new years and the coronavirus stuff.
2020-02-04,aqualung_aqualung,Coronavirus,1,https://www.reddit.com/r/Coronavirus/comments/eypwi7/amazon_needs_to_step_up_and_starts_controlling/fgjarpf/,"CoV-2019 solution for cities like Wuhan:

https://themilsource.com/thai-doctors-found-treatment-wuhan-coronavirus-2020/
""Dr. Kriangsak Atipornwanich, a medical doctor at Rajavithi Hospital in Bangkok, combined the anti-flu drug oseltamivir with lopinavir and ritonavir – antivirals used to treat human immunodeficiency virus (HIV).""

These 3 drugs are all tablets -- not liquid. 

-- The first drug is Tamiflu. Will be avail over the counter in USA later during 2020.

--- The last two are anti-HIV drugs in a combined tablet. ""Kaletra"" is the brand name for the paired combo. 

The Chinese govt should load tablets in packs of 3 on drones or helicopters, fly over the city, and drop the blister-packed meds to the people in the streets."
2020-02-04,Lurkingredditatwork,Coronavirus,1,https://www.reddit.com/r/Coronavirus/comments/eyrgbt/i_highly_suggest_to_invest_in_codx_now_the_us/fgj8fyj/," [https://www.businesswire.com/news/home/20200131005557/en/Co-Diagnostics-Announces-Successful-Initial-Verification-Coronavirus-Test](https://www.businesswire.com/news/home/20200131005557/en/Co-Diagnostics-Announces-Successful-Initial-Verification-Coronavirus-Test) 

&#x200B;

 [https://finance.yahoo.com/news/co-diagnostics-inc-announces-successful-203500987.html](https://finance.yahoo.com/news/co-diagnostics-inc-announces-successful-203500987.html) 

&#x200B;

 [https://video.foxbusiness.com/v/6128259124001/#sp=show-clips](https://video.foxbusiness.com/v/6128259124001/#sp=show-clips)"
2020-02-04,identiifiication,AskReddit,1,https://www.reddit.com/r/AskReddit/comments/eyk67k/parents_of_reddit_what_do_you_not_understand/fgj90wh/,sorta like coronavirus
2020-02-04,Mitoni,politics,1,https://www.reddit.com/r/politics/comments/eysj0l/2020_iowa_caucus_discussion_live_thread_part_vii/fgj9451/,I wonder if the lower caucus turnout numbers is due to worries about Wuhan Coronavirus?
2020-02-04,Arroyoyoyo,PewdiepieSubmissions,1,https://www.reddit.com/r/PewdiepieSubmissions/comments/eyu5wb/2020_has_been_shit_do_far/fgjatva/,China *renaming* coronavirus
2020-02-04,aqualung_aqualung,chn,1,https://www.reddit.com/r/chn/comments/eypict/the_world_and_china/fgjaxy5/,"CoV-2019 solution for cities like Wuhan:

https://themilsource.com/thai-doctors-found-treatment-wuhan-coronavirus-2020/
""Dr. Kriangsak Atipornwanich, a medical doctor at Rajavithi Hospital in Bangkok, combined the anti-flu drug oseltamivir with lopinavir and ritonavir – antivirals used to treat human immunodeficiency virus (HIV).""

These 3 drugs are all tablets -- not liquid. 

-- The first drug is Tamiflu. Will be avail over the counter in USA later during 2020.

--- The last two are anti-HIV drugs in a combined tablet. ""Kaletra"" is the brand name for the paired combo. 

The Chinese govt should load tablets in packs of 3 on drones or helicopters, fly over the city, and drop the blister-packed meds to the people in the streets."
2020-02-04,sciolycaptain,askscience,1,https://www.reddit.com/r/askscience/comments/ewwmem/have_a_question_about_the_2019_novel_coronavirus/fgj8c4h/,"You can review the WHO situation reports which break down country, source, and how many are severally I'll. https://www.who.int/emergencies/diseases/novel-coronavirus-2019/situation-reports/

I don't know what the public health infrastructure in Venezuela is like at this time (I suspect poor?).
In the United States, only the CDC is doing the specific OCR testing. Commercially available PCR tests for coronavirus will not detect 2019 nCoV.

There are no other lab tests you can use to differentiate this infection. But, at this time, the only treeatment is supportive care, like you would do for any other severe respiratory infection."
2020-02-04,jsmoove888,China_Flu,1,https://www.reddit.com/r/China_Flu/comments/eyn7uv/2_more_confirmed_cases_in_hong_kong_believed_to/fgj8jhc/,"I think the problem is we are now in flu / cold season and the coronavirus initial symptoms are very similar. The doctors would prob ask if they have been to Mainland, esp Wuhan / Hubei, if so you're getting tested, if not, they would think it's a cold. My guess is his symptoms weren't severe to a flu, more like a cold. At that time, there was not a h2h case in HK. The doc and hospitals prob thought it's an old man with a nagging cold."
2020-02-04,ThatAnnoyingLad,WiiHacks,1,https://www.reddit.com/r/WiiHacks/comments/eynoxo/korean_wii/fgj8qnh/,"Coronavirus comes as free gift.
Id buy it, 10 bucks are just 1 less burguer in my belly."
2020-02-04,Arashi_Kanashimi,worldnews,1,https://www.reddit.com/r/worldnews/comments/eui9ui/live_thread_wuhan_coronavirus/fgj9lwx/,"In the following article they mention it:

https://www.goodthingsguy.com/business/coronavirus-south-africa-operations-centres/

It looks like the 14 tested negative, thankfully. Other sources seem to have reported on it earlier, so at the time of me posting, they may have already been shown to be negative test results. Happy news!"
2020-02-04,Dalstar1000,Coronavirus,1,https://www.reddit.com/r/Coronavirus/comments/eytpng/who_wants_to_ruminate_together_on_this_article/fgj9pp3/,"I agree with your thoughts. Even if its not air pollution that causes higher amounts of ACE2 expression, densely populated areas also probably have higher numbers of air born pathogens which could also contribute to up-regulating expression of ACE-2. That said we dont know what other factors play a role and i am also not a scientist or a doctor. Definitely learned something though. I wasnt aware that sudden respiratory death syndrome was even related to this coronavirus. Thanks for sharing"
2020-02-04,aqualung_aqualung,Coronavirus,1,https://www.reddit.com/r/Coronavirus/comments/eyp9c4/wuhan_then_wenzhou_then/fgjamll/,"CoV-2019 solution for cities like Wuhan:

https://themilsource.com/thai-doctors-found-treatment-wuhan-coronavirus-2020/
""Dr. Kriangsak Atipornwanich, a medical doctor at Rajavithi Hospital in Bangkok, combined the anti-flu drug oseltamivir with lopinavir and ritonavir – antivirals used to treat human immunodeficiency virus (HIV).""

These 3 drugs are all tablets -- not liquid. 

-- The first drug is Tamiflu. Will be avail over the counter in USA later during 2020.

--- The last two are anti-HIV drugs in a combined tablet. ""Kaletra"" is the brand name for the paired combo. 

The Chinese govt should load tablets in packs of 3 on drones or helicopters, fly over the city, and drop the blister-packed meds to the people in the streets."
2020-02-04,aqualung_aqualung,Coronavirus,1,https://www.reddit.com/r/Coronavirus/comments/eyjthq/wow_i_am_actually_surprised_that_cnbc_is_letting/fgjaovq/,"CoV-2019 solution for cities like Wuhan:

https://themilsource.com/thai-doctors-found-treatment-wuhan-coronavirus-2020/
""Dr. Kriangsak Atipornwanich, a medical doctor at Rajavithi Hospital in Bangkok, combined the anti-flu drug oseltamivir with lopinavir and ritonavir – antivirals used to treat human immunodeficiency virus (HIV).""

These 3 drugs are all tablets -- not liquid. 

-- The first drug is Tamiflu. Will be avail over the counter in USA later during 2020.

--- The last two are anti-HIV drugs in a combined tablet. ""Kaletra"" is the brand name for the paired combo. 

The Chinese govt should load tablets in packs of 3 on drones or helicopters, fly over the city, and drop the blister-packed meds to the people in the streets."
2020-02-04,Zsnakejake,wallstreetbets,1,https://www.reddit.com/r/wallstreetbets/comments/eyoh7t/daily_discussion_thread_february_04_2020/fgj7t0o/,"Kinda wanna play Disney, but worry that the moment they mention coronavirus, the shares tank. Shanghai park closed, Chinese theaters closed, and so on. I don’t think it SHOULD have a detrimental affect, but I saw what that fear did to Starbucks earnings"
2020-02-04,kgrjbkh,CasualUK,1,https://www.reddit.com/r/CasualUK/comments/eyn0pr/back_in_my_day_if_we_contracted_bubonic_plague_we/fgj8fd8/,"Coronavirus is just a type of virus, like colds for example"
2020-02-04,160lbs,UIUC,1,https://www.reddit.com/r/UIUC/comments/eytyf6/supreme_court_in_china_orders_executions_for/fgj8qje/,"You again? This is your sixth post about China/coronavirus in the past two weeks.

Your previous comments [here](https://reddit.com/r/UIUC/comments/ewygvv/_/fg57bii/?context=1).

Also, this has absolutely nothing to do with r/UIUC."
2020-02-04,StartedGivingBlood,metacanada,1,https://www.reddit.com/r/metacanada/comments/eyu7mj/rosemary_barton_a_new_viral_threat_revives_an_old/fgj9snf/,Just in case you didn't catch the other 90 articles on the CBC about Coronavirus/racism.
2020-02-04,mesmer_adama,teslamotors,1,https://www.reddit.com/r/teslamotors/comments/eyqxzb/tsla_stock/fgjaosa/,What I don't get about this is the timing. The virus in china should reasonably affect the Chinese gigafactory and it might also be coming to the us soon. Would think the stock market should be more aware of this... https://www.cnbc.com/video/2020/02/04/we-must-assume-containment-for-coronavirus-will-fail-in-the-us-says-johns-hopkins-amesh-adalja.html
2020-02-04,aqualung_aqualung,China_Flu,1,https://www.reddit.com/r/China_Flu/comments/eysyns/twothirds_of_coronavirus_victims_are_men_chinese/fgjbc6f/,"CoV-2019 solution for cities like Wuhan:

https://themilsource.com/thai-doctors-found-treatment-wuhan-coronavirus-2020/
""Dr. Kriangsak Atipornwanich, a medical doctor at Rajavithi Hospital in Bangkok, combined the anti-flu drug oseltamivir with lopinavir and ritonavir – antivirals used to treat human immunodeficiency virus (HIV).""

These 3 drugs are all tablets -- not liquid. 

-- The first drug is Tamiflu. Will be avail over the counter in USA later during 2020.

--- The last two are anti-HIV drugs in a combined tablet. ""Kaletra"" is the brand name for the paired combo. 

The Chinese govt should load tablets in packs of 3 on drones or helicopters, fly over the city, and drop the blister-packed meds to the people in the streets."
2020-02-04,Dmscarred,AskReddit,1,https://www.reddit.com/r/AskReddit/comments/eyu2zd/what_are_pros_vs_cons_of_marriage_in_the_us_for/fgjbs5m/,Crotch fruit is one of my biggest fears. I try to avoid them like the plague. Actually more than the plague. I’d rather get the coronavirus than have a child because one of them I possibly can get rid of.
