date,author,subreddit,score,url,text
2020-02-22,lordofhell78,worldnews,3,https://www.reddit.com/r/worldnews/comments/f7sfpu/global_coronavirus_cases_are_spiking_and_the/fiife5b/,I typed in coronavirus today and barely had any results so I had to type in its new cool name and that's where I found everything. Funny that.  I live in the states and I worry about it all the time but I stopped looking it up everyday cuz it was freaking me out
2020-02-22,MerlinGrandCaster,AskReddit,3,https://www.reddit.com/r/AskReddit/comments/f82bpl/rsv_causes_10_of_all_colds_and_has_a_03_mortality/fiifvyy/,"Coronavirus is new. Plus, it's closer to influenza than a common cold, so the symptoms are worse."
2020-02-22,Kingkwon83,korea,3,https://www.reddit.com/r/korea/comments/f7vjd0/2020_coronavirus_covid19_outbreak_in_south_korea/fiig0im/,"I don't have too much faith in governments learning their lessons. Take China for example. You'd think they would have learned their lesson from trying to cover up the SARS outbreak. Nope, they did the same shit again with this new coronavirus."
2020-02-22,je101,Coronavirus,3,https://www.reddit.com/r/Coronavirus/comments/f81wwd/israel_bars_south_korean_tourists_nytimes_02222020/fiig224/,"Check out the last question in the FAQs section on the official Israeli coronavirus website:  [https://govextra.gov.il/ministry-of-health/corona/corona-virus-en/](https://govextra.gov.il/ministry-of-health/corona/corona-virus-en/) 

"" However, checkpoints will most likely be closed soon to anyone who is not an Israeli resident. ""

So it seems like they're actually thinking about closing the borders.

The Hebrew version of this website even has the option to ""snitch"" on people who don't obey the home quarantine law (currently for people coming from China, Thailand, HK, Singapore, Macau, SK, Japan), it's actually punishable by up to 7 years in prison."
2020-02-22,thesoundofthewind,worldnews,3,https://www.reddit.com/r/worldnews/comments/f7newo/a_woman_in_canada_tested_positive_for_coronavirus/fih0pms/,"not an english [source](https://tr.sputniknews.com/turkiye/202002221041456855-yetkililer-dogruladi-van-ve-hakkaride-3u-iran-sinirindan-gecis-yapan-5-kisi-koronavirus-suphesiyle/) but today 3 people in van, turkey also hospitalised for high fever after entering to Turkey from Iran. ministry of health said that there is no coronavirus thread but it seems suspicious."
2020-02-22,sheeshman,MMA,3,https://www.reddit.com/r/MMA/comments/f802k9/spoiler_callan_potter_vs_song_kenan/fii34a1/,This guy trains at the UFC pi in Shanghai but went to tiger because of coronavirus.
2020-02-22,reddittallintallin,China_Flu,3,https://www.reddit.com/r/China_Flu/comments/f80wf2/serious_replies_only_if_i_buy_takeout_food_and/fihw22f/,"Microwave deactivate virus through heat, if your food is hated, could be good idea to reheat to 60° 


This is not about Coronavirus but could be interesting
https://www.ncbi.nlm.nih.gov/pmc/articles/PMC5114683/"
2020-02-22,whatTheHeyYoda,China_Flu,3,https://www.reddit.com/r/China_Flu/comments/f7zjuu/this_piece_didnt_age_well/fihvwpl/,"In their defence....sigh...I got nothing.  Anyone?

Headline:. Don’t Worry About The Coronavirus. Worry About The Flu.

Key aging milk points:
'In the US, there are now [six confirmed cases](https://www.buzzfeednews.com/article/danvergano/first-us-transmission-coronavirus-chicago). An additional 110 people are under observation, according to Messonnier. The “great majority” are travelers from Wuhan or people who had close contact with them. “The general risk to the [US] public is low at this time,” she stressed.'

'Over the weekend, a number of estimates emerged, ranging from 1.3 to 3.8. Harvard health economist Eric Feigl-Ding called the 3.8 value “thermonuclear pandemic level bad” '

'Even the high number isn’t so terrifying, Messonnier said. “As a comparison, the R0 for measles is between 12 and 18,” she said. '

'For [people in the US](https://www.cdc.gov/coronavirus/about/prevention.html), CDC suggests washing your hands frequently; not putting your fingers in your mouth, eyes, or nose; and avoiding sick people — standard advice during flu season. '

'Masks would not be necessary for anyone in the US, Health and Human Services Secretary Alex Azar said on Tuesday.'

'[Others have suggested](https://www.cdc.gov/media/releases/2020/t0127-coronavirus-update.html) imports from China could carry a risk of transmission overseas. But coronavirus particles die within a few hours outside a host cell, according to Messonnier.'"
2020-02-22,bluehexagon1776,conspiracy,3,https://www.reddit.com/r/conspiracy/comments/f81pdw/the_united_states_china_and_the_who_is_lying_to/fii7mge/,SS: There is a coverup underway from the major powers. There is little talk about the Coronavirus in the news but infections are speeding up and it is much worse that what anybody is telling you.
2020-02-22,ch1p_skylark,wallstreetbets,3,https://www.reddit.com/r/wallstreetbets/comments/f7hla8/weekend_discussion_thread_february_2123_2020/fii5ybe/," [https://fortune.com/2020/02/21/fortune-1000-coronavirus-china-supply-chain-impact/](https://fortune.com/2020/02/21/fortune-1000-coronavirus-china-supply-chain-impact/) 

only 94%? bullish buy calls"
2020-02-22,__Ritish__,Coronavirus,3,https://www.reddit.com/r/Coronavirus/comments/f81eug/youll_probably_never_read_this_reddit_users/fii573r/,"I actually tried myself on Google and DuckduckGo by searching ""r/Coronavirus"" and found that whereas on DuckduckGo this thread appears on 1st place, using Google you will have to scroll down a little to find the link result to it, which is kind of strange since ""r/Coronavirus"" is pretty specific itself and you should probably find it in 1st place, just as you will find it using DuckduckGo, since Google is suposedly ""better""."
2020-02-22,HexFyber,worldnews,3,https://www.reddit.com/r/worldnews/comments/f7tv9m/italian_towns_on_lockdown_after_2_virus_deaths/fiigh5z/,"I live pretty close to a town that is now under lockdown. I can say the people around here are quite afraid and under a media perspective there's a 50:50 between those who state out how bad it really is and those who tend to make it bigger than it is.

I'm working as waiter and this was the first saturday we couldn't get enough people to fill the restaurant like we used to see every single week-end. Some have even called us to take back their table reservation, most likely due to fear at this point.

Everywhere I go, the thematic it's that one, coronavirus. It's kinda annoying but comprehensible, will see what happens during the next weeks"
2020-02-22,LamarOdomWhosOnCRACK,barstoolsports,3,https://www.reddit.com/r/barstoolsports/comments/f80u42/saturday_night_drunk_thread/fiih5i6/,Jesus dude shut the fuck up all you do is post in here crying about coronavirus
2020-02-22,StonerMom1987,Coronavirus,3,https://www.reddit.com/r/Coronavirus/comments/f80v00/anniston_alabama_fema_facility_to_be_used_as/fii9xcs/,"Seems to me, I'd be more worried about the ones ""self quarantining"" in Alabama....at least the ones in the fema can't leave as they please. 

""Between 50 to 100 people who have traveled to Wuhan, Hubei province or mainland China are being monitored.

All those who are being monitored stay in self-isolation and maintain daily contact with the health department for 14 days.

The number of those being monitored in Alabama changes daily due to when they reported.""

https://abc3340.com/news/local/alabama-dept-of-public-health-monitoring-dozens-for-coronavirus"
2020-02-22,Flemtality,PAX,3,https://www.reddit.com/r/PAX/comments/f7xrq0/boston_mayor_formally_asks_sony_to_reconsider_pax/fiid1jg/,"I got that impression after awhile, but the initial headlines made it seem like Sony was afraid of Boston like it's some kind of coronavirus hotbed, or will be with thousands of people around the world flying in. I'm also still not convinced that isn't partially what they were saying, because they really didn't get specific."
2020-02-22,PROMOLOZO,China_Flu,3,https://www.reddit.com/r/China_Flu/comments/f818nx/as_an_italian_my_humble_opinion_of_why_italy_has/fiifupt/,"If this is actually the case, and it may very well be.... we are screwed. Airlines have been going full-steam hourly as usual.

I was just at Costco in San Diego-it was packed like sardines. I had this thought that if even one person in there had coronavirus... oh boy..."
2020-02-22,fermatprime,wallstreetbets,3,https://www.reddit.com/r/wallstreetbets/comments/f80w0e/so_two_days_of_losses_and_somehow_that_means_a/fiisyzd/,"People buying short-dated call options are implicitly trading with a lot of leverage, which means small moves in stock prices have big effects on the mark-to-market value of the options. The autists here also often trade options on high-beta stocks that generally have bigger price swings than the market average. Finally, it's hard to diversify your options portfolio across 20-30 bets if you don't have at least a few thousand bucks to play with. Put these things together and it turns a 1% drop in the S&P into 1929, 1987 and 2008 all rolled into one.

My portfolio is mostly stonks and was down 10 basis points on the week. If the coronavirus means the market crashes on Monday... well, my AAPL will go down, my UAL may go back to where I bought it, but people will still need cigarettes and fireproofing materials and cardboard packaging and banks.

(inb4 ""go back to r/investing"")"
2020-02-22,aligatormannow,China_Flu,3,https://www.reddit.com/r/China_Flu/comments/f838ik/i_am_having_a_hard_time_believing_the_cdc_is/fiit9cj/,But do you really believe the administration is competent enough to pull something like this off? More likely that T bag would say Coronavirus was fake news
2020-02-22,Knows-something,China_Flu,3,https://www.reddit.com/r/China_Flu/comments/f7vrji/trump_furious_after_officials_allowed_americans/fiiswxi/,""" 

**Separately, the FDA has notified blood donation centers that they may encourage potential donors to defer giving blood if they have traveled to areas affected by the outbreak or if they suspect a potential infection.** 

**However,** [**the agency said**](https://www.fda.gov/vaccines-blood-biologics/safety-availability-biologics/important-information-blood-establishments-regarding-novel-coronavirus-outbreak) **the potential for 2019-nCoV transmission through blood, as with respiratory viruses in general, is considered low and should be caught by routine screening methods—such as donors being in good health and having a normal body temperature on the day of donation.""**

For blood, apparently there is no test.  All will be caught by routine screening methods.  Finally something ROTF funny."
2020-02-22,vatoniolo,AmItheAsshole,3,https://www.reddit.com/r/AmItheAsshole/comments/f83a0u/wibta_for_askinginsisting_that_my_flatmate_start/fiiswyz/,Oh man you were already NTA but add the Coronavirus on top? Get her out asap
2020-02-22,MacPepper,conspiracy,3,https://www.reddit.com/r/conspiracy/comments/f83g29/california_government_cdc_plan_coronavirus/fiito5q/,"**Submission Statement:**

California and CDC are expedite planning coronavirus quarantine center in densely populated urban Southern California. Local officials moved to temporarily block plan as it doesn’t appear to make sense."
2020-02-22,SimplyTennessee,Coronavirus,3,https://www.reddit.com/r/Coronavirus/comments/f83gag/uk_to_start_drive_through_testing_on_monday/fiiuvh7/,https://www.expressandstar.com/news/health/2020/02/14/coronavirus-pods-set-up-at-black-country-hospitals/
2020-02-22,RytheGuy97,vancouver,3,https://www.reddit.com/r/vancouver/comments/f7zhz5/you_gotta_be_kidding_me/fiixuzt/,I’m not trying to imply that we shouldn’t do basic hygienic things to prevent contracting coronavirus like washing their hands. I just don’t like the fear mongering. I can’t stand how people are looking at Chinese people with suspicion that they might have coronavirus. Those 6 cases were quarantined and they all recovered.
2020-02-22,anagramqueen,AskReddit,3,https://www.reddit.com/r/AskReddit/comments/f83vk4/on_a_110_how_afraid_of_corona_virus_are_you/fiix0z1/,Makes sense. I'm at a 4-5 for the flu if that makes her feel any better. Coronavirus is just new and dramatic and exciting.
2020-02-22,XxNerdKillerxX,investing,3,https://www.reddit.com/r/investing/comments/f7vboa/after_reading_a_lot_i_came_to_the_conclusion_we/fij0r0p/,"Coronavirus isn't temporary. The flu comes back every year, and coronavirus is far more infectious than the flu."
2020-02-22,EveryoneDies2019,China_Flu,3,https://www.reddit.com/r/China_Flu/comments/f7xhh5/almost_all_patients_in_south_korean_psychiatric/fij027i/,"I love my country but criticism of our leaders is stifled in authoritarian Singapore.

Singapore still thinks its fighting SARS deploying temperature screeners when every research out there states that its almost useless and psychological theatre for an asymptomatic disease with long incubation.

Feels like its using World War 1 horses to battle World War 2 tanks.

https://www.npr.org/sections/health-shots/2020/01/23/798919318/can-airport-screening-help-stop-the-spread-of-wuhan-coronavirus

And Singapore tells its citizens to not wear masks unless sick. Because they must be the only country with masks shortages.

With a government stockpile of 16milliom excluding surgical, Singapore actually has way more n95s than most countries! 

2.8 n95s per person. Feel free to calculate other countries ratios.

https://www.channelnewsasia.com/news/singapore/haze-n95-face-masks-available-national-stockpile-moh-government-11919286

Meanwhile the government is sending tons of masks to China. 

https://www.straitstimes.com/singapore/coronavirus-mindef-sends-2000kg-of-medical-supplies-to-china-to-help-with-relief-efforts?utm_medium=Social&utm_campaign=STFB&utm_source=Facebook&fbclid=IwAR1jQ6F-9sHpKrMaCZcgIfAcVJzAyLIwc84x2Db71EGBy9a3rX67TYOapF8#Echobox=1582329691"
2020-02-22,arewebeingplutoed,China_Flu,3,https://www.reddit.com/r/China_Flu/comments/f845lt/are_there_any_personal_accounts_blogger_or_web/fiizs7a/,"Not a personal account.  However, it’s a record of
Symptom Progression Day 1 to Day 12 From
First Case of 2019 Novel Coronavirus in the United States 

35 year old male

https://www.nejm.org/doi/full/10.1056/NEJMoa2001191

On January 19, 2020, a 35-year-old man presented to an urgent care clinic in Snohomish County, Washington, with a 4-day history of cough and subjective fever. On checking into the clinic, the patient put on a mask in the waiting room. After waiting approximately 20 minutes, he was taken into an examination room and underwent evaluation by a provider. He disclosed that he had returned to Washington State on January 15 after traveling to visit family in Wuhan, China. The patient stated that he had seen a health alert from the U.S. Centers for Disease Control and Prevention (CDC) about the novel coronavirus outbreak in China and, because of his symptoms and recent travel, decided to see a health care provider....

Given the patient’s travel history, the local and state health departments were immediately notified. Together with the urgent care clinician, the Washington Department of Health notified the CDC Emergency Operations Center. Although the patient reported that he had not spent time at the Huanan seafood market and reported no known contact with ill persons during his travel to China, CDC staff concurred with the need to test the patient for 2019-nCoV on the basis of current CDC “persons under investigation” case definitions.8 Specimens were collected in accordance with CDC guidance and included serum and nasopharyngeal and oropharyngeal swab specimens. After specimen collection, the patient was discharged to home isolation with active monitoring by the local health department.
On January 20, 2020, the CDC confirmed that the patient’s nasopharyngeal and oropharyngeal swabs tested positive for 2019-nCoV by real-time reverse-transcriptase–polymerase-chain-reaction (rRT-PCR) assay. In coordination with CDC subject-matter experts, state and local health officials, emergency medical services, and hospital leadership and staff, the patient was admitted to an airborne-isolation unit at Providence Regional Medical Center for clinical observation, with health care workers following CDC recommendations for contact, droplet, and airborne precautions with eye protection.

On admission, the patient reported persistent dry cough and a 2-day history of nausea and vomiting; he reported that he had no shortness of breath or chest pain. Vital signs were within normal ranges. On physical examination, the patient was found to have dry mucous membranes. The remainder of the examination was generally unremarkable. After admission, the patient received supportive care, including 2 liters of normal saline and ondansetron for nausea.


On days 2 through 5 of hospitalization (days 6 through 9 of illness), the patient’s vital signs remained largely stable, apart from the development of intermittent fevers accompanied by periods of tachycardia (Figure 2). The patient continued to report a nonproductive cough and appeared fatigued. On the afternoon of hospital day 2, the patient passed a loose bowel movement and reported abdominal discomfort. A second episode of loose stool was reported overnight; a sample of this stool was collected for rRT-PCR testing, along with additional respiratory specimens (nasopharyngeal and oropharyngeal) and serum. The stool and both respiratory specimens later tested positive by rRT-PCR for 2019-nCoV, whereas the serum remained negative.

Treatment during this time was largely supportive. For symptom management, the patient received, as needed, antipyretic therapy consisting of 650 mg of acetaminophen every 4 hours and 600 mg of ibuprofen every 6 hours. He also received 600 mg of guaifenesin for his continued cough and approximately 6 liters of normal saline over the first 6 days of hospitalization.


A chest radiograph taken on hospital day 3 (illness day 7) was reported as showing no evidence of infiltrates or abnormalities (Figure 3). However, a second chest radiograph from the night of hospital day 5 (illness day 9) showed evidence of pneumonia in the lower lobe of the left lung (Figure 4). These radiographic findings coincided with a change in respiratory status starting on the evening of hospital day 5, when the patient’s oxygen saturation values as measured by pulse oximetry dropped to as low as 90% while he was breathing ambient air. On day 6, the patient was started on supplemental oxygen, delivered by nasal cannula at 2 liters per minute. Given the changing clinical presentation and concern about hospital-acquired pneumonia, treatment with vancomycin (a 1750-mg loading dose followed by 1 g administered intravenously every 8 hours) and cefepime (administered intravenously every 8 hours) was initiated.


On hospital day 6 (illness day 10), a fourth chest radiograph showed basilar streaky opacities in both lungs, a finding consistent with atypical pneumonia (Figure 5), and rales were noted in both lungs on auscultation. Given the radiographic findings, the decision to administer oxygen supplementation, the patient’s ongoing fevers, the persistent positive 2019-nCoV RNA at multiple sites, and published reports of the development of severe pneumonia3,4 at a period consistent with the development of radiographic pneumonia in this patient, clinicians pursued compassionate use of an investigational antiviral therapy. Treatment with intravenous remdesivir (a novel nucleotide analogue prodrug in development10,11) was initiated on the evening of day 7, and no adverse events were observed in association with the infusion. Vancomycin was discontinued on the evening of day 7, and cefepime was discontinued on the following day, after serial negative procalcitonin levels and negative nasal PCR testing for methicillin-resistant Staphylococcus aureus.

On hospital day 8 (illness day 12), the patient’s clinical condition improved. Supplemental oxygen was discontinued, and his oxygen saturation values improved to 94 to 96% while he was breathing ambient air. The previous bilateral lower-lobe rales were no longer present. His appetite improved, and he was asymptomatic aside from intermittent dry cough and rhinorrhea. 

As of January 30, 2020, the patient remains hospitalized. He is afebrile, and all symptoms have resolved with the exception of his cough, which is decreasing in severity.


(The above referenced patient survived and was released from hospital and “remains isolated at home.”) see;
https://www.google.com/amp/s/www.usnews.com/news/healthiest-communities/articles/2020-02-04/first-us-coronavirus-patient-released-from-hospital%3fcontext=amp


The JAMA related to the first story: https://jamanetwork.com/journals/jama/fullarticle/2761044"
2020-02-22,DARCKER2626,teenagers,3,https://www.reddit.com/r/teenagers/comments/f84gq0/so_this_is_for_a_skit_whats_the_most_awkward/fij0gd2/,I got the coronavirus
2020-02-22,delqath,preppers,3,https://www.reddit.com/r/preppers/comments/f83m77/coronavirus_infected_passengers_to_possibly_be/fij2lp7/,"If you're under 80 and reasonably healthy then statistically you have no reason to worry (yet).   I'm basing my data from  [https://www.worldometers.info/coronavirus/coronavirus-age-sex-demographics/](https://www.worldometers.info/coronavirus/coronavirus-age-sex-demographics/)  , take that with a grain of salt, then form your own opinion.  Just remember 99% of the deaths have been in China in overcrowded conditions. 

Also if anyone else has any other data like this actually looking at age group breakdown  I would love to see it."
2020-02-22,CoronaVirusSexy,teenagers,3,https://www.reddit.com/r/teenagers/comments/f84ntu/im_really_sick_rn_and_i_feel_super_cold_in_a_room/fij1rny/,Coronavirus
2020-02-22,WaitWhatOhNevermind,Coronavirus,3,https://www.reddit.com/r/Coronavirus/comments/f7tn54/cdc_says_only_35_confirmed_cases_in_ca_but/fif0bnl/,"As of February 22, 2020 at 15:10 GMT, there have been 35 confirmed cases of patients infected with the 2019 novel coronavirus (2019-nCoV) in the United States:

18 former passengers of the Diamond Princess cruise ship in Japan.


10 in California

2 in Illinois

1 in Wisconsin

1 in Arizona

1 in Washington state

1 in Massachusetts

1 in Texas"
2020-02-22,bluntlybipolar,marketing,3,https://www.reddit.com/r/marketing/comments/f7ucc9/tasteful_coranavirus_marketing/fifa9gd/,"I think the key here is to not mention the coronavirus at all. There's no reason to. Your manufacturing clients already know what's up with the reasons their suppliers aren't keeping up. 

Just say something like, ""You know we have the product you need, available and ready to ship right now with no delays.""

I think that any mention of it at all could be interpreted as tacky or disrespectful, so I'd avoid it altogether personally. Focus on their problem and your solution."
2020-02-22,CamarosAndCannabis,wallstreetbets,3,https://www.reddit.com/r/wallstreetbets/comments/f7hla8/weekend_discussion_thread_february_2123_2020/fifaax0/,Which is also a coronavirus
2020-02-22,bsauerapple,PewdiepieSubmissions,3,https://www.reddit.com/r/PewdiepieSubmissions/comments/f7uehw/the_press_is_back_at_it_again/fifbecv/,https://www-ccn-com.cdn.ampproject.org/v/s/www.ccn.com/pewdiepie-laughs-at-coronavirus-in-racially-edgy-return-video/?amp_js_v=a3&amp_gsa=1&usqp=mq331AQFKAGwASA%3D#referrer=https%3A%2F%2Fwww.google.com&amp_tf=From%20%251%24s&ampshare=https%3A%2F%2Fwww.ccn.com%2Fpewdiepie-laughs-at-coronavirus-in-racially-edgy-return-video%2F
2020-02-22,Chapose,Drama,3,https://www.reddit.com/r/Drama/comments/f7u45t/coronachan_has_reached_the_freeish_world/fifk4iw/,Who even talks about coronavirus anymore? Its *sooo* last week 🙄
2020-02-22,poobert24,China_Flu,3,https://www.reddit.com/r/China_Flu/comments/f7uu5g/have_we_ever_seen_a_spread_of_an_infectious/fifjld3/,"Check the coronavirus timeline on Wikipedia. 

2-3% in Wuhan where their hospitals are overwhelmed, considerably less outside."
2020-02-22,mage2love1,wallstreetbets,3,https://www.reddit.com/r/wallstreetbets/comments/f7u6jv/i_only_wish_the_market_would_take_me_out_for_a/fifx8nj/,What do you expect you’re buying stocks that have been pumped for months and to top it off we’re in a coronavirus worldwide breakout.
2020-02-22,reddittallintallin,Coronavirus,3,https://www.reddit.com/r/Coronavirus/comments/f7vogd/china_should_roll_out_inhome_testing_kits_rest_of/fifwpek/,"Someone just posted about the topic

https://www.reddit.com/r/Coronavirus/comments/f7vpu5/15_minute_test_kit_developed_new_china_tv_video/?utm_medium=android_app&utm_source=share

Enjoy learning!"
2020-02-22,arinjoyn,Wuhan_Flu,3,https://www.reddit.com/r/Wuhan_Flu/comments/f7w4xy/costa_mesa_preliminary_injunction_states_3550/fig8lcf/,"CBS reported on 70 being transferred there from Travis Air Force Base  this was the link but it's been taken down
https://losangeles.cbslocal.com/2020/02/21/costa-mesa-coronavirus/"
2020-02-22,Blaboons,PewdiepieSubmissions,3,https://www.reddit.com/r/PewdiepieSubmissions/comments/f7wyja/here_we_go_again/figc49f/,https://www.ccn.com/pewdiepie-laughs-at-coronavirus-in-racially-edgy-return-video/ the link of anybody wants to read a bunch of bullcrap.
2020-02-22,Hippo-Hippo,news,3,https://www.reddit.com/r/news/comments/f7s5n4/i_brainwashed_myself_with_the_internet_nearly_45/figfm1p/,"> ""Birth is not a medical event but a spontaneous function of biology.""

The same can be said about contracting coronavirus."
