date,author,subreddit,score,url,text
2020-02-22,LordHughRAdumbass,xrmed,2,https://www.reddit.com/r/xrmed/comments/f7u0v1/amazon_ecommerce_could_soon_get_a_boost_from/figx0kl/,"[https://wikileaks.org/amazon-atlas/map/](https://wikileaks.org/amazon-atlas/map/)

[https://www.reddit.com/r/xrmed/comments/equ8m5/can\_someone\_help\_me\_out\_here\_with\_a\_technical/ffkx4k4/?context=3](https://www.reddit.com/r/xrmed/comments/equ8m5/can_someone_help_me_out_here_with_a_technical/ffkx4k4/?context=3)

[https://www.healthcareitnews.com/news/coronavirus-outbreak-used-hackers-spread-malware](https://www.healthcareitnews.com/news/coronavirus-outbreak-used-hackers-spread-malware)

[https://www.jpost.com/HEALTH-SCIENCE/A-coronavirus-like-disease-can-be-created-through-cyber-attack-618084](https://www.jpost.com/HEALTH-SCIENCE/A-coronavirus-like-disease-can-be-created-through-cyber-attack-618084)

[https://www.proofpoint.com/us/corporate-blog/post/coronavirus-themed-attacks-target-global-shipping-concerns](https://www.proofpoint.com/us/corporate-blog/post/coronavirus-themed-attacks-target-global-shipping-concerns)

They don't call it Corvid-19 for nothing: [https://www.corvidcyberdefense.com/managed-services/](https://www.corvidcyberdefense.com/managed-services/)"
2020-02-22,lordDEMAXUS,boxoffice,2,https://www.reddit.com/r/boxoffice/comments/f7von0/can_i_just_say_how_much_2020_already_is/figx04j/,"Holy shit, I've been frequenting /r/Coronavirus for a while and didn't hear about this until a few hours ago. If we get sudden spikes like in Italy and SK, it's gonna be really bad by the end of next month. Thank god I live in the middle of a desert."
2020-02-22,Terminal-Psychosis,Bannedfromcoronavirus,2,https://www.reddit.com/r/Bannedfromcoronavirus/comments/f7pey9/ph03nix_170k_karma_mod_went_out_of_his_way_for/figxxm2/,"The irony of this asshat calling /Wuhan_Flu a ""dangerous misinfo incubator"", and then praising the cancer subs /China_Flu & /Coronavirus, that are nothing more than pro-commie, pro-Cina propaganda.

Keeping people from knowing the truth, only allowing ""official"" Chinese gov propaganda and disinformation can, and most likely is,  getting people killed.

Disgusting, they care nothing of the people they are damaging, only their petty power games."
2020-02-22,HP41CL,Coronavirus,2,https://www.reddit.com/r/Coronavirus/comments/f7ykf8/why_is_rcollapse_related_to_this/figyhw1/,"You might get an answer if you ask the Mods at:

[https://reddit.com/message/compose?to=/r/Coronavirus](https://reddit.com/message/compose?to=/r/Coronavirus)"
2020-02-22,Throwingitout20,China_Flu,2,https://www.reddit.com/r/China_Flu/comments/f81h4y/where_is_dr_xiangguo_qiu/fiidllg/,"Well you didn't look very hard. It was discussed on 4 chan before reddit and aside from that a simple google search finds it on youtube and various websites. Even the BBC has an article about it, predictably calling it misinformation but clearly it got around to a lot more than your few conspiracy theorists on reddit.

[Dr. Xiangguo Qiu – Chinese Biological Warfare Agent](https://greatgameindia.com/dr-xiangguo-qiu-chinese-biological-warfare-agent/)

[Chinese Agent Spied and Shipped Coronavirus](https://youtube.com/watch?v=5QbqMh_dQfU)

[From Canada to China: Wuhan Coronavirus Launches Global Depopulation Plan?](https://civilianintelligencenetwork.ca/2020/01/25/from-canada-to-china-wuhan-coronavirus-launches-global-depopulation-plan/)



Of course it all could be have been a red herring to hide something else but her lack of a response is strange."
2020-02-22,djolera,Coronavirus,2,https://www.reddit.com/r/Coronavirus/comments/f7swwe/54_confirmed_cases_in_italy/fiewihu/,Spain is ‘free of coronavirus’ oficially... i’m shiting my pants.
2020-02-22,ZeroLurkThirty,cursedcomments,2,https://www.reddit.com/r/cursedcomments/comments/f7ti5d/cursed_self_driving_car/fiexerp/,Get the car to detect coronavirus
2020-02-22,alnex,MMA,2,https://www.reddit.com/r/MMA/comments/f7nas5/official_general_discussion_thread_february_22/fiewm20/,"Coronavirus is spreading in Italy. 

I swear to God that if I die before Tony-Khabib I'll get mad."
2020-02-22,Sidonieone,Coronavirus,2,https://www.reddit.com/r/Coronavirus/comments/f7sws5/7_of_south_koreas_confirmed_coronavirus_cases_had/fiezmte/,"Apparently Israel’s health Ministry confirms this story

https://www.jpost.com/Breaking-News/SKorea-reports-142-additional-coronavirus-cases-brings-total-to-34-618364"
2020-02-22,1337_L34f,China_Flu,2,https://www.reddit.com/r/China_Flu/comments/f7so1y/the_number_of_confirmed_coronaviruscovid19_cases/fif16xi/,"No we haven't had ""lots"", I think we've had 4 since 1900, and all being flu strains. Yes you're right we haven't seen a coronavirus pandemic at least not in the past couple centuries. But I'm not just going to blindly compare it to the Spanish flu, because its different viruses, different times, and we don't have a world war going on, and we have better healthcare. But yeah maybe I should ""bc it killed up to 100 million people""."
2020-02-22,sweetchillileaf,Coronavirus,2,https://www.reddit.com/r/Coronavirus/comments/f7te8h/the_nhs_are_piloting_at_home_testing_in_london/fif2x76/,"Iran  is not on the list, source: NHS website 
https://www.nhs.uk/conditions/coronavirus-covid-19/"
2020-02-22,unrulystowawaydotcom,Coronavirus,2,https://www.reddit.com/r/Coronavirus/comments/f7pos2/largescale_kpop_concert_featuring_bts_postponed/fif9suu/,They don’t want to be singing “Boy With Coronavirus” next album.
2020-02-22,Nevarma,teenagers,2,https://www.reddit.com/r/teenagers/comments/f7ubzz/first_post/fif9ac9/,Coronavirus. There are no confirmed cases yet. But the country is taking extreme measures.
2020-02-22,antihexe,Coronavirus,2,https://www.reddit.com/r/Coronavirus/comments/f7tu93/if_incubation_time_can_be_up_to_27_days_why_are/fif4vr5/,"I'm a little out of the loop on this. 

Where is  the 24 days is the current understanding coming from exactly? Is this speculation or official information? What's normal for a coronavirus? 24 days seems insanely way too long. SARS, which this is similar to, was only 2-7 days generally and up to 10 days maximum. covid-19 doesn't seem to be *that* different than previous coronaviruses. I have a hard time believing that covid-19 has upended the way these viruses work.

I've been interpreting all of these 2 week+ incubation time stories as simply not being able to pin down exactly when infection began instead of actually being the incubation time."
2020-02-22,TuckerMcInnes,Coronavirus,2,https://www.reddit.com/r/Coronavirus/comments/f7v72f/at_what_temperature_does_the_virus_die/fifmi2n/,"The general consensus is it died off due to higher temperatures and humidity, as expected of coronaviruses.

SARS was airborne, so no amount of disinfectant was going to get rid of it. As you may know, entire buildings were getting infected from people doing explosive shits. How do you defend against that?

Unfortunately the new coronavirus is also airborne.

And I agree with your last statement - cold countries are going to have a serious issue with this."
2020-02-22,SandKey,wallstreetbets,2,https://www.reddit.com/r/wallstreetbets/comments/f7hla8/weekend_discussion_thread_february_2123_2020/fifufh8/,Yes. Coronavirus isn't new. They were first discovered in humans in the 1960s.
2020-02-22,tigerdeF,Coronavirus,2,https://www.reddit.com/r/Coronavirus/comments/f7vec4/china_is_building_19_more_field_hospitals_flights/fifppkj/,https://www.forbes.com/sites/kenrapoza/2020/02/22/coronavirus-impact-china-has-fallen-into-bizarro-world/#2dca70802edd
2020-02-22,magony,China_Flu,2,https://www.reddit.com/r/China_Flu/comments/f7vtqc/top_10_countries_with_most_confirmed_cases/fifut5d/,I follow [BNO News](https://bnonews.com/index.php/2020/02/the-latest-coronavirus-cases/) tracker and the one you mentioned by John Hopkins University.
2020-02-22,NotMarbles,exjw,2,https://www.reddit.com/r/exjw/comments/f7v36u/jdub_convo/fifvtwv/,"> Don't forget that sometimes Jehovah lets things happen 

Like Coronavirus. But it's \*sin\* that causes our bodies to be imperfect and thus allows disease to happen. So why was is \*necessary\* to allow sin to be transmitted from Adam to all offspring.

Because J was \*constrained\* to build up this entire thing as a ""we need to make an example of everyone that no-one will ever forgot or question a trillion years from now. We'll settle the question once and for all if you really need me or not!"" (Did I get that right? That's what I got from my mom JW.)

Okay - but it's kind of for show. We know there's no physical way to ""be perfect physically"", so there is objectively more pain / evil in the world because we're all bearing the choice of one person. Let's assume for argument's sake that everything JW say is true and a trillion years from now, someone could possibly say ""oh, see we tried living apart from J and it didn't work out so we better keep doing what he wants."" Or... what if instead of having sin transmit down from Adam, he died from his choice, but his offspring did not. Maybe some would sin, some would not. Those who sinned would die - those who did not sin would live forever. A trillion years from now, we'd still have the same principle ""proven"" to us: ""some tried living apart from J and it didn't work out for them, so we better keep doing what he wants."" Principle proven - but far less pain / evil would have been seen in the world, since not everyone would \*have to\* sin, unlike the current situation. Thus, J is responsible for the choice of transmission, and therefore is responsible for at least some quantity of pain / evil in the world. Being responsible for \*any\* destroys the view of his all-knowing/powerful/good nature.

Help me understand what the PIMI response would be to this - I don't debate with my JW mom anymore, but I've wondered what a response would be."
2020-02-22,CicaMic,China_Flu,2,https://www.reddit.com/r/China_Flu/comments/f7uzt0/can_pets_be_carriers_of_novel_coronavirus_peta/fifokdh/,My dog has coronavirus right now. Kennel cough.
2020-02-22,funnyguywhoisntfunny,antimeme,2,https://www.reddit.com/r/antimeme/comments/f7s2jo/does_this_count/fifoher/,"they locked the sub because of coronavirus. I exhaled when someone in comments said: ""that's a scary virus,if it can infect you through the internet"""
2020-02-22,Anime-Swag-100,Animemes,2,https://www.reddit.com/r/Animemes/comments/f7vhd4/we_get_to_live_one_more_week/fifqlg4/,The coronavirus isn’t even that lethal if you have a good immune system. I have a good immune system so I don’t have to worry about that.
2020-02-22,ayyywhyyy,americanairlines,2,https://www.reddit.com/r/americanairlines/comments/f7h6vz/a321_to_7878_seat_config/fiftn4n/,"Flew the 787 PE from DFW to LAX in December. Great option since it’s marketed as MCE domestically. 

No extra service besides the complimentary MCE alcohol. You’ll enjoy it - the seats are great.

If you look carefully there are some special routes like this. Typically around the holidays but the coronavirus has caused a few new ones to appear."
2020-02-22,parkinglotsprints,China_Flu,2,https://www.reddit.com/r/China_Flu/comments/f7v19p/covid19_victim_removal_wuhan_coronavirus/fifuzy9/,Right? What do you do in Wuhan now with a non-coronavirus health emergency? Something common like appendicitis is so much more dangerous when your city is under quarantine and medical workers are occupied and stressed.
2020-02-22,projectself,China_Flu,2,https://www.reddit.com/r/China_Flu/comments/f7up50/live_coronvirus_youtube_stream_me_and_my/fifeu4x/,"According to https://bnonews.com/index.php/2020/02/the-latest-coronavirus-cases/  China is reporting 366 new cases in Hubei, and only 31 new cases in all of the rest of China for today.  

How true does that ring in your experience over the last 24 hours in whatever region you are in given the absolutely huge number of citizens in china?"
2020-02-22,blushRedTail,Covid2019,2,https://www.reddit.com/r/Covid2019/comments/f7tndp/can_someone_help_explain_what_is_going_on_with/fify2un/,"Nearly 800 people are being 'monitored' in Washington State (i.e., not tested) [source KremNews](https://www.krem.com/article/news/health/coronavirus/over-700-people-in-washington-under-public-health-supervision-due-to-coronavirus/293-0f7dfced-db4f-4a3c-a2ff-73a7db258dd3)

In Florida officials won't publish any numbers [Florida source](https://www.tampabay.com/florida-politics/buzz/2020/02/18/florida-officials-mum-on-coronavirus-tests-of-state-residents/)

Those are just two states I know of."
2020-02-22,SwanBridge,China_Flu,2,https://www.reddit.com/r/China_Flu/comments/f7wbis/terminator_flu_judgement_day/fig4jve/,"I'm somewhat religious, and I can see the more evangelical and fundamentalist Christians using this as a ""sign"" of the end times. No doubt televangilists will capitalise on it, for $14.99 we'll pray your coronavirus away!"
2020-02-22,dbrockisdeadcmm,Wuhan_Flu,2,https://www.reddit.com/r/Wuhan_Flu/comments/f7r191/so_youre_telling_me_that_china_with_a_population/fig1c0b/,"1. It's obvious to anyone with a brain.
2. California just sued to block more coronavirus patients than the total count from being transferred to a single location."
2020-02-22,helmutschmidt,Coronavirus,2,https://www.reddit.com/r/Coronavirus/comments/f7v72f/at_what_temperature_does_the_virus_die/fifzjkr/,"[https://www.medicalnewstoday.com/articles/coronaviruses-how-long-can-they-survive-on-surfaces](https://www.medicalnewstoday.com/articles/coronaviruses-how-long-can-they-survive-on-surfaces)

TLDR: Coronavirus does not like sunlight and high temperatures"
2020-02-22,pastelChair,PewdiepieSubmissions,2,https://www.reddit.com/r/PewdiepieSubmissions/comments/f7x0jv/im_sorry_wut/figcjdy/,Here’s where it come from https://www.ccn.com/pewdiepie-laughs-at-coronavirus-in-racially-edgy-return-video/
2020-02-22,nicosmom82,Anxiety,2,https://www.reddit.com/r/Anxiety/comments/eupik4/coronavirus_megathread/fig70cc/,"I’m in the US and there are three major headline topics that are constantly shuffling around in order of importance (depending on the moment and news source): coronavirus, Trump media circus, and election drama. I think it’s being heavily reported upon, at least here in the US"
2020-02-22,whaddefuck,TheMonkeysPaw,2,https://www.reddit.com/r/TheMonkeysPaw/comments/f7wsse/i_wish_i_could_wish_for_more_wishes/fig9khq/,"Granted. You can wish any wish you like but, beyond the wish of wishing, no wish is fulfilled. And you get coronavirus"
2020-02-22,w212_eric,FashionReps,2,https://www.reddit.com/r/FashionReps/comments/f7w1sq/concerning_question/figcf5j/,"So before all the coronavirus stuff, soak it in authentic dishwashing soap and get rid of that 1:1 coronavirus... lol jk you should be fine though with reps just wash them like always."
2020-02-22,ricanthunder501,VerifiedIAmA,2,https://www.reddit.com/r/VerifiedIAmA/comments/f6esqk/hi_im_lily_im_a_foot_model_nsfw_content_creator/fig6oiq/,How do you think businesses or govt should approach the Coronavirus  outbreak (if it gets worse) considering we rely heavily on those markets it has affected?
2020-02-22,Law_And_Politics,CoronavirusUncensored,2,https://www.reddit.com/r/CoronavirusUncensored/comments/f7wof3/office_of_the_city_attorney_in_costa_mesa/fig73pf/,"Statement of the Facts on page 2:

>Defendants intend to relocate from **35-50 patients already diagnosed with the Coronavirus from a secure location on Travis Air Force Base**, where they are isolated from population centers, to Costa Mesa, a densely populated city within a county of over 3 million."
2020-02-22,InternetCaesar,Coronavirus,2,https://www.reddit.com/r/Coronavirus/comments/f7vty1/kc_health_officials_monitoring_nearly_10_people/figh1zs/,"Monitoring = we can't test em, so we monitor em.

Why can't these reporters ask a basic question to anyone.   The word TEST isn't even used in the damn piece.  

Reporter to Health Department or federal official:  ""Can you tell us if the CDC or the  DPH actually tested these individuals for Coronavirus or are we just using the hopes and prayers methodology of detection?""

Possible follow up:  ""When were they tested?, what test are they using?  When will they be tested, will they be tested again?"""
2020-02-22,DodgyQuilter,CasualConversation,2,https://www.reddit.com/r/CasualConversation/comments/f7woyf/hows_everyone_doing/fighc1w/,"Yeah, don't go strolling around in the dark. Smart call. It's 8.20am here. 

Stay safe from coronavirus. It's good that your school and country are taking it seriously."
2020-02-22,tofuyuki,Coronavirus,2,https://www.reddit.com/r/Coronavirus/comments/f7swwe/54_confirmed_cases_in_italy/figdvzm/,"Yeah let me just go ahead and recall his name that I can't spell off the top of my head or even pronounce. 

/r/4858392 said it as a joke but it seems like it's actually true. 2020 is wild. We got coronavirus and sjws in full force."
2020-02-22,antikrates,redscarepod,2,https://www.reddit.com/r/redscarepod/comments/f7w842/psa_for_all_you_flagrantly_irresponsible_girls/figk5u3/,"Looking at raw deaths is useless, you need to look at mortality rates. The mortality rate for the seasonal flu is usually less than 0.1%, this new coronavirus so far has a 2-3% mortality rate (though it’s too early to say definitively). That’s a significant difference. Worth noting that mortality rate is often underestimated in the initial phase of a new disease. SARS (the closest relative of this new virus) was initially thought to have 3% mortality but it later turned out to be more like 10%. 

It’s much more dangerous than the flu, and we have no vaccine or known treatments. You should never panic but it’s not a bad idea to take some extra precautions, wash your hands more, never touch your face, etc and start to stock up on essential goods. It can’t hurt, if it ends up being nothing, you’ll just have some extra supplies."
2020-02-22,freyascats,COVID19,2,https://www.reddit.com/r/COVID19/comments/f7xs4q/why_cant_i_view_covid19_posts_older_than_10_days/figmd8g/,"It’s only existed that long. Try /r/china_flu for the oldest good articles, and then /r/coronavirus for more recent stuff (the two switched which was casual and which was more serious a few days ago)"
2020-02-22,potatosalad001,AskReddit,2,https://www.reddit.com/r/AskReddit/comments/f7y21s/what_are_your_thoughts_on_14_us_citizens_with_the/figq3ow/, https://fox40.com/news/coronavirus/california-tells-7k-people-to-stay-home-because-of-coronavirus/
2020-02-22,RockyDify,insaneparents,2,https://www.reddit.com/r/insaneparents/comments/f7x636/update_my_mothers_paranoias_was_the_product_of/figw6gp/,But if people take precautions for ‘coronavirus’ it will offer same protections against the flu. I’m enjoying this level of paranoia and wish it was like this every flu season.
2020-02-22,let_me_think_talk,Coronavirus,2,https://www.reddit.com/r/Coronavirus/comments/f7ydt4/case_severity_of_sars_in_different_age_groups/figwghl/,"Good stats, this seems to confirm official data that we have now for COVID-19

https://www.reddit.com/r/Coronavirus/comments/f6iqq0/more_than_90_of_deaths_are_for_people_older_than/"
2020-02-22,Parakeet63,PewdiepieSubmissions,2,https://www.reddit.com/r/PewdiepieSubmissions/comments/f7s8tb/it_do_be_like_that/figzsif/,"""It do be like that"" it definitely is nothing like that, Coronavirus has WAY more news coverage that Pewdiepie, same goes for the flooding in Australia, which isn't even that big of a deal, they are not the only place that is being flooded."
2020-02-22,T_D_A_G_A_R_I_M,Coronavirus,2,https://www.reddit.com/r/Coronavirus/comments/f7xqas/daily_discussion_post_20200222_questions_images/fih8tkt/,"How does Corona compare to Cold and Flu in terms of how contagious you are? 

It’s estimated that for every one person infected with Coronavirus, they will infect 2-3 other individuals? How does that compare to cold and flu? 

I know cold is something I get every year whereas the flu I’ve never had. Just curious where corona falls on that spectrum."
2020-02-22,News_Voyeur,Coronavirus,2,https://www.reddit.com/r/Coronavirus/comments/f7ylo2/judge_blocks_transfer_of_suspected_coronavirus/fih2lj1/,"Appears to be open source, and not pay walled
https://www.nbcnews.com/health/health-news/federal-judge-blocks-effort-transfer-coronavirus-patients-california-city-n1140786"
2020-02-22,macmuffinpro,worldnews,2,https://www.reddit.com/r/worldnews/comments/f7sfpu/global_coronavirus_cases_are_spiking_and_the/fihaymi/,Why would addicts pretend to have coronavirus?  It's not like that would get them opioids or medications that are actually desirable to prescription drug-seekers
2020-02-22,sab340,Coronavirus,2,https://www.reddit.com/r/Coronavirus/comments/f7uwtz/when_preppingpreparing_please_dont_forget_the/fih25n2/,https://www.reddit.com/r/Coronavirus/comments/f7rxlg/a_sensible_guide_to_stocking_up_in_the_us/?utm_source=share&utm_medium=ios_app&utm_name=iossmf
2020-02-22,guzmanbrian13,preguntaleareddit,2,https://www.reddit.com/r/preguntaleareddit/comments/f7wzj7/qué_teorías_conspirativas_conoces/fih4ait/,"Algunos dicen que el coronavirus fue hecho por los ricos que controlan el mundo para reducir la población de gente pobre como en África (porque si lo piensas los lugares pobres con mala infraestructura medica van a ser los más afectados y lugares ricos como China o EEUU van a ser los menos afectados) para que así usen menos recursos y quedan con mas para ellos mismos.

Pero otros dicen que es una forma para que la naturaleza se proteja de los humanos porque cada 100 años hay alguna enfermedad que perjudica a los humanos.

Y si me preguntas a mi no creo mucho en ninguna pero igual las pongo en la mesa para que las vean y opinen ustedes mismos"
2020-02-22,DarkLordFluffyBoots,PoliticalCompassMemes,2,https://www.reddit.com/r/PoliticalCompassMemes/comments/f7qsrf/gang_weed_society_time/fihcr9c/,Do you think the coronavirus might be a sign that the PCR has lost the Mandate of Heaven?
2020-02-22,riggosi,Coronavirus,2,https://www.reddit.com/r/Coronavirus/comments/f7xqlm/google_censoring_internets_best_source_of_current/fihfc6k/,"qwant.com is a great search engine.

A search for /r/coronavirus gives this sub as the first result, as should be expected from any search engine. 

Try it: [https://www.qwant.com/?q=%2fr%2fcoronavirus&t=web](https://www.qwant.com/?q=%2fr%2fcoronavirus&t=web)"
2020-02-22,pintord,Coronavirus,2,https://www.reddit.com/r/Coronavirus/comments/f7xqlm/google_censoring_internets_best_source_of_current/fihcw5v/,r/coronavirus is still the first result in google canada.
