date,author,subreddit,score,url,text
2020-02-15,yourcatispostingthis,conspiracy_commons,1,https://www.reddit.com/r/conspiracy_commons/comments/f40s71/thought_on_this_corona_virus/fhp2tm0/,"It's not looking so good on the vaccine front:

>It’s highly possible to get infected a second time. A few people recovered from the first time by their own immune system, but the meds they use are damaging their heart tissue, and when they get it the second time, the antibody doesn’t help but makes it worse, and they die a sudden death from heart failure.

 [https://www.taiwannews.com.tw/en/news/3876197](https://www.taiwannews.com.tw/en/news/3876197) 

The antibodies making the reinfection worse means that a vaccine would likely be harmful.

This happened when they were trying to develop a vaccine for SARS:

> Immunization with SARS coronavirus vaccines leads to pulmonary immunopathology on challenge with the SARS virus.

 [https://www.ncbi.nlm.nih.gov/pubmed/22536382](https://www.ncbi.nlm.nih.gov/pubmed/22536382) 

I hope the claims are unsubstantiated/based on a few isolated incidents, I find the implications a lot more disturbing than this being a bioweapon."
2020-02-15,birds_of_berlin_ny,politics,1,https://www.reddit.com/r/politics/comments/f49dv9/can_we_trust_in_donald_trumps_claim_that_the/fhp31do/,"Sure we can! In fact, his followers should all volunteer to work with coronavirus patients until the Spring, of 2021..."
2020-02-15,walktall,apple,1,https://www.reddit.com/r/apple/comments/f4amh0/2020_macbook_pro_13_benchmark_leak_shows_30_gpu/fhp34ea/,"We've been theorizing March based on prior Apple events, but because of the Coronavirus, who knows at this point."
2020-02-15,iiEco-Ryan3166,pics,1,https://www.reddit.com/r/pics/comments/f4851b/metal_detecting_in_australia_minus_2_gold_rings_i/fhp41y6/,"If you haven't already rinsed / washed those items off, you're gonna have to wash your hands like you're a germophobe with the Coronavirus."
2020-02-15,tmybr11,Coronavirus,1,https://www.reddit.com/r/Coronavirus/comments/f4aulx/recovered_patients_in_kerelaindia/fhp48g4/,">Kerala Defeats Coronavirus

Yeah right."
2020-02-15,mentalsparrow,worldnews,1,https://www.reddit.com/r/worldnews/comments/f47kwi/first_coronavirus_death_confirmed_in_europe/fhp4su3/,"Yes, this coronavirus is not that dangerous for healthy individuals. But people with weakened immune systems are vulnerable, just like with bronchitis and the flu."
2020-02-15,AutoModerator,news,1,https://www.reddit.com/r/news/comments/f4b721/coronavirus_warning_expert_reveals_devastating/fhp4xmb/,"Your post was automatically removed for being about the coronavirus. Please use the update thread [here](https://www.reddit.com/r/news/comments/ezo8xn/coronavirus_megathread_2/).

*I am a bot, and this action was performed automatically. Please [contact the moderators of this subreddit](/message/compose/?to=/r/news) if you have any questions or concerns.*"
2020-02-15,RetardedPepeClap,memes,1,https://www.reddit.com/r/memes/comments/f47j7w/a_girl_will_seek_protection_from_you_but_you_can/fhp2atj/,but it has bat so its coronavirus
2020-02-15,karnaza,creepy,1,https://www.reddit.com/r/creepy/comments/f0kpe4/the_power_went_out_at_kroger/fhp2odg/,So you mean 6 months from now by coronavirus
2020-02-15,worttito,CoronavirusConspiracy,1,https://www.reddit.com/r/CoronavirusConspiracy/comments/f44p34/ive_been_banned_out_of_nowhere_for_wrongthink_on/fhp2ub8/,"I was banned from r/nCov because I posted an article about Warren Buffetts partner saying how coronavirus affects the economy. 
Other mods will not reply and one just said how does this relate to coronavirus. 
I followed up to explain and got a response that ""this matter is closed"" 
Not sure if thats normal but if they didnt like it just delete the post, why ban?"
2020-02-15,Wheres_that_to,worldnews,1,https://www.reddit.com/r/worldnews/comments/f44wue/chinese_journalist_missing_after_live_streaming/fhp354n/,I expect a lot of the people who the Chinese goverment find irritating will have conveniently disappeared by the end of the coronavirus.
2020-02-15,AutoModerator,Coronavirus,1,https://www.reddit.com/r/Coronavirus/comments/f49u9d/8_of_the_9_uk_cases_are_now_recovered/fhp414t/,"businessinsider.com news source is unreliable. If possible, please re-submit with a link to a reliable source, such as a reliable news organization or an recognized institution.

Note that you may also resubmit as a text post, just add a link, add some explanatory text and add an appropriate flair.  

If you believe we made a mistake, please let us know.

Thank you for helping us keep information in /r/Coronavirus reliable!


*I am a bot, and this action was performed automatically. Please [contact the moderators of this subreddit](/message/compose/?to=/r/Coronavirus) if you have any questions or concerns.*"
2020-02-15,manojlds,Coronavirus,1,https://www.reddit.com/r/Coronavirus/comments/f48yvx/isnt_it_strange_that_indonesia_a_country_with_a/fhpaux8/,"No offense, but eating bats while talking about Coronavirus is a bit too much - https://youtu.be/ZJEp-LNcWHs"
2020-02-15,1donteven,China,1,https://www.reddit.com/r/China/comments/f33rbv/megathread_4_covid19wuhan_viral_outbreak/fhpb554/,"Can't be proven, can't be disproven. The virus is especially dangerous for the elderly - they wouldn't bother determining whether an elderly person died of 'old age', 'some infection' or the Coronavirus infection specifically."
2020-02-15,myeyeonpie,Coronavirus,1,https://www.reddit.com/r/Coronavirus/comments/f4bqy2/us_to_evacuate_americans_from_quarantined_ship_in/fhpcmxn/,"I saw they are splitting the evacuated people in between Travis Air Force base in California and Lackland Air Force bass in Texas. I absolutely think it’s appropriate for these people to be quarantined at an Air Force base but why the same ones? Travis and Lackland have both already been used as bases for coronavirus evacuees. I live an hour from Travis and think it’s unfair they are putting such a big burden and risk on California and Texas like there aren’t 30 or so other states with Air Force bases. California has plenty of other problems without being the default dumping ground of people under coronavirus quarantine. To me it would actually make more sense to pick a base more in the middle of nowhere for the quarantine rather than pick Travis, which isn’t a long drive from San Francisco or Sacramento."
2020-02-15,Better-Flamingo,China_Flu,1,https://www.reddit.com/r/China_Flu/comments/f4b8eh/from_the_news_above_it_turned_out_that_on_board/fhpbiuf/,"https://amp.nos.nl/artikel/2323159-toch-besmetting-met-coronavirus-op-cruiseschip-westerdam.html?__twitter_impression=true

Dutch news: Thursday they tested 20 people on the ship, no one was positive so it looked like there were no infections with the virus.
20 people tested out of some 2250 ???"
2020-02-15,LeftistsAreBigots,China_Flu,1,https://www.reddit.com/r/China_Flu/comments/f4bji8/this_is_from_real_workers_in_wuhan_crematoriums/fhpbiql/,"Lol i thought it was just someone being funny, my bad.  Well it's good to see coronavirus bringing people of all walks of life together for a common cause i suppose!  Carry on, mommy!"
2020-02-15,dontloseyourway1610,anime,1,https://www.reddit.com/r/anime/comments/f4b0rt/227_episode_6_discussion/fhpbldz/,"""and those who can't follow these rules will get spanked"" \*Doujin artists begin rubbing hands\*

&#x200B;

I love episodes like these that allow the girls to overcome their issues. In this case it was Reika's insecurities and unresolved frustration about her mother's death. I'm not sure if her father should be allowed within 100 yards of a school, but it was nice to see them bonding too. MVP of the ep was best girl Miu coming to cheer Reika on and give her the courage to get out there.

&#x200B;

I also think the episode brought up a really interesting topic, the sexualisation of idols, especially minor ones just to sell albums and merch. Really sad, but that's economics for ya. I can only imagine how uncomfortable many of them are made to feel.

&#x200B;

Really loving the series so far, about to be past the halfway point and it's been a great ride. wish it wasn't so slept on. I think it's a lot better than most of the other idol shows. It's certainly better than LoveLive's first season. First episode was a bit confusing which probably turned some people away. But the concept of the wall is something I like a lot. Did the girls get hit with coronavirus at the end there or wtf"
2020-02-15,Self-Contradiction,memes,1,https://www.reddit.com/r/memes/comments/f4bxkc/what_a_joke/fhpc0a9/,"Well, Coronavirus is a meme right now, so yes, you are a joke to us right now, Coronavirus."
2020-02-15,_missym_,CoronavirusConspiracy,1,https://www.reddit.com/r/CoronavirusConspiracy/comments/f4488r/no_one_takes_me_seriously/fhpcj69/,"There are 7 billion of us. Definitely we do not face existencial threat. To much fuss for 1.5k dead. Car accidents kill more every year. The damage we cause to environment put as at existencial threat but I suppose that's not so exciting. I'm only human, grabbing all info I can on coronavirus as well, but let us be real, this is nothing but the effect of media alarming our survival instinct."
2020-02-15,Assistant_Pimp_,news,1,https://www.reddit.com/r/news/comments/f480qv/us_will_evacuate_americans_from_cruise_ship/fhpbet7/,As soon as she heard that people onboard [got free porn](https://www.google.com/amp/s/globalnews.ca/news/6535843/free-porn-cruise-ship-coronavirus-quarantine/amp/)  Mike Pence’s mother ordered the evacuation
2020-02-15,wawzw,worldnews,1,https://www.reddit.com/r/worldnews/comments/f44wue/chinese_journalist_missing_after_live_streaming/fhpbnsf/,"Relaxed, dude, another man killed is nothing, because  tartar china already killed one billion infants on race.

 

**Wuhan coronavirus**, high tech from America or other, really good copy work.

Tartar communists already killed one billion infants on race.

Hundreds of millions of infants was killed by sticks and fists when they were still in their mothers' uteri， and moreover, hundreds of millions of infants were killed when they just saw this world, all because of their race. But just one one cares.

If you are a typical chinese, you can only have one child, and the rest of your infants must be killed under the order of tartar communists. But if you are a tartar, you can have two and more children, admitted by the tartar communists and written in public laws ! ! !

Do you really believe poor china decades ago had enough qualified drugs to kill infants on race in birth control on race ? Do you really believe tartar communists would always nicely and politely give you drugs to kill your infants on race?

Why do freedom countries not care about the biggest Racial discrimination and the biggest Genocide of the world ?

📷['One Child Nation': Inside China's Horrifying Child-Killing Policy](https://www.thedailybeast.com/one-child-nation-inside-chinas-horrifying-child-killing-policy)"
2020-02-15,hyperviolator,SeaWA,1,https://www.reddit.com/r/SeaWA/comments/f47ioh/emts_not_warned_of_transporting_possible/fhp6b5u/,/r/China_flu is (I think) the best subreddit on coronavirus. /r/Coronavirus is more... crazy.
2020-02-15,Hikenjeager,trashy,1,https://www.reddit.com/r/trashy/comments/f4bbj9/americans_on_the_diamond_princess_cruise_ship_in/fhp6xci/,The Diamond Princess is currently being quarantined due to 66 people being infected with Coronavirus.
2020-02-15,catandDuck,gatech,1,https://www.reddit.com/r/gatech/comments/f49vvy/are_foreign_spies_looking_to_target_georgia_tech/fhp55rc/,">However, Belcher learned that Tech researchers were interested in a conference in Wuhan, China, last July.

>By chance, that was five months before Wuhan’s streets were emptied by the coronavirus threat.

Wow! Academic researchers was interested in attending an academic conference in a city with over 10 million residents. Could they have known about the coronavirus before it was discovered??"
2020-02-15,Pedandick,france,1,https://www.reddit.com/r/france/comments/f4an4g/exclusive_chinese_doctors_say_wuhan_coronavirus/fhp565f/,"Humour noir ON : T’inquiète, le virus viendra à toi, L'OMS a bien dit que deux tiers de la population mondiale l'attraperait.

https://www.bloomberg.com/news/articles/2020-02-13/coronavirus-could-infect-two-thirds-of-globe-researcher-says"
2020-02-15,Kack-a-lack,Coronavirus,1,https://www.reddit.com/r/Coronavirus/comments/f4a7b2/this_paper_predicted_the_coronavirus_outbreak/fhp57nc/,"The wet market is just a scapegoat. The first few patients had no relation to the market. They have a lab in Wuhan though, that works on coronavirus’ that so happens to have a history with stolen pathogens from other countries. They accidentally or purposely released it."
2020-02-15,tiger-boi,neoliberal,1,https://www.reddit.com/r/neoliberal/comments/f45yt3/discussion_thread/fhp5kfc/,"Some workers at our university were talking about how our school was going to be ""ground zero"" for the coronavirus because we have many Asian international students. A worker noted that this was ""why [he was] avoiding the Chinese like plague."" 


This is at least slightly less offensive."
2020-02-15,_lurker_26,IndianGaming,1,https://www.reddit.com/r/IndianGaming/comments/f498ez/can_i_get_chronavirus_from_buying_pc_components/fhp5nez/,"No, there is very least probabilty that you can get infected from the virus , [here is an article that you may wanna read](https://www.tomshardware.com/news/can-you-catch-coronavirus-packages-china)."
2020-02-15,bobagumbee,Coronavirus,1,https://www.reddit.com/r/Coronavirus/comments/f42em0/singapore_is_going_exponential_this_is_very_bad/fhp5x66/,"Please don’t create fear. It is NOT going exponential. 

9 new cases ytd and 5 new cases today. Explain how that is exponential? 

https://www.channelnewsasia.com/news/singapore/coronavirus-covid19-singapore-cases-feb-15-12437852 

Yes, it’s scary but is it exponential? No."
2020-02-15,Generation-X-Cellent,worldnews,1,https://www.reddit.com/r/worldnews/comments/f47kwi/first_coronavirus_death_confirmed_in_europe/fhp69um/,"So far the coronavirus isn't even as deadly as the 2017 to 2018 flu season. Almost 80,000 people died in the United States alone. Over 10,000 of them were in the healthy age range between 5 and 49 years old."
2020-02-15,AutoModerator,Coronavirus,1,https://www.reddit.com/r/Coronavirus/comments/f4bgaw/mrc_centre_for_global_infectious_disease_analysis/fhp6inh/,"Twitter is generally an unreliable source. If possible, please re-submit with a link to a reliable source or the direct article.

Note that you may also resubmit as a text post, just add a link and some explanatory text. 

Thank you for helping us keep information in /r/Coronavirus reliable!


*I am a bot, and this action was performed automatically. Please [contact the moderators of this subreddit](/message/compose/?to=/r/Coronavirus) if you have any questions or concerns.*"
2020-02-15,Me-llamo_jeff2,ukpolitics,1,https://www.reddit.com/r/ukpolitics/comments/f3u0u8/court_of_appeal_judges_rule_islamic_marriages_not/fhp6jx2/,"That's because Islam is small right now. Its like saying coronavirus is not a big threat to the UK because there are only a handful of cases. Its delusional. The growth of Islam is stark and unrelenting. The conversion of Christians to atheism on the other hand is reaching critical mass. Once it gets their its not going to grow because atheistic lifestyle is inherently not geared towards reproduction, traditional family values, gender roles, health and wellness. It's a losing battle."
2020-02-15,ty-hates-mechs,gtaonline,1,https://www.reddit.com/r/gtaonline/comments/f4aht5/theres_so_much_garbage_on_mobile/fhp5a1r/,a comment? bruh go back to the coronavirus sub
2020-02-15,Kujo17,cvnews,1,https://www.reddit.com/r/cvnews/comments/f4b8l9/17_people_from_delhi_who_returned_from_abroad/fhp5bn1/,"Seventeen people, out of a large number of passengers who had arrived in Delhi from China and other coronavirus-affected countries before the screening at the airport began around mid-January, have been found symptomatic for the infection and hospitalised, officials said.

Delhi health department officials have traced many of such passengers. According to data shared by the Delhi health department, till February 13, over 5,700 such passengers were approached after being informed by the Delhi airport authorities.

”As many as 4,707 passengers were found asymptomatic and advised for home isolation (self-quarantined). Seventeen patients were found symptomatic and hospitalised,” a senior official of the Delhi health department saidThe number of passengers, who remain untraced stands at 817, the official said, quoting the data collated by the health department.
The number of passengers pending surveillance stands at 68, according to the data.

In Delhi, of the 4,705 passengers found asymptomatic, a maximum of 1,249 of those were residents of West Delhi district, while 1,073 people lived in Central Delhi.
The Delhi government has already set up a centralised control room at DGHS (HQ) and such centres also in the 11 districts.
India has so far reported three confirmed cases of the virus, all in Kerala.
One of the three medical students, who had tested positive for novel coronavirus infection and were treated at a hospital in Kerala, has been discharged after recovery, Union Health Minister Harsh Vardhan had said on Thursday.
About the other two, he said subsequent tests indicated significant reduction in “viral load”.

The health ministry has asked people to refrain from travelling to China in view of the coronavirus outbreak and said travellers on return could be quarantined"
2020-02-15,TopTierCawmedy,bjj,1,https://www.reddit.com/r/bjj/comments/f4a8wa/i_think_my_rashguards_order_has_been_quarantined/fhp68rr/,That's nothing I went to this chinese guys house yesterday because of work and dude was under quarantine like wtf bro why are you outside talking to me with the coronavirus.  Man I wanted slap that fool
2020-02-15,EuphoricLettuce,politics,1,https://www.reddit.com/r/politics/comments/f4azr0/american_health_care_system_costs_four_times_more/fhp6c3j/,"A week normally, due to the coronavirus wait time is more like 2 weeks for me now."
2020-02-15,teegan_o,COVID19,1,https://www.reddit.com/r/COVID19/comments/f4bb69/what_is_covid19_beta/fhp6dbw/,https://www.cdc.gov/coronavirus/types.html
2020-02-15,koolman631,China_Flu,1,https://www.reddit.com/r/China_Flu/comments/f4c5uh/update_us_woman_from_westerdam_cruise_ship_which/fhpdcfx/,[The women’s husband has symptoms as well but so far he has tested negative for coronavirus. It’s unknown if this will have any effects for people who are still on Westerdam](https://twitter.com/bnodesk/status/1228726335868108803?s=21)
2020-02-15,Golden_Miner_Mod,science,1,https://www.reddit.com/r/science/comments/f4998k/a_new_study_in_the_lancet_by_a_team_of_yale/fhpds0g/,They're the ones that were going bonkers about coronavirus with egregious predicting. So yeah they're junk
2020-02-15,Mordarto,taiwan,1,https://www.reddit.com/r/taiwan/comments/f42ruj/german_institute_taipei_praises_taiwans/fhpe6fc/,"I have family in Taiwan. Before the coronavirus began to spread I was planning to visit them in March. A lot of them bought into the media scare and advised me against it, but with my own research seeing how Taiwan quickly prevented Chinese people from visiting the island as well as the fact that only 10 people or so are infected since the outbreak, I'm not too worried and am still planning on going. This article further cements my decision."
2020-02-15,SonicBrick,AskReddit,1,https://www.reddit.com/r/AskReddit/comments/f4cgwr/people_who_moved_to_china_what_surprised_you_most/fhpecgd/,*cough cough* ^(Coronavirus) *cough*
2020-02-15,Sharksneedpoptarts,RoastMe,1,https://www.reddit.com/r/RoastMe/comments/f47ue8/well_here_we_go/fhpeldp/,You look like the personification of the coronavirus.
2020-02-15,Dave_Wanking_Dip,NoStupidQuestions,1,https://www.reddit.com/r/NoStupidQuestions/comments/f4cfzs/whats_the_worse_case_sernerio_if_you_use_the/fhpf0qs/,Coronavirus
2020-02-15,k4zoo,news,1,https://www.reddit.com/r/news/comments/f1ih07/coronavirus_megathread_3/fhpf0wg/,"Y'all not alone. I'm sure searching ""coronavirus (political party)"" will come up with comments attacking everyone."
2020-02-15,allursnakes,circlejerk,1,https://www.reddit.com/r/circlejerk/comments/f3w0kb/fuck_trump_ama/fhpd97f/,Don't fuck trump he has Coronavirus
2020-02-15,differ,China_Flu,1,https://www.reddit.com/r/China_Flu/comments/f46vx9/67_new_cases_of_coronavirus_on_cruise_ship_near/fhpdr7b/,That happens everywhere with bigots who are trying to normalize their bigotry. Especially on reddit where you have to factor in the edgy tweens. The racist posts tend to get downvoted and removed by mods. At least in this sub. I haven't looked into other subs specific to this coronavirus.
2020-02-15,BigRedTomato,worldnews,1,https://www.reddit.com/r/worldnews/comments/f47kwi/first_coronavirus_death_confirmed_in_europe/fhpduo6/,"It may have [escaped containment in Japan](https://japantoday.com/category/national/Coronavirus-infection-cases-spread-further-in-Japan).  If even Japan can't contain it, what chance do less developed countries have?  Are we gonna ban travel from all those countries until a vaccine becomes available in 12 to 18 months?"
2020-02-15,Hammerhead_brat,China_Flu,1,https://www.reddit.com/r/China_Flu/comments/f44bwx/man_tests_positive_for_coronavirus_after_hawaii/fhpebee/,"So far it's just my stepmom who was sick and just showing residual sniffles and sore throat, me and baby, baby has a wet cough whenever he lays down but is in otherwise good spirits just quicker to tire, and I've got the start of sniffles and cough. I've sent in a contact request to the CDC but plan on avoiding going out unless absolutely necessary whether it's the coronavirus or just the common cold. Ya never know who in your local community is immunocompromised and it's wouldn't be fair to spread whatever this is to them."
2020-02-15,kinda_not_really,Coronavirus,1,https://www.reddit.com/r/Coronavirus/comments/f4auu0/wake_up_check_on_the_latest_coronavirus_news/fhpere6/,"Last thing at night-check news for coronavirus news. In middle of the night, check it again. Check the Johns Hopkins tracker first thing in morning and last thing at night. Check news throughout the day. Subscribed to several prepped channels on YouTube. Go to work and am forced to project a calm, healing demeanor as a massage therapist WHILE freaking out inwardly because Im touchingggg people with no gloves or mask AND they are all completely unconcerned. Have 2-3 months worth of supplies at home. Emailed my boss the link to CDC guidelines for businesses regarding the coronavirus. I've basically stopped chatting with coworkers because I have zero patience and they all sound inane right now. Otherwise, all is well here. Lol."
2020-02-15,GravityReject,SeattleWA,1,https://www.reddit.com/r/SeattleWA/comments/f47ixa/emts_not_warned_of_transporting_possible/fhpeynm/,"The infectiousness of this particular novel-coronavirus is UNKNOWN right now. There have been no confirmed cases of transmission from asymptomatic carriers.

That doesn't mean that it can't be transmitted before they show symptoms, it just means we don't know yet and need more data."
2020-02-15,Omnifarious,nottheonion,1,https://www.reddit.com/r/nottheonion/comments/f485rm/dea_seized_a_womans_bag_of_cash_at_an_airport_it/fhpf002/,Says the guy that thinks [Bill Gates is a secret shadowy overlord behind the coronavirus.](https://i.imgur.com/XVoyjbd.png)
2020-02-15,mechtech,investing,1,https://www.reddit.com/r/investing/comments/f4c01f/china_collapsing_but_markets_at_highs/fhpedzu/,"Because there are a dozen factors equally important to global equities. Shanghai took a 500 billion dollar market cap hit before the liquidity injections. Worldwide there was 1 trillion wiped off the market when fear peaked. You may be expecting too much of an impact.

Here is a good analyst report on how the virus will propagate to US equities. 

https://www.msci.com/www/blog-posts/the-coronavirus-epidemic/01718848208"
2020-02-15,ModoTPC,PewdiepieSubmissions,1,https://www.reddit.com/r/PewdiepieSubmissions/comments/f44hc6/and_theres_nothing_we_can_do_about_it/fhpesa9/,You're personality is quite literally worse than Coronavirus.
2020-02-15,aquarain,worldnews,1,https://www.reddit.com/r/worldnews/comments/f47kwi/first_coronavirus_death_confirmed_in_europe/fhpew1n/,"Containment has failed.  CDC guidance is to get used to it.

https://www.cnn.com/2020/02/13/health/coronavirus-cdc-robert-redfield-gupta-intv/index.html"
2020-02-15,VeryStableGenius,dataisbeautiful,1,https://www.reddit.com/r/dataisbeautiful/comments/f30bed/oc_corona_virus_update_12_feb/fhohq4o/,"The death curve seems to continue to be closer to an exponential (but it is some lagging convolution of the new cases).  

https://www.worldometers.info/coronavirus/coronavirus-death-toll/

In log space, cumulative deaths is turnover over a little, but not much. and seems to be close to flat for the past week."
2020-02-15,NewsDataDaily,China_Flu,1,https://www.reddit.com/r/China_Flu/comments/f3xzon/so_i_was_hoping_that_when_the_who_announced_that/fhohrlq/, President Trump on Friday praised Chinese premier Xi Jinping for the country’s handling of the novel coronavirus outbreak is very much on topic you fucking retard!
2020-02-15,rbeedees,LeagueOfMemes,1,https://www.reddit.com/r/LeagueOfMemes/comments/f3po3i/what_are_the_chances_of_getting_this_in_urf/fhoi3i8/,Coronavirus singed
