date,author,subreddit,score,url,text
2020-02-25,boblaplante,Winkerpack,5,https://www.reddit.com/r/Winkerpack/comments/f9537l/daily_discussion_thread_for_tuesday_february_25/fir3w6c/,"Considering this beautiful blurb
 https://www.reddit.com/r/Coronavirus/comments/f92h85/3040_days_before_shipping_knockon_will_be_felt/?utm_medium=android_app&utm_source=share 

It seems like we'll see companies starting to report shortcomings around March 19. Right about the time where the US will start testing en masse as per Mr. Hawaii governor.  

Crayon daddy said 310 is fair value but do any of you gaylords beardaddies see this shit going down further? I'm thinking may15 300p but I'd like to wait for a better entry later this week, considering economic data may still be positive in the US specifically. What say you?"
2020-02-25,Impulseps,neoliberal,5,https://www.reddit.com/r/neoliberal/comments/f96cl9/discussion_thread/firaino/,"So, as I understand it, actually catching the coronavirus is in most cases not even *that* bad right?"
2020-02-25,spyaintnobitch,wallstreetbets,5,https://www.reddit.com/r/wallstreetbets/comments/f98o73/daily_discussion_thread_february_25_2020/firb92p/,"Headed to Costco to load up on food and then to Walmart to load up on bullets 


Then Imma spend the next few days looking at yachts and houses so I can go claim some dead coronavirus victim stuff after all this blows over.

Looking forward to a US population half the size it is today. No more global warming, more Becky's for me yay!!"
2020-02-25,stamatt45,wallstreetbets,5,https://www.reddit.com/r/wallstreetbets/comments/f98o73/daily_discussion_thread_february_25_2020/fir8i51/,"CDC warned of an inevitable coronavirus outbreak in the US. Buy puts on theme parks. $DIS is already down like 8% this week and it's going to absolutely tank if it has to close its US parks to prevent an outbreak like it did in Shanghai

Thanks for coming to my ~~TED~~ DD talk."
2020-02-25,allyourcatsarebases,wallstreetbets,5,https://www.reddit.com/r/wallstreetbets/comments/f98o73/daily_discussion_thread_february_25_2020/firco20/,"https://www.independent.co.uk/news/world/americas/coronavirus-news-us-pandemic-schools-business-closure-china-latest-a9359196.html?utm_medium=Social&utm_source=Facebook&fbclid=IwAR1iUbRdKPglQvxnXhu66ump5A5J_RUuRQbTEESGpLh7m8sQJjnTj3h9g4k#Echobox=1582655074

Beer virus is a nationwide pump and dump to fuck over WSB. Wall Street knew how autistic we would be to buy calls last Friday"
2020-02-25,DMVBornDMVRaised,neoliberal,5,https://www.reddit.com/r/neoliberal/comments/f96cl9/discussion_thread/fircnre/,"I woke up this morning with nasal congestion, a scratchy throat and a headache. Do I have coronavirus? And if I do, can I put that on my resume?"
2020-02-25,Relik,China_Flu,5,https://www.reddit.com/r/China_Flu/comments/f9h0pn/only_5_us_states_can_test_for_sarscov2_as_cdc/firhw7d/,"Nebraska is one.  Look, it doesn't really matter what states can test.  The 5 states still have to send the kits to the CDC in Atlanta and over the last 2 weeks they have run SEVEN tests per day.  

https://web.archive.org/web/20200211050045/https://www.cdc.gov/coronavirus/2019-ncov/cases-in-us.html

If you compare total completed tests two weeks ago (318+12=330) versus the total completed tests today (426), you can see the CDC has only completed NINETY-SIX tests in the last two weeks. That's an average of 7 per day.  SEVEN.  I hope there aren't 8 people that might be infected in a single day in a country of 329 million!

FYI, the 5 states are from here : https://www.reuters.com/article/us-china-health-usa-testing/tired-of-delays-us-labs-ask-fda-to-develop-their-own-coronavirus-tests-idUSKCN20I2G8

>As of Monday, only five U.S. states - California, Illinois, Nebraska, Nevada and Tennessee - have the capability to test for the virus, according to the Association of Public Health Laboratories (APHL).

Again, 5 states of 50 states doesn't matter when they are only AUTHORIZING 7 tests a day.

>The CDC said in a news briefing last week that the agency is still handling the bulk of testing for the coronavirus as it works out issues with test kits sent to states."
2020-02-25,I_H_T,neoliberal,5,https://www.reddit.com/r/neoliberal/comments/f96cl9/discussion_thread/firjtqb/,"https://www.who.int/dg/speeches/detail/who-director-general-s-opening-remarks-at-the-media-briefing-on-covid-19---24-february-2020

Good information on the Coronavirus from the WHO. They say that the epidemic probably peaked and plateaued in China in late January or early February. They also say that they believe that there is a possibility that the virus can be contained. They do not wish to use the word pandemic yet, because they don't believe the virus is spreading uncontrolling and causing mass death and destruction. Still, a pandemic is possible. The mortality rate of the virus in Wuhan is 2 to 4% while the mortality rate outside of Wuhan is estimated to be 0.7%. There is no evidence that the virus has mutated yet."
2020-02-25,modernvoyager-,Coronavirus,4,https://www.reddit.com/r/Coronavirus/comments/f9dv99/india_declares_itself_coronavirus_free_with_many/fiqvsen/,"It is so unbelievably irresponsible of you to suggest Indian curry can prevent Coronavirus. In situations like this, true public health emergencies, it is absolutely criminal to pass off such ridiculous claims."
2020-02-25,okgenxer,wallstreetbets,4,https://www.reddit.com/r/wallstreetbets/comments/f98o73/daily_discussion_thread_february_25_2020/fir2ce3/,"haha...

CNBC alert: Larry Kudlow says US has contained the coronavirus and the economy is holding up nicely."
2020-02-25,Prc16c,wallstreetbets,4,https://www.reddit.com/r/wallstreetbets/comments/f98o73/daily_discussion_thread_february_25_2020/fir1t84/,SPY 300 EOW https://www.nytimes.com/2020/02/25/world/asia/coronavirus-news.html?referringSource=articleShare
2020-02-25,_____pantsunami_____,anime,4,https://www.reddit.com/r/anime/comments/f72bzt/casual_discussion_fridays_week_of_february_21_2020/fir3ai9/,"make sure you tell everyone you care about that you love and apreciate them. 

this is just general advice by the way and has nothing to do with coronavirus tbh"
2020-02-25,maddox1405,instantkarma,4,https://www.reddit.com/r/instantkarma/comments/f9cni2/swift_octopus_justice/fir8vqn/,Because one Coronavirus outbreak isn't enough
2020-02-25,burrowed_greentext,China_Flu,4,https://www.reddit.com/r/China_Flu/comments/f9gop1/what_do_people_reckon_the_fatality_rate_could/firemfo/,"Lol this sub is just AskReddit with a coronavirus twist now.

69%"
2020-02-25,SomeFreshMeme,memes,4,https://www.reddit.com/r/memes/comments/f9h8y0/i_personally_think_that_this_would_be_a_great_idea/firikpg/,Oh god imagine internet explorer memes about coronavirus in a few years when some people will be dead from the virus and memes will only get them angry
2020-02-25,_Riddle,financialindependence,4,https://www.reddit.com/r/financialindependence/comments/f971aw/daily_fi_discussion_thread_february_25_2020/firj6zy/,"I have 743 AR's and over 9 million rounds of 5.56 nato. Coronavirus wouldn't dare enter my home

/s"
2020-02-25,D13se1,ValveIndex,4,https://www.reddit.com/r/ValveIndex/comments/f9g1s2/valve_is_out_of_rma_left_controllers/firi9lo/,Coronavirus!
2020-02-25,WernerrenreW,Coronavirus,4,https://www.reddit.com/r/Coronavirus/comments/f9hfbz/is_the_netherlands_doing_any_testing_whatsoever/firk2mk/,"Yes several dozens of people have already been tested, we are so fucked.

[https://www.rivm.nl/coronavirus/covid-19/vragen-antwoorden](https://www.rivm.nl/coronavirus/covid-19/vragen-antwoorden)"
2020-02-25,CS_Vision,NYYankees,4,https://www.reddit.com/r/NYYankees/comments/f9h1mv/post_game_thread_the_yankees_defeated_the_blue/firm2s9/,Now I hope I get coronavirus
2020-02-25,spanishgalacian,wallstreetbets,4,https://www.reddit.com/r/wallstreetbets/comments/f9h6jj/what_are_your_moves_tomorrow_february_26_2020/firpruc/,The coronavirus has given me a new appreciation for the game Plaugue. Sometimes I would be yelling at the screen bitch spread to North America already what is this weak ass 30 cases and now it seems like they were just trying to be realistic.
2020-02-25,Mrhurtmachine,PublicFreakout,4,https://www.reddit.com/r/PublicFreakout/comments/f9i39p/can_anyone_give_any_news_on_this_this_clip_has/firpv8i/,Not the best source but https://www.snopes.com/fact-check/violent-aftermath-of-coronavirus/
2020-02-25,applesforsale-used,ChapoTrapHouse,4,https://www.reddit.com/r/ChapoTrapHouse/comments/f9ix0k/the_dow_divebombing_down_right_now_because_of_a/firuldx/,"Turns out the economy is a lot like the kind of patient that will be killed by the Wuhan Coronavirus

A frail old man with multiple pre-existing issues."
2020-02-25,kinda_not_really,China_Flu,4,https://www.reddit.com/r/China_Flu/comments/f9ixy7/im_a_massage_therapist_and_im_quitting_my_job/firy5om/,"Thank you...xx

I don't take it lightly either. It feels like a sane decision, given my age and health and the realities of both my job AND how this stupid coronavirus transmits..."
2020-02-25,TheRealAMF,shittyrainbow6,4,https://www.reddit.com/r/shittyrainbow6/comments/f9e58m/when_you_accidentally_use_the_revolver_instead_of/fis6btn/,"That definitely makes the headline seem misleading.

That being said, it still seems like the punishment was a bit harsh.  A more straightforward description of the event would still make a good headline.

>NK officer executed for disobeying Coronavirus quarantine to go to beach."
2020-02-25,barbieonspeed,China_Flu,4,https://www.reddit.com/r/China_Flu/comments/f9kez0/americans_doubting_the_severity_of_the/fis6z36/,"I get frustrated by “doubters”—and then I remember people are reacting to the information they’ve been casually fed. Not everyone is a psycho like me who actively hunts for information, updates, and videos on the coronavirus. I trust my assessment though."
2020-02-25,AnnRichards_Boots,DemocratsforDiversity,4,https://www.reddit.com/r/DemocratsforDiversity/comments/f97lyw/dfd_discussion_thread_february_25_2020/fis8f1b/,"Well, we're all gonna catch coronavirus and die so this shitshow of a primary will be meaningless anyway"
2020-02-25,skeebidybop,Coronavirus,4,https://www.reddit.com/r/Coronavirus/comments/f9ktub/first_confirmed_covid19_case_in_brazil_just_after/fis9dsj/,"Im more concerned about the annual 2+ million pilgrimage to Mecca, Saudi Arabia [(the Hajj)](https://en.m.wikipedia.org/wiki/Hajj). 

This year it's from late July through early August. Hopefully the coronavirus is gone by then and/or that Saudi Arabia's 45 °C brutal summers kills it."
2020-02-25,JLingz_the_GOAT,Gamingcirclejerk,4,https://www.reddit.com/r/Gamingcirclejerk/comments/f95t9o/unjerk_thread_of_february_25_2020/fisc92m/,"I know the risk of me catching the Coronavirus is low. I know that it's incredibly unilkely that anything would happen to me if I got it. Yet still, as someone with a chronic cough, I am kinda nervous by now. 

I mean sure, now that I have semester break I only leave my house twice a week to get food, but still. Irrational fear is still fear, I guess."
2020-02-25,Yukon_Kizmiaz,Sacramento,4,https://www.reddit.com/r/Sacramento/comments/f9jfy7/update_sacramento_state_professor_escorted_out_of/fisf86m/,I think we should all keep up the rampant speculation and support it with anecdotal evidence until we’ve totally convinced ourselves he’s a Chinese coronavirus spy stealing intellectual property from God fearing Americans.
2020-02-25,absurdlivingghost,neoliberal,4,https://www.reddit.com/r/neoliberal/comments/f9krck/the_thunderdome_returns/fisffud/,"""How many staplers are you prepared to throw at the Coronavirus?"""
2020-02-25,MentlegenRich,couriersofreddit,4,https://www.reddit.com/r/couriersofreddit/comments/f9llhn/whats_everyone_doing_about_coronavirus/fisgayt/,"I'm not doing anything. Viruses are always popping up and killing and infecting people before a cure of medication regiment is made. Virologists did it for bird flu, swine flu, and the common cold every year. Coronavirus will spread until virologists can make a live or dead vaccine or find an effective antiviral drug regimen.

So far, it seems older individuals are dying mostly from the virus. Younger folk get quarantined and a bad flu for sometime before coming to. The big scare is that right now, there is no confident course of action to treat.

I'm going to Italy in May and if it hasn't calmed down by then, I'll wear a facemask and bring purrell or something."
2020-02-25,RemindMeBot,Coronavirus,4,https://www.reddit.com/r/Coronavirus/comments/f9nhia/olympic_official_tokyo_is_looking_at_a/fisrg59/,"I will be messaging you in 3 months on [**2020-05-26 04:23:01 UTC**](http://www.wolframalpha.com/input/?i=2020-05-26%2004:23:01%20UTC%20To%20Local%20Time) to remind you of [**this link**](https://np.reddit.com/r/Coronavirus/comments/f9nhia/olympic_official_tokyo_is_looking_at_a/fisqzp8/?context=3)

[**CLICK THIS LINK**](https://np.reddit.com/message/compose/?to=RemindMeBot&subject=Reminder&message=%5Bhttps%3A%2F%2Fwww.reddit.com%2Fr%2FCoronavirus%2Fcomments%2Ff9nhia%2Folympic_official_tokyo_is_looking_at_a%2Ffisqzp8%2F%5D%0A%0ARemindMe%21%202020-05-26%2004%3A23%3A01%20UTC) to send a PM to also be reminded and to reduce spam.

^(Parent commenter can ) [^(delete this message to hide from others.)](https://np.reddit.com/message/compose/?to=RemindMeBot&subject=Delete%20Comment&message=Delete%21%20f9nhia)

*****

|[^(Info)](https://np.reddit.com/r/RemindMeBot/comments/e1bko7/remindmebot_info_v21/)|[^(Custom)](https://np.reddit.com/message/compose/?to=RemindMeBot&subject=Reminder&message=%5BLink%20or%20message%20inside%20square%20brackets%5D%0A%0ARemindMe%21%20Time%20period%20here)|[^(Your Reminders)](https://np.reddit.com/message/compose/?to=RemindMeBot&subject=List%20Of%20Reminders&message=MyReminders%21)|[^(Feedback)](https://np.reddit.com/message/compose/?to=Watchful1&subject=RemindMeBot%20Feedback)|
|-|-|-|-|"
2020-02-25,row2gobro,Winkerpack,4,https://www.reddit.com/r/Winkerpack/comments/f9537l/daily_discussion_thread_for_tuesday_february_25/fir1zqy/,"[WSJ: CDC expects COVID to spread to US](https://www.wsj.com/articles/cdc-warns-it-expects-coronavirus-to-spread-in-u-s-11582653829)

Trump says *all under control.*"
2020-02-25,oregon_forever,wallstreetbets,4,https://www.reddit.com/r/wallstreetbets/comments/f98o73/daily_discussion_thread_february_25_2020/firbjq0/,">Fed Vice Chair Clarida says it’s still too soon to tell on coronavirus, but will ‘respond accordingly’"
2020-02-25,daenerysisboss,LoveIslandTV,4,https://www.reddit.com/r/LoveIslandTV/comments/f9dkgs/season_7_estimated_release_date_monday_1st_june/firbs6e/,"“Dick Pound, the longest-serving member of the International Olympic Committee said the 2020 Olympics in Tokyo could face ""cancellation"" because of the fast-spreading coronavirus.”

How about we get Dick Pound on love island!"
2020-02-25,MochaModdin,wallstreetbets,4,https://www.reddit.com/r/wallstreetbets/comments/f98o73/daily_discussion_thread_february_25_2020/fir927n/,Coronavirus reported in switzerland and Spain
2020-02-25,MaleficentRespect3,Coronavirus,4,https://www.reddit.com/r/Coronavirus/comments/f9fn02/algeria_reports_first_case_of_coronavirus/fir9954/,"Yup... 

*Algeria has confirmed its first case of the coronavirus, an Italian man who arrived in the country on February 17, state television reported.*

 [https://www.devdiscourse.com/article/international/889746-algeria-confirms-first-case-of-coronavirus---state-tv](https://www.devdiscourse.com/article/international/889746-algeria-confirms-first-case-of-coronavirus---state-tv)"
2020-02-25,Hecksas247,greentext,4,https://www.reddit.com/r/greentext/comments/f9f56e/anon_does_incest/fir8i5n/,Can you write my thesis i have coronavirus and cant control my bowels I just keep shitting all over it
2020-02-25,Electronic_Stage,China_Flu,4,https://www.reddit.com/r/China_Flu/comments/f9evjn/so_basically_after_the_cdc_announcement_all/fire20z/,Don't believe a word coming out of Senator Blumental. He is a political hack. Just because the Coronavirus is coming doesn't mean these people are going to suspend their politics.
2020-02-25,Shieldhelm,RobinHoodPennyStocks,4,https://www.reddit.com/r/RobinHoodPennyStocks/comments/f9glb5/when_they_told_me_to_hold_tblt_cause_it_was_going/firgtln/,"Watch after hours. Today it held very stable despite the fact the market was still dropping incredibly. This stock moves consistently, it's either going to plateau after hours and rise tomorrow or shoot up after hours and have a sell off dip tomorrow followed by a large rise. You're not patient enough, market recovery will happen today after hours or tomorrow. TBLT is /GREEN/ in a sea of /RED/. Would you rather we be 100% wrong and it tumbles 8-20% like other stocks today? Be happy with it closing at 10%, it just means you can buy more for when it shoots up later. Coronavirus isn't keeping this bad boy down, and with shorts coming back tomorrow the volume may be through the roof.

Edit: After hours spike may come later, but I predict it'll happen sooner than later tonight. Keep an eye on it, it'll tell you how to trade tomorrow."
2020-02-25,WaitWhatOhNevermind,Coronavirus,4,https://www.reddit.com/r/Coronavirus/comments/f9ghbv/the_us_is_getting_hit_cdc_says_not_if_but_when/firdbzn/,"
https://www.reddit.com/r/Coronavirus/comments/f9e1ga/us_cdc_were_asking_folks_in_every_sector_as_well/

https://www.reddit.com/r/Coronavirus/comments/f9e8l0/coronavirus_live_updates_us_officials_warn/

https://www.reddit.com/r/Coronavirus/comments/f9eat3/new_york_times_front_page_cdc_tells_americans_to/

https://www.reddit.com/r/Coronavirus/comments/f9fzx1/coronavirus_live_updates_cdc_warns_americans_of/"
2020-02-25,nathanielx4,wallstreetbets,4,https://www.reddit.com/r/wallstreetbets/comments/f9h6jj/what_are_your_moves_tomorrow_february_26_2020/firyk9w/,"Tweet ""Great scientist in final stages for vaccine for the Coronavirus. Very good and final trade talks tomorrow."""
2020-02-25,Yung_Jose_Space,ChapoTrapHouse,4,https://www.reddit.com/r/ChapoTrapHouse/comments/f9529d/crying_about_a_poll_from_a_c_pollster_thread/firy9fp/,"Actually, the global economic impact of the coronavirus will decrease *after* it becomes a global pandemic.

It is the quarantine measures that cause issues."
2020-02-25,rmarti78,Coronavirus,4,https://www.reddit.com/r/Coronavirus/comments/f9jl51/north_korea_still_officially_claims_it_has_zero/firysdu/,"How would coronavirus even get to North Korea? I know they’re right there with China and South Korea, but their borders are essentially always closed, no?"
2020-02-25,Omegamaru,Enough_Sanders_Spam,4,https://www.reddit.com/r/Enough_Sanders_Spam/comments/f97kzh/daily_political_discussion_roundtable_02252020/firzsp5/,Coronavirus is trending on Twitter and I can't tell whether it's because of something new or if a Trump toady said something stupid.
2020-02-25,Cpt_SteveRogers,rangers,4,https://www.reddit.com/r/rangers/comments/f9birz/game_thread_new_york_rangers_33244_at_new_york/fis3ldm/,We need the Corazon memes to come back for the coronavirus
2020-02-25,Leaky_Buns,wallstreetbets,4,https://www.reddit.com/r/wallstreetbets/comments/f9h6jj/what_are_your_moves_tomorrow_february_26_2020/fis62o4/,"Okay guys. This article is a couple weeks old but might wanna take a look.

https://www.globenewswire.com/news-release/2020/02/13/1984409/0/en/ALPHA-PRO-TECH-ANNOUNCES-OVER-10-4-MILLION-IN-ORDERS-FOR-THE-COMPANY-S-PROPRIETARY-N-95-FACE-MASK-RESULTING-FROM-WUHAN-CORONAVIRUS-Covid-19-OUTBREAK.html

Basically APT exploded on me today and I found this article while doing more research to see how much more I should put into it.

Earnings are on 3/5"
2020-02-25,airchinapilot,canucks,4,https://www.reddit.com/r/canucks/comments/f9jrox/gt_vancouver_canucks_33226_montréal_canadiens/fis6ecj/,the lighting on that camera makes them all look like they have coronavirus
2020-02-25,mesj361,Coronavirus,4,https://www.reddit.com/r/Coronavirus/comments/f9az8y/daily_discussion_post_20200225_questions_images/fiskhqw/,"US Army soldier tested positive for coronavirus in South Korea, marking the first time a US service member is confirmed to have the disease
https://www.nytimes.com/2020/02/25/world/asia/coronavirus-news.html"
2020-02-25,wolfenstein1998,wallstreetbets,4,https://www.reddit.com/r/wallstreetbets/comments/f9h6jj/what_are_your_moves_tomorrow_february_26_2020/firln0o/,"[US health officials say human trials on coronavirus vaccine to start in 6 weeks](https://www.cnbc.com/2020/02/25/us-health-officials-say-human-trials-on-coronavirus-vaccine-to-start-in-6-weeks.html) 
SPY to 270"
2020-02-25,ejsilovecommonsense,Coronavirus,4,https://www.reddit.com/r/Coronavirus/comments/f9n4jj/if_your_city_is_quarantined_do_you_need_to_make/fisq85v/,"Is there a pandemic of people saying, “oh honey” in any Coronavirus response? I feel like this is a thing. It’s lame."
2020-02-25,Remy385,ChapoTrapHouse,4,https://www.reddit.com/r/ChapoTrapHouse/comments/f9gbug/let_the_markets_hit_the_floor_let_the_markets_hit/firmfo2/,"They're blaming it on Coronavirus but I was telling people over the weekend that the Dow will have a rough week because of Coronavirus in Italy + Bernie dominating Nevada. Both are bad for Wall Street. And the nice part about a Bernie-fearing crash is that it can be all blamed on Trump because he's the president and people are too stupid for complex reasonings.

Trump right now:

[https://media.giphy.com/media/poZnXsKLvTVGo/giphy.gif](https://media.giphy.com/media/poZnXsKLvTVGo/giphy.gif)"
2020-02-25,smophroux,China_Flu,4,https://www.reddit.com/r/China_Flu/comments/f9ilbl/guesstimating_total_current_cases_in_iran/firrupj/,And the total number of detected coronavirus travellers from Iran in the last few days to other countries is very high.  They've got loads of cases.  They're definitely not reporting nor even aware of the number of infected they have
2020-02-25,AlteregoMike,Coronavirus,4,https://www.reddit.com/r/Coronavirus/comments/f9i6ff/as_of_0225_cdc_in_the_us_has_only_tested_426_cases/firqog4/,"Daily testing metrics is super useful, which may gives us insights on how it's likely to be infected, and how much efforts the gov has put.

Meanwhile, Korean is about to test 200,000 more cases. And Japan has been testing each suspected case for 3 times

[https://www.theguardian.com/world/2020/feb/25/coronavirus-south-korea-to-test-200000-sect-members-as-pandemic-fears-hit-markets](https://www.theguardian.com/world/2020/feb/25/coronavirus-south-korea-to-test-200000-sect-members-as-pandemic-fears-hit-markets)"
2020-02-25,drakanx,China_Flu,4,https://www.reddit.com/r/China_Flu/comments/f9ibvb/news_tab_on_reddit_doesnt_show_any_coronavirus_in/firr8o7/,r/news funnels all coronavirus related articles/posts into the coronavirus megathread.
2020-02-25,Airia_Aura,Coronavirus,4,https://www.reddit.com/r/Coronavirus/comments/f9ld0h/whats_the_research_regarding_temperature_show/fisd5ph/,"When comparing it to SARS and MERS which share about 90% of the same DNA as the Coronavirus, both SARS and MERS don’t seem to be seasonal like the flu. MERS is currently still a problem in Saudi Arabia which is generally hot. But until the weather gets warmer, no one knows for certain how the coronavirus will react. [Will warming spring temperatures slow the coronavirus outbreak?](https://www.nationalgeographic.com/science/2020/02/what-happens-to-coronavirus-covid-19-in-warmer-spring-temperatures/)"
2020-02-25,verguenzanonima,Coronavirus,4,https://www.reddit.com/r/Coronavirus/comments/f9i7pk/madrid_reports_first_case_of_coronavirus_5th_case/firovyg/,">The Community of Madrid has certified the first case of coronavirus in the capital. This is a 24-year-old patient who was traveling in Italy. The sanitary equipment went to his home to take samples and has left positive.  
>  
>They are in good condition and has been transferred to Carlos III Hospital.  
>  
>Throughout this Tuesday there are already four confirmed cases in Spain: the woman of the Italian doctor who tested positive in Tenerife, one patient in Barcelona and another in Castellón.  
>  
>During this Tuesday, in addition, the Community of Madrid had carried out analysis at least three other people, who nevertheless gave negative throughout the afternoon.  
>  
>This is the first case registered in the Community, and this Tuesday was the day on which the virus has jumped to the Peninsula, since the two cases that were known weeks ago (and already discharged) occurred in the Canary Islands and the Balearic Islands"
2020-02-25,CRTsdidnothingwrong,China_Flu,4,https://www.reddit.com/r/China_Flu/comments/f9j3o7/is_there_any_evidence_that_people_who_recover/firvsu8/,"Think about it like the common cold, which can also be a type of Coronavirus.

If you and a family member both come down with the same cold and one of you gets better first, do you worry about catching it again from the other? No, there is some temporary immunity to that specific cold. But when the cold comes back around a month or year later you don't expect to have an immunity to it."
2020-02-25,imnotberg,chicagobulls,4,https://www.reddit.com/r/chicagobulls/comments/f9k725/game_thread_chicago_bulls_2038_vs_oklahoma_city/fisf73f/,">New

right around the time of the first case of the Coronavirus."
2020-02-25,James1DPP,The_Donald,4,https://www.reddit.com/r/The_Donald/comments/f9kqm9/watch_party_dem_debate_disaster_south_carolina/fisfwen/,"Biden: We have to insist to China that they let us in to help with the CoronaVirus. Insist! Insist! Insist!

Me: China ain't doing shit."
2020-02-25,scoobyroobyr00,memes,4,https://www.reddit.com/r/memes/comments/f9j6sl/die_or_die_dude/firwiu3/,*coronavirus
