date,author,subreddit,score,url,text
2020-02-06,CorrectAbroad,Coronavirus,27,https://www.reddit.com/r/Coronavirus/comments/f02hqf/41_new_corona_virus_cases_on_board_yokohama/fgr392j/,A good (or bad) indicator of how easily the virus spreads. Situation is looking dire.
2020-02-06,boostedturbo,Coronavirus,27,https://www.reddit.com/r/Coronavirus/comments/f00x5f/if_this_virus_is_so_bad_and_deadly_where_are_all/fgqsjfn/,"After reading this sub reddit... I have concluded: It's not that this virus is deadly in itself....  
It's that this virus has an extremely high infection rate, and causes pneumonia.  
Pneumonia is not really serious in most cases, and the cases it is serious in, it is treatable with care from staying in a hospital.  


This being said, the first few cases, it is no big deal, then the infection spreads and more people get pneumonia, filling up the hospitals... Once they are filled... It is game over. Now you have people with pneumonia in the middle of winter with no medical care."
2020-02-06,greyco31,Coronavirus,24,https://www.reddit.com/r/Coronavirus/comments/ezzffk/7000_people_on_those_quarantined_cruise_ships/fgqijhp/,"He’s not talking about diseases... he is talking about ONE disease. One disease in particular on a cruise ship where people are being quarantined exactly because of that ONE virus. You think that everyone is just strolling about the ship like usual? No, they are stuck in their rooms... it must be horrible, but it actually is a fairly good, if uncomfortable, experiment."
2020-02-06,LinkUnseen,Coronavirus,23,https://www.reddit.com/r/Coronavirus/comments/f00yi9/why_has_a_city_like_nyc_not_seen_any_coronavirus/fgqt1te/,"Did you know it's common in the US for people to avoid seeking medical help if they think they can just struggle through it and avoid the steep financial cost?

You can be infected for up to 2 weeks and have no symptoms.

Then you can have a week of mild symptoms. No reason to get upset.

After this point is where you either improve, or start to get worse. People might wait another week before going to a hospital.

Ask again in a month.

Edit: For reference, the first known case was around Dec 8th. The government didn't start taking it seriously until 3 weeks later, at which point only around 40 people had actually been diagnosed. The number of diagnoses didn't change for another 2 weeks while they kept things on the down low (some say they ran out of test kits). Then all hell broke loose. So yeah, give it a month or so."
2020-02-06,Dirty_Rotten_Rabbit,Coronavirus,22,https://www.reddit.com/r/Coronavirus/comments/f03b4w/if_we_make_it_to_march_5th_we_not_china_should_be/fgra907/,"
India: ""Hold my beer"""
2020-02-06,asswaxer,Coronavirus,21,https://www.reddit.com/r/Coronavirus/comments/ezxsy4/chinese_reporter_qiushi_chen_has_gone_missing/fgq63pc/,"FUCK

This guy placed himself in harm's way to bring this info to the world. He was the main source for so much.

He's absolutely a hero in journalism.


Edit :fuck you can hear the urgency and concern in her voice....."
2020-02-06,Iwannadrinkthebleach,Coronavirus,21,https://www.reddit.com/r/Coronavirus/comments/ezxsy4/chinese_reporter_qiushi_chen_has_gone_missing/fgq68uv/,China should stop now. They are making it so blatantly obvious how they treat their citizens and I'm sure most nations across the world dont agree with it.
2020-02-06,throwawaybobk,Coronavirus,21,https://www.reddit.com/r/Coronavirus/comments/ezyrgx/government_not_being_transparent_with_case/fgqdmlj/,"Took you long enough. Anyhoo, welcome friend."
2020-02-06,taionsherp,Coronavirus,20,https://www.reddit.com/r/Coronavirus/comments/f031gg/your_fear_of_the_coronavirus_isnt_precaution_its/fgr6qd0/,Shut up
2020-02-06,throwawaybobk,Coronavirus,20,https://www.reddit.com/r/Coronavirus/comments/ezxt4v/they_are_screening_cruise_passengers_now_in_miami/fgq7pb4/,Ok ok. If you get the virus could you tell us what it's really like PLEASE.
2020-02-06,Zeropossibility,Coronavirus,19,https://www.reddit.com/r/Coronavirus/comments/f02hqf/41_new_corona_virus_cases_on_board_yokohama/fgr4frd/,I can pretty much guarantee the virus is circulating in NYC.
2020-02-06,HeidiH0,Coronavirus,18,https://www.reddit.com/r/Coronavirus/comments/f01vvj/why_are_only_chinese_coronavirus_patients_dying/fgr0m8v/,The test sample is 1.  That isn't a test.  That's a science fair project graded F.
2020-02-06,Giacc3d,Coronavirus,18,https://www.reddit.com/r/Coronavirus/comments/f01uja/gym/fgqyj63/,Yeah if you wanna be a scrawny little bitch while fighting off corona zombies
2020-02-06,Thor442,Coronavirus,18,https://www.reddit.com/r/Coronavirus/comments/f02hqf/41_new_corona_virus_cases_on_board_yokohama/fgr4z8d/,Cruise ship is a bad example for any disease. The R0 of Norovirus goes from like 1.3 normally to over 7 on cruise ships
2020-02-06,Important-Fruit,Coronavirus,17,https://www.reddit.com/r/Coronavirus/comments/f01foq/china_plans_to_open_up_on_monday_210/fgqvokj/,About time. That virus won't spread on its own you know.
2020-02-06,Severe_Clouds,Coronavirus,17,https://www.reddit.com/r/Coronavirus/comments/f04adc/tons_of_conspiracy_on_here/fgrfwne/,"TRIGGER WARNING

The market hasn't crashed because they pumped a ton of money into it.  China put in Billions. The next day Chinese stocks rose higher than they should have.  Stocks I have been tracking or seeing for years moved much higher on this large amount of money being injected into the markets and China guaranteeing purchases.

I do not know which way this will go, and I cannot predict it.  Scientists and Experts are trying using estimates and models.

The action of our country is either being done privately or are non-existent as far as I am concerned we are not doing enough to stop the spread of the virus

Right now its a wait and see,  we must wait to see what information comes out.

I have never seen anyone go to their Dr. with the Flu Symptoms and it shut down entire Cities and Countries.  Nor have I ever been to my local Dr and or hospital to see an entire medical staff in Hazmat Suits.

We don't need Conspiracy as the truth is plain to see for those who are able to understand what they are seeing.

A city of 11 Million with hospitals Full and people waiting to get in them, they build 11 More Hospitals and those are full now.  Next patients will just be abandoned because the staff is exhausted and cannot handle the influx or they too get sick and die. Which evidence suggests this is already happening. 

On top of entire economies, countries, and cities all beginning to shut down people are so readily able to believe it is all being done for only 600 or so deaths?

I have to question the person who cannot see this.

Ignorance is Bliss."
2020-02-06,th3allyK4t,Coronavirus,17,https://www.reddit.com/r/Coronavirus/comments/ezzffk/7000_people_on_those_quarantined_cruise_ships/fgqhvdx/,Those figures won’t be totally accurate as cruise ships are notorious for spreading diseases.
2020-02-06,santaisabellazamora,Coronavirus,16,https://www.reddit.com/r/Coronavirus/comments/f02hqf/41_new_corona_virus_cases_on_board_yokohama/fgr33yh/,thats bad news
2020-02-06,Bumpy_Nugget,Coronavirus,16,https://www.reddit.com/r/Coronavirus/comments/f035vl/could_anyone_just_give_the_most_precise/fgr7xhd/,"Many people are sick.

Some are dead

Mostly in China"
2020-02-06,fishbellyblack,Coronavirus,16,https://www.reddit.com/r/Coronavirus/comments/f0095p/a_message_to_all_the_ccp_shills_freelance_or/fgqoawn/,"Yes, a lot of medics and scientists who aren’t worried about speaking out"
2020-02-06,Lizardman7,Coronavirus,16,https://www.reddit.com/r/Coronavirus/comments/ezy4kk/panic_genuine_question/fgq8lhf/,When was the last time you saw blue chip stocks close their businesses over a disease.
2020-02-06,Queencitybeer,Coronavirus,15,https://www.reddit.com/r/Coronavirus/comments/f03b9q/flight_from_wuhan_arrives_at/fgr972t/,Seems like it should be bigger news and that the media should be more informed about where the plane is going.
2020-02-06,Notviper1,Coronavirus,15,https://www.reddit.com/r/Coronavirus/comments/f01vx4/update_638_dead_31439_infected/fgqzpyc/,Keep markets up before the ultimate recession in a few months
2020-02-06,M4g3n7A,Coronavirus,15,https://www.reddit.com/r/Coronavirus/comments/f00xqx/health_minister_breaks_down_when_talking_about/fgqtm2t/,"Good man, really dedicated."
2020-02-06,__anthracite,Coronavirus,14,https://www.reddit.com/r/Coronavirus/comments/ezz1wb/do_you_believe_the_peak_has_been_is_present_now/fgqgg0o/,"China: Week of 1st April

India: June. 

Everywhere else: slow burn, with outbreaks springing up."
2020-02-06,BuyMed,Coronavirus,14,https://www.reddit.com/r/Coronavirus/comments/f031gg/your_fear_of_the_coronavirus_isnt_precaution_its/fgr6u1n/,"I hope you didn't write this article, because it was terrible."
2020-02-06,Carnotaur3,Coronavirus,14,https://www.reddit.com/r/Coronavirus/comments/f04r7v/the_flu_has_killed_10000_americans_as_the_world/fgri3v3/,"It’s about time we’ve heard this for the umpteenth, ignorant time"
2020-02-06,daisy7895528,Coronavirus,14,https://www.reddit.com/r/Coronavirus/comments/f000yb/traveling_to_singapore_on_17th_feb_any_advice/fgqmoil/,Don’t go
2020-02-06,throwawaybobk,Coronavirus,14,https://www.reddit.com/r/Coronavirus/comments/ezxt4v/they_are_screening_cruise_passengers_now_in_miami/fgq6be2/,That screening technique is useless to safeguard lives but excellent to protect the business from liability.
2020-02-06,picklepepperpickle,Coronavirus,14,https://www.reddit.com/r/Coronavirus/comments/f02hqf/41_new_corona_virus_cases_on_board_yokohama/fgr3lm8/,Here we are still waiting in NYC for test results LOL 8+ million people are sitting ducks for days!!!
2020-02-06,brunus76,Coronavirus,14,https://www.reddit.com/r/Coronavirus/comments/ezyi9c/realistically_if_the_flu_is_way_deadlier_why_are/fgqe5vg/,"It’s an air freshener. Lavender, probably."
2020-02-06,oic123,Coronavirus,14,https://www.reddit.com/r/Coronavirus/comments/f01vvj/why_are_only_chinese_coronavirus_patients_dying/fgqzdqe/,"According to these Shanghai scientists, the virus is 600% more likely to infect Asian men over others, because Asian men have a larger number of ACE2 enzymes in their lungs than other ethnicities.

https://www.biorxiv.org/content/10.1101/2020.01.26.919985v1.full"
2020-02-06,PooFlyer,Coronavirus,14,https://www.reddit.com/r/Coronavirus/comments/f00x5f/if_this_virus_is_so_bad_and_deadly_where_are_all/fgqs6vm/,Wait for it.
2020-02-06,howlsofwind,Coronavirus,13,https://www.reddit.com/r/Coronavirus/comments/f02ytz/princess_diamond_wuhan_in_a_nutshell/fgr685b/,RIP Cruise Industry
2020-02-06,feudalismforthewin,Coronavirus,13,https://www.reddit.com/r/Coronavirus/comments/f0168f/a_train_wreck_in_slow_motion/fgqu0ui/,">What a terrible time to be alive. 

I can think about millions of people who lived through the 20th century who would disagree with you. The virus is no joke, but your comment is histrionic."
2020-02-06,A9-EE-78-6A-C8-9F,Coronavirus,12,https://www.reddit.com/r/Coronavirus/comments/f01y9s/woman_who_is_forced_into_quarantine_in_a_box_this/fgqzda8/,You just now catching on to the human rights violations?
2020-02-06,Lizardman7,Coronavirus,12,https://www.reddit.com/r/Coronavirus/comments/f01zfi/india_34_confirmed_cases_in_india/fgqzhh7/,"zero coverage! Amazing. If there is any legitimate way the other 34 are ""pending"" let me know but I dont see how thats a factor given the setting."
2020-02-06,Nomadtv,Coronavirus,12,https://www.reddit.com/r/Coronavirus/comments/ezy9nv/who_pandemic_alert_level/fgqarln/,"Currently still only level 5 I believe, although they passed their criteria for level 6 last week.   


Even congress said in their briefing yesterday that the WHO seems to be beholden to China and is not properly addressing the issue."
2020-02-06,grandmothertrillow,Coronavirus,12,https://www.reddit.com/r/Coronavirus/comments/f02hqf/41_new_corona_virus_cases_on_board_yokohama/fgr2yyy/,Fuck.
2020-02-06,ruxgirl333,Coronavirus,12,https://www.reddit.com/r/Coronavirus/comments/ezzldu/possible_case_in_pennsylvania/fgqizli/,I can’t imagine asking a volunteer firefighter to do that!
2020-02-06,Ten7ei,Coronavirus,12,https://www.reddit.com/r/Coronavirus/comments/ezzffk/7000_people_on_those_quarantined_cruise_ships/fgqk0bx/,I think R0 cannot be determined in a scenario like a crowded ship. but correct me if I'm wrong.
2020-02-06,ne0ndistraction,Coronavirus,12,https://www.reddit.com/r/Coronavirus/comments/f0470q/so_california_now_texas_and_nebraska/fgrek7p/,"“It’s actually very unlikely that on the flight that lands here, there will be somebody with active signs of illness,” she said.

OF COURSE THEY DON'T HAVE ACTIVE SIGNS OF THE ILLNESS! Otherwise they wouldn't have allowed them to board the plane (IIRC). The problem is, you can asymptomatically spread this fucking virus. 

And that is why she chose her words carefully. And that is what troubles me."
2020-02-06,Lizardman7,Coronavirus,12,https://www.reddit.com/r/Coronavirus/comments/f00x5f/if_this_virus_is_so_bad_and_deadly_where_are_all/fgqs9v4/,The doctor just died whos an OG.....  that’s scary as fuck
2020-02-06,xSaRgED,Coronavirus,12,https://www.reddit.com/r/Coronavirus/comments/ezyhqc/taiwan_evacuated_its_citizens_from_wuhan_and_3_of/fgqfalp/,A very bad one.
2020-02-06,Zaneris,Coronavirus,11,https://www.reddit.com/r/Coronavirus/comments/ezyi9c/realistically_if_the_flu_is_way_deadlier_why_are/fgqfjhi/,So... If they're doing the same thing with coronavirus as the flu with determining the cause of death...
2020-02-06,asswaxer,Coronavirus,11,https://www.reddit.com/r/Coronavirus/comments/f01foq/china_plans_to_open_up_on_monday_210/fgqvpyv/,Oh ccp. The most dangerous ailment on earth. It'll burn itself out eventually
2020-02-06,roleme17,Coronavirus,11,https://www.reddit.com/r/Coronavirus/comments/f01rnq/will_it_spread_in_the_us/fgqyz01/,"As I said in another post....

Wuhan had 7 suspected cases in the first half of December. 27 suspected by the end of December. January 10, 41 confirmed cases.

So about a month, before things started to really reveal it's significance. We know more now than we did then. I would estimate around Valentines (2/14) things are really going to explode in the rest of the world.

Even though more is known not a lot is being done on the visible surface, especially in places like the USA.

If folks aren't educated on how bad things could get it will simply be business as usual and this thing will spread exponentially.

It would be more helpful if we had more specifics on mortality rate and death factors. This could be as bothersome as a severe cold or it could be as lethal as terminal cancer. We just don't know enough fact."
2020-02-06,ndkdkdndh,Coronavirus,11,https://www.reddit.com/r/Coronavirus/comments/f00x5f/if_this_virus_is_so_bad_and_deadly_where_are_all/fgqt6pa/,It seems like it took nearly two months for it to explode in wuhan.
2020-02-06,Headwest127,Coronavirus,11,https://www.reddit.com/r/Coronavirus/comments/f0095p/a_message_to_all_the_ccp_shills_freelance_or/fgqpckw/,"I agree. Shill away you CCP loyal scamps, but have some respect for the fact that your work is being seen on a larger scale. You might be able to get away with copy pasta of some pre-worded message when you're censoring WeChat, but we in the West expect a little more from our shills. Pretend to say something bad about the CCP BEFORE you try to tell us (again) that everything is under control. Use a little profanity when appropriate. It makes you seem more western and believable because, honestly, I don't trust anyone who doesn't drink or curse just a little. Overall, the effort isn't a total failure - we're here discussing you now - but you've been busted now and need to find a new game plan. I'll make a deal with you, before you post that same bullshit post under a different user name AGAIN, DM me and I'll punch it up a little for you. No charge. It would be fun to help you out in your time of need."
2020-02-06,mehhhhhhhhhhhhhhhhhh,Coronavirus,11,https://www.reddit.com/r/Coronavirus/comments/f007ig/usa_is_sold_out_of_masks_online/fgqnk3o/,Because lots of people like me bought a couple when the writing was on the wall (2 weeks ago). I'm still going to work and I'm not wearing it yet. But I'll have one ready and not be standing in a line with thousands of infected people when it comes to my city.
2020-02-06,Awakeat5amagain,Coronavirus,11,https://www.reddit.com/r/Coronavirus/comments/f00yi9/why_has_a_city_like_nyc_not_seen_any_coronavirus/fgqsou7/,Information is being suppressed
2020-02-06,Notviper1,Coronavirus,11,https://www.reddit.com/r/Coronavirus/comments/f00x5f/if_this_virus_is_so_bad_and_deadly_where_are_all/fgqsck5/,He was saying this back in December as well
2020-02-06,FullSpectrumSurvival,Coronavirus,11,https://www.reddit.com/r/Coronavirus/comments/f00x5f/if_this_virus_is_so_bad_and_deadly_where_are_all/fgqsmtt/,"With this type of virus (incubation period/mortality/spreadability) it is a minimum of a 1 month waiting period to see if it's going to be contained or disasterous.

Even if it's contained now, if it remains epidemic, it will circle the Earth and could be back harder in non affected countries next year.

Bottom line, watch what the government's are doing. That's when it is or isn't serious."
2020-02-06,BuyMed,Coronavirus,11,https://www.reddit.com/r/Coronavirus/comments/f01j6i/garlic_water/fgqweqp/,Maybe it can treat your retardation?
2020-02-06,Victurd09,Coronavirus,11,https://www.reddit.com/r/Coronavirus/comments/f01cgh/the_australian_department_of_health_now_says_5/fgqv6q5/,Beautiful.
2020-02-06,GodsWarrior89,Coronavirus,11,https://www.reddit.com/r/Coronavirus/comments/ezxz9n/if_the_corona_virus_was_a_movie/fgq7d65/,Contagion.
2020-02-06,BigReaderCassius,Coronavirus,11,https://www.reddit.com/r/Coronavirus/comments/ezy4kk/panic_genuine_question/fgq8r65/,"60 million people quarantined 
Us shut down borders to china
China shuts down economy 
Wuflu round ups
R=0 of 4

Yeah boomer nothing to worry about
*Coughs*"
2020-02-06,Ryker_05,Coronavirus,11,https://www.reddit.com/r/Coronavirus/comments/f02hol/61_on_cruise_ship_in_japan_now_positive_and_china/fgr33lc/,It’s just a shit storm in Asia rn
2020-02-06,CaitiJ,Coronavirus,11,https://www.reddit.com/r/Coronavirus/comments/f02hqf/41_new_corona_virus_cases_on_board_yokohama/fgr4oa9/,Correct. NYC is still waiting. They are testing and retesting that cruise ship over and over. No way anyone is actually waiting for results in the US.
2020-02-06,asswaxer,Coronavirus,11,https://www.reddit.com/r/Coronavirus/comments/f007la/hubei_reports_2447_new_cases_69_new_deaths_a/fgqoim2/,Haha yes comrade. The chairman is most pleased
2020-02-06,MissileHorse,Coronavirus,11,https://www.reddit.com/r/Coronavirus/comments/f00tld/is_the_ccp_setting_up_for_a_disaster_theyre/fgqtkgq/,"The way I see it, is CCP is following the USSR to a tee. History is repeating itself. Both made their way up into a wealthy superpower. The problem is that system is inherently broken. There was a huge toll on the populace for them to get industrialised and bring people into the middle class. Once they reached a certain point, the system begins to run its course. Since it is a top-down system (meaning everything always depends on the guy higher up than you), people start not doing their jobs, or can fake doing their jobs and when things go wrong, no one claims responsibility. When everyone starts scrambling to get things done, they can't because its already broken from the bottom up. All those times they told their superiors that everything was fine, and going well, suddenly begins to fall apart. The guy at the top assumes everyone is doing their job because of how powerful and strong-armed he or she is. Now to keep their positions and preserve the party (because they believe no one else can run the country correctly other than them), everyone from top down has to crack down on people to show they actually are doing something and keep everyone in line. They start doing crazy things or doing the wrong move, but none can say anything for fear of being reprimanded. Then you enter the shit show. People now see through their bullshit, and there is nothing they can do it about now. With the world and its own people not having confidence, the system inevitably crumbles because you can only hold the pile of bullshit up for so long. The sad irony is that the CCP could of saved themselves and China, had they not arrested the doctors, and actually took initiative to deal with this virus."
2020-02-06,bamasmith,Coronavirus,11,https://www.reddit.com/r/Coronavirus/comments/ezx1l2/mask_hoarding_doesnt_really_make_any_sense_to_me/fgq0pq4/,">This virus is .12 microns which means your mask will not filter it out.

Flawed logic, the virus (as we currently know) needs to travel in small water droplets."
2020-02-06,tokyochrisf,Coronavirus,11,https://www.reddit.com/r/Coronavirus/comments/ezzffk/7000_people_on_those_quarantined_cruise_ships/fgr50ym/,"An additional 41 have come back positive - therefore total 61. It's unclear how many of the 273 tests have returned so far.

[https://www.japantimes.co.jp/news/2020/02/07/national/coronavirus-diamond-princess-cruise-ship/#.Xjy6KGgzaUk](https://www.japantimes.co.jp/news/2020/02/07/national/coronavirus-diamond-princess-cruise-ship/#.Xjy6KGgzaUk)"
2020-02-06,Kujo17,Coronavirus,10,https://www.reddit.com/r/Coronavirus/comments/f02hol/61_on_cruise_ship_in_japan_now_positive_and_china/fgr3zh6/,Wait until we find out it's not just Asia
2020-02-06,shwoople,Coronavirus,10,https://www.reddit.com/r/Coronavirus/comments/f04adc/tons_of_conspiracy_on_here/fgrfhxx/,"We will not likely get the truth of reality in China. Best we can do is be prepared, hope for a vaccine that can be mass produced before any major spread, and hope other countries report transparently."
2020-02-06,ne0ndistraction,Coronavirus,10,https://www.reddit.com/r/Coronavirus/comments/f052l1/we_are_very_much_too_late/fgrl18f/,"I have no faith in a person's ability to self quarantine.

People will send their kids to school with fevers over 100°F. They will go to the mall with the flu. They will cough in their hands and bag your groceries right after."
2020-02-06,BoyYeetzWorld,Coronavirus,10,https://www.reddit.com/r/Coronavirus/comments/f01zfi/india_34_confirmed_cases_in_india/fgr05fs/,No where does it say this is confirmed.  False title and should be removed.
2020-02-06,asswaxer,Coronavirus,10,https://www.reddit.com/r/Coronavirus/comments/ezyi9c/realistically_if_the_flu_is_way_deadlier_why_are/fgqb75k/,"Well according to Chinese central govt own numbers, the coronavirus virus has killed over 4x as many people in 1 month as the flu did in China in all of 2019 (144 deaths, Global Times, the Chinese state media outlet)"
2020-02-06,multiple4,Coronavirus,10,https://www.reddit.com/r/Coronavirus/comments/f02hqf/41_new_corona_virus_cases_on_board_yokohama/fgr6h2j/,"Unless over 1000 of the passengers get the virus I don't think it's enough info to make a meaningful determination on death rate either. Plus the type of people who go on cruises during the end of January and beginning of Feburary to Japan tend to be older, which means a lot of them will of course be more susceptible to complications from the virus

It's just not a meaningful statistic. All it will tell us is that cruise ships are bad for spreading sickness and that old people are more susceptible to sickness, both of which we know"
2020-02-06,CuzzinTerio,Coronavirus,10,https://www.reddit.com/r/Coronavirus/comments/f03ggt/ccp_shills_and_trolls_you_do_realize_youre_just/fgreng2/,Please do not worry. Everything under control. China take care of citizens.
2020-02-06,SeoulTezza,Coronavirus,10,https://www.reddit.com/r/Coronavirus/comments/f000yb/traveling_to_singapore_on_17th_feb_any_advice/fgqnodp/,Cancel your hotel reservation then rebook it. You are likely to get huge discounts now. Have fun!
2020-02-06,jgt23,Coronavirus,10,https://www.reddit.com/r/Coronavirus/comments/f0095p/a_message_to_all_the_ccp_shills_freelance_or/fgqo97l/,"Well, because a bunch of epidemiologists say so. It's painfully obvious."
2020-02-06,MsKaye,Coronavirus,10,https://www.reddit.com/r/Coronavirus/comments/f02hqf/41_new_corona_virus_cases_on_board_yokohama/fgr5scw/,But this might get  us a “truer” death rate. Those who are being found positive are being moved to medical facilities for proper care.
2020-02-06,Thor442,Coronavirus,10,https://www.reddit.com/r/Coronavirus/comments/f02hqf/41_new_corona_virus_cases_on_board_yokohama/fgr3yrf/,"I mean, there was recently a Norovirus outbreak on a ship that had 500 sick. Cruise ships have always been a no go zone for me."
2020-02-06,herowiggles,Coronavirus,10,https://www.reddit.com/r/Coronavirus/comments/f031gg/your_fear_of_the_coronavirus_isnt_precaution_its/fgr7d2z/,Get off reddit Xi and help your people
2020-02-06,dunzee,Coronavirus,10,https://www.reddit.com/r/Coronavirus/comments/ezxsy4/chinese_reporter_qiushi_chen_has_gone_missing/fgq6l4d/,"I'm fucking shocked right now, he was the main news reporter from Wuhan for me.

I'm hope he'll be fine and everything is alright with him"
2020-02-06,one2zerojigawat,Coronavirus,10,https://www.reddit.com/r/Coronavirus/comments/ezxsvl/friend_in_wuhan_stranded_in_apt_with_no_access_to/fgq7fgy/,"Tell them to sack up and go find food. 

Do nothing: you WILL die. 

Do something: you MIGHT die."
2020-02-06,NothingtoSeeHere0909,Coronavirus,10,https://www.reddit.com/r/Coronavirus/comments/ezyrgx/government_not_being_transparent_with_case/fgqecqg/,"Haha Yes, welcome - you’re not crazy.  The media is gaslighting us. It’s the largest travel ban & mass quarantine in history - justifiable to be concerned and want to be prepared for possible scenarios.  - you’re not alone."
