date,author,subreddit,score,url,text
2020-02-16,eldiabs,Coronavirus,9,https://www.reddit.com/r/Coronavirus/comments/f4y57t/i_work_in_a_major_academic_hospital_in_the_us/fhv7d5c/,"Watch this and share it with your superiors. Especially the first two speakers. [https://youtu.be/fau718wOeXU](https://youtu.be/fau718wOeXU)

Their models are showing potentially 200K infected as of February 8 ( timestamped - [https://youtu.be/fau718wOeXU?t=2731](https://youtu.be/fau718wOeXU?t=2731) ) using just the 88 genomes they've sequenced from the virus. With human to human transmission starting sometime between November 15 and December 15, 2019. A doubling rate every six days so by that estimate we are at half a million worldwide. Also disproves much of the 'it came from a bio weapons lab!' conspiracy with evidence based logic.

[https://nextstrain.org/ncov](https://nextstrain.org/ncov)

The fact so many comments here are from health workers working in locations with no apparent plans in place is super disheartening."
2020-02-16,imperfect_plotting,Coronavirus,9,https://www.reddit.com/r/Coronavirus/comments/f4zm1u/there_is_a_change_petition_for_the_resignation/fhvifvb/,"This is nice and all, but they'll just get some other stooge in there who's just as bad."
2020-02-16,MagMan1979,Coronavirus,9,https://www.reddit.com/r/Coronavirus/comments/f4ze4t/who_division_tackling_coronavirus_underfunded_and/fhvgc4p/,"Well colour me stunned! /s

The WHO’s second-largest funding partner is CHINA, isn’t that a conflict of interest right there, amongst all the other allegations, including this??"
2020-02-16,cliu6,Coronavirus,9,https://www.reddit.com/r/Coronavirus/comments/f4ze4t/who_division_tackling_coronavirus_underfunded_and/fhvesyb/,as expected
2020-02-16,xzander0,Coronavirus,9,https://www.reddit.com/r/Coronavirus/comments/f4zvpg/new_singapore_downgrades_gdp_growth_forecast_to/fhvmclj/,wow... painfully honest they are
2020-02-16,MouseInLove,Coronavirus,9,https://www.reddit.com/r/Coronavirus/comments/f50npa/preparedness_strategy_discussion/fhvxdpg/,"I don't think you're overreacting.  Prepare for the worst and hope for the best, as they say.  Nothing wrong with stocking up on stuff for any emergency.  I do think there's a chance that this could get bad outside of China.  It might not get bad but prepping is about preparing for the worst IN CASE it gets bad.  That's what non-preppers don't get.  They say things like ""Well, if it gets bad then I'll prep"" but if you wait too long then it's too late.  Already in my area in California masks and gloves are sold out.  So being PREpared means prepping BEFORE SHTF.  Not after. Follow your instincts and don't worry about what other people think.  We're being logical and looking at the situation and China and seeing that IF it happens here we might need to stay in our homes for a while.  The more people that prep, the fewer people will be out in stores and spreading the virus. You're doing a service to the community by making it so you don't have to go out and contribute to the chaos."
2020-02-16,Zandor72,Coronavirus,9,https://www.reddit.com/r/Coronavirus/comments/f4y57t/i_work_in_a_major_academic_hospital_in_the_us/fhvxeyo/,"We need to make sure nobody knows, until everybody knows...."
2020-02-16,pie17171717,Coronavirus,9,https://www.reddit.com/r/Coronavirus/comments/f50r4m/if_you_cant_provide_evidence_backing_up_your/fhw0det/,Unverified by who? The people who they claim are lying?
2020-02-16,Phoenyx634,Coronavirus,9,https://www.reddit.com/r/Coronavirus/comments/f5260f/protecting_infants_from_this_virus/fhw9s1u/,Dr John Campbell made a great video [COVID19 infections in infants might be rare and mild](https://youtu.be/BlpR9Gi4RaI)
2020-02-16,Intense_Resolve,Coronavirus,9,https://www.reddit.com/r/Coronavirus/comments/f4ux33/why_does_it_seem_like_money_is_being_prioritized/fhtwvpy/,"Most of the stuff people do are essential life and services.  Someone drills for oil and others refine it into diesel, which goes into a farmer's tractor, which is how he grows and harvest food, which goes to a factory and becomes a packaged food product, which a tractor trailer driver has to bring to the store, where stocker's unload the food and stock shelves, where a cashier rings up the groceries of the wife of the guy who is out drilling for oil.

It's only artists, academics, and shit like that who could take a month off without the world falling into chaos.

People are creating the electricity that is powering the computer you are using right now, including people who work on the electrical lines, monitor the system, feed coal into the power plants, mine that coal, etc .."
2020-02-16,KatzaAT,Coronavirus,9,https://www.reddit.com/r/Coronavirus/comments/f4vjme/the_trade_impact_of_the_virus_that_no_ones/fhu326m/,Basically everyone is talking about it
2020-02-16,ciabattabing16,Coronavirus,9,https://www.reddit.com/r/Coronavirus/comments/f4upll/massive_delay_for_products/fhu3u5u/,"Need someone to get it off the boat and into their distribution network, which is probably also bare bones staff atm."
2020-02-16,enkiloki,Coronavirus,9,https://www.reddit.com/r/Coronavirus/comments/f4u9ak/40_americans_evacuated_from_the_diamond_princess/fhumcyy/,"What he doesn't understand is that even if stays on the ship for a year, when he come to the USA he's still going to be quarantined."
2020-02-16,nrps400,Coronavirus,9,https://www.reddit.com/r/Coronavirus/comments/f4xzq9/been_low_key_prepping_just_ordered_an_o2/fhuwk3b/,"Preppers: Pandemic will tank the global economy

Also preppers: Consumer spending growth quadruples due to panic buying"
2020-02-16,Ascendancex,Coronavirus,9,https://www.reddit.com/r/Coronavirus/comments/f532j8/can_we_please_stop_downplaying_the_situation/fhwg3hh/,"Be cautious and smart but don’t act like zombies have overtaken the world. And certain don’t let yourself be consumed with fear. Scared people are the WORST kind of people to be in a situation with. People used to tell me I had bad anxiety but ffs people here devote their lives to Coronavirus and reporting on its death toll. This shouldn’t be a damn spectacle not should so many pessimistic individuals be in the same place. When there isn’t other POV, people start thinking that theirs is the only view worth discussion and people in privileged places shouldn’t be acting as if the world has ended/will end tomorrow. Newsflash, death has been lurking on many on a daily basis. My family has a funeral coming up unrelated to this. Have people gone on with life thinking they’d never die and suddenly think that this virus is their one Achilles heel?"
2020-02-16,NepoDumaop,Coronavirus,9,https://www.reddit.com/r/Coronavirus/comments/f516c6/the_province_i_live_has_the_second_highest/fhw4lr2/,Dude check OP's previous comments/posts weeks ago. He's been saying the same thing that the numbers are declining. And we all know that is not the case.
2020-02-16,RampantInanity,Coronavirus,9,https://www.reddit.com/r/Coronavirus/comments/f50r4m/if_you_cant_provide_evidence_backing_up_your/fhw4va7/,"My friend is in Wuhan and he told me that some people with COVID19 are starting to spontaneously combust. Trust me, it's true, my friend wouldn't lie about this."
2020-02-16,ImaginaryFly1,Coronavirus,9,https://www.reddit.com/r/Coronavirus/comments/f5344a/can_someone_please_explain_to_me_why_people_are/fhwfeho/,Thank you!!!!
2020-02-16,Random_CPA,Coronavirus,9,https://www.reddit.com/r/Coronavirus/comments/f538s1/exempt_chinese_students_from_coronavirus_travel/fhwfr81/,Might as well not have any ban whatsoever with an exemption like that.
2020-02-16,GrindingWit,Coronavirus,9,https://www.reddit.com/r/Coronavirus/comments/f538fq/japans_health_minister_urges_the_public_to_avoid/fhwfnn9/,Finally. Common sense.
2020-02-16,AuntieLili,Coronavirus,9,https://www.reddit.com/r/Coronavirus/comments/f538s1/exempt_chinese_students_from_coronavirus_travel/fhwgij1/,"Yes let’s put business before health, bring in the infected Chinese and get ur entire student population infected, so your healthcare gets overwhelmed, a lot of your people die and declare economic bankruptcy cus you have no workforce. Solid plan!"
2020-02-16,Ffdfggfgdrfwfzdf,Coronavirus,9,https://www.reddit.com/r/Coronavirus/comments/f4zhn5/russia_points_finger_at_usa_claiming_covid19_is_a/fhvhkxc/,Just Putin exploiting the virus to spread his political agenda. Disgusting really.
2020-02-16,ForestRangerJenny,Coronavirus,9,https://www.reddit.com/r/Coronavirus/comments/f4ypmi/schools_in_brighton_hove_and_eastbourne_have_told/fhvqhev/,"I live 5 minutes from LAX and pulled my 5 year old out of school (and Japanese Saturday school) last week and have decided to homeschool until we have more information. My husband thinks I'm being ridiculous, but my husband and 5 year old have asthma and my 3 year old has had febrile seizures. They're building a quarantine by our house and I really wish I was in Montana right now. I'm afraid of how people will act towards each other when people start getting laid off and supplies run short."
2020-02-16,mandalorian88-25,Coronavirus,9,https://www.reddit.com/r/Coronavirus/comments/f5096p/it_all_just_got_very_real_for_me_read_before_this/fhvr4zv/,"Well I wouldnt doubt it. Also, In B4 mods delete"
2020-02-16,schuylkilladelphia,Coronavirus,9,https://www.reddit.com/r/Coronavirus/comments/f4um90/elton_john_diagnosed_with_pneumonia/fhttvb9/,"I think you posted in the wrong sub, what does this have to do with COVID-19"
2020-02-16,lovjok,Coronavirus,9,https://www.reddit.com/r/Coronavirus/comments/f4uo6n/i_just_flew_to_seattle_after_spending_almost_3/fhu5z3n/,I have to check in with employee health before I return to work so I will let them know.
2020-02-16,lovjok,Coronavirus,9,https://www.reddit.com/r/Coronavirus/comments/f4uo6n/i_just_flew_to_seattle_after_spending_almost_3/fhu657j/,Still in the airport but wearing a mask and practicing good hand hygiene.
2020-02-16,Xoanon99,Coronavirus,9,https://www.reddit.com/r/Coronavirus/comments/f4upll/massive_delay_for_products/fhuc730/,"> You are describing literally every seller on amazon...

The second hand book market on Amazon won't be affected, we source all of our books from local charity shops."
2020-02-16,LapisLazuliOne,Coronavirus,9,https://www.reddit.com/r/Coronavirus/comments/f50npa/preparedness_strategy_discussion/fhvxckb/,"I stocked up this weekend - have a month of dry goods, as well as extra batteries, medicines, shampoo etc. Basically stocked up on anything I use regularly that a shortage might affect. Haven’t gotten paper goods or cleaning supplies stocked up - those are next. I have to travel soon and can’t avoid it, so trying to stay positive about that but will lay low after. Don’t think they would ever force a quarantine in the US - someone posted an Atlantic article today about how it would be too difficult to do that legally."
2020-02-16,djmagichat,Coronavirus,9,https://www.reddit.com/r/Coronavirus/comments/f4x64d/container_shipping_exchina_grinding_to_a_halt/fhujagu/,"I work in supply chain logistics moving containers out of China for the most part, the lack of goods coming out of China will start effecting us greatly in the next few weeks as containers aren’t moving with product like they used to."
2020-02-16,The_Spook_of_Spooks,Coronavirus,9,https://www.reddit.com/r/Coronavirus/comments/f4sxfl/cv_is_no_joke/fhtgbwx/,"> Having had a past sudden onset (and much less severe) respiratory problems in the past,

I hear you on that.  I'm a pretty in shape guy and I caught pneumonia when I was 34 and it almost killed me.  I ruptured the blood vessels in both my eyes from coughing so much, even passed out from lack of oxygen when I finally made it to the ER.  I never want to experience that hell again."
2020-02-16,watertatertot0182,Coronavirus,9,https://www.reddit.com/r/Coronavirus/comments/f516c6/the_province_i_live_has_the_second_highest/fhw283k/,"So wait let me get you straight, your saying the situation isn't all that bad?"
2020-02-16,wuflu4u,Coronavirus,9,https://www.reddit.com/r/Coronavirus/comments/f4sxfl/cv_is_no_joke/fhu8v0f/,If we were senselessly bipartisan it would be a very boring country lol
2020-02-16,pass_me_im_slow,Coronavirus,9,https://www.reddit.com/r/Coronavirus/comments/f4wuw5/just_some_lifestyle_tips/fhug0h4/,I agree with all of this. I've been using condoms to masturbate. I don't really know whwere my penis has been. On steve bannon's podcast he said dicks are the biggest sleeper carriers.
2020-02-16,HeAbides,Coronavirus,9,https://www.reddit.com/r/Coronavirus/comments/f4upll/massive_delay_for_products/fhutych/,"People have been talking for weeks about how supply chain disruptions is where the real pain will be felt. If you think shortages in the furniture market is going to be felt, wait till you see pharmaceutical shortages.

Companies are also going to see significant delays in new product launches due to the ties these same manufacturers to scale up activities of product development and NPIs."
2020-02-16,HarryButterscotch,Coronavirus,9,https://www.reddit.com/r/Coronavirus/comments/f4z9zc/is_the_stock_market_about_to_crash_due_to_this/fhvdhlj/,"I was on the fence the last couple weeks. I had a small nest I egg in the market and decided to sell on Friday after watching this on CNBC on Thursday. I'd rather be sitting on cash just in case

https://youtu.be/EMK9HG3jWC8"
2020-02-16,ToiletPlungerOfDoom,Coronavirus,9,https://www.reddit.com/r/Coronavirus/comments/f4yzaa/i_have_a_slight_fever_and_a_cough_i_sometimes/fhv8ohf/,Don’t trust a random internet person to diagnose you.
2020-02-16,flightofafeather,Coronavirus,9,https://www.reddit.com/r/Coronavirus/comments/f52dc1/any_preparation_recommendations/fhwbh2s/,"I up voted you. People on here want to believe wholeheartedly in western medicine, especially now. Cayenne is the best! Stops bleeding. They think it’s the essential oil crowd piping in. Don’t waver in your thoughts. Stay strong in your stance and stay safe fam."
2020-02-16,kbutters9,Coronavirus,9,https://www.reddit.com/r/Coronavirus/comments/f53avc/chinas_ambassador_to_australia_calls_for_change/fhwfun3/,What could possibly go wrong?
2020-02-16,satx-9,Coronavirus,9,https://www.reddit.com/r/Coronavirus/comments/f4z4rd/the_nhs_is_preparing_for_50_of_the_uk_to_become/fhvh5cc/,World War 1 and 2 killed an estimated 100 million plus. Where did you get 1.5 million? That sounds like the total from the UK alone.
2020-02-16,crypt_keeper88,Coronavirus,9,https://www.reddit.com/r/Coronavirus/comments/f50r4m/if_you_cant_provide_evidence_backing_up_your/fhw0ult/,If you can’t sift through the bullshit you probably shouldn’t be on reddit. Trolls right now the world over are looking for posts such as this.
2020-02-16,ne0ndistraction,Coronavirus,9,https://www.reddit.com/r/Coronavirus/comments/f4u9ak/40_americans_evacuated_from_the_diamond_princess/fhtmtlw/,"So 10% of the Americans that were to be evacuated.

I feel like there's a pretty big chance that some of the other 360 that were actually evacuated to the US will get infected. :("
2020-02-16,veni_vedi_vinnie,Coronavirus,9,https://www.reddit.com/r/Coronavirus/comments/f51lh9/shenzhen_factory_just_told_me_on_hold_till_virus/fhw56gf/,"Just curious. Assuming this doesn’t hit North America, South America or Europe hard. How long would you wait to pull the trigger to start looking for a new factory on those continents."
2020-02-16,beepbeepbop_,Coronavirus,9,https://www.reddit.com/r/Coronavirus/comments/f4upll/massive_delay_for_products/fhttz2h/,"It's going to happen all over.  My wife has a side gig selling handbags on eBay that she sources from aliexpress.  Her vendors are telling her it'll be mid to late March at the latest before they can ship her stuff, and her customers on eBay are cancelling orders instead of waiting.  She said she's probably just going to shut it down.  Earned a little more than a car payment, but still.  This is going to effect a lot of people."
2020-02-16,RampantInanity,Coronavirus,9,https://www.reddit.com/r/Coronavirus/comments/f50r4m/if_you_cant_provide_evidence_backing_up_your/fhw6rp1/,That's my point.
2020-02-16,InfowarriorKat,Coronavirus,9,https://www.reddit.com/r/Coronavirus/comments/f513zm/nursing_101_caring_for_your_loved_ones_at_home/fhw8ek1/,"Awesome! I recently purchased a nebulizer. That's good to know you can use the saline alone (since you don't need a script for it). I also seen a device on Amazon that looks like a kazoo that uses vibrations to help loosen phlegm from the respirtory system. It's called Turboforte. I purchased an ozone generator to (attempt to) kill germs/ viruses on hard to clean surfaces and in the air. Someone showed me home vent covers that have UV light in them to sanitize the air as it passes by the light. Again, IDK how effective any of this will be, but I'm sure it can't hurt. Also I think it's important not to feel helpless."
2020-02-16,slagwa,Coronavirus,9,https://www.reddit.com/r/Coronavirus/comments/f51eui/its_been_almost_a_week_and_no_new_cases_in_usa/fhwa2fp/,Funny. I think the same thing about our military spending.
2020-02-16,cheturo,Coronavirus,9,https://www.reddit.com/r/Coronavirus/comments/f52inw/did_the_who_fail_to_fight_the_coronavirus/fhwaz5w/,"Not WHO, it was China government who failed to their citizens."
2020-02-16,liljeno4,Coronavirus,8,https://www.reddit.com/r/Coronavirus/comments/f52dc1/any_preparation_recommendations/fhw9vlk/,"Cayenne pepper or wonder dust stops bleeding

I don’t know why this is getting down voted but farmers use wonder dust to stop bleeding all the time . On animals themselves 

In midwife labor books it says use cayenne pepper . You can try it . It doesn’t burn . It is used to stop hemorrhage"
2020-02-16,kinda_not_really,Coronavirus,8,https://www.reddit.com/r/Coronavirus/comments/f531yh/could_we_have_an_informal_nostupidquestions/fhweckc/,"I will never understand **annoyance** when someone asks a question.

Thanks for posting this."
2020-02-16,Jade_Twilek,Coronavirus,8,https://www.reddit.com/r/Coronavirus/comments/f532j8/can_we_please_stop_downplaying_the_situation/fhweuz2/,"Even if it doesn’t get bad in the west, people need to remember that China makes almost everything. They make our medicines, our plastics, our car parts, our tech parts. Even if they are only down for a couple months, the world and the US will feel the impact. It will be difficult to find cheap household goods, or you may even have a difficult time filling your prescription. I’m not saying everything will run out. I’m saying we might have to switch to more expensive sources, and prices will go up. Some people might not be able to afford this. It could be a serious problem. And, that’s if it doesn’t spread in the west. It looks like it might...."
2020-02-16,glawk-fawty,Coronavirus,8,https://www.reddit.com/r/Coronavirus/comments/f4zvxl/covid_is_the_first_infodemic/fhvm6ff/,I heard this virus makes your dick fall off...
2020-02-16,_MITH,Coronavirus,8,https://www.reddit.com/r/Coronavirus/comments/f4xzq9/been_low_key_prepping_just_ordered_an_o2/fhvpvyz/,"They’re not bullshitting, if you over oxygenate you run the risk of suppressing the breathing reflex, which is triggered by CO2 levels in the blood. Plus if you are bad enough to need supplemental O2 you are also probably looking at needing a form of ventilation."
2020-02-16,DelightfullyFilthy,Coronavirus,8,https://www.reddit.com/r/Coronavirus/comments/f4zwx1/do_you_feel_like_the_movie_titanic/fhvr21j/,"It's not happening in our towns, it's happening ""way over there"". Right now to most people it's just a scary narrative. 
When this starts affecting our daily lives in the west, it'll finally sink in. 

Pardon the pun. Omg. 😂"
2020-02-16,flawy12,Coronavirus,8,https://www.reddit.com/r/Coronavirus/comments/f5061x/wuhan_is_cutting_internet_service/fhvpg4r/,Link?
2020-02-16,M0THER-0F-EW0KS,Coronavirus,8,https://www.reddit.com/r/Coronavirus/comments/f4zsyh/coronavirus_wuhan_research_facility_could_be/fhvzqpn/,Have people not been saying this since day one?
2020-02-16,dramatic-pancake,Coronavirus,8,https://www.reddit.com/r/Coronavirus/comments/f50tmq/westerdam_arrived_in_cambodia_on_thursday_the/fhvyrlv/,Darwinism at finest unfortunately.
2020-02-16,TecmoSuperBowl1,Coronavirus,8,https://www.reddit.com/r/Coronavirus/comments/f50876/is_reddit_full_of_doomers_or_are_we_actually_all/fhvwg3q/,Wonderfully said. The comment above said 100% this is going global. I can’t with so many people in this reddit. I use to come here for information now all I’m doing is trying to stop fearmongering.
2020-02-16,TecmoSuperBowl1,Coronavirus,8,https://www.reddit.com/r/Coronavirus/comments/f519df/good_news_suspected_cases_down_from_28k_a_week/fhw2gzo/,And we are learning. People are getting educated. All good news. Keep thinking positive and pray for those effected right now.
2020-02-16,nezzman,Coronavirus,8,https://www.reddit.com/r/Coronavirus/comments/f513zm/nursing_101_caring_for_your_loved_ones_at_home/fhw3ybv/,"Going to put this in a word doc and print, thank you."
2020-02-16,Malumeze86,Coronavirus,8,https://www.reddit.com/r/Coronavirus/comments/f4w6sk/coronavirus_disease_2019_covid19_situation_report/fhua5qe/,"“WHO does not recommend any specific health measures for travellers.”

Hmmm"
2020-02-16,sleeper_must_awaken,Coronavirus,8,https://www.reddit.com/r/Coronavirus/comments/f4u6l6/changing_names_is_changing_reality/fhtn3xi/,"The Ministry Of Truth agrees with you. Double-plus good!

“Power is in tearing human minds to pieces and putting them together again in new shapes of your own choosing.” - 1984"
2020-02-16,DoctorScrotus,Coronavirus,8,https://www.reddit.com/r/Coronavirus/comments/f4z6jx/chinese_doctors_say_wuhan_coronavirus_reinfection/fhvb6ja/,"Notably, one of the ways coronaviruses cripple the immune system is via an HIV-like attachment to white blood cells, which triggers a 'cytokine storm' - a term popularized during the avian H5N1 influenza outbreak - in which an uncontrolled release of inflammatory 'cytokines' target various organs, often leading to failure and in many cases death.

The cytokine storm is best exemplified by severe lung infections, in which local inflammation spills over into the systemic circulation, producing systemic sepsis, as defined by persistent hypotension, hyper- or hypothermia, leukocytosis or leukopenia, and often thrombocytopenia.

In addition to lung infections, the cytokine storm is a consequence of severe infections in the gastrointestinal tract, urinary tract, central nervous system, skin, joint spaces, and other sites. (Tisoncik, et. al, Into the Eye of the Cytokine Storm)(2012)

According to the 2012 study, ""Cytokine storms are associated with a wide variety of infectious and noninfectious diseases and have even been the unfortunate consequence of attempts at therapeutic intervention."""
2020-02-16,Iwannadrinkthebleach,Coronavirus,8,https://www.reddit.com/r/Coronavirus/comments/f50vez/dont_be_the_first_one_to_get_caught_by_the/fhw69uf/,"Mostly this. The world is thriving consumer wise off the blood of the Chinese citizen. 

Not judging and they also need to work but ya know. We are"
2020-02-16,myarmhurtsrightnow,Coronavirus,8,https://www.reddit.com/r/Coronavirus/comments/f513zm/nursing_101_caring_for_your_loved_ones_at_home/fhw7fsy/,"I appreciate this. I actually just ordered pulse oximeters (child & adult), stethoscope, and blood pressure cuffs today. My husband is a firefighter/ emt- but I thought it wise to be prepared with items that would be helpful to us and hopefully avoid a possible trip to a hospital in the case of infection. I’ve already purchased masks/ disposable gloves, goggles, disinfectant, and food stores. Still need a few more items to feel totally prepared, but getting there."
2020-02-16,WunWegWunDarWun_,Coronavirus,8,https://www.reddit.com/r/Coronavirus/comments/f4y57t/i_work_in_a_major_academic_hospital_in_the_us/fhw7569/,"They started this testing way too late. They should have started two weeks ago.

Edit: by the time people start presenting with these symptoms it’s already too late"
2020-02-16,wadenelsonredditor,Coronavirus,8,https://www.reddit.com/r/Coronavirus/comments/f516ec/355_on_cruise_infected_by_1_person_yet_we_are/fhw8zc6/,"They're not looking for it.  There's nothing they can do when they find it. And the tests don't seem to be overly reliable --- the MD/opthamologist  in Wuhan tested negative 4 times, positive the 5th, then died.

It's long past the golden hour when  it might have been stopped by travel bans and quarantines.

This is a pandemic and virtually all of us are eventually going to be exposed to the virus.  82% will have mild or no symptoms, 18% get sick, 3-5 of those 18 die.

All the excellent testing in Singapore and Japan does is give us ideas of how fast it will happen, how transmissable, whether asymptomatic people are infectious, incubation times, etc.

China's trying desperately just to slow it down with quarantines, yet it keeps spreading.

Canada isn't even bothering to test people.

Sorry!"
2020-02-16,ASRandASR,Coronavirus,8,https://www.reddit.com/r/Coronavirus/comments/f4yrvo/there_are_currently_71223_confirmed_cases/fhv9ghp/,"Death rate today was 5.17%, not good to know"
