date,author,subreddit,score,url,text
2020-03-11,soignestrumpet,Coronavirus,67,https://www.reddit.com/r/Coronavirus/comments/fh7uuj/trump_addresses_the_nation_on_coronavirus_from/fk9fvcg/,Is he sick?  He sounds sick....
2020-03-11,Kalman88,Coronavirus,67,https://www.reddit.com/r/Coronavirus/comments/fh8pod/a_person_who_has_taken_a_picture_with_trump_3/fk9m40m/,He looked sick tonight.
2020-03-11,coljung,Coronavirus,67,https://www.reddit.com/r/Coronavirus/comments/fh474y/italy_just_announced_new_form_of_lockdown_all/fk93t68/,"The best a-brain!

Who in their right mind says that honestly!"
2020-03-11,GreenStrong,Coronavirus,67,https://www.reddit.com/r/Coronavirus/comments/fgzw8w/who_classifies_covid19_as_a_pandemic_finally/fk840d7/,"I wish you the best, friend.  You need to self- isolate, but please don't internalize any sense of guilt or contamination.  Get well."
2020-03-11,islaylover,Coronavirus,67,https://www.reddit.com/r/Coronavirus/comments/fh8pod/a_person_who_has_taken_a_picture_with_trump_3/fk9ouum/,Noticed that. Thought weird they said he's not getting tested and now CDC briefings are classified.
2020-03-11,my_name_is_______,Coronavirus,67,https://www.reddit.com/r/Coronavirus/comments/fh4s91/the_cdc_deputy_directors_response_to_the_lack_of/fk93iyt/,Love seeing the tough questions being asked pointedly. It's about time we see some people trying to hold others accountable.
2020-03-11,AinDiab,Coronavirus,66,https://www.reddit.com/r/Coronavirus/comments/fhaalh/kim_jongun_flees_pyongyang_over_coronavirus/fk9w9l8/,"According to Wiki: ""The Chosun Ilbo is a major ultra-conservative newspaper in South Korea.""

So keep that in mind."
2020-03-11,PM_ME_UR_LOONS_PICS,Coronavirus,66,https://www.reddit.com/r/Coronavirus/comments/fh870p/actor_tom_hanks_says_he_and_his_wife_have_tested/fk9juul/,Some know about it but it won’t be *real* to them until someone they heard of or know gets it or even dies.
2020-03-11,RollyPollyGiraffe,Coronavirus,66,https://www.reddit.com/r/Coronavirus/comments/fh62e5/nba_star_rudy_gobert_out_of_game_tonight_with/fk92wow/,What an asshole.
2020-03-11,Adorable-Barracuda,Coronavirus,66,https://www.reddit.com/r/Coronavirus/comments/fh85cs/megathread_president_trump_announces_30day_travel/fk9lii7/,The fact that this doesn't include the UK doesn't make any sense whatsoever.
2020-03-11,NothingWhenILived,Coronavirus,66,https://www.reddit.com/r/Coronavirus/comments/fgyr72/dr_helen_chu_who_violated_cdc_gag_order_should_be/fk8h8ul/,"She had samples from people for an unrelated flu study and decided to test them for COVID-19 without explicit permission. Normally you're not supposed to do this since if you collect medical samples you have to use them for their intended purpose and their intended purpose only, with exceptions made in special circumstances. her superiors did not grant her an exception but she did it anyway."
2020-03-11,anim0sitee,Coronavirus,65,https://www.reddit.com/r/Coronavirus/comments/fh5jfp/the_media_should_view_this_as_a_time_of_unity_and/fk8yexm/,And if he did then it is safe to say he knows that we are seriously screwed.
2020-03-11,NerveConductionPuppy,Coronavirus,65,https://www.reddit.com/r/Coronavirus/comments/fh85cs/megathread_president_trump_announces_30day_travel/fk9hij4/,NO! NO NO NO.
2020-03-11,jsut_,Coronavirus,65,https://www.reddit.com/r/Coronavirus/comments/fh81z2/us_ban_on_travel_from_europe_takes_effect_on/fk9g4yj/,That will totally address all the Existing domestic cases /s
2020-03-11,bitchy_witch_poo,Coronavirus,65,https://www.reddit.com/r/Coronavirus/comments/fh0edn/world_health_organization_says_its_seeing/fk7ys07/,\*cough\* United States
2020-03-11,----0000000-------,Coronavirus,65,https://www.reddit.com/r/Coronavirus/comments/fh474y/italy_just_announced_new_form_of_lockdown_all/fk8uwt5/,We sell pizzas and dildos in Rome. What should we do?
2020-03-11,Boh-dar,Coronavirus,65,https://www.reddit.com/r/Coronavirus/comments/fh2qed/i_am_fully_prepared_to_use_the_full_power_of_the/fk8fazj/,Because you have a functioning brain
2020-03-11,BlazenRyzen,Coronavirus,65,https://www.reddit.com/r/Coronavirus/comments/fh3nfo/nyc_st_patricks_day_parade_reportedly_canceled/fk8lpl5/, Can they just have it online?
2020-03-11,Mar210,Coronavirus,65,https://www.reddit.com/r/Coronavirus/comments/fgzw8w/who_classifies_covid19_as_a_pandemic_finally/fk7wzms/,"""alarming levels of inaction""  *cough* USA *cough*"
2020-03-11,LongDongSilver50,Coronavirus,65,https://www.reddit.com/r/Coronavirus/comments/fh9mq3/us_expert_new_coronavirus_deadlier_than_flu/fk9shj3/,"You mean the Chinese government was locking people in cages and driving them away from their homes and chemical washing the streets over something that was more than a common flu? 

*Insert wee bey gif*"
2020-03-11,c-dollasign,Coronavirus,65,https://www.reddit.com/r/Coronavirus/comments/fh9q06/why_you_must_act_now/fk9smy4/,"Narrator: they did not, in fact, choose to act now"
2020-03-11,Temstar,Coronavirus,65,https://www.reddit.com/r/Coronavirus/comments/fh9pac/china_is_now_sending_doctors_masks_and_hazmat/fk9ud8u/,"It's something like 1,000 ventilators on that plane, plus masks, biosuits, PCR test kits etc.

1,000 ventilators will mean a lot of lives saved in the next few weeks."
2020-03-11,brain-gardener,Coronavirus,65,https://www.reddit.com/r/Coronavirus/comments/fh7uuj/trump_addresses_the_nation_on_coronavirus_from/fk9fdds/,Did he just hold back a cough or am I stoned?
2020-03-11,ayojerm,Coronavirus,64,https://www.reddit.com/r/Coronavirus/comments/fh512h/pandemic_could_cost_1_trillion_dollars/fk8uu7m/,To who? It's a global pandemic? Who the hell does the entire globe owe money to?
2020-03-11,kartunmusic,Coronavirus,64,https://www.reddit.com/r/Coronavirus/comments/fh561u/neil_degrasse_tyson_this_is_an_experiment_on/fk8xhdz/,Joe Rogan gets a expert on infectious disease while the mainstream media gets a cosmologist. Smh
2020-03-11,Spocks_Goatee,Coronavirus,64,https://www.reddit.com/r/Coronavirus/comments/fh870p/actor_tom_hanks_says_he_and_his_wife_have_tested/fk9izvw/,Fuck this year.
2020-03-11,StretchMontague,Coronavirus,64,https://www.reddit.com/r/Coronavirus/comments/fgzw8w/who_classifies_covid19_as_a_pandemic_finally/fk7zcbc/,Oh honey...
2020-03-11,CipherInTheKnow,Coronavirus,64,https://www.reddit.com/r/Coronavirus/comments/fh468t/trump_says_he_will_address_the_nation_from_the/fk8q2xf/,"""Ok, ok, Hilary actually won the popular vote. She's the president. Ask her about the Clinton Coronavirus."""
2020-03-11,krantzphoto,Coronavirus,64,https://www.reddit.com/r/Coronavirus/comments/fh933w/coronavirus_spreads_to_oregons_first_assisted/fk9nny1/,These are the stories I hate the most...
2020-03-11,frenchlesbian,Coronavirus,64,https://www.reddit.com/r/Coronavirus/comments/fh85cs/megathread_president_trump_announces_30day_travel/fk9k28n/,I’ve heard this multiple times now. Does customs not give a fuck?
2020-03-11,LeonDaChameL3on,Coronavirus,64,https://www.reddit.com/r/Coronavirus/comments/fh7uuj/trump_addresses_the_nation_on_coronavirus_from/fk9fpew/,EU travel ban doesn't affect the UK. UK with the 200IQ big bain move to leave the EU
2020-03-11,armsugar,Coronavirus,64,https://www.reddit.com/r/Coronavirus/comments/fh8ajo/thunder_and_jazz_nba_teams_and_locker_rooms_are/fk9hvtm/,"So who caught it?

Edit: It was Rudy Gobert."
2020-03-11,NihilistLivesMatter,Coronavirus,64,https://www.reddit.com/r/Coronavirus/comments/fh16mr/the_us_president_is_considering_declaring_a/fk849ps/,"Should've happened a long time ago. Until they start putting money towards distributing testing kits, nothing else matters"
2020-03-11,shinyshirtlesssulu,Coronavirus,64,https://www.reddit.com/r/Coronavirus/comments/fh85cs/megathread_president_trump_announces_30day_travel/fk9jx0n/,And with that...time for another Gin....
2020-03-11,Lady_Elle,Coronavirus,64,https://www.reddit.com/r/Coronavirus/comments/fh870p/actor_tom_hanks_says_he_and_his_wife_have_tested/fk9h8ra/,My god what is happening? I feel like this isn't real.
2020-03-11,dudewhatculttop,Coronavirus,64,https://www.reddit.com/r/Coronavirus/comments/fh8irw/what_will_you_do_if_you_start_coughing/fk9jqnn/,I already cough all the time from allergies so I am not sure how to know if it's just that or the virus...
2020-03-11,AnotherTooth,Coronavirus,63,https://www.reddit.com/r/Coronavirus/comments/fh5ee0/broadway_usher_positive_for_coronavirus/fk8xb9o/,Just freaking close everything ffs
2020-03-11,ErinInTheMorning,Coronavirus,63,https://www.reddit.com/r/Coronavirus/comments/fh85cs/megathread_president_trump_announces_30day_travel/fk9iwm4/,"I’m sick as a dog right now. All covid symptoms. Can’t get tested, no contact with a known case, no travel internationally, and no severe symptoms requiring hospitalization. I feel like crap and am in an area where at least one community spread case popped up. Flu and strep came back negative.

We are simply too late. I don’t know what the world looks like on the other side of this but it’s going to be very, very different. We’ll be telling stories of these days in our 80s. Hopefully our children won’t be as complacent listening to us as we were listening to our elders passed about Spanish flu."
2020-03-11,flashtone,Coronavirus,63,https://www.reddit.com/r/Coronavirus/comments/fh4dv1/italy_196_new_coronavirus_deaths_today_the/fk8qbtd/,"when there are pictures surfacing of older folks at coffee shops in the area not caring, thats the real problem."
2020-03-11,WeeboSupremo,Coronavirus,63,https://www.reddit.com/r/Coronavirus/comments/fh4bc5/president_says_he_has_made_some_decisions_and/fk8qgcc/,"They told me ""Mr. President, sir, the tests are so beautiful, so great these tests. Very positive results."" And I said ""Make them more positive."""
2020-03-11,superfluous-buns,Coronavirus,63,https://www.reddit.com/r/Coronavirus/comments/fh870p/actor_tom_hanks_says_he_and_his_wife_have_tested/fk9na34/,2020 is not taking Betty White!
2020-03-11,mgarksa,Coronavirus,63,https://www.reddit.com/r/Coronavirus/comments/fh8959/turn_out_it_is_an_aibourne_virus/fk9iamn/,No use in washing hands. We need to stop breathing.
2020-03-11,sardood,Coronavirus,63,https://www.reddit.com/r/Coronavirus/comments/fh8c2f/utah_jazz_allstar_rudy_gobert_has_tested_positive/fk9pmr9/,"Ok before opening the video I thought you were being harsh, I thought he would've touched the mic to adjust it. Little did I know he purposely touched the whole desk and all the mics.

Truly a POS."
2020-03-11,AaronRose77,Coronavirus,63,https://www.reddit.com/r/Coronavirus/comments/fh8dtm/tom_hanks_tests_positive_to_coronavirus_placed_in/fk9inlv/,2020 can eat a dick
2020-03-11,c-dollasign,Coronavirus,63,https://www.reddit.com/r/Coronavirus/comments/fh9bru/twoyearold_in_potsdam_near_berlin_germany_in_icu/fk9ph4a/,"I don’t mean this to sound trite, because this is a huge concern of mine, but there will always be outliers.  Hopefully this kiddo makes a swift recovery!"
2020-03-11,Retinyl,Coronavirus,63,https://www.reddit.com/r/Coronavirus/comments/fh9koj/we_are_10_days_away_from_the_hospitals_getting/fk9shx5/,"Stay home when possible. Avoid crowds. Wash your hands often. Don't panic, but take it seriously. It will help slow it down and create less of a burden on the health care system."
2020-03-11,2hi4me2cu,Coronavirus,63,https://www.reddit.com/r/Coronavirus/comments/fh870p/actor_tom_hanks_says_he_and_his_wife_have_tested/fk9h9dy/,"And here we have it. In the world where likes are worth more than life, people take note when celebs get sick."
2020-03-11,trebleformyclef,Coronavirus,63,https://www.reddit.com/r/Coronavirus/comments/fh85cs/megathread_president_trump_announces_30day_travel/fk9ost6/,"All US Citizens/ Permanent Residents can return to US. The travel ban is for foreign nationals.

DHS Statement: https://www.dhs.gov/news/2020/03/11/homeland-security-acting-secretary-chad-f-wolf-s-statement-presidential-proclamation"
2020-03-11,jagauthier,Coronavirus,63,https://www.reddit.com/r/Coronavirus/comments/fh8pod/a_person_who_has_taken_a_picture_with_trump_3/fk9mo5e/,"No. But he doesnt always read direct from a teleprompter. Today he was 100% following script. I think the pauses was him catching up, reading ahead, etc. I noticed them too."
2020-03-11,FusRoDahMa,Coronavirus,62,https://www.reddit.com/r/Coronavirus/comments/fh561u/neil_degrasse_tyson_this_is_an_experiment_on/fk8xemh/,"People in NC in my social circle still call me ""overreacting and silly."" 🤷"
2020-03-11,Gffcom,Coronavirus,62,https://www.reddit.com/r/Coronavirus/comments/fh8pod/a_person_who_has_taken_a_picture_with_trump_3/fk9mb5f/,If trump gets it I hope he’s quickly treated with absolute best thoughts and prayers congress can offer. Godspeed my friend!
2020-03-11,ATL4Life95,Coronavirus,62,https://www.reddit.com/r/Coronavirus/comments/fh870p/actor_tom_hanks_says_he_and_his_wife_have_tested/fk9l4g0/,Trying to think of the amount of people that have been near him at a game.
2020-03-11,xlvi_et_ii,Coronavirus,62,https://www.reddit.com/r/Coronavirus/comments/fh474y/italy_just_announced_new_form_of_lockdown_all/fk8spy4/,"So people are still going to work but you can't buy anything beyond the essentials (food, medicine etc)?"
2020-03-11,Powershadow24,Coronavirus,62,https://www.reddit.com/r/Coronavirus/comments/fh001l/coronavirus_confirmed_as_pandemic/fk7w4tp/,Literally everyone was calling it a Pandemic before WHO...
2020-03-11,MetoprololAddict,Coronavirus,62,https://www.reddit.com/r/Coronavirus/comments/fh7qft/utah_jazz_game_officially_postponed_stadium_being/fk9dr6z/,Holy fuck this is crazy
2020-03-11,NabiscoLobstrosity,Coronavirus,62,https://www.reddit.com/r/Coronavirus/comments/fh7uuj/trump_addresses_the_nation_on_coronavirus_from/fk9g7nh/,"He always sounds off when reading from a teleprompter. But he does sound sick. And he is squinting with his right eye, it's weird and I don't think that's normal for him.

6:10 Pacific time; his voice is faltering. He's sick."
2020-03-11,franny5662,Coronavirus,62,https://www.reddit.com/r/Coronavirus/comments/fha0oq/dow_futures_plunge_almost_1000_points_as_prime/fk9uplm/,"Every trader I spoke to (believe or not) wanted solid testing.  They got nothing.  Thus, a plunge.  This isn’t something supply side Econ can fix, it’s a demand issue."
2020-03-11,ATL4Life95,Coronavirus,62,https://www.reddit.com/r/Coronavirus/comments/fh870p/actor_tom_hanks_says_he_and_his_wife_have_tested/fk9lg53/,Seriously?
2020-03-11,MNL2017,Coronavirus,62,https://www.reddit.com/r/Coronavirus/comments/fh5jfp/the_media_should_view_this_as_a_time_of_unity_and/fk8yq47/,Maybe his advisers finally got to him. “Donald if you let millions of Americans die over this you’re fucked.”
2020-03-11,Seddit12,Coronavirus,62,https://www.reddit.com/r/Coronavirus/comments/fh870p/actor_tom_hanks_says_he_and_his_wife_have_tested/fk9vkor/,Have you tried turning it off and on again.
2020-03-11,xRastaPastax,Coronavirus,62,https://www.reddit.com/r/Coronavirus/comments/fh227n/congressional_doctor_predicts_70150_million_us/fk8ag7y/,I'm building a pillow fort fuck this.
2020-03-11,zp42,Coronavirus,62,https://www.reddit.com/r/Coronavirus/comments/fh85cs/megathread_president_trump_announces_30day_travel/fk9hn48/,Punish Europe and reward Brexiteers
2020-03-11,Apptubrutae,Coronavirus,62,https://www.reddit.com/r/Coronavirus/comments/fh8ee6/the_nba_has_suspended_its_season/fk9k4fh/,"The upside of exponential growth is boy does the news come fast.  Every few minutes its a new story that would be legitimately big news for a month on its own.  Over and over and over again.  While at the same time we're all worried for our future, worried for those we know and love."
2020-03-11,scott225225,Coronavirus,62,https://www.reddit.com/r/Coronavirus/comments/fh870p/actor_tom_hanks_says_he_and_his_wife_have_tested/fk9krqy/,This incident will be reported
2020-03-11,ShmidtRubin1911,Coronavirus,61,https://www.reddit.com/r/Coronavirus/comments/fh9pac/china_is_now_sending_doctors_masks_and_hazmat/fk9sade/,Cause we’re fucked and China is recovering
2020-03-11,cooksclub22,Coronavirus,61,https://www.reddit.com/r/Coronavirus/comments/fh468t/trump_says_he_will_address_the_nation_from_the/fk8p7rf/,I feel like this is going to be the moment the American people wake up from the corporate advertisement they all love
2020-03-11,acos12,Coronavirus,61,https://www.reddit.com/r/Coronavirus/comments/fh1bvy/the_netherlands_crisisexperts_are_saying_that_the/fk85bh8/,The Netherlands is becoming the laughing stock of Europe.
2020-03-11,helpnxt,Coronavirus,61,https://www.reddit.com/r/Coronavirus/comments/fh48or/young_and_unafraid_of_the_coronavirus_good_for/fk9bjy5/,"here's the article

 [https://medium.com/@cdmj/a-colorado-covid-19-story-61466a56811](https://medium.com/@cdmj/a-colorado-covid-19-story-61466a56811)"
2020-03-11,herbmillerjr,Coronavirus,61,https://www.reddit.com/r/Coronavirus/comments/fh870p/actor_tom_hanks_says_he_and_his_wife_have_tested/fk9m92o/,r/Moronavirus
2020-03-11,ilikelegoandcrackers,Coronavirus,61,https://www.reddit.com/r/Coronavirus/comments/fh97fm/jetblue_ceo_says_coronavirus_impact_on_flight/fk9oq6c/,"The industry will almost certainly beg for a bailout. Many airlines will not make it out of this one without one. But then, all business will be in the same boat too. With a geometric expansion of the virus, I'm estimating 10-14 days until all of North America is shut down."
2020-03-11,Defacto_Champ,Coronavirus,61,https://www.reddit.com/r/Coronavirus/comments/fha9dp/viking_cruises_cancels_all_voyages_through_may_1/fk9vss4/,Ahh what a smart company
2020-03-11,robotical712,Coronavirus,61,https://www.reddit.com/r/Coronavirus/comments/fh34dh/the_us_president_will_deliver_a_statement_about/fk8hwc0/,"""My fellow Americans, the threat to the stock market and my reelection is real!"""
2020-03-11,JuxtaposeThis,Coronavirus,61,https://www.reddit.com/r/Coronavirus/comments/fh1943/new_york_governor_andrew_cuomo_makes_an/fk84vtm/,"“We’re not in a position where we can rely on the CDC or FDA.”

Truth."
2020-03-11,wiee2,Coronavirus,61,https://www.reddit.com/r/Coronavirus/comments/fh3zgo/us_says_it_will_try_to_be_useful_in_helping_iran/fk8ni3c/,It’s good to help but how about the USA take control of what’s going on here than help other countries?
2020-03-11,tarafitzwriter,Coronavirus,61,https://www.reddit.com/r/Coronavirus/comments/fha16r/cuba_claims_the_have_a_cure_for_coronavirus/fk9uru9/,"Cuba has a lung cancer vaccine. Their research programs are no joke. 

https://abcnews.go.com/Health/cubas-major-medical-achievements/story?id=43844344"
2020-03-11,mythrowawaybabies,Coronavirus,61,https://www.reddit.com/r/Coronavirus/comments/fh870p/actor_tom_hanks_says_he_and_his_wife_have_tested/fk9h595/,"*WILSONNN*

Edit: For real though, I really hope they’re ok and they’re able to have speedy recoveries"
2020-03-11,pamtar,Coronavirus,61,https://www.reddit.com/r/Coronavirus/comments/fh8c2f/utah_jazz_allstar_rudy_gobert_has_tested_positive/fk9i4am/,"Sorry, but he should be arrested for touching those mics."
2020-03-11,Moo3,Coronavirus,61,https://www.reddit.com/r/Coronavirus/comments/fh8ee6/the_nba_has_suspended_its_season/fk9q6dg/,OK... I'm Chinese and I laughed... Good one.
2020-03-11,IndraSun,Coronavirus,61,https://www.reddit.com/r/Coronavirus/comments/fh6ip0/man_with_coronavirus_from_rome_georgia_i_have_had/fk96nid/,They didn't even test his wife.
2020-03-11,Prowlerbaseball,Coronavirus,60,https://www.reddit.com/r/Coronavirus/comments/fh1wmc/senate_gop_blocks_emergency_paid_sick_leave_bill/fk89gx5/,"Ngl, I kinda agree with the GOP dude.  Forcing employers to foot the bill when they're getting hit just as bad as the employees is a bad idea."
2020-03-11,Hard_at_it,Coronavirus,60,https://www.reddit.com/r/Coronavirus/comments/fh2xbp/the_italian_college_of_anesthesia_analgesia/fk8gmjn/,This is going to rewrite every ethical and triage textbook going forward.
2020-03-11,mcclapyourhands,Coronavirus,60,https://www.reddit.com/r/Coronavirus/comments/fh1lcx/robert_redfield_cdc_director_said_there_are_no/fk86yt3/,Stupid.
2020-03-11,helpfuldan,Coronavirus,60,https://www.reddit.com/r/Coronavirus/comments/fh7v0k/first_china_then_italy_what_the_us_can_learn_from/fk9enjv/,What can they learn. LA has 10 million people. They’ve tested 45 so far. Lol. It’s too late for learning. That was months ago.
2020-03-11,Sharkjumpkinsky,Coronavirus,60,https://www.reddit.com/r/Coronavirus/comments/fh870p/actor_tom_hanks_says_he_and_his_wife_have_tested/fk9h6o1/,"Run Forrest, Run"
2020-03-11,DrHelios,Coronavirus,60,https://www.reddit.com/r/Coronavirus/comments/fh85cs/megathread_president_trump_announces_30day_travel/fk9gydb/,There is almost 1 million tourists from Europe in the US at the moment. If they dont leave by friday they will be stuck in the US for 30 days. Source : [Monthly Tourism Statistics - Overseas Arrivals to the U.S](https://travel.trade.gov/view/m-2017-I-001/index.asp)
2020-03-11,Odogonmc,Coronavirus,60,https://www.reddit.com/r/Coronavirus/comments/fh8c2f/utah_jazz_allstar_rudy_gobert_has_tested_positive/fk9i7cc/,So the entire Jazz team has coronavirus.
2020-03-11,jblackmiser,Coronavirus,60,https://www.reddit.com/r/Coronavirus/comments/fh4fil/covid19_can_stay_viable_for_more_than_3_hours_in/fk8qoni/,">Given that SARS-CoV-1 superspreading events were linked to aerosol and fomite transmission, our finding that HCoV-19 has viability in the environment comparable to that of SARS151 CoV-1 lends credence to the hypothesis that it too may be associated with superspreading.

Obviously the most famous COVID -19 super-spreading event would be the South Korea church one. The lesson I think is that we must ban large public events. Everywhere. Now."
2020-03-11,threeamighosts,Coronavirus,60,https://www.reddit.com/r/Coronavirus/comments/fh4ns2/coronavirus_symptoms_australian_couple_from/fk8s5fl/,"Mods can we please create a ""Symptoms"" or ""first hand account"" flair so there is broader information out there which might help people who are weighing up self quarantine since there is not the level of testing necessary right now."
2020-03-11,SeptembersChopin,Coronavirus,60,https://www.reddit.com/r/Coronavirus/comments/fh85cs/megathread_president_trump_announces_30day_travel/fk9iadm/,"It will be a coordinated move. He will know what the U.K. Govt will be announcing in the morning. I would imagine the U.K. will ban all flights from mainland Europe.

Otherwise excluding the U.K. just makes no sense."
2020-03-11,WaitWhatOhNevermind,Coronavirus,60,https://www.reddit.com/r/Coronavirus/comments/fh57on/trump_fears_emergency_declaration_would/fk93xj1/,"Trump declared a National Emergency to build the wall, but he’s hesitant to do it for a pandemic?

Great. Great great great"
2020-03-11,Travelingdolphins34,Coronavirus,60,https://www.reddit.com/r/Coronavirus/comments/fh85cs/megathread_president_trump_announces_30day_travel/fk9hhp3/,He rarely reads from teleprompters - he isn't good at it. He also seemed nervous. He has never really had to deal with something so serious during his presidency.
2020-03-11,mrb11n,Coronavirus,60,https://www.reddit.com/r/Coronavirus/comments/fh8dtm/tom_hanks_tests_positive_to_coronavirus_placed_in/fk9ikqt/,I hope he is alright. He’s in his 60s. Glad they’ve quarantined and said they’re feeling alright.
2020-03-11,Curio-Researcher,Coronavirus,60,https://www.reddit.com/r/Coronavirus/comments/fha4nt/inside_the_hospital_slammed_by_coronavirus_nurses/fk9w8kx/,"True heroes. My heart.... Mr. Rogers once said his Mom told him during times of crisis, look to the helpers.

Sending you all a hug! We can get through this. But we have to do it together. Differences aside. We have to take care of each other."
2020-03-11,HHNTH17,Coronavirus,60,https://www.reddit.com/r/Coronavirus/comments/fh8ee6/the_nba_has_suspended_its_season/fk9luep/,God it’s barely started and I already crave my normal boring life. Two months ago I was excited for baseball season and the Olympics and now we’re in a pandemic. Unreal.
2020-03-11,lsspam,Coronavirus,60,https://www.reddit.com/r/Coronavirus/comments/fh8ee6/the_nba_has_suspended_its_season/fk9l9sz/,"Some context

* 2 days ago the NBA, alongside the MLB, MLS, and NHL, announced they would be limiting access to locker rooms and players as a precautionary measure against Covid-19

https://twitter.com/JeffZillgitt/status/1237149481872883714?s=19

* Utah Jazz player and French national Rudy Gobert, that same day, seemingly mocked the precaution by making it a point to touch all of the microphones and other media equipment at a post-game press conference that same day

https://streamable.com/o2eju

* 2 days later (today) Rudy Gobert is listed as ""questionable"" with an illness on the official injury report

https://www.reddit.com/r/nba/comments/fh3kdl/heck_rudy_gobert_is_questionable_with_an_illness/

* Right as the Utah Jazz game against the Oklahoma City Thunder is set to play a team doctor runs out on court, confers with officials, and the game is abruptly cancelled

https://www.reddit.com/r/nba/comments/fh7m67/post_game_thread_the_utah_jazz_4123_the_oklahoma/

* We immediately find out Rudy Gobert has tested positive for Covid-19

https://twitter.com/ShamsCharania/status/1237913057596026881

And now the NBA has suspended the entire season."
2020-03-11,barsoapguy,Coronavirus,59,https://www.reddit.com/r/Coronavirus/comments/fh474y/italy_just_announced_new_form_of_lockdown_all/fk91wi7/,In two weeks probably.
2020-03-11,TTPMGP,Coronavirus,59,https://www.reddit.com/r/Coronavirus/comments/fh9g6m/jazz_star_rudy_gobert_joked_about_coronavirus_by/fk9qwpe/,He’s never going to hear the end of this. Ever.
