date,author,subreddit,score,url,text
2020-03-28,fourpuns,Coronavirus,1,https://www.reddit.com/r/Coronavirus/comments/fqkprq/couple_shaves_their_eyebrows_as_motivation_to/flqrgzl/,Should help with the condom shortage too.
2020-03-28,Shin-Kong,Coronavirus,1,https://www.reddit.com/r/Coronavirus/comments/fqkk56/daily_discussion_post_march_28_questions_images/flqrh31/,Why are China's numbers so low now? Are they actually close to stopping it in their country or is their government trying to make it seem like it's been beaten?
2020-03-28,Kalfu73,Coronavirus,1,https://www.reddit.com/r/Coronavirus/comments/fqj7lw/data_shows_amazon_raised_prices_during_pandemic/flqroiy/,I can't tell if you are celebrating this or forgot to /s
2020-03-28,Duude_Hella,Coronavirus,1,https://www.reddit.com/r/Coronavirus/comments/fqki4b/homemade_masks_can_significantly_slow_the_spread/flqrrt8/,"I actually bought a few thick cotton masks on ebay for my family. We don't go out but if we have to, they're wearing them!"
2020-03-28,supertrader11,Coronavirus,1,https://www.reddit.com/r/Coronavirus/comments/fqkezn/germany_has_a_remarkably_low_coronavirus_death/flqrrrm/,Yep
2020-03-28,iped1,Coronavirus,1,https://www.reddit.com/r/Coronavirus/comments/fq4ljo/us_first_to_confirm_100k_cases/flqrs1a/,Congrats
2020-03-28,CurrentVictory,Coronavirus,1,https://www.reddit.com/r/Coronavirus/comments/fpxagz/daily_discussion_post_march_27_questions_images/flqrwfb/,MJ never passes up a beer pong game.
2020-03-28,Efficient_Custard,Coronavirus,1,https://www.reddit.com/r/Coronavirus/comments/fqb6gk/senators_urge_overhaul_of_gay_donor_restrictions/flqrwg6/,"It was the first of many Google results. 

blood donation groups say they need more African American donors for their African American patients. This isn't my field so I may have explained it poorly but there's plenty to look at."
2020-03-28,ArniePalmys,Coronavirus,1,https://www.reddit.com/r/Coronavirus/comments/fqj7lw/data_shows_amazon_raised_prices_during_pandemic/flqs13i/,Lots of them aew Chinese sellers as you can see prices of masks etc go up earlier on when the US was clueless still.
2020-03-28,50-Foot-Taco,Coronavirus,1,https://www.reddit.com/r/Coronavirus/comments/fqknvt/germany_will_not_ease_shutdown_until_at_least/flqs3xb/,The girl hidden in the ceiling will hide a bit longer than that
2020-03-28,US-Disability,Coronavirus,1,https://www.reddit.com/r/Coronavirus/comments/fqkbrn/federal_ppe_supplies_for_oklahoma_come_in_short/flqs41h/,Do masks expire?
2020-03-28,BreatheThroughCheeze,Coronavirus,1,https://www.reddit.com/r/Coronavirus/comments/fqkk56/daily_discussion_post_march_28_questions_images/flqs8gw/,"In rural Georgia, I would say about 20% of shoppers are wearing masks and gloves. Most smaller businesses are closed or closing. Larger stores are putting customer limits on most items but especially bottled water and other emergency type items.


Last time I checked we had around 200 cases that are unassigned, meaning their county is not yet named. Due to this, I think most people are assuming it’s already in our county despite not being listed as a county with active cases.


Fast food drive thru lines are full pretty much everywhere which is a bit confusing to me. It doesn’t make much sense to me why people would increase their eating out during a pandemic but I understand a lot of people in this country don’t have a lot of food options at home.


My wife also was showing some symptoms, so she called her doctor and was transferred to a coronavirus screening hotline. The hotline said the doctor would call her back with the results of the screening and recommend options from there. The doctor never called my wife back. So she called him about 5 hours later and he said he didn’t have the results from the screening yet. That was yesterday.


Additionally, I’m scared. Everyone please stay safe out there."
2020-03-28,McLuhanSaidItFirst,Coronavirus,1,https://www.reddit.com/r/Coronavirus/comments/fq5xm7/mystery_in_wuhan_previously_recovered_patients/flqs8oh/,the public/private partnership is ramping up. we are going to be swimming in tests as soon as they can make it happen.
2020-03-28,Sutekh338,Coronavirus,1,https://www.reddit.com/r/Coronavirus/comments/fqku0s/260_new_deaths_in_uk_taking_total_to_1019/flqs8ot/,Acted too late.
2020-03-28,02K30C1,Coronavirus,1,https://www.reddit.com/r/Coronavirus/comments/fqje0d/coronavirus_what_if_this_had_happened_in_2005/flqsc1t/,"And when Netflix first offered a streaming service, people said “that will never last!”"
2020-03-28,TipsyBartenderVRFD,Coronavirus,1,https://www.reddit.com/r/Coronavirus/comments/fqhy3p/fox_business_parts_ways_with_trish_regan_host_who/flqsc46/,Do you really think joe actually wrote that? He’s falling fast into dementia and can barely function to breathe and stand unassisted
2020-03-28,MauriceReeves,Coronavirus,1,https://www.reddit.com/r/Coronavirus/comments/fqdhau/i_have_never_seen_anything_like_this_says_new/flqsciv/,"Are you me? I have a table out in the garage with a UV light over it and a box to hold the mail under the light. Every day I sort the mail that's come in, throw away most of, lay out the rest to get a good tan.  Any boxes are opened right away and the contents get a tan. After a few days, the mail and contents get a wipe and can come in."
2020-03-28,WormLivesMatter,Coronavirus,1,https://www.reddit.com/r/Coronavirus/comments/fqj8s7/new_york_may_be_weeks_away_from_reaching_a_peak/flqscbk/,I’ve been inside since March 6th with a 4 year old. Can confirm it’s hard. We have a backyard though.
2020-03-28,Own_Nature,Coronavirus,1,https://www.reddit.com/r/Coronavirus/comments/fqka8u/we_now_know_who_societys_essential_workers_are/flqsc7q/,"I work in a factory with packing machines. I promise you the cantankerous beasts wouldn't work thirty minutes unsupervised. Humans are still needed in automation -- just not as many. (For now, at least.)"
2020-03-28,TheRealBronzebeard,Coronavirus,1,https://www.reddit.com/r/Coronavirus/comments/fqj8s7/new_york_may_be_weeks_away_from_reaching_a_peak/flqsh1s/,"Better hurry it up, guys. Apparently we're all going back to work by Easter Sunday."
2020-03-28,donkeyrider88,Coronavirus,1,https://www.reddit.com/r/Coronavirus/comments/fq9zyt/russia_sees_no_epidemic_but_starts_shutdown/flqsgke/,"Stockpiling medical supplies, borders closed in a logical way, and staging resources.  Those actions prevent the need for quarantine.  The quarantined in the US are very reactive instituted by local government because our federal gov didn’t do those things."
2020-03-28,Odostolon,Coronavirus,1,https://www.reddit.com/r/Coronavirus/comments/fqk4e8/scotland_may_release_prisoners_close_to_end_of/flqsks6/,"I don’t know about Scotland but European prison systems vastly differ from the US. German prisons, for example, focus heavily on re-integrating criminals back into society. One of the most recently built prisons had inmates cooking for themselves unsupervised. You can take up a job in prison or learn a trade and use the money you earn during prison leave on weekends. It’s also not impossible to get a job after prison. Some jobs require you to not have been convicted in the past but you have a good chance with those that don’t require it. All of this plays a role in the low rate of repeated offenders. 

If Scotland is anything like Germany, the prisoners will likely be able to rebuild their lives."
2020-03-28,dc7singko,Coronavirus,1,https://www.reddit.com/r/Coronavirus/comments/fqj9f7/philippines_locsin_blasts_doh_for_blocking_entry/flqskqb/,Quality of healthcare but worse than that corruption and politicking of the government officials.
2020-03-28,ark092,Coronavirus,1,https://www.reddit.com/r/Coronavirus/comments/fq8u1s/a_102yearold_italian_woman_recovers_from/flqspmb/,"US had some 2500 recoveries and some 1700 deaths. That's well above 17 percent, because again early stages. Most mild cases are likely to recover and a lot of people aren't even in the system; they get sick but don't go to the hospital or get tested and recover at home. We don't know exactly what the death rate will be, snd won't know for sure until it is all over, but 17 percent will almost certainly be higher than the actual death rate."
2020-03-28,justhrowmeawaydamnit,Coronavirus,1,https://www.reddit.com/r/Coronavirus/comments/fqk9x1/what_happens_when_extreme_heat_collides_with_a/flqspr5/,Ok thanks for letting me know this then 🙏
2020-03-28,Vid-Master,Coronavirus,1,https://www.reddit.com/r/Coronavirus/comments/fqj7lw/data_shows_amazon_raised_prices_during_pandemic/flqspkz/,"Yes but heres the thing, if the street price (real value) of a thermometer is $300, then the price is $300.

There obviously is a shortage of all things related to coronavirus.

If Amazon forces sellers to keep prices the same, people will just buy out the supply and then resell it somewhere else that allows you to list at correct real world prices."
2020-03-28,onlyyolum,Coronavirus,1,https://www.reddit.com/r/Coronavirus/comments/fqdsie/cant_stop_car_factory_due_to_traffic_deaths/flqstzq/,"Brazil, I love you, but it's going to be as bad as Italy (or the US for that matter) very soon. Stay safe."
2020-03-28,CoronavirusSources,Coronavirus,1,https://www.reddit.com/r/Coronavirus/comments/fql1x7/ai_can_help_find_scientists_find_a_covid19_vaccine/flqstor/,"Your submission has been removed because

* **You should contribute only high quality information.** There are many places online to discuss conspiracies and speculate, we ask you not to do so here. Please provide an English translation for all non-English submissions in a comment on your submission. ([More Information](https://www.reddit.com/r/Coronavirus/wiki/rules#wiki_rule_5.3A_keep_information_quality_high))

*If you believe we made a mistake, please [message the moderators](/message/compose?to=/r/Coronavirus).*"
2020-03-28,sporks5000,Coronavirus,1,https://www.reddit.com/r/Coronavirus/comments/fq8u1s/a_102yearold_italian_woman_recovers_from/flqt21d/,"The headline should have read ""Immortal Goddess Laughs in the Face of Death"""
2020-03-28,drew0594,Coronavirus,1,https://www.reddit.com/r/Coronavirus/comments/fqkuxb/uk_reports_2510_new_cases_of_coronavirus_and_260/flqt60s/,"People are dying so I Hate that I find this ""funny"", but..."
2020-03-28,TorchIt,Coronavirus,1,https://www.reddit.com/r/Coronavirus/comments/fqaxzb/federal_officials_repeatedly_warned_that_us/flqt61b/,"Anybody that would call an associate's degree grueling is wildly out of touch.  

RTs are amazing, indispensable members of our healthcare teams.  We'd be lost without our RTs inside an hour.  They're wizards in my opinion, and the level of ingenuity they've displayed in the face of this crisis is really something to write home about.

I did two semesters of RT school before I decided I wanted to go the nursing route instead, and I'd say that the difficulty of the education is about on par with each other."
2020-03-28,ILikeSchecters,Coronavirus,1,https://www.reddit.com/r/Coronavirus/comments/fqagv0/college_students_aged_1824_who_have_been_claimed/flqt5vy/,Exactly. $1200 wasted on each 1% is nil in the scheme of government spending. Just give everyone the fucking check
2020-03-28,js5ohlx1,Coronavirus,1,https://www.reddit.com/r/Coronavirus/comments/fqj7lw/data_shows_amazon_raised_prices_during_pandemic/flqt638/,I'm about done with Amazon.
2020-03-28,achilleshy,Coronavirus,1,https://www.reddit.com/r/Coronavirus/comments/fql2ls/in_flying_intensive_care_unit_bundeswehr_brings/flqt5ob/,That’s awesome
2020-03-28,redmongrel,Coronavirus,1,https://www.reddit.com/r/Coronavirus/comments/fqb49e/fda_approve_test_that_can_generate_a_positive/flqtazv/,"You don’t cure viruses, you just keep the body supported long enough to fight it out. Or beat the viruses to their meal with vaccination."
2020-03-28,nomadicsailorscout,Coronavirus,1,https://www.reddit.com/r/Coronavirus/comments/fqk31g/dc_hospital_nurse_resigns_over_lack_of_ppe/flqtbb9/,"Coronavirus isn't the only communicable disease to worry about either. Hospital aquired infections are a danger when there isn't a pandemic. This measure isn't for protecting patients, it's for protecting staff. But if we don't protect the staff, we won't be able to care for the infected. It's a shitty situation"
2020-03-28,frasermunde,Coronavirus,1,https://www.reddit.com/r/Coronavirus/comments/fqagv0/college_students_aged_1824_who_have_been_claimed/flqtbbv/,"My situation exactly. I’m 33 and I still get pissed when I think about the fact that my mom claimed me when I was in college, despite the fact that I paid EVERY DIME of my tuition myself, bought my own car, and paid for all my own shit. I missed out on the 2008 stimulus because of this."
2020-03-28,Jankensolvesall5512,Coronavirus,1,https://www.reddit.com/r/Coronavirus/comments/fqkk56/daily_discussion_post_march_28_questions_images/flqtfkw/,"""Did something good? Enjoy your updoot"""
2020-03-28,malusfacticius,Coronavirus,1,https://www.reddit.com/r/Coronavirus/comments/fqixw2/coronavirus_kills_man_61_and_daughter_33_in_space/flqtfld/,They congregate.
2020-03-28,the_F_bomb,Coronavirus,1,https://www.reddit.com/r/Coronavirus/comments/fqj7lw/data_shows_amazon_raised_prices_during_pandemic/flqtfhx/,Same here but after a few hours of looking we found a 10 year old one we had lost.
2020-03-28,CRTsdidnothingwrong,Coronavirus,1,https://www.reddit.com/r/Coronavirus/comments/fqd283/los_angeles_mayor_appreciates_chinese_cities_help/flqtfgi/,"Do you realize how insane it is to expect China to allow the US CDC in?

There are three global nuclear superpowers and they don't just let each other's three letter agencies come poke around."
2020-03-28,MayorOfBluthton,Coronavirus,1,https://www.reddit.com/r/Coronavirus/comments/fqkgi6/people_with_down_syndrome_autism_could_be_left_to/flqtf46/,She also had a DNR. So a ventilator wasn’t used because she didn’t want one. She dictated her care. But I guess that tidbit would make the story far less sensational...
2020-03-28,indianola,Coronavirus,1,https://www.reddit.com/r/Coronavirus/comments/fqkuoa/india_akshay_kumar_joins_covid19_fight_with_a_rs/flqtkb7/,"When you use the word ""secular"", what does that mean exactly?  The way we use that term in the US precludes how you're using it, so I can't make heads or tails of what you're saying here.  I mean, I'm grasping that Team A doesn't like Team B, but can't figure the rest out."
2020-03-28,paynese_grey,Coronavirus,1,https://www.reddit.com/r/Coronavirus/comments/fqknvt/germany_will_not_ease_shutdown_until_at_least/flqtkcr/,"yup, it was the same when they set the lock down in place. Every two days they added new measures until people were mentally prepared and expected the lock down, they didn't go full force on the lock down. This is how you handle anxious people during a crisis and I'm actually glad to see a pattern in their ""lack"" of planning ahead."
2020-03-28,AutoModerator,Coronavirus,1,https://www.reddit.com/r/Coronavirus/comments/fqj7lw/data_shows_amazon_raised_prices_during_pandemic/flqtos8/,"Your comment has been removed because

* **Purely political posts and comments will be removed.** Political discussions can easily come to dominate online discussions. Therefore we remove political posts and comments and lock comments on borderline posts. ([More Information](https://www.reddit.com/r/Coronavirus/wiki/rules#wiki_rule_4.3A_avoid_politics))

*I am a bot, and this action was performed automatically. Please [contact the moderators of this subreddit](/message/compose/?to=/r/Coronavirus) if you have any questions or concerns.*"
2020-03-28,JenniferColeRhuk,Coronavirus,1,https://www.reddit.com/r/Coronavirus/comments/fqkudh/ny_doctor_on_tucker_carlson_discusses_taking/flqtoti/,"Your post or comment has been removed because

* **Asking for or providing medical advice is not allowed.** We cannot be responsible for your health. If you need general information, please refer to the [CDC's website](https://www.cdc.gov/coronavirus/2019-ncov/about/) and if you need more specific medical advice, please contact a qualified medical professional in your area. ([More Information](https://www.reddit.com/r/Coronavirus/wiki/rules#wiki_rule_5.3A_keep_information_quality_high))

*If you believe we made a mistake, please [message the moderators](/message/compose?to=/r/Coronavirus).*"
2020-03-28,JtolaJeff,Coronavirus,1,https://www.reddit.com/r/Coronavirus/comments/fqj7lw/data_shows_amazon_raised_prices_during_pandemic/flqtotv/,"Yeah, of course they did. Their prices are high af on a lot of things on a good day."
2020-03-28,turkey_is_dead,Coronavirus,1,https://www.reddit.com/r/Coronavirus/comments/fqckfj/the_number_of_recoveries_now_exceeds_the_number/flqtp5o/,"3-12 days incubation, 1-4 weeks symptomatic, 2-4 weeks completely recovered. If you're on the worst timeline you could be contagious for over 2 months."
2020-03-28,Greed_is_Evil,Coronavirus,1,https://www.reddit.com/r/Coronavirus/comments/fql4fx/hobby_lobby_states_that_god_is_in_control_and/flqtp75/,Brilliant
2020-03-28,Here_4_Camilla,Coronavirus,1,https://www.reddit.com/r/Coronavirus/comments/fqj7lw/data_shows_amazon_raised_prices_during_pandemic/flqtozr/,Really?  I found spme for $4.50
2020-03-28,shitcoinmaximalist30,Coronavirus,1,https://www.reddit.com/r/Coronavirus/comments/fqkezn/germany_has_a_remarkably_low_coronavirus_death/flqtozx/,"110000 + 1 Italian ( my anecdote source ) would like to disagree with you. 

https://www.google.com/amp/s/www.independent.co.uk/news/world/europe/coronavirus-italy-lockdown-police-charges-fines-quarantine-lombardy-a9427046.html%3famp"
2020-03-28,Kenny_log_n_s,Coronavirus,1,https://www.reddit.com/r/Coronavirus/comments/fqj7lw/data_shows_amazon_raised_prices_during_pandemic/flqtopi/,Don't be dense.
2020-03-28,NeedingAdvice86,Coronavirus,1,https://www.reddit.com/r/Coronavirus/comments/fqgohs/huawei_donates_10000_n95_masks20000_isolation/flqtt5s/,"Hopefully they are better quality than the crap they sold to Spain....  

I do love how the PR stunt always works on the most gullible rubes just as it is intended to do.....not a coincidence that the most foolish and gullible are also the most anti-American nutjobs.     

Of course, this is like the arsonist who set fire to your house, lied about the blazing fire in the back of the kitchen until it was raging thru your living room....offering you a shot glass of water to ""help"".   

Not surprised to see bunch of the Chinese bots out on all these subs praising China and slamming the US...nice work, guys."
2020-03-28,thetamilking,Coronavirus,1,https://www.reddit.com/r/Coronavirus/comments/fql5cj/brazil_leader_wants_to_end_social_distancing_even/flqttce/,r/iamatotalpieceofshit
2020-03-28,Kidnovatex,Coronavirus,1,https://www.reddit.com/r/Coronavirus/comments/fqk0gs/in_virusravaged_wuhan_hourslong_queues_to_collect/flqttcm/,The pictures are linked in the Bloomberg article on this topic if you're interested in seeing them.
2020-03-28,Nunyabeezkneez,Coronavirus,1,https://www.reddit.com/r/Coronavirus/comments/fqkuxb/uk_reports_2510_new_cases_of_coronavirus_and_260/flqtto1/,"Wait until you start seeing reports of people with obvious coronavirus symptoms/testing positive dying of ""multiple organ failure"" and not being counted wth the coronavirus death tally. 

Pretty sure all infected nations are manipulating the numbers by listing ""technicalities"" as the ""cause of death"" so it looks less severe publicly."
2020-03-28,keepsake4,Coronavirus,1,https://www.reddit.com/r/Coronavirus/comments/fqki4b/homemade_masks_can_significantly_slow_the_spread/flqttgf/,"Here's my contribution, better than nothing, paper towel face-mask maker. One mask per 72 seconds.

https://btnmask.gitlab.io"
2020-03-28,mpaquin1064,Coronavirus,1,https://www.reddit.com/r/Coronavirus/comments/fqk9x1/what_happens_when_extreme_heat_collides_with_a/flqtye2/,It’s not the flu but both are viral
2020-03-28,BeratFetai,Coronavirus,1,https://www.reddit.com/r/Coronavirus/comments/fqjyxj/facing_shortage_detroit_area_hospitals_could_soon/flqtyos/,"For real you want Gov. Cuomo to get briefing from reddit and make decisions to buy 40.000 ventilators before all governments stepped up and bought whatever was on market, while president called it democrats hoax!!!!"
2020-03-28,SirCutRy,Coronavirus,1,https://www.reddit.com/r/Coronavirus/comments/fq6omp/perfectly_healthy_44_year_old_father_of_6_dies_2/flqtyov/,"Oh shit, sorry."
2020-03-28,MasterKoos,Coronavirus,1,https://www.reddit.com/r/Coronavirus/comments/fqagv0/college_students_aged_1824_who_have_been_claimed/flqtycc/,"Dependency has nothing to do with how much tax you pay. You can be claimed if you pay no taxes or if you paid taxes. It has to do with ""support"", and if you parents ""provided half your support"", they have the right to take that deduction. 

However, for college kids, parents don't usually provide half their support but they claim them anyway because they can. There's a tuition credit out now that makes a lot of families fight over who has the right, and parents will almost always win that battle because it's easy to threaten your kids."
2020-03-28,Red_Fox_Blue,Coronavirus,1,https://www.reddit.com/r/Coronavirus/comments/fqka8u/we_now_know_who_societys_essential_workers_are/flqu40e/,You're not wrong. People just like to virtue signal.
2020-03-28,BDThrills,Coronavirus,1,https://www.reddit.com/r/Coronavirus/comments/fqkk56/daily_discussion_post_march_28_questions_images/flqu3se/,"A lot of these folks would have been dining in and are now getting take out.  My neighbor has done this (retired) every day, 3 times a day, since I moved here (20 years).   It is so weird to see that truck not move for days.  (his daughter lives with him, so I'm not worried about him)."
2020-03-28,BabyBelBallOnWall,Coronavirus,1,https://www.reddit.com/r/Coronavirus/comments/fql90q/new_study_by_pr_raoult_using_hydroxycholoroquine/flqu41c/,Their fever was reduced to room temperature.
2020-03-28,Imaginary_Value,Coronavirus,1,https://www.reddit.com/r/Coronavirus/comments/fql5cj/brazil_leader_wants_to_end_social_distancing_even/flqu8nc/,We're gonna see a total movie moment where the cartels take over and protect the citizens.
2020-03-28,IrrawaddyWoman,Coronavirus,1,https://www.reddit.com/r/Coronavirus/comments/fq4c8e/disneyland_and_walt_disney_world_now_indefinitely/flqu8jg/,"I worked there during 9/11 all the way up until a couple of years ago.  The crowds in the early 2000s can’t really be compared to these days.  Back then there really was a slow season.  Now it is ALWAYS very busy.  Always.

Also, the crowds dropped after 9/11 because the nation was in mourning and didn’t really feel like doing fun stuff.  I don’t think it’s going to be the same situation after people have been cooped up in their homes for weeks or moths desperate to go out.

Expect the parks to be slammed from the minute they open back up."
2020-03-28,Tasteyfleece,Coronavirus,1,https://www.reddit.com/r/Coronavirus/comments/fqgohs/huawei_donates_10000_n95_masks20000_isolation/flqu8wb/,"This sub used to be ok, then it grew and became a disgusting hive of chinese propaganda playing off American's love of self hatred."
2020-03-28,ixikei,Coronavirus,1,https://www.reddit.com/r/Coronavirus/comments/fqj7lw/data_shows_amazon_raised_prices_during_pandemic/flqu8h4/,Amazon also makes it really difficult to report price gouging. Where is the damn button to report price gouging!? They could make it way easier if they wanted to.
2020-03-28,RadicalDilettante,Coronavirus,1,https://www.reddit.com/r/Coronavirus/comments/fq5mdt/new_orleans_mayor_says_she_would_have_canceled/flqu8ho/,Not mentioned? The 'flip side' is well documented and talked about a lot. Privacy is sacrificed in every war. The US needed good intelligent leadership and got a whinging baby-king in denial who's now demanding tributes from the local chieftains. The FDA is now having to push his bullshit 'cure'. What a way to run a railroad.
2020-03-28,misspussy,Coronavirus,1,https://www.reddit.com/r/Coronavirus/comments/fqj7lw/data_shows_amazon_raised_prices_during_pandemic/flquitu/,That's insane. Are you in the states?
2020-03-28,UsualRoyal1,Coronavirus,1,https://www.reddit.com/r/Coronavirus/comments/fqiyuy/portuguese_government_has_decreed_that_all_asylum/flqup02/,No it looks like the citizens just got fucked over to me. You can let a bunch of freeloaders into your country and give them everything they need but that's not ever going to happen in my country.
2020-03-28,SpaceWolf37,Coronavirus,1,https://www.reddit.com/r/Coronavirus/comments/fqj7lw/data_shows_amazon_raised_prices_during_pandemic/flquooe/,"That just creates a domino effect where the supplies have to buy their materials at a lower price which is almost impossible because they are in short supply as well, which ends up resulting in mass shortages.

Amazon doesn't just get to wave a magic wand and make it easier to requisition, build, and distribute items during a massive global emergency."
2020-03-28,duhhWhatever1999,Coronavirus,1,https://www.reddit.com/r/Coronavirus/comments/fqagv0/college_students_aged_1824_who_have_been_claimed/flquot6/,Where did I say I wished this on someone? Get out of your feelings.
2020-03-28,Noisy_Toy,Coronavirus,1,https://www.reddit.com/r/Coronavirus/comments/fqki4b/homemade_masks_can_significantly_slow_the_spread/flquoqi/,Anytime I hem leggings I end up with new hairbands :-)
2020-03-28,BeaversAreTasty,Coronavirus,1,https://www.reddit.com/r/Coronavirus/comments/fqk31g/dc_hospital_nurse_resigns_over_lack_of_ppe/flqutw6/,Go home and stay alive would be a good start.  These people didn't sign up to die.
2020-03-28,briandt75,Coronavirus,1,https://www.reddit.com/r/Coronavirus/comments/fql4fx/hobby_lobby_states_that_god_is_in_control_and/flquz26/,Like what?
