date,author,subreddit,score,url,text
2020-03-28,daddymattyg,Coronavirus,1,https://www.reddit.com/r/Coronavirus/comments/fqk31g/dc_hospital_nurse_resigns_over_lack_of_ppe/flqshgs/,She should be able to keep her job and file an osha complaint.
2020-03-28,US-Disability,Coronavirus,1,https://www.reddit.com/r/Coronavirus/comments/fqjxmr/global_cases_top_600000_and_28000_dead/flqshhm/,"This year's flu only took about 20,000 people."
2020-03-28,lopy1215,Coronavirus,1,https://www.reddit.com/r/Coronavirus/comments/fqicwa/pakistan_struggles_to_limit_islamic_prayers_to/flqslvr/,You're right. They are useless.
2020-03-28,darkpatri0t,Coronavirus,1,https://www.reddit.com/r/Coronavirus/comments/fqk280/life_as_weve_known_it_has_stopped/flqslpv/,"As much as I think that would be great, not possible unless you lose a lot of people. Which is, of course, not a good outcome. The time for few cars and clear skies is gone, at least, in large cities."
2020-03-28,Shado_HQ,Coronavirus,1,https://www.reddit.com/r/Coronavirus/comments/fqkvps/guys_if_you_have_time_could_you_fill_out_this/flqslw8/,"Done.

Not sure the translation of the question ""how is the virus undervalued"" is totally accurate but I got the gist of it."
2020-03-28,CorruptLogix,Coronavirus,1,https://www.reddit.com/r/Coronavirus/comments/fqkeb0/in_mexico_there_are_already_70_deaths_reported_as/flqslyq/,"Mexico botched this from the beginning. I know people from the U.S. like to hate on our own response to the virus, but our death toll will be nothing compared to Countries in Africa and South America that lack medical infrastructure"
2020-03-28,____dolphin,Coronavirus,1,https://www.reddit.com/r/Coronavirus/comments/fqjcn1/mayor_new_haven_asks_for_coronavirus_housing_help/flqsm0i/,So what? All people who work do. Asking them to pay taxes is not stealing. It's not wanting to cover private enterprises. At the minimum if they don't pay taxes they should be providing in times of crisis in return for all the things they didn't have to pay for.
2020-03-28,r4nd0mreddituser2020,Coronavirus,1,https://www.reddit.com/r/Coronavirus/comments/fqjomc/bollywood_actor_donates_333_million_usd_to_fight/flqsltr/," 

# that actor is Canadian citizen he has sent all his UN TAXED AKA BLACK MONEY to Canada and bought MALLS in Canada."
2020-03-28,ReservoirPenguin,Coronavirus,1,https://www.reddit.com/r/Coronavirus/comments/fqjzo5/germany_extends_shutdown_to_april_20/flqsqii/,It's not a fact. It's your opinion.
2020-03-28,scott60561,Coronavirus,1,https://www.reddit.com/r/Coronavirus/comments/fqka8u/we_now_know_who_societys_essential_workers_are/flqsqqc/,"Nobody*

*Except the largest retail chain in America. https://www.cnn.com/2019/04/09/business/walmart-robots-retail-jobs/index.html"
2020-03-28,annoy-nymous,Coronavirus,1,https://www.reddit.com/r/Coronavirus/comments/fqk0gs/in_virusravaged_wuhan_hourslong_queues_to_collect/flqt0h1/,"The reasonable answer to this is that some people in China have multiple lines, multiple phones, especially for small businesses that were likely to suffer during the lockdown and continued distancing measures. 

Firstly, China has \~300 million more phone subscribers than their population.  [https://techblog.comsoc.org/2020/01/23/china-has-more-than-1-6-billion-mobile-subscribers-chinas-entire-population/](https://techblog.comsoc.org/2020/01/23/china-has-more-than-1-6-billion-mobile-subscribers-chinas-entire-population/) 

So it's already clear that phone lines do not map 1:1 with population. 

Like a lot of the US, people sometimes have work and personal lines/phones, either for security reasons or just separation of work and play. Ex. in the US, a lot of small businesses use Google Voice forwarding. 

This pandemic response has been brutal for the Chinese economy as much, if not more, as it continues to be brutal to the US and world economy. A lot of small business operators in China, from restaurants to Karaoke parlors to theaters and massage parlors, have gone under or are suffering massive distress. It's not unlikely at all that many of these result in canceled wireless plans for those businesses and for those laid off from such."
2020-03-28,AgentOrcish,Coronavirus,1,https://www.reddit.com/r/Coronavirus/comments/fqgohs/huawei_donates_10000_n95_masks20000_isolation/flqt3y3/,"Factories do not start production right away. They need to be retooled to do what needs to be done. That takes time. 3m is beginning production on masks. GM was just forced to get in line with the program on ventilators. 

Most of these companies are only pivoting because they know that the US will pay and if they don’t do what is asked, they won’t be selling any products in six months. 

Everyone wanted manufacturing overseas because it is cheap. Well, now you all know what happens when you give up control of particular goods. 

Bring manufacturing back to the US. 
Forget China and their cheap phones and their crappy wet markets. 

All this is going on around us and all people can say is I like their phones... you won’t need a cheap Chinese imitation phone once you are dead."
2020-03-28,Irrichc,Coronavirus,1,https://www.reddit.com/r/Coronavirus/comments/fqkrwh/times_square_cams_this_would_normally_be_packed/flqt92m/,"Honestly when life gets back to normalcy, i hope the government issues at least a week or maybe weekend of mandatory solitude per year for the nation. It does wonders for the well being of the earth....but who we kidding, it’ll take a life threatening event for that to ever occur."
2020-03-28,Saang01,Coronavirus,1,https://www.reddit.com/r/Coronavirus/comments/fqixw2/coronavirus_kills_man_61_and_daughter_33_in_space/flqt98v/,Obviously
2020-03-28,barkatthedune,Coronavirus,1,https://www.reddit.com/r/Coronavirus/comments/fpv83s/worse_pandemic_on_horizon_unless_world_deals_with/flqt98y/,"FFS talk like a human being. Why the fuck are asking questions when you're trying to make a statement. Same with that other vegan poster. It's like you're trying to be an asshole.

If you want to say something or make a point, say something and make a point.

I really highly recommend learning to communicate. Just advice. Try not to be an asshole.

And also, cheese can be made ethically. Chickens can be raised ethically. I don't see what your point is."
2020-03-28,[deleted],Coronavirus,1,https://www.reddit.com/r/Coronavirus/comments/fqj7lw/data_shows_amazon_raised_prices_during_pandemic/flqte21/,[removed]
2020-03-28,AutoModerator,Coronavirus,1,https://www.reddit.com/r/Coronavirus/comments/fqj7lw/data_shows_amazon_raised_prices_during_pandemic/flqte2x/,"Your comment has been removed because

* **Purely political posts and comments will be removed.** Political discussions can easily come to dominate online discussions. Therefore we remove political posts and comments and lock comments on borderline posts. ([More Information](https://www.reddit.com/r/Coronavirus/wiki/rules#wiki_rule_4.3A_avoid_politics))

*I am a bot, and this action was performed automatically. Please [contact the moderators of this subreddit](/message/compose/?to=/r/Coronavirus) if you have any questions or concerns.*"
2020-03-28,muldoonwasacleverboy,Coronavirus,1,https://www.reddit.com/r/Coronavirus/comments/fqdjyt/400_million_indians_to_be_infected_by_july_report/flqtdyb/,"Well they shit and wash in the same river.

Shocked Pikachu"
2020-03-28,igotnothingtoadd,Coronavirus,1,https://www.reddit.com/r/Coronavirus/comments/fqjomc/bollywood_actor_donates_333_million_usd_to_fight/flqtdvm/,Gave up the citizenship
2020-03-28,IndigoWizard7,Coronavirus,1,https://www.reddit.com/r/Coronavirus/comments/fql4fx/hobby_lobby_states_that_god_is_in_control_and/flqtnir/,I mean they could be deemed essential at this point for people to get supplies . They do have a huge selection of products that people may need during this
2020-03-28,fortevn,Coronavirus,1,https://www.reddit.com/r/Coronavirus/comments/fql5cj/brazil_leader_wants_to_end_social_distancing_even/flqtncw/,"I feared the virus would spread in Brazil from the carnival, I was somehow relaxed because Brazil said they increased screening and testing in the airport and made announcement that they were aware of the virus and preparing accordingly.

Now... I don't know. It's like Bolsonaro WANTS his country to die. I know economy is important especially to a developing nation like Brazil, but he doesn't even bother to mask it up like Japan."
2020-03-28,Six-Zer0,Coronavirus,1,https://www.reddit.com/r/Coronavirus/comments/fq3gju/woman_who_purposefully_coughed_on_35k_worth_of/flqtneb/,"Front line hospital workers are very likely to get sick.
We come in contact with the sick as a matter of our day to day.

We wear the masks as prevention. First to try to protect us so we can keep treating the sick.

If all the doctors and nurses are in quarantine who assists your grandfather during a heart attack?

Second, with an incubation period of 14 days to symptoms and a contagious period before being symptomatic we would not nessisarly know if we where shedding virus in droplets from our mouths and nose when we breath. 

In terms of hazard management there are degrees of how risk is mitigated. 

Elimination - we don't admit or treat the sick, not an option.
Substitution - not possible, not an option.
Engineering controls - we use negative pressure rooms but there are only so many of those, have erected barriers between point of entry and patients before admission to the specialized areas, reduce the number of entrances going into the hospital so that we can screen people coming in, 

So we adopt a standard of protection that trys to prevent spread to patients who are at the hospital for other reasons. Even though we don't think we are sick, it is safer for you, the patient if our policies assume we are and we act accordingly."
2020-03-28,Kidnovatex,Coronavirus,1,https://www.reddit.com/r/Coronavirus/comments/fqkgi6/people_with_down_syndrome_autism_could_be_left_to/flqtqvh/,The pictures are linked in the Bloomberg article on this subject if you want to see them.
2020-03-28,ihadarowboat,Coronavirus,1,https://www.reddit.com/r/Coronavirus/comments/fq6omp/perfectly_healthy_44_year_old_father_of_6_dies_2/flqtzq8/,"This subreddit scares me more than the virus. Even an article about dogs being adopted is full of negative comments all looking for the edge on why this is a bad thing. 

One comment even went so far reaching as to ponder how the mental health of a dog is going to be impacted when their owner someday isn't staying home 24/7 with them."
2020-03-28,itsBailey1692,Coronavirus,1,https://www.reddit.com/r/Coronavirus/comments/fqku9e/cop_tells_man_with_coronavirus_hes_killing_people/flqtzqf/,Exactly!
2020-03-28,faab64,Coronavirus,1,https://www.reddit.com/r/Coronavirus/comments/fqbumh/irans_army_sets_up_hospital_in_capital_as_virus/flqtzr9/,"Thanks, it is really hurtful, watching people die and people don't even mention Iran as one of the major victims of this pandemic, and the innocent people are stuck in between the US sanctions and media who doesn't care about Iran any more and a regime that is doing it's best to act like they have everything under control, something similar to what Trump is doing now!"
2020-03-28,RickDRooster,Coronavirus,1,https://www.reddit.com/r/Coronavirus/comments/fqixw2/coronavirus_kills_man_61_and_daughter_33_in_space/flqu00e/,"Sure, it’s likely true and it makes sense. It’s still speculation, even if virologists say it."
2020-03-28,asah,Coronavirus,1,https://www.reddit.com/r/Coronavirus/comments/fqhy3p/fox_business_parts_ways_with_trish_regan_host_who/flqtzmq/,"Your post or comment has been removed because

* **Purely political posts and comments will be removed.** Political discussions can easily come to dominate online discussions. Therefore we remove political posts and comments and lock comments on borderline posts. ([More Information](https://www.reddit.com/r/Coronavirus/wiki/rules#wiki_rule_4.3A_avoid_politics))"
2020-03-28,banana-trippin,Coronavirus,1,https://www.reddit.com/r/Coronavirus/comments/fql4fx/hobby_lobby_states_that_god_is_in_control_and/flqu4c3/,Nope - they sent out letters to every employee yesterday - terminating everyone effective immediately.
2020-03-28,Fughtmeulilbitch,Coronavirus,1,https://www.reddit.com/r/Coronavirus/comments/fqj7lw/data_shows_amazon_raised_prices_during_pandemic/flqu9re/,"I hope the government ends up fixing prices. 

Then you’ll complain about not being able to buy toilet paper or other basic goods."
2020-03-28,watermelonoma,Coronavirus,1,https://www.reddit.com/r/Coronavirus/comments/fq9dt5/more_than_half_of_small_business_owners_say_they/flqu9wb/,"Medicaid covered my rehab, but that was almost 10 years ago."
2020-03-28,MrStealYourWhey,Coronavirus,1,https://www.reddit.com/r/Coronavirus/comments/fqkvfx/coronavirus_kills_10_infects_712_on_diamond/flqufht/,"The ship epidemy happened over a month ago. Most of the passengers already recovered. Only few are still treated.

Some may have recovered without even having symptoms, before they were even tested"
2020-03-28,SomeFee0,Coronavirus,1,https://www.reddit.com/r/Coronavirus/comments/fqkk56/daily_discussion_post_march_28_questions_images/flqufcw/,Why there are many cases in Florida? The heat/humidity don't help?
2020-03-28,d_nijmegen,Coronavirus,1,https://www.reddit.com/r/Coronavirus/comments/fqjz2w/coronavirus_killing_people_in_new_york_city_at/flquf9x/,Consistent stupidity from the spreaders among us
2020-03-28,duckmadfish,Coronavirus,1,https://www.reddit.com/r/Coronavirus/comments/fqj7lw/data_shows_amazon_raised_prices_during_pandemic/flqufk9/,"I'm sure that's because Amazon has been a convenience for a lot of us. 

Sure they're not the best example of an ethical company, but they made getting stuff online easy."
2020-03-28,DJsatinJacket,Coronavirus,1,https://www.reddit.com/r/Coronavirus/comments/fql5cj/brazil_leader_wants_to_end_social_distancing_even/flqukvh/,It's like the leaders dont care.
2020-03-28,Nessyliz,Coronavirus,1,https://www.reddit.com/r/Coronavirus/comments/fpxagz/daily_discussion_post_march_27_questions_images/flqul1a/,"It sounds like OP is higher up in the company/some sort of managerial job. Those kinds of specialized jobs are pretty hard to hire someone to help with, by the time whoever was hired got trained up enough to actually be of use the pandemic would have calmed down. So...it would just make more work in the end for OP. I might be totally off but that's how I read the comment."
2020-03-28,Maklo_Never_Forget,Coronavirus,1,https://www.reddit.com/r/Coronavirus/comments/fpeeak/with_italys_confirmed_cases_yet_to_be_reported/flqul7d/,"Where did bill gates say that?

Right now looking at countries in Europe, I hope you are right. I work in a large hospital and the changes applied are intense, not to mention the horror patients and their system goes through. Don’t wish that upon anyone."
2020-03-28,whattaUwant,Coronavirus,1,https://www.reddit.com/r/Coronavirus/comments/fqladg/coronavirus_why_are_the_death_rates_different/flqupl4/,"The more data I see, the more I’m starting to question whether it’s being overhyped some. I’ve been a big “this is real.. no hype” person this entire time.. 

but seeing that America has 105k cases and only 1700 deaths so far and only 2500 listed as serious/critical.... I can’t help but question things. Let’s not forget there’s a ton of other people who probably have it or HAD it who weren’t able to get tested. the majority of those 105k cases are the worst of the worst.... but only 2500 are in serious/critical condition by now? Hmmm. Oh yeah the experts were all predicting triage in America by now but I haven’t seen any examples of that yet."
2020-03-28,mr_niggito,Coronavirus,1,https://www.reddit.com/r/Coronavirus/comments/fqlebq/podcast_tip_of_the_spear_in_the_ebola_response/flqup3f/,"ebola killed 11.3k people in 1 year, corona has killed 27k in only 3 months. big difference"
2020-03-28,RedditUser9212,Coronavirus,1,https://www.reddit.com/r/Coronavirus/comments/fqixw2/coronavirus_kills_man_61_and_daughter_33_in_space/flqupow/,">Matter of fact one of the worst things you can get at McDonalds is a Cesar salad.

haha wtf maybe if you drench it in ranch but nah dude this isnt true.  Look down at your own body?  Are you fat?  Then you're more at risk.  Period."
2020-03-28,Q_me_in,Coronavirus,1,https://www.reddit.com/r/Coronavirus/comments/fqkk56/daily_discussion_post_march_28_questions_images/flqupp6/,"There is also information that that finding is based on correlation, not causation. The people that have died are older, and that demographic happens to have more aches, pains and arthritis so they take more ibuprofen. There is nothing proving anything causal."
2020-03-28,sudomagodo,Coronavirus,1,https://www.reddit.com/r/Coronavirus/comments/fqladg/coronavirus_why_are_the_death_rates_different/flqupbr/,The REAL cases are estimated to be in the region of 7/800.000 . 10 times the reported cases. Hence the high mortality
2020-03-28,ghurl1234,Coronavirus,1,https://www.reddit.com/r/Coronavirus/comments/fqk31g/dc_hospital_nurse_resigns_over_lack_of_ppe/flquvkb/,"And it is a difficult choice to make because you can spread the virus and also you can contact it yourself by not having PPE. Thus, leading to more people affected."
2020-03-28,MonkeysFanny,Coronavirus,1,https://www.reddit.com/r/Coronavirus/comments/fqld8b/more_americans_should_probably_wear_masks_for/flquvcw/,I’m waiting for mine. Week 4. I ended up sewing my own. They’re not pretty but they work.
2020-03-28,oldsportgatsby,Coronavirus,1,https://www.reddit.com/r/Coronavirus/comments/fqhy3p/fox_business_parts_ways_with_trish_regan_host_who/flqv0pz/,"He's also against free market fundamentalism and was one of the few conservative talking heads to criticize Trump's choice of John Bolton from the beginning.  He's a legit dude with shitty opinions on a lot of things and hosts a dishonest platform in which he invites weak strawmen on his show to beat up on.  I hate him and begrudgingly respect him a tiny bit, depending on the day."
2020-03-28,Ordinary_Gene,Coronavirus,1,https://www.reddit.com/r/Coronavirus/comments/fqka8u/we_now_know_who_societys_essential_workers_are/flqv0i4/,"The rich have never been essential, except to start wars, enslave people, kill people..."
2020-03-28,BeaversAreTasty,Coronavirus,1,https://www.reddit.com/r/Coronavirus/comments/fqk31g/dc_hospital_nurse_resigns_over_lack_of_ppe/flqv0sh/,Except healthcare workers aren't soldiers.  They didn't sign up to potentially die for some stranger.
2020-03-28,glyphotes,Coronavirus,1,https://www.reddit.com/r/Coronavirus/comments/fqcgvp/er_doctor_who_criticized_bellingham_hospitals/flqv68o/,"As a publicly known ""whistleblower""? I wish him all the luck and success, but I think he needs luck..."
2020-03-28,Dafinition,Coronavirus,1,https://www.reddit.com/r/Coronavirus/comments/fqj7lw/data_shows_amazon_raised_prices_during_pandemic/flqv69l/,"Weird, I’ve been using it for months without an account."
2020-03-28,Dr-Werner-Klopek,Coronavirus,1,https://www.reddit.com/r/Coronavirus/comments/fqaq7y/google_donates_800_million_in_cash_and_ads_to/flqv6bb/,I work on ppc also. We have many travel clients who have sadly been hit so hard by it. Various e-commerce clients however have seen some amazing results via shopping.
2020-03-28,zer00eyz,Coronavirus,1,https://www.reddit.com/r/Coronavirus/comments/fqj7lw/data_shows_amazon_raised_prices_during_pandemic/flqv6bf/,"Sure, but now the bottleneck is manpower and that ISN'T cheap at the moment."
2020-03-28,doegrey,Coronavirus,1,https://www.reddit.com/r/Coronavirus/comments/fqkezn/germany_has_a_remarkably_low_coronavirus_death/flqvavm/,"Sorry - refuse to go to yahoo! Webpages as their analytics are impossible to opt out of.

Are you able to post the article here?"
2020-03-28,evil_666_live,Coronavirus,1,https://www.reddit.com/r/Coronavirus/comments/fqkopi/japan_1724_domestic_cases_as_of_28032020/flqvay2/,"Trump: Not testing people because of stock market. 

Abe: not testing people because of Olympics

politicians think alike!"
2020-03-28,TrimiPejes,Coronavirus,1,https://www.reddit.com/r/Coronavirus/comments/fqf7r7/translated_indonesian_man_takes_wife_who_died_of/flqvlk2/,Man I don’t want to live in a world without fysical contact. I like giving a hug or something like that.
2020-03-28,pizza_for_nunchucks,Coronavirus,1,https://www.reddit.com/r/Coronavirus/comments/fqj7lw/data_shows_amazon_raised_prices_during_pandemic/flqvlo3/,"Doc: So you’re running a fever? How bad?

Winkelschleifer: Medium rare."
2020-03-28,bakeoutbigfoot,Coronavirus,1,https://www.reddit.com/r/Coronavirus/comments/fq8wln/not_sure_if_this_is_the_place_to_post_a_womens/flqvlq1/,Same. My parents were hella sick and the casino doctors told them they were fine and to go back to work. Funny too that only one dealer was tested and they didnt test anyone else who had been working with him.
2020-03-28,saltyswedishmeatball,Coronavirus,1,https://www.reddit.com/r/Coronavirus/comments/fqgohs/huawei_donates_10000_n95_masks20000_isolation/flqvlbm/,"China is doing everything it can to help the US but the US has so much ignorance that it wont let the aid in. US has officially become a worse offender to this entire pandemic than the Chinese government by far. The blood of those that will die is on that of Donald Trump, not President Xi."
2020-03-28,hamagiclamp,Coronavirus,1,https://www.reddit.com/r/Coronavirus/comments/fqjxmr/global_cases_top_600000_and_28000_dead/flqvleq/,"Well if you keep in mind in that 600k most haven't been put in the recovered vs dead category yet. I think the mortality rate is about 14% right now based off resolved cased numbers, but you have to take all these numbers with a grain of salt right now and probably for years to come."
2020-03-28,mBuxx,Coronavirus,1,https://www.reddit.com/r/Coronavirus/comments/fqka8u/we_now_know_who_societys_essential_workers_are/flqvlr6/,"Weighing in here as a (private) restaurant owner.  I love our staff, we have about 25, many of which have been with us 15+ years.  You don’t know how much I’d love to pay them much more, and we do pay well above minimum wage. They’re like our family. The hard truth is the govt takes nearly half our income in taxes, property taxes on our corner lot are nearly 30k a year. Absurd hydro rates here in Ontario put us well over 20k a year. That’s not including gas and water. It’s sad, but our sales tax/income tax/property tax amounts to about 3-4 times the amount of what we take home at the end of the year.  If the govt would stop taking so much, we could provide much more for our staff."
2020-03-28,BUFBills_AfricasTeam,Coronavirus,1,https://www.reddit.com/r/Coronavirus/comments/fqka8u/we_now_know_who_societys_essential_workers_are/flqvlno/,"You kiss your mother with that mouth?!

-Jeff Bezos, probably"
2020-03-28,seouled-out,Coronavirus,1,https://www.reddit.com/r/Coronavirus/comments/fqjbk5/india_covid19_in_jk_tableeghi_jamaat_head_dies/flqvqmd/,"Your comment has been removed because


* **Incivility isn’t allowed on this sub.** In specific, celebrating or wishing for someone’s harm is not allowed. We want to encourage a respectful discussion. ([More Information](https://www.reddit.com/r/Coronavirus/wiki/rules#wiki_rule_1.3A_be_civil))



*If you believe we made a mistake, please [message the moderators](/message/compose?to=/r/Coronavirus).*"
2020-03-28,Nomsensus,Coronavirus,1,https://www.reddit.com/r/Coronavirus/comments/fqj7lw/data_shows_amazon_raised_prices_during_pandemic/flqvqsb/,Not like there’s massive supply chain and raw materials acquisitions issues amongst all this that has a legitimate effect on prices or anything...
2020-03-28,sk8rgrrl69,Coronavirus,1,https://www.reddit.com/r/Coronavirus/comments/fqdpti/two_sisters_died_days_apart_from_coronavirus_in/flqvvq6/,I’m not seeing reports of 36-42 yr old white women dying even though there are millions more of them who are obese.
2020-03-28,monkeyman74721,Coronavirus,1,https://www.reddit.com/r/Coronavirus/comments/fqje0d/coronavirus_what_if_this_had_happened_in_2005/flqvv9p/,SARS had a much higher mortality rate. Also most people who go sick stayed home because they were sick.  This one spreads so easy because so may people show little to no symptoms.
2020-03-28,markulous,Coronavirus,1,https://www.reddit.com/r/Coronavirus/comments/fqj7lw/data_shows_amazon_raised_prices_during_pandemic/flqvvb3/,"Companies/people with billions of dollars owe it to their fellow humans during times like these. They made that money off of the same people that are now sick, unemployed, or working for them. To sit on this money is abhorrent. To actually price gouge on top of it is pure evil."
2020-03-28,GustavEkel,Coronavirus,1,https://www.reddit.com/r/Coronavirus/comments/fqj8f7/fake_alert_media_reports_claim_400_million/flqvvh5/,"That was a nice joke. You have around 900 infected you found, and I am sure there are at least 500 more without symtoms still running around. Guess what happens if only one walks into a slum...

Just wait for some more weeks, like the USA did, pretending everything is under control, but beware. Without an approach like Hong Kong or South Korea the numbers will explode. And you lack anything, from technics to control people over testing equipment to enough beds in hospitals and possibilities to keep people separated.

The bomb just hasn't exploded yet."
2020-03-28,is-this-a-nick,Coronavirus,1,https://www.reddit.com/r/Coronavirus/comments/fqkcxa/netherlands_coronavirus_deaths_rise_93_to_639/flqreyv/,"NL didn't really give a single fuck about COVID even when everybody else was shutting down schools, sports events, etc."
2020-03-28,blue-leeder,Coronavirus,1,https://www.reddit.com/r/Coronavirus/comments/fqj7lw/data_shows_amazon_raised_prices_during_pandemic/flqrf2l/,Ahaha fuck Bezos!
