date,author,subreddit,score,url,text
2020-02-06,Cosmicpixie,Coronavirus,6,https://www.reddit.com/r/Coronavirus/comments/ezvs2k/how_are_young_people_dying_from_this/fgpt8bx/,"Coronaviruses typically cause colds. This particluar one, 2019-nCoV, is more than a cold. It's a fairly lethal viral pneumonia. It has an affinity for certain ACE receptors, which are prominent in the lungs, intestines, and kidneys. It hits those tissues hardest, culminating in respiratory and kidney failure in the worst cases. Because it has an affinity for the gut, there can be GI symptoms. The virus is not just shed from mucosa of the respiratory tract, it is shed by the gut and spread through vomit and the fecal-oral route as well. It is rumored to have an affinity for the epithelia of the eye but I'm not well read on that yet. 20% of the infected require ICU care and roughly 4% die. 

It has an R naught of about 4, meaning each infected person goes on to infect 4 others. R naught is not deterministic--it is impacted by quarantines and isolation. These measures will help. Incubation period of up to 14 days but usually shows up in 5. Unclear if it can spread when asymptomatic. Some cases indicated that could happen, later turns out the case subject was taking fever reducers (so was actually symptomatic). 

Air travel is a slow rolling nightmare. We are weeks behind the data because of a lag in test results and lack of testing kits in China. China is not at all transparent about the actual number of cases or dead. The mortality rate can rise over time, especially if hospitals become overwhelmed. The mortality rate of SARS rose over time from 3.5% at the start to 10% at the end of its run. Only time will tell how this goes. So far it is more infectious than flu and SARS. It has infected more people in one month than SARS did in 9 months.

This is not a flu."
2020-02-06,Otadiz,Coronavirus,6,https://www.reddit.com/r/Coronavirus/comments/f0168f/a_train_wreck_in_slow_motion/fgqu9tl/,"That's exactly what it is and individuals spouting off shit like ""the flu is worse"" or ""it won't be a problem here"" clearly do not understand the social and economic hits this will have, on top of any health ones and are doing nothing to help the situation.

Yes you read that correctly.  You know who you are.  Quit fucking down playing the situation to make yourself and others FEEL better.

This is a very real threat and it needs to be taken very seriously.  Your down playing is getting directly in the way of proper preparation."
2020-02-06,LeftistsAreBigots,Coronavirus,6,https://www.reddit.com/r/Coronavirus/comments/f0186r/the_corona_effect_why_the_coronavirus_outbreak_is/fgqv54v/,"""This viral advertisement paid for by Corona""

But also, no, dead and sick people generally aren't drinking a lot of beer."
2020-02-06,gravitybee1,Coronavirus,6,https://www.reddit.com/r/Coronavirus/comments/f00x5f/if_this_virus_is_so_bad_and_deadly_where_are_all/fgquojd/,It started early December in Wuhan.   It's only been 2 weeks for the rest of world.
2020-02-06,InsomniaticMeat,Coronavirus,6,https://www.reddit.com/r/Coronavirus/comments/f01rnq/will_it_spread_in_the_us/fgqzz1v/,"I did not realize how densely populated India was. I knew it was heavily populated, but not to this degree."
2020-02-06,CryptoKingPrawn,Coronavirus,6,https://www.reddit.com/r/Coronavirus/comments/f01hfp/is_this_true_i_mean_it_seems_a_little_outlandish/fgqw9uw/,That is probably an underestimate
2020-02-06,ToiletPlungerOfDoom,Coronavirus,6,https://www.reddit.com/r/Coronavirus/comments/f02uov/lets_name_the_virus/fgr81ce/,Wu Tang Flu
2020-02-06,smackson,Coronavirus,6,https://www.reddit.com/r/Coronavirus/comments/ezzffk/7000_people_on_those_quarantined_cruise_ships/fgr8je0/,"I think the person you responded appropriately stated the ""sampling"" caveat about their 61/273 percentage ....

So I think your holier-than-though re-stating of it was unnecessarily condescending.

In Internet parlance: you don't gotta be such a dick about it."
2020-02-06,BurrShotFirst1804,Coronavirus,6,https://www.reddit.com/r/Coronavirus/comments/ezztrq/what_if_the_people_that_have_recovered_are_still/fgqn130/,"The reason HIV stays around is that it integrates itself into your own CELLS DNA through very specific proteins called integrase and a specific protein that turns itself from RNA to DNA. This way, it is able to hide for years in you own DNA before reactivating. Your immune system cannot find it. Coronaviruses and nCov do not have integrase or the protein used to turn RNA(what the virus is) into DNA. So no, this cannot work."
2020-02-06,jgt23,Coronavirus,6,https://www.reddit.com/r/Coronavirus/comments/f0095p/a_message_to_all_the_ccp_shills_freelance_or/fgqpm5k/,It would hilarious if they tried to follow your instructions.
2020-02-06,Queencitybeer,Coronavirus,6,https://www.reddit.com/r/Coronavirus/comments/ezxz9n/if_the_corona_virus_was_a_movie/fgq7bsy/,Bat Soup
2020-02-06,Brother_YT,Coronavirus,6,https://www.reddit.com/r/Coronavirus/comments/f03zj7/nothing_to_see_here_guys_its_just_the_flu/fgrekgs/,"But it is... very much is. All the data even shows it is. Heck, just look at the measures China is taking to stop it. This wouldn’t be done if it wasn’t worse than the flu."
2020-02-06,marketjoe72,Coronavirus,6,https://www.reddit.com/r/Coronavirus/comments/f009yk/yes_worry_about_coronavirus_those_saying_its_just/fgqot8a/,😂
2020-02-06,jgt23,Coronavirus,6,https://www.reddit.com/r/Coronavirus/comments/f0095p/a_message_to_all_the_ccp_shills_freelance_or/fgqqg66/,"No, actually it's the perfect example of a totalitarian government sacrificing the lives of its people for the party's image and the wealth of the oligarchs. But, deep inside you know that already."
2020-02-06,ne0ndistraction,Coronavirus,6,https://www.reddit.com/r/Coronavirus/comments/f0470q/so_california_now_texas_and_nebraska/fgrfwgq/,"Me too! I barely tuned in for Ebola! And I agree, they don't have a clue, which I understand as it's a new virus. But it seems like they're keeping us in the dark, just like China. Where are the test results I've been waiting to hear for 6 days (in TX)? And now there's another one in TX (which I'm about to post about). 

I have really good intuition as well and this shit is just on my radar. I am really hoping I'm wrong too."
2020-02-06,mu5tardtiger,Coronavirus,6,https://www.reddit.com/r/Coronavirus/comments/f04jpr/i_hope_this_helps_everyone/fgrh9sr/,"can we stop comparing this to the common Flu please? thanks.

&#x200B;

its a novel virus. start treating it like one."
2020-02-06,asswaxer,Coronavirus,6,https://www.reddit.com/r/Coronavirus/comments/f04qjv/wuhan_nurses_stop_to_eat_lunch_talk_about_their/fgrhyxp/,"Ah good ol' CGTN material from the motherland. Thank you comrade, I do miss the chairman so"
2020-02-06,Alcapachino,Coronavirus,6,https://www.reddit.com/r/Coronavirus/comments/f00x5f/if_this_virus_is_so_bad_and_deadly_where_are_all/fgqswbr/,Exactly. Don’t forget the poor lungs of people that have been living in smog like areas for a long time (and smoke sometimes themselves)
2020-02-06,Ron-Don-Volante,Coronavirus,6,https://www.reddit.com/r/Coronavirus/comments/f00or0/is_wuhan_lost_now_theyre_spraying_it_with/fgqrevz/,"The city was actually spraying the ""disinfectant"" as early as the first week of January.

It is just another attempt to sterlize surfaces en masse"
2020-02-06,KatzaAT,Coronavirus,6,https://www.reddit.com/r/Coronavirus/comments/ezx1l2/mask_hoarding_doesnt_really_make_any_sense_to_me/fgq0xq7/,"The virus may be small, but does not travel on it's own. It is carried by small drops of fluids, like saliva, which can be filtered out."
2020-02-06,GamingTaylor,Coronavirus,6,https://www.reddit.com/r/Coronavirus/comments/ezwv83/we_are_sorry_that_due_to_the_influence_of/fgq0l5a/,"Lmao, I order a bunch of small gifts from china a month or two prior to each holiday, and then a separate bigger gift. I feel like its more rewarding that way, and i don't mind if the China stuff ever arrives, sometimes it arrives a month afterwards, but its still a nice surprise for her.

The point of the topic was that I was surprised manufacturers in china are telling people there's going to be major delays due to the virus."
2020-02-06,donotgogenlty,Coronavirus,6,https://www.reddit.com/r/Coronavirus/comments/ezxsy4/chinese_reporter_qiushi_chen_has_gone_missing/fgquzwd/,He's a hero. He had balls of steel taking the CCP on and his mind is resilient. I wish him all the strength he needs to beat that insidious virus and the coronavirus.
2020-02-06,one2zerojigawat,Coronavirus,6,https://www.reddit.com/r/Coronavirus/comments/ezxsvl/friend_in_wuhan_stranded_in_apt_with_no_access_to/fgq79m5/,Might as well do nothing.
2020-02-06,inflames216,Coronavirus,6,https://www.reddit.com/r/Coronavirus/comments/ezxp01/anyone_else_tired_of_seeing_the_2_mortality_rate/fgq5ofm/,Its roughly 6% I reckon
2020-02-06,Hafomeng,Coronavirus,6,https://www.reddit.com/r/Coronavirus/comments/f01vx4/update_638_dead_31439_infected/fgqzh3i/,"So if the numbers are falling & they're fake, what's the big brain play?"
2020-02-06,kolbywashere,Coronavirus,6,https://www.reddit.com/r/Coronavirus/comments/ezy7ha/have_there_been_any_reports_of_the_virus_mutating/fgq8tqj/,Let me ask Splinter and Donatello they are more versed in virus mutations than I.
2020-02-06,Fattybobo,Coronavirus,6,https://www.reddit.com/r/Coronavirus/comments/ezyrgx/government_not_being_transparent_with_case/fgqekkm/,What did you say? Maybe better to DM me that ;)
2020-02-06,throwaway224,Coronavirus,6,https://www.reddit.com/r/Coronavirus/comments/ezzffk/7000_people_on_those_quarantined_cruise_ships/fgr57y1/,"They've tested 273 and 61 have come back positive.  That's about a 25% positive rate, innit?  (61/273 = .223 so not quite 25%)  Of course they did people who might be sick or were around the infected person first, but still.  22.3% of suspected cases confirmed seems pretty high."
2020-02-06,metametapraxis,Coronavirus,6,https://www.reddit.com/r/Coronavirus/comments/ezzffk/7000_people_on_those_quarantined_cruise_ships/fgr745u/,"I think the insurance provider might decline to cover, somehow...."
2020-02-06,tonnenmeter,Coronavirus,6,https://www.reddit.com/r/Coronavirus/comments/f02zuw/twitter_user_trying_to_show_reported_data_is/fgr74uj/,Do you want to predict the numbers in the past? That doesn't make sense
2020-02-06,Diseased_Raccoon,Coronavirus,6,https://www.reddit.com/r/Coronavirus/comments/f02hol/61_on_cruise_ship_in_japan_now_positive_and_china/fgr5adx/,"This doesn't mean much, cruise ships are basically giant floating petri dishes, and dont show a whole lot about what'll happen outside of it. I absolutely dont think China has anything under control, but this doesn't really show anything."
2020-02-06,ShartSqueegee,Coronavirus,6,https://www.reddit.com/r/Coronavirus/comments/f02hol/61_on_cruise_ship_in_japan_now_positive_and_china/fgr6lao/,"I think it’s going to catch people off guard after being reassured over and over again by the media, too.  Then, that’s when panic begins."
2020-02-06,multiple4,Coronavirus,6,https://www.reddit.com/r/Coronavirus/comments/f02hqf/41_new_corona_virus_cases_on_board_yokohama/fgr6qao/,"I mean as long as they're being quarantined there's no need to take them off the ship. At least right now they've essentially got a floating quarantine ship which with supplies being delivered can easily sustain itself and take care of the passengers for an indefinite amount of time. I'm sure there are health officials who are directing the quarantine on the ship making sure everything is done with caution not to spread the virus to those who don't have it

I honestly think keeping everyone on the cruise ship other than those who are confirmed to have the virus is a good idea"
2020-02-06,rossionq1,Coronavirus,6,https://www.reddit.com/r/Coronavirus/comments/f037zk/regarding_countries_that_havent_reported_any/fgr8oxt/,"China has been majorly investing and building infrastructure in Africa over the past decade from what I understand. While not tourists, workers and businessmen transmit just as effectively"
2020-02-06,asswaxer,Coronavirus,6,https://www.reddit.com/r/Coronavirus/comments/f03726/武汉加油/fgr7s92/,"Comrade, I think these people only read English"
2020-02-06,ejpusa,Coronavirus,6,https://www.reddit.com/r/Coronavirus/comments/ezyrgx/government_not_being_transparent_with_case/fgqfin5/,"Panic is perceived by government(s) and urban cities as far worse than the Virus itself. Just how it has to be. People panic. Just how we're built. Cities are not set up to deal with that.

Contagion, the must-see film goes into this a lot. It mirrors this epidemic so close. It's spooky.

""No one must know, or everyone knows at once.""  There is no middle ground.  From the film:

[https://www.youtube.com/watch?v=4sYSyuuLk5g](https://www.youtube.com/watch?v=4sYSyuuLk5g)"
2020-02-06,BoyYeetzWorld,Coronavirus,6,https://www.reddit.com/r/Coronavirus/comments/ezwoe6/walmart_pick_has_never_been_better/fgpybls/,"I’ve converted my garage into a nursery and grow my own food.  Also have goats and chickens now for fresh milk, eggs and meat.  We can only pray this plague doesn’t infect my garden"
2020-02-06,roarshocking,Coronavirus,6,https://www.reddit.com/r/Coronavirus/comments/ezzdhm/johns_hopkins_nuzzo_says_current_approach_to/fgqhqhi/,Does she say what will work? Or is she just another **Doomer.** Am I doing it right?
2020-02-06,th3allyK4t,Coronavirus,6,https://www.reddit.com/r/Coronavirus/comments/ezyrgx/government_not_being_transparent_with_case/fgqiva0/,Welcome to the world of free speech. Yeah it’s hard to keep a level temperament when the shills are all over you.
2020-02-06,tmybr11,Coronavirus,6,https://www.reddit.com/r/Coronavirus/comments/ezwqam/china_sacrifices_a_province_to_save_the_world/fgpz61i/,"This makes them look so altruistic but the truth is they did this not to save the world but to save the rest of the country's industry. No, the CCP doesn't care about the rest of the world, they barely care about their own people."
2020-02-06,mu5tardtiger,Coronavirus,6,https://www.reddit.com/r/Coronavirus/comments/f0455p/body_bags_line_the_halls/fgrercy/,i was banned from china\_flu for speaking out and helping people get their videos posted online. keep posting brother.
2020-02-06,anon7935678,Coronavirus,6,https://www.reddit.com/r/Coronavirus/comments/f03oxj/41_new_cases_of_coronavirus_on_quarantined_cruise/fgrcr6s/,I read they tested two primary groups 1.  Anyone showing signs and 2. Anyone who was in proximity to patient zero. So hopefully this 368 tested number is from primary high risk group and the positive percentage will be much lower in the now quarantined to their cabins 2700 other passengers.
2020-02-06,LinkUnseen,Coronavirus,6,https://www.reddit.com/r/Coronavirus/comments/f04qjv/wuhan_nurses_stop_to_eat_lunch_talk_about_their/fgri5cu/,A repost of a CCP puff piece.
2020-02-06,MeowNugget,Coronavirus,6,https://www.reddit.com/r/Coronavirus/comments/ezy4kk/panic_genuine_question/fgq939w/,Who is panicking here? I think you're confusing people being very interested in the situation and keeping themselves informed as panic
2020-02-06,Thor442,Coronavirus,6,https://www.reddit.com/r/Coronavirus/comments/ezz1wb/do_you_believe_the_peak_has_been_is_present_now/fgqfk8h/,10 days
2020-02-06,brunus76,Coronavirus,6,https://www.reddit.com/r/Coronavirus/comments/ezywi9/hundreds_americans_quarantined/fgqfrw2/,"Go on the boat, they said. It’ll be fun, they said."
2020-02-06,Middle-Persimmon,Coronavirus,6,https://www.reddit.com/r/Coronavirus/comments/ezywt0/doctor_who_blew_whistle_over_coronavirus_has_died/fgqfbuq/,He's still alive everyone is retracting story .. I'm confused
2020-02-06,SazedMonk,Coronavirus,6,https://www.reddit.com/r/Coronavirus/comments/ezwsyq/wow_lets_take_the_number_of_deaths_and_divide_it/fgpzdg7/,"If Johnny has seven apples left, and Sue gives three apples to Jane, how many people die of the Coronavirus?"
2020-02-06,multiple4,Coronavirus,6,https://www.reddit.com/r/Coronavirus/comments/ezxt4v/they_are_screening_cruise_passengers_now_in_miami/fgqi87o/,"I mean it also actually could stop someone with the virus from boarding a ship. If somebody knows they've been to China in the past month then they shouldn't be getting on the ship anyways and they know that, but a questionnaire may make them rethink whether they really want to lie about it

If you don't ask the questions then someone could just board the ship without telling anybody they've been to China and feel sick, and they'll feel fine about it bc nobody asked

If you ask the question before they get on the ship, then they have to make a conscious choice to lie about it, which for a lot of people just isn't something they're comfortable doing, especially if you lie and then end up having the virus and getting other people sick"
2020-02-06,kellysam401,Coronavirus,6,https://www.reddit.com/r/Coronavirus/comments/ezyrgx/government_not_being_transparent_with_case/fgqinug/,Oh my. The biggest mass quarantine in history. The biggest travel bans ever and YOU COMPARE IT TO THE FLU???
2020-02-06,Trav2016,Coronavirus,6,https://www.reddit.com/r/Coronavirus/comments/ezzffk/7000_people_on_those_quarantined_cruise_ships/fgqo692/,Check this footage out you can go in but no medicine and you sleep on the floor. The hospitals in China that where built are just [death camps.](https://www.youtube.com/watch?v=RdGjm_94ho4) Hope the people on cruise ships don't get forgotten about like those at the Chinese hospitals. I know different situations but also similar.
2020-02-06,Lucynfred,Coronavirus,6,https://www.reddit.com/r/Coronavirus/comments/f0178h/wuhan_authorities_ordered_to_round_up_coronavirus/fgqutbc/,Significant indeed. I’m glad to see the NYTimes giving them the attention Wuhan deserves at this pivotal moment.
2020-02-06,LinkUnseen,Coronavirus,6,https://www.reddit.com/r/Coronavirus/comments/f04r7v/the_flu_has_killed_10000_americans_as_the_world/fgril83/,"""10,000 deaths of millions who have the disease""

Influenza has a 0.095% mortality rate.

nCoV is at least 2-3 times more deadly than that.

stop peddling this nonsense"
2020-02-06,Diseased_Raccoon,Coronavirus,6,https://www.reddit.com/r/Coronavirus/comments/f01zfi/india_34_confirmed_cases_in_india/fgqzsf8/,"Bullshit? It doesn't say that anywhere. I'd bet all of the tests weren't taken at the exact same time. They were probably still waiting on the other 34 when the article was written. Until its actually confirmed, stop spreading bullshit."
2020-02-06,BuyMed,Coronavirus,6,https://www.reddit.com/r/Coronavirus/comments/f02gu9/how_does_self_quarantine_actually_work/fgr5fo6/,It doesn't.
2020-02-06,sidon2k,Coronavirus,6,https://www.reddit.com/r/Coronavirus/comments/ezzffk/7000_people_on_those_quarantined_cruise_ships/fgqq15w/,"...always late to the party, and underdressed. Think your Russian, German, French, Japanese, China & Commonwealth friends might have something say about that."
2020-02-06,Meme-Dropper,Coronavirus,6,https://www.reddit.com/r/Coronavirus/comments/f00p44/is_it_me_or_is_suddenly_alot_of_people_around_you/fgqqw3t/,Your spidie sense is just focused on it at the moment.
2020-02-06,ellavisions,Coronavirus,6,https://www.reddit.com/r/Coronavirus/comments/f02uov/lets_name_the_virus/fgra41r/,"I like Wumonia. 

Saw it on this sub somewhere, but not sure who said it."
2020-02-06,hucifer,Coronavirus,6,https://www.reddit.com/r/Coronavirus/comments/f03b4w/if_we_make_it_to_march_5th_we_not_china_should_be/fgra8r5/,"Your projections are hugely flawed for a couple of key reasons:

1) almost all of the cases outside of China are people who travelled directly from Wuhan. Now that the city is on lockdown and flights to and from China are being grounded, there is no rational reason to expect the number of cases in other countries to continue to increase at the same rate as they have up until now.

2) expecting the number of cases outside of China to follow the same trend as the cases inside China makes no sense at all. The country is on lockdown. People in Wuhan cannot leave and so are forced to stay trapped in their petri dish, greatly increasing the risk of infection for those people. Meanwhile, outside of China, confirmed cases are quarantined and isolated from the population at large in healthcare facilities which are not overwhelmed to the point of collapse, as they are in the worst affected areas in China."
2020-02-06,Iwannadrinkthebleach,Coronavirus,6,https://www.reddit.com/r/Coronavirus/comments/ezxt4v/they_are_screening_cruise_passengers_now_in_miami/fgq65ua/,If you get the virus could you tell us what it's really like
2020-02-06,CryElsewhere,Coronavirus,6,https://www.reddit.com/r/Coronavirus/comments/ezwltu/if_no_one_is_concerned_why_is_every_place_i_have/fgq4dff/,"Yes, they’re everywhere.  Even in peak drywall season.  Hopefully they do run out and I’m the only one without. If everyone else is wearing one, I figure I’m safe as fuck."
2020-02-06,ChetYouarecorrect,Coronavirus,6,https://www.reddit.com/r/Coronavirus/comments/ezxsy4/chinese_reporter_qiushi_chen_has_gone_missing/fgq6sxx/,Jesus christ
2020-02-06,Severe_Clouds,Coronavirus,6,https://www.reddit.com/r/Coronavirus/comments/ezz1wb/do_you_believe_the_peak_has_been_is_present_now/fgqgtsf/,"Actually you are right. The scientist is saying March/April,  with the continued spread worldwide.  Could come back seasonally.   But I imagine that depends on Factors. It depends on if Spring/Summer brings a stop to it."
2020-02-06,Ugabugawugaguga,Coronavirus,6,https://www.reddit.com/r/Coronavirus/comments/ezyhqc/taiwan_evacuated_its_citizens_from_wuhan_and_3_of/fgqeuc4/,Thats crazy. What kind of relationship does Taiwan have with China?
2020-02-06,-----SNES-----,Coronavirus,6,https://www.reddit.com/r/Coronavirus/comments/f02hol/61_on_cruise_ship_in_japan_now_positive_and_china/fgraxvi/,"That’s what it feels like to me.  3 1/2 weeks before collapse.   

I can just feel it.  Somewhere in my being this is a nightmare like nothing before."
2020-02-06,Brother_YT,Coronavirus,6,https://www.reddit.com/r/Coronavirus/comments/f0455p/body_bags_line_the_halls/fgrenzb/,"Thank you. First time I’ve seen it and I believed the truth, no matter how painful, needs to be seen."
2020-02-06,BelaMac,Coronavirus,6,https://www.reddit.com/r/Coronavirus/comments/f03otp/rounding_up_the_infected_for_mass_quarantine/fgrc2lt/,OMG those poor people
2020-02-06,Travis-Cole,Coronavirus,6,https://www.reddit.com/r/Coronavirus/comments/f00hra/trouble_in_the_male_shift_hospital/fgqpn9c/,Did I just assume that hospitals gender? 😂
2020-02-06,sidon2k,Coronavirus,6,https://www.reddit.com/r/Coronavirus/comments/ezzffk/7000_people_on_those_quarantined_cruise_ships/fgqpf27/,"Sorry, who won the war again? Think I miss heard...."
2020-02-06,Dying_Bloodbirds,Coronavirus,6,https://www.reddit.com/r/Coronavirus/comments/ezxsy4/chinese_reporter_qiushi_chen_has_gone_missing/fgqq4xe/,They are losing the Chinese market in the worst way possible right now with everybody dying left and right
2020-02-06,hodlx,Coronavirus,6,https://www.reddit.com/r/Coronavirus/comments/f00p44/is_it_me_or_is_suddenly_alot_of_people_around_you/fgqqryq/,I have a cold and I usually never get sick. First cold in 10 years. But it may be unrelated still. Some years more people have colds
2020-02-06,Gamingdad94,Coronavirus,6,https://www.reddit.com/r/Coronavirus/comments/ezzvca/as_a_chineseamerican_im_scared/fgqnxc7/,"Im white, I wouldnt call myself rasict as I have friends of many backgrounds but I would be extra cautious just on the fact maybe a close friend or family member frequents china in your household or something, like if I see an Indian, white or black guy I have a gut feeling them or their family wouldn't go to china."
2020-02-06,Jonny_Osbock,Coronavirus,6,https://www.reddit.com/r/Coronavirus/comments/f009yk/yes_worry_about_coronavirus_those_saying_its_just/fgqorl7/,It says not in europe but nothing about uk...
2020-02-06,Stoaticor,Coronavirus,6,https://www.reddit.com/r/Coronavirus/comments/f0095p/a_message_to_all_the_ccp_shills_freelance_or/fgqp5z4/,"Watch as someone from r/sino screenshots this post and posts it over in that vile sub. ""OmG AmErIcA sO mEaN and XeNoPhObIc"" then they'll continue to post about some random, irrelevant shit that they think is important."
2020-02-06,feudalismforthewin,Coronavirus,6,https://www.reddit.com/r/Coronavirus/comments/f0168f/a_train_wreck_in_slow_motion/fgqvcu2/,Then shouldn't you be spending every second with your loved ones instead of wasting time on Reddit?
2020-02-06,Brother_YT,Coronavirus,6,https://www.reddit.com/r/Coronavirus/comments/f00n6a/dr_rex_archer_advices_the_kansas_city_officials/fgqryf2/,"So yesterday Kansas City had a parade Where nearly a million attendees were within close quarters with each other. And now we’re being told there’s not threat.

https://www.today.com/video/1-million-attend-kansas-city-victory-parade-for-chiefs-78222405727"
2020-02-06,CosmosMythos,Coronavirus,6,https://www.reddit.com/r/Coronavirus/comments/f00yi9/why_has_a_city_like_nyc_not_seen_any_coronavirus/fgqss40/,Whatever helps you sleep at night I guess.
2020-02-06,howlsofwind,Coronavirus,6,https://www.reddit.com/r/Coronavirus/comments/f02uov/lets_name_the_virus/fgr627v/,Censorona
2020-02-06,th3allyK4t,Coronavirus,6,https://www.reddit.com/r/Coronavirus/comments/ezyrgx/government_not_being_transparent_with_case/fgqizn2/,Brighton U.K. here. So are we. Patient being running about since Sunday with the virus. No word where they went. Who they saw. Luckily I’ve been away since Sunday but people are worried
