date,author,subreddit,score,url,text
2020-02-16,myne,Coronavirus,109,https://www.reddit.com/r/Coronavirus/comments/f51ay3/23_weeks_ago_people_were_commenting_saying_well/fhw8m21/,"What's changed in two weeks?

Truthful Singapore has more than tripled from [18](https://www.straitstimes.com/singapore/health/coronavirus-no-new-confirmed-cases-in-singapore-for-a-second-day) to 75 cases. 

Truthful Japan has tripled from [20](https://www.nippon.com/en/news/l00263/japan-faces-crucial-moment-for-containing-coronavirus.html) to 62 (We're ignoring the poor bastards on the ship)

Probably bullshitting Thailand has almost doubled from [19](https://www.nytimes.com/reuters/2020/02/03/world/asia/31reuters-china-health-thailand.html) to 34.

Magical Indonesia has dodged all bullets like Neo.

So yeah, nothing much happening."
2020-02-16,Scurvey,Coronavirus,99,https://www.reddit.com/r/Coronavirus/comments/f5344a/can_someone_please_explain_to_me_why_people_are/fhwf2la/,Dont bad mouth china. Or else feel the ban hammer.
2020-02-16,maryjanekronik,Coronavirus,58,https://www.reddit.com/r/Coronavirus/comments/f51ay3/23_weeks_ago_people_were_commenting_saying_well/fhwf3wj/,"> Magical Indonesia has dodged all bullets like Neo.

I just want people to take the time to appreciate this comment, lol."
2020-02-16,Mithmorthmin,Coronavirus,54,https://www.reddit.com/r/Coronavirus/comments/f51eui/its_been_almost_a_week_and_no_new_cases_in_usa/fhw5u73/,How they justify that lol this isnt customer support at  a fucking Hobby Lobby or something.
2020-02-16,BlazenRyzen,Coronavirus,48,https://www.reddit.com/r/Coronavirus/comments/f51g90/chinese_scientists_say_says_covid19_could_have/fhw3yw3/,Could have?  70K subReddit users have been saying that for weeks.
2020-02-16,auhsoj565joshua,Coronavirus,47,https://www.reddit.com/r/Coronavirus/comments/f51lh9/shenzhen_factory_just_told_me_on_hold_till_virus/fhw5i6r/,Typically you don’t want to lose customers so you continue to tell them yeah next week and hope they keep waiting lol.
2020-02-16,Salmonfisher420,Coronavirus,46,https://www.reddit.com/r/Coronavirus/comments/f5344a/can_someone_please_explain_to_me_why_people_are/fhwem1b/,"Getting muted for just about anything, just got off a 7 day mute for calling someone a commie. Never been on a sub with mods completely going against FOS."
2020-02-16,gard-r,Coronavirus,46,https://www.reddit.com/r/Coronavirus/comments/f51lh9/shenzhen_factory_just_told_me_on_hold_till_virus/fhw5oqf/,I’m expecting to hear that many of the factories I work with are still closed.  I’m afraid to check my email right now.
2020-02-16,justanotherwilliam,Coronavirus,46,https://www.reddit.com/r/Coronavirus/comments/f4z817/quinine_tonic_water_use_in_treating_covid/fhvbvoh/,"If you are planning on stocking up on tonic water, I would suggest getting several bottles of gin to go with it too"
2020-02-16,lucasmoten,Coronavirus,44,https://www.reddit.com/r/Coronavirus/comments/f51eui/its_been_almost_a_week_and_no_new_cases_in_usa/fhw3vjp/,"CDC does not give updates on weekends. Info is announced Monday/Wednesday/Friday. Given the holiday weekend, may not get any result updates until Wednesday"
2020-02-16,GroundhogMonth,Coronavirus,36,https://www.reddit.com/r/Coronavirus/comments/f5137a/chinas_coronavirus_figures_dont_add_up_this_never/fhw0zo7/,"Which is something that the people in this subreddit have been saying for weeks. 

And we were labeled “conspiracy theorists” and our posts got systematically deleted."
2020-02-16,prettyinvellum,Coronavirus,36,https://www.reddit.com/r/Coronavirus/comments/f4z9zc/is_the_stock_market_about_to_crash_due_to_this/fhvcnf7/,I’ve sold nearly all my stock holdings due to this crisis. I’m anticipating a catastrophic drop in the coming weeks
2020-02-16,Bifftech,Coronavirus,34,https://www.reddit.com/r/Coronavirus/comments/f4ux33/why_does_it_seem_like_money_is_being_prioritized/fhtuylf/,Are you new to planet Earth?
2020-02-16,JustNewbieThings,Coronavirus,33,https://www.reddit.com/r/Coronavirus/comments/f4y28i/is_this_video_authentic/fhuvbdg/,You are two weeks late on this. Yes it's real.
2020-02-16,fizx1,Coronavirus,33,https://www.reddit.com/r/Coronavirus/comments/f53cbv/us_hospitals_are_not_testing_people_so_what_do_we/fhwgkd7/,I'm afraid we won't know local epidemics are happening until we see spikes of pneumonia cases at ERs and it's already too late.
2020-02-16,beefly,Coronavirus,31,https://www.reddit.com/r/Coronavirus/comments/f4ux33/why_does_it_seem_like_money_is_being_prioritized/fhtyrod/,"I honestly had no idea how reliant I was on a healthy economy for just ""living"" until I had to live through Super Storm Sandy.  Everyone had stock piled food, water, generators.. we were ready.  Batteries were charged, liquor was on the ready, and we thought we were good for a solid week in the neighborhood.  I was very wrong.

We lost electricity for 2 weeks, but half way through that we ran out of gasoline for the generators.  There were no gas stations open within an hour drive, no shipments of food going to the grocery stores because the electric was out, and cars were abandoned on the roads from running out of gas.  The heat in our house was out and my 6 month old was wrapped with blankets.  I live in a nice area, but people started looting houses... and neighborhoods put up signs saying that looters would be shot.  Some fed agency organized delivery of dry ice for helping prevent food from spoiling.  We were legitimately stuck, and it was terrifying.

All of these systems are connected.  If someone stays home, who is delivering your food?  Who is at your gas station?  Who is maintaining your water systems?  If the kids stay home from school then parents cant go to work.  Those same parents may be working at the factory  that makes medication or masks.  If the doctors have to stay home to watch their kids, who is at the emergency room?  You can see how this is all connected.

I considered myself ""prepared"" for the fallout of that hurricane.  I had guns, gas, and food... didn't matter.  1 week into a lock down without the community going to work and it all falls apart... fast.  First few days are kinda fun and different, but then your neighbor comes over asking for food or water and things change quickly.

I know this sounds crazy, but I actually had shared your view at one point in time.  Seeing it fall apart first hand in the most unexpected ways was eye opening for me."
2020-02-16,Dmakor,Coronavirus,31,https://www.reddit.com/r/Coronavirus/comments/f532j8/can_we_please_stop_downplaying_the_situation/fhweja8/,"I think this is the last place you need to tell people to stop downplaying the situation. If anything, people here are already acting like 3/4 of the world is infected."
2020-02-16,myne,Coronavirus,30,https://www.reddit.com/r/Coronavirus/comments/f51ay3/23_weeks_ago_people_were_commenting_saying_well/fhw9fvs/,"Actually, Singapore has quadrupled. My bad.

If it keeps quadrupling every 2 weeks, 100% of the country is infected by June 8."
2020-02-16,Molnutz,Coronavirus,29,https://www.reddit.com/r/Coronavirus/comments/f519df/good_news_suspected_cases_down_from_28k_a_week/fhw2fq3/,Assuming these numbers are accurate.
2020-02-16,baconn,Coronavirus,28,https://www.reddit.com/r/Coronavirus/comments/f5344a/can_someone_please_explain_to_me_why_people_are/fhwg879/,"If China made the virus, it would have broken by now."
2020-02-16,kartunmusic,Coronavirus,28,https://www.reddit.com/r/Coronavirus/comments/f51zl8/it_is_important_to_distinguish_covid19_from/fhw7fba/,It's either hide it as a flu and treat the worse or have every Karen in the country take there kids with the sniffles to the er and clog our system.
2020-02-16,dudleydorightorwrong,Coronavirus,28,https://www.reddit.com/r/Coronavirus/comments/f51eui/its_been_almost_a_week_and_no_new_cases_in_usa/fhw4lry/,"CDC only gives updates on m,w,f??  You gotta be shittin me!  We are in a Global Pandemic Emergency according to W.H.O. right?  Unbelievable!"
2020-02-16,alfa80211,Coronavirus,28,https://www.reddit.com/r/Coronavirus/comments/f4y57t/i_work_in_a_major_academic_hospital_in_the_us/fhv3rp5/,"I’m a data scientist, not a Dr. But I had zero fear over Ebola because I didn’t think it could spread to the US. With Corona Virus I seriously think it is going to be so bad the government just does not want to scare anyone.
Any time you used to see my grandad, he would always talk about WWII, I think one day my kids will say “grandad tell us your stories about the great virus of 2020”. This is about to rock our world. But the way bureaucrats work, and the lies from the CCP mean we are totally unprepared - prepare yourself by buying food supplies etc"
2020-02-16,Rummie123,Coronavirus,27,https://www.reddit.com/r/Coronavirus/comments/f4ypmi/schools_in_brighton_hove_and_eastbourne_have_told/fhv60fb/,If that happens here in the states I will be taking my boys out of school if the administrators are understanding or not.
2020-02-16,bbbbbbbbbb99,Coronavirus,27,https://www.reddit.com/r/Coronavirus/comments/f4sxfl/cv_is_no_joke/fhu57jl/,"I'd actually prefer to be in Japan and sick than the US.

The health care system is infinitely better in Japan.

Oh and the population LISTENS unlike America.  So idiots won't just take off their masks and say fuck you like they would in the US."
2020-02-16,Otadiz,Coronavirus,27,https://www.reddit.com/r/Coronavirus/comments/f51evq/cv_is_no_joke/fhw47b3/,"This looks real similar to a post by another user...

Yah, here it is. https://www.reddit.com/r/Coronavirus/comments/f4sxfl/cv_is_no_joke/

Something going on here...."
2020-02-16,Sandybagicus,Coronavirus,26,https://www.reddit.com/r/Coronavirus/comments/f5344a/can_someone_please_explain_to_me_why_people_are/fhwfiij/,""" **the fact that COVID19 is a possible**  ""

if it's still a possibility, then it's speculation, not fact."
2020-02-16,Famous_Cryptographer,Coronavirus,26,https://www.reddit.com/r/Coronavirus/comments/f50876/is_reddit_full_of_doomers_or_are_we_actually_all/fhvuebd/,You shouldn't ask on reddit. People act like they know but at the end of the day no one knows anything. We will see. Way too much information and the flood of it mixes into a big mush which has no saying whatsoever
2020-02-16,dankhorse25,Coronavirus,26,https://www.reddit.com/r/Coronavirus/comments/f4z4rd/the_nhs_is_preparing_for_50_of_the_uk_to_become/fhvaplv/,There is 0 chance that NHS will not collapse the moment massive amounts of people have to go to the ICU.
2020-02-16,sweetchillileaf,Coronavirus,26,https://www.reddit.com/r/Coronavirus/comments/f516ec/355_on_cruise_infected_by_1_person_yet_we_are/fhw1vi2/,"You wont find  cases if you wont test for them. 

In most countries there are still policies in place that you wont get tested unless you traveled to hubei/sometimes mainland  china in the last 2 weeks or had a direct close contact with the confirmed case. End off."
2020-02-16,Intense_Resolve,Coronavirus,25,https://www.reddit.com/r/Coronavirus/comments/f4v911/one_out_of_ten_people_on_earth_right_now_is_under/fhu14ea/,"People are busting on you .. but two months ago this wasn't even a thing.  At all.  I've only been here for 18 days and the shit is way worse even in that short a period of time ...

Shit, the first death from coronavirus was only on January 11th, .. like 36 days ago, and look where we are now ..."
2020-02-16,Bumpy_Nugget,Coronavirus,25,https://www.reddit.com/r/Coronavirus/comments/f4x9zo/could_this_be_good_for_the_western_worlds/fhukydf/,"It will take ten years to move these industries.


The raw materials are made in China

The products are made in China

The machines to make the products are made in China

The machines to make the machines are made in China."
2020-02-16,BlazenRyzen,Coronavirus,25,https://www.reddit.com/r/Coronavirus/comments/f4yrvo/there_are_currently_71223_confirmed_cases/fhv631r/,We are already there in Reality..
2020-02-16,flamingnoodles5580,Coronavirus,25,https://www.reddit.com/r/Coronavirus/comments/f513zm/nursing_101_caring_for_your_loved_ones_at_home/fhw490y/,"As a home health physical therapist, this is gospel. Thank you for this."
2020-02-16,Canadianized,Coronavirus,25,https://www.reddit.com/r/Coronavirus/comments/f51lh9/shenzhen_factory_just_told_me_on_hold_till_virus/fhwagww/,What’s in the box?!!! -brad pitt
2020-02-16,dgrfe,Coronavirus,24,https://www.reddit.com/r/Coronavirus/comments/f51zl8/it_is_important_to_distinguish_covid19_from/fhw7v2o/,I hate Karen.
2020-02-16,Jeff-in-Bournemouth,Coronavirus,24,https://www.reddit.com/r/Coronavirus/comments/f4zwx1/do_you_feel_like_the_movie_titanic/fhvmi1l/,"Cognitive dissonance , normalcy bias, and cultural gravity.

Well documented and explains the inability of most people to face the potential of a very unpleasant new reality."
2020-02-16,archamedeznutz,Coronavirus,24,https://www.reddit.com/r/Coronavirus/comments/f4wncp/doctor_from_new_york_says_6_confirmed_cases_being/fhum1fk/,"You know you're being misleading by labeling this guy a ""Doctor,"" right? Sure he says he has a PhD and you can make a pedantic case that therefore he is indeed a doctor. However, given the subject under discussion not clarifying that the guy has an irrelevant PhD and not an MD seems like you almost intend to be deceptive here. Why?"
2020-02-16,Stoaticor,Coronavirus,24,https://www.reddit.com/r/Coronavirus/comments/f51lh9/shenzhen_factory_just_told_me_on_hold_till_virus/fhw74jt/,Please check and let us know!
2020-02-16,Glass-Country,Coronavirus,24,https://www.reddit.com/r/Coronavirus/comments/f4yrvo/there_are_currently_71223_confirmed_cases/fhv5tua/,I predict 100 thousand cases or more by next weekend.
2020-02-16,chuckymcgee,Coronavirus,23,https://www.reddit.com/r/Coronavirus/comments/f5097w/whats_your_immunityboosting_regimen/fhvrhw3/,"1. Don't be fat
2. Don't smoke
3. Exercise regularly for 1-2 hours a day most days of the week
4. Sleep 8-9 hours a day
5. Eat 1-2 lbs+ of green vegetables
6. Don't eat much crap"
2020-02-16,candleflyonline,Coronavirus,23,https://www.reddit.com/r/Coronavirus/comments/f4xluj/dr_campbell_we_could_be_in_the_early_stages_of_a/fhv5mud/,Dr. John is an international treasure. He lays the truth down in low-tech methods
2020-02-16,wtwv,Coronavirus,23,https://www.reddit.com/r/Coronavirus/comments/f50876/is_reddit_full_of_doomers_or_are_we_actually_all/fhvqg0o/,"Look at China's actions, not their words.

We're screwed."
2020-02-16,vCazzi,Coronavirus,23,https://www.reddit.com/r/Coronavirus/comments/f4wuw5/just_some_lifestyle_tips/fhugzzn/,"“Sneeze openly” wtf kind of tip is that, I know your looking to best protect yourself and your family but the best way to do that is to keep everyone from getting sick, sneezing openly is going to allow the droplets into the air and settle on nearby surfaces causing danger for anyone around, cmon man"
2020-02-16,gard-r,Coronavirus,23,https://www.reddit.com/r/Coronavirus/comments/f50vez/dont_be_the_first_one_to_get_caught_by_the/fhvyvxt/,I’m in supply chain too and my company sources from China and one of our oem customers is losing their shit right now.
2020-02-16,stavd3,Coronavirus,22,https://www.reddit.com/r/Coronavirus/comments/f51eui/its_been_almost_a_week_and_no_new_cases_in_usa/fhw42p5/,"I feel like people are alleging that the authorities are covering it up. And that's understandable, given the relative lack of communication. But that leads people to ignore the two (in my opinion) likelier scenarios: A.) that people have it, but haven't developed symptoms, or B.) that the quarantine is more effective than people give it credit for."
2020-02-16,ciabattabing16,Coronavirus,22,https://www.reddit.com/r/Coronavirus/comments/f4sxfl/cv_is_no_joke/fhu1mon/,"I imagine Japan, ignoring the proximity to China and possible influx of patients, would be THE best place to go outside of the US. They probably have some kind of drone doctor robots using some new age high tech lasers and shit to help OPs family. They usually have their shit together. Hell even their streets and toilets clean themselves."
2020-02-16,the_jetset,Coronavirus,22,https://www.reddit.com/r/Coronavirus/comments/f51lh9/shenzhen_factory_just_told_me_on_hold_till_virus/fhw7h98/,"My business partner from Taiwan just wrote me this.   We are all in the same boat.   Things are going to start to get hairy in retail and manufacturing:

""GuanZhou was sealed last Wednesday, Shenzhen last Thursday & Dongguan last Friday.  It takes at least 14 days quarantine-period before people can leave their home.  The fast they can start production would be early March."""
2020-02-16,Molnutz,Coronavirus,22,https://www.reddit.com/r/Coronavirus/comments/f51ay3/23_weeks_ago_people_were_commenting_saying_well/fhw325t/,"Remindme! 3 weeks. 

In 2-3 weeks, we'll have this back and forth again. Except the numbers will be higher. It's not over until it's over."
2020-02-16,Otadiz,Coronavirus,22,https://www.reddit.com/r/Coronavirus/comments/f50r4m/if_you_cant_provide_evidence_backing_up_your/fhvznkl/,"There's a flip to that; ""Don't be the sucker who was left unprepared because you chose to ignore what's screaming in your face."""
2020-02-16,valgal1986,Coronavirus,22,https://www.reddit.com/r/Coronavirus/comments/f51ay3/23_weeks_ago_people_were_commenting_saying_well/fhw2u1g/,It's being majorly censored by world government to avoid panic. All the prediction tables I have seen have been pretty spot on. If it continues at this mathematical rate it is only a matter of time until you will see wide spread global infections....probably 2 months is my own belief
2020-02-16,planetdaily420,Coronavirus,22,https://www.reddit.com/r/Coronavirus/comments/f4y57t/i_work_in_a_major_academic_hospital_in_the_us/fhuzs0z/,"I also work in hospitals, direct patient care, home health, etc and no one is talking about it. I am frustrated right now actually. I have talked about this on my page  A LOT on facebook and all I get is that I am ""Worrying too much"", ""stressing myself out"" and that I am getting too ""deep into conspiracy"". I state nothing on ""conspiracy"" other than I think China lies about numbers. I am irritated at this point. At work I feel like there is the attitude of ""well, that's them and not me so I don't care honestly"". They seem to look at China as they deserve it or ""whatever"". In speaking to my PT friend she is the ONLY one that agrees we all should be concerned."
2020-02-16,monolim,Coronavirus,21,https://www.reddit.com/r/Coronavirus/comments/f51lh9/shenzhen_factory_just_told_me_on_hold_till_virus/fhw6m0d/,"from my provider:
""Yes, the coronavirus is real crazy. But we are handling this, and we can.

As you know, Chinese people always have the power to handle every outbreak. 


Two hospitals name Fire God and Thunder God already built in 10 days, and they both are functioning now.  All patients will be cured there. 


We are affected indeed. To cut off the spreading of coronavirus, we are informed not back to work, and stay at home. So we cannot produce nowadays.

But, this situation will be over soon, our government is so powerful that we can face any outbreak. Please don’t worry about it!""

I guess it will be a while...  their gvt is hidding so much they dont know shit about things."
2020-02-16,wtwv,Coronavirus,21,https://www.reddit.com/r/Coronavirus/comments/f51lh9/shenzhen_factory_just_told_me_on_hold_till_virus/fhw6sb4/,Unfortunately that's how it works.
2020-02-16,Molnutz,Coronavirus,21,https://www.reddit.com/r/Coronavirus/comments/f5020n/russian_border_current_status/fhvo04q/,"In Soviet Russia, land border shuts you"
2020-02-16,SecretAccount69Nice,Coronavirus,21,https://www.reddit.com/r/Coronavirus/comments/f50r4m/if_you_cant_provide_evidence_backing_up_your/fhvxs5e/,"Many of these reports have turned out to be true.  Instantly believing something you read on the internet is foolish, but so is instantly discounting it."
2020-02-16,unchainedcitizen,Coronavirus,21,https://www.reddit.com/r/Coronavirus/comments/f51eui/its_been_almost_a_week_and_no_new_cases_in_usa/fhw7cgx/,"Four family members. High fever, one dangerously high, mild cough, extreme fatigue and mild cold like symptoms. Up to day three of fever.

First called the health line, they know 'something' is spreading, also said it could be because of awareness, but she seemed to be leaning towards COVID, given the volume. She said they won't test, but we had to take the seven year old to emergency 

Hospital refused to test, all they did was rule out menigitis in the seven year old

Who the fuck knows if they won't test"
2020-02-16,Luffysstrawhat,Coronavirus,20,https://www.reddit.com/r/Coronavirus/comments/f4z6jx/chinese_doctors_say_wuhan_coronavirus_reinfection/fhvb1rf/,"On the COVID2019 subreddit they already ripped this article to shreds and exposed several inconsistencies.
post here:
https://www.reddit.com/r/COVID19/comments/f4hxgu/is_there_any_truth_to_these_findings_its_so_hard/"
2020-02-16,BelterLivesMatter,Coronavirus,20,https://www.reddit.com/r/Coronavirus/comments/f4uo6n/i_just_flew_to_seattle_after_spending_almost_3/fhtvlmv/,"Welcome back home, I hope you and your virus had a good trip!"
2020-02-16,SentientDookie,Coronavirus,20,https://www.reddit.com/r/Coronavirus/comments/f5097w/whats_your_immunityboosting_regimen/fhvt0ta/,"Damn... based off this list, my ass Is grass."
2020-02-16,stavd3,Coronavirus,19,https://www.reddit.com/r/Coronavirus/comments/f4z4rd/the_nhs_is_preparing_for_50_of_the_uk_to_become/fhvc5tl/,"A couple things worth noting:

1. First off, preparing for 50% of the population to be infected does not mean they think it will. This is most likely preparing for the absolute worst case scenario.
2. The death rate, even in a situation where hospitals are overwhelmed, would not be anywhere close to 20%+. The current rate of mild cases alone [is 80%](https://www.washingtonpost.com/health/most-coronavirus-cases-are-mild-complicating-efforts-to-respond/2020/02/12/213603a4-4dc2-11ea-bf44-f5043eb3918a_story.html), so unless literally every single person who doesn't have a mild case drops dead without medical attention, 20% is an overestimate. This is not to mention the fact that coronavirus seems to be milder outside China.
3. I wasn't going to be to harsh until you called WW1 and WW2 ""minor events"". Are you fucking trolling? WW2 alone killed \~80 million people. That's more than the population of the UK in the first place! If you seriously think coronavirus will not only kill more than 80 million people, but will kill so many people that it will blow that figure ""out of the water"", then I don't know what to say.

If you think that both of the world wars were ""minor events"", then you obviously have no sense of perspective. Stop it."
2020-02-16,stavd3,Coronavirus,19,https://www.reddit.com/r/Coronavirus/comments/f51g90/chinese_scientists_say_says_covid19_could_have/fhw4dvj/,"I know this post is gonna get flooded with ""I knew it!"" type comments, but I find this hard to believe if the only source is one Chinese scientist who said it *might* have happened."
2020-02-16,Acrobatrn,Coronavirus,19,https://www.reddit.com/r/Coronavirus/comments/f4y57t/i_work_in_a_major_academic_hospital_in_the_us/fhuzcb3/,I'm a nurse and none of my coworkers are concerned.  I've asked a few if they are following the virus.  They all say its just another virus like influenza.   I follow COVID but I'm not sold it's going to be widespread in America.  I feel the economic impact will be bigger.
2020-02-16,oddlikeeveryoneelse,Coronavirus,19,https://www.reddit.com/r/Coronavirus/comments/f51lh9/shenzhen_factory_just_told_me_on_hold_till_virus/fhw7210/,"Everyone in multiple regions (Hangzhou Shanghai Jiangsu Ningbo Qingdao) all say basically the same. They are told by govt they can open the 16th or 17th or 18th but it may be end of February, TRANSLATION THEY EXPECT EARLY MARCH.  That is being able to open the factory building, 

However one supplier in Hangzhou explained further there are currently without workers as office and factory workers are non local people. And there are also no truck drivers to deliver finished goods to port. And the trains are shut down currently, so no one non local is returning from CNY. And when people do come to Hangzhou they are quarantined two weeks. Currently in Hangzhou there are no buses or taxi or ride share allowed. Only one person from each household is allowed to leaved every two days to buy food.

I personally think things may ease up in Ningbo and Qingdao before the rest as they are further from the worst of the outbreak. But that is based on nothing except knowing that the provinces are all acting independently of the others in the details of the response and restrictions."
2020-02-16,Tetraman,Coronavirus,19,https://www.reddit.com/r/Coronavirus/comments/f4ze4t/who_division_tackling_coronavirus_underfunded_and/fhvdy9o/,"""Myself and other public health experts, based on what the World Health Organisation and China were saying, reassured the public that this was not serious, that we could bring this under control,"" Professor Gostin told the Washington Post.

""We were given a false sense of assurance."""
2020-02-16,Hooman1987,Coronavirus,19,https://www.reddit.com/r/Coronavirus/comments/f52222/armed_gang_steals_toilet_rolls_in_panicbuying_hit/fhw89i5/,Mounting evidence that bidets are the way to go
2020-02-16,flightofafeather,Coronavirus,19,https://www.reddit.com/r/Coronavirus/comments/f52e3y/is_the_coronavirus_epidemic_chinas_chernobyl/fhwaht3/,Yes. It is. Except this time it’s mobile.
2020-02-16,chefkoolaid,Coronavirus,18,https://www.reddit.com/r/Coronavirus/comments/f4zsyh/coronavirus_wuhan_research_facility_could_be/fhvow65/,To clarify for everyone who isn't reading the paper. It's possible the virus was accidentally released from a lab. The paper says nothing about bio engineering.
