date,author,subreddit,score,url,text
2020-03-11,box_of_no_north,Coronavirus,108,https://www.reddit.com/r/Coronavirus/comments/fh5d1b/66700_peoples_have_recovered_from_covid19_and_the/fk8wzzb/,"Fatality rate of 3.5%. 

""Good news."""
2020-03-11,pelicanfart,Coronavirus,108,https://www.reddit.com/r/Coronavirus/comments/fh474y/italy_just_announced_new_form_of_lockdown_all/fk8ygrn/,Bold of you to assume I have friends.
2020-03-11,Velour_Connoisseur,Coronavirus,108,https://www.reddit.com/r/Coronavirus/comments/fh8c2f/utah_jazz_allstar_rudy_gobert_has_tested_positive/fk9ifr8/,"I’m NOT saying he deserves this but..that’s what you get for not taking shit seriously.

ETA ok he deserves it. Saw the video."
2020-03-11,mmdeerblood,Coronavirus,108,https://www.reddit.com/r/Coronavirus/comments/fh870p/actor_tom_hanks_says_he_and_his_wife_have_tested/fk9u7s6/,"If you do go to a hospital CALL them first, don’t just show up. If they and you are both not prepared you could infect the entire hospital and force all staff into quarantine. Stay safe and hope you get better soon!!"
2020-03-11,unhampered_by_pants,Coronavirus,108,https://www.reddit.com/r/Coronavirus/comments/fh870p/actor_tom_hanks_says_he_and_his_wife_have_tested/fk9lhvd/,Colin Hanks
2020-03-11,perderickhapley,Coronavirus,108,https://www.reddit.com/r/Coronavirus/comments/fh3bhx/the_us_president_will_deliver_his_statement_on/fk8jbr1/,"Predictions: 

Risk remains lows

If you’re healthy you’ll be fine

Calls it the “Chinese Coronavirus” at some point

Come to my upcoming rally"
2020-03-11,Howboutit85,Coronavirus,108,https://www.reddit.com/r/Coronavirus/comments/fh48or/young_and_unafraid_of_the_coronavirus_good_for/fk8pot2/,"Here's the real fucking kicker, my mother in law (62) is a real far right wing doomsday prepper, or wannabe prepper anyway. When obama was Pres, and we had brought a case of ebola to the US, she freaked out and hunkered up, over 2000 Miles away from the quarantined patient... Yet here we are now, trump is Pres, we live IN SEATTLE....and she says it's nothing to worry about. 

Really shows how political brain washing can affect  your judgement.

Oh and my wife is pregnant and my MIL lives with her 94 year old father, and lets him go about town doing whatever"
2020-03-11,NitstheMits,Coronavirus,107,https://www.reddit.com/r/Coronavirus/comments/fh8wwe/the_new_york_times_has_dropped_its_paywall_on/fk9mje6/,About time. Most other new sites dropped theirs a while ago. You can always get around paywalls by using Safari and enabling “reading mode” or by inserting an extra period such as “.com./nytimes/article”
2020-03-11,incer,Coronavirus,107,https://www.reddit.com/r/Coronavirus/comments/fh474y/italy_just_announced_new_form_of_lockdown_all/fk8tlhj/,They are trying to keep people separated. For now people can go to work but they encourage companies to put non-essential people on leave and organize work in a manner that minimizes personal contact.
2020-03-11,agreedbro,Coronavirus,107,https://www.reddit.com/r/Coronavirus/comments/fgzw8w/who_classifies_covid19_as_a_pandemic_finally/fk7woau/,I'm going to inform Europeans here that this does not apply to us as insurances (or rather reinsurers) are required to have emergency pandemic risk capital and pandemics are EXEMPT from force majeure (exception of liability) per. EU Regulation 2015/35
2020-03-11,Crak_McCranium,Coronavirus,106,https://www.reddit.com/r/Coronavirus/comments/fh870p/actor_tom_hanks_says_he_and_his_wife_have_tested/fk9k07a/,Where it's summer. Maybe they will help the US realize this won't necessarily disappear in April.
2020-03-11,jamesjordanofficial,Coronavirus,106,https://www.reddit.com/r/Coronavirus/comments/fh5dtq/washington_state_reports_99_new_cases_of/fk8x87l/,"I know it's because of the lack of testing, but fucking hell the mortality rate in Washington"
2020-03-11,iWr4tH,Coronavirus,106,https://www.reddit.com/r/Coronavirus/comments/fh48or/young_and_unafraid_of_the_coronavirus_good_for/fk9jbvz/,People making the decision to avoid spreading contagion on a small scale everywhere. Will be the difference in us beating it.
2020-03-11,GrendelNightmares,Coronavirus,106,https://www.reddit.com/r/Coronavirus/comments/fh57on/trump_fears_emergency_declaration_would/fk9300y/,We're fucked.
2020-03-11,pkvh,Coronavirus,105,https://www.reddit.com/r/Coronavirus/comments/fh67q3/even_though_there_are_no_confirmed_cases_of/fk99tcd/,The time to shut the gate is before the horse leaves the barn.
2020-03-11,rosecurry,Coronavirus,105,https://www.reddit.com/r/Coronavirus/comments/fh8ee6/the_nba_has_suspended_its_season/fk9jv37/,"Yep, gobert is the guy who has the virus and was touching mics"
2020-03-11,tmsskt,Coronavirus,104,https://www.reddit.com/r/Coronavirus/comments/fh474y/italy_just_announced_new_form_of_lockdown_all/fk8xifl/,It's overloaded already. I booked groceries delivery two days ago. First available day: 20th March. Northern Italy.
2020-03-11,defaultusername001,Coronavirus,104,https://www.reddit.com/r/Coronavirus/comments/fh8ee6/the_nba_has_suspended_its_season/fk9qpcc/,"In 3 weeks: ""wow lmao, can't believe my grandma died just because of some flu. Weak."""
2020-03-11,0rganization,Coronavirus,103,https://www.reddit.com/r/Coronavirus/comments/fh474y/italy_just_announced_new_form_of_lockdown_all/fk98hce/,"Be glad you have a leader who's leveling with you and doing his best. Help him help your nation. You will make it through this. Your culture has gone through much worse and it still stands. So will you. Good luck, friend. 🤗"
2020-03-11,skeebidybop,Coronavirus,103,https://www.reddit.com/r/Coronavirus/comments/fh8c01/covid19_may_be_delivering_a_local_manufacturing/fk9ine0/,"We should especially re-develop our own self-sufficient supply chains for *medical supplies*. 

Being entirely dependent on China and India for *all* categories of medical supplies is a huge national security risk, as this rapidly escalating pandemic is making abundantly clear."
2020-03-11,robbycat,Coronavirus,103,https://www.reddit.com/r/Coronavirus/comments/fh8ee6/the_nba_has_suspended_its_season/fk9ja4g/,"NHL is next, too"
2020-03-11,Serinous,Coronavirus,103,https://www.reddit.com/r/Coronavirus/comments/fh8pod/a_person_who_has_taken_a_picture_with_trump_3/fk9moba/,"Hmm who knew being a leader, especially in time of crisis, could be this hard"
2020-03-11,TheWierdGuy,Coronavirus,103,https://www.reddit.com/r/Coronavirus/comments/fh3yyo/tsa_administrator_says_not_providing_health_care/fk8ngyh/,"When you treat your employees like shit, you get shit employees. That explains a lot."
2020-03-11,stupidinternetnames,Coronavirus,101,https://www.reddit.com/r/Coronavirus/comments/fh6rop/the_new_york_times_is_providing_free_access_to/fk9702p/,Finally. Though the period trick works a treat.
2020-03-11,[deleted],Coronavirus,101,https://www.reddit.com/r/Coronavirus/comments/fh7uuj/trump_addresses_the_nation_on_coronavirus_from/fk9eoef/,[removed]
2020-03-11,incelchad,Coronavirus,101,https://www.reddit.com/r/Coronavirus/comments/fh870p/actor_tom_hanks_says_he_and_his_wife_have_tested/fk9loei/,Tom Hanks aint dying
2020-03-11,MarkusBerkel,Coronavirus,101,https://www.reddit.com/r/Coronavirus/comments/fh870p/actor_tom_hanks_says_he_and_his_wife_have_tested/fk9ih85/,"Or you know, being able to afford ventilators and ECMO and concierge doctors to stay at his side? Get real. If anyone has an advantage, it’s the rich."
2020-03-11,YoshiAllStar,Coronavirus,101,https://www.reddit.com/r/Coronavirus/comments/fh8pod/a_person_who_has_taken_a_picture_with_trump_3/fk9pljm/,"Of course he’s getting tested, there’s no way on earth they’re not testing the president of the United States, and everyone around him, it would be a national disaster if one were to get sick and then passed it onto the rest. Even his administration isn’t stupid enough to take that risk."
2020-03-11,BigFPS,Coronavirus,101,https://www.reddit.com/r/Coronavirus/comments/fh85cs/megathread_president_trump_announces_30day_travel/fk9gv4j/,It’s not
2020-03-11,RajonLonzo,Coronavirus,101,https://www.reddit.com/r/Coronavirus/comments/fh8ee6/the_nba_has_suspended_its_season/fk9sybe/,Lol. That was too short of a time ago to be the cause. But the fact that he did it means he probably contracted the virus doing something equally stupid. Get well and smarter Gobert.
2020-03-11,Coronatine,Coronavirus,101,https://www.reddit.com/r/Coronavirus/comments/fh4zo3/portugal_as_schools_and_universities_close_for/fk8vijh/,"I swear to God introverts are going to inherit the earth after this shit.

I'm ready and happy to be locked in my house with my husband for 3+ months and I have the boxes of condoms to prove it."
2020-03-11,EscapeRouteYT,Coronavirus,100,https://www.reddit.com/r/Coronavirus/comments/fh5et8/st_louis_man_demands_a_test_and_is_arrested/fk8xe4d/,“enough tests for everyone to get tested”
2020-03-11,Thoughtful_Jew,Coronavirus,100,https://www.reddit.com/r/Coronavirus/comments/fh85cs/megathread_president_trump_announces_30day_travel/fk9r2p7/,"In Alabama, the reason we dont have any cases here yet is because they legitimately aren’t testing. Like none."
2020-03-11,RckYouLkeAHermanCain,Coronavirus,100,https://www.reddit.com/r/Coronavirus/comments/fh8ckb/sweden_stops_testing_people_except_severe_cases/fk9i7p5/,Oh no baby what is you doing
2020-03-11,OPsDaddy,Coronavirus,100,https://www.reddit.com/r/Coronavirus/comments/fh85cs/megathread_president_trump_announces_30day_travel/fk9lr9n/,It doesn’t apply to the UK. for some reason.
2020-03-11,c-dollasign,Coronavirus,100,https://www.reddit.com/r/Coronavirus/comments/fh6ybn/new_york_to_take_testing_matters_into_its_own/fk989q6/,"Well yeah, when the federal response is basically nonexistent."
2020-03-11,WelshLocks,Coronavirus,100,https://www.reddit.com/r/Coronavirus/comments/fh870p/actor_tom_hanks_says_he_and_his_wife_have_tested/fk9nleu/,"Nah, it’s because he’s loaded.  You can get amazing medical care anywhere if you have enough money, which he most certainly has. I think he’s in a much better spot than the rest of us. You can bet he didn’t have to wait for hours in the emergency room coughing his lungs out to be seen. The average person will have to do that, no matter what system their country’s healthcare is based on."
2020-03-11,Odogonmc,Coronavirus,99,https://www.reddit.com/r/Coronavirus/comments/fh9koj/we_are_10_days_away_from_the_hospitals_getting/fk9r6ix/,Wow interesting word choice.
2020-03-11,Absinthe_Parties,Coronavirus,99,https://www.reddit.com/r/Coronavirus/comments/fh3nfo/nyc_st_patricks_day_parade_reportedly_canceled/fk8lat3/,"Kind of funny how all these news articles say events are cancelled out of corona virus ""fears"".

&#x200B;

I wish one of these articles would have the balls to say ""cancelled out of common fucking sense.""

&#x200B;

edit\*    Thanks for the award, whoever you are.  My first one!"
2020-03-11,Lazerdude,Coronavirus,99,https://www.reddit.com/r/Coronavirus/comments/fh93h8/to_add_onto_this_im_told_the_thunder_players_are/fk9nopb/,Is it really a surprise that celebrities and the rich will be first in line?
2020-03-11,groot4lyfe,Coronavirus,98,https://www.reddit.com/r/Coronavirus/comments/fh9cpr/italian_daily_coronavirus_deaths_jump_31_to_827/fk9q4qo/,">the largest rise in absolute numbers since the contagion came to light on Feb. 21

Specifically, Italy had 0 deaths 18 days ago, and only 20 confirmed cases. 

Now 827 deaths and 12,462 confirmed cases.

The infection in the United States is currently following the same rate of expansion that Italy just experienced.

Hope y'all are stocked up on your beans and rice."
2020-03-11,dumpsterdiverflorida,Coronavirus,97,https://www.reddit.com/r/Coronavirus/comments/fh6bxf/florida_officials_wanted_town_to_stay_quiet_on/fk9456u/,"Absolutely 100% trying to cover it up in Florida. They dont want to lose out on Disney and Spring breakers. Our governor is a Trump guy too.  
  
Edit: I admit I did not read the article. In this particular case I was wrong, my fault. I still stand by my statement in an overall sense."
2020-03-11,evilmoi987,Coronavirus,97,https://www.reddit.com/r/Coronavirus/comments/fh7uuj/trump_addresses_the_nation_on_coronavirus_from/fk9fkv1/,"Bruh he still saying how the US is better than everywhere else, like bro stop making it a competition and talk about how u will protect the nation"
2020-03-11,PM_ME_YOUR_EARL_GREY,Coronavirus,97,https://www.reddit.com/r/Coronavirus/comments/fh7juo/no_calling_the_novel_coronavirus_the_wuhan_virus/fk9coz5/,"It's not implicitly racist, but the WHO advises against referring to a disease by its area of origin as it causes undue stigma surrounding the region for years after."
2020-03-11,tuitiontrap,Coronavirus,97,https://www.reddit.com/r/Coronavirus/comments/fh468t/trump_says_he_will_address_the_nation_from_the/fk8pc0o/,Please avoid face palming.
2020-03-11,A_glorious_dawn,Coronavirus,97,https://www.reddit.com/r/Coronavirus/comments/fh8ee6/the_nba_has_suspended_its_season/fk9jycj/,The president concludes his address and within 30 minutes the news breaks that the most famous actor in the world and members of the nba have the Coronavirus. Sure feels like a “nobody can know until everyone knows” moment.
2020-03-11,Modestexcuse,Coronavirus,96,https://www.reddit.com/r/Coronavirus/comments/fh95of/senate_staffer_tests_positive_for_coronavirus/fk9q8qu/,"I genuinely thought he sounded sick, so did my SO."
2020-03-11,edge2528,Coronavirus,96,https://www.reddit.com/r/Coronavirus/comments/fh569p/about_10_of_people_who_contracted_coronavirus/fk8vun8/,"What makes you think you'll get it down to 1% from 10% in a country with 45% obesity? It's more like it'll be 20% hospitalised in the US.

You may have heard the phrase ""underlying health conditions"" a few times. Be aware, obesity is an underlying health condition."
2020-03-11,kitbiglil,Coronavirus,96,https://www.reddit.com/r/Coronavirus/comments/fh6ybn/new_york_to_take_testing_matters_into_its_own/fk98p9p/,We are literally watching a once great and powerful nation fall before our eyes.  This is so sad to watch.
2020-03-11,vdlong93,Coronavirus,96,https://www.reddit.com/r/Coronavirus/comments/fh48or/young_and_unafraid_of_the_coronavirus_good_for/fk8q41d/,Here in France they say that everywhere and I'm like what? do people have any humanity left?
2020-03-11,i_am_not_mike_fiore,Coronavirus,95,https://www.reddit.com/r/Coronavirus/comments/fh5f3u/we_must_not_stop_living_french_mayor_defends/fk8xrdo/,"""we must not stop living""

believe it or not, people *are* gonna stop living if you keep this shit up"
2020-03-11,wereallg0nnad1e,Coronavirus,95,https://www.reddit.com/r/Coronavirus/comments/fh9wlk/the_mayor_of_berlin_not_willing_to_close_schools/fk9tpn4/,I feel like I'm watching a shitty and predictable horror movie.
2020-03-11,finsareluminous,Coronavirus,95,https://www.reddit.com/r/Coronavirus/comments/fh474y/italy_just_announced_new_form_of_lockdown_all/fk8s22u/,"I was a non-believer a month ago, still skeptical two weeks ago, but now I'm starting to accept that this is shaping up to be the most significant event since WW2.

Not world ending, but world shattering."
2020-03-11,trisw,Coronavirus,95,https://www.reddit.com/r/Coronavirus/comments/fh85cs/megathread_president_trump_announces_30day_travel/fk9jt0e/,"The NBA just cancelled the rest of the season, Tom Hanks is dying and we can't go to Europe - all within like 20 minutes WTF"
2020-03-11,tadgie,Coronavirus,95,https://www.reddit.com/r/Coronavirus/comments/fh1bo2/bbc_italian_medical_chief_dies_after_contracting/fk8yzel/,"Most important are the nurses. As a doctor, I can often make my assessment of a patient in minute, then do most of my management far outside the zone for spread. Nurses however are almost constantly in contact with these patients, not only curing but comforting the patient. 

Send extra love to your nurses now, and coffee and eventually a beer or glass of wine when all is said and done."
2020-03-11,plumEater69,Coronavirus,95,https://www.reddit.com/r/Coronavirus/comments/fh48or/young_and_unafraid_of_the_coronavirus_good_for/fk91q9v/,People find a way to rise to the occasion. Trust yourself more than that.
2020-03-11,ImMethuselah,Coronavirus,95,https://www.reddit.com/r/Coronavirus/comments/fgrile/what_if_the_rest_of_europe_follows_italys/fk6fuwg/,"If? Based purely on the facts the rest of the world will follow Italy in literally 14 days at the longest. 

Can people stop thinking this is a fucking joke?"
2020-03-11,IrritableIrvin,Coronavirus,94,https://www.reddit.com/r/Coronavirus/comments/fh63g4/south_dakota_has_tested_35_people_with_8_positive/fk92e5f/,"To state the obvious, 8 unrelated cases doesn’t bode well for the overall infection rate there.

That’s kind of crazy to think about honestly."
2020-03-11,tenaku,Coronavirus,94,https://www.reddit.com/r/Coronavirus/comments/fha8lt/us_cdc_issues_a_global_level_3_advisory/fk9vsk6/,"All right guys, it worked, we got rid of the American tourists. We can all stop pretending now!"
2020-03-11,Mulsanne,Coronavirus,94,https://www.reddit.com/r/Coronavirus/comments/fh6rop/the_new_york_times_is_providing_free_access_to/fk9d20k/,"This is almost as unhelpful as no comment. Nobody knows what an FQDN is, man. 

For other users, this guy is obtusely trying to say that you put a period after nytimes.com


e.g. https://www.nytimes.com./news-event/coronavirus?action=click&module=Spotlight&pgtype=Homepage"
2020-03-11,cammyk123,Coronavirus,94,https://www.reddit.com/r/Coronavirus/comments/fh001l/coronavirus_confirmed_as_pandemic/fk7vxc3/,Took them long enough.
2020-03-11,DEEP_SEA_MAX,Coronavirus,93,https://www.reddit.com/r/Coronavirus/comments/fh870p/actor_tom_hanks_says_he_and_his_wife_have_tested/fk9ku2r/,"God I hope he's okay. 

Losing Tom Hanks would literally be the worst possible celebrity to lose. He's an icon"
2020-03-11,TonyM203,Coronavirus,93,https://www.reddit.com/r/Coronavirus/comments/fh85cs/megathread_president_trump_announces_30day_travel/fk9hbav/,Thats cool and all but how about make test kits easily available to hospitals and clinics so the people that want to get tested can do so without jumping thru hoops?
2020-03-11,cyclefreaksix,Coronavirus,93,https://www.reddit.com/r/Coronavirus/comments/fh5et8/st_louis_man_demands_a_test_and_is_arrested/fk8xs39/,"And now he's in jail, spreading it around..."
2020-03-11,tacobelley,Coronavirus,93,https://www.reddit.com/r/Coronavirus/comments/fh870p/actor_tom_hanks_says_he_and_his_wife_have_tested/fk9m4tk/,"Can someone check on Betty White, please!?"
2020-03-11,StoicJedi15,Coronavirus,93,https://www.reddit.com/r/Coronavirus/comments/fh8of1/coronavirus_has_disrupted_supply_chains_for/fk9ks5j/,This could be the monster hiding in the woods
2020-03-11,Hard_at_it,Coronavirus,93,https://www.reddit.com/r/Coronavirus/comments/fh93h8/to_add_onto_this_im_told_the_thunder_players_are/fk9p7nx/,"> Their lives matter more than ordinary peasants like ER docs or RNs.

Medical people are on the front line, and face the highest risks due to non testing."
2020-03-11,XpcorpC,Coronavirus,93,https://www.reddit.com/r/Coronavirus/comments/fh5q6j/99_new_cases_366_total_were_just_announced_in/fk8zood/,The community spread is terrifying once it begins.
2020-03-11,magic27ball,Coronavirus,93,https://www.reddit.com/r/Coronavirus/comments/fh8959/turn_out_it_is_an_aibourne_virus/fk9iqr9/,"Welcome to what China told you a month ago, like everything else so far.

This virus certainly isnt kind to countries with arrogant tendencies"
2020-03-11,mthmchris,Coronavirus,92,https://www.reddit.com/r/Coronavirus/comments/fh48or/young_and_unafraid_of_the_coronavirus_good_for/fk8u3rb/,"Sitting here in China after a month and a half in lockdown, I've described it as watching a slow motion replay of a car crash. You want to yell out ""Veer away! It's not too late!"" ...but you know it's not going to change anything.

Right now I have people on my Facebook feed complaining that the St Patties day parade in Boston is cancelled for 'no good reason' and others comparing the absolutely fantastic flight deals they're getting to Florida. These people aren't out there in Trumpistan or anything... they're college educated people in their 30s that live in the Northeast corridor.

It's massively frustrating to watch."
2020-03-11,Free_Joty,Coronavirus,92,https://www.reddit.com/r/Coronavirus/comments/fh82op/all_travel_from_europe_is_suspended_for_next_30/fk9g78a/,The corona......virus
2020-03-11,wolfgangamadeus10,Coronavirus,92,https://www.reddit.com/r/Coronavirus/comments/fh8ee6/the_nba_has_suspended_its_season/fk9js6h/,This is the guy who did that!?
2020-03-11,cookiedux,Coronavirus,92,https://www.reddit.com/r/Coronavirus/comments/fh870p/actor_tom_hanks_says_he_and_his_wife_have_tested/fk9kha8/,....yes.
2020-03-11,anthabit,Coronavirus,92,https://www.reddit.com/r/Coronavirus/comments/fh474y/italy_just_announced_new_form_of_lockdown_all/fk90oqs/,"only shops like shoe shops, flower shops, etc. all the non essential stuff. Groceries and pharmacies are open of course, but even there people are being asked not to get close to each other (1 mt distance at least, and the police can close them if they don’t make their customers actually do it)

Offices and factories are invited to close down non necessary production and/or implement remote working procedures.

Lots of factories and offices are also lessening the crowding by changing shift/work hours etc.

We work as IT consultants and three of us were supposed to go to a customer, instead only one went and we were given a desk at 3mt distance from everyone else, mandatory hand sanitizer at the entrance.

Everything is changing, for real.

There actually are cops around asking people what they are doing outside and if they have a valid reason to leave home."
2020-03-11,ProGenjuuuuu,Coronavirus,92,https://www.reddit.com/r/Coronavirus/comments/fh9g6m/jazz_star_rudy_gobert_joked_about_coronavirus_by/fk9qcei/,Defensive player of the year btw lmao
2020-03-11,midnight_squash,Coronavirus,91,https://www.reddit.com/r/Coronavirus/comments/fh3bhx/the_us_president_will_deliver_his_statement_on/fk8j2z4/,Here’s the synopsis “the risk remains low”
2020-03-11,you_are_all_monsters,Coronavirus,91,https://www.reddit.com/r/Coronavirus/comments/fh8sbr/nobody_took_the_aids_epidemic_seriously_until/fk9mbv7/,"Well, yeah. But the bills and rent don't stop and I mostly live paycheck to paycheck. I can swing another week or two of this but not much more. I have no health insurance either so I can't get help if I get very sick."
2020-03-11,streetvoyager,Coronavirus,91,https://www.reddit.com/r/Coronavirus/comments/fh870p/actor_tom_hanks_says_he_and_his_wife_have_tested/fk9hzmg/,He’s rich as fuck. Will make a difference.
2020-03-11,Y2Jerich0,Coronavirus,90,https://www.reddit.com/r/Coronavirus/comments/fh85ha/nyc_mayor_bill_de_blasio_encourages_dining_out/fk9ipwg/,Cuomo is an idiot too but he’s a born and bred politician so he understands that he can’t kill the constituents who elect him.
2020-03-11,henryeaterofpies,Coronavirus,90,https://www.reddit.com/r/Coronavirus/comments/fgzw8w/who_classifies_covid19_as_a_pandemic_finally/fk80409/,"makes me really rethink this whole living in ""the greatest country in the world"" thing."
2020-03-11,King_Krouton,Coronavirus,90,https://www.reddit.com/r/Coronavirus/comments/fh2xm8/texass_largest_public_health_lab_is_able_to/fk8gdof/,I’m not expert but that doesn’t seem like a lot
2020-03-11,megaTorisaurous,Coronavirus,89,https://www.reddit.com/r/Coronavirus/comments/fh8ee6/the_nba_has_suspended_its_season/fk9nukl/,Dayummmmmm im rolling!
2020-03-11,H3000,Coronavirus,89,https://www.reddit.com/r/Coronavirus/comments/fh870p/actor_tom_hanks_says_he_and_his_wife_have_tested/fk9j7xk/,"I know it's weird that Tom Hanks has contracted the virus, but a lot of us are probably going to get it. The fact that a wealthy celebrity with access to the best medical care has it isn't that bad in the grand scheme of things. This entire situation is so fucking weird."
2020-03-11,cr4sh0v3rride,Coronavirus,89,https://www.reddit.com/r/Coronavirus/comments/fh870p/actor_tom_hanks_says_he_and_his_wife_have_tested/fk9oou9/,Instant karma.
2020-03-11,Alasdaire,Coronavirus,89,https://www.reddit.com/r/Coronavirus/comments/fh8959/turn_out_it_is_an_aibourne_virus/fk9hlkc/,"If it really is airborne, how can we be expected to go to work? Offices are on shared HVAC systems."
2020-03-11,whodat514,Coronavirus,89,https://www.reddit.com/r/Coronavirus/comments/fh4g1u/kosovo_with_0_case_closed_all_schools_after_who/fk8r2a3/,"This is what everyone else should’ve done, shut it down BEFORE it spreads! What a concept!"
2020-03-11,KingSnazz32,Coronavirus,89,https://www.reddit.com/r/Coronavirus/comments/fh0tkx/world_health_organization_we_are_deeply_concerned/fk81n1b/,"Inaction such as waiting for so long before declaring a pandemic, thus feeding the sense of complacency around the world? That sort of inaction?"
2020-03-11,Cargobiker530,Coronavirus,88,https://www.reddit.com/r/Coronavirus/comments/fh5jfp/the_media_should_view_this_as_a_time_of_unity_and/fk8z6j5/,Not Donald J. Trump: everything is spelled correctly.
2020-03-11,solocupjazz,Coronavirus,88,https://www.reddit.com/r/Coronavirus/comments/fgzw8w/who_classifies_covid19_as_a_pandemic_finally/fk7zbau/,"Whaddya mean, inaction?  I've been stockpiling toilet paper for weeks!"
2020-03-11,SlamminfishySalmon,Coronavirus,88,https://www.reddit.com/r/Coronavirus/comments/fh85cs/megathread_president_trump_announces_30day_travel/fk9ovsv/,All those people capitalizing on cheap flights to europe over the weekend probably feel pretty stupid right now.
