date,author,subreddit,score,url,text
2020-02-16,stavd3,Coronavirus,5,https://www.reddit.com/r/Coronavirus/comments/f51dj9/using_sars_swine_flu_or_other_new_coronavirus/fhw3jwc/,"[This](https://www.statnews.com/2020/02/04/two-scenarios-if-new-coronavirus-isnt-contained/) might be a relevant article for you, if you are interested."
2020-02-16,Bumpy_Nugget,Coronavirus,5,https://www.reddit.com/r/Coronavirus/comments/f51c4e/will_coronavirus_push_china_to_get_more_desperate/fhw2vu9/,"Trade negotiations?

I don't think you're grasping the full magnitude of this situation."
2020-02-16,bluevegas1966,Coronavirus,5,https://www.reddit.com/r/Coronavirus/comments/f51eui/its_been_almost_a_week_and_no_new_cases_in_usa/fhw4y1t/,"Maybe a lot of people are asymptomatic and are spreading it to others who are as well. Maybe what people think is a cold is actually covid, but it’s no big deal for people with healthy lungs and strong immune systems. Who knows."
2020-02-16,Alobalo27,Coronavirus,5,https://www.reddit.com/r/Coronavirus/comments/f51evq/cv_is_no_joke/fhw525d/,Lol this guy guy fucking posting the same fake shit he did earlier. You posting a new article doesn’t prove anything
2020-02-16,Philosofox,Coronavirus,5,https://www.reddit.com/r/Coronavirus/comments/f4u9ak/40_americans_evacuated_from_the_diamond_princess/fhtqdax/,That or the staff are infected.
2020-02-16,HeidiH0,Coronavirus,5,https://www.reddit.com/r/Coronavirus/comments/f4umct/tom_cotton_hints_without_evidence_coronavirus_is/fhtsnqo/,They have the sequence.  'Without evidence' won't last long.
2020-02-16,aroxychik,Coronavirus,5,https://www.reddit.com/r/Coronavirus/comments/f4us44/what_is_the_actual_status_of_the_infected_from/fhtu0ty/,East TN couple in their 70s. Male is a doctor. We're due to evac today. She tested positive with zero symptoms.  He is staying in Japan with her. They gave him option of just leaving and coming back to USA burbhe wanted to stay with her.  Her luggage was already taken away from what I'm.possibky reading (ie touched by crew). They believe she contracted it from food delivery steward
2020-02-16,funkusernames,Coronavirus,5,https://www.reddit.com/r/Coronavirus/comments/f4uo6n/i_just_flew_to_seattle_after_spending_almost_3/fhtuedp/,Literally pointless if you're not showing symptoms yet.
2020-02-16,usernamezerozero,Coronavirus,5,https://www.reddit.com/r/Coronavirus/comments/f4uo6n/i_just_flew_to_seattle_after_spending_almost_3/fhts72q/,This is really disturbing. I live in Seattle and as a non-driver rely on public transit. I don't feel it is safe to do so with such lax procedures and communication. Stay well.
2020-02-16,blitz6900,Coronavirus,5,https://www.reddit.com/r/Coronavirus/comments/f4u5nx/would_we_be_better_off_with_no_quarantines_or/fhtsorq/,"In america you go to work pretty much no matter what unless you're physically unable to function.  Between the culture here and people's inability to afford to skip work, if this thing does spread here a lot of people could be fucked. Especially when you look at the fact that many Americans also choose not or are unable to use our healthcare systems"
2020-02-16,PinkPropaganda,Coronavirus,5,https://www.reddit.com/r/Coronavirus/comments/f4ux33/why_does_it_seem_like_money_is_being_prioritized/fhu1om2/,"Without money, how do you feed your family? Billions of people don’t have access to farmland and the resources needed to grow food, manufacturer medicine."
2020-02-16,Not_A_Luddite,Coronavirus,5,https://www.reddit.com/r/Coronavirus/comments/f4oyy3/on_a_positive_side_china_now_enjoys_europelike/fhu3mqs/,The real fault lies on the American consumer who buys the products while knowing there’s no way to ethically make that product at that price.
2020-02-16,Krappatoa,Coronavirus,5,https://www.reddit.com/r/Coronavirus/comments/f4upll/massive_delay_for_products/fhu53yd/,Supposedly China has huge reserve stockpiles to last them for months.
2020-02-16,21carlito,Coronavirus,5,https://www.reddit.com/r/Coronavirus/comments/f4vvhb/chinese_bank_to_destroy_cash_in_areas_hit_by/fhu6u8f/,"banks replace worn and damaged notes all the time.   no significant cost to the economy and in this case will help control the spread.

smart move"
2020-02-16,zxcv444,Coronavirus,5,https://www.reddit.com/r/Coronavirus/comments/f4wqcr/coronavirus_is_being_suppressed_online/fhufe4d/,"Wow, every single video is age restricted and requires signing in, regardless of what it is."
2020-02-16,beefly,Coronavirus,5,https://www.reddit.com/r/Coronavirus/comments/f4ux33/why_does_it_seem_like_money_is_being_prioritized/fhuf100/,The ones closest to the on-ramps of the highway
2020-02-16,painfully1,Coronavirus,5,https://www.reddit.com/r/Coronavirus/comments/f4wqcr/coronavirus_is_being_suppressed_online/fhugrfv/,"It's really interesting that the ""trending"" results on Twitter are being manipulated, so only mis-spelled ""coronavirius"" etc. is getting through to trending. The correct spelling is never trending, oddly enough."
2020-02-16,DagnyGalt007,Coronavirus,5,https://www.reddit.com/r/Coronavirus/comments/f4ufed/subtlety/fhug79v/,"I got giant pockets put in my wedding gown, best thing ever. Now to make jeans pockets that actually fit hands. :)"
2020-02-16,Lizardman7,Coronavirus,5,https://www.reddit.com/r/Coronavirus/comments/f4upll/massive_delay_for_products/fhucgbi/,The US ceases to raise concern on the reality here. It’ll be a big eye opener for everyone here in America.
2020-02-16,anonymous23throwaway,Coronavirus,5,https://www.reddit.com/r/Coronavirus/comments/f4upll/massive_delay_for_products/fhub0fz/,"This. I initially bought some masks and meds, stuff for the potential virus, but now I'm realizing that a lot of basic supplies might be scarce/pricey for awhile."
2020-02-16,myne,Coronavirus,5,https://www.reddit.com/r/Coronavirus/comments/f4sxfl/cv_is_no_joke/fhunomx/,"NO! 

That was very early research.

Later research suggests it's smokers who express the ACE2 receptor in large quantities.

But since there are so many smokers in China, it looked like a race thing.

https://www.preprints.org/manuscript/202002.0051/v1/download

> Recently, studies found that 2019-nCov and SARS-nCov share the same receptor, ACE2. In this study, we analyzed four large-scale datasets of normal lung tissue to investigate the disparities related to race, age, gender and smoking status in ACE2 gene expression. **No significant disparities in ACE2 gene expression were found between racial groups (Asian vs Caucasian)**, age groups (>60 vs <60) or gender groups (male vs female). **However, we observed significantly higher ACE2 gene expression in smoker samples compared to nonsmoker samples.** This indicates the smokers may be more susceptible to 2019-nCov and thus smoking history should be considered in identifying susceptible population and standardizing treatment regimen.

I'm not saying this research is gold standard, but it seems safer to just say ""we think"".

So, let's not spread the race thing. Because it might well be dangerous (false sense of security) misinformation."
2020-02-16,worktop1,Coronavirus,5,https://www.reddit.com/r/Coronavirus/comments/f4xg39/menu_items/fhupjl2/,Toilet rolls
2020-02-16,pinkbunnybitch,Coronavirus,5,https://www.reddit.com/r/Coronavirus/comments/f4xl1v/boston_foodies_officials_fight_coronavirus_fears/fhuq80d/,"So glad I moved out of Boston. Full of sanctimonious, overly educated creeps"
2020-02-16,Maroon14,Coronavirus,5,https://www.reddit.com/r/Coronavirus/comments/f4xg39/menu_items/fhuqzfr/,As I drink a hot toddy at not even 2 in the afternoon lol
2020-02-16,Galaxy_Child_Aru,Coronavirus,5,https://www.reddit.com/r/Coronavirus/comments/f4u9ak/40_americans_evacuated_from_the_diamond_princess/fhuq9tj/,"That's crazy. He basically lied to you in order to be with you, then when he got what he wanted ""everything stopped"". I would go on lots of himing and camping trips just to annoy him. He will either come, or he will rot at the house 🤷‍♂️ 
Either way, he owes it to you to go with you since he catfished you. Otherwise I'm sure there is another guy who enjoys hiking and being outdoors and will go with you. Maybe it will make your husband jealous."
2020-02-16,SaltyKine,Coronavirus,5,https://www.reddit.com/r/Coronavirus/comments/f4u9ak/40_americans_evacuated_from_the_diamond_princess/fhtoupg/,"Shared ventilation system, airborne virus?"
2020-02-16,someinternetdude19,Coronavirus,5,https://www.reddit.com/r/Coronavirus/comments/f4y1yg/as_the_advice_given_in_a_lot_of_places_is_two/fhuwp2n/,"I'll probably get hate for this, but home treatment for this is probably the same as the flu. Yes, I know it's not the flu and more dangerous, but what you can do at home is the same as for the flu. Flu/cold medicine, ibuprofen, plenty of hydration, rest, food, keep them comfortable. I wouldn't mess around with any of the oxygen stuff unless you know what you're doing. If it gets really bad for anyone, take them to get professional help."
2020-02-16,MBird161,Coronavirus,5,https://www.reddit.com/r/Coronavirus/comments/f4sxfl/cv_is_no_joke/fhuvjab/,https://ktla.com/2020/02/12/tarzana-man-on-cruise-ship-quarantined-in-japan-hospitalized-for-coronavirus-symptoms-wife-says/
2020-02-16,Lucycoopermom,Coronavirus,5,https://www.reddit.com/r/Coronavirus/comments/f4u5nx/would_we_be_better_off_with_no_quarantines_or/fhtm731/,No they haven’t full figured out how it spreads yet
2020-02-16,greyco31,Coronavirus,5,https://www.reddit.com/r/Coronavirus/comments/f4u5nx/would_we_be_better_off_with_no_quarantines_or/fhtmstk/,"I don’t think so... experts have said that the best method to contain it is exactly what they are doing now... So, by not restricting people’s movements, I think it would be setting up everyone to get infected. And that would be bad."
2020-02-16,Ukleafowner,Coronavirus,5,https://www.reddit.com/r/Coronavirus/comments/f4u5nx/would_we_be_better_off_with_no_quarantines_or/fhtmyy5/,People will take themselves out of the economy anyway once they start to hear about people getting sick and dying. It's crazy to think that people will still just go about their business as normal if this becomes a pandemic.
2020-02-16,nsgrimm,Coronavirus,5,https://www.reddit.com/r/Coronavirus/comments/f4yy94/study_white_peoples_could_be_immune_to/fhv8uab/,Does this study even address ethnicity?
2020-02-16,Dutch_Mufasa,Coronavirus,5,https://www.reddit.com/r/Coronavirus/comments/f4v911/one_out_of_ten_people_on_earth_right_now_is_under/fhw5qoa/,"So there is a sister thread called China\_Flu, and this is the same name, just think a little more specific than China.  Like, a city."
2020-02-16,wuhanjoe,Coronavirus,5,https://www.reddit.com/r/Coronavirus/comments/f4upll/massive_delay_for_products/fhw5y1w/,"I am a purchasing manager for a small paper-goods company in New England (US).  We used to purchase all of our raw paper (pulped recycled in bulk) from China, but I saw some weird activity in December 2019, and after a meeting with my manager and the owner of the company, switched to pulp from Canada.  Yes it's more expensive, but we actually save money on transportation costs.  So glad I did that now because our old plant in China has been closed since before the holidays and it doesn't look like they will open again until April at the earliest."
2020-02-16,zombieshogun,Coronavirus,5,https://www.reddit.com/r/Coronavirus/comments/f4sxfl/cv_is_no_joke/fhv389e/,"I live in Japan. Few wears masks correctly, often not tight enough or not covering their noses. In addition, it’s common for people here to sneeze and cough without covering their faces at all, even in crowded areas like grocery stores. Even dudes that take massive diarrhea dumps in public will often only rinse their fingertips (if that) before bolting out the door. People here don’t stay at home when they’re sick, and fuck everyone else in the process. You’re probably safer in America, to be honest."
2020-02-16,Serinous,Coronavirus,5,https://www.reddit.com/r/Coronavirus/comments/f51icv/coronavirus_81_afraid_of_infection_but_35_would/fhw7ewr/,"When other people is showing mild symptoms, that person is 100% infected with Coronavirus. When I show mild symptoms however, it is 100% just allergy. /s"
2020-02-16,Estella149,Coronavirus,5,https://www.reddit.com/r/Coronavirus/comments/f513zm/nursing_101_caring_for_your_loved_ones_at_home/fhwcgpz/,I’m a nurse in Texas.
2020-02-16,ParryThisYouBastards,Coronavirus,5,https://www.reddit.com/r/Coronavirus/comments/f4sxfl/cv_is_no_joke/fhtg4xj/,"I do wish they would show more video of ill patients. As intrusive as it may be, people need to see what the suffering actually looks like. I've only recently looked properly into ebola as back when it was spreading I didn't really pay attention, but having looked at some videos today, its horrifying. I know ebola is probably 10x worse, but the suffering is all the same."
2020-02-16,FuckedTaxpayer,Coronavirus,5,https://www.reddit.com/r/Coronavirus/comments/f4tz01/rochester_ny_emergency_rooms_full_with_regular/fhtjvzl/,"That’s the issue, people tend to go to the ER for these simple things and with the media hysteria and spread it’s only going to further the issue."
2020-02-16,BicksonBall,Coronavirus,5,https://www.reddit.com/r/Coronavirus/comments/f4u57o/hadaka_matsuri_thousands_gather_for_japans_annual/fhtl9ze/,That picture looks like all men....
2020-02-16,Im_not_God_,Coronavirus,5,https://www.reddit.com/r/Coronavirus/comments/f4u5nx/would_we_be_better_off_with_no_quarantines_or/fhtnm55/,But we can still slow it down while cures and vaccines are being developed.
2020-02-16,unrulystowawaydotcom,Coronavirus,5,https://www.reddit.com/r/Coronavirus/comments/f516ec/355_on_cruise_infected_by_1_person_yet_we_are/fhw7mpg/,"Nah, it’s cool. They’re on top of it, just like the wildfires..."
2020-02-16,WunWegWunDarWun_,Coronavirus,5,https://www.reddit.com/r/Coronavirus/comments/f4y57t/i_work_in_a_major_academic_hospital_in_the_us/fhw70v1/,"Lol yeah I only brought up the subject to gauge the opinions of my friends and they all more or less told me I’m worried about nothing. 

People really don’t seem to care. There are hundreds of millions of people on lockdown, meetings and conferences around the world are being cancelled, and it’s definitely spreading (albeit “seemingly” slowly”) around the world and no one seems to give a shit. 

Like that’s without me making predictions. Just simply saying “I’m concerned” is enough for people to just shut down any concern and say it’s no big deal. 

As if there’s nothing to be concerned about... it’s wild"
2020-02-16,birdsofterrordise,Coronavirus,5,https://www.reddit.com/r/Coronavirus/comments/f4upll/massive_delay_for_products/fhttusf/,"There seems to be a lot of false hope and promises from factories that they will resume or be at full production by March 1st. Culturally, it’s a thing for them to be very positive when facing the clients. But the truth is, it will likely be month(s) and everyone is just kind of humming along to the positivity and not looking at the reality on the ground."
2020-02-16,nemoknows,Coronavirus,5,https://www.reddit.com/r/Coronavirus/comments/f4yrvo/there_are_currently_71223_confirmed_cases/fhvaitf/,"It’s doubling about every week, or more conservatively by a factor of 10 every month. So 1 million by mid March, 10 million by mid April. Beyond that it’s really a matter of how it breaks out of China, probably via developing nations."
2020-02-16,flaviuc,Coronavirus,5,https://www.reddit.com/r/Coronavirus/comments/f4xzq9/been_low_key_prepping_just_ordered_an_o2/fhv4ngv/,"read this, you're not nuts, don't overract though: [http://www.psandman.com/col/teachable.htm](http://www.psandman.com/col/teachable.htm)"
2020-02-16,JCGolf,Coronavirus,5,https://www.reddit.com/r/Coronavirus/comments/f4xd9s/live_stats_graphs_covid19_sarscov2_feb_16_2020/fhv575s/,"My rule of thumb has been: if things keep getting worse, i keep buying a little more and more. When I start hearing good news I will stop buying stuff."
2020-02-16,stavd3,Coronavirus,5,https://www.reddit.com/r/Coronavirus/comments/f4ylut/cure/fhv6x11/,"No, we won't. Even if the entire planet is infected, 98% of us will still be alive. And sorry if that was sarcasm, but I'm saying this because a lot of people on this sub seem to believe that."
2020-02-16,allergic_reaction71,Coronavirus,5,https://www.reddit.com/r/Coronavirus/comments/f4y57t/i_work_in_a_major_academic_hospital_in_the_us/fhvdlsi/,"Wow. This is surprising, but perhaps administrators are holding off for further info before they finalize plans/decide how to proceed for scheduling, potential staffing shortages, and employee safety. I would imagine EUH doesn’t want to panic their staff or make a wrong/costly decision. Still, it wouldn’t hurt to ask about it so you could prepare for more shifts."
2020-02-16,notthewendysgirl,Coronavirus,5,https://www.reddit.com/r/Coronavirus/comments/f4upll/massive_delay_for_products/fhvc9ea/,"At the same time, lots of people in this and other coronavirus subs have made comments like ""health is more important than the economy"" or ""who cares if a quarantine harms corporations if it keeps people healthy?"" It's a frustrating argument because it is so short-sighted. If people lose their jobs or their health coverage, they may not be able to pay medical bills / fill their prescriptions / etc. Economic problems have health consequences, too."
2020-02-16,C3R3B3,Coronavirus,5,https://www.reddit.com/r/Coronavirus/comments/f4z9zc/is_the_stock_market_about_to_crash_due_to_this/fhvjo51/,Possible. But I wouldn’t put money on it.
2020-02-16,Hooman1987,Coronavirus,5,https://www.reddit.com/r/Coronavirus/comments/f501ei/question_from_my_family/fhvny3m/,Sources say the virus can live about 9 days on a hard surface but most Chinese plants have not been running for a few weeks. It should be safe. Better to get cheap things like that while they’re still cheap.
2020-02-16,MassholeMikes,Coronavirus,5,https://www.reddit.com/r/Coronavirus/comments/f504eg/concerned_about_gp_advice_in_australia/fhvxc37/,I think it is a lack of test kits and lab availability. There are not enough test kits atm to test unconfirmed contacts. If they waste all the CV tests and lab techs on the common flu there will be no tests if the virus becomes more prevalent. This is the case around the world until test kit production & distribution can keep up with the spread.
2020-02-16,XxXMoonManXxX,Coronavirus,5,https://www.reddit.com/r/Coronavirus/comments/f50n7b/are_military_surplus_gas_masks_any_good/fhvwl1x/,No sir *but I can learn
2020-02-16,gamedori3,Coronavirus,5,https://www.reddit.com/r/Coronavirus/comments/f4upll/massive_delay_for_products/fhvxlj7/,"No, what is going to happen is that 50% of companies with just-in-time (JIT) logistics from China will go bankrupt, and some small boutique with domestic production will scale up to fill in 10% of the gap. After the pandemic is over, the boutique will have to pay off its bills for scaling up, but its prices will be undercut by the remaining JIT companies. The upstart will go bankrupt, leaving us with more monopolization of the marketplace, more dependency on third-world suppliers, and higher overall costs for shittier product."
2020-02-16,Geo-Nerd,Coronavirus,5,https://www.reddit.com/r/Coronavirus/comments/f4zvpg/new_singapore_downgrades_gdp_growth_forecast_to/fhvybjz/,"Singaopre is about the only country I have some trust in. For an authoritarian culture, they seem refreshingly open with their info."
2020-02-16,TecmoSuperBowl1,Coronavirus,5,https://www.reddit.com/r/Coronavirus/comments/f50l68/the_potential_lethality_of_the_coronavirus/fhvyknx/,"Wuhan has 11 million people. 70k people have it. That’s .7%. For what you’re saying to be true, 49.3% more have to catch it. Even on a ship that is an incubator for the virus we aren’t even at 50% yet. I hate these type of threads. So much flawed in what you’re saying.

Edit: fixed math that strengthened my post. Credit to Barz"
2020-02-16,seasonder,Coronavirus,5,https://www.reddit.com/r/Coronavirus/comments/f4y57t/i_work_in_a_major_academic_hospital_in_the_us/fhw0rmi/,"I do get what you’re saying here. Definitely don’t want mass panic, but I do like to be prepared and know that I am doing everything I can. Hopefully we’ll get more information soon."
2020-02-16,Nickadeamus36,Coronavirus,5,https://www.reddit.com/r/Coronavirus/comments/f4zsyh/coronavirus_wuhan_research_facility_could_be/fhvzi3r/,"It’s part of the Rupert Murdoch machine. So as respectable as FOX, which isn’t much. But it’s not exactly the National Enquirer either.

It’s on par with CNN, MSNBC, or FOX News. Again, not saying much."
2020-02-16,Iarguewithretards,Coronavirus,5,https://www.reddit.com/r/Coronavirus/comments/f50zhn/barrons_reported_that_the_mortality_data_out_of/fhw3p0k/,"Would love for a statistician to chime in, but the article pretty much explains that the data follows a simple curve with unexpectedly low variability given the nature of tracking a random process with many degrees of freedom.  

On the bright side, if you believe the numbers, China could potentially soon become the safest zone in the region when it comes to new detections and mortality from this virus."
2020-02-16,Mithmorthmin,Coronavirus,5,https://www.reddit.com/r/Coronavirus/comments/f51evq/cv_is_no_joke/fhw5xiw/,"You right, you right."
2020-02-16,jnoon1986,Coronavirus,5,https://www.reddit.com/r/Coronavirus/comments/f50vez/dont_be_the_first_one_to_get_caught_by_the/fhw4z77/,"Problem a lot of times is getting stable employees. A manufacturing plant around me hires almost anyone that applys about 4-5 people a week. Most quit within the first week, some make it a month, others make it longer and stay for life usually. They take everyone from a temp agency, even bus people in from nearby cities. People take long breaks, don’t come back from lunch it’s an ongoing thing for years. They will hire anyone that’s a warm body. They are shutting down lines weekly from a lack of workers... keep in mind these jobs are union, pay well, free health insurance etc. it’s just hard work, they used to make all the parts in their factory but now some are made in China then shipped over. They still have all the machines and could easy open up the second floor and make everything at this location again, but there is just not enough people to cover what they do now let alone a ramp up. They are the only manufacturer of what they make in US. It has nothing to do with health care or anything it’s an ag product that also has nothing to do with food supply (not trying to cause panic their business has zero impact on this to be clear) but they have employed a ton of people I know and they all say the same thing they need people who can do manual labor. Who are willing to work in a factory, and willing to work hard. they have to pay crazy amounts for employees and have the best benefits because of the union but even then can’t find enough people to do the job, so instead they can spend a fraction of the cost and save on some parts ordered and still employee at least part of the local community without packing and completely going overseas."
2020-02-16,ThatsJustUn-American,Coronavirus,5,https://www.reddit.com/r/Coronavirus/comments/f51c4e/will_coronavirus_push_china_to_get_more_desperate/fhw56jd/,> They ~~are~~ _were_ world’s 18% gdp.
2020-02-16,Timely-Biology,Coronavirus,5,https://www.reddit.com/r/Coronavirus/comments/f51ay3/23_weeks_ago_people_were_commenting_saying_well/fhwbesc/,"> Exponential curves start slow, 2, 4, 8, but it's the same rate of growth when it 2048, 4096, 8192... people don't understand math.

At least some of us who understand math are ""frantically"" prepping...."
2020-02-16,Kendralina,Coronavirus,5,https://www.reddit.com/r/Coronavirus/comments/f52dc1/any_preparation_recommendations/fhwbfap/,"Well I am in regards to pet food for sure. The rest I don't have crazy amounts but some of each for sure. 

I have like 10+ months stockpiled of pet food. I buy it on sale or clearance since with 5 pets I know it'll get used eventually. I didn't even need to prep... I've always joked I was ready when it came to pet food during the apocalypse. 😆

Also it's fair to note I live in Richmond BC which has the largest amount of Chinese in North America, they're all wealthy immigrants that travel, and we have the Vanvouver airport in my city too with zip in regards to screening protocol... so yeah know..."
2020-02-16,Timely-Biology,Coronavirus,5,https://www.reddit.com/r/Coronavirus/comments/f51lh9/shenzhen_factory_just_told_me_on_hold_till_virus/fhwaab4/,"Both countries are plausibly stretching the truth to downright lying.  PRC deaths reported as being from influenza are an implausible less than 200, which makes the PRC look good.  The US tries to guess what fraction of Influenza Like Illness deaths are actually from it, and very possibly goes over, which encourages more funding to fight it, improve vaccines and their production, and get people vaccinated.  A great deal of that directly transfers to fighting this new respiratory virus, like piggybacking community transmission testing on the flu testing infrastructure."
2020-02-16,junior_primary_riot,Coronavirus,5,https://www.reddit.com/r/Coronavirus/comments/f52dc1/any_preparation_recommendations/fhwbirn/,"Stores tend to have less pet food than people food so have a month or two on hand. Your pet can eat your “mistake” if nothing happens but a hungry, yowling, pacing-underfoot pet would be sad. Also, cat litter if applicable."
