date,author,subreddit,score,url,text
2020-02-06,Thailandorbust,Coronavirus,4,https://www.reddit.com/r/Coronavirus/comments/ezyhqc/taiwan_evacuated_its_citizens_from_wuhan_and_3_of/fgqjzcd/,"Blessings of a corrupt centralized system. Sure you can rescue your people, but 20% of the seats go to our cronies. 

How's this different than any other transaction in that system?"
2020-02-06,NotAChinaShill,Coronavirus,4,https://www.reddit.com/r/Coronavirus/comments/ezzpek/redditors_would_you_avoid_a_one_night_stop_over/fgqkc8a/, RemindMe! 6 Months
2020-02-06,BuckeyeJay,Coronavirus,4,https://www.reddit.com/r/Coronavirus/comments/ezzdhm/johns_hopkins_nuzzo_says_current_approach_to/fgqkjdy/,"This is actually a really good listen. And I thank everyone no matter if you're on a it's just a flu bro, or the world is ending. Track you should listen to this."
2020-02-06,A9-EE-78-6A-C8-9F,Coronavirus,4,https://www.reddit.com/r/Coronavirus/comments/f01vvj/why_are_only_chinese_coronavirus_patients_dying/fgr2m0u/,"BECAUSE IT CAN TAKE UP TO A MONTH FOR A PERSON TO DIE FROM  NCOV-2019

This is asked like every 10-15 minutes here. Google it"
2020-02-06,Iwannadrinkthebleach,Coronavirus,4,https://www.reddit.com/r/Coronavirus/comments/f02efl/i_wanted_to_share_the_experience_of_the_people_of/fgr2w46/,"Lol. No. Actually this happened with SARS as well. 

That's why WHO and the CDC were against travel bans. Travel bans show and uptick in racism and xenophobia.  

Unfortunately ignorant people are going to be ignorant. 

My son is a quarter Asian and has already gotten shit for this at school and hes 6. 

6 years old."
2020-02-06,ruggpea,Coronavirus,4,https://www.reddit.com/r/Coronavirus/comments/f02d7o/think_someone_is_lying_to_you_first_check_to_see/fgr2f81/,"A very long yet detailed thread that someone made using the data given. Almost everyday, the data given from the Chinese government has managed to fit some trend, which in theory shouldn’t happen with an epidemic. The results look too perfect."
2020-02-06,sleepie_head,Coronavirus,4,https://www.reddit.com/r/Coronavirus/comments/ezv58z/i_am_in_the_dallas_area_and_just_came_back_from_a/fgr33bl/,"It's because they're probably telling the truth. Maybe they didn't get all the details perfectly right, but the picture it paints isn't a pretty one. The thing I'm curious about is where did this doctor get his mortality rate from? If this is some kind of govt. doctor surely they have access to classified information regarding this virus? Is it really this deadly?"
2020-02-06,thestreamofthought,Coronavirus,4,https://www.reddit.com/r/Coronavirus/comments/f02efl/i_wanted_to_share_the_experience_of_the_people_of/fgr6c7p/,"I understand the fear even though the possibility is pretty low and I'm not judging you.

I'm referring more to those who use this virus as an excuse to be mean to Chinese and Asians in general."
2020-02-06,tearsinrain66,Coronavirus,4,https://www.reddit.com/r/Coronavirus/comments/f02gu9/how_does_self_quarantine_actually_work/fgr6mzm/,They don’t know what they are doing probably
2020-02-06,Adele811,Coronavirus,4,https://www.reddit.com/r/Coronavirus/comments/f02ytz/princess_diamond_wuhan_in_a_nutshell/fgr74zj/,"from what I read, it's the first test results coming in, they checked 200 or so people and had only 20 results the 1 day, etc"
2020-02-06,multiple4,Coronavirus,4,https://www.reddit.com/r/Coronavirus/comments/f02hqf/41_new_corona_virus_cases_on_board_yokohama/fgr7w39/,"The staff bringing food would wear protective gear of course, and they would do the same when bringing back the silverware and plates. They would make sure to wash it extremely well, which they already do anyways, but even more caution could be used. It's pretty much a machine anyways

I don't get how this is any different from quarantining them somewhere else though. So I don't get your point. They're going to have to get given food and other things regardless of whether they're on a cruise ship or in a facility on land. That's not any different

In fact I think that bringing them onto land from the boat and then still having to take care of them in a less isolated setting would be even more risk of spreading the virus"
2020-02-06,BuyMed,Coronavirus,4,https://www.reddit.com/r/Coronavirus/comments/f03c21/collodial_silver_coronavirus_remedy/fgr8plh/,It remedies your remedial intelligence.
2020-02-06,Jesus___H___Christ,Coronavirus,4,https://www.reddit.com/r/Coronavirus/comments/ezxsy4/chinese_reporter_qiushi_chen_has_gone_missing/fgr933a/,Yes my child?
2020-02-06,hubaloza,Coronavirus,4,https://www.reddit.com/r/Coronavirus/comments/ezvs2k/how_are_young_people_dying_from_this/fgptf12/,"H1N1 is a influenza virus, not a coronavirus, people are just comparing the two because they are familiar with the flu and that's their only metric of comparison."
2020-02-06,MeowNugget,Coronavirus,4,https://www.reddit.com/r/Coronavirus/comments/ezwflw/more_leaked_video_from_within_the_new_fangcang/fgpyyxu/,"That's an ignorant comment to make. People are sick and dying all over China, what do you expect them to do? Phones are source to spread information, to read the news, to contact your family who may still be at home while you're in a hospital. Would you rather they lay dying while staring at the ceiling?

If I was laying in a hospital while my country was going through a massive pandemic, you definitely find me on my phone trying to inform myself"
2020-02-06,ready-ignite,Coronavirus,4,https://www.reddit.com/r/Coronavirus/comments/ezwmt0/reality_on_the_ground_in_china_local_village/fgpxz70/,The question is whether not severe cases are detected. That's the biggest struggle with available data at the moment. If we're only identifying the cases that became serious there's a selection bias there.
2020-02-06,ekopec7,Coronavirus,4,https://www.reddit.com/r/Coronavirus/comments/f01l99/coronavirus_what_is_happening_in_america_right_now/fgqx49c/,Good to know
2020-02-06,ekopec7,Coronavirus,4,https://www.reddit.com/r/Coronavirus/comments/f01l99/coronavirus_what_is_happening_in_america_right_now/fgqww06/,"Case confirmed in Wisconsin, the last place you would expect. This is all we've had in a week

https://www.google.com/amp/s/www.nbcnews.com/news/amp/ncna1130946"
2020-02-06,mjp80,Coronavirus,4,https://www.reddit.com/r/Coronavirus/comments/ezzffk/7000_people_on_those_quarantined_cruise_ships/fgr4a2u/,"Yeah, an inside cabin on a cruise ship is generally so small that you can touch all the walls from your bed.  One small cabinet/dresser, a TV mounted on the wall, and a separate bathroom.  It would be miserable to be stuck in there."
2020-02-06,0-Joker-0,Coronavirus,4,https://www.reddit.com/r/Coronavirus/comments/f02kz1/peer_reviewed_study_smoking_not_being_asian_male/fgr4hpz/,"I mean, most smoking products contain nicotine.  But nicotine is more or less just a stimulant.  Its the radioactive metals and toxic chemical additives in smoking products thst make ot dangerous."
2020-02-06,nuli5593,Coronavirus,4,https://www.reddit.com/r/Coronavirus/comments/ezxsy4/chinese_reporter_qiushi_chen_has_gone_missing/fgr4yyt/,"The video was posted about 6 hours ago. 

According to the latest update, posted half an hour ago, on Chen Qiushi's Twitter (chenqiushi404), Mr. Chen is still missing. 

Mr. Chen has now been missing for more than 10 hours."
2020-02-06,NoamHedges,Coronavirus,3,https://www.reddit.com/r/Coronavirus/comments/ezus7n/coronavirus_canadian_stuck_on_cruise_ship_shows/fgpljm8/,"I'm with you on that, the British couple was asked if they will ever go on a cruise again, responded with absolutely we got 3 more cruises lined up this year. How we got this far baffles me"
2020-02-06,Copman5k,Coronavirus,3,https://www.reddit.com/r/Coronavirus/comments/ezy4kk/panic_genuine_question/fgqbcta/,"Quite a few posts, actually."
2020-02-06,LinkUnseen,Coronavirus,3,https://www.reddit.com/r/Coronavirus/comments/ezsjfw/warning_chinese_shills_are_patrolling_this_sub/fgq934q/,"They are not hospitals, even if you use that word.

They are quarantine prisons made from pre-fabricated sections.

Anyone could do this in a week if they just appropriate the workers and materials at no cost."
2020-02-06,whyohwhy1988,Coronavirus,3,https://www.reddit.com/r/Coronavirus/comments/ezy9jv/no_updates_on_new_numbers/fgq9url/,I should also say that bno news is updating based on info they are given and I think it's likely been said a million times that we have to take those #s with a grain a salt
2020-02-06,Atok48,Coronavirus,3,https://www.reddit.com/r/Coronavirus/comments/ezxg7h/there_is_gonna_be_a_recession_because_of_this/fgqbdek/,Economists have been predicting it since Trump was elected. PMI is above 50 which indicates manufacturing is expanding. You literally don’t know what you are talking about.
2020-02-06,Otadiz,Coronavirus,3,https://www.reddit.com/r/Coronavirus/comments/ezy25u/ncov19_china_rounding_up_all_infected_people_to/fgq8esp/,"Do you people like pay for NYT or what?

How are you reading these with their stupid pay wall in the way?

Can someone transcribe please."
2020-02-06,B-Clinton-Rapist,Coronavirus,3,https://www.reddit.com/r/Coronavirus/comments/ezw8zf/alaska_anchorage_school_district_admits_recently/fgq86cz/,Go to China then
2020-02-06,feudalismforthewin,Coronavirus,3,https://www.reddit.com/r/Coronavirus/comments/ezu0t4/the_third_person_in_the_uk_to_be_diagnosed_with/fgq88p7/,"*It is also notable this patient caught the infection abroad, it is not due to the York patients spreading the virus.*"
2020-02-06,Freezerburn_,Coronavirus,3,https://www.reddit.com/r/Coronavirus/comments/ezxz9n/if_the_corona_virus_was_a_movie/fgq9dn0/,"Also, if you watch the video and listen to the lyrics, the two might aswell be viruses excclaiming ""Woooohaaaan, got you all in check""

eerie..."
2020-02-06,Rbullock55,Coronavirus,3,https://www.reddit.com/r/Coronavirus/comments/ezv5hm/how_did_this_virus_transfer_itself_over_to_humans/fgpnbrf/,Chicken of the cave
2020-02-06,bamasmith,Coronavirus,3,https://www.reddit.com/r/Coronavirus/comments/ezv58z/i_am_in_the_dallas_area_and_just_came_back_from_a/fgpnuv5/,Got any paperwork or hospital related items to add some credibility?
2020-02-06,attemptingla,Coronavirus,3,https://www.reddit.com/r/Coronavirus/comments/ezvay7/everyone_who_gets_the_virus_dies/fgpos5p/,"1300 recovered patients. Anything? What it was like to have it? How they pulled through? What are they doing to keep their family safe? What have they been told? Are they still contagious after getting it, like shingles? Or is it just over like the flu?"
2020-02-06,Thelema_13,Coronavirus,3,https://www.reddit.com/r/Coronavirus/comments/ezv4sv/real_footages_and_number_has_been_leaked_this/fgpn9zn/,Fuck off facebook
2020-02-06,kcmuz,Coronavirus,3,https://www.reddit.com/r/Coronavirus/comments/ezvay7/everyone_who_gets_the_virus_dies/fgpobyl/,That person has yet to provide any proof of his hospital visit or anything...
2020-02-06,Hooligan30,Coronavirus,3,https://www.reddit.com/r/Coronavirus/comments/ezvs2k/how_are_young_people_dying_from_this/fgpssv3/,My understanding is that this Coronavirus compromises your airway like pneumonia does. Without medical attention you are at a risk of suffocating.
2020-02-06,cshaiku,Coronavirus,3,https://www.reddit.com/r/Coronavirus/comments/ezsdaa/anyone_else_feel_like_we_are_being_lied_to/fgpsksv/,"The US government is not the CCP, by any stretch. Never thought I'd actually compare the two in this way, but CCP is faaaar more efficient at this type of operation. Look at how fast they built two hospitals. How fast they locked down their cities. I doubt the US government can manage the same speed."
2020-02-06,Justjustin6969,Coronavirus,3,https://www.reddit.com/r/Coronavirus/comments/ezvofh/india_2826_suspected_coronavirus_cases_being/fgpsmdc/,India will be in just as bad if not worse shape then China. They are so densely populated and hygiene is not the best. This could get ugly.
2020-02-06,Nomadtv,Coronavirus,3,https://www.reddit.com/r/Coronavirus/comments/ezvrw5/quarantine_stations_us/fgpsmiw/,"Looking at it, it seems these are stations for EVALUATION and PROCESSING of quarantined peoples and goods, not storage."
2020-02-06,somethingsomethingbe,Coronavirus,3,https://www.reddit.com/r/Coronavirus/comments/ezvh9r/they_did_all_this_for_the_washington_state_case/fgqd37z/,"It’s a real shame that the US had a full time pandemic respond department and the entirety of it was fired by the Trump administration last year. 

I’d be less worried if I had some confidence in my government but it’s been mismanaged to shit and now we’re about to see what that does to a country as an emergency situation arises."
2020-02-06,droden,Coronavirus,3,https://www.reddit.com/r/Coronavirus/comments/ezsjfw/warning_chinese_shills_are_patrolling_this_sub/fgqdrz9/,china is asshoe
2020-02-06,PuddlesIsHere,Coronavirus,3,https://www.reddit.com/r/Coronavirus/comments/ezx481/is_it_happening_in_india_now/fgqeiio/,"Both applicable for Xi

""POOFLU"" OH BOTHER"
2020-02-06,tj13nl,Coronavirus,3,https://www.reddit.com/r/Coronavirus/comments/ezz4g3/genetically_engineered_pathogens_by_the_us/fgqg3xm/,3....
2020-02-06,best_damn_milkshake,Coronavirus,3,https://www.reddit.com/r/Coronavirus/comments/ezxp01/anyone_else_tired_of_seeing_the_2_mortality_rate/fgqdl7c/,"I think if we got a true death count we’d be closer to 20%. People compare this to the flu but you don’t hear stories of crematoriums being overrun by the flu, people dropping dead in the street from the flu, people in their mid 20s dying from the flu. The reported numbers a total crock of shit"
2020-02-06,givemefuelgimmefire,Coronavirus,3,https://www.reddit.com/r/Coronavirus/comments/ezyggd/fox_vietnam_britain_confirm_new_coronavirus_cases/fgqdzkp/,Still at 3 but it has since been confirmed that the 3rd British case was contracted in Singapore [https://www.bbc.co.uk/news/uk-51398039](https://www.bbc.co.uk/news/uk-51398039)
2020-02-06,Copman5k,Coronavirus,3,https://www.reddit.com/r/Coronavirus/comments/ezyrgx/government_not_being_transparent_with_case/fgqdwk4/,U/freezerburn_
2020-02-06,ThinkBankco,Coronavirus,3,https://www.reddit.com/r/Coronavirus/comments/ezyrgx/government_not_being_transparent_with_case/fgqei65/,What did u say?
2020-02-06,damienDev,Coronavirus,3,https://www.reddit.com/r/Coronavirus/comments/ezvgci/china_has_enough_control_over_their_citizens_to/fgpu4jr/,am i being detained?
2020-02-06,hbardot1,Coronavirus,3,https://www.reddit.com/r/Coronavirus/comments/ezw9hv/like_china_has_done_would_the_us_sacrifice/fgpvhkr/,yes. any country would imo
2020-02-06,SgtOz,Coronavirus,3,https://www.reddit.com/r/Coronavirus/comments/ezv9e9/death_rate_in_other_countries_is_only_so_low/fgpvzlm/,"i've actually thought about this, but you'd be taking a gamble, even a 5 or 6% chance is too high when it's your life that's on the line..."
2020-02-06,leteatgo,Coronavirus,3,https://www.reddit.com/r/Coronavirus/comments/ezv9e9/death_rate_in_other_countries_is_only_so_low/fgptxqq/,I don’t think US is imposing any regulations on people even if they traveled from Wuhan. I have a colleague who knows some people who have flown from Wuhan and have been roaming around the streets without having proper quarantine time.
2020-02-06,kinda_not_really,Coronavirus,3,https://www.reddit.com/r/Coronavirus/comments/ezvgci/china_has_enough_control_over_their_citizens_to/fgpwdj2/,"You mean my intelligence and ability to grasp the obvious?

I suggest you take your low IQ someplace else."
2020-02-06,grandmothertrillow,Coronavirus,3,https://www.reddit.com/r/Coronavirus/comments/ezv9e9/death_rate_in_other_countries_is_only_so_low/fgptqrh/,"Panic mongering. Yes it’s serious as fuck, but ruminating isn’t doing anything good"
2020-02-06,Headwest127,Coronavirus,3,https://www.reddit.com/r/Coronavirus/comments/ezvgci/china_has_enough_control_over_their_citizens_to/fgpvu8e/,The NG will want to be with their own families and nowhere near sick people.
2020-02-06,ShartSqueegee,Coronavirus,3,https://www.reddit.com/r/Coronavirus/comments/ezvgci/china_has_enough_control_over_their_citizens_to/fgpwcta/,"No national guard in any state has the manpower to enforce a quarantine state wide.  In Virginia for example there’s only about 7500.  Also, if the National Guard were deployed in certain areas of the state it’d probably start a hot conflict due to recent state politics (push for gun control and threats to deploy the national guard to enforce them with subsequent formation of militias saying “come and take them”)

Edit: also, you’d have to suspend posse comitatus which is no small feat"
2020-02-06,timaries3,Coronavirus,3,https://www.reddit.com/r/Coronavirus/comments/ezzffk/7000_people_on_those_quarantined_cruise_ships/fgqi5q6/,Why? Just curious
2020-02-06,FlyingDutchman1337,Coronavirus,3,https://www.reddit.com/r/Coronavirus/comments/ezz3rx/hi_if_anyone_has_any_questions_about_anything_i/fgqhhxz/,Ehh sure send it to me via pm! Or link the picture!
2020-02-06,th3allyK4t,Coronavirus,3,https://www.reddit.com/r/Coronavirus/comments/ezz8z5/was_the_coronavirus_started_by_the_chinese/fgqickp/,No one knows. But there rumours and reports of it being man made and backed up with some evidence. But then unless you are a biologist it may not make sense. It’s probably too early to make a call either way. But one thing is certain the response isn’t exactly military precision. More laurel and hardy episode.
2020-02-06,Copman5k,Coronavirus,3,https://www.reddit.com/r/Coronavirus/comments/ezy4kk/panic_genuine_question/fgqhsf2/,Just leave this guy alone. Has blinders on. Won’t win even if you are right :)
2020-02-06,cocobisoil,Coronavirus,3,https://www.reddit.com/r/Coronavirus/comments/ezyrgx/government_not_being_transparent_with_case/fgqjhfn/,"My parcel hasn't arrived, I want a refund."
2020-02-06,jalleNET,Coronavirus,3,https://www.reddit.com/r/Coronavirus/comments/ezwl5y/what_if_13_billion_chinese_just_decide_to_leave/fgpy6mh/,It's doesn't have to be air transportation only !
2020-02-06,tuitiontrap,Coronavirus,3,https://www.reddit.com/r/Coronavirus/comments/ezwhq2/coronavirus_cases_linked_to_singapore_meeting/fgpwtnr/,Malaysian and South Korean men diagnosed after visiting city
2020-02-06,Aviluxx,Coronavirus,3,https://www.reddit.com/r/Coronavirus/comments/f0577i/some_girl_passed_out_today_in_class_and_was_taken/fgrllg5/,Im not saying i do not believe you. I would love to know more about that situation as a whole
2020-02-06,GodsWarrior89,Coronavirus,3,https://www.reddit.com/r/Coronavirus/comments/f056zn/whats_the_end_game_here/fgrn367/,Or what if this is just a hoax and they’re preparing to invade?!?!  I’m just kidding guys.
2020-02-06,BACONisKEWLEST,Coronavirus,3,https://www.reddit.com/r/Coronavirus/comments/f03otp/rounding_up_the_infected_for_mass_quarantine/fgrk94q/,Any other large society that doesn’t have an armed populace. People always forget why the US constitution has a 2nd amendment.
2020-02-06,NiceBeaver2018,Coronavirus,3,https://www.reddit.com/r/Coronavirus/comments/f01j6i/garlic_water/fgqwj8z/,"*Forrest Gump Garlic Water*, in stores **NOW!**"
2020-02-06,Aqqusin,Coronavirus,3,https://www.reddit.com/r/Coronavirus/comments/ezzffk/7000_people_on_those_quarantined_cruise_ships/fgqszo1/,Because many Americans receive a very poor education.  I'm American and see the results every day.
2020-02-06,ElectronicEffective8,Coronavirus,3,https://www.reddit.com/r/Coronavirus/comments/ezzffk/7000_people_on_those_quarantined_cruise_ships/fgqv2d6/,do they have free wifi?
2020-02-06,FundamentalBasic,Coronavirus,3,https://www.reddit.com/r/Coronavirus/comments/f01bjn/what_chemicals_kill_novel_corona_virus_bleach_not/fgqvb0w/,"I have found some common household cleaning products that kill ""human Corona virus"".  I have found none that kill Novel Corona virus.  I have spent an inordinate amount of time reading labels in the past few weeks.  

If you'd like a list, let me know.

ETA:  this was Dettols statement regarding the latest strain of Corona virus:  

""As this is an emerging outbreak RB, like all manufacturers, doesn’t yet have access to the new virus (2019-nCoV) for testing and, as a result, are not yet in a position to confirm levels of effectiveness against the new strain.

“Our products have been tested against other coronaviruses (such as MERS-CoV and SARS-CoV) and have been found to kill those.”

So, bottom line is there are no products that have been clinically proven to kill the 2019 novel Corona virus.  It would be impossible to obtain this evidence at this point.  The best we can do is use products proven effective against prior strains."
2020-02-06,Severe_Clouds,Coronavirus,3,https://www.reddit.com/r/Coronavirus/comments/ezzdhm/johns_hopkins_nuzzo_says_current_approach_to/fgqt02p/,I do not know either way yet.  Too soon. We will know within the next 2 weeks.  But I do understand what you are saying. I promise that.
2020-02-06,JAS3808,Coronavirus,3,https://www.reddit.com/r/Coronavirus/comments/f009yk/yes_worry_about_coronavirus_those_saying_its_just/fgqtkq8/,And since you were smart and got your yearly flu shot you have little to worry about
2020-02-06,Diseased_Raccoon,Coronavirus,3,https://www.reddit.com/r/Coronavirus/comments/f01zfi/india_34_confirmed_cases_in_india/fgr0i9e/,I mean I can tell you I'm not a bot. I just think its shitty to title it like you did when they absolutely have not been confirmed. It's more likely that they're waiting on results.
2020-02-06,ImportantMarket0,Coronavirus,3,https://www.reddit.com/r/Coronavirus/comments/ezp8cq/germany_all_12_are_in_good_condition_close_to/fgr18m2/,"I have the same on my mind. I appreciate the good news so far,  but I believe the current status says nothing, because the known cases follow the pattern, 2 weeks no symptoms,  1 week mild symptoms,  suddenly very sick within few hours."
2020-02-06,Mymoggievan,Coronavirus,3,https://www.reddit.com/r/Coronavirus/comments/ezzffk/7000_people_on_those_quarantined_cruise_ships/fgr08tk/,"My friend thought this meant ""maggots."" (she does have a benign brain tumor, so I'll let it slide)."
2020-02-06,MasterMichael,Coronavirus,3,https://www.reddit.com/r/Coronavirus/comments/ezt30m/notice_directive_statements_encouraging_other/fgquzu8/,Gwyneth Paltrow save us!
2020-02-06,kiwicarlaburger,Coronavirus,3,https://www.reddit.com/r/Coronavirus/comments/ezxsy4/chinese_reporter_qiushi_chen_has_gone_missing/fgqwcmg/,"I'm shocked to, I'm from nz he was my main too!!!!  I hope he OK his poor mum!"
2020-02-06,ellelitellelit,Coronavirus,3,https://www.reddit.com/r/Coronavirus/comments/ezzffk/7000_people_on_those_quarantined_cruise_ships/fgqsdqe/,"Honestly, I think they are a microcosm of what will happen in those makeshift hospitals they just built in Wuhan. I'd watch very closely for the numbers."
2020-02-06,chimp73,Coronavirus,3,https://www.reddit.com/r/Coronavirus/comments/f00mvo/this_subreddit_is_blocked_in_google/fgqsiyj/,"Same for me. The sub itself does not seem to have a high page rank though, presumably because /r/news and /r/worldnews have much higher rank being more popular."
2020-02-06,Alcapachino,Coronavirus,3,https://www.reddit.com/r/Coronavirus/comments/f00yi9/why_has_a_city_like_nyc_not_seen_any_coronavirus/fgqsocc/,Because the world is reacting accordingly and with great care! Sometimes when I read the stuff here I think people have interest in boosting fear. Probably cause they are selling masks or have interest in a company that thrives with doomsdayshit
2020-02-06,Gonzalopabloandres,Coronavirus,3,https://www.reddit.com/r/Coronavirus/comments/f01vx4/update_638_dead_31439_infected/fgrca8c/,Omg today was a 5k increase? Damn
2020-02-06,mandalorian88-25,Coronavirus,3,https://www.reddit.com/r/Coronavirus/comments/f03b4w/if_we_make_it_to_march_5th_we_not_china_should_be/fgrd0zn/,"Except your forgetting to add in the 5 million Wuhan residents that fled the city before lockdown took place. Who knows where they are, and it only takes 1 sick person to start the whole cycle over again in other cities/countries so I would say we need to see a steady decline/no change in numbers until maybe April to say we are out of the woods on this. But that's just my opinion"
2020-02-06,ABigMang,Coronavirus,3,https://www.reddit.com/r/Coronavirus/comments/f02l9z/some_clarifications_regarding_coronavirus/fgr41vk/,All true except about Trump
2020-02-06,gldngrlee,Coronavirus,3,https://www.reddit.com/r/Coronavirus/comments/f01y9s/woman_who_is_forced_into_quarantine_in_a_box_this/fgr4rcq/,Her screams make me wonder if there was some type of inhalant in the box that she was being exposed to
2020-02-06,Sixsignatory,Coronavirus,3,https://www.reddit.com/r/Coronavirus/comments/f0250v/question_on_length_of_illness/fgr306l/,I thought the flu had to mutate slightly to get me again next year. Maybe im wrong.
2020-02-06,th4d3us,Coronavirus,3,https://www.reddit.com/r/Coronavirus/comments/ezyhqc/taiwan_evacuated_its_citizens_from_wuhan_and_3_of/fgr2n7l/,This virus will destroy the CCP
2020-02-06,Hooman1987,Coronavirus,3,https://www.reddit.com/r/Coronavirus/comments/f0250v/question_on_length_of_illness/fgr31fn/,This is true from what I’ve seen of Dr. John Campbell’s vids on youtube. Search him up. He’s great.
2020-02-06,Brother_YT,Coronavirus,3,https://www.reddit.com/r/Coronavirus/comments/f027l6/kc_director_of_public_health_is_still_comparing/fgr4oa6/,An P95 Rated mask will block 95% of all particles... the question becomes how infectious is it? Best you can buy is a P100 rated mask.
2020-02-06,Tkx421,Coronavirus,3,https://www.reddit.com/r/Coronavirus/comments/ezxt4v/they_are_screening_cruise_passengers_now_in_miami/fgr79v4/,apparently you weren't around when there wasn't any.
