date,author,subreddit,score,url,text
2020-02-16,morebucks23,Coronavirus,7,https://www.reddit.com/r/Coronavirus/comments/f4xetl/number_of_masks_needed/fhuxrf5/,"As a trained respiratory nurse I know how to keep safe and a mask is necessary, and goggles when in close proximity to a patient with active CORONA.
Yes they can keep other safe from you but a vented mask allows all particles out, doesn’t necessarily filter both ways. So fuck the government I’m wearing a mask when this gets worse and I’m dealing with the public."
2020-02-16,blazeayylmao,Coronavirus,7,https://www.reddit.com/r/Coronavirus/comments/f4xzq9/been_low_key_prepping_just_ordered_an_o2/fhuuhm8/,"Do you really need public approval for what you buy?

Others spend thousends, ten thousends, even hundreds of thousends of dollars on various hobbies."
2020-02-16,Iarguewithretards,Coronavirus,7,https://www.reddit.com/r/Coronavirus/comments/f51eui/its_been_almost_a_week_and_no_new_cases_in_usa/fhw4oll/,Why not C? That CDC admitted the test kits they sent to many states and foreign countries had defective reagents and gave inconclusive results.
2020-02-16,droden,Coronavirus,7,https://www.reddit.com/r/Coronavirus/comments/f519df/good_news_suspected_cases_down_from_28k_a_week/fhw6lcd/,Those Costco sized hot cot no drip lines in sight death Chambers count as hospitals?
2020-02-16,Glass-Country,Coronavirus,7,https://www.reddit.com/r/Coronavirus/comments/f4z7bj/nih_official_says_coronavirus_on_the_verge_of/fhvdjnl/,It allready is a global pandemic.
2020-02-16,broglesby74,Coronavirus,7,https://www.reddit.com/r/Coronavirus/comments/f4y57t/i_work_in_a_major_academic_hospital_in_the_us/fhvcpc2/,"Good advice. We dont need to be panicking to see everyone should be preparing for atleast a month of empty shelves. It most likely wont be a month where you arent able to get basic needs but preparing isnt hurting anyone. Its actually helping as there will be one less panic buyer fighting over what's left. 

I also agree that none of the other viruses in the last 20 years have made me this concerned. The likelihood the US doesnt have an outbreak is low in my mind."
2020-02-16,queenshirley666,Coronavirus,7,https://www.reddit.com/r/Coronavirus/comments/f516ec/355_on_cruise_infected_by_1_person_yet_we_are/fhwe6zp/,"I work in retail and it’s horrifying to see how many people don’t know/practice proper hygiene. I’ve had customers cough directly into my face. Customers openly coughing/sneezing into the air or into their hands before touching trolleys/goods. Not uncommon for customers to blow  their nose and discard the tissues on shelves or in trolleys. I stand a distance away from customers, carry hand sanitizer and do everything by the book- and I’ve still managed to get sick. My company has explicitly banned staff from wearing masks because it gives off the impression that we’re unclean or we think our customers are dirty. A formal complaint was made by a customer who saw a staff member sanitising self serve checkouts and eftpos machines, so we can’t do that in view of the customer. Australia is way behind other countries, and it’s disturbing. The classic Aussie “she’ll be right” attitude is at play once again."
2020-02-16,inmyhead7,Coronavirus,7,https://www.reddit.com/r/Coronavirus/comments/f4ypvs/daily_discussion_post_feb_17_2020_questions/fhvk7tf/,"Graphic NSFL, intubated patient of the coronavirus (viral pneumonia):

https://twitter.com/IsChinar/status/1229131031619477509"
2020-02-16,sweetchillileaf,Coronavirus,7,https://www.reddit.com/r/Coronavirus/comments/f4zwx1/do_you_feel_like_the_movie_titanic/fhvmf5c/,"It doesn't. 

But you get official media being very casual about it  

Then you get the number going down. 

Then you dont get many cases internationally. 
( here also no one seems to care that, people are not being tested if they didn't travel to china in the last couple of weeks or had a direct contact with the confirmed positive case) 

So it looks contained, for most people. It's just some nasty cold in far away china, some even believing that it doesn't affect caucasians the same way."
2020-02-16,Tactless2U,Coronavirus,7,https://www.reddit.com/r/Coronavirus/comments/f5097w/whats_your_immunityboosting_regimen/fhvtgff/,"My regimen:

1. 9 hours sleep 
2. One hour cardio exercise, one hour weights 3-4x/week
3. 80 oz water
4. Multivitamin plus B-complex vitamin 
5. Keto diet
6. Avoiding alcohol, drugs
7. Have been getting flu shots for last 20 years, got whooping cough booster a few years ago as well."
2020-02-16,metametapraxis,Coronavirus,7,https://www.reddit.com/r/Coronavirus/comments/f4upll/massive_delay_for_products/fhu6wyo/,"It will arguably hurt China less than the rest of the world. At the end of it, they can ramp up. All the western companies that chose to source everything from the cheapest alternative will be gone."
2020-02-16,Kopopo,Coronavirus,7,https://www.reddit.com/r/Coronavirus/comments/f50dt6/my_prep_run_experience_today_in_socal/fhvxgoc/,I saw something last night about zinc being out of stock. I think it's the active ingredient in some meds and may shorten the duration against some illnesses.  I'm not sure but did notice it was hard to find today
2020-02-16,NoLimitViking,Coronavirus,7,https://www.reddit.com/r/Coronavirus/comments/f4u0kr/when_is_it_time_to_leave_cities/fhtlu48/,Nobody will know until everybody knows
2020-02-16,jbdota2,Coronavirus,7,https://www.reddit.com/r/Coronavirus/comments/f4sxfl/cv_is_no_joke/fhu2ovs/,"And of course we get downvoted because we don’t just believe every negative thing without evidence, this subreddit"
2020-02-16,PutinsSpliffRoller,Coronavirus,7,https://www.reddit.com/r/Coronavirus/comments/f4u0kr/when_is_it_time_to_leave_cities/fhtk9l0/,Everybody should stay where they are. Self quarantine. Everyone freaking out and moving around will increase the likelihood of spreading it. Use your brains.
2020-02-16,H4v3m3rcy,Coronavirus,7,https://www.reddit.com/r/Coronavirus/comments/f4ypmi/schools_in_brighton_hove_and_eastbourne_have_told/fhva6lh/,"In the past month, there have been several districts closed in several states for widespread staff and student illness.  More than a few posters expressed concern about this, and all were quickly assured by others that it is not unusual for schools to close for widespread illness during the flu season."
2020-02-16,htownlife,Coronavirus,7,https://www.reddit.com/r/Coronavirus/comments/f538fq/japans_health_minister_urges_the_public_to_avoid/fhwg3dz/,"Yes. That would be a good example of a public gathering. According to my Plague Inc, Olympics are cancelled."
2020-02-16,MagMan1979,Coronavirus,7,https://www.reddit.com/r/Coronavirus/comments/f4zvpg/new_singapore_downgrades_gdp_growth_forecast_to/fhvmvt5/,Honesty is particularly painful in an era of total dishonesty and coverup.
2020-02-16,110andneveragain,Coronavirus,7,https://www.reddit.com/r/Coronavirus/comments/f4zvxl/covid_is_the_first_infodemic/fhvoyo0/,"These neoliberal technocrats are going to have to invent more than fancy new terms for news outside of the controlled narrative if this thing gets out of control.

&#x200B;

Going to be quite a few people unhappy and these types if they start losing family members because of PC language and 'filtered' information."
2020-02-16,Hooman1987,Coronavirus,7,https://www.reddit.com/r/Coronavirus/comments/f4zwx1/do_you_feel_like_the_movie_titanic/fhvpox9/,"This needs to be a pinned comment that everyone can refer to. There are real psychological reasons why things look the way they do right now. 

If, 3 weeks ago I had told my shrink about what I suspected about the coronovirus, I might be seen to have a delusion. I’m not even going to mention it now. No one is immune to this kind of thinking."
2020-02-16,[deleted],Coronavirus,7,https://www.reddit.com/r/Coronavirus/comments/f5096p/it_all_just_got_very_real_for_me_read_before_this/fhvqtmr/,[removed]
2020-02-16,Hooman1987,Coronavirus,7,https://www.reddit.com/r/Coronavirus/comments/f50dt6/my_prep_run_experience_today_in_socal/fhvt63m/,Good rundown. Thanks for sharing!
2020-02-16,jujucathulu,Coronavirus,7,https://www.reddit.com/r/Coronavirus/comments/f50npa/preparedness_strategy_discussion/fhvybfp/,"Thank you for this, people always give me the eye roll when I compare it to insurance from a home, health or car perspective."
2020-02-16,richiesutie,Coronavirus,7,https://www.reddit.com/r/Coronavirus/comments/f50zhn/barrons_reported_that_the_mortality_data_out_of/fhw127n/,"if you exclude Hubei, R2  is 0.998 so it hasn't really changed

if you include Hubei R2 is 0.9813.

globally with mainland china excluded (not hong kong) R2 = 0.9930

~~I'm going to find the swine flu data for comparison. will update in about 15mins~~

&#x200B;

This was fitting to a logistic model which is what you want when you want to show the epidemic is over."
2020-02-16,Literally_A_Brain,Coronavirus,7,https://www.reddit.com/r/Coronavirus/comments/f4u9ak/40_americans_evacuated_from_the_diamond_princess/fhumhbu/,"Please reread the parent comment. They are talking about a couple on the cruise ship, who are from TN. They are not in TN right now."
2020-02-16,stephanie0711,Coronavirus,7,https://www.reddit.com/r/Coronavirus/comments/f4udej/the_guy_from_maryland_who_said_he_saw_several/fhtp09o/,Can't find any info on CNN or BNO to confirm
2020-02-16,Teabaggening,Coronavirus,7,https://www.reddit.com/r/Coronavirus/comments/f51pnt/update_1775_dead_71330_infected/fhw6fzv/,Fake news
2020-02-16,ErshinHavok,Coronavirus,7,https://www.reddit.com/r/Coronavirus/comments/f50r4m/if_you_cant_provide_evidence_backing_up_your/fhw764g/,"This sub has turned into damn near a full blown trash fire, you can't stop it now. It's already been co-opted by preppers and doomers and conspiracy theorists. This subreddit is essentially theirs now. The battle with reality was lost."
2020-02-16,Kazemel89,Coronavirus,7,https://www.reddit.com/r/Coronavirus/comments/f521fu/japan_experts_decline_to_raise_alert_as_virus_not/fhw8bf4/,Impossible in Tokyo also 12 million people there
2020-02-16,Jauss123,Coronavirus,7,https://www.reddit.com/r/Coronavirus/comments/f4xlz4/where_are_all_the_interviews_from_the_recovered/fhv1xm5/,"She was discharged after being in a critical state..of course it sounded serious.

Isn't it good news that she could have a full recovery, even after being in a critical state?"
2020-02-16,Iarguewithretards,Coronavirus,7,https://www.reddit.com/r/Coronavirus/comments/f4yewn/why_do_stocks_continue_to_rise_in_the_face_of/fhv340i/,"I can think of a few reasons. 

Central banks engaging in quantitative easing through repo actions

China government prohibiting short selling 

Companies and funds supporting their holdings through exercise of repurchase agreements 

A view that supply chain interruptions will be limited and that lost time now can be recovered through overtime later.  

Understand that stuff we get from China to be sold here next three months is already on cargo ships and in transit.  The biggest concerns would be for stuff that is supposed to be here in the summer"
2020-02-16,A9-EE-78-6A-C8-9F,Coronavirus,7,https://www.reddit.com/r/Coronavirus/comments/f4xluj/dr_campbell_we_could_be_in_the_early_stages_of_a/fhv4s3d/,We were in the early stages up until we started making ships quarantine
2020-02-16,Crazymomma2018,Coronavirus,7,https://www.reddit.com/r/Coronavirus/comments/f4ufed/subtlety/fhu0mrr/,"I'm a function over fashion kind of gal, but asking for pockets is a bit too hopeful. Fashion industry will never get on the same page and put pockets in everything."
2020-02-16,Nutrionalfact,Coronavirus,7,https://www.reddit.com/r/Coronavirus/comments/f4ufed/subtlety/fhu1h73/,Were all going to die before womens clothing is functional.
2020-02-16,unwittycomment,Coronavirus,7,https://www.reddit.com/r/Coronavirus/comments/f50vez/dont_be_the_first_one_to_get_caught_by_the/fhwalzr/,"Funny, my ""how to survive the end of the world as we know it"" written in 2009, specifically called out JIT inventory's weakness.

I'm learning so much about logistics and manufacturing though..."
2020-02-16,BannedRemovedDeleted,Coronavirus,6,https://www.reddit.com/r/Coronavirus/comments/f51ay3/23_weeks_ago_people_were_commenting_saying_well/fhwbwad/,"some people will be immune so it's impossible for 100% of a population to be affected. In addition, some people will successfully isolate themselves from the virus."
2020-02-16,Kwak280,Coronavirus,6,https://www.reddit.com/r/Coronavirus/comments/f4z9zc/is_the_stock_market_about_to_crash_due_to_this/fhvdvjo/,"Bad stock advice. A roller coaster typically starts on the ground and if you stay on it till it hits the ground again, what was the point. But with stock you can end up underground."
2020-02-16,NepoDumaop,Coronavirus,6,https://www.reddit.com/r/Coronavirus/comments/f538s1/exempt_chinese_students_from_coronavirus_travel/fhwg39t/,Why are they immune?
2020-02-16,bionista,Coronavirus,6,https://www.reddit.com/r/Coronavirus/comments/f51lh9/shenzhen_factory_just_told_me_on_hold_till_virus/fhwegao/,It’s smart. The virus is not gone and if you have tons of people gathering again it breathes new life into the infection. Mass quarantine is needed. Take the short term pain to avoid massive long turn pain.
2020-02-16,used3dt,Coronavirus,6,https://www.reddit.com/r/Coronavirus/comments/f53cbv/us_hospitals_are_not_testing_people_so_what_do_we/fhwh0ts/,Welcome to the American medical system.  They hardly ever want to even test anyone here for the flu let alone for covid-19.  I truly fear this will hit us harder here than it is in China because how we handle our medical care
2020-02-16,WunWegWunDarWun_,Coronavirus,6,https://www.reddit.com/r/Coronavirus/comments/f4v911/one_out_of_ten_people_on_earth_right_now_is_under/fhvjszy/,"Yep. Yesterday I met up with different groups of friends for birthday parties and house warming and just asked people how they felt about it and stuff and everyone said “it’s not a big deal” “nothing to be concerned about” and I’m like, wait..what? How are they so certain, even dismissive? 

And the answer is because of psychology. Not only do they want to just ignore it, but they also think things will be okay because they’ve always been okay. But also, as far as they know there’s only a few cases here in the Us. What they haven’t realize is there are a few, known cases that have been tested, they haven’t put 2 and 2 that there are an unknown amount of people that have it and haven’t been confirmed by the cdc.

Im not saying there is definitely going to be an outbreak. But I’m well aware that’s still within the realm of possibility while no one seems to have acknowledged that..."
2020-02-16,flawy12,Coronavirus,6,https://www.reddit.com/r/Coronavirus/comments/f50876/is_reddit_full_of_doomers_or_are_we_actually_all/fhvqxrk/,"The outlook is grim.

Even the official numbers are disturbing and even China admits that the official numbers are not accurate.

The most disturbing thing is the severe cases, which is \~20%.

In a widescale outbreak that will quickly overwhelm medical capacity."
2020-02-16,TheCanOpenerPodcast,Coronavirus,6,https://www.reddit.com/r/Coronavirus/comments/f4zkd1/our_world_this_week_the_new_coronavirus_ncov_2019/fhvjrfl/,"Yes sir, That is why we must do our civic duty and spread the word."
2020-02-16,Johnny09876,Coronavirus,6,https://www.reddit.com/r/Coronavirus/comments/f4z9zc/is_the_stock_market_about_to_crash_due_to_this/fhvr747/,No.
2020-02-16,chefkoolaid,Coronavirus,6,https://www.reddit.com/r/Coronavirus/comments/f4zm1u/there_is_a_change_petition_for_the_resignation/fhvp19o/,And what is he gaining exactly....?
2020-02-16,prisonisariot,Coronavirus,6,https://www.reddit.com/r/Coronavirus/comments/f50vez/dont_be_the_first_one_to_get_caught_by_the/fhw1ax8/,"Because American workers require a minimum wage, benefits, and factories would be under US regulations so the companies couldn't squeeze every last penny of profit for their share holders with human rights violations."
2020-02-16,GroundhogMonth,Coronavirus,6,https://www.reddit.com/r/Coronavirus/comments/f50zhn/barrons_reported_that_the_mortality_data_out_of/fhw1abn/,"Can’t wait for China’s GDP numbers to be announced, next. 

I expect the same level of “realism” from those, as well."
2020-02-16,rainer_d,Coronavirus,6,https://www.reddit.com/r/Coronavirus/comments/f4x64d/container_shipping_exchina_grinding_to_a_halt/fhw42rk/,Rearranging the deck-chairs on the Titanic comes to mind.
2020-02-16,funkusernames,Coronavirus,6,https://www.reddit.com/r/Coronavirus/comments/f4uqlw/report_uprayers4wuhan_for_mass_farming_and_spam/fhtt651/,">Apologies if you have recieved this message more than once

lmao"
2020-02-16,glawk-fawty,Coronavirus,6,https://www.reddit.com/r/Coronavirus/comments/f4uz0a/bc_canada_corons_virus_case_in_the_bc_interior/fhtwnt2/,Canada’s going to burn and take the US with her
2020-02-16,used3dt,Coronavirus,6,https://www.reddit.com/r/Coronavirus/comments/f4v911/one_out_of_ten_people_on_earth_right_now_is_under/fhtzr8a/,The word doesnt mean anything to me.  The enactment of such measures does.  One because we and they know some of these measure are useless. Two governments dont like to spend money on shit like this yet they are throwing every last cent at it.  The things we are seeing happen have never happened on a scale such as this.
2020-02-16,redleafex,Coronavirus,6,https://www.reddit.com/r/Coronavirus/comments/f4uz0a/bc_canada_corons_virus_case_in_the_bc_interior/fhtz4da/,"Justin Trudeau won't risk hurting the feelings of anyone that gets infected. ""We need to learn to live together, through dialogue, healthy and infected people alike""

Seriously. If we start quarantining people, you'll start to read about all the taxpayer funded cash payouts for infringing on their rights. It could cripple us financially."
2020-02-16,johntwit,Coronavirus,6,https://www.reddit.com/r/Coronavirus/comments/f4vjme/the_trade_impact_of_the_virus_that_no_ones/fhu2sym/,Well for God's sake nobody talk about it until the NY Fed has a bailout plan in place! They only have til Tuesday!!!!!!!!!!!!!
2020-02-16,rubizza,Coronavirus,6,https://www.reddit.com/r/Coronavirus/comments/f4uo6n/i_just_flew_to_seattle_after_spending_almost_3/fhu5ds8/,Are you self-quarantining now? Please get tested before you return to hospital work!
2020-02-16,NoLimitViking,Coronavirus,6,https://www.reddit.com/r/Coronavirus/comments/f4w82b/the_us_is_finally_evacuating_americans_from_the/fhu8x8a/,It sucks but I'm sure both countries want to be sure no one is sick considering every time you turn around Japan has a new case.
2020-02-16,Trashcan1-8-7,Coronavirus,6,https://www.reddit.com/r/Coronavirus/comments/f4upll/massive_delay_for_products/fhug5u1/,"I was at Walmart last night and there are tons of clothing items, shoes and plastic goods at several of the stores in my area that have temporarily out of stock on them. Go to Walmart and have a look, you probably will be shocked. Also let's not forget that china makes 97% of our antibiotics."
2020-02-16,Racooncorona,Coronavirus,6,https://www.reddit.com/r/Coronavirus/comments/f4wncp/doctor_from_new_york_says_6_confirmed_cases_being/fhugdy5/,"It's amazing how you can post that comment having had 4 minutes to listen to a 22 minute video.


If it is a larp, he gives very intricate details."
2020-02-16,Starcraftduder,Coronavirus,6,https://www.reddit.com/r/Coronavirus/comments/f4sxfl/cv_is_no_joke/fhuf3s3/,"If this turns out to be true, ten my condolences. But I should warn everyone that OP has not verified anything with the mods and has a history of talking about things predating this cruise quarantine that corresponds with someone who wants his story to be true. Just be careful."
2020-02-16,used3dt,Coronavirus,6,https://www.reddit.com/r/Coronavirus/comments/f4v911/one_out_of_ten_people_on_earth_right_now_is_under/fhuacj6/,I am neither a doomer or bloomer. I am a big data and numbers modeler who works in civil engineering on large global projects.  I see numbers and I see the numbers are like nothing any living human has seen before.  Even the Spanish flu didnt come this fast and this strong. But there are over 10x the populations now and they didnt have air travel yet.
2020-02-16,waddapwuhan,Coronavirus,6,https://www.reddit.com/r/Coronavirus/comments/f4v911/one_out_of_ten_people_on_earth_right_now_is_under/fhud332/,"I noticed the media is now starting to pull the ""fake news"" card on all negative news"
2020-02-16,spotrocker0931,Coronavirus,6,https://www.reddit.com/r/Coronavirus/comments/f4x9zo/could_this_be_good_for_the_western_worlds/fhuokr5/,"Either way, it’s better to move these industries out of one of the most polluted, corrupt, and disease-harboring nations in the entire world. Fuck China."
2020-02-16,johnibizu,Coronavirus,6,https://www.reddit.com/r/Coronavirus/comments/f4x64d/container_shipping_exchina_grinding_to_a_halt/fhup3yh/,This is one aspect of the virus I have the most interest in and I heard a lot of companies are worried about this weeks ago so we will probably see unstocked shelves in small stores soon and probably Walmart and other large chains in weeks. Hope people take this more seriously by then.
2020-02-16,SirLunchmeat,Coronavirus,6,https://www.reddit.com/r/Coronavirus/comments/f4xg39/menu_items/fhunle9/,"My 2 cents.  Get stuff you like.  If you aren't a huge rice eater, pandemic isn't going to suddenly make you love it.  Get the seasonings, sides and garnish that make for an enjoyable meal.  If this cooks off in a big way, eating with loved ones may be  some of the rare solace we get.  Make it an enjoyable occasion.  Get the booze, get the smokes, get the dessert.  Whatever makes you content in regular life."
2020-02-16,globalhumanism,Coronavirus,6,https://www.reddit.com/r/Coronavirus/comments/f4xlz4/where_are_all_the_interviews_from_the_recovered/fhuq8fn/,"Alot of them might have sequelae. So even though they have recovered, they are still dealing with lingering issues"
2020-02-16,ne0ndistraction,Coronavirus,6,https://www.reddit.com/r/Coronavirus/comments/f4uanq/so_a_few_days_ago_the_chinese_government_let_out/fhtoasn/,This.
2020-02-16,Djgentlegiant,Coronavirus,6,https://www.reddit.com/r/Coronavirus/comments/f4u6l6/changing_names_is_changing_reality/fhtpdff/,"SARS-COV-2 is the official name of the virus 

the disease it causes is called COVID-19"
2020-02-16,MBird161,Coronavirus,6,https://www.reddit.com/r/Coronavirus/comments/f4sxfl/cv_is_no_joke/fhuv2pk/,"https://ktla.com/2020/02/12/tarzana-man-on-cruise-ship-quarantined-in-japan-hospitalized-for-coronavirus-symptoms-wife-says/

Just because I don’t follow the herd doesn’t mean I’m a liar."
2020-02-16,lyrastarcaller,Coronavirus,6,https://www.reddit.com/r/Coronavirus/comments/f4u57o/hadaka_matsuri_thousands_gather_for_japans_annual/fhtluyg/,Because it is.
2020-02-16,InfowarriorKat,Coronavirus,6,https://www.reddit.com/r/Coronavirus/comments/f4y57t/i_work_in_a_major_academic_hospital_in_the_us/fhw60rr/,I guess your screwed if you have symptoms and aren't in those 5 cities. Not that getting tested makes you not screwed.
2020-02-16,CnCz357,Coronavirus,6,https://www.reddit.com/r/Coronavirus/comments/f516c6/the_province_i_live_has_the_second_highest/fhw66xe/,"I totally believe the original poster. He is 100% not making up things!

Glad to hear the glorious CCP has the situation completely under control."
2020-02-16,CnCz357,Coronavirus,6,https://www.reddit.com/r/Coronavirus/comments/f5127g/so_no_more_updates_from_diamond_princess_now_that/fhw6k2r/,40 came back infected as of today
2020-02-16,PostHorror919,Coronavirus,6,https://www.reddit.com/r/Coronavirus/comments/f519df/good_news_suspected_cases_down_from_28k_a_week/fhw6llx/,You’re not fooling anyone
2020-02-16,glawk-fawty,Coronavirus,6,https://www.reddit.com/r/Coronavirus/comments/f51pnt/update_1775_dead_71330_infected/fhw75tt/,"You spent all your money on n95 masks and got into a fight with family over this, didn’t you."
2020-02-16,used3dt,Coronavirus,6,https://www.reddit.com/r/Coronavirus/comments/f4uanq/so_a_few_days_ago_the_chinese_government_let_out/fhtnqsd/,Welcome to 2020. Where we say two things at once and confuse everyone in hopes that when all is said and done we dont get sued for falsely representing this story or put on trial for killing millions with misinformation. :(
2020-02-16,pass_me_im_slow,Coronavirus,6,https://www.reddit.com/r/Coronavirus/comments/f4u5rt/the_problem_with_mortality_rate/fhtnmrj/,"It's the opposite. There are likely many more people infected with mild symptoms or no symptoms than people who have been in hospitals. 

https://twitter.com/michaelmina_lab/status/1228385323572482048

In almost every case like this where there is a pandemic the mortality estimates are almost always high: https://journals.plos.org/plosntds/article?id=10.1371/journal.pntd.0003846"
