date,author,subreddit,score,url,text
2020-03-28,Cbariotolkien,Coronavirus,1,https://www.reddit.com/r/Coronavirus/comments/fqj7lw/data_shows_amazon_raised_prices_during_pandemic/flqs4ra/,"I know this is probably a joke, but just in case you are serious, those are very inaccurate at lower temperatures."
2020-03-28,Donald303,Coronavirus,1,https://www.reddit.com/r/Coronavirus/comments/fqi4iv/japans_official_numbers_on_those_infected_by_the/flqs4tb/,Interim...thanks for posting
2020-03-28,GiganteTNC,Coronavirus,1,https://www.reddit.com/r/Coronavirus/comments/fqiyuy/portuguese_government_has_decreed_that_all_asylum/flqs583/,What? Your borders are not closed millions of people cross to Mexico and from Mexico EVERY DAY. How can you live there and know so little? The Portuguese Borders have been closed for 2 weeks now only trucks came in and portuguese people
2020-03-28,notoriousbsr,Coronavirus,1,https://www.reddit.com/r/Coronavirus/comments/fqj51h/three_industries_that_are_being_decimated_by_the/flqs592/,I wonder if Tom Bodett has turned out the lights at Motel 6 yet
2020-03-28,JugglingKnives,Coronavirus,1,https://www.reddit.com/r/Coronavirus/comments/fqco07/brazilian_hospital_started_using/flqsa7b/,"Yes, but you would need at least 1500 confirmed to do an actually clinical trial. I live in MN"
2020-03-28,Mr_Kurama,Coronavirus,1,https://www.reddit.com/r/Coronavirus/comments/fqc5fl/coronavirus_treatment_cost_could_exceed_1300_for/flqsacg/,"You mean using $10000 equipment hundreds of dollars in PPE a whole fucking room with an expensive bed, food , drugs and countless hours from brave professionals that go to school for years actually costs money??? What a surprise...."
2020-03-28,ojedaforpresident,Coronavirus,1,https://www.reddit.com/r/Coronavirus/comments/fqj7lw/data_shows_amazon_raised_prices_during_pandemic/flqsdns/,"If you're in a state like mine, where only 9k tests have been done, I can imagine it's really hard to get a positive result even if you have it. You basically need to be on your death bed or have pneumonia before you get tested. 

So yeah, the hoops to jump through to get a diagnosis are not to be understated, couple that with the cost of getting tested.

I know the test itself is free, anything else isn't. The visit, the flu tests they'll do, the treatment..

Can't imagine Amazon workers are flush with cash, so to get a diagnosis is.. well.. it's not easy."
2020-03-28,dimitrilatov,Coronavirus,1,https://www.reddit.com/r/Coronavirus/comments/fqjtf9/coronavirus_the_panic_is_unjustified_an/flqsdzq/,"I've posted the newest interview in another series of comments. although he was taken out of context. he maintains that the numbers aren't certain, but he agrees with the quarantine of his country"
2020-03-28,redmongrel,Coronavirus,1,https://www.reddit.com/r/Coronavirus/comments/fqb49e/fda_approve_test_that_can_generate_a_positive/flqse01/,"This is a different test, albeit for a different device, also from Abbott. So for this one you need a Nespresso."
2020-03-28,StupidBlueLady,Coronavirus,1,https://www.reddit.com/r/Coronavirus/comments/fqkvgc/new_york_medical_workers_decry_abysmal_lack_of/flqshxi/,"> “Right now, at this stage – and I’ve said this and I continue to say it – the risk to the American public is low,” CDC Director Robert Redfield. - Feb 28, [source](https://www.courthousenews.com/public-risk-for-coronavirus-remains-low-cdc-director-tells-congress/)"
2020-03-28,Superbuddhapunk,Coronavirus,1,https://www.reddit.com/r/Coronavirus/comments/fqkxqp/stacks_of_urns_in_wuhan_prompt_new_questions_of/flqshug/,"Your post or comment has been removed because

* **Reposts will be removed.** Reposts also cover new posts containing only information that has already been posted. ([More Information](https://www.reddit.com/r/Coronavirus/wiki/edit/rules#wiki_rule_3.3A_avoid_reposts))

*If you believe we made a mistake, please [message the moderators](/message/compose?to=/r/Coronavirus).*"
2020-03-28,estielifer,Coronavirus,1,https://www.reddit.com/r/Coronavirus/comments/fq2esv/bill_gates_entire_country_needs_to_shut_down_for/flqsn6a/,"That is so very kind of you. Making those choices, knowing that yes, it's your 10 staff members making those sacrifices too, but their family and loved ones that will feel the pinch too. I just couldn't live with myself if one of them, or any of our community was put at risk, knowingly. I wish we had the full story, from day one. I would have closed much sooner, but I'll have to live with that.
Our businesses will be ok. I'm confident in it, because while this is possibly, the crappiest situation we've yet faced, the acts of kindness we have seen and the warmth from our clients, I'm reassured, deeply. 
I hope that you and yours find ways to support each other, and stay well. 
Apologies for the lengthy reply, but thank you. It was lovely to wake up to such supportive words from a stranger, and I'm grateful for the reddit community also!"
2020-03-28,ct314,Coronavirus,1,https://www.reddit.com/r/Coronavirus/comments/fq2esv/bill_gates_entire_country_needs_to_shut_down_for/flqsr6a/,We’ve already tried killing processes in task manager. CT’s Alt Del isn’t responding. Next steps: try the power button or unplug us for 30 seconds and then plus us back in.
2020-03-28,Minja87,Coronavirus,1,https://www.reddit.com/r/Coronavirus/comments/fqkk56/daily_discussion_post_march_28_questions_images/flqsrag/,"I am a healthy and fit 32 year old male. If I contract COVID-19, what will my symptoms be and why?"
2020-03-28,goosetavo2013,Coronavirus,1,https://www.reddit.com/r/Coronavirus/comments/fqaagt/mexicos_health_secretary_hangs_up_call_after/flqsqy3/,"I agree on AMLO events. Since they announced phase two measures his rallies are now off and he's asking the adoring masses to stop chasing after him. Well see if it works.
He should started sooner. The President's force is a moral one."
2020-03-28,janosss123,Coronavirus,1,https://www.reddit.com/r/Coronavirus/comments/fqj7lw/data_shows_amazon_raised_prices_during_pandemic/flqsr2v/,Jeff bezoz wins scumbag of the year
2020-03-28,Own_Nature,Coronavirus,1,https://www.reddit.com/r/Coronavirus/comments/fqk6aa/governors_are_starting_to_close_their_borders_the/flqsv3n/,"Why? The virus is everywhere now. When closing borders may actually have helped, they didn't. Why bother now? So they can wreck what little normalcy we have by ruining our supply network? Oh yeah, that'll end well."
2020-03-28,lafigatatia,Coronavirus,1,https://www.reddit.com/r/Coronavirus/comments/fqiyuy/portuguese_government_has_decreed_that_all_asylum/flqsv4h/,"What's the total increase people with access to healthcare? 0,1%? And even if it was more, how do you morally justify 'saving your own people' and letting them die? Are some lifes worth more than others?"
2020-03-28,Ketchup-and-Mustard,Coronavirus,1,https://www.reddit.com/r/Coronavirus/comments/fqj7lw/data_shows_amazon_raised_prices_during_pandemic/flqsvfp/,You’re not wrong they’re all fucked up. I think Amazon has become and continues to to become more and more powerful which is why they are scrutinized more.
2020-03-28,Vorsprung1234,Coronavirus,1,https://www.reddit.com/r/Coronavirus/comments/fq6zm5/millions_of_undocumented_workers_in_the_us_wont/flqszgt/,"Not just “fake” social security numbers, stolen social security numbers. That belong to someone else. Those people then face the challenge of dealing with ruined credit, identity theft, unable to file their taxes etc."
2020-03-28,PlayOnDemand,Coronavirus,1,https://www.reddit.com/r/Coronavirus/comments/fqkwz8/stay_fit_to_fight_the_virus/flqsz4n/,"This.

No need to tear anything down. Just get those mitachondria working better, get your stamina up, blood pumping and lungs built up. 

The comments about athletes finding the virus extremely draining are irrelevant. 

Ask yourself one question:

Who has a better chance at beating this virus? You, or you who is 1-3 months fitter?"
2020-03-28,MandatoryMoose,Coronavirus,1,https://www.reddit.com/r/Coronavirus/comments/fqkuxb/uk_reports_2510_new_cases_of_coronavirus_and_260/flqsze1/,"That new model stating we would peak at 250 deaths a day and only have 5700 deaths didn't age well, and it's only been out a few hours."
2020-03-28,seventeenninetytwo,Coronavirus,1,https://www.reddit.com/r/Coronavirus/comments/fqk31g/dc_hospital_nurse_resigns_over_lack_of_ppe/flqsz2x/,"2003 Iraq invasion we did exactly that. Sent them without sufficient armored vehicles too, many of the early humvees could be penetrated by small arms."
2020-03-28,pegothejerk,Coronavirus,1,https://www.reddit.com/r/Coronavirus/comments/fqkbrn/federal_ppe_supplies_for_oklahoma_come_in_short/flqszik/,"Yep, I am."
2020-03-28,teokun123,Coronavirus,1,https://www.reddit.com/r/Coronavirus/comments/fqftat/trump_issues_order_to_bring_former_troops_back_to/flqt44v/,Shoot Americans with guns
2020-03-28,whymylife,Coronavirus,1,https://www.reddit.com/r/Coronavirus/comments/fqj7lw/data_shows_amazon_raised_prices_during_pandemic/flqt4d9/,"Is it just me that really doesn't see the huge deal? I'm working class by any metric but doesn't supply & demand dictate pricing? When a product suddenly gets a surge of demand, you can't meet it with demand so surely you put up the prices???"
2020-03-28,BleedingCello,Coronavirus,1,https://www.reddit.com/r/Coronavirus/comments/fqka8u/we_now_know_who_societys_essential_workers_are/flqt4dh/,"Well, that's unfortunate."
2020-03-28,MayorOfBluthton,Coronavirus,1,https://www.reddit.com/r/Coronavirus/comments/fqjyxj/facing_shortage_detroit_area_hospitals_could_soon/flqt82o/,"Haha, no worries.

Can’t you picture it? The Cheeto thinking (and probably saying out loud, and may possibly tweet later tonight):

“Michigan could get more help, as much as they need, a huge amount of help, if they’d only be nice to me! Instead that governor (such a whiny lady!) insults the tremendous work I’ve done! No gratitude, no appreciation! Don’t attack me and then expect favors! Sorry they’re overwhelmed, but I take no responsibility for the problems they’ve created for themselves. #nexttimesayplease #notmyfault”"
2020-03-28,1984Summer,Coronavirus,1,https://www.reddit.com/r/Coronavirus/comments/fql2ls/in_flying_intensive_care_unit_bundeswehr_brings/flqt839/,"Yes, I think it's merely symbolical as a reply to Russia and China flying in aid. The EU was really pissed of by that. 

Now there is this flight with 6 people. Well documented and communicated to the press with professional footage by forewarned journalists. To show European 'unity', whilst all countries are battling over supplies in reality."
2020-03-28,mdma-_-,Coronavirus,1,https://www.reddit.com/r/Coronavirus/comments/fqhnt3/covid19_germany_sees_low_fatalities_despite_high/flqt7yp/,"My bad, the conference is linked in the article:
https://m.facebook.com/tagesschau/videos/243812243453095/?v=243812243453095&notif_id=1584694894382298&notif_t=live_video"
2020-03-28,DaBIGmeow888,Coronavirus,1,https://www.reddit.com/r/Coronavirus/comments/fqh30z/s_korea_begins_mandatory_14day_selfquarantines_on/flqt87f/,"95% confidence interval for incubation (time-from-exposure-to-symptoms) is between 2 to 11 days with an average of 5 days. There are some outliers up to 30 days, but those are rare."
2020-03-28,cyberwitchpress,Coronavirus,1,https://www.reddit.com/r/Coronavirus/comments/fqfjzz/governors_coronavirus_pacts_could_thwart_trump/flqtcyr/,"I don't know why people are arguing with you. I'm a US citizen, and I'm worried about all the same things you bring up in this thread. This country is on the borderline of a pandemic and a political disaster. Ignoring the utter child sitting in our presidential seat, the rest of our governmental leadership is too busy arguing bipartisan politics to care about doing what's necessary for the people. 

It all feels geared towards an epic explosion. We will not emerge from this the same. Anyone who thinks we will isn't paying close enough attention."
2020-03-28,KingTomenI,Coronavirus,1,https://www.reddit.com/r/Coronavirus/comments/fqcgvp/er_doctor_who_criticized_bellingham_hospitals/flqtcni/,They are trying to terrorized the other employees from speaking out.
2020-03-28,togflogger,Coronavirus,1,https://www.reddit.com/r/Coronavirus/comments/fqkwz8/stay_fit_to_fight_the_virus/flqtcky/,"people in poor health right now can't improve shit in 2 weeks. they can maybe get their diet straightened out to be have a nicer poo consistency and reduce bloat to ""feel"" better, but their body isn't stronger yet

and a lot of people who are in bad shape think weights = getting in shape. if you go from not lifting to lifting, your first week is gonna see muscles so fucking sore you can't move, your body is literally weaker because it's focusing on repairing all that damage you did to your muscles

the first 2 weeks of ""getting in shape"" for someone who isn't in average shape at least is not a good time to get sick. 

you're not going from overweight to not overweight in 2 weeks unless you go on an all-water diet which again, weakens you

it takes time, this isn't the time to start getting healthy to fight a sickness, but maybe it's time to think about it"
2020-03-28,PantyPixie,Coronavirus,1,https://www.reddit.com/r/Coronavirus/comments/fqb49e/fda_approve_test_that_can_generate_a_positive/flqtiae/,"Im with you on that. You should read the book [""Unequal Protection- the rise of corporate personhood and the theft of human rights"" by Thom Hartmann.](https://www.thriftbooks.com/w/unequal-protection-the-rise-of-corporate-dominance-and-the-theft-of-human-rights_thom-hartmann/327595/item/4098263/?mkwid=PPy9YqZj%7cdm&pcrid=70112878392&product=4098263&plc=&pgrid=21323665512&ptaid=pla-292616666826&utm_source=google_shopping&utm_content=PPy9YqZj%7cdm%7cpcrid%7c70112878392%7cpkw%7c%7cpmt%7c%7cproduct%7c4098263%7cslid%7c%7cpgrid%7c21323665512%7cptaid%7cpla-292616666826%7c&gclid=Cj0KCQjw6_vzBRCIARIsAOs54z6K26r_ItgZ9q5aWxS1RJBQulpx1AzM_lfEQvXMudQnjdi0OM2-WCAaAq2WEALw_wcB#isbn=1605095591&idiq=4098263)
There's chapter after chapter of tracking exactly what you described. Big pharma corporation wants to push a drug or big chemical wants to push an agent but neither would pass with the current FDA and EPA restrictions...so what do they do? The head of marketing quits their job with the corporation and gets a seat on the FDA / EPA board and removes the regulation or at least makes it difficult for competitors to push their products.

I bought a dozen+ copies of this book in 2006/7/8 and was just giving them away. Fascinating and infuriating information that's easy to understand. I couldn't put it down.

But back to the topic, 
WHO tweeted that they don't see issue with using ibuprofen [but the tweet had a cautious undertone](https://twitter.com/WHO/status/1240409220916432899?s=20) with the use of double negatives...

WHO is probably the most trust worthy agency right now but better safe than sorry I guess.


Stay safe.

And get a copy of that book!"
2020-03-28,X-TinaRN,Coronavirus,1,https://www.reddit.com/r/Coronavirus/comments/fqkbcz/doctor_arrested_after_being_accused_of/flqtiby/,yes
2020-03-28,BaconIpsumDolor,Coronavirus,1,https://www.reddit.com/r/Coronavirus/comments/fqkvgc/new_york_medical_workers_decry_abysmal_lack_of/flqti4c/,"Right then, at that stage, he was right."
2020-03-28,GuybrushBeeblebrox,Coronavirus,1,https://www.reddit.com/r/Coronavirus/comments/fqhy3p/fox_business_parts_ways_with_trish_regan_host_who/flqthxd/,I wonder just how much these people earn for peddling stupidity
2020-03-28,OutsidePain6,Coronavirus,1,https://www.reddit.com/r/Coronavirus/comments/fqkk56/daily_discussion_post_march_28_questions_images/flqtmzm/,"Looks great und nice UI, thanks"
2020-03-28,D3vst8r96gt,Coronavirus,1,https://www.reddit.com/r/Coronavirus/comments/fq74nx/rcoronavirus_is_looking_for_new_moderators/flqtrwg/,"No mods from political subs. 
Make sure they can describe a rule 4 violation."
2020-03-28,KindlyBasket,Coronavirus,1,https://www.reddit.com/r/Coronavirus/comments/fqb49e/fda_approve_test_that_can_generate_a_positive/flqtrrx/,no shit. when you're extra sick you take more meds... what is puzzling you about this?
2020-03-28,cosgd,Coronavirus,1,https://www.reddit.com/r/Coronavirus/comments/fqkrj0/singapores_covid19_cases_exceed_800_with_70_new/flqtvw0/,"We were doing the right things, but it wasn't water-tight. The tens of unlinkable cases all this while, as well as any asymptomatic carriers from the beginning, are probably going to be our undoing, as we are seeing a rise now in unlinked cases."
2020-03-28,griffdog82,Coronavirus,1,https://www.reddit.com/r/Coronavirus/comments/fqgohs/huawei_donates_10000_n95_masks20000_isolation/flqtw1z/,"Wrong, America bad"
2020-03-28,Vort-ai,Coronavirus,1,https://www.reddit.com/r/Coronavirus/comments/fql90q/new_study_by_pr_raoult_using_hydroxycholoroquine/flqtw6w/,"81% is essentially clickbait, it's a very low base"
2020-03-28,mep2367,Coronavirus,1,https://www.reddit.com/r/Coronavirus/comments/fq6zm5/millions_of_undocumented_workers_in_the_us_wont/flqu01f/,So you’re advocating for letting these crucial workers obtain legal status to let them work? Super idea!
2020-03-28,EpicBananapus,Coronavirus,1,https://www.reddit.com/r/Coronavirus/comments/fql6xi/coronavirus_teenage_boy_whose_death_was_linked_to/flqu05b/,Urgent care centers are not equipped with ventilators nor have the level of care he would have needed if he was hours from dying. I heard in a comment that the urgent care center could have called an ambulance and that might have been more helpful. Awful situation.
2020-03-28,ManBoobs13,Coronavirus,1,https://www.reddit.com/r/Coronavirus/comments/fqbkg2/second_coronavirus_test_comes_back_negative_for/flqu0g5/,"Ok but this was a sudden death it seems, so even having the option to have the entire hospital to herself wouldn’t have helped bc she wouldn’t have made it there"
2020-03-28,Yoghurt42,Coronavirus,1,https://www.reddit.com/r/Coronavirus/comments/fqhnt3/covid19_germany_sees_low_fatalities_despite_high/flqu0cd/,"The RKI (think Germany's CDC) said that they count every death of a confirmed positive as COVID-19 related death, regardless of the cause of death."
2020-03-28,squishy_bear,Coronavirus,1,https://www.reddit.com/r/Coronavirus/comments/fqb6gk/senators_urge_overhaul_of_gay_donor_restrictions/flqu5ls/,"Fun fact, it's an irrelevant law until it isnt, every country has them."
2020-03-28,its_me_ask,Coronavirus,1,https://www.reddit.com/r/Coronavirus/comments/fqgpji/johns_hopkins_says_didnt_authorize_cddep_to_use/flqu5pz/,"Exactly. Ramanan Laxminarayan. He has already given interview for BBC, Rahul Kanwal of India Today, Barkha Dutt prominently and posted articles on The New York Times and Outlook India from what I have seen so far. Clearly enjoying limelight and giving irresponsible statements and causing fear mongering."
2020-03-28,Jutboy,Coronavirus,1,https://www.reddit.com/r/Coronavirus/comments/fqa0yl/the_pentagons_big_problem_how_to_prepare_for_war/flquapf/,This administration has brought up attacking both North Korea and Iran... and what does this administration matter?  The US has been involved in constant armed conflict since WWII... Learn a little history.
2020-03-28,Lemonadeok,Coronavirus,1,https://www.reddit.com/r/Coronavirus/comments/fqkk56/daily_discussion_post_march_28_questions_images/flquaq6/,I’m worried about the weather warming up. It’s been raining here but as soon as it warms up I can see that happening. The city  where my dad lives banned people from going to parks.
2020-03-28,hungryprego,Coronavirus,1,https://www.reddit.com/r/Coronavirus/comments/fqj7lw/data_shows_amazon_raised_prices_during_pandemic/flqub0t/,"This is true!!! I over paid for diapers at 53 bucks I just got sent a refund after they pushed my order back weeks, for them to refund my money and say they were never going o ship my item....so fast forward to receiving refund...I receive said 53 bucks...I go to reorder Amazon  has now raised its prices AGAIN and the exact same diapers are n ow 55 and some change...FUUUUCCCK JEFF BEZOS YOU SELFISH FUCK!. how dare this rich ass idiot who just bought the most expensive property in california....even dare to ask people to give to his relief fund for his own company making millions....btw for anyone who didnt know this dipshit really built a relief fund for amazon and is asking people to donate to it!!! For real??? How bout u step off that high horse bring ur prices back down and stop price gouging like every other ungodly asshole trying to bank off of the world's struggle right now!"
2020-03-28,limache,Coronavirus,1,https://www.reddit.com/r/Coronavirus/comments/fqkk56/daily_discussion_post_march_28_questions_images/flqub1a/,"Ah okay well I don’t work in the medical field. 

I was thinking maybe people in the import export business would be better. I don’t think doctors would know this (the verification side of it) and leave it up to administrators"
2020-03-28,AutoModerator,Coronavirus,1,https://www.reddit.com/r/Coronavirus/comments/fqld48/now_i_finally_understand_what_my_grandparents_knew/flquard/,"Automatic translation [here](https://translate.google.com/translate?sl=auto&tl=en&u=https://www.cnn.com/2020/03/28/opinions/coronavirus-grandparents-glock/index.html)

*I am a bot, and this action was performed automatically. Please [contact the moderators of this subreddit](/message/compose/?to=/r/Coronavirus) if you have any questions or concerns.*"
2020-03-28,Im_Not_Crazy_I_Swear,Coronavirus,1,https://www.reddit.com/r/Coronavirus/comments/fqckfj/the_number_of_recoveries_now_exceeds_the_number/flquehq/,See. Don’t trust the government!!!
2020-03-28,yaronSoo,Coronavirus,1,https://www.reddit.com/r/Coronavirus/comments/fqld8b/more_americans_should_probably_wear_masks_for/flques4/,Yea shoulda started doing that a month ago
2020-03-28,evil_666_live,Coronavirus,1,https://www.reddit.com/r/Coronavirus/comments/fql5cj/brazil_leader_wants_to_end_social_distancing_even/flquedt/,"Perhaps he is one of those what are on broad with ""packed church, beautiful thing"""
2020-03-28,Jankensolvesall5512,Coronavirus,1,https://www.reddit.com/r/Coronavirus/comments/fqje0d/coronavirus_what_if_this_had_happened_in_2005/flquev5/,I would have finished college since I couldve done it remotely
2020-03-28,andstayfuckedoff,Coronavirus,1,https://www.reddit.com/r/Coronavirus/comments/fql90q/new_study_by_pr_raoult_using_hydroxycholoroquine/flquo5t/,"You're joking, right? By simple scaling even this ""cheap"" product could sell for a total of tens of billions of dollars.

You're not getting downvoted because you're wrong, which you are, but you're getting downvoted because you're retarded, which you are."
2020-03-28,relaxedguy,Coronavirus,1,https://www.reddit.com/r/Coronavirus/comments/fqaxzb/federal_officials_repeatedly_warned_that_us/flquo80/,Billionaire on paper. Let's talk about his debts and 6 bankruptcies and how many shitty failed businesses?
2020-03-28,thekeel,Coronavirus,1,https://www.reddit.com/r/Coronavirus/comments/fqixw2/coronavirus_kills_man_61_and_daughter_33_in_space/flqunzc/,Eggs do not clog any arteries. That’s old bunk science
2020-03-28,TherealPrincessbella,Coronavirus,1,https://www.reddit.com/r/Coronavirus/comments/fqld8b/more_americans_should_probably_wear_masks_for/flquo41/,Honestly i am so tired of people being like don’t wear mask they don’t help but honestly WHOOOO THE HELL CARES IM WEARING ONE ANYWAYS BETTER SAFE THEN SORRY IM SO ANNOYED WITH EVERYBODY WHO DOESNT HAVE A MASK ON LIKE WHAT ARE YOU DOING???
2020-03-28,deepspaceneutral,Coronavirus,1,https://www.reddit.com/r/Coronavirus/comments/fqkk56/daily_discussion_post_march_28_questions_images/flqurx3/,"Yall are doing the right thing staying in! Could you try joining Next Door or a local FB group? Folks have been offering to pick things up for others in my area. This is also a time to maybe ask coworkers or neighbors for help, since you don't have family in the area. I'm sure you've already researched it, but look into either general delivery services (like instacart) or store-specific services (a few grocery chains in my area & target have their own delivery services available).

I hope you guys feel better soon!"
2020-03-28,aZamaryk,Coronavirus,1,https://www.reddit.com/r/Coronavirus/comments/fqkpsh/france_orders_a_total_of_a_billion_masks_from/flquwdy/,"Thank you china, savior of the world, because other countries are incompetent, apparently."
2020-03-28,JJJMT,Coronavirus,1,https://www.reddit.com/r/Coronavirus/comments/fqkk56/daily_discussion_post_march_28_questions_images/flquwis/,"No one really knows, everyones just guessing rn. I think in the next 3 months we'll know enough to pin down a date/timeline for when this ends.

My guess, could last 3\~4 months or 2\~4 years or even longer."
2020-03-28,Mart243,Coronavirus,1,https://www.reddit.com/r/Coronavirus/comments/fqkklr/south_korea_routinely_massdisinfects_its_urban/flquwjw/,Doesn't that kill a bunch of insects and animals?  Surely we'll pay for this mistake for years (ie: a bit like the dying bees)
2020-03-28,ezzat1960,Coronavirus,1,https://www.reddit.com/r/Coronavirus/comments/fqkk56/daily_discussion_post_march_28_questions_images/flquw9z/,To deal with everyone we have had this epidemic and to consider others carriers of the virus
2020-03-28,Pentt41207,Coronavirus,1,https://www.reddit.com/r/Coronavirus/comments/fqkvxf/coronavirus_stayathome_rules_must_be_relaxed/flquwu5/,Chance to get the Health care system a chance to catch up? Just spit balling. People cant be cooped up until a vaccine comes out in 9 months in a best case waiting for a Vaccine.
