date,author,subreddit,score,url,text
2020-03-11,duncurr,Coronavirus,2743,https://www.reddit.com/r/Coronavirus/comments/fh870p/actor_tom_hanks_says_he_and_his_wife_have_tested/fk9h764/,It was only a matter of time before a celebrity contracted it. Kinda bummed it was Tom Hanks.
2020-03-11,SuperSayanVegeta,Coronavirus,1939,https://www.reddit.com/r/Coronavirus/comments/fh870p/actor_tom_hanks_says_he_and_his_wife_have_tested/fk9hawo/,He is over 60 and has other health issues. Not good at all.
2020-03-11,wo_lo_lo,Coronavirus,993,https://www.reddit.com/r/Coronavirus/comments/fh870p/actor_tom_hanks_says_he_and_his_wife_have_tested/fk9h7g8/,"Well there’s the first celebrity.  And at 63 years old, at rather high risk."
2020-03-11,thrilla2k10,Coronavirus,933,https://www.reddit.com/r/Coronavirus/comments/fh870p/actor_tom_hanks_says_he_and_his_wife_have_tested/fk9i838/,2 nba basketball players are being tested as we speak.
2020-03-11,NotoriousANM,Coronavirus,913,https://www.reddit.com/r/Coronavirus/comments/fh870p/actor_tom_hanks_says_he_and_his_wife_have_tested/fk9hu3j/,"He’s diabetic, and apparently his wife had breast cancer too. She’s also 63 :("
2020-03-11,henryeaterofpies,Coronavirus,886,https://www.reddit.com/r/Coronavirus/comments/fh474y/italy_just_announced_new_form_of_lockdown_all/fk97cjc/,You may have a terminal case of affluenza
2020-03-11,Unicorn_Sparkles23,Coronavirus,800,https://www.reddit.com/r/Coronavirus/comments/fh870p/actor_tom_hanks_says_he_and_his_wife_have_tested/fk9h90u/,"at 63, I hope he can recover."
2020-03-11,Eliot_5,Coronavirus,757,https://www.reddit.com/r/Coronavirus/comments/fh85cs/megathread_president_trump_announces_30day_travel/fk9gs5d/,"I hate to say it, but it's about to get ugly."
2020-03-11,Giantjellybeans,Coronavirus,746,https://www.reddit.com/r/Coronavirus/comments/fh8ee6/the_nba_has_suspended_its_season/fk9imm0/,For anyone who isn't aware Shams Charania is considered highly credible in the NBA sphere this is 100% legitimate
2020-03-11,SleepyPizza7,Coronavirus,716,https://www.reddit.com/r/Coronavirus/comments/fh85cs/megathread_president_trump_announces_30day_travel/fk9ico5/,^THE ^CALL ^IS ^COMING ^FROM ^INSIDE ^THE ^HOUSE
2020-03-11,ltctoneo,Coronavirus,680,https://www.reddit.com/r/Coronavirus/comments/fh870p/actor_tom_hanks_says_he_and_his_wife_have_tested/fk9jqca/,Rudy Gobert has it.
2020-03-11,shinyshirtlesssulu,Coronavirus,633,https://www.reddit.com/r/Coronavirus/comments/fh85cs/megathread_president_trump_announces_30day_travel/fk9jp5v/,"So, I just discovered this...while on a flight to the UK. I seemed to be one of a few that purchased inflight WiFi. To say the least, the news has spread amongst our metal tube quite fast, people are freaking out, nervous, scared."
2020-03-11,nafalie,Coronavirus,579,https://www.reddit.com/r/Coronavirus/comments/fh9ncu/hundreds_of_ravenous_wild_monkeys_terrorise_thai/fk9rqtj/,Am I living in a movie???
2020-03-11,TataasdQs,Coronavirus,556,https://www.reddit.com/r/Coronavirus/comments/fh870p/actor_tom_hanks_says_he_and_his_wife_have_tested/fk9hms1/,"Oh shoot what health conditions? He seems so healthy, i thought he was :("
2020-03-11,iCappy_,Coronavirus,554,https://www.reddit.com/r/Coronavirus/comments/fh474y/italy_just_announced_new_form_of_lockdown_all/fk92tg5/,"What?! Are we saying that buying a new Gucci bag is considered NON-ESSENTIAL?!?!

&#x200B;

/s"
2020-03-11,Joe_Rogan_is_bae,Coronavirus,529,https://www.reddit.com/r/Coronavirus/comments/fh870p/actor_tom_hanks_says_he_and_his_wife_have_tested/fk9kw3q/,Also a former big time smoker.
2020-03-11,TheDogofTears,Coronavirus,517,https://www.reddit.com/r/Coronavirus/comments/fh870p/actor_tom_hanks_says_he_and_his_wife_have_tested/fk9jxdo/,And now the NBA is on pause.
2020-03-11,Joe_Rogan_is_bae,Coronavirus,514,https://www.reddit.com/r/Coronavirus/comments/fh870p/actor_tom_hanks_says_he_and_his_wife_have_tested/fk9lv5l/,"Tom. We know Coronavirus is far more deadly to smokers than non-smokers (9-10% vs 2-3.7%) from Chinese data; we have zero data on diabetes yet due to the lack of obesity/diabetes in Asian nations and the utter recency of the EU outbreak.

EDIT:Source is [Michael Osterholm](https://www.youtube.com/watch?v=cZFhjMQrVts) (3:58) & CIDRAP. - Suggest looking through the CDC/CIDRAP/Healthline/etc. for actual info."
2020-03-11,evanc3,Coronavirus,513,https://www.reddit.com/r/Coronavirus/comments/fh870p/actor_tom_hanks_says_he_and_his_wife_have_tested/fk9hesc/,And diabetic
2020-03-11,failingtolurk,Coronavirus,503,https://www.reddit.com/r/Coronavirus/comments/fh8ee6/the_nba_has_suspended_its_season/fk9joc2/,I guess China really can cancel the NBA.
2020-03-11,spatchi14,Coronavirus,446,https://www.reddit.com/r/Coronavirus/comments/fh85cs/megathread_president_trump_announces_30day_travel/fk9gtjc/,"So if he's exempting the UK do people go via London to get to the US?

I'm sorry I don't understand how this all works.

Edit so are all airlines now going to cancel all flights to Europe eg. Miami to Paris or LA to Frankfurt?"
2020-03-11,you_are_all_monsters,Coronavirus,444,https://www.reddit.com/r/Coronavirus/comments/fh8sbr/nobody_took_the_aids_epidemic_seriously_until/fk9lgkr/,I started getting a mild fever on Sunday night and have been in self-quarantine since. I'm a contractor so this is costing me a lot of money but it's the right thing to do right now.  People: Stay home.
2020-03-11,nnomadic,Coronavirus,434,https://www.reddit.com/r/Coronavirus/comments/fh870p/actor_tom_hanks_says_he_and_his_wife_have_tested/fk9hars/,"2020, let me off this ride."
2020-03-11,bh6891,Coronavirus,433,https://www.reddit.com/r/Coronavirus/comments/fh870p/actor_tom_hanks_says_he_and_his_wife_have_tested/fk9kojv/,Shit has officially hit the fan
2020-03-11,Colonize_The_Moon,Coronavirus,421,https://www.reddit.com/r/Coronavirus/comments/fh93h8/to_add_onto_this_im_told_the_thunder_players_are/fk9nmbd/,"Well, you see, basketball players are *important* people.  Their lives matter more than ordinary peasants like ER docs or RNs."
2020-03-11,5ive5tar,Coronavirus,416,https://www.reddit.com/r/Coronavirus/comments/fh8ee6/the_nba_has_suspended_its_season/fk9ij73/,Maybe the US will wake up now.
2020-03-11,MrSnuffle_,Coronavirus,411,https://www.reddit.com/r/Coronavirus/comments/fh870p/actor_tom_hanks_says_he_and_his_wife_have_tested/fk9myyx/,“No rEaSoN To bE WoRrieD”
2020-03-11,JackDT,Coronavirus,402,https://www.reddit.com/r/Coronavirus/comments/fh7uuj/trump_addresses_the_nation_on_coronavirus_from/fk9hiib/,"What's the point of banning CARGO from Europe?

We need travel bans INSIDE the country. The risk is right here.

I'm glad businesses will get loans but I want to hear about measures that actually reduce the impact of the VIRUS. Testing, antiviral treatments, social distancing, paying medical workers so they can afford private transport and child care, emergency mask production, drive-through tests, ventilator production, pay people in quarantine. The best way to help the economy is to actually deal with the virus and make it less of a problem!

Let's be like South Korea and do this right."
2020-03-11,Nihilistic_Response,Coronavirus,398,https://www.reddit.com/r/Coronavirus/comments/fh85cs/megathread_president_trump_announces_30day_travel/fk9h9nf/,Tom Hanks has caught coronavirus while in Australia: [https://twitter.com/RFaughnder/status/1237908717649014784](https://twitter.com/RFaughnder/status/1237908717649014784)
2020-03-11,incer,Coronavirus,396,https://www.reddit.com/r/Coronavirus/comments/fh474y/italy_just_announced_new_form_of_lockdown_all/fk8q3cc/,"FACTORIES AND OTHER PLACES OF WORK WILL **NOT** BE CLOSED.

This is about non essential commercial activities, aka shops that are not groceries or pharmacies."
2020-03-11,skeebidybop,Coronavirus,395,https://www.reddit.com/r/Coronavirus/comments/fh67q3/even_though_there_are_no_confirmed_cases_of/fk934rc/,TIL that El Salvador is more wisely proactive than the rest of the world
2020-03-11,NeokratosRed,Coronavirus,394,https://www.reddit.com/r/Coronavirus/comments/fh474y/italy_just_announced_new_form_of_lockdown_all/fk8quf1/,"Italian here. This is good. In 2 weeks we’ll hopefully start seeing results, and although it’s a hard hit for the economy, not stopping the pandemic before all national healthcare collapses would be much worse.  
I never thought I would say this, but our government is doing the right thing."
2020-03-11,Super_Crash_Bug,Coronavirus,385,https://www.reddit.com/r/Coronavirus/comments/fh870p/actor_tom_hanks_says_he_and_his_wife_have_tested/fk9hfvz/,"That's it.   
The simulation has officially reached peaked ""fucked"" status. 

Please uninstall and reinstall. 

See you in Simulation 2.0."
2020-03-11,trto44,Coronavirus,383,https://www.reddit.com/r/Coronavirus/comments/fh9g6m/jazz_star_rudy_gobert_joked_about_coronavirus_by/fk9qfnc/,we’re literally experiencing history
2020-03-11,NarwhalsAndBacon,Coronavirus,379,https://www.reddit.com/r/Coronavirus/comments/fh85cs/megathread_president_trump_announces_30day_travel/fk9jh9i/,"Ha. Friend of mine and his girlfriend just got back from a trip to Italy yesterday!

They were in Rome, Venice and Florence.

They said they weren't even asked a single thing about where they were or if they had any symptoms.

Both now feel under the weather."
2020-03-11,BlinkingKiwi,Coronavirus,366,https://www.reddit.com/r/Coronavirus/comments/fh870p/actor_tom_hanks_says_he_and_his_wife_have_tested/fk9kvok/,"> “Hello, folks. Rita and I are down here in Australia,” Mr. Hanks said in a statement. “We felt a bit tired, like we had colds, and some body aches. Rita had some chills that came and went. Slight fevers, too. To play things right, as is needed in the world right now, we were tested for the coronavirus, and were found to be positive.” 

They would have been refused testing in the US."
2020-03-11,RedBeardedWhiskey,Coronavirus,343,https://www.reddit.com/r/Coronavirus/comments/fh8ee6/the_nba_has_suspended_its_season/fk9j3hs/,Everything is spiraling now. Omg
2020-03-11,pelicanfart,Coronavirus,336,https://www.reddit.com/r/Coronavirus/comments/fh474y/italy_just_announced_new_form_of_lockdown_all/fk8vfkz/,Grab a pie and go fuck yourself
2020-03-11,Kelekin,Coronavirus,332,https://www.reddit.com/r/Coronavirus/comments/fh8c2f/utah_jazz_allstar_rudy_gobert_has_tested_positive/fk9iae4/,Even worse - he was the dude making fun of coronavirus two days ago.
2020-03-11,wee_man,Coronavirus,323,https://www.reddit.com/r/Coronavirus/comments/fh8pod/a_person_who_has_taken_a_picture_with_trump_3/fk9m317/,"We need to prepare for a scenario where our president, who falls squarely in the at-risk demographic, is infected with coronavirus."
2020-03-11,LeonDaChameL3on,Coronavirus,319,https://www.reddit.com/r/Coronavirus/comments/fh85cs/megathread_president_trump_announces_30day_travel/fk9hftd/,"The summary that I took from the Guardian

* The president also said he’ll take “emergency action” to provide relief to workers who are affected. He said he’s asking Congress for $50bn for small business loans. He also called for “immediate” payroll tax cuts.

* He also downplayed warnings of a potential recession: “This is not a financial crisis, this is just a temporary moment of time that we will overcome as a nation and as a world,” he said.

* Trump temporarily suspends travel from Europe to the US The restrictions will not apply to the UK, he said. The travel restriction will start Friday, and last for 30 days amid virus outbreak.

* Trump also encouraged older Americans to avoid all travel if possible. He reviewed other measures his administration is taking to address the pandemic.

* Trump also encouraged older Americans to avoid travel if possible. Older people “must be very, very careful,” he said, calling on nursing homes to suspend “medically unnecessary visits.”


* “The vast majority of Americans, the risk is very, very low,” he said. But he said that older Americans should avoid travel, and endorsed social distancing and avoiding large gatherings. “Every community faces different risks,” he noted and encouraged Americans to listen to local officials.

* In his brief address, the president continued to signal that the pandemic is mainly a threat outside American borders, without fully acknowledging that the coronavirus is spreading within the US.


* Trump said that the US is doing better than Europe. “The EU failed to take the same precautions and restrict travel from China and other hot spots,” he said. “As a result, a large number of new clusters in the United States were seeded by travelers from Europe.”

* Trump said that the US is doing better than Europe, but whereas European nations have rolled out widespread testing, it’s still unclear how many cases we’ve had in America."
2020-03-11,DropTopEWop,Coronavirus,318,https://www.reddit.com/r/Coronavirus/comments/fh9l8g/coronavirus_has_disney_assuring_customers_that/fk9r839/,WOW ok Disney. I doubt that.
2020-03-11,suspicious_lemons,Coronavirus,317,https://www.reddit.com/r/Coronavirus/comments/fh8wwe/the_new_york_times_has_dropped_its_paywall_on/fk9me4i/,I can finally stop using incognito tabs
2020-03-11,lordflip,Coronavirus,307,https://www.reddit.com/r/Coronavirus/comments/fh870p/actor_tom_hanks_says_he_and_his_wife_have_tested/fk9h9cw/,"Horrible, but this will spread awareness...finally."
2020-03-11,Docbear64,Coronavirus,302,https://www.reddit.com/r/Coronavirus/comments/fh48or/young_and_unafraid_of_the_coronavirus_good_for/fk8pfee/,"Yeah this "" It only affects the old and already sick ! "" is so disrespectful .   Yes that's not the majority of us but many of us care for people in those groups.  Just because I won't die doesn't mean I want to put my parents, grandparents, or friends with cancer or diabetes  at risk . 

 

It's such a tone deaf argument to me and shows how self-interested our society has become ."
2020-03-11,cut_that_meat,Coronavirus,302,https://www.reddit.com/r/Coronavirus/comments/fh85cs/megathread_president_trump_announces_30day_travel/fk9juey/,Solution - free drinks. Lube the tube.
2020-03-11,Forestkander,Coronavirus,300,https://www.reddit.com/r/Coronavirus/comments/fh67q3/even_though_there_are_no_confirmed_cases_of/fk96vjk/,"The president practically said ""Look at Italy, look at South Korea, they have way better infrastructure and healthcare systems than us and they are still not able to handle this, what do you think would happen is this came here""

He also said the virus will probably come (if it's not here already) eventually, but he's trying to slow it down as much as possible and waiting for the international science community to find a cure, vaccine or med that can stop or at least lower the mortality of the virus."
2020-03-11,quantumleeps,Coronavirus,297,https://www.reddit.com/r/Coronavirus/comments/fh870p/actor_tom_hanks_says_he_and_his_wife_have_tested/fk9hfhf/,"Yeah. Me, too. Rooting for you and your wife, Tom"
2020-03-11,bibbimbopper,Coronavirus,297,https://www.reddit.com/r/Coronavirus/comments/fh870p/actor_tom_hanks_says_he_and_his_wife_have_tested/fk9m0k1/,"Two days ago, he mocked the reporter ban by touching every reporter's mic: 

https://nba.nbcsports.com/2020/03/11/rudy-gobert-touches-every-reporters-recorder-questionable-for-jazz-game-illness/"
2020-03-11,GuinnessWithinUs,Coronavirus,295,https://www.reddit.com/r/Coronavirus/comments/fh8ee6/the_nba_has_suspended_its_season/fk9jxmn/,"Enough of these preventative measures and we get back to normal much sooner. These are good, practical moves, not a harbinger of doom."
2020-03-11,manubfr,Coronavirus,286,https://www.reddit.com/r/Coronavirus/comments/fh468t/trump_says_he_will_address_the_nation_from_the/fk8peed/,Imagine being in 2014 and someone tells you Trump will be president during a pandemic.
2020-03-11,throwaway1Dgrzq,Coronavirus,285,https://www.reddit.com/r/Coronavirus/comments/fh48or/young_and_unafraid_of_the_coronavirus_good_for/fk8pc13/,">Put aside statistics. Here is how it looks in practice. Most of my childhood friends are now doctors working in north Italy. In Milan, in Bergamo, in Padua, they are having to choose between intubating a 40-year-old with two kids, a 40-year old who is fit and healthy with no co-morbidities, and a 60-year-old with high blood pressure, because they don't have enough beds. In the hallway, meanwhile, there are another 15 people waiting who are already hardly breathing and need oxygen.

>The army is trying to bring some of them to other regions with helicopters but it's not enough: the flow is just too much, too many people are getting sick at the same time."
2020-03-11,drewhead118,Coronavirus,285,https://www.reddit.com/r/Coronavirus/comments/fh870p/actor_tom_hanks_says_he_and_his_wife_have_tested/fk9kzsi/,"as I wrote elsewhere, his post, thankfully, made it seem relatively minor, and most cases of the virus tend to be minor. It's impossible to speak with certainty here of course due to his age and medical history.

Still remember every single +1 to a fatality count in any country is a human being as valuable to the world as Tom Hanks is and we should all remember the humans behind the case report figures"
2020-03-11,0rganization,Coronavirus,285,https://www.reddit.com/r/Coronavirus/comments/fh474y/italy_just_announced_new_form_of_lockdown_all/fk95qfg/,This will be inscribed in pages of history as one of the most famous quote.
2020-03-11,planenewb,Coronavirus,281,https://www.reddit.com/r/Coronavirus/comments/fh85cs/megathread_president_trump_announces_30day_travel/fk9hf1a/,"Italy, right now, sounds like something out of a horror movie. It's already ugly."
2020-03-11,malikdwd,Coronavirus,278,https://www.reddit.com/r/Coronavirus/comments/fh870p/actor_tom_hanks_says_he_and_his_wife_have_tested/fk9iz75/,Oh fuck
2020-03-11,arugulapizza,Coronavirus,277,https://www.reddit.com/r/Coronavirus/comments/fh474y/italy_just_announced_new_form_of_lockdown_all/fk8x1f1/,"Wow that’s beautiful. I almost feel jealous since all we hear is “I am very smart, the best.”"
2020-03-11,groot4lyfe,Coronavirus,276,https://www.reddit.com/r/Coronavirus/comments/fh8ee6/the_nba_has_suspended_its_season/fk9iqk1/,MLB is next. Hopefully it won't take players getting infected with a pandemic virus for them to get their shit together.
2020-03-11,Hafomeng,Coronavirus,275,https://www.reddit.com/r/Coronavirus/comments/fh9mq3/us_expert_new_coronavirus_deadlier_than_flu/fk9rjgv/,Wow where can I get my expert certificate because I wrote a detailed post about this three fucking weeks ago
2020-03-11,ThatOrdinary,Coronavirus,273,https://www.reddit.com/r/Coronavirus/comments/fh870p/actor_tom_hanks_says_he_and_his_wife_have_tested/fk9phdm/,"It's just the flu

&#x200B;

/s"
2020-03-11,french_toasty,Coronavirus,272,https://www.reddit.com/r/Coronavirus/comments/fh85cs/megathread_president_trump_announces_30day_travel/fk9i79r/,All those “YOLO cheap flights living my best life” kids gonna be disappointed.
2020-03-11,wtwv,Coronavirus,270,https://www.reddit.com/r/Coronavirus/comments/fh870p/actor_tom_hanks_says_he_and_his_wife_have_tested/fk9hnxr/,He's diabetic
2020-03-11,gcruzatto,Coronavirus,260,https://www.reddit.com/r/Coronavirus/comments/fh8wwe/the_new_york_times_has_dropped_its_paywall_on/fk9qe11/,Pro Tip: You can bypass all their firewalls by adding a dot after the com (e.g. https://www.nytimes.com./2020/03/11/world/europe/italy-coronavirus.html )
2020-03-11,notqualifiedforthis,Coronavirus,257,https://www.reddit.com/r/Coronavirus/comments/fh85cs/megathread_president_trump_announces_30day_travel/fk9gsva/,"I’m not a fan of Trump but the administration made the right move, hope its in time.

Edit:  didn’t seem like the usual Trump"
2020-03-11,GYN-k4H-Q3z-75B,Coronavirus,254,https://www.reddit.com/r/Coronavirus/comments/fh474y/italy_just_announced_new_form_of_lockdown_all/fk8p56n/,Italy is basically shutting down the economy beyond absolute basic necessities.
2020-03-11,Townkrier,Coronavirus,254,https://www.reddit.com/r/Coronavirus/comments/fh870p/actor_tom_hanks_says_he_and_his_wife_have_tested/fk9jos1/,But a shit ton of money. Counterbalance?
2020-03-11,RobPercer40258,Coronavirus,248,https://www.reddit.com/r/Coronavirus/comments/fh85cs/megathread_president_trump_announces_30day_travel/fk9m8al/,"He also has access to the best medical care that money can buy. He's a national icon. If a life can be saved, it will be his."
2020-03-11,p001b0y,Coronavirus,246,https://www.reddit.com/r/Coronavirus/comments/fh870p/actor_tom_hanks_says_he_and_his_wife_have_tested/fk9ntt1/,"I’m a type 2 diabetic and I only have 1.5 working lungs due to multiple pulmonary embolisms a couple years ago and I’m on blood thinners for life and over 50. I’m kind of worried about this one because I tick three or four potential risk factor boxes.

Oh, and I am in the US

Edit: Thanks to all for the well wishes!"
2020-03-11,NihilistLivesMatter,Coronavirus,245,https://www.reddit.com/r/Coronavirus/comments/fh7uuj/trump_addresses_the_nation_on_coronavirus_from/fk9fe95/,Wtf he sounds sick? He just gasped for his breath
2020-03-11,crazeecatladee,Coronavirus,244,https://www.reddit.com/r/Coronavirus/comments/fh9ncu/hundreds_of_ravenous_wild_monkeys_terrorise_thai/fk9s7wc/,At this point we don’t need Hollywood to make a movie about this pandemic; we can just piece together found footage
2020-03-11,Graematter,Coronavirus,243,https://www.reddit.com/r/Coronavirus/comments/fh870p/actor_tom_hanks_says_he_and_his_wife_have_tested/fk9s4ub/,"Tom Hanks - 
T. Hanks - 
Thanks."
2020-03-11,energizerbunneee,Coronavirus,243,https://www.reddit.com/r/Coronavirus/comments/fh561u/neil_degrasse_tyson_this_is_an_experiment_on/fk8wac3/,"I deactivated my Facebook because I couldn't handle the ""it's just the flu"" moronic posts anymore"
2020-03-11,coffeeplot,Coronavirus,240,https://www.reddit.com/r/Coronavirus/comments/fh5f3u/we_must_not_stop_living_french_mayor_defends/fk8xl81/,"Got it.

Why stop living in the short term, ... , when you can stop living in the long term.

Good advice. /s"
2020-03-11,StagOfBaratheon,Coronavirus,236,https://www.reddit.com/r/Coronavirus/comments/fh85cs/megathread_president_trump_announces_30day_travel/fk9gwu5/,It's not. Weeks too late. It's already here.
2020-03-11,angrypandabotz,Coronavirus,232,https://www.reddit.com/r/Coronavirus/comments/fh870p/actor_tom_hanks_says_he_and_his_wife_have_tested/fk9h7f0/,What the Fuck is this timeline.
2020-03-11,iheartbettas,Coronavirus,231,https://www.reddit.com/r/Coronavirus/comments/fh870p/actor_tom_hanks_says_he_and_his_wife_have_tested/fk9odh6/,Seriously what a douche bag
2020-03-11,mandalorian88-25,Coronavirus,226,https://www.reddit.com/r/Coronavirus/comments/fh8sbr/nobody_took_the_aids_epidemic_seriously_until/fk9lgi1/,"Tom Hanks - "" Hold my beer """
2020-03-11,BadamsDota,Coronavirus,223,https://www.reddit.com/r/Coronavirus/comments/fh9g6m/jazz_star_rudy_gobert_joked_about_coronavirus_by/fk9qb4k/,All of the jokes people are currently making about this pandemic will potentially age extremely poorly.
2020-03-11,bengyap,Coronavirus,221,https://www.reddit.com/r/Coronavirus/comments/fh729r/oped_im_an_american_in_italy_were_on_coronavirus/fk994do/,Being in a lockdown is not horrific. Being hook up to a medical ventilator is horrific.
2020-03-11,space_coyote6,Coronavirus,221,https://www.reddit.com/r/Coronavirus/comments/fh8pod/a_person_who_has_taken_a_picture_with_trump_3/fk9mvg7/,"He goes to hospital and Mike Pence becomes ""acting president"" if he becomes too ill. 

There's a protocol for it. Dick Cheney was president for a few hours twice when W was having surgery."
2020-03-11,phenomenomenol,Coronavirus,220,https://www.reddit.com/r/Coronavirus/comments/fh85cs/megathread_president_trump_announces_30day_travel/fk9k1pk/,He also has type 2 diabetes and is 63. Not good at all.
2020-03-11,wadenelsonredditor,Coronavirus,219,https://www.reddit.com/r/Coronavirus/comments/fh870p/actor_tom_hanks_says_he_and_his_wife_have_tested/fk9ht6o/,"As morbid as this sounds, perhaps news of the infection of these National Treasures will convince other Americans this is real, it's NOT ""just the flu,"" and they need to prep, social distance, etc.

Also: @#$@#&!!!!!!"
2020-03-11,girhen,Coronavirus,219,https://www.reddit.com/r/Coronavirus/comments/fh7uuj/trump_addresses_the_nation_on_coronavirus_from/fk9hich/,"Why does he say ""Corona. Virus.""  like a text to speech bot?"
2020-03-11,itsneverlupusduh,Coronavirus,218,https://www.reddit.com/r/Coronavirus/comments/fh870p/actor_tom_hanks_says_he_and_his_wife_have_tested/fk9psl0/,"I keep telling all the people in my life who think it's ""just the flu"" that things don't shut down like this for the annual flu. They still don't get it. Idk when the fuck they will."
2020-03-11,K33pMeHangin0n,Coronavirus,217,https://www.reddit.com/r/Coronavirus/comments/fh85cs/megathread_president_trump_announces_30day_travel/fk9m7o6/,“There are decades where nothing happens; and there are weeks where decades happen.” - Lenin
2020-03-11,lightningheels,Coronavirus,215,https://www.reddit.com/r/Coronavirus/comments/fh4bc5/president_says_he_has_made_some_decisions_and/fk8pqoe/,"""I have decided... that this is pretty bad, folks."""
2020-03-11,really_knobee,Coronavirus,212,https://www.reddit.com/r/Coronavirus/comments/fh80up/trump_suspends_travel_from_europe_for_30_days_as/fk9fw8z/,But travel from the UK is allowed.  Because... they aren't in Europe anymore.
2020-03-11,aklbos,Coronavirus,212,https://www.reddit.com/r/Coronavirus/comments/fh474y/italy_just_announced_new_form_of_lockdown_all/fk9858c/,"Good news, your disease has been renamed!

You now have afflonavirus."
