date,author,subreddit,score,url,text
2020-02-06,5footbanana,Coronavirus,4,https://www.reddit.com/r/Coronavirus/comments/ezybuz/purell_doesnt_kill_flu_virus_and_the_parent/fgqjazu/,"I don't understand...  What else are they meant to do?  Create an impenetrable barrier?
  
Obviously they only kill what's on your hands at that time, that's why you should ways your hands regularly"
2020-02-06,Machismo01,Coronavirus,4,https://www.reddit.com/r/Coronavirus/comments/ezq9fj/canada_bc_wont_disclose_the_city_location_of_the/fgqi7oj/,"Damn, that was pretty good."
2020-02-06,DatMoFugga,Coronavirus,4,https://www.reddit.com/r/Coronavirus/comments/f05d76/portable_gas_chamber_listen_to_this_womens_blood/fgrn6x3/,"It got a little hard to understand at the very end but most of it she was saying “ahhhhhh”


Edit: a few seconds after I posted this I felt really REALLY terrible about it. I feel terrible for what all of these people are going through, but a little levity can be taken in good spirit in dark times I hope"
2020-02-06,LeftistsAreBigots,Coronavirus,4,https://www.reddit.com/r/Coronavirus/comments/f0178h/wuhan_authorities_ordered_to_round_up_coronavirus/fgqvcnz/,Archive for those who don't want to give NYT clicks or make an account just to look at the news.   [https://archive.is/Kqypd](https://archive.is/Kqypd)
2020-02-06,TwistedTheBand,Coronavirus,4,https://www.reddit.com/r/Coronavirus/comments/f01bjn/what_chemicals_kill_novel_corona_virus_bleach_not/fgqvyd5/,"Yes bleach will kill it within minutes. I looked it up for another post where someone was asking if pool chlorine would kill it.

Edit: use bleach and wait 5 minutes 

""The virus is easily inactivated by commonly used disinfectants.""


https://www.ncbi.nlm.nih.gov/m/pubmed/16142653/

This is SARS which should give similar results to this novel virus."
2020-02-06,LeftistsAreBigots,Coronavirus,4,https://www.reddit.com/r/Coronavirus/comments/f0110s/a_99_effective_quarantine_is_0_effective/fgqvrbk/,"Not exactly true...  A quarantine is not ONLY to prevent cases from happening outside, but in this case it is to SLOW the rate of new infections, giving hospital staff and test facilities time to, hopefully, catch up... or at least slow the growth of their workload."
2020-02-06,heyitsmeursocks,Coronavirus,4,https://www.reddit.com/r/Coronavirus/comments/ezzffk/7000_people_on_those_quarantined_cruise_ships/fgqwgz2/,I think you should exclude Japan
2020-02-06,SecretAgentIceBat,Coronavirus,4,https://www.reddit.com/r/Coronavirus/comments/f0163w/could_this_virus_have_been_evolved_or_designed_to/fgqxhrb/,"I’m determined to respond to this link every single time it’s posted. You can’t say *anything* about a group as large as “Asian males” based on eight samples... but even worse than that, there is *only one sample from an Asian donor*"
2020-02-06,110andneveragain,Coronavirus,4,https://www.reddit.com/r/Coronavirus/comments/f00ciz/anyone_able_to_translate_chinese_accurately/fgqt4av/,"**UPDATE:** One confirmation so far of original theory: [https://www.reddit.com/r/Coronavirus/comments/f00ciz/anyone\_able\_to\_translate\_chinese\_accurately/fgqr4tf?utm\_source=share&utm\_medium=web2x](https://www.reddit.com/r/Coronavirus/comments/f00ciz/anyone_able_to_translate_chinese_accurately/fgqr4tf?utm_source=share&utm_medium=web2x) confirmed by one person to be the same phrase.

&#x200B;

*If you'd like to feel even more comforted, these are almost definitely the same stats the WHO is using in their reports.19665 and 19665*

[http://wjw.hubei.gov.cn/fbjd/tzgg/202002/t20200206\_2019848.shtml](http://wjw.hubei.gov.cn/fbjd/tzgg/202002/t20200206_2019848.shtml)[https://www.who.int/docs/default-source/coronaviruse/situation-reports/20200206-sitrep-17-ncov.pdf?sfvrsn=17f0dca\_2](https://www.who.int/docs/default-source/coronaviruse/situation-reports/20200206-sitrep-17-ncov.pdf?sfvrsn=17f0dca_2)  


**Please upvote and share the original post so we can get eyes on this.**"
2020-02-06,tasu10101,Coronavirus,4,https://www.reddit.com/r/Coronavirus/comments/f018xg/is_coronavirus_raising_the_bitcoin_price/fgqvh6w/,"Yes, when there’s global instability and uncertainty BTC goes up like gold.  Especially now with China’s global production grinding to a halt, there’s fears this could have a massive economic impact. A weakened dollar and yuan are good for BTC."
2020-02-06,mroctopi,Coronavirus,4,https://www.reddit.com/r/Coronavirus/comments/f01uja/gym/fgqyvpm/,"Thank you, I feel better. I even started prepping a bit because of the anxiety this has caused me."
2020-02-06,grandmothertrillow,Coronavirus,4,https://www.reddit.com/r/Coronavirus/comments/f01uja/gym/fgr1km4/,"I live in Austin too and I’m laying low for a while to be honest. Not going to the gym, cancelled my birthday— we’re hunkering down a bit until we see how this pans out. Run to HEB while you can and get necessities. 

I can see corona spreading like wildfire in Austin because of the laid back approach to life and insufficiency of fucks given in the general culture."
2020-02-06,ndkdkdndh,Coronavirus,4,https://www.reddit.com/r/Coronavirus/comments/f01mm3/lets_build_a_website_to_self_report_ncov_cases/fgqyz2m/,And punched with a spring loaded boxing glove
2020-02-06,real__eyes,Coronavirus,4,https://www.reddit.com/r/Coronavirus/comments/f01y7l/post_is_getting_instantly_removed_why/fgqzze1/,"Guess they don’t want that specific info out yet in this sub.  Everything here (Reddit) is controlled very tightly and mods are usually NOT organically chosen.

Thanks for the screenshot though! I didn’t know that."
2020-02-06,wiscowhaaat,Coronavirus,4,https://www.reddit.com/r/Coronavirus/comments/f01mi1/todays_update_from_medcramcom/fgqx5c3/,Awesome to see this in other subs. Just posted this in r/china_flu a few minutes ago.
2020-02-06,amyisarobot,Coronavirus,4,https://www.reddit.com/r/Coronavirus/comments/f01l99/coronavirus_what_is_happening_in_america_right_now/fgqx5w2/,"One of the people who were supposed to self quarantine from the Snohomish case.. took a flight to Wisconsin.. it might not be related at all, but I thought that was interesting."
2020-02-06,cws1981,Coronavirus,4,https://www.reddit.com/r/Coronavirus/comments/f03b4w/if_we_make_it_to_march_5th_we_not_china_should_be/fgrc87q/,"At the current infection rate, the global population will be infected by 18 April 2020.

In other words, who knows."
2020-02-06,xSaRgED,Coronavirus,4,https://www.reddit.com/r/Coronavirus/comments/f01vx4/update_638_dead_31439_infected/fgr3kls/,"They are trying to get everyone back to the factories on Monday, and need the numbers to explain/justify lifting quarantines."
2020-02-06,WillowSnows,Coronavirus,4,https://www.reddit.com/r/Coronavirus/comments/f01vvj/why_are_only_chinese_coronavirus_patients_dying/fgr3ply/,"Yeah the 34 yr dr died today was infected 4 weeks ago, and just died today sooo."
2020-02-06,Shelia209,Coronavirus,4,https://www.reddit.com/r/Coronavirus/comments/f02d7o/think_someone_is_lying_to_you_first_check_to_see/fgr2n7h/,"Regardless, everyone knows the data from China is incorrect."
2020-02-06,bluesquaresound,Coronavirus,4,https://www.reddit.com/r/Coronavirus/comments/f02hol/61_on_cruise_ship_in_japan_now_positive_and_china/fgr76d3/,"&#x200B;

FEBRUARY 6, 2020 / 7:57 PM / UPDATED 25 MINUTES AGO

TOKYO (Reuters) - Another 41 people on a cruise liner off Japan tested positive for coronavirus, bringing the total confirmed from the ship to 61, Japan’s health minister said on Friday.

***The new cases were out of the 171 remaining test results, he said.***

The drastic jump in infected passengers on the cruise vessel comes as the cruise ship was under the two-week quarantine with about 3,700 people inside.

[https://www.reuters.com/article/us-china-health-japan-ship/another-41-on-cruise-liner-off-japan-test-positive-for-coronavirus-government-idUSKBN20102S?feedType=mktg&feedName=worldNews&WT.mc\_id=Partner-Google](https://www.reuters.com/article/us-china-health-japan-ship/another-41-on-cruise-liner-off-japan-test-positive-for-coronavirus-government-idUSKBN20102S?feedType=mktg&feedName=worldNews&WT.mc_id=Partner-Google)"
2020-02-06,Palaeolithic_Raccoon,Coronavirus,4,https://www.reddit.com/r/Coronavirus/comments/f02kz1/peer_reviewed_study_smoking_not_being_asian_male/fgr6cuh/,"Well, smoke of ANY kind isn't meant to enter the lungs, the particles in it play hell with the delicate tissue and stuff.

And tobacco cigarettes (but not the nicotine vapes, I \_think\_) have a nasty thing called ""tar"" in it (this is what turns walls and shit yellow), and THAT stuff will gunk up your lungs something bad.

Marijuana smoke lacks the tar, but it's still particulate; using a bong can help, but I'm sure some of the gunk you get on your bong gets into your lungs, too.  Not to mention additives or whatnot that can be found in badly made concentrates and vapes.

&#x200B;

As for vapes, well, it's not quite smoke, and though I love to vape honey oil, I would never say it's ""safe"" in any way, but like anything, done in moderation, you're probably OK.  The recent kerfuffle about killer vape carts had to do with dumbasses using edible oils as a base.

Living for years and years in really bad air pollution will do a number on your lungs, too.  It isn't just ""second-hand smoke"" that's to blame for shredded lungs of city-dwelling non-smokers; some of 'em might want to eye the ass end of their own cars, esp. depending on where they live and what their allowable emissions are like ..."
2020-02-06,tearsinrain66,Coronavirus,4,https://www.reddit.com/r/Coronavirus/comments/f02gu9/how_does_self_quarantine_actually_work/fgr6kmb/,"What’s to stop an addict from going out to score. 
Alcoholics included."
2020-02-06,Round_Ball,Coronavirus,4,https://www.reddit.com/r/Coronavirus/comments/f02hqf/41_new_corona_virus_cases_on_board_yokohama/fgr6qhk/,"Its fine, just like normal flu... Yep tell that to the cruise passengers"
2020-02-06,RedditFeddish,Coronavirus,4,https://www.reddit.com/r/Coronavirus/comments/f02hqf/41_new_corona_virus_cases_on_board_yokohama/fgr721e/,"well yeah, keep them on that bacti-ship (sorry vira-boat), they should've immediately evacuated them to a place where clean air and space could be afforded each human.  Keep them quarantined, yes, keep them locked up there? NO.  ship them to an island, anything but get them off that ship!"
2020-02-06,anon7935678,Coronavirus,4,https://www.reddit.com/r/Coronavirus/comments/f031gg/your_fear_of_the_coronavirus_isnt_precaution_its/fgr75dt/,It is the most poorly written article I have ever read. Good lord. Sad actually.
2020-02-06,Muted-Signature,Coronavirus,4,https://www.reddit.com/r/Coronavirus/comments/ezxt4v/they_are_screening_cruise_passengers_now_in_miami/fgr7mgi/,"Are they using the same pens for everyone? Lol

""Oh you've been in china you cant board""
*hands pen to next guest in line*"
2020-02-06,Paradox0111,Coronavirus,4,https://www.reddit.com/r/Coronavirus/comments/f01l99/coronavirus_what_is_happening_in_america_right_now/fgr629v/,Based on China’s numbers we should be at around 20 or more cases. that’s going off the fact that on 2/3/2020 there were 11 cases.. something some where doesn’t add up.. Either China’s numbers are to high or USA isn’t catching or reporting the cases accurately..
2020-02-06,Soosietyrell,Coronavirus,4,https://www.reddit.com/r/Coronavirus/comments/ezxsy4/chinese_reporter_qiushi_chen_has_gone_missing/fgqkl7z/,"sadly, both"
2020-02-06,whatTheHeyYoda,Coronavirus,4,https://www.reddit.com/r/Coronavirus/comments/f036mg/i_am_very_worried_what_do_you_all_think_time/fgr8j4a/,120 million quarantined.
2020-02-06,SDResistor,Coronavirus,4,https://www.reddit.com/r/Coronavirus/comments/ezzffk/7000_people_on_those_quarantined_cruise_ships/fgr9jxg/,"**Good news, everyone! I've isolated a sample size of 7000 in a controlled environment for the ""airborne AIDS"" project I've been working on!**

^ read in professor from Futurama voice"
2020-02-06,muchbravado,Coronavirus,4,https://www.reddit.com/r/Coronavirus/comments/f0095p/a_message_to_all_the_ccp_shills_freelance_or/fgr8cm5/,">I don't trust anyone who doesn't drink or curse just a little

Same yo."
2020-02-06,SQLSQLAndMoreSQL,Coronavirus,4,https://www.reddit.com/r/Coronavirus/comments/ezzffk/7000_people_on_those_quarantined_cruise_ships/fgr9szs/,"If you live in a big city like Paris or New York, then you are likely to be in very close proximity of other human beings in the subway/metro or even just walking on the street, turning door handles that have been turned by literally thousands of people on the same day. The air conditioning systems recycle air that has been in hundreds of lungs prior and do not expect filters to stop all of the bad things. And many people work in cubicle farms, often in open work spaces because that idiocy was deemed cool a decade ago."
2020-02-06,Silent_syndrome,Coronavirus,4,https://www.reddit.com/r/Coronavirus/comments/f03726/武汉加油/fgr8o1k/,Man this is really turning into a race thing.
2020-02-06,Tkx421,Coronavirus,4,https://www.reddit.com/r/Coronavirus/comments/ezxt4v/they_are_screening_cruise_passengers_now_in_miami/fgr99dv/,Your argument doesn't even make sense so that just makes it even worse.
2020-02-06,BuyMed,Coronavirus,4,https://www.reddit.com/r/Coronavirus/comments/f03726/武汉加油/fgr8xm0/,Its an obfuscation tactic.
2020-02-06,dont_feed_phil,Coronavirus,4,https://www.reddit.com/r/Coronavirus/comments/ezzt2a/is_it_real_that_people_can_be_genetically_immune/fgqmrtj/,Matt Damon is immune.
2020-02-06,TequilaCamper,Coronavirus,4,https://www.reddit.com/r/Coronavirus/comments/ezzffk/7000_people_on_those_quarantined_cruise_ships/fgqnlv6/,"There is an AMA here somewhere done by an American who is on one of the quarantined ships.  He said there are crewmembers stationed in the hallways to ensure they do not leave their cabins.  

After a couple of days in their cabins they were planning a way to let small groups of the cruisers out on deck for 90 minutes at a time but keeping masked and 3 meters apart from each other."
2020-02-06,annon1521,Coronavirus,4,https://www.reddit.com/r/Coronavirus/comments/f004ey/pregnant_and_terrified_of_getting_the_virus/fgqn91q/,"Thank you so much for the reassurance. In Derry in the north, there is Altnegalvin hospital and apparently there is a case there and corridors have been blocked off. I’ve just seen this on Facebook but can’t find anything on the news about it yet"
2020-02-06,Ron-Don-Volante,Coronavirus,4,https://www.reddit.com/r/Coronavirus/comments/f007ig/usa_is_sold_out_of_masks_online/fgqngl4/,"Early on in the outbreak, Chinese citizens were working together and learning how to make purchases from North American retailers like Amazon and Walmart.

It is recommended that, atleast in NA, you find a local retailer for such purchases.

*additionally*, some medical suppliers including manufacturers like 3M, are respecting and honor strict supply chain protocols in lieu of the outbreak to satisfy emergency orders overseas."
2020-02-06,_ark262_,Coronavirus,4,https://www.reddit.com/r/Coronavirus/comments/ezzffk/7000_people_on_those_quarantined_cruise_ships/fgqn0ng/,True. IMO they need to reset the start of quarantine to the time of the most recent case. There would be peeps on that ship for years.
2020-02-06,mu5tardtiger,Coronavirus,4,https://www.reddit.com/r/Coronavirus/comments/f04adc/tons_of_conspiracy_on_here/fgrf63s/,"hasnt crashed yet because they dumped 170 trillion into the market a few days ago, give it a week."
2020-02-06,Brother_YT,Coronavirus,4,https://www.reddit.com/r/Coronavirus/comments/f03zj7/nothing_to_see_here_guys_its_just_the_flu/fgregyw/,Yup just the flu. This is completely normal. https://youtu.be/QlnXxeRfLbQ
2020-02-06,multiple4,Coronavirus,4,https://www.reddit.com/r/Coronavirus/comments/f00fwd/turning_coronovirus_into_racial_issue/fgqppeg/,"I don't have any problem with somebody just simply trying to avoid sitting next to or having heavy contact with Chinese people right now if there are other seats available or whatever. The overwhelming majority of people with the virus are Chinese. That's just a fact. Many Chinese people left the country before flights were stopped. That's a fact. So just simply keeping distance from somebody isn't racist. Like you said, it is a normal reaction. When it becomes racist is when people begin to directly reject someone from sitting next to them or refusing to serve them just because they're Chinese. Directly acting rude to somebody just bc they're Chinese isn't ok. But I choose not to sit beside people for all kinds of reasons. There's nothing wrong with that

If you saw a person wearing all black with a hood on and they looked intimidating and they made you feel uncomfortable, then you wouldn't sit next to them. So if you're concerned that a Chinese person is coughing or looks kind of sick then why would you sit next to them?"
2020-02-06,marketjoe72,Coronavirus,4,https://www.reddit.com/r/Coronavirus/comments/f009yk/yes_worry_about_coronavirus_those_saying_its_just/fgqoxd8/,Thank you
2020-02-06,Severe_Clouds,Coronavirus,4,https://www.reddit.com/r/Coronavirus/comments/f04adc/tons_of_conspiracy_on_here/fgrgro7/,"apparently neither will the armageddon ...

just kidding"
2020-02-06,Ryker_05,Coronavirus,4,https://www.reddit.com/r/Coronavirus/comments/f04cpo/coronavirus_over_50000_new_infections_per_day/fgrhz05/,Chris is maybe one of 4 people max out there that is giving out info that’s credible and true. The fact that the media isn’t reporting the CURRENT news events and data shows that this pandemic is ducking serious
2020-02-06,Trashcan1-8-7,Coronavirus,4,https://www.reddit.com/r/Coronavirus/comments/f04adc/tons_of_conspiracy_on_here/fgriljz/,"I've been called a doomer for saying I was pulling my money, the first week this was going on and people were  saying it will be over in a week and I was nuts. Welp looks like I'll get the last laugh, not that that's a good thing in this case. Also I agree with the point in your post that people seem to be incredibly blind to the gravity of the situation."
2020-02-06,Gonzalopabloandres,Coronavirus,4,https://www.reddit.com/r/Coronavirus/comments/f04py3/chinese_police_checking_cellphones_and/fgrjaps/,Nothing new for every police force in the world if you ask me
2020-02-06,Mother_of_a_psycho,Coronavirus,4,https://www.reddit.com/r/Coronavirus/comments/f04py3/chinese_police_checking_cellphones_and/fgrjihz/,Ok.... how come that video even exists? Who filmed?
2020-02-06,Great_Big_Phony,Coronavirus,4,https://www.reddit.com/r/Coronavirus/comments/ezsjfw/warning_chinese_shills_are_patrolling_this_sub/fgpzndt/,"... and the Chinese gov would build it on contaminated ground, in such a manner that it would collapse and kill patients at some point."
2020-02-06,FullSpectrumSurvival,Coronavirus,4,https://www.reddit.com/r/Coronavirus/comments/ezxt4v/they_are_screening_cruise_passengers_now_in_miami/fgq6nuu/,"And that my friend is the right answer. Corporation: "" lives can be replaced. Riches cannot."""
2020-02-06,teegan_o,Coronavirus,4,https://www.reddit.com/r/Coronavirus/comments/ezwl5y/what_if_13_billion_chinese_just_decide_to_leave/fgq1wy7/,More of a marketing guy...
2020-02-06,HeidiH0,Coronavirus,4,https://www.reddit.com/r/Coronavirus/comments/ezx481/is_it_happening_in_india_now/fgq1y1c/,I think this needs to be cross referenced with an official news source.  The weather channel isn't is disease tracking service.
2020-02-06,iCappy_,Coronavirus,4,https://www.reddit.com/r/Coronavirus/comments/ezx1l2/mask_hoarding_doesnt_really_make_any_sense_to_me/fgq2svq/,"OH SNAP, she threw out her piece of paper that automatically means she knows what she's talking about!

I can point you to hundreds of masters students who have no clue what the fuck they're talking about."
2020-02-06,greyco31,Coronavirus,4,https://www.reddit.com/r/Coronavirus/comments/f03b4w/if_we_make_it_to_march_5th_we_not_china_should_be/fgrbx14/,Haha! (I hope not!)
2020-02-06,DanIsSwell,Coronavirus,4,https://www.reddit.com/r/Coronavirus/comments/f02gu9/how_does_self_quarantine_actually_work/fgrc8pk/,"Even if they craved fast food really bad. I can see someone thinking “ok I’ll be super careful and clean at the drive through. I’ve just gotta have those tacos!” Anyone who thinks every person has stellar self control, hasn’t seen the human race lately."
2020-02-06,Otadiz,Coronavirus,4,https://www.reddit.com/r/Coronavirus/comments/f036mg/i_am_very_worried_what_do_you_all_think_time/fgrd3tg/,"It is not unreasonable to be worried or concerned.  That is a normal, biological, evolutionary response.

Let NO ONE tell you other wise."
2020-02-06,Tkx421,Coronavirus,4,https://www.reddit.com/r/Coronavirus/comments/f03oxj/41_new_cases_of_coronavirus_on_quarantined_cruise/fgre1u9/,it's gonna end up being turned into a quarantine island.
2020-02-06,DanIsSwell,Coronavirus,4,https://www.reddit.com/r/Coronavirus/comments/f02hqf/41_new_corona_virus_cases_on_board_yokohama/fgrbvnq/,I wonder how many of the infected are staff members.
2020-02-06,willmaster123,Coronavirus,4,https://www.reddit.com/r/Coronavirus/comments/ezzffk/7000_people_on_those_quarantined_cruise_ships/fgrf80b/,"The makeshift hospitals are for coronavirus patients only. Not testing. 

The big issue isn't coronavirus spreading in them, the people in them already have it. Its bacterial infections."
2020-02-06,Ar0ndight,Coronavirus,4,https://www.reddit.com/r/Coronavirus/comments/f03b4w/if_we_make_it_to_march_5th_we_not_china_should_be/fgrdyrq/,"Not quite reset the clock because any advance made in managing the virus will still be there so we might deal with a new epicenter more efficiently but yes, basically that's about right.

From what I've read about infections it's all about the first days. If the threat is confirmed to be very infectious (like this nCoV is) then containing it is basically all about making sure it doesn't spread outside the epicenter or that if it does contacts are easily trackable. For nCoV we got the exact opposite: the first days were nothing but denial and information suppression from China, the virus spread outside the epicenter very fast with no hope of tracking contacts and, cherry on the deadly cake its inherently very infectuous with a high R-0, asymptomatic transmission and the usual coronavirus stuff like the ability to live on surfaces for days.

I'll add that imo, and that's pure speculation, the reason the WHO seems to give 0 fucks about actually making sure we contain this thing is because they know it's too late, so might as well keep China happy by not advising travel bans left and right."
2020-02-06,thetelltalehart,Coronavirus,4,https://www.reddit.com/r/Coronavirus/comments/ezyrgx/government_not_being_transparent_with_case/fgqog4n/,"I mean, did I have to add /s? Maybe I should have miss spelled more."
2020-02-06,Headwest127,Coronavirus,4,https://www.reddit.com/r/Coronavirus/comments/ezzffk/7000_people_on_those_quarantined_cruise_ships/fgqm5nk/,"The US Treasury studied money in the US. If you never want to touch cash again, read that study. Everything from poop to cocaine."
2020-02-06,MagicPantsMachine,Coronavirus,4,https://www.reddit.com/r/Coronavirus/comments/ezzldu/possible_case_in_pennsylvania/fgqm4b6/,"There are already [quarantined](https://www.wgal.com/article/susquehanna-valley-woman-quarantined-because-of-coronavirus-elizabeth-heckman/30792986) people in Pennsylvania. In specific, that one is in Berks County. If there's another, over in the Alleghenies near Pittsburgh, then both halves of the state have suspected cases. Altoona/Johnstown/Happy Valley don't have anything yet from what I see.  
Stay safe, OP. I love my Keystone State."
2020-02-06,anon7935678,Coronavirus,4,https://www.reddit.com/r/Coronavirus/comments/f00hra/trouble_in_the_male_shift_hospital/fgqpe0b/,Then they should move to a female shift hospital.
2020-02-06,SpartanMonkChaos,Coronavirus,4,https://www.reddit.com/r/Coronavirus/comments/f04hm5/httpsnationalpostcomnewsworldhowtoavoidcoronavirus/fgrgq9g/,These people are either stupid or complicit. Masks are a viable precautionary measure. A respirator is even better.
2020-02-06,mgarciaj707,Coronavirus,4,https://www.reddit.com/r/Coronavirus/comments/f04llg/are_china_just_counting_pneumonia_cases_of/fgrh678/,"I heard somewhere that the test kits only work on patients that have symptoms, pretty bad considering the virus can spread without symptoms."
2020-02-06,mu5tardtiger,Coronavirus,4,https://www.reddit.com/r/Coronavirus/comments/f04jpr/i_hope_this_helps_everyone/fgrhr0n/,"you need to understand that its irrelevant. everyone has built up their own immunity combined with vaccinations for the common flu(me personaly, i have over 2 decades of building up an immunity to the common flu). it has a mortality rate of 0.01%.   you are more likely to be hit by a car driving to go get medicine from the store.

&#x200B;

ask the poeple in wuhan whats more of a threat, traffic of the corona virus."
2020-02-06,0en0m2,Coronavirus,4,https://www.reddit.com/r/Coronavirus/comments/f04qjv/wuhan_nurses_stop_to_eat_lunch_talk_about_their/fgrimpi/,People here seem to have a hard time thinking of Chinese people as actual people
2020-02-06,nz-guy101,Coronavirus,4,https://www.reddit.com/r/Coronavirus/comments/f04hvh/third_cruise_ship_under_quarantine_due_to/fgrkr1w/,"My grandparents are currently on the Sun Princess which is in the middle of the Indian Ocean at the moment. I sent them a message asking if they have been effected by the nCov, however they haven't replied yet."
