date,author,subreddit,score,url,text
2020-03-28,freshlymint,Coronavirus,1,https://www.reddit.com/r/Coronavirus/comments/fpxjgq/us_covid_cases_grew_98_in_32_days_and_tripled_in/flqrbii/,"I just ask because according to this, [https://www.heart.org/idc/groups/heart-public/@wcm/@sop/@smd/documents/downloadable/ucm\_319587.pdf](https://www.heart.org/idc/groups/heart-public/@wcm/@sop/@smd/documents/downloadable/ucm_319587.pdf), 80% of people over 75 have hypertension. So wondering if it's false fallacy. I have high blood pressure from anxiety but it's normal most of the time...although tying this makes me anxious  :O LOL JK stay safe!"
2020-03-28,saxonturner,Coronavirus,1,https://www.reddit.com/r/Coronavirus/comments/fqiyuy/portuguese_government_has_decreed_that_all_asylum/flqrc37/,Or they carry the Virus though the countries they try and travel through.
2020-03-28,Mtbsrfun,Coronavirus,1,https://www.reddit.com/r/Coronavirus/comments/fqixw2/coronavirus_kills_man_61_and_daughter_33_in_space/flqri4s/,"And soon it won’t be.


Natural selection.

👨‍🦼👨‍🦼👨‍🦼👨‍🦼👨‍🦼"
2020-03-28,Italy_Update,Coronavirus,1,https://www.reddit.com/r/Coronavirus/comments/fq74nx/rcoronavirus_is_looking_for_new_moderators/flqri6d/,"I can. I've been censored for posting famous italian newspapers articles about masks shortages. Now 51 doctors died and thousands healtcare personnel is infected. I provided links and translations, no personal opinions. When I tried asking for an explanation I received a ridicolous answer. I'm not sure if I'm allowed to post it here."
2020-03-28,FragrantTurnover,Coronavirus,1,https://www.reddit.com/r/Coronavirus/comments/fq5u0a/coronavirus_how_do_3_million_newly_unemployed/flqrmvl/,Depends on which plan you choose....
2020-03-28,Own_Nature,Coronavirus,1,https://www.reddit.com/r/Coronavirus/comments/fqkbrn/federal_ppe_supplies_for_oklahoma_come_in_short/flqrn14/,You can't fix stupid.
2020-03-28,indianola,Coronavirus,1,https://www.reddit.com/r/Coronavirus/comments/fqkklr/south_korea_routinely_massdisinfects_its_urban/flqrn1v/,"I believe our street-cleaning program is actually on hold right now, which is ironic."
2020-03-28,TachyonTaj,Coronavirus,1,https://www.reddit.com/r/Coronavirus/comments/fqka8u/we_now_know_who_societys_essential_workers_are/flqrn4a/,There are other companies working on the same tech making it cheaper and available to small/medium businesses as well
2020-03-28,justhrowmeawaydamnit,Coronavirus,1,https://www.reddit.com/r/Coronavirus/comments/fqk9x1/what_happens_when_extreme_heat_collides_with_a/flqrt2i/,"Hopefully the heat can kill the virus or slow it, it’s been rumored that it hates the heat. Don’t know if it’s true or not, fuck if I know..."
2020-03-28,Greed_is_Evil,Coronavirus,1,https://www.reddit.com/r/Coronavirus/comments/fqgbjc/german_luftwaffe_a310_medevac_taking_several/flqrsyg/,"Vielen Dank für die Erklärung. 

I think that means much thanks for the explanation."
2020-03-28,Micr0drop,Coronavirus,1,https://www.reddit.com/r/Coronavirus/comments/fqkbcz/doctor_arrested_after_being_accused_of/flqrsz2/,How in the fuck does someone in a doctors position even consider this... Revoke his license. He obviously doesn’t care about other people.
2020-03-28,Forest-G-Nome,Coronavirus,1,https://www.reddit.com/r/Coronavirus/comments/fqj7lw/data_shows_amazon_raised_prices_during_pandemic/flqrszk/,"It's because, contrary to /u/lacitcaT's lying ass, you can't actually report illegal activity on Amazon any longer.  They removed your ability to.

You actually have to *get scammed* before you can report a scammer/gouger/etc.  There is literally no longer a mechanism for 3rd parties to simply report such behavior when found."
2020-03-28,BilllisCool,Coronavirus,1,https://www.reddit.com/r/Coronavirus/comments/fqagv0/college_students_aged_1824_who_have_been_claimed/flqrx1v/,"Yep, but you still need to keep everyone home no matter what, which means a lot of people would still lose their jobs."
2020-03-28,EvaUnit01,Coronavirus,1,https://www.reddit.com/r/Coronavirus/comments/fqco07/brazilian_hospital_started_using/flqrxjy/,"He already blew it, people (including doctors) have been hoarding it since he mentioned it in a presser on Monday."
2020-03-28,[deleted],Coronavirus,1,https://www.reddit.com/r/Coronavirus/comments/fqi348/new_york_ag_launches_hotline_to_report/flqs2r0/,[removed]
2020-03-28,Retroflect,Coronavirus,1,https://www.reddit.com/r/Coronavirus/comments/fqj7lw/data_shows_amazon_raised_prices_during_pandemic/flqs69k/,It’s their own histogram data
2020-03-28,HuaweiCEO,Coronavirus,1,https://www.reddit.com/r/Coronavirus/comments/fm7yu4/not_practicing_social_distancing_you_could_be/flqsbv5/,"She whipped my ass, I'm awful at mahjong!"
2020-03-28,SanyChiwa,Coronavirus,1,https://www.reddit.com/r/Coronavirus/comments/fqiyuy/portuguese_government_has_decreed_that_all_asylum/flqsq95/,"Such a great country! Well done Portugal, a lot of country should take this as an example"
2020-03-28,analogcommunism,Coronavirus,1,https://www.reddit.com/r/Coronavirus/comments/fqj7lw/data_shows_amazon_raised_prices_during_pandemic/flqsu2f/,nationalize amazon
2020-03-28,Stresshead2501,Coronavirus,1,https://www.reddit.com/r/Coronavirus/comments/fqkuxb/uk_reports_2510_new_cases_of_coronavirus_and_260/flqsuag/,We had over 800 here in Spain in the last 24 hrs 😢😢
2020-03-28,ILikeSchecters,Coronavirus,1,https://www.reddit.com/r/Coronavirus/comments/fqagv0/college_students_aged_1824_who_have_been_claimed/flqsuai/,"Democrats pushed this shit thru too. Fuck this whole government, especially Republicans, but still"
2020-03-28,ScribeThoth,Coronavirus,1,https://www.reddit.com/r/Coronavirus/comments/fqkrwh/times_square_cams_this_would_normally_be_packed/flqsu0n/,"NY is taking this a lot more seriously now.  

No more Cuomo endorses parades it seems."
2020-03-28,1984Summer,Coronavirus,1,https://www.reddit.com/r/Coronavirus/comments/fqcshx/sweden_refuses_to_lockdown_the_country_in_huge/flqsyzj/,"I am doing the exact opposite. Countries in early stages end up similarly to countries in later stages some time later. Unless they take action. 

Italy is worse than Hubei's official numbers, Spain will top Italy, the US will top Spain and I think Sweden will take the cake in the end. And each of those countries reacted a bit later than the other. 

It's super obvious. If you can't see it though, I will stop bothering."
2020-03-28,knieveldick,Coronavirus,1,https://www.reddit.com/r/Coronavirus/comments/fqkvgc/new_york_medical_workers_decry_abysmal_lack_of/flqsysg/,the problem is trump doesn't want this to be a federally managed crisis. he wants the states to fend for themselves so that he can blame the governors when shit goes sideways
2020-03-28,LambdaLambo,Coronavirus,1,https://www.reddit.com/r/Coronavirus/comments/fq5mdt/new_orleans_mayor_says_she_would_have_canceled/flqsywt/,People vote the leaders in
2020-03-28,GoldenDeLorean,Coronavirus,1,https://www.reddit.com/r/Coronavirus/comments/fqj7lw/data_shows_amazon_raised_prices_during_pandemic/flqsynk/,"Boom, roasted!"
2020-03-28,rhetorical_twix,Coronavirus,1,https://www.reddit.com/r/Coronavirus/comments/fqj7lw/data_shows_amazon_raised_prices_during_pandemic/flqt3av/,"That's true. I wouldn't rely on government tests being available for some time.

if I had a couple of weeks of pay on the line I'd have my doctor use whatever private lab he/she would like to use for COVID-19 testing. But I guess if you don't want to pay for a doctor then it is hard getting a diagnosis."
2020-03-28,mattjb,Coronavirus,1,https://www.reddit.com/r/Coronavirus/comments/fqhy3p/fox_business_parts_ways_with_trish_regan_host_who/flqt36m/,You're thinking of Deep Throat.
2020-03-28,Anne1167,Coronavirus,1,https://www.reddit.com/r/Coronavirus/comments/fqkk56/daily_discussion_post_march_28_questions_images/flqt36o/,"Do not take Motrin, Advil or Ibuprofen. Use Tylenol or Acetaminophen. Studies show the death rate is higher for those who took the Ibuprofen products."
2020-03-28,tomlooby,Coronavirus,1,https://www.reddit.com/r/Coronavirus/comments/fqkezn/germany_has_a_remarkably_low_coronavirus_death/flqt8mc/,I don't think I trust our infection rate per capita
2020-03-28,swiftestcat,Coronavirus,1,https://www.reddit.com/r/Coronavirus/comments/fqj7lw/data_shows_amazon_raised_prices_during_pandemic/flqt8v4/,Price gouging is necessary.
2020-03-28,resistible,Coronavirus,1,https://www.reddit.com/r/Coronavirus/comments/fqhnpu/heres_what_the_press_should_be_asking_how_will_we/flqt8mx/,"... what? You were talking about Trudeau and now you’re talking about a totally different person. Is the health minister saying there’s nothing to worry about? Assuming he’s not, that *supports* my comment and you’ve managed to confuse yourself."
2020-03-28,AutoModerator,Coronavirus,1,https://www.reddit.com/r/Coronavirus/comments/fqkpsh/france_orders_a_total_of_a_billion_masks_from/flqtc94/,"Your comment has been removed because

* **Purely political posts and comments will be removed.** Political discussions can easily come to dominate online discussions. Therefore we remove political posts and comments and lock comments on borderline posts. ([More Information](https://www.reddit.com/r/Coronavirus/wiki/rules#wiki_rule_4.3A_avoid_politics))

*I am a bot, and this action was performed automatically. Please [contact the moderators of this subreddit](/message/compose/?to=/r/Coronavirus) if you have any questions or concerns.*"
2020-03-28,Avenge_Nibelheim,Coronavirus,1,https://www.reddit.com/r/Coronavirus/comments/fqj7lw/data_shows_amazon_raised_prices_during_pandemic/flqtc31/,"Yeah that’s not how this works. Everyone gets sent home which means there are all the logistics of getting home setups online, licenses for secure connections, and allocating for all the increased inbound network traffic. Projects are reprioritized, you are also taking on duties assisting less tech savvy workers with WFH solutions and often hardware. Once you identify the problem you also have to create the solution, thoroughly validate in test, and vigorously monitor the change once it’s pushed to Prod. All of this during allergy/flu season in a growing state of fear. Amazon is based in Washington which was ground zero before NYC ramped up"
2020-03-28,WhatsItMean123,Coronavirus,1,https://www.reddit.com/r/Coronavirus/comments/fqagv0/college_students_aged_1824_who_have_been_claimed/flqth8w/,"Lol...I’ve yet to have my coffee.  Sorry😎

This policy is bullshit."
2020-03-28,problastic,Coronavirus,1,https://www.reddit.com/r/Coronavirus/comments/fqkj6q/india_needs_at_least_38_million_masks_to_fight/flqtgw0/,"You don't know how to deliver it. At least put ""/s"" at the end when the delivery is so poor."
2020-03-28,hsyfz,Coronavirus,1,https://www.reddit.com/r/Coronavirus/comments/fqkvgc/new_york_medical_workers_decry_abysmal_lack_of/flqth1o/,Reminiscent of the infamous (in China) “可防可控” back in January.
2020-03-28,Strifeguy89,Coronavirus,1,https://www.reddit.com/r/Coronavirus/comments/fqj7lw/data_shows_amazon_raised_prices_during_pandemic/flqth2o/,"Our local Walmart is raising prices on products, some 50% higher."
2020-03-28,-poop-in-the-soup-,Coronavirus,1,https://www.reddit.com/r/Coronavirus/comments/fq15o7/nyc_nurse_on_coronavirus_front_lines_dies_from/flqtlwh/,"I’m saying that your situation is very bad, that it should never have gotten that bad, that we shouldn’t just accept that “some healthcare workers will die oh well”. 

Instead of just insulting me, could you very specifically quote me the part that offended you in the first place? Because from what I can read, you seem mad at me for being happy I’m not in the US?"
2020-03-28,ZakuTwo,Coronavirus,1,https://www.reddit.com/r/Coronavirus/comments/fqiyuy/portuguese_government_has_decreed_that_all_asylum/flqtlwt/,Most illegals in the US enter legally on visas and overstay.
2020-03-28,2wheels2lives,Coronavirus,1,https://www.reddit.com/r/Coronavirus/comments/fqka5z/coronavirus_live_counter_in_india_by_city_and/flqtls4/,"India went into complete lockdown when the country had about 500 total confirmed cases. AFAIK, very few countries have done that. Shutting down the whole country is not the same as turning off your phone. Time for you to rethink who the idiot really is."
2020-03-28,cariusQ,Coronavirus,1,https://www.reddit.com/r/Coronavirus/comments/fqiyuy/portuguese_government_has_decreed_that_all_asylum/flqtlyu/,Make sense. COVID19 doesn’t care your legal status.  Ignoring them just create a population with COVID19 that’s easily transmissible to other people.
2020-03-28,MoviesInFrench,Coronavirus,1,https://www.reddit.com/r/Coronavirus/comments/fpmj9c/more_than_150_boston_hospital_workers_test/flqtrkk/,"It does, I would tell you but they would not be relevant anymore by the time you read this."
2020-03-28,LazyHussar,Coronavirus,1,https://www.reddit.com/r/Coronavirus/comments/fqcshx/sweden_refuses_to_lockdown_the_country_in_huge/flqtva2/,">This is why medical experts should not be in charge solely,

And they’re not in charge of anything but healthcare.

>they think they know better than everyone else in all areas.

They *do* know more than you, you yokel. You seem to confuse your right to vote with some actual qualification or knowledge."
2020-03-28,NShelson,Coronavirus,1,https://www.reddit.com/r/Coronavirus/comments/fql2vp/kenya_police_under_fire_over_excessive_force_as/flqtvkr/,That doesn’t look like social distancing.
2020-03-28,Pioustarcraft,Coronavirus,1,https://www.reddit.com/r/Coronavirus/comments/fql45i/935_positive_cases_of_covid19_reported_in/flqtvij/,"Wow 13000 test done ? That's more than Belgium did in a week. That's like 1/4th of all the test done in Belgium since the beginning of the epidemy...  
I love to piss on the american government for being inefficiant and terrible under Trump but that is still a good job in testing..."
2020-03-28,LilHaunt,Coronavirus,1,https://www.reddit.com/r/Coronavirus/comments/fq9wfw/instacart_workers_are_going_on_a_massive_strike/flqtvfs/,"Wait, so you're telling me that rather than doing their job and looking for the product, they are totally justified replacing it with something else totally unrelated?  Sorry, don't take the job if you're not willing to actually do it and finish it, especially when it's someone that could be immunocompromised or disabled paying you to do it.  I would have refunded and not tipped at all."
2020-03-28,thewebdev,Coronavirus,1,https://www.reddit.com/r/Coronavirus/comments/fqk96q/icmr_study_suggests_icmr_covid19_testing_strategy/flqu0lv/,"Yes, you can as they have a team of experienced and professional editors and journalists."
2020-03-28,Mrsjoeblack,Coronavirus,1,https://www.reddit.com/r/Coronavirus/comments/fq3gju/woman_who_purposefully_coughed_on_35k_worth_of/flqu0th/,Good. That’s a lot of food.
2020-03-28,RemmyGamez,Coronavirus,1,https://www.reddit.com/r/Coronavirus/comments/fqkcxa/netherlands_coronavirus_deaths_rise_93_to_639/flqu6a3/,Ok.. Why else are they doing it? https://www.forbes.com/sites/joshuacohen/2020/03/27/caught-between-herd-immunity-and-national-lockdown-holland-hit-hard-by-covid-19/
2020-03-28,skitch23,Coronavirus,1,https://www.reddit.com/r/Coronavirus/comments/fqkeb0/in_mexico_there_are_already_70_deaths_reported_as/flqu6a4/,"Do you have a source for 45k urns being delivered?

Not saying I don’t believe you, just that it is a very high number."
2020-03-28,AdmirableRegular,Coronavirus,1,https://www.reddit.com/r/Coronavirus/comments/fqixw2/coronavirus_kills_man_61_and_daughter_33_in_space/flqu6aj/,So if Im unlucky I have about 1 day left to say goodbye to everyone? Would I be spending that last day hooked up to a fucking machine or would I still have enough strength to say goodbye to those I love? I hate thinking about shit like this but I can’t help but want to plan if it came down to this. Im fucking scared. My heart goes out to everyone.
2020-03-28,ODonThis,Coronavirus,1,https://www.reddit.com/r/Coronavirus/comments/fqbwph/air_pollution_sharply_falls_worldwide_on_covid19/flqub8d/,I think its more linked to lower testosterone levels
2020-03-28,markolan,Coronavirus,1,https://www.reddit.com/r/Coronavirus/comments/fqkezn/germany_has_a_remarkably_low_coronavirus_death/flqubj2/,"Those numbers cannot be real otherwise we should reevaluate some  old ideas death in 1945.

Let alone Italy and Spain, even with France the comparison is absurd

source: https://bnonews.com/index.php/2020/03/the-latest-coronavirus-cases/

- Germany: 53.991 cases, 399 deaths (CFR 0,74%), 923 people in ICU, recovered people 12.250

- France: 32,964 cases 1,995 deaths (CFR 6.05%), 3,375 people in ICU, recovered: 4.948

Germany has 63% more cases than Spain but a CFR almost 10 times lower and 2500 less people in ICU.. I want to repeat it:

53.991 cases -> 399 deaths and 923 people in ICU

vs

32,964 cases -> 1,995 deaths -> 3,375 in ICU

And as I wrote I dont even take Italy and Spain otherwise their data compared the other big 3 EEUU countries would be totally absurd. There are 3 explanations imho:

- Luck

- Data not real

- Their race is above the other european ones, stronger and better (in term of health and immunitary system ofc)..

And dont talk me about hospital please, healthcare system bla bla bla, I'M FECKING TALKING ABOUT 53000 FUCKIN INFECTED PEOPLE AND ONLY 900 NEED AN HOSPITAL BECAUSE ALL THE OTHER PPL ONLY HAVE MILD SYMPTOMS, dont talk me about mass testing please, it has little to do with deaths and people in critical condition.."
2020-03-28,fearsword357,Coronavirus,1,https://www.reddit.com/r/Coronavirus/comments/fqdhsg/r_kelly_seeks_release_from_jail_cites_covid19_risk/flqubk4/,All the kids are outta school so he gotta get on the prowl
2020-03-28,idelics,Coronavirus,1,https://www.reddit.com/r/Coronavirus/comments/fqkk56/daily_discussion_post_march_28_questions_images/flqubkt/,"Hi everyone, from things you've seen around the internet, what good things have come from the virus? Speaking more in an environmental sense, e.g the  decreasing pollution in China due to lockdown etc? If anyone has links/articles/sources this would be amazing... while the virus has been a huge negative, I want to find ways that our forced change of routines has positively impacted in some ways"
2020-03-28,iuthnj34,Coronavirus,1,https://www.reddit.com/r/Coronavirus/comments/fql90q/new_study_by_pr_raoult_using_hydroxycholoroquine/flqubmi/,This doctor looks like [Trump's personal doctor](https://www.businessinsider.com/trump-doctor-health-letter-who-wrote-it-2018-5) after 4 years.
2020-03-28,HoldMyBeerAgain,Coronavirus,1,https://www.reddit.com/r/Coronavirus/comments/fqknvt/germany_will_not_ease_shutdown_until_at_least/flqubmw/,"Yes it's annoying as a person who has kept up/knows what is coming/understands two weeks will turn into two more will turn into two more and ""we won't pull you over driving and ask to see your papers"" until they are etc.

I get why they're doing it and I don't disagree but I do wish there was ability to have more transparency of ""y'all we're screwed unless we lockdown 24/7 so that's what we're doing now""
So maybe I'm less annoyed at the government and more at the people they have to do it for lol"
2020-03-28,elephants22,Coronavirus,1,https://www.reddit.com/r/Coronavirus/comments/fqjcn1/mayor_new_haven_asks_for_coronavirus_housing_help/flqubnc/,They provide a service for an exorbitant and unnecessary cost.
2020-03-28,SwimmingBuddy4,Coronavirus,1,https://www.reddit.com/r/Coronavirus/comments/fqj7lw/data_shows_amazon_raised_prices_during_pandemic/flquhno/,My cvs was running low but if you asked the staff they had a large box full of them behind a counter. Apparently people had been stealing them off the shelves.
2020-03-28,YukkiHamaya,Coronavirus,1,https://www.reddit.com/r/Coronavirus/comments/fqkpv2/uk_pm_johnsons_war_with_coronavirus_is_no_joke/flquhoq/,So it was a joke before he got it?
2020-03-28,thechervil,Coronavirus,1,https://www.reddit.com/r/Coronavirus/comments/fql4fx/hobby_lobby_states_that_god_is_in_control_and/flquh7h/,"I know for a fact that they like most other businesses, they have shut down in areas with a shelter in place or stay at home order.  


There is one 15 minutes away that is still open, but the next town over shut down a few days ago because their county is under that order.  


Let's be honest, most businesses are staying open until they are forced to close and not even using ""faith"" as an excuse."
2020-03-28,Extras,Coronavirus,1,https://www.reddit.com/r/Coronavirus/comments/fqkk56/daily_discussion_post_march_28_questions_images/flqulvg/,What apps? I don't know if any are operating in our area
2020-03-28,JayBrock,Coronavirus,1,https://www.reddit.com/r/Coronavirus/comments/fqku6m/hey_reddit_were_running_a_gofundme_to_award_1/flqum54/,Just added!
2020-03-28,daedone,Coronavirus,1,https://www.reddit.com/r/Coronavirus/comments/fqbhqx/gamestop_to_employees_wrap_your_hands_in_plastic/flqum5j/,"I know, I was just making a Florida Man joke .. Tho it will probably be a valid newspaper headline"
2020-03-28,RedditUser9212,Coronavirus,1,https://www.reddit.com/r/Coronavirus/comments/fqixw2/coronavirus_kills_man_61_and_daughter_33_in_space/flqulx4/,"Yeah I guessssssss 

This is the kind of home-brewed advice that no epidemiologist worth their salt would ever say.  Eating out isn't make you any more prone, aside from the actual EXPOSURE risk of eating out.  But whatever."
2020-03-28,fractalfrog,Coronavirus,1,https://www.reddit.com/r/Coronavirus/comments/fqiyuy/portuguese_government_has_decreed_that_all_asylum/flqum4a/,"Your post or comment has been removed because

* **Purely political posts and comments will be removed.** Political discussions can easily come to dominate online discussions. Therefore we remove political posts and comments and lock comments on borderline posts. ([More Information](https://www.reddit.com/r/Coronavirus/wiki/rules#wiki_rule_4.3A_avoid_politics))"
2020-03-28,Morning-Coffee-fix,Coronavirus,1,https://www.reddit.com/r/Coronavirus/comments/fqkjov/two_more_people_die_from_covid19_in_bulgaria/flquqbn/,"We live in a very rural location and haven't seen anyone or even heard a car for 2 weeks, but yesterday we went to our nearest town to stock up on some supplies; and although the town was quiet I was surprised by the amount of people around and there were a few (non-essential) shops open.

It was nice to see more people wearing masks and gloves though compared to last time I was there.

We don't plan on returning for another 2 or 3  weeks."
2020-03-28,hotcoupleeee,Coronavirus,1,https://www.reddit.com/r/Coronavirus/comments/fqladg/coronavirus_why_are_the_death_rates_different/flquqpy/,Yep true
2020-03-28,gatechthrowaway1873,Coronavirus,1,https://www.reddit.com/r/Coronavirus/comments/fqld8b/more_americans_should_probably_wear_masks_for/flquqj1/,"Everybody should, the problem is there are no masks to wear."
2020-03-28,AutoModerator,Coronavirus,1,https://www.reddit.com/r/Coronavirus/comments/fqlhbr/dothefive_coronavirus_covid19_mindfulness/flquw1p/,"facebook.com may not be reliable or may be dedicated mostly to political coverage, your post has been automatically removed. If possible, please re-submit with a link to a reliable or non-political source, such as a reliable news organization or an recognized institution.

Thank you for helping us keep information in /r/Coronavirus reliable!


*I am a bot, and this action was performed automatically. Please [contact the moderators of this subreddit](/message/compose/?to=/r/Coronavirus) if you have any questions or concerns.*"
2020-03-28,hutre,Coronavirus,1,https://www.reddit.com/r/Coronavirus/comments/fqj7lw/data_shows_amazon_raised_prices_during_pandemic/flquw2l/,"I'm getting a 403 error, is it because I'm from EU?"
2020-03-28,csincavage,Coronavirus,1,https://www.reddit.com/r/Coronavirus/comments/fqkklr/south_korea_routinely_massdisinfects_its_urban/flquvxl/,“All natural ingredients” :)
2020-03-28,moleratical,Coronavirus,1,https://www.reddit.com/r/Coronavirus/comments/fqkk56/daily_discussion_post_march_28_questions_images/flqv1ds/,"About 30% of the country will love Trump no matter what.

I'd say about 40% of the country are just unaware. They know the schools are shut down and that testing has increased and that we are all under quarantine to fight this virus. 

There is no awareness that local and state governments are who closed the schools, that Trump is suggesting that the quarantine be lifted, there's no awareness that testing is still woefully inadequate and that Trump has repeatedly lied about testing availability. 

They know Trump is giving press conferences everyday but are unaware that these are filled with misinformation.

To a lot of people who don't pay close attention they no that Trump is the head of the government and they are generally aware that the government is doing something ergo, in their mind, it must be Trump. There is no understanding of the details or mechanisms of how things are actually accomplished."
2020-03-28,glyphotes,Coronavirus,1,https://www.reddit.com/r/Coronavirus/comments/fqcgvp/er_doctor_who_criticized_bellingham_hospitals/flqv12u/,">I never realised how bad it is until now.

...really? REALLY?!

Are-you-fucking-kidding-me?"
2020-03-28,AsherGlass,Coronavirus,1,https://www.reddit.com/r/Coronavirus/comments/fpnybt/new_jersey_man_coughs_on_wegmans_employee_gets/flqv1iy/,"You shouldn't be licking toilets even without a deadly, highly contagious virus spreading. These people have no sense in their heads whatsoever."
